,2021-12-31,马笑传媒互联科技团队：2021年报告汇总,微信
0,2021-12-31,三七互娱、世纪华通、吉比特……谁将会是成长能力最强的游戏企业？,Ofweek
1,2021-12-31,三七互娱荣获2021上海证券报“金质量”评选两项大奖,上证报
2,2021-12-31,三七互娱12月30日现25笔大宗交易,证券时报网
3,2021-12-30,传媒互联网1月投资策略：继续关注元宇宙主题表现,新浪
4,2021-12-30,元宇宙概念持续火热，这些公司值得关注,凤凰网
5,2021-12-30,守正创新助推高质量可持续发展，三七互娱荣获“2021最具社会责任上市公司奖”,每经网
6,2021-12-30,三七互娱现25笔大宗交易 合计成交694.34万股,证券时报网
7,2021-12-30,"三七互娱现25笔大宗交易 共成交16,782.02万元",新浪
8,2021-12-30,三七互娱今日大宗交易成交69.34万股，成交价25.88元折价1.48%,Wind
9,2021-12-30,电竞指数近3个月大涨20% 为何相关公司业绩和走势两极分化,投资者网
10,2021-12-29,"三七互娱现5笔大宗交易 共成交3,000.40万元",新浪
11,2021-12-28,互联网传媒行业周报：监管趋严有望促进行业健康发展,新浪
12,2021-12-28,三七互娱李逸飞：用情用力讲好中国故事，用心践行社会责任担当,投资时报
13,2021-12-27,【国元传媒】游戏行业月报：21年手游市场同比增7.6%，腾讯加码开放世界赛道布局,典评文娱
14,2021-12-24,游戏厂商混战斗罗大陆，月流水最高者破7亿,投资界
15,2021-12-24,"三七互娱现4笔大宗交易 共成交4,999.95万元",新浪
16,2021-12-24,三七互娱今日大宗交易成交203.25万股，成交价24.6元折价4.06%,Wind
17,2021-12-24,国金证券：港股互联网长期配置价值凸显 建议关注美团(03690)、腾讯(00700)等,智通财经
18,2021-12-24,自研大作初露锋芒 三大战略推进提速,发布易
19,2021-12-23,中泰证券：关注虚拟人商业化投资趋势,财联社
20,2021-12-22,游戏公司卷起来了？除了完美世界，这些公司也为员工买房无息借款,新京报
21,2021-12-21,互联网传媒行业周报：游戏产业年会召开 短视频内容审核细则发布,新浪
22,2021-12-21,三七互娱现6笔大宗交易 合计成交125.91万股,证券时报网
23,2021-12-21,"三七互娱现6笔大宗交易 共成交2,898.52万元",新浪
24,2021-12-21,三七互娱今日大宗交易成交95.40万股，成交价23.43元折价5.75%,Wind
25,2021-12-21,娱美德再胜诉《热血传奇》版权不容侵犯 《传奇世界》授权无用非法 诉讼纠纷,上方网
26,2021-12-20,三七互娱荣获“2020年度金牛最具投资价值奖”等三项大奖,和讯
27,2021-12-20,2020年度金牛企业领袖奖,中证网
28,2021-12-19,【国君互联网传媒】2021年49期：游戏市场高基数下仍增长，耐克收购虚拟潮牌RTFKT,国泰君安互联网传媒研究
29,2021-12-19,传媒行业：《幻塔》首日流水破5000万 爱奇艺宣布会员提价,广发证券
30,2021-12-18,深度！2021年中国移动游戏行业竞争格局及市场份额分析 腾讯、网易游戏竞争力较强,前瞻研究院
31,2021-12-17,三七互娱：公司正进一步构建全产业链文娱生态布局，推动产业价值与文化价值的互相赋能,每日经济新闻
32,2021-12-17,二三四五：与华为和小米主要在互联网信息服务业务方面有合作，与三七互娱主要是游戏业务联运合作,每日经济新闻
33,2021-12-16,《2020-2021年中国移动游戏数字营销研究报告》发布,中证网
34,2021-12-16,三七互娱12月16日大宗交易成交2004.45万元,证券时报网
35,2021-12-16,游戏产业年会隆重举行 三七互娱受邀分享企业合规、创新历程,中国网
36,2021-12-16,三七互娱今日大宗交易成交83万股，成交价24.15元折价4.81%,Wind
37,2021-12-16,游戏出海业绩亮眼，市场空间广阔,Wind
38,2021-12-16,游戏出海业绩亮眼 市场空间广阔,新浪
39,2021-12-15,中国游戏产业年会“游戏出海与传播”论坛圆满落幕，行业大咖共论文化出海,证券时报网
40,2021-12-15,让“歪果仁”玩到中国游戏，有哪些重要意义？,ZAKER
41,2021-12-15,传媒互联网行业周报：虚拟人概念空前火热 仍看好后续影视复苏,新浪
42,2021-12-15,传媒互联网数据月报：手游产品表现稳健 贺岁档储备丰富,新浪
43,2021-12-13,2021年12月13日大宗交易机构专用买入席位报告,搜狐
44,2021-12-13,三七互娱现8笔大宗交易 合计成交677.00万股,证券时报网
45,2021-12-13,"三七互娱现8笔大宗交易 共成交16,478.18万元",新浪
46,2021-12-13,三七互娱今日大宗交易成交677万股，成交价24.34元折价5.66%,Wind
47,2021-12-13,WIM2021丨三七互娱集团产品副总裁殷天明：解码游戏出海破局之道,亿欧网
48,2021-12-13,南财研选丨“元宇宙”概念领涨，游戏产业年会将开始，游戏板块会否迎新一轮业绩释放周期,21世纪经济报道
49,2021-12-12,传媒行业周报：快手测试海外直播电商 META虚拟世界《HORIZONWORLD》开放,新浪
50,2021-12-12,IPO项目业绩频变脸国元证券被质疑，业内争议“看门人”边界 盈利能力下降,Wind
51,2021-12-09,2021年红杉资本调研114家上市公司，元宇宙概念崛起歌尔一路飙升,金融界
52,2021-12-09,用功能“重视”游戏！三七互娱发挥技术优势，践行社会责任,奥一网
53,2021-12-09,"三七互娱现6笔大宗交易 共成交5,003.94万元",新浪
54,2021-12-09,三七互娱今日大宗交易成交205.50万股，成交价24.35元折价2.44%,Wind
55,2021-12-09,一上市业绩就下滑，股价最多跌去六成！这家投行保荐的新股怎么频频出问题？,Wind
56,2021-12-09,连锁咖啡品牌NOWWA挪瓦咖啡连续完成2亿元B轮与B+轮融资,Wind
57,2021-12-09,保优还是荐劣？国元证券IPO项目频频“卸妆”,Wind
58,2021-12-08,三七互娱现1笔大宗交易 共成交993.17万元,新浪
59,2021-12-08,三七互娱今日大宗交易成交45.60万股，成交价21.78元折价13.23%,Wind
60,2021-12-08,记者观察|为何说发展电竞与防沉迷并不矛盾？,中新经纬
61,2021-12-08,三七互娱荣膺“上市公司投关价值经纶奖”两项大奖,经济观察网
62,2021-12-08,元宇宙概念卷土重来，中文在线一度涨停，当虹科技等大涨,证券时报网
63,2021-12-08,传媒互联网行业2022年度策略报告：科技驱动加速文化出海 四大优质赛道扬帆起航,新浪
64,2021-12-07,元宇宙框架梳理,新浪
65,2021-12-07,传媒互联网12月投资策略：元宇宙催化行情表现 持续关注游戏板块,新浪
66,2021-12-07,行业深度！2021年中国游戏行业竞争格局及市场份额分析 腾讯与网易占据绝对优势,前瞻研究院
67,2021-12-07,附音频|2022年传媒新消费策略|新秩序 新增量 再进化,拾珠传媒新消费
68,2021-12-07,传媒行业：滴滴拟美股退市回港上市 微信群聊将试行电商外链直接访问 退市,广发证券
69,2021-12-06,2022年传媒投资策略|明年游戏行业去往何方？游戏出海、精品化和元宇宙,财联社
70,2021-12-06,快手升级电商分销平台 字节跳动火山引擎上线全系云产品,中泰证券
71,2021-12-06,传媒行业周报：国内软实力出海 板块未来可期,新浪
72,2021-12-06,传媒行业月报：行业PPT报告元宇宙相关投资并购热度持续 积极关注行业拐点,国海证券
73,2021-12-06,传媒行业周报：网易丁磊宣布进军元宇宙 关注虚拟人投资机会,新浪
74,2021-12-06,电竞“出圈”又“出海”：有企业海外收入占比超1/4,广州日报
75,2021-12-05,传媒行业周报：中重度游戏投放上扬 贺岁档反贪风暴5备受期待,新浪
76,2021-12-03,调整到位了？一年跌近30%，这些超跌板块正在被新基金疯抢,每日经济新闻
77,2021-12-02,爆款三消SLG被抄袭 三七互娱开启全面维权行动,中国网
78,2021-11-30,三七互娱：公司不断完善VR/AR领域的整体布局,每日经济新闻
79,2021-11-30,三七互娱：《斗罗大陆：魂师对决》的运营和流水情况良好，处于正常生命周期,每日经济新闻
80,2021-11-30,广州电竞：“出圈”又“出海”,广州日报
81,2021-11-30,每周一报：积极拥抱新兴技术 行业机遇不断涌现,新浪
82,2021-11-29,中青宝：市值狂飙如空中楼阁,证券市场周刊
83,2021-11-29,中国游戏厂商十年：靠下沉市场与模式创新崛起，低投入高收益已不再,新浪
84,2021-11-29,传媒行业周报：坚守游戏板块 关注监管常态化下的互联网新机遇,新浪
85,2021-11-29,传媒行业：周报,新浪
86,2021-11-29,传媒互联网行业：互联网广告管理办法公开征求意见 青瓷游戏通过港交所聆讯,新浪
87,2021-11-29,传媒互联网周报：《长津湖》成中国影史票房冠军 互联网广告管理办法发布,新浪
88,2021-11-28,三七互娱杨军：传统文化与游戏双向赋能，中国风游戏火到海外,奥一网
89,2021-11-28,传媒行业周报：《互联网广告管理办法》公开征求意见；网易云音乐即将在港上市,广发证券
90,2021-11-27,互联网传媒行业周报：监管强化APP用户信息保护 国产游戏再获TGA提名,新浪
91,2021-11-26,三七互娱：公司已投资了优质的VR内容研发商Archiact布局内容生态等,每日经济新闻
92,2021-11-26,传播文化业行业：2021双十一再创佳绩 英伟达助力元宇宙基建,新浪
93,2021-11-25,三七互娱集团高级副总裁杨军：用数字化形式活化中国传统文化,DoNews
94,2021-11-25,三七互娱举办游戏行业社会责任论坛 共话行业社会责任与担当,中国网
95,2021-11-24,共话社会责任与担当 网络游戏健康发展与社会责任论坛成功举办！,北国网
96,2021-11-24,游戏行业数据周报：中国手游市场下载量、净收入均环比略有下降 盈利能力下降,新浪
97,2021-11-24,手游收入大减证券投资大增 缺乏爆款的巨人网络如何重振主业？,投资者网
98,2021-11-24,Sensor Tower：2021年Q3韩国手游市场概览（附下载）,199IT
99,2021-11-23,腾讯增速下滑，网易逆势增长，三季度游戏企业过得怎么样？,第一财经
100,2021-11-23,新时代传媒周报：《演出经纪人员管理办法》公开征求意见 元宇宙的探讨将会持续进行,新浪
101,2021-11-23,传媒10月经营跟踪：LOL手游上线表现良好,国金证券股份有限公司
102,2021-11-23,元宇宙概念回调，资金逢低加仓游戏ETF（159869）,Wind
103,2021-11-22,传媒互联网行业：数据安全新规将至 互联网安全边界设立愈加明确,新浪
104,2021-11-22,国金证券：游戏行业的估值中枢有望受益于元宇宙加速发展,Wind
105,2021-11-21,传媒行业投资策略：顺应政策 拥抱变革 重启成长,新浪
106,2021-11-21,传媒行业2022年年度策略：下一代网络技术望带动行业步入新周期,新浪
107,2021-11-21,7000亿大市场！傅鹏博、朱少醒、谢治宇、刘格菘…顶流们都来了,Wind
108,2021-11-21,7000亿大市场！傅鹏博、朱少醒、谢治宇等顶流们都来了,Wind
109,2021-11-19,SGS为三七互娱颁发ISO/IEC 27001信息安全管理体系认证证书,美通社
110,2021-11-19,三七互娱：李卫伟解除质押540万股,每日经济新闻
111,2021-11-18,游戏行业月报：元宇宙专题 从技术到应用看元宇宙的持续布局,新浪
112,2021-11-18,传媒行业周报：模拟经营类新品表现亮眼 看好A股公司扩大出海,新浪
113,2021-11-18,“数据会说话”之2021年10月数据解读：10月社零数据符合预期 看好中国消费韧性,新浪
114,2021-11-17,游戏行业ESG周报：从食堂到产品，游戏公司都是怎么做环保的？,搜狐
115,2021-11-17,【趣点】“王牌”搜狗“委身”腾讯后，搜狐的未来在哪？,财华社
116,2021-11-17,聚焦年轻市场，三七互娱参与潮流社交餐饮厂牌“Bar Flow Brand”天使轮融资,中国网
117,2021-11-17,传媒行业每周一报：行业市场表现亮眼 持续性还看基本面,新浪
118,2021-11-16,指数突破年内新高，大热元宇宙+5G加持，北向资金抢筹的云游戏概念股名单来了,证券时报网
119,2021-11-16,传媒行业投资策略周报：工信部解读“信息通信服务感知提升行动”；国内十月游戏市场持续增长,广发证券
120,2021-11-16,安徽区域股市周报：中公教育跌出板块市值6强 16家机构调研开润股份,每日经济新闻
121,2021-11-16,三七互娱投资新茶饮品牌“未来茶浪WILLCHA”，持续加码新消费领域,面包财经
122,2021-11-16,未来茶浪WILLCHA获得三七互娱Pre-A轮融资,智通财经
123,2021-11-15,【中泰传媒】Q3总结及展望：持续看好线上娱乐消费及线下场景复苏，重点关注游戏板块投资机会,传媒产业大视点
124,2021-11-15,A股午盘综述：食品板块爆发，元宇宙延续强势,Wind
125,2021-11-15,电竞、元宇宙激活游戏市场 龙头股迎拐点机遇,红周刊
126,2021-11-15,传媒互联网数据月报：10月手游回暖;国庆档及进口片推动影市环增,新浪
127,2021-11-15,互联网传媒周报：从英伟达看元宇宙+互联互通,新浪
128,2021-11-14,传媒行业周报：“元宇宙”概念宏大 关注或更快落地的受益领域,新浪
129,2021-11-13,上市公司扎堆涌入“元宇宙”，分析称仍需探索,Wind
130,2021-11-12,元宇宙概念股飙涨游戏ETF“水涨船高”，还能上车吗？,Wind
131,2021-11-12,天风问答系列第二弹：传媒互联网五问五答,新浪
132,2021-11-12,游戏行业数据周报：大陆手游市场下载量环比上扬 净收入略有回落 整体表现稳健 盈利能力下降,新浪
133,2021-11-11,三七互娱通过信息安全管理体系认证，将继续完善用户隐私安全,奥一网
134,2021-11-11,三七互娱强化信息安全体系，获 ISO/IEC 27001 认证,ZAKER
135,2021-11-11,“未成年人游戏禁令”落地两个月：游戏公司过得还好吗？,36氪
136,2021-11-11,传媒行业：从FACEBOOK和ROBLOX看元宇宙硬件和内容布局,广发证券
137,2021-11-10,元宇宙行业专题之二：NFT：初露峥嵘的区块链应用 元宇宙的重要支柱,新浪
138,2021-11-10,三七互娱：股东吴氏家族持股比例降幅达5%,e公司
139,2021-11-10,"三七互娱现1笔大宗交易 共成交1,137.61万元",新浪
140,2021-11-10,三七互娱今日大宗交易成交47.98万股，成交价23.71元折价5.2%,Wind
141,2021-11-10,南财脱水研报丨“元宇宙”概念炒热了游戏股，板块11月以来逆市大涨！,21经济网
142,2021-11-10,游戏股逆势走强 机构：元宇宙有望推动行业估值中枢上移,第一财经
143,2021-11-10,游戏行业简评：EDG夺冠有望驱动大众认知修复 元宇宙带来长期产业逻辑,新浪
144,2021-11-09,传媒互联网行业10月月报：2022年进口片边际改善 票房有望复苏,广发证券
145,2021-11-09,元宇宙概念股频收关注函，监管加码能否浇灭虚火?,Wind
146,2021-11-09,元宇宙引多空激辩！中信证券163页研报：很难给出短期投资建议,Wind
147,2021-11-09,财信证券传媒行业2021年10月数据跟踪：2021年中国游戏市场仍为正增长，关注职教政策利好,财信证券研究
148,2021-11-09,元宇宙热度蔓延，关注三条主线,Wind
149,2021-11-08,EDG夺冠刷屏，游戏股大爆发！上车机会来了？公募基金紧急解盘,中国基金报
150,2021-11-08,融资丨潮流餐饮厂牌「Bar Flow Brand」获近千万元天使轮投资，三七互娱领投,创业邦
151,2021-11-08,元宇宙概念持续活跃 机构强推这些个股,第一财经
152,2021-11-08,Bar Flow Brand宣布完成近千万人民币天使轮投资 三七互娱领投,智通财经
153,2021-11-08,三七互娱迎新拐点？,36氪
154,2021-11-08,36氪首发 | 潮流餐饮厂牌「Bar Flow Brand」获近千万人民币天使轮投资，三七互娱领投,36氪
155,2021-11-07,A股传媒板块2021年三季报综述：政策和疫情影响下整体基本面稳步改善,微信
156,2021-11-07,证券时报：国内游戏出海渐成风潮，中企游戏收入全球霸榜,Wind
157,2021-11-06,游戏公众公司市值排行榜10：A股第一易主，这家公司单月增长108%,搜狐
158,2021-11-06,开启软硬件产业新机遇，多家上市公司加码布局元宇宙,Wind
159,2021-11-06,国内游戏出海渐成风潮，中企游戏收入全球霸榜,Wind
160,2021-11-05,“A股游戏一哥”变了，三七互娱反超世纪华通！“元宇宙”疯狂下中青宝股价涨53%「文娱周评榜」,华夏时报
161,2021-11-05,"三七互娱现1笔大宗交易 共成交1,280.50万元",新浪
162,2021-11-05,三七互娱今日大宗交易成交50万股，成交价25.61元溢价0.0%,Wind
163,2021-11-05,八大券商主题策略：元宇宙的猜想！,中投网
164,2021-11-05,A股游戏公司三季报业绩盘点 世纪华通27.29亿归母净利润领跑,金融界
165,2021-11-05,超半数游戏公司前三季度净利上涨 元宇宙或成行业催化剂,中新经纬
166,2021-11-05,元宇宙热度不减，主力早间大幅抢筹、个股还能涨86%,第一财经
167,2021-11-05,中信建投：元宇宙的逻辑和投资机遇,Wind
168,2021-11-04,估值超5亿美元，三星和三七互娱参投波导厂商DigiLens D轮融资,映维网
169,2021-11-04,三七互娱(002555)：公司进入利润释放期 后续出海表现可期,新浪
170,2021-11-04,三七互娱今日大宗交易成交69万股，成交价25.22元溢价0.0%,Wind
171,2021-11-04,世纪华通成为“游戏三巨头”唯一归母净利正增长 “元宇宙”概念多管齐下,金融界
172,2021-11-04,【中泰传媒 | 三七互娱】三季报点评：爆款新品上线+海外稳定增长推动单季收入规模创历史新高,传媒产业大视点
173,2021-11-04,A股传媒三季报总结：游戏有回暖信号 梯媒体现韧性,新浪
174,2021-11-04,元宇宙概念股三季度均盈利 分析师：还在炒作阶段,搜狐
175,2021-11-03,三七互娱：工银瑞信、汇丰晋信等14家机构于11月1日调研我司,证券之星
176,2021-11-03,互联网传媒行业：元宇宙系列报告2：FACEBOOK全面拥抱元宇宙 硬件与应用机遇来临,新浪
177,2021-11-02,传媒行业：游戏拐点确认 部分子行业受到监管以及疫情等因素影响,广发证券
178,2021-11-02,三七互娱(002555)：Q3季度业绩超预期 强烈看好《斗罗大陆：魂师对决》盈利后续体现,新浪
179,2021-11-02,三七互娱(002555)：三季度业绩持续回暖 自研和海外拓展表现强劲,新浪
180,2021-11-02,三七互娱(002555.SZ)半年度每10股派1.5元 股权登记日为11月8日,智通财经
181,2021-11-02,45股今日获机构买入评级,证券时报网
182,2021-11-02,三七互娱(002555.SZ)半年度权益分派10派1.5元 股权登记日为11月8日,格隆汇
183,2021-11-02,中国银河证券给予传媒互联网行业推荐评级：21Q3传媒配置降至1.19%，重仓股持续稳定,每日经济新闻
184,2021-11-02,安信证券：维持三七互娱(002555.SZ)“买入”评级 目标价30元,智通财经
185,2021-11-02,安信证券维持三七互娱买入评级：业绩强势复苏，自研与出海能力持续验证，目标价30.0元,每日经济新闻
186,2021-11-02,"国金证券维持三七互娱买入评级：Q3业绩超预期,关注Q4斗罗和P&S利润释放",每日经济新闻
187,2021-11-02,财信证券维持三七互娱推荐评级：三季度业绩超预期，自研+出海带动业绩逐步释放,每日经济新闻
188,2021-11-02,德邦证券维持三七互娱买入评级：营销投入回收叠加新品上线助推业绩超预期，关注重点产品Q4利润释放,每日经济新闻
189,2021-11-02,A股早报2021年11月2日星期二,Wind
190,2021-11-02,三七互娱11月1日现16笔大宗交易,证券时报网
191,2021-11-02,头部游戏公司三季度业绩率先企稳,Wind
192,2021-11-01,山西证券维持三七互娱买入评级：三季度业绩靓丽，海外业务发展卓有成效,每日经济新闻
193,2021-11-01,三七互娱：吴氏家族通过大宗交易方式累计减持约2583万股 减持股份,每日经济新闻
194,2021-11-01,三七互娱：吴氏家族累计减持比例达1.16% 减持股份,Wind
195,2021-11-01,三七互娱发生16笔大宗交易 合计成交1.32亿元,证券时报网
196,2021-11-01,国盛证券维持三七互娱买入评级：买量回收+新游加持确立业绩拐点，出海能力持续验证,每日经济新闻
197,2021-11-01,"三七互娱现16笔大宗交易 共成交13,219.01万元",新浪
198,2021-11-01,5000亿巨头闪崩，万亿宁王却创新高！极致行情上演,Wind
199,2021-11-01,图解三七互娱三季报：第三季度单季净利润同比增54.77%,证券之星
200,2021-11-01,元宇宙概念股中青宝连续两日涨停，汤姆猫、昆仑万维、三七互娱、数码视讯等跟进,Wind
201,2021-11-01,华西证券：给予三七互娱增持评级,证券之星
202,2021-11-01,华西证券维持三七互娱增持评级：业绩拐点确立，新游回收超预期,每日经济新闻
203,2021-11-01,"思维独角兽 | 日本角川集团：腾讯将以超17亿人民币收购角川股份；巨人网络：第三季度归母净利润为3亿元，同比减少3.37%
盈利能力下降",中金在线
204,2021-10-31,三七互娱（002555）2021年三季报点评：新品拉动业绩强劲复苏，看好公司多元化+精品化+全球化战略,微信
205,2021-10-31,东吴证券维持三七互娱买入评级，2021年三季报点评：业绩超预期，自研与全球化布局成效显著,每日经济新闻
206,2021-10-31,三七互娱(002555)：Q3业绩超预期 单季度收入创新高,国海证券
207,2021-10-31,东吴证券：给予三七互娱买入评级,证券之星
208,2021-10-30,中信建投公布11月金股名单，共有23只股票,Wind
209,2021-10-30,三七互娱披露2021年三季报 实现营收121.11亿元,资本邦
210,2021-10-30,三七互娱营收增速创三年新低，海外业务或成新业绩增长点 盈利能力下降,奥一网
211,2021-10-30,三七互娱前三季净利同比减少23.85%　销售费用明显高于行业水平 盈利能力下降,财富动力网
212,2021-10-29,第三季度净利润8.67亿元 三七互娱精品化、多元化、全球化成果显著,上证报
213,2021-10-29,三七互娱前三季度营收超120亿元 全球化战略成效显著,中证网
214,2021-10-29,三七互娱第三季度营收45.72亿元 同比增长38.5%,证券日报网
215,2021-10-29,A股游戏公司三甲三季报：业绩普遍回暖，三七互娱营收第一,南都报
216,2021-10-29,三七互娱：第三季度净利同比增54.77% 业绩稳步释放,e公司
217,2021-10-29,2021安徽省民营企业百强名单公布 三七互娱连续3年上榜,中国网
218,2021-10-29,资本动态｜前三季度87.88%游戏概念股盈利，星辉娱乐净利下滑1037.57%亏损最多 亏损,财经网
219,2021-10-29,三七互娱(002555.SZ)前三季度归母净利润同比下降23.85%至17.21亿元 盈利能力下降,智通财经
220,2021-10-29,三七互娱(002555.SZ)第三季度归母净利升54.77%至8.67亿元 业绩实现稳步释放,格隆汇
221,2021-10-29,三七互娱Q3归母净利润超预告上限 三大战略迎提速契机,证券时报网
222,2021-10-29,三七互娱：第三季度净利润8.67亿元 同比增长54.77%,财联社
223,2021-10-29,三七互娱：第三季度净利润8.67亿元，同比增长54.77%,Wind
224,2021-10-29,三七互娱：前三季度净利润同比减少23.85% 盈利能力下降,Wind
225,2021-10-29,传媒互联网行业周报：看好传媒高安全垫龙头,新浪
226,2021-10-29,定增频现“A投A”，产业巨头身影不断,Wind
227,2021-10-27,每周一报：三季报行情渐次展开 关注超预期优质标的,新浪
228,2021-10-26,出海、社交、元宇宙在实时互动的交汇点相遇了,TechWeb
229,2021-10-25,心动公司：上市即巅峰 盈利难题凸显,证券市场周刊
230,2021-10-25,传播行业周报：“双11”预售开启 阿里转让芒果5%股权,国金证券股份有限公司
231,2021-10-25,传媒：谷歌拟下调基于订阅的应用抽成至15% 巨人拟收购淘米网络,国海证券
232,2021-10-22,传媒互联网行业周报：板块走势出现分化 看好传媒高安全垫龙头,新浪
233,2021-10-22,中国文化产业资本大会举行 三七互娱受邀分享价值投资理念,中国经济网
234,2021-10-22,并不“虚”的中国本土元宇宙：年轻世代、产业格局、基建基础、应用探索、投资机会,36氪
235,2021-10-22,银河证券每日晨报,新浪
236,2021-10-21,2018VS2021：两次游戏版号停发回顾与对比,新浪
237,2021-10-21,三七互娱：目前该游戏整体运营情况良好,每日经济新闻
238,2021-10-21,多空互撕！刘彦春、谢治宇等基金经理重仓股频登龙虎榜,Wind
239,2021-10-20,传媒行业周报：头部新游有望吸引增量 看好行业长线发展,新浪
240,2021-10-20,A股共发生181宗大宗交易成交32.71亿元（10月20日）,Wind
241,2021-10-20,游戏行业2021年数据跟踪第九期：Q3手游收入同比增长9.09% 海外市场增长亮眼,新浪
242,2021-10-20,传媒互联网行业周报：市场情绪企稳 看好游戏板块估值回归,新浪
243,2021-10-20,"三七互娱现16笔大宗交易 共成交10,972.00万元",新浪
244,2021-10-19,传媒行业游戏三季度数据点评及业绩前瞻：市场规模增长稳 出海成为新动力,新浪
