488,2021-03-15,世纪华通将获腾讯27.9亿元增持,中证报
489,2021-03-15,腾讯(00700-HK)成为世纪华通(002602-CN)第二大股东,财华社
490,2021-03-15,腾讯拟加仓世纪华通 28亿拿下5%股份,证券时报
491,2021-03-14,腾讯27.9亿元增持世纪华通5%股份，成A股游戏巨头第二大股东,经济观察网
492,2021-03-14,腾讯举牌成第二大股东：世纪华通意念涨停 机构已提前进场,新浪
493,2021-03-14,腾讯举牌成第二大股东！这家游戏公司意念涨停，股民晚上“数板”，机构已提前进场,中证报
494,2021-03-14,林芝腾讯27.9亿元受让世纪华通5%股权,上证报
495,2021-03-14,世纪华通股东王苗通套现56亿：王佶成大股东 腾讯为二股东 减持股份,雷帝触网
496,2021-03-14,越跌越买?不惧股价腰斩，腾讯豪掷28亿元增持世纪华通，成第二,财联社
497,2021-03-14,晚间重要公告2021年3月14日星期日,Wind
498,2021-03-14,腾讯斥资27.9亿元增持世纪华通，持股10%成第二大股东,澎湃新闻
499,2021-03-14,世纪华通CEO王佶成为第一大股东 腾讯完成二次举牌 控制人变化,中证网
500,2021-03-14,世纪华通CEO王佶与林芝腾讯增持世纪华通 锁定第一、第二大股东,金融界
501,2021-03-14,林芝腾讯拟受让世纪华通5%股份,北京商报
502,2021-03-14,世纪华通(002602.SZ)：CEO王佶及林芝腾讯拟分别受让5%的股份公司将无实控人,格隆汇
503,2021-03-14,公告精选：腾讯方面拟受让世纪华通5%股份；理邦仪器2020年度净利润同比增长近4倍,e公司
504,2021-03-14,聚焦游戏发展战略 世纪华通(002602.SZ)引入战略投资者“腾讯”,智通财经
505,2021-03-14,世纪华通：控股股东及一致行动人拟将5%公司股份协议转让给林芝腾讯 减持股份,Wind
506,2021-03-14,世纪华通：腾讯方面拟受让公司5%股份,e公司
507,2021-03-12,"世纪华通现2笔大宗交易 共成交8,385.30万元",新浪
508,2021-03-12,世纪华通传奇买量排名进入行业前三机构看好流量运营优势,环球老虎财经
509,2021-03-12,A股早报2021年3月12日星期五,Wind
510,2021-03-11,3月11日龙虎榜，机构青睐这10股,证券时报网
511,2021-03-11,世纪华通龙虎榜数据（3月11日）,Wind
512,2021-03-11,世纪华通今日大宗交易成交606万股，成交价6.93元折价10.0%,Wind
513,2021-03-11,世纪华通放量涨停，外资净买入超1亿元,Wind
514,2021-03-11,好利来收深交所关注函：公司控制权或变更，交易股份目前全部质押 控制人变化,搜狐
515,2021-03-11,游戏板块显著回暖，世纪华通、游族网络先后涨停,Wind
516,2021-03-11,世纪华通、游族网络涨停，网游股冲高,Wind
517,2021-03-11,世纪华通大涨7.57%，领涨互联网传媒行业,中新经纬
518,2021-03-09,"世纪华通现8笔大宗交易 共成交3,949.62万元",新浪
519,2021-03-09,上海富豪汤奇青拟入主好利来 疑似通过世纪华通重组“大赚”、投资产业众多,每日经济新闻
520,2021-03-09,好利来的准实控人汤奇青是何背景？ 疑似借世纪华通重组“大赚”,每日经济新闻
521,2021-03-09,传媒行业高频数据可视化周报第8期,新浪
522,2021-03-09,世纪华通：子公司盛趣游戏旗下游戏服务器正常运行,每日经济新闻
523,2021-03-09,互联网传媒周报：互联网估值收缩明显 把握高景气 估值不高的核心资产和中小盘标的,新浪
524,2021-03-08,传媒一周观点：超跌A股企稳 中概外部影响调整 核心都在业绩估值性价比,新浪
525,2021-03-08,传媒行业周报：多只动漫游戏ETF上市流通 关注游戏板块结构性机会,华安证券
526,2021-03-08,传媒互联网行业周报：1月广告市场梯媒持续高速增长 游戏公司新品可期,新浪
527,2021-03-06,【行业一线】低估值叠加成长确定性，布局游戏行业正当时？,财华社
528,2021-03-04,国泰游戏ETF投资价值分析：力争上“游”,新浪
529,2021-03-04,隐秘的减持之手，大宗交易异动透视股东动向,Wind
530,2021-03-04,游戏板块性价比凸显 世纪华通等头部企业值得提前布局,证券时报网
531,2021-03-02,世纪华通现2笔大宗交易总成交金额3043.61万元,证券时报网
532,2021-03-02,世纪华通(002602.SZ)：大股东邵恒解除质押647万股,格隆汇
533,2021-03-02,世纪华通(002602.SZ)：股东邵恒累计减持1.72亿股、司法拍卖2011.8万股 减持股份,格隆汇
534,2021-03-02,"世纪华通现2笔大宗交易 共成交3,043.61万元",新浪
535,2021-03-02,世纪华通今日大宗交易成交498.95万股，成交价6.1元折价8.82%,Wind
536,2021-02-28,【传媒互联网】月度观点：外部影响有望企稳，高成长板块以及后疫情修复持续关注,天风研究
537,2021-02-27,国内首批游戏ETF出炉 长期投资价值遭质疑,新浪
538,2021-02-26,世纪华通：大股东邵恒解除质押3917万股,每日经济新闻
539,2021-02-26,合作特斯拉享新能源汽车增长利好 世纪华通2020业绩可观,中金在线
540,2021-02-24,"世纪华通现10笔大宗交易 共成交3,863.84万元",新浪
541,2021-02-24,世纪华通今日大宗交易成交656万股，成交价5.89元折价8.96%,Wind
542,2021-02-23,世纪华通今日大宗交易成交200万股，成交价6.0元折价6.83%,Wind
543,2021-02-22,首批游戏ETF带动游戏板块飘红 世纪华通大涨8%,金融界
544,2021-02-22,传媒行业周报：春节档78亿收官 国内首批游戏ETF获批,新浪
545,2021-02-17,传媒行业一周观点：春节档票房如期新高 抖快继续争夺 电商物流高景气,新浪
546,2021-02-10,世纪华通展IDC蓝图，决胜5G时代,斑马消费
547,2021-02-09,世纪华通牵手腾讯打造超算中心券商：低估值叠加IDC潜力十足,云掌财经
548,2021-02-09,世纪华通：大股东邵恒解除质押2577万股,每日经济新闻
549,2021-02-09,世纪华通今日大宗交易成交1000万股，成交价5.7元折价4.68%,Wind
550,2021-02-09,新基建概念下云计算长牛趋势不变重点关注世纪华通等个股,金融界
551,2021-02-08,乘风新基建 世纪华通IDC业务长期价值凸显,中新网
552,2021-02-08,传媒行业动态报告：《原神》上架小米渠道 看游戏行业变化,新浪
553,2021-02-07,传媒行业一周观点：继续重视全市场龙头 长假将至关注文娱活动数据表现,新浪
554,2021-02-05,世纪华通(002602.SZ)遭股东邵恒减持5905.38万股 减持股份,智通财经
555,2021-02-05,世纪华通(002602.SZ)：股东邵恒持股比例降至5.55%,格隆汇
556,2021-02-04,A股共发生127宗大宗交易成交51.3亿元（2月4日）,Wind
557,2021-02-04,世纪华通今日大宗交易成交759万股，成交价5.85元折价5.95%,Wind
558,2021-02-03,风格重回习惯 选手普遍受益,财富动力网
559,2021-02-02,世纪华通：公司目前未有商誉减值风险,Wind
560,2021-02-02,解盘：大消费活跃，汽车、品牌龙头、疫苗、血液制品领涨,Wind
561,2021-02-02,A股早报2021年2月2日星期二,Wind
562,2021-02-01,世纪华通《传奇》独占权再获韩国法院支持 娱美德恶意诉讼难改败诉结局 诉讼纠纷,中金在线
563,2021-02-01,传媒行业研究周报：市场波动中继续聚焦核心龙头 快手港股发行火爆 春节关注电影变化,新浪
564,2021-01-31,世纪华通(002602.SZ)：约6.31亿股将于2月2日解禁 解禁,格隆汇
565,2021-01-31,世纪华通：占总股本8.4602%限售股将于2月2日上市流通 解禁,Wind
566,2021-01-30,下周1516亿市值限售股解禁，环比增加930.1% 解禁,Wind
567,2021-01-29,"世纪华通现1笔大宗交易 共成交5,950.00万元",新浪
568,2021-01-29,娱美德在韩二审再败诉 世纪华通《传奇》IP在华独占性权益再度确权成功 诉讼纠纷,上证报
569,2021-01-26,马化腾又出手！百奥家庭互动立马飙升85%,中国基金报
570,2021-01-26,雷声滚滚！又有两公司亏穿总市值，15万股东触雷 亏损,证券时报
571,2021-01-24,A股爆雷之夜将至，就在下周！扫雷指南在此,中证报
572,2021-01-22,下周业绩披露高峰，“天雷滚滚”现冰山一角,Wind
573,2021-01-21,制造业老板变身游戏大亨，世纪华通实控人面临200亿商誉压力，会否成为下一个天神娱乐？ 控制人变化,华夏时报
574,2021-01-20,"世纪华通现1笔大宗交易 共成交3,234.70万元",新浪
575,2021-01-19,世纪华通(002602.SZ)：华通创投拟与专业投资机构设立虚拟现实产业基金,智通财经
576,2021-01-19,世纪华通(002602.SZ)：拟与时代伯乐、盛趣股权等发起设立虚拟现实产业基金,格隆汇
577,2021-01-19,世纪华通拟通过全资子公司联合发起设立虚拟现实产业基金,北京商报
578,2021-01-15,世纪华通(002602.SZ)：大股东邵恒解除质押475.69万股,格隆汇
579,2021-01-12,世纪华通(002602.SZ)：与上海恺英签署全面深化战略合作协议,格隆汇
580,2021-01-12,"世纪华通现1笔大宗交易 共成交1,401.48万元",新浪
581,2021-01-11,世纪华通(002602.SZ)大股东邵恒等解质3995.09万股及质押480万股,智通财经
582,2021-01-11,世纪华通(002602.SZ)：华通控股质押480万股及解押2918.4万股邵恒解押1076.69万股,格隆汇
583,2021-01-11,盛趣游戏传奇等多款IP助推世纪华通业绩走高,金融界
584,2021-01-11,传媒行业周报：游戏出海竞争力仍在提升 芒果超媒业绩或超预期,新浪
585,2021-01-11,2020年游戏上市公司股价盘点：有人市值创纪录，有人空欢喜,21世纪经济报道
586,2021-01-08,世纪华通现1笔大宗交易 共成交999.90万元,新浪
587,2021-01-08,解盘：错杀股企稳，网络游戏、数字货币、网络安全领涨,Wind
588,2021-01-07,世纪华通股价暴跌，实控人王苗通钱紧，千亿《传奇》IP是毒药？ 连续下跌,金融界
589,2021-01-04,传媒行业月度观点：“一年复始”关注超跌游戏电影 “万象新”推荐龙头芒果小米百度B站,新浪
590,2021-01-03,世纪华通(002602.SZ)：华通控股质押1200万股,格隆汇
591,2021-01-02,警报！2020年上市公司黑榜之财务爆雷（附独家连线） 产品问题,巨丰财经
592,2020-12-30,世纪华通(002602.SZ)：控股股东及实控人提前终止减持累计减持2.48%股份,格隆汇
593,2020-12-30,世纪华通(002602.SZ)遭控股股东华通控股及实控人王苗通减持1.84亿股 减持计划终止 拟减持股份,智通财经
594,2020-12-30,港股盘前必读：科技股强势反弹，欧盟批准与英国的贸易协议,Wind
595,2020-12-29,第七大道(00797)完成向世纪华通增发1.337亿股 净筹约3.46亿港元,智通财经
596,2020-12-29,解盘：顺周期全面回调，网络游戏、5G、第三代半导体略涨,Wind
597,2020-12-18,世纪华通(002602.SZ)：大股东邵恒解除质押800万股,格隆汇
598,2020-12-17,盛趣游戏CEO谢斐:云游戏是网游的未来,21世纪经济报道
599,2020-12-17,第七大道(00797-HK)向世纪华通(002602-CN)配股并进行战略合作,财华社
600,2020-12-16,世纪华通(002602.SZ)：将增持上海珑睿的股权,格隆汇
601,2020-12-15,传媒行业2021年投资策略：文娱消费复苏延续 内容赛道竞争再升级,新浪
602,2020-12-15,世纪华通今日大宗交易成交298.69万股，成交价8.57元溢价11.73%,Wind
603,2020-12-14,"世纪华通现1笔大宗交易 共成交2,889.90万元",新浪
604,2020-12-11,美股低开，新能源汽车、银行股普跌,Wind
605,2020-12-11,美股盘前：新能源汽车股走软,Wind
606,2020-12-11,"世纪华通现1笔大宗交易 共成交2,886.60万元",新浪
607,2020-12-11,Newzoo伽马发布《2020全球移动游戏竞争力报告》 中国20强公布,36氪
608,2020-12-11,业绩涨，PE低，四只龙头都跌超30%，这个板块被错杀了吗？,36氪
609,2020-12-11,报告：中国自研移动游戏海外收入预计超130亿美元,Wind
610,2020-12-10,世纪华通：预计明年会有若干款新游戏逐步上线,Wind
611,2020-12-10,世纪华通大股东减持3858.71万股，套现约3.08亿元 减持股份,21世纪经济报道
612,2020-12-09,世纪华通(002602.SZ)：控股股东及实控人股份减持比例超过1% 减持股份,格隆汇
613,2020-12-09,世纪华通(002602.SZ)近期遭控股股东及实控人王苗通减持8029.03万股 减持股份,智通财经
614,2020-12-09,世纪华通：华通控股及王苗通合计减持比例达总股本1.08% 减持股份,Wind
615,2020-12-09,世纪华通现1笔大宗交易 共成交879.00万元,新浪
616,2020-12-07,光正眼科低门槛激励达标术,证券市场周刊
617,2020-12-03,传媒行业月度报告：网络直播监管新规出台 12月新片供给回暖,新浪
618,2020-12-03,盛视早参：疫苗量产在即 风险偏好上升,新浪
619,2020-12-01,世纪华通(002602.SZ)：大股东王佶质押900万股,格隆汇
620,2020-12-01,A股收盘综述：金融板块火热，上证指数录升1.77%明日或突破年内高点,Wind
621,2020-12-01,三季度行业保持高增长 游戏概念股全面反弹丨牛熊眼,第一财经
622,2020-12-01,A股午盘综述：上证综指半日涨1.31%，银行、保险股炒作卷土重来,Wind
623,2020-12-01,网游股复苏，昆仑万维、顺网科技、游族网络、世纪华通领涨,Wind
624,2020-11-30,传媒月度观点：连续调整后不悲观 继续关注后疫情复苏逻辑及绩优稀缺龙头价值,新浪
625,2020-11-24,晚间重要公告2020年11月24日星期二,Wind
626,2020-11-24,世纪华通拟出售水果堂7.44%股权 交易作价4464万元 资产异常,北京商报
627,2020-11-24,世纪华通：广西腾讯创投拟受让水果堂7.44%股权,Wind
628,2020-11-24,世纪华通(002602.SZ)拟4464万元转让水果堂7.44%股权予广西腾讯创投 资产异常,格隆汇
629,2020-11-24,世纪华通：公司目前不存在商誉减值风险,Wind
630,2020-11-20,"高毅首度详细回应“GY被查”三大疑点：“未违规卖出”世纪华通,与腾讯没有一致行动关系，冯柳仍重仓同仁堂",华夏时报
631,2020-11-20,高毅资产首度详细回应坊间谣言：对世纪华通和同仁堂的投资完全合法合规！,每日经济新闻
632,2020-11-20,【直击】高毅资产澄清发布会：关于“GY被查”、大宗交易违规等传言，都回应了,证券时报网
633,2020-11-20,高毅回应冯柳交易问题：未在锁定期违规卖出世纪华通，仍较高比例持仓同仁堂,21世纪经济报道
634,2020-11-20,高毅资产回应冯柳进出个股：卖世纪华通没违规，仍持仓同仁堂,澎湃新闻
635,2020-11-20,高毅资产正面回应：已对谣言源头之一就职于券商的“某网络大V”采取法律措施,金融界
636,2020-11-19,接连布局超算中心 世纪华通为云游戏布局按下“快进键”,上证报
637,2020-11-19,从世纪华通布局超算中心 看游戏大厂自建IDC的几大利好,中金在线
638,2020-11-19,千亿私募被查传言背后：冯柳9年赚370倍，管理基金市值四百亿,AI财经社
639,2020-11-18,高毅资产被查 私募大佬冯柳“犀利”操作浮出水面,金融投资报
640,2020-11-18,高毅资产紧急辟谣被查传闻 冯柳世纪华通操作引市场质疑,新浪
641,2020-11-18,如何看待高毅被查传言，还“抄作业”吗？,格隆汇
642,2020-11-18,千亿资管公司被查？公司紧急回应 持仓股票大跌 股民吓出一身冷汗 连续下跌,每日经济新闻
643,2020-11-18,开启数据中心5G新时代 世纪华通为什么要做这么“重”的事情？,DoNews
644,2020-11-18,百亿私募被查？高毅紧急回应！是谁扔的“深水炸弹”？冯柳417亿持仓曝光,券商中国
645,2020-11-18,百亿私募被查？牵涉投资大佬冯柳？高毅紧急回应 冯柳持仓曝光,券商中国
646,2020-11-17,2500亿高毅资产被查？冯柳现身辟谣；重仓股世纪华通市值持续缩水,时代在线
647,2020-11-17,千亿私募高毅被查？冯柳罕见发微博，公司回应了,中证报
648,2020-11-17,逃不开的游戏生命周期 吉比特不再是游戏界的“茅台”,新浪
649,2020-11-16,【华西电子孙远峰-每日观点&资讯】（2020-11-17）,远峰电子
650,2020-11-16,世纪华通与神州数码战略合作 多股重大利好望开启上攻走势,巨丰财经
651,2020-11-16,A股早报2020年11月16日星期一,Wind
652,2020-11-15,世纪华通(002602.SZ)与神州数码(000034.SZ)签署战略合作框架协议,格隆汇
653,2020-11-15,晚间重要公告2020年11月15日星期日,Wind
654,2020-11-15,世纪华通(002602.SZ)携神州数码合作打造完整的超算中心产业链,智通财经
655,2020-11-15,世纪华通：与神州数码签订战略合作框架协议，助力公司在IDC产业布局,Wind
656,2020-11-15,世纪华通：与神州数码签订战略合作框架协议,e公司
657,2020-11-14,神州数码与世纪华通携手构筑“新基建”算力底座,中证网
658,2020-11-14,神州数码：与世纪华通达成战略合作,e公司
659,2020-11-14,【山证传媒】行业月度策略：博纳IPO过会快手递交上市申请，继续把握业绩主线,山西证券研究所
660,2020-11-13,市场要闻丨背靠腾讯，世纪华通的IDC业务又有新动作,36氪
661,2020-11-12,世纪华通(002602.SZ)拟续聘普华永道中天为公司2020年度审计机构,智通财经
662,2020-11-12,腾讯重仓股4个月暴跌47%，市值蒸发529亿！多空双方存分歧,搜狐
663,2020-11-12,传媒行业周报：快手抢占“短视频第一股” 双十一直播预售创纪录,新浪
664,2020-11-11,多路资本买买买，举牌“飞出”金凤凰,Wind
665,2020-11-10,传媒行业周报：博纳IPO终获批 电影行业有望迎来新生机,华安证券
666,2020-11-10,世纪华通：控股股东及大股东质押3900万股用于融资,资本邦
667,2020-11-09,世纪华通(002602.SZ)：华通控股质押2000万股 邵恒质押1900万股,格隆汇
668,2020-11-08,*ST群兴、华谊嘉信等资本运作异常 资金占用、商誉减值现象成常态 资金问题,红周刊
669,2020-11-07,吉比特：老本还能吃多久?,证券市场周刊
670,2020-11-06,20Q3传媒行业基金持仓报告：持仓配置比例下滑 机构加仓分众,新浪
671,2020-11-05,世纪华通超90款存量游戏收益增20% 6款重磅新游排期公开,凤凰网
672,2020-11-04,世纪华通前三季净利润24.46亿元超去年全年，排名A股游戏公司第一,搜狐
673,2020-11-04,世纪华通前三季度净利润24.46亿元同比增长21.73% 位列A股游戏板第一,长江商报
674,2020-11-03,股价腰斩、大股东套现、业绩增长放缓 世纪华通这样解释 盈利能力下降,新浪
675,2020-11-03,抄作业的，很多都亏钱了,格隆汇
676,2020-11-03,传媒行业周报：业绩稳健不必悲观 继续推荐游戏、视频龙头,新浪
677,2020-11-03,明星资本有进有退，这个板块能否“玩”转全年？,中国财富网
678,2020-11-02,21家A股游戏公司Q3业绩过山车,钛媒体
679,2020-11-02,游戏板块整体向好 世纪华通前三季度营收、净利均位列行业第一,证券日报网
680,2020-11-02,传媒行业研究周报：顺周期广告板块效应明显 关注双十一背后竞争力,新浪
681,2020-11-02,券商龙头闪崩，多只白马大跌！冯柳大举出货,中国基金报
682,2020-11-02,突发乌龙指？2800亿券商龙头盘中闪崩跌停，多只大白马集体暴跌！ 连续下跌,中新经纬
683,2020-11-02,突发乌龙指？中信建投盘中闪崩跌停 多只大白马集体暴跌 连续下跌,中国基金报
684,2020-11-02,世纪华通2020前三季度营收、净利位列A股游戏第一,凤凰网
685,2020-11-02,世纪华通一度触及跌停，冯柳减持消息引发市场抛售,Wind
686,2020-11-02,多家游戏公司三季度业绩增速放缓 数款重磅新品将上线 盈利能力下降,中证报
687,2020-11-02,多家游戏公司三季度业绩增速放缓 盈利能力下降,Wind
688,2020-10-31,最新！冯柳又现重磅减持 这次是600亿白马股！3季度以来暴跌 减持股份,中国基金报
689,2020-10-31,顺丰之后冯柳又现重磅减持，这次是世纪华通！,Wind
690,2020-10-31,顺丰之后，冯柳又现重磅减持，这次是600多亿的世纪华通 减持股份,证券时报网
691,2020-10-30,同比增长21.73% 世纪华通前三季度实现净利润24.46亿元,北京商报
692,2020-10-30,世纪华通(002602.SZ)第三季度归母净利润同比增长1.48%至8.43亿元,智通财经
693,2020-10-30,世纪华通前三季净利润24.46亿 同比增长22%,证券时报
694,2020-10-30,世纪华通(002602.SZ)第三季度扣非净利润降12.53%至6.92亿元 盈利能力下降,格隆汇
695,2020-10-30,世纪华通：前三季度净利润同比增长21.73%,Wind
696,2020-10-30,世纪华通：高级管理人员变更 董监高成员变化,Wind
697,2020-10-30,A股共发生82宗大宗交易成交35.18亿元（10月30日）,Wind
698,2020-10-30,"世纪华通现1笔大宗交易 共成交10,200.00万元",新浪
699,2020-10-30,世纪华通今日大宗交易成交1200万股，成交价8.5元折价0.35%,Wind
700,2020-10-30,世纪华通前三季度营收117.69亿元,北京商报
701,2020-10-26,近4000亿“安防茅”一度涨停 冯柳旗下产品持仓或逼近100亿元,每经牛眼
702,2020-10-26,基金圈“好兄弟”反目成“仇” 知名私募和熙投资治理闹剧曝光,新浪
703,2020-10-25,市值营收净利均位列A股游戏第一，世纪华通是如何做的,凤凰网
704,2020-10-21,世纪华通：目前公司有VR项目安排,Wind
705,2020-10-20,传媒行业周报：游戏蛰伏中布局 直播电商和芒果继续加码,新浪
706,2020-10-20,【中原晨会1020】市场分析、传媒行业月报、通信行业月报,中原证券研究所
707,2020-10-19,文化传媒行业周报：行情继续低迷 关注业绩优秀龙头个股,渤海证券
708,2020-10-19,世纪华通：可登录公司官网预约游戏《庆余年》,Wind
709,2020-10-18,闪崩！多只基金重仓白马股出事，基金经理最新研判来了,中国基金报
710,2020-10-16,这只股，让冯柳亏的有点多,格隆汇
711,2020-10-16,巨人网络失速：盈利能力下降 自主研发带来高毛利率？ 盈利能力下降,新浪
712,2020-10-16,融资客青睐17股，美好置业买入占比高达51.81%,Wind
713,2020-10-15,游族网络、世纪华通均放量下挫7%左右，昆仑万维、凯撒文化等游戏股跟跌,Wind
714,2020-10-15,A股早报2020年10月15日星期四,Wind
715,2020-10-14,跌幅最高超7% 盛迅达、世纪华通等多只游戏股股价继续下跌,北京商报
716,2020-10-14,定增新规下首批项目迎解禁，收益率落差明显,Wind
717,2020-10-14,定增新规下首批项目迎解禁 收益率落差明显 解禁,上证报
718,2020-10-13,A股互联网传媒行业2020年三季报业绩前瞻：楼宇媒体复苏超预期 视频龙头维持高景气 游戏有分化,新浪
719,2020-10-13,《热血传奇》20年：游戏IP穿越周期的最强样本,时代在线
720,2020-10-13,世纪华通(002602.SZ)股东华通控股及王苗通减持股份1.15亿股 减持时间已过半 减持股份,智通财经
721,2020-10-13,世纪华通(002602.SZ)：华通控股及王苗通减持期过半合计减持1.16亿股 减持股份,格隆汇
722,2020-10-13,世纪华通：控股股东及实际控制人减持计划时间过半 拟减持股份,Wind
723,2020-10-12,游戏龙头股领跌 或与渠道分成有关？,每日经济新闻
724,2020-10-12,传媒行业月度报告：国庆档顺利收官 关注Q4新游戏上线及双11营销板块催化,新浪
725,2020-10-12,传媒行业周报：新游上线纷至沓来 直播电商风云再起,新浪
726,2020-10-10,下周655亿市值限售股解禁 解禁,Wind
727,2020-10-08,世纪华通(002602.SZ)：3.24亿股限售股将于10月15日解禁 解禁,格隆汇
728,2020-09-30,创业板“妖股”遭散户追捧，高毅重仓股筹码“巨震”,红周刊
729,2020-09-29,“传奇”游戏已20岁，累计用户超6亿，版权纠纷仍存在隐患 诉讼纠纷,奥一网
730,2020-09-28,互联网传媒周报：游戏渠道内容议价力有望改变,新浪
731,2020-09-28,传媒互联网周报：“全国一网”取得突破性进展 推荐游戏、电商及广告,光大证券
732,2020-09-24,A股共发生141宗大宗交易成交34.76亿元（9月24日）,Wind
733,2020-09-24,"世纪华通现6笔大宗交易 共成交4,919.60万元",新浪
734,2020-09-24,世纪华通今日大宗交易成交502万股，成交价9.8元折价3.83%,Wind
735,2020-09-23,世纪华通：拟为全资子公司提供不超过3亿元额度的连带责任担保 大额借贷担保,TechWeb
736,2020-09-23,世纪华通(002602.SZ)：拟为华通车业申请综合授信业务提供不超3亿元连带责任担保 大额借贷担保,格隆汇
737,2020-09-23,每经专访世纪华通CEO、盛趣游戏董事长王佶：全世界游戏产业，还有四分之三市场等着中国企业开拓,每日经济新闻
738,2020-09-23,盛趣游戏董事长王佶：收购盛大是“命运交集”,每日经济新闻
739,2020-09-22,曾操盘中国游戏并购最大案铸就行业传奇，舵手王佶却要“转战”脑科学？,每日经济新闻
740,2020-09-22,互联网传媒行业周报：楼宇媒体继续复苏 游戏国内迎来新品高峰,新浪
741,2020-09-22,A股早报2020年9月22日星期二,Wind
742,2020-09-21,A股共发生136宗大宗交易成交42.34亿元,Wind
743,2020-09-21,"世纪华通现2笔大宗交易 共成交25,870.00万元",新浪
744,2020-09-20,传媒一周观点：持续提示的后疫情板块表现较强 关注Q3业绩兑现,新浪
