259,2021-08-04,调研记录|东鹏饮料（605499.SH）：长沙工厂预计在2024年3月投产 董事长聚焦点新品研发和推出等事宜,智通财经
260,2021-08-04,券商首次关注8股并给予买入评级（8月4日）,Wind
261,2021-08-04,社保基金、QFII调仓路线曝光，同时重仓化工股,Wind
262,2021-08-03,备案产品数量创年内新高，私募最新持仓透露布局方向,Wind
263,2021-08-03,东鹏饮料接受24家机构调研！短期主力资金净流入，市场资金早已察觉,每日经济新闻
264,2021-08-03,东鹏饮料(605499)：大鹏迎风起 扶摇而直上,新浪
265,2021-08-03,禁买线预警，看“聪明钱”如何爆买A股？,Wind
266,2021-08-03,组团抄底来了！谢治宇、邓晓峰、冯柳等最新持仓曝光,Wind
267,2021-08-03,东鹏饮料二季度净利环比下滑，净利近9成分红、林木勤吃相难看？ 盈利能力下降,中访网
268,2021-08-02,食品饮料行业研究周报：白酒需自上而下拨云见日 关注食品超跌标的,新浪
269,2021-08-02,联商超市周报：重客隆超市要全关 茅台市值蒸发1.05万亿,联商网
270,2021-08-02,东鹏饮料(605499)2021年半年报点评：高增趋势不改 东鹏展翅全国,西南证券
271,2021-08-02,德邦证券8月金股组合,微信
272,2021-08-02,估值回落后，怎么看当下食饮板块？,智通财经
273,2021-08-02,机构强推买入 六股成摇钱树,证券之星
274,2021-08-02,西南证券首予东鹏饮料买入评级：高增趋势不改，东鹏展翅全国,每日经济新闻
275,2021-08-02,国金证券维持东鹏饮料买入评级：业绩符合预期，全国化布局稳步推进,每日经济新闻
276,2021-08-02,81股获券商买入评级 新城控股目标涨幅达108.40%,Wind
277,2021-08-02,东鹏饮料靠营销驱动推广费半年达3.41亿 盈利6.76亿分红6亿林木勤被指掏空公司,长江商报
278,2021-08-01,【华西食饮】东鹏饮料（605499.SH）2021上半年业绩点评：上市将加速成长,国金食品饮料寇星
279,2021-07-31,上半年，东鹏特饮救了卖馒头的,ZAKER
280,2021-07-31,巴比食品(605338)：开店逻辑验证 内生外延发展,新浪
281,2021-07-31,巴比食品(605338)：同店恢复 享受猪价下行成本红利,华安证券
282,2021-07-30,东鹏饮料(605499)21年中报点评：业绩符合预期 全国化布局稳步推进,国金证券股份有限公司
283,2021-07-30,101股获买入评级 最新:东鹏饮料,中财网
284,2021-07-30,华鑫证券给予东鹏饮料推荐评级：能量饮料营收快速增长，市场扩展战果显着,每日经济新闻
285,2021-07-30,巴比食品(605338)2021年半年度业绩预告点评：更看扩张加速 盈利具备支撑,新浪
286,2021-07-30,押对宝？巴比食品3年前投资的东鹏饮料，今贡献净利润超1.4亿,和讯
287,2021-07-30,东鹏饮料多次风险提示后股价跌去33％“千亿”市值或欠缺成长性支撑,发现网
288,2021-07-30,东鹏饮料(605499)：高歌猛进全国拓市 品牌形象深入人心,新浪
289,2021-07-30,【开源食饮】东鹏饮料：空白市场高速扩张，Q3净利率有望恢复——公司信息更新报告,宇光看食饮
290,2021-07-30,东鹏饮料大手笔分红后欲投资私募基金，一名董事投出弃权票,经济观察报
291,2021-07-30,东北证券：维持东鹏饮料(605499.SH)“买入”评级 目标价228元,智通财经
292,2021-07-30,【窥业绩】上半年净利增长超5成，东鹏饮料（605499.SH）如何讲好成长故事？,财华社
293,2021-07-30,中银证券维持东鹏饮料增持评级：主销产品放量+渠道拓展有力，业绩快速增长,每日经济新闻
294,2021-07-30,东鹏饮料发布公告 拟6亿元投资建设生产基地项目,资本邦
295,2021-07-30,巴比食品中报预告：净利润增长超258%，东鹏饮料贡献1亿利润,36氪
296,2021-07-30,关注半年报｜东鹏饮料赚了，最后却是巴比食品赢了？,搜狐
297,2021-07-30,投资东鹏饮料获得丰厚利润，巴比食品上半年业绩预增2倍多,资本邦
298,2021-07-30,2股中期分红 东鹏饮料派现最大方,证券时报网
299,2021-07-30,券商首次关注5股并给予买入评级（7月30日）,Wind
300,2021-07-30,开源证券维持东鹏饮料增持评级，近期获20份券商研报关注，目标均价涨幅21.6%,每日经济新闻
301,2021-07-30,[公司]东鹏饮料拟长沙投建华中区域总部及生产基地项目,全景网
302,2021-07-30,46股获券商买入评级 志邦家居目标涨幅达107.75%,Wind
303,2021-07-30,能量饮料行业下半场，东鹏的时间窗口到来了,斑马消费
304,2021-07-30,巴比食品上半年业绩预增，投资东鹏饮料贡献大半利润,新京报
305,2021-07-30,【东吴晨报0730】【宏观】【行业】轻工、食品饮料【个股】东鹏饮料、百川畅银,东吴研究所
306,2021-07-30,【食品饮料-苏铖】东鹏饮料：渠道开拓超预期,安信证券研究
307,2021-07-30,“醒着拼”的东鹏饮料发中报，“饮料界茅台”名副其实吗？,美股研究社
308,2021-07-29,消费参考丨外资分化：星巴克在华增长放缓 百胜扩张加速,21世纪经济报道
309,2021-07-29,天风证券维持东鹏饮料增持评级：全国化拓张成效显现，费用加码助力品牌提升和扩张,每日经济新闻
310,2021-07-29,东鹏饮料上半年业绩增五成 高度依赖单品问题犹存,GPLP犀牛财经
311,2021-07-29,“千亿”东鹏饮料大手笔分红：逾3亿红利装入实控人口袋,第一财经
312,2021-07-29,东鹏饮料(605499)2021年半年报点评：收入延续高增 加速推进全国化,新浪
313,2021-07-29,巴比食品(605338)更新点评：“量”“价”表现可期 外生内延谱新章,新浪
314,2021-07-29,东鹏饮料上半年营收36.8亿元，豪掷3亿认购私募基金,21世纪经济报道
315,2021-07-29,东鹏饮料(605499.SH)：与长沙金霞开发区签署项目入园协议书,格隆汇
316,2021-07-29,32股获机构买入型评级 百润股份、东鹏饮料关注度最高,证券时报网
317,2021-07-29,东鹏饮料(605499.SH)拟6亿元在长沙市开福区投建华中区域总部及生产基地,智通财经
318,2021-07-29,川财证券维持东鹏饮料增持评级：盈利能力稳步提升，大力推动全国化进程,每日经济新闻
319,2021-07-29,东鹏饮料：拟6亿元投建东鹏饮料华中区域总部及生产基地,财联社
320,2021-07-29,多元催化剂加速东鹏饮料全国化进程,中金在线
321,2021-07-29,35股获机构买入型评级 百润股份、东鹏饮料关注度最高,证券时报网
322,2021-07-29,东鹏饮料半年报：非能量饮料收入减少33% 销售费用大增成效几何？ 盈利能力下降,新浪
323,2021-07-29,32股今日获机构买入评级12股上涨空间超20%,证券时报网
324,2021-07-29,巴比食品：上半年预计净利润同比增长258.96%~294.85%,Wind
325,2021-07-29,快讯｜巴比食品上半年净利大涨近300%，主要系持有东鹏饮料收益增加,财经网
326,2021-07-29,东吴证券给予东鹏饮料买入评级：收入延续高增，加速推进全国化,每日经济新闻
327,2021-07-29,东鹏饮料中报点评：省内外均表现亮眼，费用投放谋长远【太平洋食饮】,食品饮料大消费黄付生
328,2021-07-29,东鹏饮料(605499.SH)拟3亿元参投招银朗曜二期基金以投资先进制造等领域,智通财经
329,2021-07-29,东鹏饮料(605499.SH)拟出资3亿元认购私募基金份额,格隆汇
330,2021-07-29,东鹏饮料：拟3亿元认购基金投资领域为先进制造、新能源等,财联社
331,2021-07-29,光大证券：维持东鹏饮料(605499.SH)“增持”评级 大单品持续放量 收入稳健增长,智通财经
332,2021-07-29,安信证券：维持东鹏饮料(605499.SH)“买入”评级 目标价225元,智通财经
333,2021-07-29,国泰君安：维持东鹏饮料(605499.SH)“增持”评级 目标价下调21%至235.1元,智通财经
334,2021-07-29,A股异动 | 东鹏饮料(605499.SH)涨逾8% 中期净利同比增53.14% 上市以来股价翻逾4倍,格隆汇
335,2021-07-29,方正证券：维持东鹏饮料(605499.SH)“推荐”评级 全国化进程稳步推进 业绩有望持续高增,智通财经
336,2021-07-29,东鹏饮料(605499)：加强费用投放 开拓渠道驱动成长,新浪
337,2021-07-29,东鹏饮料(605499)2021年中报点评：大单品持续放量 收入稳健增长,光大证券
338,2021-07-29,东鹏饮料(605499)：大单品高增驱动盈利改善 新设产能构建市场扩张支点,新浪
339,2021-07-29,【招商食品】东鹏饮料：费用投入高增，全国化步伐加快,招商食品饮料
340,2021-07-29,东鹏饮料全国化布局成效卓着 上市后首份半年报净利同比增53.14%,证券时报网
341,2021-07-29,上市公司中期分红一览,证券时报网
342,2021-07-29,东鹏饮料拟认购私募基金份额 加华资本宋向前投出弃权票,和讯
343,2021-07-29,国海证券维持东鹏饮料买入评级：省外持续扩张，新品持续培育,每日经济新闻
344,2021-07-29,东鹏饮料首份半年报出炉，上半年净利增逾五成,资本邦
345,2021-07-29,国盛证券维持东鹏饮料增持评级：全国化顺利推进，新品增长瞩目,每日经济新闻
346,2021-07-29,【东鹏饮料中报点评：全国化进程稳步推进，短期品牌投放影响业绩210728】,虎哥的研究
347,2021-07-29,半年报解读|东鹏饮料上市后首份成绩单出炉 二季度净利润环比下滑 盈利能力下降,财联社
348,2021-07-29,东鹏饮料(605499)：Q2收入较快增长 费用投放有所加大,新浪
349,2021-07-29,安信证券维持东鹏饮料买入评级：渠道开拓超预期，持续兑现高成长，目标价225元,每日经济新闻
350,2021-07-29,东鹏饮料：有向河南灾区捐赠东鹏特饮、东鹏饮用水等物资,Wind
351,2021-07-29,东鹏饮料：本次水灾对公司在河南省的业绩会略有影响,Wind
352,2021-07-29,东鹏饮料：目前公司没有收购同行业上下游的计划,Wind
353,2021-07-29,民生证券维持东鹏饮料推荐评级，2021年中报点评：区域扩张及渠道下沉提速效果显着,每日经济新闻
354,2021-07-29,【东鹏饮料（605499.SH）】大单品持续放量，收入稳健增长——2021年中报点评（陈彦彤）,光大证券
355,2021-07-29,东鹏饮料首份半年报出炉 全国化布局稳步推进,上证报
356,2021-07-29,半年报业绩大增，股价高点回撤三成：东鹏开始去“虚火”,华夏时报
357,2021-07-28,东鹏饮料公布半年报 上半年净利增加53.14%,新浪
358,2021-07-28,【开源食饮每日资讯0728】2021H1东鹏饮料净利润同比增长53.14%。,宇光食饮日讯
359,2021-07-28,晚间重要公告2021年7月28日星期三,Wind
360,2021-07-28,东鹏饮料：上半年营收增长49.11%净利润增长53.14%,发布易
361,2021-07-28,东鹏饮料上半年业绩增长逾五成 拟10派15元,上证报
362,2021-07-28,东鹏饮料上市后首份中报出炉 归属净利润同比增长53.14%,北京商报
363,2021-07-28,东鹏饮料：2021年半年度净利润约6.76亿元，同比增加53.14%,每日经济新闻
364,2021-07-28,东鹏饮料(605499.SH)拟设长沙子公司投建华中区域总部及生产基地项目,智通财经
365,2021-07-28,东鹏饮料(605499.SH)上半年归母净利同比增53%至6.76亿元 拟10派15元,智通财经
366,2021-07-28,东鹏饮料(605499.SH)：上半年净利增53.14%至6.76亿元 拟10派15元,格隆汇
367,2021-07-28,东鹏饮料(605499.SH)：拟设长沙公司实施华中区域总部及生产基地项目,格隆汇
368,2021-07-28,东鹏饮料半年报：上半年净利同比增长53%拟10派15元,财联社
369,2021-07-28,东鹏饮料：上半年净利润同比增长53.14%,Wind
370,2021-07-28,东鹏饮料：拟投资设立全资子公司长沙东鹏维他命饮料有限公司,Wind
371,2021-07-26,40余家食品企业驰援河南防汛救灾 元气森林等食品行业新生品牌表现积极,中国网
372,2021-07-26,饮料板块周报：白酒中报拉开帷幕 继续推荐五粮液(推荐),国海证券
373,2021-07-25,【开源食饮】食品饮料重仓比例回落，板块性价比逐渐显现——行业周报,宇光看食饮
374,2021-07-24,风雨一起撑| 东鹏饮料第三批捐赠物资陆续到达,凤凰网
375,2021-07-20,消费行业周报：次高端酒企上半年业绩实现较高增长 建议持续关注,新浪
376,2021-07-19,萧楠二季度大幅增持银行板块，招商银行入围易方达科顺重仓股，美的集团出局,每日经济新闻
377,2021-07-19,食品饮料行业跟踪周报：周观点 白酒延续高增 底部布局食品,新浪
378,2021-07-17,深度*公司*东鹏饮料(605499)：费用投放加大 渠道有序拓展,新浪
379,2021-07-16,111股获买入评级最新:伟明环保,中财网
380,2021-07-16,中银证券维持东鹏饮料增持评级：费用投放加大，渠道有序拓展,每日经济新闻
381,2021-07-16,二季度基金持仓浮出水面，顶流基金经理亲自“踩点”这些公司（附名单）,Wind
382,2021-07-16,德邦证券维持东鹏饮料买入评级：市场渠道开拓见效，费投与新品为成长蓄力,每日经济新闻
383,2021-07-16,国海证券维持东鹏饮料买入评级，近期获12份券商研报关注，目标均价涨幅16.12%,每日经济新闻
384,2021-07-16,川财证券维持东鹏饮料增持评级，2021半年度业绩预告：公司目前艺术陶瓷尚未应用于白酒包装,每日经济新闻
385,2021-07-16,【食品饮料】东鹏饮料—费用投放加大，渠道有序拓展,中银证券研究
386,2021-07-16,明星代言股真香！倍轻松上市首日飙涨,北京商报
387,2021-07-15,安信证券首予东鹏饮料买入评级：Q2稳健增长，费用投放导致利润承压，目标价275元,每日经济新闻
388,2021-07-15,东鹏饮料(605499)重大事件点评：全国化持续推进 东鹏务实向上,国海证券
389,2021-07-15,信达证券维持东鹏饮料买入评级：品牌投放力度大，加快走向全国化,每日经济新闻
390,2021-07-15,饮料板块周报：中报验证成新催化剂暨二季度业绩前瞻,国海证券
391,2021-07-15,东鹏饮料(605499.SH)：“东鹏?牛磺酸B族维生素饮料”获得国产保健食品注册证书,智通财经
392,2021-07-15,肖战代言的倍轻松上市首日股价飙涨525% 明星代言股真的更香吗,北京商报
393,2021-07-15,光大证券：维持东鹏饮料(605499.SZ)“增持”评级 收入、业绩符合市场预期,智通财经
394,2021-07-15,招商证券：重申东鹏饮料(605499.SH)“强烈推荐-A”评级 Q2营收同比预增22.9%-30.8%符合预期,智通财经
395,2021-07-15,国盛证券维持东鹏饮料增持评级：立足长远，加码品宣,每日经济新闻
396,2021-07-15,东鹏饮料(605499)：加大品牌投放 区域走向全国,新浪
397,2021-07-15,民生证券维持东鹏饮料推荐评级，2021年半年度业绩预告点评：21Q2 收入维持高增，加大费用投放快速突围,每日经济新闻
398,2021-07-14,晚间重要公告2021年7月14日星期三,Wind
399,2021-07-14,东鹏饮料预计上半年净利润增长超50%,贝壳财经
400,2021-07-14,东鹏饮料：预计上半年净利润同比增长51%-55%,第一财经
401,2021-07-14,东鹏饮料：预计 2021 年上半年净利润为 6.65 亿元到 6.85 亿元，增幅为 50.69% 到 55.22%,ZAKER
402,2021-07-14,东鹏饮料：上半年预计净利润同比增长50.69%~55.22%,Wind
403,2021-07-14,东鹏饮料(605499.SH)半年度净利预增50.69%-55.22%,格隆汇
404,2021-07-14,东鹏饮料：预计上半年净利同比增长50.69%-55.22%,财联社
405,2021-07-14,东鹏饮料：预计上半年净利润同比增长50.69%到55.22%,Wind
406,2021-07-14,【东鹏饮料（605499.SZ）】渠道拓展持续推进，全国化扩张值得期待——2021年半年度业绩预告点评（陈彦彤）,光大证券
407,2021-07-13,近17亿业绩窟窿未填平，国民技术的“董事长专属”定增,第一财经
408,2021-07-11,巨大的财富效应之下 资金加速流入消费赛道,投资界
409,2021-07-10,东鹏饮料市值千亿 机构抱团推高意为割韭菜？,ZAKER
410,2021-07-09,模仿红牛：代工厂厂长身家冲上500亿,网易
411,2021-07-09,估值明显偏离业绩表现 东鹏饮料如何撑起千亿市值？,南方日报
412,2021-07-09,东鹏饮料: 华泰联合关于东鹏饮料使用闲置自有资金购买理财产品的核查意见,证券之星
413,2021-07-08,食品饮料的资金争夺战,和讯
414,2021-07-08,东鹏饮料：目前公司原材料成本稳定,每日经济新闻
415,2021-07-08,市值破千亿，东鹏特饮能撕掉“高仿红牛”标签的吗？,36氪
416,2021-07-08,“暴富”的东鹏饮料：高市值背后的远虑与近忧,凤凰网
417,2021-07-08,东鹏饮料，「拐点」将至？,和讯
418,2021-07-07,潮汕首富易主 东鹏造富特饮第一牛股,创业邦
419,2021-07-07,东鹏饮料50亿营收或难撑千亿市值，压货虚增收入问题仍存疑 欺诈造假,中访网
420,2021-07-07,潮汕首富易主 东鹏造富特饮第一牛股,ZAKER
421,2021-07-06,新消费︱都是抄作业，东鹏竟干翻元气森林？,搜狐
422,2021-07-06,食品饮料行业：必选大众品触底待反弹 白酒H2呈接力式发展,新浪
423,2021-07-06,东鹏饮料是否值得“千亿市值”？,每日财报
424,2021-07-05,国海证券维持东鹏饮料买入评级：全国化持续推进，东鹏务实向上,每日经济新闻
425,2021-07-05,153家公司获机构调研（附名单）,证券之星
426,2021-07-05,食品饮料行业跟踪周报：波动中需寻找具有性价比的稳定增长标的,新浪
427,2021-07-02,东鹏饮料上市首份投资者调研报告 涉及未来经营、产品定价等问题,和讯
428,2021-07-02,国盛证券首予东鹏饮料增持评级：于展翅起舞时再论东鹏,每日经济新闻
429,2021-07-02,滴滴与东鹏饮料的“影子股东” ST加加持股4家年内新股,和讯
430,2021-07-02,东鹏饮料(605499)首次覆盖报告：于展翅起舞时再论东鹏,新浪
431,2021-07-01,主力探秘：换手率识别庄家,财富动力网
432,2021-07-01,6月金股组合盈利25.37% 7月荐股名单出炉,新浪
433,2021-07-01,东鹏饮料(605499)：能量饮料风起 东鹏展翅正当时,光大证券
434,2021-06-30,黑马频出，上半年中国上市企业市值500强揭晓,Wind
435,2021-06-30,连续7天成交破万亿，创业板指站上6年来新高，7月A股机会在哪里？,第一财经
436,2021-06-30,"券商6月金股组合""战绩""：川财证券25.37%夺冠 中原最差",新浪
437,2021-06-30,食品饮料行业研究周报：可选势头强劲至中报 H2必选数据有望回暖,新浪
438,2021-06-30,市值破千亿，东鹏特饮能撕掉“高仿红牛”标签的吗？,36氪
439,2021-06-30,周谈 | Weekly Talk：可选势头强劲至中报，H2必选数据有望回暖,食品饮料光头阳线
440,2021-06-29,信达证券维持东鹏饮料买入评级：不简单的东鹏,每日经济新闻
441,2021-06-28,东鹏饮料，有点“上头”,新浪
442,2021-06-28,食品饮料行业周报：如何解读白酒税改传闻？,新浪
443,2021-06-27,板块拾金丨万亿元大题材“BIPV概念”横空出世，七月的翻身行情会在哪？,第一财经
444,2021-06-27,【中泰食品】周思考26：如何看待618数据以及白酒消费税？,食品饮料俱乐部
445,2021-06-25,农夫山泉市值蒸发3000亿 金龙鱼海天味业回调40% 资本市场迷恋的“液体黄金”风光不再？ 连续下跌,金融投资报
446,2021-06-25,股价飙涨5倍后，东鹏饮料终于“刹车”，它真的值近千亿市值吗？,AI财经社
447,2021-06-25,机构强推买入六股成摇钱树,证券之星
448,2021-06-25,曾被视为红牛模仿者，如今成功上市，一年卖出24亿瓶！,搜狐
449,2021-06-25,广东区域股市周报：3亿融资买入亿纬锂能 北讯退跌34.34%跌幅第一,每日经济新闻
450,2021-06-25,中银国际：东鹏饮料（605499.SH）能量饮料后起之秀，市占率有较大提升空间，首予“增持”评级,智通财经
451,2021-06-25,【食品饮料】东鹏饮料—能量饮料后起之秀，市占率有较大提升空间,中银证券研究
452,2021-06-25,巴比食品：猪肉价格变化直接影响公司产品生产成本,Wind
453,2021-06-25,跌超7%！东鹏饮料暴涨5倍后迎来大跌，专家：远未调整到位 连续下跌,南都报
454,2021-06-25,游资、机构共同推动次新股行情,Wind
455,2021-06-24,ST加加：公司间接持有东鹏饮料的股份,每日经济新闻
456,2021-06-24,“红牛”之争仍在继续 功能饮料市场已“马”嘶“鹏”飞,证券日报网
457,2021-06-24,农夫山泉不再甜，市值蒸发3200亿，创始人钟睒睒失去亚洲首富宝座 连续下跌,时代财经
458,2021-06-24,【机构风向标】价格创新高个股数量井喷，半导体、化工最活跃！14股获多家机构“买入”评级,证券时报网
459,2021-06-24,恒大股价直线拉升！两只千亿次新股崩了，白酒税率传大消息,Wind
460,2021-06-24,突发！中国恒大宣布还钱，股价直线拉升！,证券时报网
461,2021-06-24,突发！恒大重磅宣布，股价直线拉升！两只千亿次新股崩了，白酒税率突传大消息！海底捞狂跌2500亿，创始人张勇火了：我是不抱有希望的,中国基金报
462,2021-06-24,罕见！5家机构狂砸11亿抢筹 东鹏饮料火了！中一签暴赚19万 还能嗨多久？,电鳗快报
463,2021-06-24,上市27天，市值暴涨833亿，潮汕首富换人了！,创业邦
464,2021-06-23,4000亿“不死鸟”崩盘，这份数据引发空袭？四大信号指明方向,Wind
465,2021-06-23,东鹏饮料市值破千亿：我国功能饮料相关企业1.4万家,第一财经
466,2021-06-23,啥情况？千亿白马跌超10%！外资加仓，半导体又火了,Wind
467,2021-06-23,25天市值翻3倍 东鹏饮料还能“醒着拼”吗？,全天候科技
468,2021-06-23,IPO为圈钱？东鹏饮料业绩增长频遭质疑,中访网
469,2021-06-23,五日龙虎榜追踪 机构抢筹这45股,证券之星
470,2021-06-22,上市16天拿下千亿市值 汕尾新首富诞生身家538亿 更有网红奶茶即将登陆港股,新浪
471,2021-06-22,2600亿疫苗白马闪崩！两桶油狂拉，中石油涨30%,Wind
472,2021-06-22,机构资金最近入驻这些股,证券之星
473,2021-06-21,15个涨停后终于“刹车”，高位抢筹东鹏饮料的机构们真的冷静了吗？,第一财经
474,2021-06-21,监管出手，2000亿巨头突然崩了！多只白酒股跳水,Wind
475,2021-06-21,饮料板块周报：行情持续演绎 股东大会持续催化,国海证券
476,2021-06-21,高估值下两大问题遭诟病东鹏饮料(605499.SH)跌超7%,格隆汇
477,2021-06-21,东鹏饮料(605499)：乘势而上 能量饮料龙头大有可为,国金证券股份有限公司
478,2021-06-21,民生证券研究周观点,新浪
479,2021-06-21,【招商食品 | 最新】白酒聚焦核心品种，食品配置价值提升,招商食品饮料
480,2021-06-21,今天，大肉签又来了！本周12只新股发行！,中国基金报
481,2021-06-21,一签狂赚22万，股民沸腾！今天，大肉签又来了！,Wind
482,2021-06-21,【国金晨讯】推荐快速进化的整车企业；中报行情如何看待？东鹏饮料：乘势而上，能量饮料龙头大有可为,国金证券研究所
483,2021-06-21,国金证券给予东鹏饮料买入评级：乘势而上，能量饮料龙头大有可为，目标价291.15元,每日经济新闻
484,2021-06-21,突发疫情！一市深夜紧急通告：全员核酸检测！一签狂赚22万，股民沸腾！今天，大肉签又来了！本周12箭齐发,中国基金报
485,2021-06-21,林木勤差异化竞争致胜 东鹏饮料16天冲上千亿市值,长江商报
486,2021-06-21,陆家嘴财经早餐2021年6月21日星期一,Wind
487,2021-06-21,【开源食饮】高端白酒前景乐观，着眼长期坚守价值——行业周报,宇光看食饮
488,2021-06-21,最牛主板新股中一签大赚22万元，下周还有12只新股连发！,上证报
489,2021-06-20,今年最牛新股一签大赚21.94万元，下周新股又来了！,Wind
490,2021-06-20,明天，大肉签又来了！,中证报
491,2021-06-20,谁是上半年最赚钱的新股？有的上市不足月 单签浮盈已超20万,经济观察报
492,2021-06-20,食品饮料：基础建设年 稳中求进取,新浪
493,2021-06-20,食品行业周报：截至2021年5月底 全国共生产食糖1066.05万吨,新浪
494,2021-06-19,超级大肉签，一签躺赚22万，机构为它“挤破头”！低位次新股崛起，低估值潜力股名单来了,证券时报
495,2021-06-19,ST加加：公司和加华共同成立合兴基金,Wind
496,2021-06-19,平价红牛上市，东鹏特饮连获15个涨停板，潮汕老板身家暴增到600亿元,时代周报
497,2021-06-19,千亿东鹏饮料开启疯狂模式 鸿蒙概念股思特奇上涨乏力,财富动力网
498,2021-06-19,彻底火了!机构扫货净买10股 东鹏饮料成为资金最爱,财富动力网
499,2021-06-18,喝出多少富豪？东鹏500亿红牛千亿，奈雪奶茶百亿，卖水成为首富,凤凰网
500,2021-06-18,机构抢筹难消“泡沫”疑虑东鹏饮料正面回应两大质疑炒作风险仍需警惕,财联社
501,2021-06-18,营收不到50亿市值却破千亿，东鹏饮料的“爆炒”！,环球老虎财经
502,2021-06-18,年内最赚钱新股诞生！上市16个交易日总市值破千亿丨一只热股,第一财经
503,2021-06-18,50亿营收能撑千亿市值？股价严重背离基本面 东鹏饮料资本泡沫何时破,华夏时报
