504,2021-06-18,东鹏饮料(605499.SH)再次提示风险,智通财经
505,2021-06-18,"中一签赚22万！今年""最牛新股""来了",中国基金报
506,2021-06-18,16天涨近5倍，千亿牛股今日1分钟却遭上亿资金砸开涨停,华尔街见闻
507,2021-06-18,吃力活在红牛影子里的东鹏特饮，或许会成为脱缰的“疯牛”,凤凰网
508,2021-06-18,太疯狂了！股价暴拉14个涨停板！更有机构尾盘狂买11亿！公司连续发文提示风险！股价还能嗨多久？,雪球
509,2021-06-18,奈雪的茶上市，市值超300亿，要不要参与打新？,新浪
510,2021-06-18,A股收盘综述：沪弱深强态势明显，新能源产业链强势反包,Wind
511,2021-06-18,百龙创园：公司未和东鹏饮料有产品的合作关系,每日经济新闻
512,2021-06-18,白酒板块集体大跌超2％ 茅台“死忠粉”林园现身五粮液 连续下跌,中国基金报
513,2021-06-18,千亿大牛股16天飙涨近5倍 股民下单遭警示 其他违规处罚,中证报
514,2021-06-18,千亿牛股16天涨近5倍，1分钟上亿资金砸开涨停板,Wind
515,2021-06-18,股民下单遭警示！1分多钟上亿资金砸盘，炸开涨停板，千亿大牛股16天飙涨近5倍；芯片股爆发，券商看好两大机会,中证报
516,2021-06-18,疯涨的东鹏饮料：千亿市值撑起潮汕富豪新贵,搜狐
517,2021-06-18,市值突破千亿大关，东鹏饮料能够摆脱“高仿红牛”的标签吗？,36氪
518,2021-06-18,茅台突然大跌900亿！又一千亿巨头诞生，发生了什么,Wind
519,2021-06-18,"发生了什么？刚刚，茅台突然大跌900亿！芯片龙头继续疯狂，""最牛""汽车股拉涨停！又一千亿巨头诞生了 连续下跌",中国基金报
520,2021-06-18,机构抢筹东鹏饮料 游资打板比亚迪｜龙虎榜,第一财经
521,2021-06-18,A股午盘综述：芯片板块保持热度，金融、周期股持续下探,Wind
522,2021-06-18,又一山寨饮料逆袭？曾被视为红牛模仿者，现市值达920亿,搜狐
523,2021-06-18,16日涨近5倍，东鹏饮料彻底火了！中一签暴赚22万，5家机构罕见包揽龙虎榜,财联社
524,2021-06-18,预盈预增板块走强 东鹏饮料涨停,新浪
525,2021-06-18,斩获14个涨停板 依赖单一品牌的东鹏饮料背离基本面,GPLP犀牛财经
526,2021-06-18,第15个交易日涨停，东鹏饮料总市值突破千亿大关,第一财经
527,2021-06-18,东鹏饮料涨停 市值突破千亿元,中证网
528,2021-06-18,东鹏饮料大幅高开9.99%，市值突破千亿元大关,36氪
529,2021-06-18,东鹏饮料开盘几近涨停，总市值突破千亿大关,Wind
530,2021-06-18,中一签暴赚19万！龙虎榜机构狂砸11亿抢筹，东鹏饮料股价还能嗨多久？,证券时报
531,2021-06-18,A股早报2021年6月18日星期五,Wind
532,2021-06-18,喝下“千亿” 东鹏饮料功效还有多久？,财联社
533,2021-06-18,罕见！5家机构砸11亿抢筹，东鹏饮料还能火多久,Wind
534,2021-06-18,东北证券【提示公告】关于东鹏饮料（605499）股票交易异常波动的提示公告,东北证券金融世界
535,2021-06-18,半导体突涨机构趁机抛售 游资齐买三峡能源抢占主动,财富动力网
536,2021-06-18,东鹏饮料提示风险仍拉14连板 千亿市值在望,新浪
537,2021-06-18,罕见！5家机构狂砸11亿抢筹 东鹏饮料火了 中一签暴赚19万,券商中国
538,2021-06-17,喝下“千亿”东鹏饮料功效还有多久,财联社
539,2021-06-17,时间线丨跻身最赚钱新股Top3，5张图带你看懂东鹏饮料,第一财经
540,2021-06-17,周谈 | Weekly Talk：啤酒旺季供销两旺，饮料板块有望全面回暖,食品饮料光头阳线
541,2021-06-17,东鹏饮料终结14连板收涨5% 半个月内五次风险提示,证券日报网
542,2021-06-17,最新龙虎榜动向：8.25亿资金抢筹东鹏饮料，机构与北向资金同时卖出3股（名单）,21世纪经济报道
543,2021-06-17,东鹏饮料龙虎榜数据（6月17日）,Wind
544,2021-06-17,数据复盘｜电子行业获主力资金大幅加仓 机构抢筹东鹏饮料等股,证券时报网
545,2021-06-17,奥瑞金：公司是东鹏饮料金属包装的核心供应商，为其提供制罐及灌装一体化服务,每日经济新闻
546,2021-06-17,东鹏饮料终结十四连板收涨5%，五机构合计买入超11亿元,第一财经
547,2021-06-17,机构今日买入这18股，卖出科蓝软件9773万元丨龙虎榜,第一财经
548,2021-06-17,主力爆买15.8亿都没能买涨停明天悬了？,证券之星
549,2021-06-17,6月17日龙虎榜解析：东鹏饮料净买入额最多，还有25只个股被机构扫货,每日经济新闻
550,2021-06-17,东鹏特饮&红牛的江湖之争，加华资本宋向前：敬畏市场尊重对手,经济网
551,2021-06-17,龙虎榜：东鹏饮料再涨5% 五机构席位买入11.39亿元,e公司
552,2021-06-17,龙虎榜|东鹏饮料收涨5%五机构合计买入11.39亿元,财联社
553,2021-06-17,东鹏饮料上市后连拉14个涨停？东鹏特饮这么涨到底有多危险？,网易
554,2021-06-17,东鹏饮料市值超960亿，股权激励下会诞生多少千万富翁？,中投网
555,2021-06-17,东鹏比茅台还上头！14 连板，市值能冲破 1000 亿吗？,ZAKER
556,2021-06-17,市值逼近千亿！东鹏饮料连续 14 天涨停，这是在逼中沃上市吗？,ZAKER
557,2021-06-17,盒马X会员店进京；永辉扩张仓储店；京东控股华冠；美团买菜升仓,搜狐
558,2021-06-17,机构看中这些股 近五日大手笔净买入,证券之星
559,2021-06-17,14连板市值超900亿 东鹏饮料百倍市盈率之惑,新京报
560,2021-06-17,每日市场热点分析,新浪
561,2021-06-17,Wind风控日报2021年6月17日星期四,Wind
562,2021-06-17,中一签可赚1辆奔驰！疯狂新股连拉14个涨停，靠卖饮料真能值千亿市值？,每日经济新闻
563,2021-06-17,上市公司正负面新闻2021年6月17日星期四,Wind
564,2021-06-17,厌恶风险机构无情抛售多氟多 赵老哥偏爱短线博弈次新股,财富动力网
565,2021-06-16,东鹏饮料：“饮料黑马”还能嗨多久？,新浪
566,2021-06-16,晚间重要公告2021年6月16日星期三,Wind
567,2021-06-16,“大肉签”东鹏饮料开板又涨停，中签赚超18万。或存隐忧？,奥一网
568,2021-06-16,拉萨军团格局三峡能源，东鹏饮料明天冲击一签二十万？丨6.16龙虎榜,第一财经
569,2021-06-16,食品饮料行业研究周报：啤酒旺季供销两旺 饮料板块有望全面回暖,新浪
570,2021-06-16,十四连板东鹏饮料：公司近期股价波动较大，市盈率显着高于行业平均水平,腾讯网
571,2021-06-16,东鹏饮料龙虎榜数据（6月16日）,Wind
572,2021-06-16,涨停复盘 | 无视指数大跌 “肉签”东鹏饮料14连板,第一财经
573,2021-06-16,东鹏饮料再发风险提示：公司股票市盈率高于同行业平均水平,中新经纬
574,2021-06-16,千亿市值在望！5次风险提示难挡14连板，东鹏饮料还能涨多久？,第一财经
575,2021-06-16,2021-06-1618:13东鹏饮料日换手率达73.14%?总市值达920亿元,中证网
576,2021-06-16,万倍回报！“功能饮料第一股”实控人靠267万赚到457亿,搜狐
577,2021-06-16,每经18点|方便老年人就医，国家卫健委推出十项举措；14连板东鹏饮料再提示股价波动风险；青海海西州茫崖市发生5.8级地震,每日经济新闻
578,2021-06-16,14连板东鹏饮料：公司近期股价波动较大，注意二级市场交易风险,Wind
579,2021-06-16,广州万隆：A股大跌原因！,广州万隆
580,2021-06-16,海融科技：东鹏饮料非我司合作客户,每日经济新闻
581,2021-06-16,东鹏饮料日换手率达73.14% 一机构买入2.88亿元,e公司
582,2021-06-16,东鹏饮料涨停一机构买入2.88亿元,第一财经
583,2021-06-16,东鹏饮料、三峡能源逆势大涨，机构大手笔买入,Wind
584,2021-06-16,6月16日主力资金净流出507亿元,证券时报网
585,2021-06-16,今日这些个股异动 主力资金青睐能源、抛售汽车,第一财经
586,2021-06-16,A股资金流向（6月16日）：资金大幅撤离新能源产业链龙头,Wind
587,2021-06-16,主力动向｜36股主力买入超亿元！东鹏饮料、伊利股份、飞利信、中国化学、美的集团位居前五！,上游新闻
588,2021-06-16,“东茅”搅翻A股：林木勤家族财富暴增600多亿，加华资本捡漏,融资中国
589,2021-06-16,李志林丨创业板科创板齐大跌，大盘考验3498点缺口,中金在线
590,2021-06-16,A股收盘综述：新能源产业链批量跌停，创业板指下挫逾4%,Wind
591,2021-06-16,“中国红牛”14天14板！5次风险提示难挡涨停，“醒着拼”的东鹏饮料即将拼下千亿市值！,中国财富网
592,2021-06-16,创业板暴跌 锂电池板块跌停潮 半导体板块暴拉 机构：短期市场缺乏上攻动能 连续下跌,新浪
593,2021-06-16,什么情况？创业板暴跌，锂电池板块掀跌停潮！这一板块却暴拉…港股最赚钱新股？时代天使中一签大赚6万港元 连续下跌,证券时报
594,2021-06-16,发生了什么？创业板大跌，2000亿锂电双巨头跌停,Wind
595,2021-06-16,解盘：题材股分化，大基建、半导体、乡村振兴、IGBT略涨,Wind
596,2021-06-16,A股午盘综述：新能源板块集体遭遇杀跌,Wind
597,2021-06-16,东鹏饮料主动在6月15日晚间发布公告提示风险,中投网
598,2021-06-16,连续警示股价严重背离基本面，13连板后东鹏饮料今日打开涨停,第一财经
599,2021-06-16,人气股东鹏饮料主动提示风险：股价严重偏离基本面,中金在线
600,2021-06-16,东鹏饮料再度涨停，收获14连板，换手率超60%,金融界
601,2021-06-16,东鹏饮料距离成为“中国的红牛”还有多远？花式营销 收入结构单一,发现网
602,2021-06-16,14连板！东鹏饮料再度涨停 中一签新股大赚超18万元,第一财经
603,2021-06-16,东鹏饮料股价触及涨停收获14连板,第一财经
604,2021-06-16,东鹏饮料快速走高，股价触及涨停,Wind
605,2021-06-16,东鹏饮料盘中再度逼近涨停,e公司
606,2021-06-16,东鹏饮料打开一字涨停累计上涨351.70%,证券时报网
607,2021-06-16,东鹏饮料打开涨停 此前收获13连板,新浪
608,2021-06-16,东鹏饮料上市第14个交易日打开涨停,Wind
609,2021-06-16,功率半导体新一轮涨价潮来袭，A股潜在受益股名单,Wind
610,2021-06-16,A股早报2021年6月16日星期三,Wind
611,2021-06-16,股市动态 | 财经早资讯：华林证券高管变动引关注；东鹏饮料13连板提示风险,财经网
612,2021-06-16,功率半导体巨头酝酿大提价 A股潜在受益股名单出炉,证券时报
613,2021-06-16,【民生证券研究院】晨会纪要20210616,MS研究
614,2021-06-16,功率半导体新一轮涨价潮来袭，A股潜在受益股名单,证券时报网
615,2021-06-16,大资金慌了！连续涨停后 人气股突发公告 什么情况？,中财网
616,2021-06-16,东兴大消费：端午出游基本恢复至疫情前 关注大众消费复苏,新浪
617,2021-06-16,多家券商发布下半年投资策略，两大关键词被反复提及,Wind
618,2021-06-16,多家券商发布下半年投资策略 两大关键词被反复提及,证券时报
619,2021-06-15,东鹏饮料十三连涨停、股价破两百，发公告自称严重背离基本面,南都报
620,2021-06-15,中一签盈利16.28万！东鹏饮料斩获13连板后五大风险提示来了,上游新闻
621,2021-06-15,两极分化：特饮新贵东鹏饮料一签怒赚16万元 游资抢筹天地板次新股,财联社
622,2021-06-15,东鹏饮料斩获十三连板，再度提示风险：股价已严重背离基本面,第一财经
623,2021-06-15,13个涨停板，东鹏饮料：目前股价已严重背离公司基本面情况,e公司
624,2021-06-15,千亿市值在望！东鹏饮料13个一字涨停能量大爆发，距离成为“中国的红牛”还有多远？,21世纪经济报道
625,2021-06-15,十三连板东鹏饮料(605499.SH)：公司面临产品结构相对单一的风险 经营问题,智通财经
626,2021-06-15,连获13个“涨停板” 东鹏饮料提示风险,e公司
627,2021-06-15,十三连板东鹏饮料：目前股价已严重背离基本面情况,财联社
628,2021-06-15,东鹏饮料：公司目前股票价格已严重背离公司基本面情况，也显着高于行业平均水平,新浪
629,2021-06-15,东鹏饮料：公司股票价格已严重背离基本面，存在估值较高的风险,36氪
630,2021-06-15,“大肉签”东鹏饮料13连板，再次提示股票交易风险,Wind
631,2021-06-15,“大肉签”东鹏饮料中一签大赚16万元 无锡振华却一度上演天地板,上证报
632,2021-06-15,“大肉签”东鹏饮料中一签大赚16万元，这只次新股却一度上演天地板！,中国证券网
633,2021-06-15,东鹏饮料：上市20天连获13个“涨停板” 公司提示四大风险,新浪
634,2021-06-15,资本一跃，东鹏特饮失去黄金时代,36氪
635,2021-06-15,主力出逃超400亿：砸盘有色龙头股 扫货24股超亿元,新浪
636,2021-06-15,东鹏饮料一字板继续 东鹏饮料继续一字涨停,至诚财经
637,2021-06-15,6月15日主力资金净流出403亿元,证券时报网
638,2021-06-15,连员工宿舍都卖了？突发两大利空！500亿巨头直线暴跌！万亿保险龙头、千亿房企龙头再创新低，还能继续补仓吗？ 连续下跌,雪球
639,2021-06-15,A股资金流向（6月15日）：主板两只新股疯狂“吸金”,Wind
640,2021-06-15,67只股涨停最大封单资金28.23亿元,证券时报网
641,2021-06-15,多项财务指标刷新行业记录，13连板的东鹏饮料股市“不困”,21世纪经济报道
642,2021-06-15,ST加加：公司间接持有东鹏饮料0.543%的股份,Wind
643,2021-06-15,60万股民懵了！700亿巨头闪崩跌停！有色钢铁大跌,Wind
644,2021-06-15,超级干货！下半年市场潜力板块和牛股来了，机构最新投资策略曝光，最看好的股票都在这里（附全名单）,e公司
645,2021-06-15,47只股上午收盘涨停(附股),证券时报网
646,2021-06-15,上市12个交易日股价翻三倍，东鹏饮料业绩创新高,投资者网
647,2021-06-15,【预见】上市十二连板的东鹏饮料，在股市真的不会困？,财华社
648,2021-06-15,东鹏饮料 13 个一字涨停！单签盈利近 16 万 本周还有“肉签”上市,ZAKER
649,2021-06-15,国泰君安晨报,新浪
650,2021-06-15,【方正食饮210615】小酒情绪退潮，坚守行业长线趋势,虎哥的研究
651,2021-06-15,东鹏饮料(605499.SH)连续13日涨停市值超800亿公司提示风险,格隆汇
652,2021-06-15,本周A股将有10只新股申购,金融投资报
653,2021-06-15,大肉签又来？就在今日！近期多只10w+新股，本周疫苗、芯片新股全都有…（附新股申购日历）,证券时报
654,2021-06-15,晨报0615 | 宏观专题、A股策略专题、东鹏饮料（605499）、陕鼓动力（601369）、极米科技（688696）,国泰君安证券研究
655,2021-06-15,"""功能性饮料第一股""东鹏饮料上市 多项财务指标刷新行业记录",投资者网
656,2021-06-15,陆家嘴财经早餐2021年6月15日星期二,Wind
657,2021-06-15,东鹏饮料本周挑战1签20万，有望成年内最赚钱新股,Wind
658,2021-06-15,东鹏饮料本周挑战1签20万，成有望年内最赚钱新股,格隆汇
659,2021-06-15,一签狂赚20万？又有新股大肉签，疫苗股、芯片股都来了！,中国基金报
660,2021-06-14,天风证券首予东鹏饮料增持评级：精准卡位功能饮料赛道，上市为全国化腾飞插上翅膀,每日经济新闻
661,2021-06-14,一签赚10万，一周俩肉签！明天机会又来了,中证报
662,2021-06-14,【开源食饮】白酒持续看好，调味品等待时机——行业周报,宇光看食饮
663,2021-06-14,首席消费官周报：麦当劳确认数据遭泄露 东鹏饮料提示若干风险 安全事故,GPLP犀牛财经
664,2021-06-14,借鉴怪物饮料(MNST.US)，探东鹏饮料(605499.SH)等中国能量饮料发展空间,智通财经
665,2021-06-13,华为鸿蒙加码，座舱智能化引发交互革命丨一周重点研究报告,开源证券研究所
666,2021-06-12,犀牛财经日报：BOSS直聘登陆美股1571辆保时捷将被召回 产品问题,GPLP犀牛财经
667,2021-06-12,上市公司正负面新闻2021年6月12日星期六,Wind
668,2021-06-12,每日市场热点分析,新浪
669,2021-06-11,晚间重要公告2021年6月11日星期五,Wind
670,2021-06-11,每经20点 |广东佛山全市餐饮场所暂停堂食；东鹏饮料：面临产品结构相对单一、销售区域较为集中及新产品推广不及预期等风险,每日经济新闻
671,2021-06-11,东鹏饮料：相对单一的产品结构使公司经营业绩对能量饮料销售依赖较高 经营问题,Wind
672,2021-06-11,交易异动！东鹏饮料：近3个交易日上涨33.1%，无未披露的重大信息,每日经济新闻
673,2021-06-11,东鹏饮料(605499.SH)股价异动 面临产品结构相对单一等风险 经营问题,智通财经
674,2021-06-11,东鹏饮料(605499.SH)提示若干风险：产品结构相对单一、销售区域较为集中及新产品推广不及预期等风险 经营问题,格隆汇
675,2021-06-11,东鹏饮料龙虎榜数据(6月11日）,Wind
676,2021-06-11,主力资金：主力紧急抢筹两只白马股 买入资金超17亿元,新浪
677,2021-06-11,东鹏饮料：目前，“累了困了，喝东鹏特饮”、“年轻就要醒着拼”都是公司的slogan,每日经济新闻
678,2021-06-11,6月11日主力资金净流出421亿元,证券时报网
679,2021-06-11,信达证券：东鹏饮料（605499.SH）行业创新先行者，专注性价比优势，首予“买入”评级,智通财经
680,2021-06-11,88只股涨停最大封单资金49.35亿元,证券时报网
681,2021-06-11,东鹏饮料上市接连录得12个涨停，这家机构赚了60亿,投中网
682,2021-06-11,东鹏饮料的核心战场：能量饮料真的存在增量吗？,亿邦动力
683,2021-06-11,百元股数量达163只，一日增加5只,证券时报网
684,2021-06-10,【机构风向标】20股获多家机构“买入”评级，10股看涨空间超20%,证券时报网
685,2021-06-10,6月10日主力资金净流出105亿元,证券时报网
686,2021-06-10,IPO收紧还是放松？一文看清,Wind
687,2021-06-10,91只股涨停最大封单资金50.53亿元,证券时报网
688,2021-06-10,59只股上午收盘涨停(附股),证券时报网
689,2021-06-10,东鹏饮料3.2亿元闲置自有资金购买理财产品,中国经济网
690,2021-06-09,东鹏饮料成今年主板第一“肉签” 新股行情来了？,第一财经
691,2021-06-09,突发！中国恒大宣布还钱，股价直线拉升！,证券之星
692,2021-06-09,上市后狂拉10个涨停，东鹏饮料还能“浪”多久？,格隆汇
693,2021-06-09,主力资金：主力悄悄出逃大热门股 卖出资金13亿元,新浪
694,2021-06-09,中一签暴赚11万、东鹏饮料10连板 本周还有8只新股可打,券商中国
695,2021-06-09,股市动态 | 周期股强势归来，二三线白酒企稳回升，东鹏特饮十连板,财经网
696,2021-06-09,疯了！一则消息，这家公司午后突然暴拉！投资者们嗨了，高呼永远的神！成交额飙至两市第一，还能上车吗？,雪球
697,2021-06-09,A股资金流向（6月9日）：券商龙头遭抛售,Wind
698,2021-06-09,95只股涨停最大封单资金47.92亿元,证券时报网
699,2021-06-09,新股行情火爆！中一签赚超11万！钛白粉、煤炭板块爆发这只近期牛股却惨遭跌停,证券时报
700,2021-06-09,中一签暴赚超11万，东鹏饮料实控人身家飙至380亿！,上游新闻
701,2021-06-09,“东茅”搅翻A股：林木勤家族财富暴增600多亿，加华资本捡漏,36氪
702,2021-06-09,火爆！中一签赚超11万，本周还有8只新股可申购！钛白粉、煤炭板块集体爆发,证券时报
703,2021-06-09,刚刚，广州通报：4岁和5岁儿童感染！防控关键阶段，张文宏重磅发声！煤炭股集体暴涨，暴赚11万大肉签来了，实控人身家飙至380亿！,中国基金报
704,2021-06-09,刚刚，中一签爆赚11万！东鹏饮料连续10涨停，这家人身家直逼400亿！白酒股也绝地反击？,e公司
705,2021-06-09,东鹏饮料总市值超600亿元,北京商报网
706,2021-06-09,东鹏饮料总市值突破600亿元，中一签可赚11万元,第一财经
707,2021-06-09,机构五日抢筹12股 主力资金大量流入,证券时报网
708,2021-06-09,东鹏饮料开盘再度涨停 收获上市以来连续第十个涨停,e公司
709,2021-06-09,新股东鹏饮料连续10日涨停，总市值突破600亿元,Wind
710,2021-06-09,每日市场热点分析,新浪
711,2021-06-09,新股大爆发！刚有一签赚14万，今天或见10万大肉签,Wind
712,2021-06-09,【晨观方正】宏观/家电/电新/环保/科技&电子/食品饮料/建材建筑 20210609,新浪
713,2021-06-08,日常消费行业阿里线上月报：5月膳食营养补充剂／纯牛奶／饮料行业表现较好,新浪
714,2021-06-08,交易异动！东鹏饮料：不存在影响公司股票交易价格异常波动的重大事宜,每日经济新闻
715,2021-06-08,东鹏饮料(605499.SH)股价异动 不存在应披露而未披露信息,智通财经
716,2021-06-08,96只股涨停最大封单资金39.57亿元,证券时报网
717,2021-06-08,东鹏饮料(605499)：能量饮料风头正盛 东鹏特饮振翅高飞,新浪
718,2021-06-08,中信证券：东鹏饮料快速崛起的能量饮料龙头，后起之秀空间巨大,证券时报网
719,2021-06-08,周谈 | Weekly Talk：啤酒旺季动销有望超预期，食品配料迎来春天,食品饮料光头阳线
720,2021-06-08,又有“大肉签”诞生，中一签暴赚14万元！,Wind
721,2021-06-08,又有“大肉签”诞生，中一签暴赚14万元！东鹏饮料也可赚近10万元,中国证券网
722,2021-06-08,东鹏饮料(605499.SH)连续第9日涨停 市值571亿元,格隆汇
723,2021-06-08,券商首次关注4股并给予买入评级（6月8日）,Wind
724,2021-06-08,两市百元股数量达159只，科创板股票占38.36%,证券时报网
725,2021-06-08,26股获券商买入评级，伊利股份目标涨幅达59.19%,Wind
726,2021-06-08,中信证券：给予东鹏饮料目标价170元 “买入”评级,e公司
727,2021-06-08,东鹏饮料（605499）：大鹏乘风，扶摇万里,中信证券研究
728,2021-06-08,东鹏饮料林木勤：深耕能量饮料赛道,长江商报
729,2021-06-07,东鹏饮料(605499.SH)注册资本增加至4亿元,智通财经
730,2021-06-07,东鹏饮料：聘王皓星为证代,每日经济新闻
731,2021-06-07,东鹏饮料(605499.SH)聘请王皓星担任证券事务代表,智通财经
732,2021-06-07,食品行业周报：《推动四川白酒产业高质量发展的若干措施》审议通过,新浪
733,2021-06-07,东方证券首予东鹏饮料买入评级：能量饮料风头正盛，东鹏特饮振翅高飞,每日经济新闻
734,2021-06-07,17股今日获机构买入评级5股上涨空间超10%,证券时报网
735,2021-06-07,涨停板解密：火爆上攻，三板块个股遭资金抢筹！（6月7日）,Wind
736,2021-06-07,113只股涨停最大封单资金40.39亿元,证券时报网
737,2021-06-07,东方证券：东鹏饮料（605499.SH）深耕能量饮料行业，首予“买入”评级,智通财经
738,2021-06-07,75只股上午收盘涨停(附股),证券时报网
739,2021-06-07,东鹏饮料(605499.SH)连续第八日涨停市值超500亿元,格隆汇
740,2021-06-07,【方正食饮210607】小酒热度继续扩散，板块短期还看情绪催化,虎哥的研究
741,2021-06-07,16股获券商买入评级，中芯国际目标涨幅达49.26%,Wind
742,2021-06-06,冲击500亿，东鹏特饮会成为下一个农夫山泉吗？,钛媒体
743,2021-06-06,【开源食饮】能量饮料赛道优质，三孩政策提升奶粉预期畅——行业周报,宇光看食饮
744,2021-06-06,东鹏饮料冲击一签赚十万，易中签新股又来了！,Wind
745,2021-06-06,一签赚十万，“功能饮料第一股”还差3个板！下周，容易中签的新股又来了,中证报
746,2021-06-06,三年耗资11亿打广告 股市连嗨七天何时醒？东鹏饮料能否撑起472亿市值,华夏时报
747,2021-06-05,近期券商研报力推这些股票，最高有144%上涨空间,Wind
748,2021-06-05,食品饮料行业2021年中期投资策略报告：景气持续向上 享受高端化趋势,新浪
749,2021-06-05,七连板！仅靠一款产品，东鹏饮料能撑得住472亿市值吗？,奥一网
750,2021-06-05,券商首次关注6股并给予买入评级（6月5日）,Wind
751,2021-06-04,国海证券首予东鹏饮料买入评级，深度报告：能量饮料趁势起，鹏城新星看东鹏,每日经济新闻
752,2021-06-04,国海证券：东鹏饮料（605499.SH）能量饮料龙二，业绩增长亮眼，首予“买入”评级,智通财经
753,2021-06-04,东鹏饮料(605499)新股分析：恒心积跬步 突围能量圈,新浪
754,2021-06-04,【招商食品 | 深度】东鹏饮料：恒心积跬步，突围能量圈,招商食品饮料
755,2021-06-04,78只股涨停最大封单资金36.14亿元,证券时报网
756,2021-06-04,那个差点破产的企业被他重新做上市了,--
757,2021-06-04,49只股上午收盘涨停(附股),证券时报网
758,2021-06-04,东鹏饮料(605499.SH)连续第七日涨停 市值472亿元,格隆汇
759,2021-06-04,饮料制造板块集体大涨，东鹏饮料封涨停,第一财经
760,2021-06-04,每日市场热点分析,新浪
