1442,2020-08-12,中国人保(601319.SH)：年报推10派1.16元股权登记日8月20日,格隆汇
1443,2020-08-12,中国人保公布三家子公司前七月原保险保费收入情况,资本邦
1444,2020-08-12,中国人保前7月保费3709.42亿 寿险业务同比下滑4.99% 盈利能力下降,中国经济网
1445,2020-08-12,每日理财观察：回购定盘利率全线上涨，万能险业务面临调整,Wind
1446,2020-08-11,格隆汇港股聚焦(8.11)︱中国人保前7月保费收入3709亿元舜宇7月手机镜头出货量同比增25%,格隆汇
1447,2020-08-11,中国人保前7月保费收入同比增长4.24%,上证报
1448,2020-08-11,晚间重要公告2020年8月11日星期二,Wind
1449,2020-08-11,中国人保:2020年前7月健康险保费收入235.79亿元 同比增45.5%,新浪
1450,2020-08-11,8月11日晚间上市公司十大重磅公告,巨丰财经
1451,2020-08-11,中国人保：前7月健康险保费收入同比大增45.5%,网易
1452,2020-08-11,中国人保(601319.SH)1-7月原保费收入3709.42亿元同比增长4.24%,格隆汇
1453,2020-08-11,中国人保：前7月保费收入3709.42亿元,Wind
1454,2020-08-11,中国人保今年迄今累计财产保险保费收入2766亿元人民币,金十数据
1455,2020-08-11,人保健康南昌中支违法总经理遭罚 虚构业务套取费用 其他违规处罚,中国经济网
1456,2020-08-10,因欺骗保险人等多项违规行为，人保健康下属两公司受罚90余万 金融监管处罚,搜狐
1457,2020-08-10,人保健康南昌中支4宗违法遭罚 唆使代理人违背诚信 其他违规处罚,中国经济网
1458,2020-08-10,人保健康江西5宗违法遭罚 欺骗投保人及阻碍接受回访 其他违规处罚,中国经济网
1459,2020-08-08,证监会发布公募REITs指引 盘活基础设施存量资产,21世纪经济报道
1460,2020-08-06,五大险企上半年净利润增速料承压 盈利能力下降,Wind
1461,2020-08-05,【东吴七点半】指数全天分化震荡 大金融板块领涨（08.05）,东吴财经通
1462,2020-08-05,每日理财观察：现货黄金突破2000美元关口,Wind
1463,2020-08-04,未央今日播报：央行部署下半年重点工作8家银行携手谷歌推出数字银行账户,搜狐
1464,2020-08-04,港股午后爆拉恒指收涨2%，香港本地股全线反弹,Wind
1465,2020-08-04,中国人保：人保财险拥有国内航天保险市场份额的70%,Wind
1466,2020-08-04,中国人保：人保财险拥有国内航天保险市场份额的70%,e公司
1467,2020-08-04,“去中介”行不行？保险中介转变价值创造方式迫在眉睫,Wind
1468,2020-08-04,保险“去中介”行不行？中介转变价值创造方式迫在眉睫,21世纪经济报道
1469,2020-08-03,中国人保参与蚂蚁金服两轮融资，持股比例0.5445%,老虎证券
1470,2020-08-03,中国人保：目前持有蚂蚁金服0.5445%的股份,Wind
1471,2020-08-03,中国人保：目前持有蚂蚁金服0.5445%的股份,e公司
1472,2020-07-31,保险行业点评：6月保费环比改善明显 产品升级聚焦价值增长,新浪
1473,2020-07-30,【权益变动】中国人保(01339-HK)被美国资本集团减持1520.9万股 减持股份,财华社
1474,2020-07-29,美国资本集团减持中国人保(01339)1520.9万股，每股作价2.488港元 减持股份,智通财经
1475,2020-07-29,保险行业2020年1至6月概况：保费增长持续修复 资金运用保持平稳,新浪
1476,2020-07-27,AH溢价率两倍多！投资者喊话中国人保管理层：想想办法,中国证券网
1477,2020-07-27,平安、国寿上榜2020年《财富》中国500强前十；青岛银保监局打击汽车4S店强制搭售保险丨慧保日报7.27,搜狐
1478,2020-07-27,人保财险兰州内部员工骗保险金 分公司老总等4人遭罚,中国经济网
1479,2020-07-27,【长城非银】非银金融板块继续减仓，需保持定力 ——公募基金2020年二季度持仓点评,强思非银
1480,2020-07-27,中国人保王廷科担任总裁任职资格获得银保监会批复,资本邦
1481,2020-07-27,中国人保：公司H股股价已背离基本面被显著低估,格隆汇
1482,2020-07-26,王廷科履新中国人保总裁 未来挑战几何？,新浪
1483,2020-07-26,非银金融行业本周聚焦：券商Q2经营业绩向好 关注大金融板块“超低持仓”下的投资机会,新浪
1484,2020-07-24,李祝用获批出任中国人保董事会秘书,新浪
1485,2020-07-24,王廷科获批任中国人保总裁,上证报
1486,2020-07-24,中国人保集团王廷科总裁任职资格获批,中国金融新闻网
1487,2020-07-24,中国人保(601319.SH)：王廷科总裁任职资格获中国银保监会核准,格隆汇
1488,2020-07-24,中国人保为我国首个火星探测器研制团队提供保险服务,证券时报网
1489,2020-07-24,中国人保多事之秋：旗下子公司屡陷纠纷 舵手辞别中兴谁解？,新浪
1490,2020-07-24,内险股普跌 中国人保被高盛降评级跌1%众安保险跌6%,新浪
1491,2020-07-23,【兴证金融 傅慧芳】基金减仓保险0.58pcts，低配比例继续扩大——基金2020年二季度保险持仓分析,兴证金融
1492,2020-07-23,中国人保半年工作会：力争高质量完成全年各项目标任务,证券时报网
1493,2020-07-23,中国人保：推进“去中介、降成本”，加大直销队伍建设,21世纪经济报道
1494,2020-07-23,基金2020年二季度保险持仓分析：基金减仓保险0.58PCTS 低配比例继续扩大,新浪
1495,2020-07-23,中国人保：上半年集团利润总额保持两位数增长,中国网
1496,2020-07-23,五大上市险企下月底发布半年报 券商预测利润分化大,证券日报
1497,2020-07-23,金融行业：行业配置已至冰点 建议增持非银板块,新浪
1498,2020-07-23,大幅上调权益投资比例上限后：险资情绪“稳定”对市场波动不盲从,Wind
1499,2020-07-23,大幅上调权益投资比例上限后： 险资情绪“稳定” 对市场波动不盲从,21世纪经济报道
1500,2020-07-22,重磅！这家近8万亿明星股份行换帅！ 保险老将跨界履新，缪建民掌舵招行,和讯
1501,2020-07-22,蚂蚁金服指数午盘涨1.4%，财通证券获主力净流入7.4亿元,Wind
1502,2020-07-22,转型深处人保集团换帅，保险巨头面临的变革挑战 董监高成员变化,搜狐
1503,2020-07-22,势板块分析：医药板块走势强劲 阿里概念股活跃,证券时报网
1504,2020-07-21,“蚂蚁”金服长成万亿巨无霸，谁将分享这场IPO盛宴,第一财经
1505,2020-07-21,史上最大造富运动！蚂蚁集团上市，哪些公司受益,证券时报网
1506,2020-07-20,百胜中国成为北京2022年冬奥会和冬残奥会官方餐饮服务赞助商,Wind
1507,2020-07-20,非银行金融行业周报：行业出清加速 并购重组势在必行,光大证券
1508,2020-07-20,牛市归来！A股狂拉2.6%，中芯国际却“崩了”,中国基金报
1509,2020-07-20,解盘：超百亿资金流入，基建、军工、券商、乡村振兴领涨,Wind
1510,2020-07-20,A股午盘综述：上证指数大涨2.62%，逼近3300点,Wind
1511,2020-07-20,【行情】保险股走强，中国人寿拉升封板，新华保险、天茂集团、中国人保等涨逾7%,金十数据
1512,2020-07-20,【长城非银】险企权益类投资空间释放，发挥长期资金稳定器作用—《关于优化保险公司权益类资产配置监管有关事项的通知》等政策的专题评析,强思非银
1513,2020-07-19,【国君非银】差异化监管权益类投资，利好龙头险企——保险公司权益类资产配置通知点评,欣琦看金融
1514,2020-07-18,稳住！险资带着长线资金赶来了,Wind
1515,2020-07-18,A股“千亿俱乐部”，北京、广东各晋9家占鳌头,Wind
1516,2020-07-18,上半年寿险保费增速分化明显,南方财经网
1517,2020-07-17,利好！部分险资配置权益类资产比例最高可增至上季末总资产的45%,21世纪经济报道
1518,2020-07-17,中国人保(601319.SH)：李祝用董秘任职资格获银保监会核准,格隆汇
1519,2020-07-17,美国资本集团近期集中买卖中国人保H股,证券时报网
1520,2020-07-17,中国人保：拟适时适当提高分红比例将首次实施中期分红,中证报
1521,2020-07-17,近40家保险机构“掌门”换岗，市场化招募明星高管战队,Wind
1522,2020-07-17,A股全线重挫，221家企业跌停，这些险企7月累计涨幅仍超30％ 连续下跌,腾讯网
1523,2020-07-16,A股五大险企上半年揽1.52万亿原保费收入同比增长6.56%,中国网
1524,2020-07-16,图说2020年6月上市险企保费数据及投资建议：负债端延续弱复苏态势 车险改革推进短期承压,新浪
1525,2020-07-16,中国人保(01339-HK)：缪建民辞任执行董事及董事长 董监高成员变化,财华社
1526,2020-07-16,【长城非银】负债端延续弱复苏态势，车险改革推进短期承压——图说2020年6月上市险企保费数据及投资建议,强思非银
1527,2020-07-16,昨日保险板块略微上涨0.09%，西水股份和中国人保上涨,资本邦
1528,2020-07-16,内险股普涨 新华保险上涨3%中国人保上升2%,新浪
1529,2020-07-16,缪建民辞别 人保集团下一步将向何方,和讯
1530,2020-07-16,缪建民辞别 人保集团下一步将向何方,中国经营网
1531,2020-07-16,每日理财观察：首批科创板50ETF又有新进展，银保信业务合作不规范被监管通报,Wind
1532,2020-07-16,财富早知道 | 房价要跌了？史上最严调控政策出台,中国财富网
1533,2020-07-16,5大险企半年揽1.5万亿:寿险增速分化 财险增速人保掉队,中国经济网
1534,2020-07-16,上市公司正负面新闻2020年7月16日星期四,Wind
1535,2020-07-15,7月16日上市公司重要公告集锦：渤海租赁上半年预亏18亿元-27亿元,证券日报
1536,2020-07-15,（上市公司人事）中国人保董事长缪建民辞任,中国经济网
1537,2020-07-15,晚间重要公告2020年7月15日星期三,Wind
1538,2020-07-15,中国人保：董事长缪建民辞职，辞任自7月15日起生效 董监高成员变化,21世纪经济报道
1539,2020-07-15,缪建民辞任中国人保董事长 董监高成员变化,上证报
1540,2020-07-15,中国人保：董事长缪建民因工作调动辞职 董监高成员变化,Wind
1541,2020-07-15,中国人保(601319.SH)：缪建民因工作调动辞去执行董事、董事长等职 董监高成员变化,格隆汇
1542,2020-07-15,五大险企半年入账1.5万亿！保险股的买点到了吗,Wind
1543,2020-07-15,这个险种爆发了，五大险企半年入账1.5万亿！保险股的买点到了吗,中证报
1544,2020-07-15,站在3400点关口 保险股涨得怎么样？,金融界
1545,2020-07-15,【权益变动】中国人保(01339-HK)获美国资本集团增持4190.3万股,财华社
1546,2020-07-15,【权益变动】中国人保(01339-HK)被摩根大通减持约2.799亿股 减持股份,财华社
1547,2020-07-15,五上市险企上半年揽1.52万亿保费，券商：保险股估值仍有修复动力,云掌财经
1548,2020-07-15,【国君非银】半年冲刺促进保费增长，板块迎来“戴维斯双击”——2020年6月上市险企保费数据点评,欣琦看金融
1549,2020-07-15,上半年入账1.52万亿元，五大上市险企保费同比增长6.3%,Wind
1550,2020-07-14,美国资本集团减持中国人保(01339)1.46亿股，每股作价3港元 减持股份,智通财经
1551,2020-07-14,中国人保前6月累计原保费收入3350.45亿元，同比增4.25%,资本邦
1552,2020-07-14,高位减持银行保险股!A股市场情绪高涨大股东为何离场? 减持股份,新浪
1553,2020-07-14,【权益变动】中国人保(01339-HK)被美国资本集团减持约1.46亿股 减持股份,财华社
1554,2020-07-14,友邦保险首次遭国际大行下调目标价 对A股保险板块有何影响？ 机构下调估值,券商中国
1555,2020-07-14,港股公告精选：中国人保上半年原保险保费收入增4.3%至3350.45亿元,Wind
1556,2020-07-14,3400点之上，这四个消息要重视,Wind
1557,2020-07-14,突发！北京国资减持大牛股王府井 2个月暴涨500%！ 减持股份,中国基金报
1558,2020-07-14,机构：A股短期谨慎中长期向好,Wind
1559,2020-07-13,中国人保上半年保费3350亿：财险增速掉队 寿险下滑5%,中国经济网
1560,2020-07-13,突发！北京国资减持大牛股，2个月暴涨500%！ 减持股份,中国基金报
1561,2020-07-13,中国人保(01339-HK)首六个月总保费收入为人民币3350.45亿元,财华社
1562,2020-07-13,中国人保(601319.SH)：上半年原保费收入3350.45亿元同比增4.25%,格隆汇
1563,2020-07-13,中国人保：上半年保费收入合计3350.45亿元,格隆汇
1564,2020-07-13,中国人保：1-6月子公司所获得的原保险保费收入合计3350亿元,Wind
1565,2020-07-13,保险行业2020年中报业绩前瞻：无风险利率下行、国债利率上行，全面利好保险，维持“增持”评级,国泰君安
1566,2020-07-13,驻中国人保纪检监察组：加强内部监督管理，坚决防止人员外逃、资金外流,每日经济新闻
1567,2020-07-13,港股盘前必读：伦敦基本金属普涨，7月18日深港通–创业板改革演习,Wind
1568,2020-07-13,机构：A股短期谨慎中长期向好,证券日报
1569,2020-07-13,【国君非银】无风险利率下行、国债利率上行，全面利好保险——保险行业2020年中报业绩前瞻,欣琦看金融
1570,2020-07-12,中国人保带领金融股集体降温 接下来按兵不动还是调整策略？,21世纪经济报道
1571,2020-07-12,A股降温调整，科技股蓄能会否卷土重来？,Wind
1572,2020-07-12,震惊A股！超3000亿大减持：银证保三龙头罕见齐遭抛售，大基金又卖6倍牛股，昔日 “股神”也出手了！他们不相信牛市？ 减持股份,中国基金报
1573,2020-07-12,7天减持超350亿！牛市情绪下减持潮汹涌,Wind
1574,2020-07-12,套现3000亿！A股的重要股东，不相信牛市,中国基金报
1575,2020-07-11,中国股市，这个周末不安静，“变盘”或在下周？值得警惕！,搜狐
1576,2020-07-11,7月10日复盘笔记：市场情绪降温 外资净流出超40亿,新浪
1577,2020-07-11,陆家嘴财经早餐2020年7月11日星期六,Wind
1578,2020-07-10,“3411工程”两周年:缪建民挥别人保 “3411工程”后半场谁来坚守,中国经济网
1579,2020-07-10,减持、套现3117亿！A股的重要股东们，不相信牛市 减持股份,全景网
1580,2020-07-10,半日蒸发1500亿，国家队疯狂减持？别慌，牛市依旧强劲！ 减持股份,搜狐
1581,2020-07-10,内资保险股下挫，中国人保中国人寿跳水大跌超4% 连续下跌,腾讯网
1582,2020-07-10,招商局集团换帅 中国人保董事长缪建民接任李建红 董监高成员变化,中国经济网
1583,2020-07-10,缪建民辞别中国人保 赴任招商局集团董事长 董监高成员变化,证券日报
1584,2020-07-10,挥别中国人保 缪建民赴招商局任董事长,经济观察网
1585,2020-07-10,社保减持突袭，A股火速降温！ 减持股份,第一财经
1586,2020-07-10,港股午后下挫恒指跌超2% 大金融杀跌中国人保大跌9%光大证券跌10%,腾讯网
1587,2020-07-10,辞别人保，缪建民赴任招商局董事长！从1万亿金融央企到9万亿实业央企，有何不同？,券商中国
1588,2020-07-10,人保财险宁波市分公司2宗违法遭罚 虚构保险中介业务 金融监管处罚,中国经济网
1589,2020-07-10,主力资金出手减持沪指失守3400、两市翻绿 减持股份,中新经纬
1590,2020-07-10,55岁中国人保集团董事长缪建民调任招商局集团董事长,澎湃新闻
1591,2020-07-10,招商局集团换帅 李建红卸任缪建民接任董事长 董监高成员变化,21世纪经济报道
1592,2020-07-10,大金融高位熄火 券商股该嫌“贵”了么？,中投网
1593,2020-07-10,港股收盘：恒生指数盘中一度跌超2% 中资券商、内险股领跌,英为财情
1594,2020-07-10,减持消息冲击市场 人保市值缩水270亿 减持股份,21世纪经济报道
1595,2020-07-10,中国人保：公司职工代表监事辞职及选举职工代表监事 董监高成员变化,Wind
1596,2020-07-10,整体调整！市场出现避险情绪，医疗板块再次领涨,Wind
1597,2020-07-10,恒指低开低走收跌1.84%，保险股领跌蓝筹,Wind
1598,2020-07-10,频频遭减持，保险股“不香”了吗？ 减持股份,腾讯网
1599,2020-07-10,A股收盘：上证指数跌约2% 结束8连涨 两市成交量再超1.5万亿,英为财情
1600,2020-07-10,内险股捱沽 中国人寿跌幅扩至逾7%中国人保下跌9%,新浪
1601,2020-07-10,A股收盘综述：创业板指周涨12.83%，创历史最大单周涨幅,Wind
1602,2020-07-10,【港股通】遭社保基金减持 中国人保跌逾8% 减持股份,凤凰网
1603,2020-07-10,【异动股】保险板块下挫，中国人保(601319-CN)跌6.79%,财华社
1604,2020-07-10,“国家队”对4家公司抛百亿减持，A股降温 减持股份,观察者网
1605,2020-07-10,疯牛刹车？爆买600亿后，“聪明资金”突然掉头,中国基金报
1606,2020-07-10,一夜减持逾150亿！国家队集体出货，光大证券遭卖出30亿 减持股份,搜狐
1607,2020-07-10,金融股高位熄火 医疗器械板块逆势上扬,新浪
1608,2020-07-10,真的降温了！中国人寿、中国人保早盘跳水,21世纪经济报道
1609,2020-07-10,中国人保首席承保的亚太6D卫星发射成功,金融界
1610,2020-07-10,A股异动：受社保基金减持影响，中国人保跌近6%，领跌保险板块 减持股份,英为财情
1611,2020-07-10,A股午盘综述：上证指数跌逾1%，两市成交额再破万亿,Wind
1612,2020-07-10,解禁洪峰将至，接盘需谨慎,Wind
1613,2020-07-10,保险股跌幅继续扩大，中国人寿、中国人保均跌7%左右,Wind
1614,2020-07-10,此次牛市与2015年有何不同？,第一财经
1615,2020-07-10,社保基金拟减持不超8.84亿股 中国人保股价低开4.48% 拟减持股份,金融界
1616,2020-07-10,【异动股】保险板块下挫，中国人保(601319-CN)跌5.7%,财华社
1617,2020-07-10,港股中国人保跌4.64% 社保基金拟减持A股不超过2% 拟减持股份,证券时报网
1618,2020-07-10,港股异动 | 中国人保(01339)盘初挫逾6%拖累内险股 社保基金拟减持最多2%人保A股 拟减持股份,智通财经
1619,2020-07-10,港股保险板块杀跌，中国人保跌超6%,Wind
1620,2020-07-10,社保基金减持不超2% 中国人保早盘低开4% 减持股份,新浪
1621,2020-07-10,A股电子烟概念股分化 中国人保低开4%,红周刊
1622,2020-07-10,大基金、社保基金减持计划出炉，中国人保等多股低开,Wind
1623,2020-07-10,沪指低开0.92% 大金融板块集体走低,证券时报网
1624,2020-07-10,中国人保低开4.48% 社保基金会拟减持 拟减持股份,e公司
1625,2020-07-10,保险股疲软，中国人保、中国人寿均低开超4%,Wind
1626,2020-07-10,社保基金计划减持中国人保8.84亿股，称作为战略投资者地位不变 减持股份,环球老虎财经
1627,2020-07-10,牛市早报｜外资机构唱多A股市场，人民币汇率重回“6”时代,澎湃新闻
1628,2020-07-10,财经早茶∣大基金计划减持多家公司股份；国常会部署防汛救灾工作,证券时报网
1629,2020-07-10,港股公告精选：中国人保第二大股东社保基金会拟减持不超8.84亿股A股,Wind
1630,2020-07-10,股、金、汇携手齐涨，减持也来了！,Wind
1631,2020-07-10,猎鹰看盘：国家队出手影响几何？短线留意这些机会！,金融界
1632,2020-07-10,每日理财观察：央行表示转账超10万将被严查系误读，第二批创业板战略配售基金已获批,Wind
1633,2020-07-10,社保基金要套现，国家大基金减持，释放什么信号,中国基金报
1634,2020-07-10,国家队突然出手，这些热门股要被减持！背后有何深意？A股疯牛还能继续吗？ 减持股份,证券时报网
1635,2020-07-10,前有中信喊“卖”、后有社保要“减”，人保为啥不被待见,第一财经
1636,2020-07-10,社保基金与大基金大手笔减持，降温信号升级，A股要调整了吗？ 减持股份,搜狐
1637,2020-07-10,车险综合改革指导意见征求意见稿点评：车险综合改革推动行业格局强者恒强,新浪
1638,2020-07-10,陆家嘴财经早餐2020年7月10日星期五,Wind
1639,2020-07-10,沪指继续放量上攻，部分机构集中减仓,Wind
1640,2020-07-10,大基金社保基金出手拟减持多家公司股份 拟减持股份,证券时报
1641,2020-07-10,大事件！社保基金计划减持中国人保 保险股要降温？ 减持股份,中证报
1642,2020-07-09,社保基金将套现73亿中国人保政府給股市降温意图明显,搜狐
1643,2020-07-09,重磅！社保、大基金、东财股东接连宣布减持，累计套现132亿！行情会不会熄火？关注三大信号 减持股份,每日经济新闻
1644,2020-07-09,中国人保遭社保基金减持 保险股“狂欢”还能持续吗？ 减持股份,经济观察网
1645,2020-07-09,上限8.84亿股！社保基金会拟减持中国人保股份不超2% 回应：是常规性投资业务安排 拟减持股份,每日经济新闻
1646,2020-07-09,市值3000多亿保险巨头遭国家队减持！中国人保回应了 减持股份,中新经纬
1647,2020-07-09,社保基金拟减持中国人保 中国人寿意外“躺枪” 拟减持股份,上证报
1648,2020-07-09,中国人保：社保基金减持不改变其作为公司重要战略投资者地位 减持股份,澎湃新闻
1649,2020-07-09,国家队突然出手！大基金要减持这3家科技股 减持股份,每日经济新闻
1650,2020-07-09,社保基金与大基金不约而同出手减持 涉及中国人保、汇顶科技等 减持股份,金融界
1651,2020-07-09,中国人保回应社保基金减持：常规性投资业务安排，战投者地位不会变 减持股份,Wind
1652,2020-07-09,中国人保回应社保基金减持：是常规性投资业务安排 社保基金会作为公司重要战略投资者的地位不会发生变化 减持股份,上证报
1653,2020-07-09,社保基金拟减持中国人保2%股份；Sigma:预计2020年全球寿险保费收缩6%，非寿险仅降0.1%|慧保日报7.9 拟减持股份,搜狐
1654,2020-07-09,市场太火爆后市怎么走？紧盯三大变盘信号,券商中国
1655,2020-07-09,社保基金会拟减持国寿和人保股份 均不超过两公司当前已发行股份总数的2% 拟减持股份,证券日报
1656,2020-07-09,九年浮盈超50亿！社保基金拟减持人保股份,Wind
1657,2020-07-09,全国社保基金计划减持中国人保A股股份 减持股份,中证网
1658,2020-07-09,中国人保：社保基金会拟减持A股不超过约8.84亿股 拟减持股份,新浪
1659,2020-07-09,连续大涨市场分化明显，6成个股跑输指数,Wind
1660,2020-07-09,社保基金会计划减持中国人保2%股份，市值近73亿元 减持股份,澎湃新闻
1661,2020-07-09,中国人保(601319.SH)：社保基金会拟减持A股不超过约8.84亿股 拟减持股份,格隆汇
1662,2020-07-09,中国人保：全国社会保障基金理事会拟减持不超2% 拟减持股份,Wind
1663,2020-07-09,中国人保：第二大股东全国社会保障基金理事会拟减持不超过2% 拟减持股份,格隆汇
1664,2020-07-08,美国资本集团减持中国人保(01339)508.6万股，每股作价2.5165港元 减持股份,智通财经
1665,2020-07-07,人保财险乌鲁木齐违法遭罚 未按规定建立保险销售从业人员管理档案 金融监管处罚,中国网
1666,2020-07-07,市场热情到底有多高？两融单日新增创历史新高,Wind
1667,2020-07-07,1.5万亿！50期权一周300倍！A股涨出期货的味道,Wind
1668,2020-07-07,保险股普涨咸鱼翻生 下半年险企有赚头,时代在线
1669,2020-07-06,港股内资保险股集体飙升 中国人寿涨超12%中国人保涨13%,腾讯网
1670,2020-07-06,7只保险股集体拉涨：新华保险、中国人寿、西水股份涨停,澎湃新闻
1671,2020-07-06,银行券商批量涨停，2015年行情已经到来？,Wind
1672,2020-07-06,恒指放量大涨近千点，大金融板块飙涨,Wind
1673,2020-07-06,快讯：内险股持续走强 中国人保涨15%中国人寿涨14%,新浪
1674,2020-07-06,A股越来越牛：中国人寿再度涨停创近年新高,Wind
1675,2020-07-03,本周800亿资金加仓A股，漂亮50王者归来,Wind
1676,2020-07-03,翻身时刻到了，A股剑指3100点，全球市场一起嗨,Wind
1677,2020-07-02,每次牛市初期，券商股是如何表现的？,Wind
1678,2020-07-02,券商龙头真要合并？四大牛市信号浮现,券商中国
1679,2020-07-02,保险行业2020年5月经营数据跟踪：保费复苏态势延续 行业配置价值仍存,新浪
1680,2020-07-02,评保险资金参与金融衍生品交易新规落地：险资投资衍生品新规落地 资产端收益有望稳步提升,光大证券
1681,2020-07-02,A股收盘综述：上证指数涨逾2%剑指3100点，大金融核心爆发,Wind
1682,2020-07-02,快讯：中国人保涨停报于7.39元,金融界
1683,2020-07-02,保险板块上攻 中国人保触及涨停,金融界
1684,2020-07-02,保险行业2020年度中期投资策略：寻找穿越利率周期的力量,新浪
1685,2020-07-02,快讯：大金融板块持续爆发 中国人保冲板,新浪
1686,2020-07-02,【行情】保险板块走高，中国人保冲击涨停，中国人寿、新华保险涨幅靠前,金十数据
1687,2020-07-02,中国人保冲击涨停，带动保险板块走升,Wind
1688,2020-07-01,2020年7月份策略月度报告：利好风险资产的市场环境没有转变 关注基本面相对优势,新浪
