2447,2019-07-19,中国人保科技保险2018年为1765家科技型企业提供保障超2846亿元,新华网
2448,2019-07-18,5大寿险企业半年保费增速降3个百分点,新京报
2449,2019-07-18,中国人保：投资354亿元支持民营经济发展,新华网
2450,2019-07-18,中国人保上半年累计实现原保费收入3213.82亿元,中国网
2451,2019-07-18,港股公告精选：中国人保上半年原保险保费收入同比增12.7%,Wind
2452,2019-07-18,五大险企上半年保费收入出炉，中国人保同比增幅居首,Wind
2453,2019-07-17,五大险企上半年保费收入出炉 中国人保同比增幅居首,21世纪经济报道
2454,2019-07-17,中国人保(01339-HK)6月底总保费收入为3213.82亿人民币,财华社
2455,2019-07-17,中国人保(601319.SH)1-6月原保费收入升12.6%至3213.82亿元,格隆汇
2456,2019-07-17,中国人保：上半年原保险保费收入3213.82亿元,中证网
2457,2019-07-17,中国人保召开半年工作会议 下半年要强化对标、补短板,证券时报网
2458,2019-07-17,【权益变动】中国人保(01339-HK)获美国资本集团增持761.6万股,财华社
2459,2019-07-12,保险股涨幅扩大 中国人寿、中国人保涨超5%,证券时报网
2460,2019-07-10,保险行业中报业绩有望超预期 券商称保险比白酒更具性价比,证券日报
2461,2019-07-08,蓝筹股集体调整，上证50成分股仅三只券商股勉强飘红,Wind
2462,2019-07-04,评级下调、北上资金连续卖出，提防消费白马短期头部,Wind
2463,2019-07-04,定投只会选沪深300？这些才是赚大钱的指数基金！,菜鸟理财
2464,2019-06-30,【产险量价齐升，寿险增速放缓 ——中国太保（601601.SH）2019年中报点评】光大非银赵湘怀 盈利能力下降,湘怀看非银
2465,2019-06-25,中国人保：已完成新金融工具准则的影响测算,Wind
2466,2019-06-25,中国人保：已完成新金融工具准则的影响测算 正在推动相关流程改造升级,e公司
2467,2019-06-24,人保投控原副总裁刘继东被调查 或涉“华闻系”旧案 其他违规处罚,中国网
2468,2019-06-22,人保投控原党委委员、副总裁刘继东被查 其他违规处罚,中国经济网
2469,2019-06-21,中国人保：拟聘任肖建友为公司副总裁,中证网
2470,2019-06-21,华闻旧案持续发酵：人保投控原副总裁刘继东被查 其他违规处罚,财经网
2471,2019-06-20,保险业严监管政策频出，车险市场捆绑销售等各种乱象得到遏制,第一财经
2472,2019-06-20,保险股又涨了！券商却说潜力尚未完全挖掘,每日经济新闻
2473,2019-06-20,保险股午后强势走高 中国人保涨逾8%,中国经济网
2474,2019-06-20,港股异动︱內险股走强 新华保险涨超3%,格隆汇
2475,2019-06-19,中国人保支付“6.17”宜宾长宁地震产险行业首笔赔款,金融界
2476,2019-06-19,上市险企前五月谁霸“龙头”？保费收入超万亿，新业务价值率提升,21世纪经济报道
2477,2019-06-18,中国人保开通客户服务绿色通道 应对四川宜宾地震,新浪
2478,2019-06-18,上证50指数样本股做出调整——道达早评,每日经济新闻
2479,2019-06-18,上证50迎成分股调整，三六零等调出，中国人保和中信建投等调入,每经网
2480,2019-06-18,多家上市险企人事变阵： 刘浩凌或执新华保险帅印,21世纪经济报道
2481,2019-06-18,六大上市险企前5月保费延续正增长,北京商报网
2482,2019-06-17,格隆汇港股聚焦(6.17)︱中国人保前5月原保费收入达2718亿元 天风证券拟45亿元收购恒投证券29.99%股权,格隆汇
2483,2019-06-17,一年下跌42% 三六零被调出上证50指数！中国人保、中信建投入选 剔除指数,中证报
2484,2019-06-17,中国人保：三子公司前5月原保费收入2718.45亿元,证券时报网
2485,2019-06-17,中国人保财险海宁违法遭罚 编制或提供虚假的文件资料 其他违规处罚,中国经济网
2486,2019-06-17,中国人保(601319.SH)1-5月原保险保费收入2718.45亿元 同比增长13.05%,格隆汇
2487,2019-06-17,中国人保：前5月保费收入总计2718.45亿元,Wind
2488,2019-06-17,中国人保：1-5月累计原保险保费收入2718.5亿元,Wind
2489,2019-06-17,邮储银行上海分行遭罚33万元 对投保人、保险人两头骗 其他违规处罚,中投网
2490,2019-06-17,"非银金融行业周报:科创板开板,首批企业上市在即",爱建证券
2491,2019-06-13,中国银联与中国人保签署战略合作协议 共同打造保险行业综合支付解决方案,新华网
2492,2019-06-06,中国人保副总裁盛和泰辞职 2018年薪酬为77万元,挖贝网
2493,2019-06-05,盛和泰辞任中国人保副总裁,中证网
2494,2019-06-05,因工作调动 盛和泰辞去中国人保副总裁职务（简历）,中国经济网
2495,2019-06-05,中国人保(01339.HK)：盛和泰辞任副总裁 董监高成员变化,格隆汇
2496,2019-06-05,中国人保：副总裁辞任 董监高成员变化,Wind
2497,2019-06-04,为什么我不选上证50 选沪深300和中证500作为标配,格隆汇
2498,2019-06-04,上市险企高管薪酬：5人年薪上千万，60人年薪100万以下,国际金融报
2499,2019-06-03,影响5000亿大消息！这些重磅指数调仓换股：康美康得新全被剔除了,中国基金报
2500,2019-06-03,"非银金融行业周观点:券商周线两连阳,科创板箭在弦上",联讯证券
2501,2019-06-02,上证50等指数调整样本股6月17日生效,证券时报网
2502,2019-05-31,【中信建投非银】保险行业减税增利！谁最受益？,中信建投非银金融研究
2503,2019-05-30,72号文“硬核减税”，保险业“省出”500亿利润能否真正减负,财经网
2504,2019-05-30,公募积极参与科创板战略配售,中证报
2505,2019-05-30,"保险行业险企手续费及佣金支出税前扣除新规点评:降税释放利润,推动转型保障",证券之星
2506,2019-05-29,两大利好！保险板块护盘A股，午后快速拉升，一巨头5分钟直线涨停,证券时报网
2507,2019-05-29,中国人保盘中涨停！469亿红包砸来，保险股大象起舞,中证报
2508,2019-05-29,“打酱油”角色进入实施高峰，资金抢权，青睐小而美,Wind
2509,2019-05-29,财政部释放保险企业减税利好政策，保险股集体大涨,澎湃新闻
2510,2019-05-29,港股异动︱中国人保(01339)A股午后直线封板 H股跟涨逾5%,智通财经
2511,2019-05-29,保险板块快速拉升 中国人保涨停,中证网
2512,2019-05-29,中国人保直线涨停 封单逾50万手,e公司
2513,2019-05-29,快讯：午后中国人保直线封涨停 ，成交额超6亿元,新浪
2514,2019-05-29,中国人保直线拉升封住涨停,e公司
2515,2019-05-29,保险股异动，中国太保涨超2%,Wind
2516,2019-05-29,人保再保险拟增资10亿元 资本金增至40亿元,每日经济新闻
2517,2019-05-28,保险行业中期投资策略浮出水面 券商称配置价值显现,证券日报
2518,2019-05-27,"非银行金融行业周报:低估蓄力,左侧布局",爱建证券
2519,2019-05-24,金融股全线异动，银行次新股、中国人保突直线拉升,21经济网
2520,2019-05-21,中国人保董事会秘书唐志刚任职资格获银保监会核准,中国经济网
2521,2019-05-21,中国人保(601319.SH)：唐志刚担任董事会秘书获核准,格隆汇
2522,2019-05-21,华林证券：大盘震荡格局未改变 关注市场结构性机会,金融界
2523,2019-05-21,银保监会同意中国人保近30亿股划转社保基金,证券日报
2524,2019-05-20,中国人保29.89亿股份划给全国社会保障基金理事会,财经网
2525,2019-05-20,银保监会：同意中国人保约29.9亿股股份划转给社保基金理事会,e公司
2526,2019-05-20,银保监会同意将财政部持有的中国人保约29.9亿股股份划转给社保基金,Wind
2527,2019-05-20,银保监会：同意中国人保约29.9亿股划转给社保基金,新浪
2528,2019-05-20,五大上市险企前4月保费破万亿，综合成本率压力有望缓解,证券日报
2529,2019-05-20,五大上市险企前4月保费破万亿元 业内预计综合成本率压力有望缓解,证券日报
2530,2019-05-17,非银金融成赢家 机构关注指数样本股调整投资机会,中证报
2531,2019-05-16,下月这些主要指数将调样本股 千亿级指数基金将调仓,中证报
2532,2019-05-16,中国人保：1-4月累计原保险保费收入为2326.56亿,新浪
2533,2019-05-16,中国人保(601319.SH)旗下三家子公司1-4月合计保费收入2326.56亿元,格隆汇
2534,2019-05-16,中国人保：1-4月保费收入总计2326.56亿元,Wind
2535,2019-05-16,量化｜三只非银股有望调入上证50：2019年年中主要宽基指数样本股调整预测,中信证券研究
2536,2019-05-15,人保副总裁盛和泰调任国寿集团副总裁，两公司人事互通仍待续,澎湃新闻
2537,2019-05-13,【华创非银】非银金融周观察：坚守长期价值，优选个股,华创非银
2538,2019-05-10,A股保险板块快速走强 中国人保(601319.SH)涨超5%,格隆汇
2539,2019-05-09,"""大象""业绩大变脸：国寿集团缘何2018年巨亏130亿？ 盈利能力下降",券商中国
2540,2019-05-09,"""大象""业绩大变脸！2017盈利124亿，2018巨亏130亿！中国人寿集团业绩大幅波动究竟是何原因 重大损失",券商中国
2541,2019-05-09,【行业点评】非银丨保费增速改善 长债收益率筑底回升利好估值提升,中国银河证券研究
2542,2019-05-07,这个行业强势捞金，企业一年净赚2977亿,和讯
2543,2019-05-06,五大上市险企首季净利大增 主因是投资收益大幅增长,羊城晚报
2544,2019-05-06,中国人保一季度净利58.87亿 现金流量净额为-116.21亿,挖贝网
2545,2019-05-06,中国人保一季度净利58.87亿元 同比增长12% 现金流量净额为-116.21亿元,挖贝网
2546,2019-05-06,西水股份投资收益腰斩骤减79.5亿净利降八成 核心子公司天安财险连续4年亏损,长江商报
2547,2019-05-05,手续费率大幅下降，所得税压力缓解——中国人保（601319）2019年1季报点评,华创非银
2548,2019-05-05,"中国人保2019年一季报点评:财险市占率升至36%,寿险收获转型成效",申万宏源
2549,2019-05-01,险企一季“爆”：投资推动净利总合增7成，日赚9.6亿谁最能赚？,第一财经
2550,2019-04-30,投资端回暖 A股五大上市险企一季报迎“开门红”,新京报
2551,2019-04-30,投资大涨保费回暖，利润大增估值提升——保险公司2019年一季报综述,湘怀看非银
2552,2019-04-30,中国人保一季度实现净利润58.9亿元 同比增长12.1%,中国网
2553,2019-04-30,公告点题｜4月29日这些公告有看头,第一财经
2554,2019-04-29,【申万宏源金融】中国人保一季报点评：财险市占率升至36.3%，寿险收获转型成效,大金融研究
2555,2019-04-29,投资收益拉动 五大上市险企一季度净利增超5成,北京商报网
2556,2019-04-29,中国人保一季度净利增12% 所得税下降47%,证券时报网
2557,2019-04-29,中国人保(601319.SH)一季度归母净利润升12.1%至58.87亿元,格隆汇
2558,2019-04-29,中国人保：一季度净利润同比增12.13%,Wind
2559,2019-04-29,中国人保：一季度净利58.87亿元 同比增12%,e公司
2560,2019-04-29,中国人保：一季度净利润58.87亿元，同比增长12.1%,Wind
2561,2019-04-29,中国人保第一季度已赚净保费868亿元人民币,新浪
2562,2019-04-29,花旗下调格力评级至卖出 董明珠年薪仅为雷军千分之一 投资评级恶化,大众证券报
2563,2019-04-29,花旗两大理由下调格力评级至卖出！已有4只明星股被贴上卖出标签,券商中国
2564,2019-04-25,中国人保与银河证券签署战略合作协议,证券时报网
2565,2019-04-24,中国人保“回A”后发布首份社会责任报告,证券时报网
2566,2019-04-23,一季度6只战略配售基金份额增加,中证网
2567,2019-04-22,6只战略配售基金一季度份额共增加1.08亿份 持仓仍以债券为主,中证网
2568,2019-04-22,【中信建投非银】周报：券商改革催化剂持续兑现，保险板块迎配置窗口,中信建投非银金融研究
2569,2019-04-22,【华创非银】非银金融周观察：负债端持续修复，利率企稳，保险一季报有望超预期,华创非银
2570,2019-04-20,券商研报看的是信息和逻辑,证券时报
2571,2019-04-19,A股上市险企一季度原保费出炉:寿险增速改善 财险高开低走,中国网
2572,2019-04-19,人保投控换帅：人保总裁白涛兼任董事长，董清秀任党委书记,澎湃新闻
2573,2019-04-19,A股行情会不会熄火？关注三大信号,21财闻汇
2574,2019-04-16,格隆汇港股聚焦(4.16)︱中国人保一季度原保险保费收入升13.6%至1932.32亿元,格隆汇
2575,2019-04-16,[公司]中国人保一季度保费收入1932亿元,全景网
2576,2019-04-16,中国人保(01339-HK)附属共录得保费收入约为1932.3亿元,财华社
2577,2019-04-16,中国人保一季度实现原保费收入同比增长13.6%,证券时报网
2578,2019-04-16,中国人保：一季度中国人民财产保险原保险保费收入1254.63亿元,Wind
2579,2019-04-15,房地产投资小火苗烧得正旺：去年五险企投资房地产规模850亿,21世纪经济报道
2580,2019-04-12,郭树清赴中国人保调研并主持召开保险机构座谈会,e公司
2581,2019-04-11,五大上市险企投资性房地产近850亿元 去年租金收入同比增长24%,证券日报
2582,2019-04-09,谢一群担任中国人保董事会秘书资格获银保监会批复,中国网
2583,2019-04-08,【华创非银】非银金融周观察：市场明显向好，建议增配非银,华创非银
2584,2019-04-08,【国君非银刘欣琦团队】行业资负两端分化更为显著—上市保险公司2018年报综述,欣琦看金融
2585,2019-04-04,人保回A头年净利少了近两成 面对质疑高管称仁者见仁,投资时报
2586,2019-04-04,科技扫清技术障碍 上市险企交叉销售成绩斐然,证券日报
2587,2019-04-03,平安去年总投资收益率排名倒数？都是新准则惹的“祸”,第一财经日报
2588,2019-04-03,风雨过后，转机来临——保险行业2018年报综述【华创非银】,华创非银
2589,2019-04-03,A股上市险企2018年投资端透视:总收益普降 最高降幅达30%,中国网
2590,2019-04-02,快讯：午后中国人保直线拉升 股价一度逼近涨停,新浪
2591,2019-04-02,保险股午后异动 中国人保涨超8%,e公司
2592,2019-04-02,A股上市险企2018年承保端透视:总保费增11% 续期业务普涨,中国网
2593,2019-04-02,五大险企业绩分化 投资收益率均下滑,新京报
2594,2019-04-02,五大上市险企2018年成绩比拼： 寿险新业务价值平安增速最快 新华净利润增速最高,21世纪经济报道
2595,2019-04-01,A股五大险企去年广告、宣传费缩减百亿元 新华保险更是八连降,每日经济新闻
2596,2019-04-01,2018五大险企日均广告宣传费8261万 中国平安降四成,新浪
2597,2019-04-01,五大险企投资能力比拼：国寿总投资收益率垫底,中国经营报
2598,2019-03-31,不只中国人寿 A股这5家险企去年炒股都“失手”了！,中新经纬
2599,2019-03-29,深度剖析A股五家上市险企年报：产寿险老大净利润均遭遇负增长,第一财经
2600,2019-03-29,战略配售基金今日上市，抢滩科创板攻略大全来了,中证报
2601,2019-03-29,中国人寿总裁谈“开门红”：坚持聚焦价值，要求业务多元化,澎湃新闻
2602,2019-03-29,“倒春寒”来了？短线快炒降温，游资退守，散户还在撑场,中财网
2603,2019-03-28,日赚4.3亿元！五大上市险企2018年合计实现净利润1581.9亿元,每日经济新闻
2604,2019-03-28,"华创证券：将中国人保评级调低为""中性"" 投资评级恶化",Wind
2605,2019-03-28,五大险企去年日赚4亿！中国人寿净利大幅缩水逾六成,中新经纬
2606,2019-03-28,逾六成披露年报公司筹码趋向集中，70家公司股东户数降幅超10%,证券日报
2607,2019-03-28,顶格申购战略配售基金 掘金科创板“先行一步”,第一财经
2608,2019-03-28,上市险企去年总投资收益达3458亿元 平均总投资收益率为4.22%,证券日报
2609,2019-03-28,A股五大上市险企去年日赚4.9亿元 合计净利同比增长23.68%达1782亿元,证券日报
2610,2019-03-27,中国人保：未来将率先突围 中性评级,和讯
2611,2019-03-27,【国金研究】保险资金专题：险资如何配置A股及其相关特征,国金证券研究所
2612,2019-03-26,千亿战略配售基金本周五上市 投资组合明细曝光,新浪
2613,2019-03-26,"中国人保:投资与费用短期承压,未来将率先突围",方正证券
2614,2019-03-26,"方正证券：将中国人保评级调低为""中性"" 投资评级恶化",Wind
2615,2019-03-26,郭施亮:本月42份下调股票评级研报，遭评级下调的股票就不值得投资吗？,中财网
2616,2019-03-26,人保掌舵人自曝集团短板 欲借数字化战略弥补,北京商报
2617,2019-03-26,中国人保：去年权益投资浮亏已消化 投资失误,证券时报
2618,2019-03-25,中国人保资管王颢：今年是布局A股比较好的时机,中证网
2619,2019-03-25,增仓并参与网下打新 战略配售基金最新持仓曝光,每日经济新闻
2620,2019-03-25,多家险企淡化开门红，中国人保董事长为何称开门红还是很重要,澎湃新闻
2621,2019-03-25,中国人保资产副董事长、总裁王颢：今年是布局A股较好时机,中证网
2622,2019-03-25,中国人保：人身险聚焦保障 持续推进业务转型,光大证券
2623,2019-03-25,中国人保：权益类投资风险已全部化解 并有盈余,零壹财经
2624,2019-03-25,中国人保董事长缪建民谈保险业对外开放 有利于活跃市场、增加消费者选择（含视频）,21世纪经济报道
2625,2019-03-25,中国财险副总裁：非车险保费增长快因政策性业务续保,新浪
2626,2019-03-25,中国人保集团董事长回应“卖出”评级：仁者见仁，智者见智,第一财经
2627,2019-03-25,中国人保集团董事长回应“卖出”评级：仁者见仁，智者见智,Wind
2628,2019-03-25,人保总裁白涛: 受多种因素影响去年净利同比降19.2%,新浪
2629,2019-03-25,港股异动︱瑞信指业绩逊预期下调评级及目标价 中国人保(01339)挫逾4% 投资评级恶化,智通财经
2630,2019-03-25,中国人保三大业务市场占有率齐下滑 8高管年薪超百万,中国经济网
2631,2019-03-25,缪建民：中国人保去年保费收入4986亿 同比增长4.7%,新浪
2632,2019-03-24,长城动漫新聘美女董秘不简单 一站到底人气选手逆袭,新浪
2633,2019-03-24,【申万宏源金融】中国人保年报点评：手续费高企拖累产险净利贡献，2H18寿险及健康险NBV增速达46%,大金融研究
2634,2019-03-24,券商猛发下调研报评级！今年3个月就已有百份,券商中国
2635,2019-03-24,谢一群辞去中国人保董事会秘书职务 唐志刚接任,国际金融报
2636,2019-03-23,中国人保：2018年实现净利润129.12亿元,中国金融新闻网
2637,2019-03-23,中国人保2018年净利润194.99亿元 营收突破5000亿元,每日经济新闻
2638,2019-03-23,中国人保去年净利降19%至134.5亿元，市场占有率微降 盈利能力下降,澎湃新闻
2639,2019-03-23,中国人保 去年净利润下降19.2% 盈利能力下降,中证报
2640,2019-03-22,2018年中国人保保费收入近5000亿元,金融界
2641,2019-03-22,谢一群辞任中国人保董秘 唐志刚拟接任,中国经济网
2642,2019-03-22,唐志刚接替谢一群 任中国人保董事会秘书,证券时报网
2643,2019-03-22,中国人保：2018年净利润134.5亿元 同比下降19.2%,新浪
2644,2019-03-22,中国人保：董事会秘书变更 董监高成员变化,Wind
2645,2019-03-22,中国人保：2018年度净利润同比下降19.2%,Wind
2646,2019-03-22,中国人保：2018年净利润129亿元 同比降18.8%,第一财经
2647,2019-03-22,中国人保(01339.HK)2018年度归母净利润跌19.8%至129.12亿元 末期息每股4.57分,格隆汇
2648,2019-03-22,港股投资日历：中国人保、招商银行等重磅财报今日公布,Wind
2649,2019-03-22,上市险企前2月保费：国寿增速领跑 天安财险拐头下滑,中国经济网
2650,2019-03-21,杜坤维：谨防利用北上资金穿马甲吸引市场目光炒作股票,中财网
2651,2019-03-21,中国人保“变形计”,国际金融报
2652,2019-03-21,五家上市险企前两月保费增速12.9%,21世纪经济报道
2653,2019-03-20,A股上市险企前2月原保费同比增长13% “开门红”增速放缓,中国网
2654,2019-03-20,甲醇概念股走势强劲 券商、机构这么看,中研网
2655,2019-03-20,金融：价值持续改善 估值迎来修复,中信建投
2656,2019-03-20,又见看空报告 三家券商集体下调中信建投证券评级 股票卖空,中国基金报
2657,2019-03-20,中国人保与腾讯签署战略合作协议,中证网
2658,2019-03-20,腾讯与中国人保达成战略合作，共推金融保险服务,Wind
2659,2019-03-19,A股五大上市险企前两月保费逾6440亿 国寿、人保领跑,国际金融报
2660,2019-03-19,中国人保前2月原保费收入1308.78亿元 同比增长16.51%,中国网
2661,2019-03-19,中国人保：2019年前两月原保险保费收入1308.78亿元,新浪
2662,2019-03-19,独角兽基金成立8个月后开通转托管 距离上市还会远吗,新浪
2663,2019-03-19,中国人保(01339.HK)1-2月原保费收入升16.51%至1308.78亿元,格隆汇
2664,2019-03-19,中国人保：前2月原保险保费收入超1300亿元,e公司
2665,2019-03-19,6大独角兽基金转托日复盘：嘉实、华夏业绩垫底之谜,经济观察网
2666,2019-03-18,战略配售基金新动作来了！累计已赚50亿,中国基金报
2667,2019-03-18,天地板、地天板同现！“柚子”走了，又回来了,Wind
2668,2019-03-18,249份年报密集轰炸：中石油、招行、神华等多个巨无霸亮相，七成公司业绩预喜，44股净利翻番，10股首亏（附名单）,21经济网
2669,2019-03-18,郭施亮:如果个股看空报告成为市场的常态化，对市场是好事还是坏事呢？,中财网
2670,2019-03-17,3000点大震荡 带你看清谁是“真神”谁是演员,每日经济新闻
2671,2019-03-17,还有很长的路要走,财富动力网
2672,2019-03-15,一锤定音！针对个股看空报告 易会满刚刚表态,证券时报网
2673,2019-03-15,易会满回应“个股看空报告”：正常的事情 敬畏市场、尊重规律,中证报
2674,2019-03-15,金融股AH溢价全线扩大 仅中国平安未“转正”,21世纪经济报道
2675,2019-03-14,[看好评级]非银行业周报：科创板正式落地 市场回暖带来业绩改善,中财网
2676,2019-03-14,"非银行金融行业周观点:交易额同比转正,两融继续攀升",万联证券
2677,2019-03-13,中国人保盘中快速下跌,e公司
2678,2019-03-13,大参考：数字孪生技术引发市场关注 重构工业互联网体系,巨丰财经
2679,2019-03-12,产险十年：老三家市场份额稳占六成,第一财经
2680,2019-03-12,公告汇总：招商证券拟回购6.5亿-13亿股份,网易
2681,2019-03-12,被市场裹挟7涨停2跌停的中国人保及保险股将往何处？,新浪
2682,2019-03-12,公告精选：中国平安2018年净利1074亿元，陆金所已完成C轮融资；华宝股份大手笔分红，共计派现24.6亿,每日经济新闻
2683,2019-03-12,社保基金会接转财政部约29.9亿股中国人保A股,中保网
2684,2019-03-12,中国人保：社保基金会已接收财政部一次性划转的10%股份,澎湃新闻
2685,2019-03-12,财政部将29.9亿股中国人保股份划转给社保基金会,中证网
2686,2019-03-12,无偿划转后 全国社保基金会持有中国人保股份增至16.54%,金融界
2687,2019-03-12,股市需要更多“卖出”评级研报,新浪
2688,2019-03-12,中国人保：财政部将其持有中国人保股份的10%划转给社保基金会持有,中国网
2689,2019-03-12,中国人保(01339.HK)：社保基金会国有资本划转一户接收划转的约29.9亿股A股,格隆汇
2690,2019-03-12,前期强势股集体反抽 大智慧涨停,金融界
2691,2019-03-12,重回强势？中国人保、中信建投止跌上涨 人民网再创新高,格隆汇
2692,2019-03-12,中国人保开盘涨0.86% 中信建投涨1.54%,e公司
2693,2019-03-12,“爆炒股”涨势趋缓 东方通信连续两日跌停,证券时报
2694,2019-03-12,中国人保股价“过山车” 机构仍看好保险股,21世纪经济报道
2695,2019-03-12,A股大跌，都是券商研报惹的祸？,新京报
2696,2019-03-12,个股估值要想更合理需完善A股做空机制,新京报
2697,2019-03-11,爆炒股同时上演地天板与天地板，散户已晕头转向，官媒连发七文警告,每日经济新闻
2698,2019-03-11,卖出评级影响尚未消化 券商AH股异常溢价影响大,第一财经
2699,2019-03-11,财经观察家 | 张刚：为什么券商卖空报告少之又少？,巨丰财经
2700,2019-03-11,恒指收涨1%连续14日成交超千亿，复旦张江暴涨逾26%,Wind
2701,2019-03-11,中国人保低开低走重挫9.87%报10.41元 成交36.32亿元,腾讯网
2702,2019-03-11,创业板指大涨逾4%！电气设备板块独领风骚,中新经纬
2703,2019-03-11,东方通信没有5G业务竟暴涨200%！概念炒作即将落幕,云掌财经
2704,2019-03-11,“爆炒股”集体深度调整 沪指争夺3000点！这只股票也跌停了,证券时报
2705,2019-03-11,中国人保、中信建投再双双跌停 两天市值蒸发1528亿,中财网
