470,2021-05-30,468亿！外资买爆A股名单大曝光，茅台又火了！,中国基金报
471,2021-05-29,下周491亿市值限售股解禁，环比增加42.97% 解禁,Wind
472,2021-05-28,寻找金融科技的赋能王者,新浪
473,2021-05-28,桑迎全部在手货基涨幅不敌同类平均 国寿安保基金为其推出新债基,金融界
474,2021-05-28,后悔买扫地机而非股票！最强“扫地僧”无视 672 亿解禁，股价 3 年 8 倍 解禁,ZAKER
475,2021-05-27,中泰证券：19.12亿股首次公开发行限售股将于6月3日上市流通 解禁,中证网
476,2021-05-27,中泰证券：约19.12亿股限售股6月3日解禁，占比27.45% 解禁,每日经济新闻
477,2021-05-27,中泰证券(600918.SH)：约19.12亿股首发限售股6月3日解禁 解禁,格隆汇
478,2021-05-27,中泰证券：19亿股限售股解禁，6月3日上市流通 解禁,Wind
479,2021-05-27,中泰证券：恒顺醋业（600305.SH）积极推动产品端变革，维持“买入”评级,智通财经
480,2021-05-26,资源品价格见顶？成本端压力释放，这几个行业有望回暖,21世纪经济报道
481,2021-05-26,中泰证券与东营市政府及8家机构签署战略合作协议,大众日报
482,2021-05-26,中泰证券--中泰证券复利防御【投资策略】,金融界股吧
483,2021-05-22,中泰证券首席经济学家李迅雷：投资要比买房子复杂，买指数基金就好！,红周刊
484,2021-05-21,夜光明拟精选层小IPO，中泰证券担任辅导机构,资本邦
485,2021-05-21,上市之路波折不断，联迪信息牵手东兴证券二闯精选层,资本邦
486,2021-05-20,中泰证券大涨,新浪
487,2021-05-19,中泰证券董事长到万达宝通考察,轮胎世界网
488,2021-05-18,2021年福布斯全球2000强：11家券商入围 排名大幅变动,新浪
489,2021-05-17,券商股早盘分化，湘财股份一字涨停，浙商证券涨超3%，天风证券、中泰证券、太,新浪
490,2021-05-15,“牛市旗手”突然大爆发！估值和业绩“背离”太久了，航母公司要火了？,中国基金报
491,2021-05-14,罕见10只券商股齐掀涨停潮：牛市旗手似苦尽甘来 这一波行情延续性来了？,财联社
492,2021-05-12,非银金融行业周报：收入普增 业绩驱动因素分化,新浪
493,2021-05-11,市场聚焦：存量博弈下的理性战术,新浪
494,2021-05-11,券商海外业务排座次：海通与中金连续四年收入占比霸榜，中信建投增速最快，券业大举发力“走出去”,财联社
495,2021-05-10,中泰证券：华峰测控（688200.SH）国内半导体测试机龙头，首予“增持”评级,智通财经
496,2021-05-10,中泰证券--晶方科技：全球TSV-CIS封测龙头，车载业务有望实现放量【公司研究】,金融界股吧
497,2021-05-10,中泰证券维持宇通客车增持评级：大中客销量增长20%，符合预期,每日经济新闻
498,2021-05-10,非银金融行业双周报：估值低位 关注短期边际变化个股,新浪
499,2021-05-10,中泰证券：医疗器械行业当前正处于黄金发展期,证券时报网
500,2021-05-10,周跟踪|大宗金属价格持续上涨概率几何？,新浪
501,2021-05-09,中泰证券前首席分析师被抓？或涉嫌与游资联手操纵股票 疑因充当信息传递者 其他违规处罚,中国经营网
502,2021-05-08,中泰证券与胶东五市财政局签署战略合作协议,e公司
503,2021-05-08,中泰证券首席经济学家李迅雷：顺应经济转型升级，做大股权融资市场,电鳗快报
504,2021-05-07,邀请函 | 银行业资产管理高端论坛——中泰证券研究所和上海金融与发展实验室合办,传统借贷vs新型金融
505,2021-05-07,中泰证券：抗疫需求持续释放，医疗新基建带动新增长,资本邦
506,2021-05-07,中泰证券维持新城控股买入评级：业绩接近翻倍增长，降本增效成果显着,每日经济新闻
507,2021-05-07,李迅雷、郭皓：碳中和趋势下钢铁业的牛市能走多长？,新浪
508,2021-05-06,煤炭股开局亮眼机构持续看好行业投资机会低估值绩优股还有这些,第一财经
509,2021-05-06,中泰证券推进区域突破战略 提升区域市场竞争力,上证报
510,2021-05-06,中泰证券维持西安银行增持评级，详细解读西安银行2020年报&2021一季报：零售业务表现亮眼，转型效能持续提升,每日经济新闻
511,2021-05-06,中泰证券维持韵达股份买入评级，韵达股份2020年报及2021一季报点评：价格战与费用提升拖累业绩，二季度压力有望缓解,每日经济新闻
512,2021-05-06,中泰证券维持青岛银行增持评级，青岛银行21年1季报详细解读：资本内生，资产质量优中夯实,每日经济新闻
513,2021-05-06,中泰证券给予农业银行增持评级：业绩增速平稳，资产质量总体稳定,每日经济新闻
514,2021-05-06,去年净利超百亿上市券商增至5家，国盛金控和太平洋出现亏损 亏损,澎湃新闻
515,2021-05-06,中泰证券维持中国平安买入评级，平安参与方正集团重整进展点评：获取新方正集团绝对控股权，对价是否合理取决于后续整合,每日经济新闻
516,2021-05-06,中泰证券维持金能科技买入评级：一季度业绩增长100%，青岛新项目将打造公司新增长点,每日经济新闻
517,2021-05-06,中泰证券给维持今世缘买入评级：国缘驱动高增，回款表现更佳,每日经济新闻
518,2021-05-06,中泰证券维持中国人寿买入评级，中国人寿2021年1季报点评：费用优化提振 NBV 表现，公司回归寿险基本规律,每日经济新闻
519,2021-05-06,中泰证券维持太阳纸业买入评级：景气上行叠加产能释放，一季度高增长,每日经济新闻
520,2021-05-06,中泰证券：华友钴业（603799.SH）全球最大的钴冶炼龙头，维持“买入”评级,智通财经
521,2021-05-06,中泰证券维持三棵树增持评级：营收持续高增，销售和研发投入谋长远发展,每日经济新闻
522,2021-05-06,中泰证券维持安井食品买入评级：Q1超预期再创佳绩，产能开启狼性扩张,每日经济新闻
523,2021-05-06,中泰证券维持用友网络买入评级：云业务指标靓丽，BIP生态加速完善,每日经济新闻
524,2021-05-06,中泰证券维持张家港行增持评级，详细解读张家港行2020年报&2021一季报：零售存贷贡献提升，资产质量稳健优异,每日经济新闻
525,2021-05-06,中泰证券维持蓝帆医疗买入评级：业绩符合预期，手套行业红利继续，心血管业务短期承压,每日经济新闻
526,2021-05-06,中泰证券维持圆通速递买入评级：公司实力提升，迎接阶段复苏,每日经济新闻
527,2021-05-06,中泰证券维持华新水泥增持评级：Q1效率高增，水泥价格及骨料等增量值得期待,每日经济新闻
528,2021-05-06,中泰证券给予泸州老窖买入评级，国窖延续高增，中档加速改善,每日经济新闻
529,2021-05-06,中泰证券给予久远银海买入评级，业绩加速增长，医疗医保新增项目不断,每日经济新闻
530,2021-05-06,5月迎来做多窗口期 有机构却表示要逢高减仓,财联社
531,2021-05-05,中泰证券：5月依然是好的做多窗口,证券时报网
532,2021-05-01,这一决定性板块又亮了：4月券商金股平均涨幅创年内新高，7大组合年内累计收益超10%！,每日经济新闻
533,2021-05-01,中泰证券维持卫星石化买入评级：一季度景气维持，静待C2项目投产,每日经济新闻
534,2021-04-30,中泰证券维持康泰生物买入评级：四联苗平稳放量，13价肺炎疫苗等大品种进入上市倒计时,每日经济新闻
535,2021-04-30,中泰证券维持安迪苏买入评级：液蛋销量快速增长，特种产品增速稳健,每日经济新闻
536,2021-04-30,中泰证券维持九阳股份买入评级，2021一季报点评：收入回暖向好,每日经济新闻
537,2021-04-30,宝馨科技：一季度实现营收1.87亿元同比增长55.37%实现扭亏为盈,投资家
538,2021-04-30,中泰证券维持海尔智家买入评级，2021一季报点评：盈利改善延续,每日经济新闻
539,2021-04-30,中泰证券给予常熟银行增持评级：存款实现开门红，资产质量维持优秀,每日经济新闻
540,2021-04-30,中泰证券维持欧派家居买入评级：零售强势，厨衣柜增速靓丽,每日经济新闻
541,2021-04-30,中泰证券维持中国太保买入评级：投资表现强于同业，寿险转型任重道远,每日经济新闻
542,2021-04-30,中泰证券给予北京银行增持评级：零售转型初见成效，资产质量改善,每日经济新闻
543,2021-04-30,中泰证券给予兴业银行增持评级：资产质量持续向好，营收保持高增,每日经济新闻
544,2021-04-30,"中泰证券给予奇安信买入评级：收入高增,毛利率提升，“高质量发展”战略成果显着",每日经济新闻
545,2021-04-30,中泰证券维持建设银行增持评级，建设银行21年1季报详细解读：营收同比增5%，存贷实现开门红,每日经济新闻
546,2021-04-30,中泰证券维持亚士创能增持评级：营收保持高增，四大产品体系形成促全面发展,每日经济新闻
547,2021-04-30,中泰证券给予伟星新材增持评级，21Q1收入高增，多重双轮驱动持续推进,每日经济新闻
548,2021-04-30,中泰证券维持移远通信买入评级：Q1营收持续高增长，不断拓展车载无线产品,每日经济新闻
549,2021-04-30,中泰证券维持顾家家居买入评级：内生经营向好，商誉减值致利润短期承压,每日经济新闻
550,2021-04-30,南方基金管理股份有限公司,证券时报
551,2021-04-30,中泰证券给予中联重科买入评级，一季度业绩高速增长，经营质量夯实稳健,每日经济新闻
552,2021-04-30,中泰证券给予海鸥住工买入评级：外销高景气，并表贡献增量,每日经济新闻
553,2021-04-30,中泰证券维持劲嘉股份增持评级，彩盒包装放量，烟标有望复苏,每日经济新闻
554,2021-04-30,中泰证券维持成都先导买入评级：业绩符合预期，看好多技术平台协同新药转让业务长期价值,每日经济新闻
555,2021-04-30,中泰证券维持新和成买入评级：一季度业绩略超预期，长期成长动力十足,每日经济新闻
556,2021-04-30,中泰证券维持桐昆股份买入评级：涤纶长丝盈利提升，看好行业景气周期,每日经济新闻
557,2021-04-30,中泰证券给予海利得买入评级：上半年同比高增长，车用丝龙头迈上成长新台阶,每日经济新闻
558,2021-04-30,中泰证券：宁德时代业绩符合预期，四季度高排产带动全年增长,金融界
559,2021-04-29,中泰证券给予中信证券买入评级：业绩实现稳健增长，信用减值损失收窄,每日经济新闻
560,2021-04-29,中泰证券维持光大银行增持评级：光大银行21年1季报详细解读：中收增速走阔，资产质量优化夯实,每日经济新闻
561,2021-04-29,中泰证券维持贝泰妮买入评级，2020年报及2021年一季报点评：线上强势，Q1收入超预期,每日经济新闻
562,2021-04-29,雄汇医疗信披违规实控人收警示函 主办券商中泰证券 金融监管处罚,中国经济网
563,2021-04-29,中泰证券：海南自贸港新政推动互联网医疗创新模式 推荐关注1药网(YI.US)等,智通财经
564,2021-04-29,统计局一锤定音！2020年人口继续保持增长，二胎概念跳水，曝人口转型下“十倍股”机会,金融界
565,2021-04-29,中泰证券：二季度钢铁行业盈利有望重回历史峰值趋势,证券时报网
566,2021-04-29,券商一季报密集发布，中信证券实现净利52亿元，同比增长27%,资本邦
567,2021-04-29,中泰证券：正泰电器（601877.SH）Q1业绩超预期，维持“增持”评级,智通财经
568,2021-04-29,拥抱金融科技 前十券商去年花费超百亿,全景网
569,2021-04-28,新益昌上市首日涨235% IPO募5亿中泰证券赚3250万,中国经济网
570,2021-04-28,中泰证券：一季度净利润同比减少11.32% 盈利能力下降,Wind
571,2021-04-28,中泰证券：一季度净利6.66亿元同比下降11% 盈利能力下降,格隆汇
572,2021-04-28,中泰证券(600918.SH)：一季度净利降11.32%至6.66亿元 盈利能力下降,格隆汇
573,2021-04-28,中泰证券：司太立（603520.SH）业绩呈现强劲增长，维持“买入”评级,智通财经
574,2021-04-28,中泰证券与山东工行达成全面战略合作,大众日报
575,2021-04-28,95股今日获机构买入评级,证券时报网
576,2021-04-27,两融市场继续上演争夺战，30家上市券商两融收入榜出炉，价格战火不断，融资利率跌破6%,财联社
577,2021-04-27,迪安诊断2021年首季净利同比增4990% 香港中央结算有限公司连续两季度增持,e公司
578,2021-04-27,医药生物板块涨0.46% 未名医药和双鹭药业涨停,证券日报网
579,2021-04-27,重庆银行业绩发布高效透明，300多位投资者用行动点赞！,--
580,2021-04-26,【银华基金】交易日报 2021-4-26,新浪
581,2021-04-26,4月26日深市创业板活跃股公开信息,深交所
582,2021-04-26,涨停复盘 | 印度疫情猛烈反扑 医疗概念逆市掀涨停潮,第一财经
583,2021-04-26,中泰证券上市后的首份年报披露 组织架构调整蕴含发展新战略,21世纪经济报道
584,2021-04-26,突发闪崩！13万股东炸锅，800亿券商瞬间暴跌8%，网友：“一个下午亏五万”，发生了什么？ 亏损,每经网
585,2021-04-26,快讯：券商股持续走弱 哈投股份、中泰证券大跌7% 连续下跌,新浪
586,2021-04-26,银行业高风险机构数量显着下降 一季度净利润同比增长1.5%,时代周报
587,2021-04-25,中泰证券20年投资收益总额20.89亿元 与净利润的比值高达80.92%,新浪
588,2021-04-25,中泰证券上市首份年报出炉，归母净利润同比增长12.26%,资本邦
589,2021-04-25,中泰证券2020年归母净利润超25亿元 同比增长12.26%,和讯
590,2021-04-23,中泰证券2020年归母净利润25.25亿元 同比增12.26%,北京商报
591,2021-04-23,中泰证券2020年实现净利润25亿，公司期货业务收入缩水超三成 盈利能力下降,搜狐
592,2021-04-23,中泰证券(600918.SH)2020年度净利润升12.26%至25.25亿元拟10派1.09元,格隆汇
593,2021-04-23,中泰证券：2020年净利润同比增长12.26%,Wind
594,2021-04-23,中泰证券：2020年计提资产减值准备4亿元 资产异常,Wind
595,2021-04-23,中泰证券(600918.SH)年度归母净利同比增12.26%至25.25亿元 拟10派1.09元,智通财经
596,2021-04-23,中泰证券一季度基金持仓结构分析主动型基金股票仓位降至85%,证券时报网
597,2021-04-21,再现高管变更 长江资管总经理离职 母公司长江证券资产托管部总经理杨忠接任 董监高成员变化,每日经济新闻
598,2021-04-19,但斌：调整或将持续到三季度或年底,上证报
599,2021-04-16,中泰证券--中科曙光：业绩符合预期，海光收入大幅增长【公司研究】,金融界股吧
600,2021-04-16,中泰证券--拓邦股份：Q1预告超预期，控制器龙头规模效应显现【公司研究】,金融界股吧
601,2021-04-16,中泰证券--圣邦股份：业绩略超预期，模拟龙头持续成长【公司研究】,金融界股吧
602,2021-04-16,中泰证券--北方稀土：20Q4单季度净利润创新高，业绩进入加速释放期【公司研究】,金融界股吧
603,2021-04-16,中泰证券--荣盛石化:一季度高增长，静待浙石化二期投产【公司研究】,金融界股吧
604,2021-04-16,民族品牌指数跌0.89% 中药类成分股逆势上涨,上证报
605,2021-04-15,中泰证券--中颖电子：Q1略超预期，关注产品组合变化【公司研究】,金融界股吧
606,2021-04-15,中泰证券--新洋丰：复合肥景气持续兑现，看好公司全年增长【公司研究】,金融界股吧
607,2021-04-15,美特斯邦威，消失的未来路,《商学院》杂志
608,2021-04-15,“牵手”中泰证券，邦德股份进入创业板IPO辅导阶段,资本邦
609,2021-04-15,中泰证券--房地产行业周观点：清明假期因素下，商品房成交小幅回落【行业研究】,金融界股吧
610,2021-04-15,中泰证券--银行角度看3月社融：信贷结构持续向好，实体融资需求较旺盛【行业研究】,金融界股吧
611,2021-04-14,又崩两个：“猪茅”逼近跌停、“药茅”盘中闪崩 接下来呢？,21世纪经济报道
612,2021-04-14,中泰证券--海思科:Q1业绩表现良好，Protac药物获批临床【公司研究】,金融界股吧
613,2021-04-14,中泰证券--仙琚制药:业绩超预期，国内制剂强劲恢复，API升级值得期待【公司研究】,金融界股吧
614,2021-04-14,中泰证券--森马服饰:业绩复苏趋势明显，运营质量大幅改善【公司研究】,金融界股吧
615,2021-04-14,券商晨会精华：针对抱团股估值过高的调整仍未结束,证券之星
616,2021-04-13,三年投入550亿，券商全力布局金融科技,财经网
617,2021-04-13,深耕电力电子设备领域 新风光（688663）成功登陆科创板,财经网
618,2021-04-13,中泰证券--杰瑞股份:2020年业绩稳健增长，看好非常规油气开发【公司研究】,金融界股吧
619,2021-04-13,中泰证券--中泰证券钢铁行业数据库【行业研究】,金融界股吧
620,2021-04-12,中泰证券--索菲亚:大宗放量，2021年多渠道多品类发力【公司研究】,金融界股吧
621,2021-04-12,中泰证券--迪安诊断:业绩超预期，新冠疫情下ICL业务全面提速，自产产品进入快速放量期【公司研究】,金融界股吧
622,2021-04-12,中泰证券--信捷电气：业绩符合预期，PLC及伺服份额显着提升【公司研究】,金融界股吧
623,2021-04-12,中泰证券--宁波银行详解宁波银行2020年报：大零售战略推进，高成长会持续【公司研究】,金融界股吧
624,2021-04-12,中泰证券--万华化学：三大业务持续向好，一季报业绩超预期【公司研究】,金融界股吧
625,2021-04-12,中泰证券--天孚通信：业绩高增长，持续加大光器件平台布局【公司研究】,金融界股吧
626,2021-04-09,中泰证券--浙江美大2020年报点评：景气持续，业绩稳健【公司研究】,金融界股吧
627,2021-04-09,中泰证券--科华数据：一季报高增长，探索IDC碳转型之路【公司研究】,金融界股吧
628,2021-04-08,中泰证券--三花智控：业绩符合预期，汽零业务高增【公司研究】,金融界股吧
629,2021-04-08,一季报行情来了？这公司预增1251%，股价立马涨停！,中国基金报
630,2021-04-08,中泰证券--食品饮料周思考（第14周）：基本面重掌股价主导权，关注春糖催化效应【行业研究】,金融界股吧
631,2021-04-08,中泰证券--银行周度跟踪：延期还本付息贷款延长，利率总体保持平稳【行业研究】,金融界股吧
632,2021-04-08,中泰证券--雷赛智能:21Q1业绩超预期，运控龙头加速扩张【公司研究】,金融界股吧
633,2021-04-08,中泰证券--金融服务深度：金融科技监管框架及行业趋势【行业研究】,金融界股吧
634,2021-04-08,中泰证券--农林牧渔行业周报：畜禽需求低迷，关注大企业扩产能兑现节奏【行业研究】,金融界股吧
635,2021-04-08,中泰证券--中泰化工周度观点22W14：两化重组终落地，化工迎来新发展【行业研究】,金融界股吧
636,2021-04-07,携高端新品亮相春糖 五粮液持续加码浓香白酒价值属性,每日经济新闻
637,2021-04-07,下周一上报综合账户试点，15家AA级券商均已行动，第三方生意又来，全面配合券商系统与柜台改造,财联社
638,2021-04-07,中泰证券两保代收监管函 未查新瀚新材实控人涉嫌行贿 问询,中国经济网
639,2021-04-07,中泰证券--《系统重要性银行附加监管规定》点评与测算：明确附加资本水平，总体压力小【行业研究】,金融界股吧
640,2021-04-07,中泰证券--银行：延期还本付息和信用贷款支持计划延长点评：体现政策连续性，资产质量压力有限【行业研究】,金融界股吧
641,2021-04-07,中泰证券--兴业银行：收入增速快，中收亮眼；财富代理、投行业务发力【公司研究】,金融界股吧
642,2021-04-07,中泰证券--中泰证券钢铁行业数据库【行业研究】,金融界股吧
643,2021-04-07,中泰证券--新洋丰：巩固成本优势，迈向新型肥蓝海【公司研究】,金融界股吧
644,2021-04-06,中泰证券--邮储银行详解邮储银行2020年报：零售优势继续巩固，资产质量保持优异【公司研究】,金融界股吧
645,2021-04-06,中泰证券--海尔智家2020年报点评：盈利改善显着释放【公司研究】,金融界股吧
646,2021-04-06,中泰证券--中国铁建：Q4业绩加速释放，订单储备充足彰显龙头本色【公司研究】,金融界股吧
647,2021-04-06,中泰证券--安迪苏：双支柱战略稳步推进，特种产品维持强劲【公司研究】,金融界股吧
648,2021-04-06,中泰证券--蒙娜丽莎：经营业绩稳步增长，双轮驱动公司发展【公司研究】,金融界股吧
649,2021-04-06,中泰证券--华菱钢铁：公司抵御风险能力渐强【公司研究】,金融界股吧
650,2021-04-06,中泰证券--恒力石化：民营炼化优势显着，一季度盈利大增【公司研究】,金融界股吧
651,2021-04-06,中泰证券--恒顺醋业：改革成效初显，期待更进一步【公司研究】,金融界股吧
652,2021-04-03,我关注的几个冷门基金经理的年报,新浪
653,2021-04-02,2000名投资人索赔超45亿，乐视网造假案余波未了，3家券商3家会计事务所牵扯其中，案件迎来关键进展,财联社
654,2021-04-02,中泰证券--佳发教育：智慧教育受疫情影响，标考拓展新场景【公司研究】,金融界股吧
655,2021-04-02,中泰证券--用友网络：云业务加速发展，企业战略进入新阶段【公司研究】,金融界股吧
656,2021-04-02,中泰证券--海天味业：疫情年增长强劲，2021目标彰显信心【公司研究】,金融界股吧
657,2021-04-02,中泰证券--万润股份：新材料平台凸显，步入成长快车道【公司研究】,金融界股吧
658,2021-04-02,中泰证券--东方雨虹:80亿定增落地，成长加速【公司研究】,金融界股吧
659,2021-04-02,中泰证券--凯普生物:新冠检测服务高需求下，2021Q1继续延续高速增长趋势，原有主业加速恢复【公司研究】,金融界股吧
660,2021-04-01,高瓴资本又出手了！豪掷16亿元参与东方雨虹定增,第一财经
661,2021-04-01,中泰证券--新城控股：双轮驱动，租金收入贡献高质量增长【公司研究】,金融界股吧
662,2021-04-01,中泰证券--赣锋锂业：业绩拐点已见，21年高增可期【公司研究】,金融界股吧
663,2021-04-01,中泰证券--中颖电子：Q1业绩超预期开启成长年【公司研究】,金融界股吧
664,2021-04-01,美特斯邦威，消失的未来路,商学院
665,2021-04-01,中泰证券--新洁能：Q4业绩符合预期，产能和涨价弹性驱动成长【公司研究】,金融界股吧
666,2021-03-31,中泰证券--医疗科技行业周报：新政推动互联网医疗行业规范发展，加速医疗服务数字化转型【行业研究】,金融界股吧
667,2021-03-31,中泰证券--种植行业深度报告：棉花行业的研究框架【行业研究】,金融界股吧
668,2021-03-31,中泰证券：天味食品(603317.SH)改革加速中，维持“买入”评级,智通财经
669,2021-03-31,中泰证券--泰格医药：主业加速恢复，在手订单持续快速增长，全球化布局可期【公司研究】,金融界股吧
670,2021-03-31,商道经纬丨震荡格局不改二季度A股乐观走势,中国经济时报
671,2021-03-31,中泰证券维持安迪苏买入评级：双支柱战略稳步推进，特种产品维持强劲,每日经济新闻
672,2021-03-31,中泰证券维持新和成买入评级：全年业绩稳健增长、长期成长值得期待,每日经济新闻
673,2021-03-31,中泰证券：太平鸟(603877.SH)Q4高增长延续，维持“买入”评级,智通财经
674,2021-03-31,中泰证券维持华熙生物买入评级，2020年报点评：功能性护肤持续亮眼,每日经济新闻
675,2021-03-31,券商晨会精华：市场大概率维持震荡 围绕业绩超预期的板块进行配置,财联社
676,2021-03-30,详解邮储银行2020年报：零售优势继续巩固，资产质量保持优异,金融界
677,2021-03-30,中泰证券给予晨光文具买入评级，Q4高增长，文创巨头稳步前行,每日经济新闻
678,2021-03-30,中泰证券给予华友钴业买入评级，2020年全年业绩高增，成长性不可忽视,每日经济新闻
679,2021-03-30,中泰证券给予欧普康视买入评级，业绩延续高增长，向眼视光综合服务商迈进,每日经济新闻
680,2021-03-30,【中泰金工】稳健为先：寻找匹配市场风格的“固收+”产品,ZTQuant
681,2021-03-30,中泰证券：工业补库有望延续，动力主要来自外需,证券时报网
682,2021-03-29,中泰证券：重申中国水务(00855)“买入”评级 目标价微升至10.55港元,智通财经
683,2021-03-29,原中泰研究所副所长笃慧离职“奔私”,上证报
684,2021-03-29,中泰证券--工商银行详细解读工商银行20年报：稳健向上，零售金融战略深化【公司研究】,金融界股吧
