1828,2020-07-27,7月27日深市创业板活跃股公开信息,深交所
1829,2020-07-27,【银华基金】交易日报 2020-07-27,新浪
1830,2020-07-27,万亿成交额按下暂停键，后续经济上行还是下降？,21世纪经济报道
1831,2020-07-27,全国优秀案例“桦川模式”：中泰证券“保险+期货”特色扶贫 探索精准扶贫可持续发展,鲁网
1832,2020-07-27,中泰证券股份有限公司关于撤销滁州,证券时报
1833,2020-07-27,中泰证券：基金通信整体持仓下降，物联网与光器件配置比例提升,证券时报网
1834,2020-07-27,中泰证券：短期疫情影响不改电动汽车发展趋势 持续看好宁德时代等,证券时报网
1835,2020-07-27,中泰证券：年内经济高点或在三季度出现,证券时报网
1836,2020-07-26,【中泰传媒—周观点】传媒板块连续三季度获超配，持续关注在线娱乐与在线消费,传媒产业大视点
1837,2020-07-26,周观点|跨境电商趋势有望延续，关注办公家居产业链,轻工二级圈
1838,2020-07-26,中泰证券梁中华：没有必然的上行周期,新浪
1839,2020-07-24,*ST金鸿(000669.SZ)：控股股东一致行动人新余中讯继续被动减持不超1344.97万股 减持股份,格隆汇
1840,2020-07-24,蚂蚁集团发布区块链应用一体机 六股掘良机,证券时报
1841,2020-07-23,【银华基金】交易日报 2020-07-23,新浪
1842,2020-07-23,7月23日深市创业板活跃股公开信息,深交所
1843,2020-07-23,中泰证券(600918.SH)：向中泰金融国际增资金额调整为不超16亿元,格隆汇
1844,2020-07-23,中泰证券打造“七个一工程” 确保扶贫攻坚落实落地,鲁网
1845,2020-07-23,中泰证券因地制宜推动产业扶贫：“输血”救济到“造血”自救,鲁网
1846,2020-07-23,中泰证券：基金加仓信息技术和医疗保健，减仓金融地产,证券时报网
1847,2020-07-23,中泰证券：创业板超配比例持续扩大，科创板持股比例提升至1.8%,证券时报网
1848,2020-07-23,中泰证券：机构持股占比继续提升，基金仓位大幅上升,证券时报网
1849,2020-07-23,中泰证券策略：机构化水平继续提升 抱团格局下价格效应显著,金融界
1850,2020-07-22,新版上证综指无缝切换，股市“晴雨表”功能渐显,第一财经
1851,2020-07-22,喜临门|家具业务Q2双位数增长，有望持续修复,轻工二级圈
1852,2020-07-22,中泰证券特色扶贫再登央视 CCTV发现之旅频道今晚展播,鲁网
1853,2020-07-22,本文精编自：中泰证券《宽禁带半导体行业深度：SiC 与 GaN 的兴起与未来》,富途证券
1854,2020-07-22,7月22日深市创业板活跃股公开信息,深交所
1855,2020-07-22,详解2季度银行股的基金持仓：持仓2.33%、环比下降1.71%【中泰银行·戴志锋/邓美君/贾靖】,传统借贷vs新型金融
1856,2020-07-22,互联网医疗纳入医保再进一步 六股布局良机,证券时报
1857,2020-07-21,冠昊生物现2笔大宗交易 共成交636.40万元,新浪
1858,2020-07-21,7月21日深市创业板活跃股公开信息,深交所
1859,2020-07-21,中泰证券(600918.SH)完成发行30亿元短期融资券,格隆汇
1860,2020-07-21,中泰证券：LG动力电池几乎是所有主流车企的核心供应商 关注璞泰来等,证券时报网
1861,2020-07-20,7月20日深市创业板活跃股公开信息,深交所
1862,2020-07-20,41股今日获机构买入评级,证券时报网
1863,2020-07-20,非银行金融行业：险资权益比例放开利好投资端 监管鼓励券业合并做大做强,新浪
1864,2020-07-20,中泰证券：“接管”金融机构的展望及对市场的影响,证券时报网
1865,2020-07-19,周观点|家居需求边际修复，精装链订单向好,轻工二级圈
1866,2020-07-17,机构密集上调个股业绩预测，最高调增14倍，真有价值吗？,红周刊
1867,2020-07-17,中泰证券：优化指标稳运营,中证协
1868,2020-07-17,券商板块午后再度跳水 中泰证券光大证券等跌停,证券时报网
1869,2020-07-17,光大证券、中泰证券午后接连封住跌停，券商板块跌幅继续扩大,Wind
1870,2020-07-17,"【行情】券商板块午后持续杀跌，太平洋、光大证券跌停，中泰证券、国海证券、中银证券、浙商证券等集体大跌，东方财富跌5%
连续下跌",金十数据
1871,2020-07-17,中泰证券：7月挖机销售有望再创新高 强推工程机械板块,证券时报网
1872,2020-07-16,山东国企改革加速度：三天内9家省属一级国企重组,证券时报网
1873,2020-07-16,【行情】券商板块尾盘杀跌，中泰证券跌停，中银证券、光大证券、华鑫股份、红塔证券集体下挫 连续下跌,金十数据
1874,2020-07-16,快讯：券商板块尾盘杀跌 中泰证券跌停,新浪
1875,2020-07-16,券商股尾盘继续下挫 浙商证券、中泰证券跌停,e公司
1876,2020-07-16,券商股午后继续走低,Wind
1877,2020-07-16,中泰证券：工程机械板块予增持评级 推荐中联重科,新浪
1878,2020-07-16,券商板块临近午盘跳水，中信证券跌超4%,Wind
1879,2020-07-16,猎鹰看盘：亏钱效应释放后 静待指数与情绪的共振反弹！,金融界
1880,2020-07-15,中信证券“单骑救盘”难挽板块跌势，券商股后市如何演绎？,第一财经
1881,2020-07-15,曹德云：“大资管”时代 将进一步推动保险和券商深度合作,证券时报
1882,2020-07-15,游资情报｜“孙哥”联手“章盟主”封板中泰证券；“赵老哥”“炒股养家”接盘第一创业！,每日经济新闻
1883,2020-07-15,龙虎榜：机构资金出逃！赵老哥溧阳路却集中杀入金融股,金融界
1884,2020-07-15,中泰证券龙虎榜数据（7月15日）,Wind
1885,2020-07-15,中泰证券换手率近50% 机构席位卖出7400万元,e公司
1886,2020-07-15,市值冲破20000亿，茅台如何走到今天？,钛媒体
1887,2020-07-15,中联重科上半年净利逼近去年全年，再融资预案刚出台认购方即斩获37.8亿浮盈,21世纪经济报道
1888,2020-07-15,【行情】中泰证券午后发力，股价冲击涨停，光大证券、东方证券、中信证券集体走高,金十数据
1889,2020-07-15,快讯：证券板块午后发力 中泰证券涨停,新浪
1890,2020-07-15,券商股拉升，中泰证券率先涨停,Wind
1891,2020-07-14,券商股走势现分化 资金+政策+业绩共振,红周刊
1892,2020-07-14,7月14日深市创业板活跃股公开信息,深交所
1893,2020-07-13,券商城投债承销业务研究（一）：项目资质与风险偏好,搜狐
1894,2020-07-13,7月13日深市创业板活跃股公开信息,深交所
1895,2020-07-13,【行情】券商板块午后发力，光大证券大涨8%，财通证券、中泰证券、天风证券、华林证券等集体跟涨,金十数据
1896,2020-07-13,中泰证券：新能源汽车全球产销拐点已现 电池头部企业持续集中（附股）,证券时报网
1897,2020-07-12,【中泰传媒—周观点】业绩预告披露高峰，重点关注在线娱乐领域相关子版块,传媒产业大视点
1898,2020-07-12,银行角度看6月社融持续高增：未来从“总量”到 “结构”【中泰银行·戴志锋/邓美君/贾靖】,传统借贷vs新型金融
1899,2020-07-12,江苏银行配股点评：提升核心一级资本充足率1.42%【中泰银行·戴志锋/邓美君/贾靖】,传统借贷vs新型金融
1900,2020-07-12,周观点|IQOS MRTP获批，电子烟长期趋势不变,轻工二级圈
1901,2020-07-10,7月10日深市创业板活跃股公开信息,深交所
1902,2020-07-10,"保龄宝现8笔大宗交易 共成交16,176.96万元",新浪
1903,2020-07-10,"华阳集团现7笔大宗交易 共成交6,572.02万元",新浪
1904,2020-07-10,[路演]打造民族药大健康产业领先品牌 大唐药业精选层挂牌网上路演成功举办,全景网
1905,2020-07-10,最前线 | 机构观点：全球新能源汽车产销拐点已至，电池行业马太效应加剧,36氪
1906,2020-07-10,多市场协同竞逐精选层“新赛道”,中证报
1907,2020-07-09,【银华基金】交易日报 2020-07-09,新浪
1908,2020-07-09,超级大单：百亿资金盘中出逃 盘后突发大消息,新浪
1909,2020-07-09,最强免税题材之后 下一个风口将至？,证券之星
1910,2020-07-09,海康威视：视频监控行业全球龙头 智慧城市拉动新一轮成长,证券之星
1911,2020-07-09,7月9日深市创业板活跃股公开信息,深交所
1912,2020-07-09,"英科医疗现2笔大宗交易 共成交3,857.58万元",新浪
1913,2020-07-09,券商股多数低开，中泰证券、太平洋跌超4%,Wind
1914,2020-07-09,中泰证券李迅雷：建议投资者在市场过热时保持理性,中证报
1915,2020-07-09,陕国投拟定增37亿元 引进新战投推动转型,证券日报
1916,2020-07-08,券商板块牛气冲天，多只连板股遭股东减持 减持股份,第一财经
1917,2020-07-08,前中泰证券煤炭行业首席转战首创证券,每日经济新闻
1918,2020-07-08,中泰证券母公司6月份净利2.16亿元环比大增,上证报
1919,2020-07-08,7月8日深市创业板活跃股公开信息,深交所
1920,2020-07-08,多家券商披露6月财务数据：中信建投母公司净利10亿元,金融界
1921,2020-07-08,中泰证券(600918.SH)：6月母公司净利达2.165亿元,格隆汇
1922,2020-07-08,中泰证券：母公司6月净利润2.17亿元,Wind
1923,2020-07-08,【行情】证券板块午后持续走强，东方财富涨停，太平洋、中泰证券等跟随上涨,金十数据
1924,2020-07-07,7月7日深市创业板活跃股公开信息,深交所
1925,2020-07-07,腾挪和集聚：中国人口迁徙路径之变,微信公众号
1926,2020-07-07,李迅雷：未来一线和新一线城市人口集中度还将继续提升 集中度或许会超乎大家想象,金融界
1927,2020-07-07,红牛金服66.67%股权被挂牌出售 两综股权转让底价合计1800元 资产异常,鲁网
1928,2020-07-07,陕国投A拟引进陕金控集团等3名战略投资者 陕西省国资委仍为实际控制人,经济观察网
1929,2020-07-07,中泰证券、光大证券均连续四日涨停,Wind
1930,2020-07-07,名酒恢复良好 券商看好茅五泸汾等2021年增长超10%,佳酿网
1931,2020-07-07,中泰证券：市场向上突破，大金融出现交易性机会,证券时报网
1932,2020-07-07,存储器巨头推动NAND布局投资 五股蓄势待发,证券时报
1933,2020-07-06,中泰证券龙虎榜数据(7月6日）,Wind
1934,2020-07-06,新三板精选层统计报告6月统计月报,资本邦
1935,2020-07-06,中泰证券：不存在应披露而未披露的重大事项或重要信息,Wind
1936,2020-07-06,涨停板复盘：沪指大涨创2年半新高 A股总市值超上轮牛市,新浪
1937,2020-07-06,十年复盘：中信证券引爆牛市可能性有多大？本来券商股行情有多高？,证券时报网
1938,2020-07-06,快讯：券商股早盘再度高开 中泰证券等多股涨停,新浪
1939,2020-07-06,券商板块大幅高开 中泰证券、光大证券、浙商证券、中银证券涨停,金融界
1940,2020-07-06,中泰证券、光大证券等4券商以涨停价开盘,Wind
1941,2020-07-06,【行情】券商股开盘延续强势，浙商证券、中泰证券涨停,金十数据
1942,2020-07-06,中泰证券：周期的“反弹”还是“反转”？,证券时报网
1943,2020-07-06,中泰证券：低估值板块蕴含估值修复可能 关注华菱钢铁等优质标的,证券时报网
1944,2020-07-05,周观点|思摩尔上市在即，建议关注电子烟产业链,轻工二级圈
1945,2020-07-05,银行股估值目前是怎样水平？【中泰银行·戴志锋/邓美君/贾靖】,传统借贷vs新型金融
1946,2020-07-04,券商领涨吹响“冲锋号角” 妖股凯撒文化高位徘徊,财富动力网
1947,2020-07-03,复盘券商分级基金涨停潮：投资风险偏好在上升,第一财经
1948,2020-07-03,中泰证券落实“七个一”工程推进扶贫工作,中证网
1949,2020-07-03,游资情报｜各路顶级游资“围猎”券商龙头；“作手新一”巨资封板比亚迪！,每日经济新闻
1950,2020-07-03,7月3日主力资金净流出125亿元,证券时报网
1951,2020-07-03,43股今日获机构买入评级,证券时报网
1952,2020-07-03,7月3日深市创业板活跃股公开信息,深交所
1953,2020-07-03,快讯：券商板块早盘持续走强涨3.96% 中泰证券、浙商证券涨停,证券日报
1954,2020-07-03,中泰证券连续两日涨停，市值突破千亿元,Wind
1955,2020-07-03,【行情】券商板块高开，浙商证券一字涨停，封单超百万手，中信建投涨9%，国金证券、山西证券、中泰证券等跟涨,金十数据
1956,2020-07-02,【行情】券商板块持续爆发，光大证券封板，中信建投大涨9%，中泰证券、东吴证券、招商证券纷纷走高,金十数据
1957,2020-07-02,上半年118家企业上市募资1393亿元 广东江苏浙江领先,中国经济网
1958,2020-07-02,中泰证券：展望下半年，市场仍会继续呈现较为明显的结构性行情,证券时报网
1959,2020-07-02,浙江百达精工股份有限公司关于以募集资金置换预先投入募投项目自筹资金的议案,证券时报
1960,2020-07-01,中泰证券：股票市场赚钱效应最好的阶段或已过去(附7月金股),中财网
1961,2020-07-01,中泰证券：卫健委全面加速推动公卫IT建设 重点看好卫宁健康等,证券时报网
1962,2020-07-01,中泰证券：继续看好科技和消费大方向,证券时报网
1963,2020-06-30,6月30日深市创业板活跃股公开信息,深交所
1964,2020-06-30,机构押注容大感光 赵老哥割肉中泰证券,财富动力网
1965,2020-06-30,中泰证券：如果监管试点给银行券商牌照 预计只会是少数,e公司
1966,2020-06-30,中泰证券：电子工业“血液”，特种气体国产化势在必行（附股）,证券时报网
1967,2020-06-29,6月29日深市创业板活跃股公开信息,深交所
1968,2020-06-29,"利亚德现8笔大宗交易 共成交2,706.30万元",新浪
1969,2020-06-29,快讯：券商股尾盘继续下挫 中泰证券接近跌停,新浪
1970,2020-06-29,【异动股】券商信托板块下挫，中泰证券(600918-CN)跌6.88%,财华社
1971,2020-06-29,券商股午后持续走弱 中泰证券跌超8%,e公司
1972,2020-06-29,顾家家居|引入外部投资者，股权结构优化,轻工二级圈
1973,2020-06-29,【异动股】券商概念板块下挫，中泰证券(600918-CN)跌5.94%,财华社
1974,2020-06-29,券商板块走弱 红塔证券、中泰证券跌近6%,格隆汇
1975,2020-06-29,快讯：证券板块持续下跌 中泰证券跌超7% 连续下跌,新浪
1976,2020-06-29,券商股早盘走弱 中泰证券跌超5%,e公司
1977,2020-06-29,券商股盘初下挫，红塔证券、中泰证券跌逾7%,Wind
1978,2020-06-29,中泰证券点评5月工业企业利润数据：利润改善销售回落 经济数据或先上后下 盈利能力下降,金融界
1979,2020-06-29,中泰证券：给银行大规模发券商牌照可能性很小 看好头部金融机构,证券时报网
1980,2020-06-28,周观点|市场份额向线上转移，继续关注海外办公家居产业链,轻工二级圈
1981,2020-06-28,梦金园已接受中泰证券为A股IPO辅导机构,资本邦
1982,2020-06-24,利亚德现18笔大宗交易均为折价成交,证券时报网
1983,2020-06-24,中小盘次新股科创板周报一百五十七期：次新股指数下跌 关注国内智能物流系统领军企业瑞晟智能,新浪
1984,2020-06-24,"利亚德现18笔大宗交易 共成交14,290.75万元",新浪
1985,2020-06-24,双券商“护航”！新三板摘牌公司新风光冲刺科创板IPO，股东席隐现两家A股上市公司,资本邦
1986,2020-06-24,中泰证券：看好资本实力雄厚，具备各自禀赋及先发优势的国内头部券商,证券时报网
1987,2020-06-23,山东福牌阿胶股份有限公司终止上市辅导 IPO融资异常,资本邦
1988,2020-06-23,6月23日深市创业板活跃股公开信息,深交所
1989,2020-06-23,港股异动︱心动公司(02400)涨超4% 获中泰证券首予“买入”评级,智通财经
1990,2020-06-23,猎鹰看盘：指数与情绪持续背离 短期如何应对？,金融界
1991,2020-06-23,梁金辉连任古井贡董事长，豪华董事会将如何拉动200亿目标？,中国白酒网
1992,2020-06-22,游资情报｜章盟主仍“爱”凯撒文化，“小鳄鱼”却对这只股票下手,每日经济新闻
1993,2020-06-22,中泰证券首予心动公司(02400.HK)买入评级,格隆汇
1994,2020-06-22,47股今日获机构买入评级 13股上涨空间超20%,证券时报网
1995,2020-06-22,管理费不够“塞牙缝”：中泰资管公募业务成鸡肋，章飚卸任董事长 董监高成员变化,新浪
1996,2020-06-22,非银行金融行业：沪指编制优化+股指期权松绑 资本市场改革开放方向厘清,新浪
1997,2020-06-21,测算！1.5万亿的让利给谁？——42%可能惠及中小微企业 【中泰银行·戴志锋/邓美君/贾靖】,传统借贷vs新型金融
1998,2020-06-21,周观点|海外办公家居产业链重构，跨境电商标的有望超预期,轻工二级圈
1999,2020-06-20,中泰证券李迅雷：明年的黄金价格有可能创历史新高,e公司
2000,2020-06-19,上海证券交易所2020年06月19日主板交易信息,上交所
2001,2020-06-19,6月19日深市创业板活跃股公开信息,深交所
2002,2020-06-19,浙矿股份开板首日上演“天地板” 中泰证券上海四家营业部齐出货,证券之星
2003,2020-06-19,证券行业周报：大盘震荡 券商表现一般,华福证券有限责任公司
2004,2020-06-18,游资情报｜“赵老哥”、“作手新一”携手机构高位出货两只医药股；“章盟主”介入1只软件股！,每日经济新闻
2005,2020-06-18,6月18日深市创业板活跃股公开信息,深交所
2006,2020-06-18,中泰证券总裁毕玉国一行走访证券时报,证券时报网
2007,2020-06-18,充电桩发展迎来“井喷期” 五股迎腾飞契机,证券时报
2008,2020-06-17,900亿资产迎来新“舵手”！这家资管公司董事长、CEO双双换人 董监高成员变化,中证报
2009,2020-06-17,中泰资管高管变动 董事长、CEO双双换人 董监高成员变化,中证网
2010,2020-06-17,中泰证券、红塔证券双辅导 新风光已完成上市辅导,资本邦
2011,2020-06-17,中泰证券等16股获特大单资金净流入超2亿元,证券时报
2012,2020-06-16,龙虎榜｜中泰证券止步9连板 兴业证券净买入1.7亿元,重庆商报
2013,2020-06-16,中泰证券：普洛斯梅志明入驻董事会，持续回购彰显转型信心,乐居财经
2014,2020-06-16,游资情报 | 方新侠、“荣超割肉王”联手抢筹开板次新股；“章盟主”出货智慧口岸概念股,每日经济新闻
2015,2020-06-16,主力资金：暴涨17倍的芯片龙头突然崩了，2亿资金蜂拥出逃,中财网
2016,2020-06-16,上海证券交易所2020年06月16日主板交易信息,上交所
2017,2020-06-16,26股今日获机构买入评级,中财网
2018,2020-06-16,A股市场主力资金净流入56.12亿元 中泰证券净流入额居首,第一财经
2019,2020-06-16,青达环保拟科创板上市，实控人浮出水面,搜狐
2020,2020-06-16,青达环保拟科创板IPO，已完成上市辅导工作,资本邦
2021,2020-06-16,新股提示：中泰证券打开连续一字涨停,e公司
2022,2020-06-16,我国5G毫米波芯片研发成功 六股迎腾飞契机,证券时报
2023,2020-06-15,非银金融周报：创业板注册制改革落地 利好行业长期发展,新浪
2024,2020-06-15,81只股涨停 最大封单资金6.00亿元,中财网
2025,2020-06-15,中泰证券梁中华点评5月经济数据：经济复苏仍偏弱 再下行压力仍大,金融界
2026,2020-06-15,61只股上午收盘涨停(附股),中财网
2027,2020-06-15,[观点]中泰证券：债券市场或许还有1-2年的牛市,全景网
2028,2020-06-12,上海证券交易所2020年06月12日主板交易信息,上交所
2029,2020-06-12,6月12日深市创业板活跃股公开信息,深交所
2030,2020-06-12,6月12日主力资金净流出162亿元,证券时报网
2031,2020-06-12,上市券商2020年5月月报点评：环比明显下滑、同比仍有改善,新浪
2032,2020-06-12,华恒生物时隔4年后冲刺科创板，背后股东“故事”多,科创板日报
2033,2020-06-12,41只股上午收盘涨停(附股),证券时报网
2034,2020-06-12,港股异动︱心动公司(02400)涨超10%创逾两个月新高 获中泰证券首予“买入”评级,智通财经
2035,2020-06-12,心动公司大涨超7% 中泰证券首予买入评级,证券时报网
2036,2020-06-12,新股中泰证券开盘继续直接涨停，收获8连板,Wind
2037,2020-06-11,中泰证券龙虎榜数据（6月11日）,Wind
2038,2020-06-11,中泰证券：股票交易异常波动,每日经济新闻
2039,2020-06-11,6月11日深市创业板活跃股公开信息,深交所
2040,2020-06-11,62只股涨停 最大封单资金8.30亿元,证券时报网
2041,2020-06-11,69只股上午收盘涨停(附股),证券时报网
2042,2020-06-11,北上资金流入加速，融资余额大幅提升——资金面周观察,修炼投资的水晶球
2043,2020-06-11,新股中泰证券继续涨停，收获7连板,Wind
2044,2020-06-11,银行角度看5月社融持续高增：结构改善，观察持续性【中泰银行·戴志锋/邓美君/贾靖】,传统借贷vs新型金融
2045,2020-06-11,中泰证券：燃料电池重卡大势所趋，产业化有望提速（附股）,证券时报网
2046,2020-06-10,6月10日深市创业板活跃股公开信息,深交所
2047,2020-06-10,3万股东看懵圈：这只次新股暴涨350%后，今日18秒从涨停到跌停！逾4000万资金被闷杀，谁在砸盘？,每日经济新闻
2048,2020-06-10,新浪微博被严厉处罚，将停更热搜话题榜一周！字节跳动概念龙头被甩卖,证券时报网
2049,2020-06-10,上海证券交易所2020年06月10日主板交易信息,上交所
2050,2020-06-10,券商股6月开门红中泰证券连续4个交易日涨停,投资时报
2051,2020-06-10,37只股上午收盘涨停(附股),证券时报网
2052,2020-06-10,中泰证券：国内大硅片有望发力 建议关注沪硅产业等,证券时报网
2053,2020-06-10,北斗三号组网倒计时 六股腾飞在即掘金良机,证券时报
2054,2020-06-09,中小盘次新股/科创板周报一百五十五期：次新股指数上涨 关注国内先进环保技术供应商路德环境,新浪
2055,2020-06-09,83股涨停 中泰证券最受资金追捧,证券时报网
2056,2020-06-09,83只股涨停 最大封单资金7.10亿元,证券时报网
2057,2020-06-09,58只股上午收盘涨停(附股),证券时报网
2058,2020-06-09,券商股盘中全线走强 中泰证券涨停,中国经济网
2059,2020-06-09,券商股震荡攀升，新股中泰证券上市五日仍未开板,Wind
2060,2020-06-09,常熟银行溢价参股镇江农商行藏隐忧：标的潜在不良或达11%,新浪
2061,2020-06-09,中泰证券：2020年欧洲开启电动汽车爆发元年 看好宁德时代等,证券时报网
2062,2020-06-08,【主力资金】芯片龙头突发利空被砸！苹果新计划引爆这个题材，龙头获超20亿追捧,证券时报网
2063,2020-06-08,44股今日获机构买入评级,证券时报网
2064,2020-06-08,6月8日深市创业板活跃股公开信息,深交所
2065,2020-06-08,一图看宏观：中泰宏观每日一图集锦（20200601~20200605）,梁中华宏观研究
2066,2020-06-08,52只股上午收盘涨停(附股),证券时报网
2067,2020-06-08,策略日报：量能能否突围 是行情持续关键,新浪
2068,2020-06-08,中泰研究杨畅：摆地摊、松航班 经济或“高位缓释”,金融界
2069,2020-06-08,中泰证券：全球经济低迷下房价上涨之谜,金融界
2070,2020-06-08,财富管理转型迈入“买方投顾”时代 券商深度改造传统营业部,中国基金报
2071,2020-06-07,周观点|继续关注软体龙头，疫情加速办公家居渗透率提升,轻工二级圈
2072,2020-06-07,10万亿级财富管理大转型！,中国基金报
2073,2020-06-07,清科数据：本周投资、上市和并购共100起事件， 涉及总金额360.29亿元人民币,科创板日报
2074,2020-06-06,中泰证券敲钟上市 创新助力实体经济发展,中国经营报
2075,2020-06-05,中泰证券6月3日在上交所主板上市 目标冲击券商第一方阵,证券市场周刊
2076,2020-06-05,6月5日深市创业板活跃股公开信息,深交所
2077,2020-06-05,涨停股复盘：9股封单超亿元,证券时报网
2078,2020-06-05,中泰证券母公司5月营收4.06亿元、净利9071万元,资本邦
2079,2020-06-05,券商5月业绩再坐“过山车”，环比普降同比分化 盈利能力下降,第一财经
2080,2020-06-05,李迅雷：A股仍然延续分化特征市场会给核心资产更高估值水平（上）,财界网
2081,2020-06-04,晚间公告热点追踪：上市券商披露5月财务数据,新浪
2082,2020-06-04,中泰证券母公司5月实现净利9071万元,上证报
2083,2020-06-04,公告点题｜6月4日这些公告有看头,第一财经
2084,2020-06-04,中泰证券：母公司5月营收超4亿元 净利9071万元,证券时报网
2085,2020-06-04,中泰证券(600918.SH)：5月母公司净利达9070.79万元,格隆汇
2086,2020-06-04,33股今日获机构买入评级,证券时报网
2087,2020-06-04,6月4日深市创业板活跃股公开信息,深交所
2088,2020-06-04,常熟银行入股镇江农商行：并购熟悉的银行，外延扩张打下基础【中泰银行·戴志锋/邓美君/贾靖】,传统借贷vs新型金融
2089,2020-06-04,66只股上午收盘涨停(附股),证券时报网
