1120,2021-01-28,【行情】证券板块异动拉升，锦龙股份涨超8%，华创阳安、中信建投、湘财股份、中泰证券等跟涨,金十数据
1121,2021-01-28,中泰证券--九强生物：短期生化血凝受疫情影响，中长期看好免疫组化打开成长空间【公司研究】,金融界股吧
1122,2021-01-28,中泰证券--浦发银行：营收增速拐头向上，资产质量改善【公司研究】,金融界股吧
1123,2021-01-28,中泰证券--东鹏控股:业绩增长超预期，经营拐点已现【公司研究】,金融界股吧
1124,2021-01-28,中泰证券--中泰证券复利防御【投资策略】,金融界股吧
1125,2021-01-28,中泰证券--固定收益专题报告：阳和不择地，海角亦逢春~盐城市城投全梳理【债券研究】,金融界股吧
1126,2021-01-27,年度盘点|2021年券商偏爱哪些房企？,搜狐
1127,2021-01-27,中泰证券--中信银行20年业绩快报：营收平稳，不良率改善较多【公司研究】,金融界股吧
1128,2021-01-27,中泰证券--宁波银行配股点评：核心一级资本充足率升至10.49%，确保其跑步前行【公司研究】,金融界股吧
1129,2021-01-27,中泰证券--珀莱雅:战略合作亚什兰，品牌持续升级【公司研究】,金融界股吧
1130,2021-01-27,中泰证券--资金面周观察：股市流动性上升，南下资金创新高【投资策略】,金融界股吧
1131,2021-01-27,"中泰证券--大参林：业绩预告符合预期,华南龙头加速走向全国【公司研究】",金融界股吧
1132,2021-01-27,中泰证券--江山欧派：高增长持续，期待品类协同【公司研究】,金融界股吧
1133,2021-01-26,连跌两周后，白酒股卷土重来？ 估值已达历史高位 机构提醒“要喝好酒”,每日经济新闻
1134,2021-01-26,美农生物拟A股上市中泰证券担任辅导机构,中证报
1135,2021-01-26,康龙化成今股价跌8% 中泰证券浙商证券昨日刚喊买入,中国经济网
1136,2021-01-26,新三板策略报告：详析2020年度做市商评优结果,新浪
1137,2021-01-26,1月26日深市创业板活跃股公开信息,深交所
1138,2021-01-26,重庆银行IPO：净息差稳定拨备计提增加依托区位优势再腾飞,搜狐
1139,2021-01-26,宁波银行拟配股募资不超120亿 银行资本补充密集进行,中国经济网
1140,2021-01-26,中泰证券：看好在融资端强管控背景下，龙头房企经营质量改善,证券时报网
1141,2021-01-26,定增、可转债、配股齐上阵银行花样“补血”强身,中证报
1142,2021-01-25,多家碳酸锂企业大幅调涨报价 五股布局良机,证券时报
1143,2021-01-25,中孚信息跌14.27% 上周中泰证券发研报喊买入,中国经济网
1144,2021-01-25,中泰证券：三道红线五档房贷，房地产的过去与未来,乐居财经
1145,2021-01-25,重牵“故人”手，联迪信息终止精选层小IPO辅导 IPO融资异常,资本邦
1146,2021-01-25,一键布局医药创新龙头 工银创新药产业ETF重磅发行,新浪
1147,2021-01-25,关于同意中泰证券股份有限公司为南方中证银行交易型开放式指数证券投资基金提供主流动性服务的公告,上交所
1148,2021-01-25,中泰证券：自动化构筑制造强国，工控行业国产品牌加速崛起,证券时报网
1149,2021-01-25,中泰证券：海外电动需求爆发，大中客出口迎来机遇,证券时报网
1150,2021-01-22,鲁证期货后台违规推荐客户领提成 大股东为中泰证券 金融监管处罚,中国经济网
1151,2021-01-22,中孚信息跌12% 昨日中泰证券刚发研报喊买入,中国经济网
1152,2021-01-22,1月22日深市创业板活跃股公开信息,深交所
1153,2021-01-22,中泰证券：燃料电池产业化提速，关注电堆系统及关键零部件国产化机会,证券时报网
1154,2021-01-21,科大讯飞放量涨停，市值破千亿元，资金博弈激烈,第一财经
1155,2021-01-21,1月21日深市创业板活跃股公开信息,深交所
1156,2021-01-21,开年券商开户又爆棚！国金倍数增长，湘财半月超过上月三成…90、00后比重超50%，85后整体超70%,财联社
1157,2021-01-21,最新进展！山钢完成7户非主业资产退出,鲁网
1158,2021-01-21,新瀚新材IPO：董事长行贿未披露 “潇洒”分红后募资补流翻倍增至1亿元 其他违规处罚,产业经济新闻网
1159,2021-01-20,可交换私募债跟踪：私募EB每周跟踪,新浪
1160,2021-01-20,算上通胀和房价，2020年中国居民收入真的翻一番吗？,时代周报
1161,2021-01-20,中泰证券与华鲁集团拓宽合作领域,大众日报
1162,2021-01-20,2020年全国股转公司减免做市交易经手费上千万,中证报
1163,2021-01-19,最牛券商来了！利润暴涨18倍股价狂飙7倍，富途、老虎站上风口，马化腾雷军又赢了！,金融界
1164,2021-01-19,"齐翔腾达现3笔大宗交易 共成交12,624.54万元",新浪
1165,2021-01-19,1月19日深市创业板活跃股公开信息,深交所
1166,2021-01-19,中泰证券：下游需求爆发，八英寸晶圆供不应求带来涨价潮,证券时报网
1167,2021-01-19,中泰证券：融资拐点已现，单月经济或已在高点区间,证券时报网
1168,2021-01-18,"智飞生物现5笔大宗交易 共成交49,307.04万元",新浪
1169,2021-01-18,1月18日深市创业板活跃股公开信息,深交所
1170,2021-01-18,"齐翔腾达现6笔大宗交易 共成交16,516.80万元",新浪
1171,2021-01-18,稀土板块大涨，政策支撑供给端维持刚性，稀土价格将继续强势,第一财经
1172,2021-01-18,中泰证券：原材料价格坚挺叠加供需格局改善 CCL企业利润有望上行,证券时报网
1173,2021-01-17,四季度做市商评价结果:三家手续费全免 九州证券、申万宏源、安信,新浪
1174,2021-01-15,交易日报 2021-1-15,新浪
1175,2021-01-15,新三板2020年四季度做市商评价及年度评优结果出炉,中国金融新闻网
1176,2021-01-15,"国联股份现5笔大宗交易 共成交4,911.09万元",新浪
1177,2021-01-15,"金莱特现3笔大宗交易 共成交1,424.11万元",新浪
1178,2021-01-15,【泰山财经·鲁股速递】卓英社科技终止4年上市辅导，曾拟创业板上市 IPO融资异常,鲁网
1179,2021-01-15,联科科技过会：今年IPO过关第26家 中泰证券过首单,中国经济网
1180,2021-01-15,中泰证券：短期地产投资增速预计放缓，但韧性延续,证券时报网
1181,2021-01-14,中泰证券：新城控股单月销售大幅增长，土地投资维持积极,乐居财经
1182,2021-01-14,中泰证券：银行股的核心投资逻辑是宏观经济，继续看好板块估值修复行情,证券时报网
1183,2021-01-13,中泰证券(600918.SH)：拟变更会计师事务所 变更会计师,格隆汇
1184,2021-01-13,中泰证券12月金融数据点评：信用收缩压力渐增,证券时报网
1185,2021-01-13,中泰证券：汽车行业面临着百年变局 重点配置具备全球竞争力的核心资产,证券时报网
1186,2021-01-12,钛白粉板块强势领涨，新一轮涨价潮来了，板块迎来景气大年,第一财经
1187,2021-01-12,深度*行业*证券行业券商板块12月数据点评：股债行情全面上行 证监会定调资本市场改革方向,新浪
1188,2021-01-11,太火了！又有多只爆款基金诞生 新基金单只吸金超400亿 单日狂卖千亿元,每日经济新闻
1189,2021-01-11,中伟股份跌12% 中泰证券3天前刚发研报唱多,中国经济网
1190,2021-01-11,2100元的贵州茅台贵不贵？股价能到2700元吗？,新浪
1191,2021-01-11,中泰证券：蔚来ET7将使用激光雷达等新一代自动驾驶及150kWh半固态电池包等技术,证券时报网
1192,2021-01-10,2020年量化私募规模翻番 首只纯量化私募FOF即将推出,中证网
1193,2021-01-10,A股周一见 | 大盘站上3500点 券商高呼还有空间,第一财经
1194,2021-01-09,港股“支付第一股”汇付天下临退市 半年亏损1.1亿 中小支付路在何方？,商学院
1195,2021-01-08,春节前后该买什么？中泰证券：节前效应有色金属最强，节后为农林牧渔,e公司
1196,2021-01-08,中泰证券：当前是A股头部游戏股较好买入时机,证券时报网
1197,2021-01-07,淳中科技跌停 两个月前中泰证券海通证券曾研报唱多,中国经济网
1198,2021-01-07,股东“忙”减持，天齐锂业却涨停，游资身影频现 减持股份,第一财经
1199,2021-01-06,中泰证券获全国企业管理现代化创新成果二等奖,大众日报
1200,2021-01-06,厦门与中泰证券签订战略合作协议,厦门日报
1201,2021-01-06,中泰证券：2021年钢铁行业投资要注重节奏和结构的把握,证券时报网
1202,2021-01-06,中泰证券：发挥专业优势 实施金融扶贫,中证网
1203,2021-01-05,中泰证券遭责令改正 分析师写史丹利研报现重大错误,中国经济网
1204,2021-01-05,证券行业周报：退市新规正式落地 提高上市公司质量再进一步,新浪
1205,2021-01-05,1月5日深市创业板活跃股公开信息,深交所
1206,2021-01-05,中泰证券杨畅：2021年中国经济的基调仍以“不急转弯”为主,国是直通车
1207,2021-01-05,中泰证券纺织服装2021年度投资策略,金融界
1208,2021-01-05,【行情】证券板块震荡走弱，国盛金控、方正证券跌6%，中金公司、中泰证券、华鑫股份等均跌逾4%,金十数据
1209,2021-01-05,券商IPO竞速 资本金 “补血”进行时,时代周报
1210,2021-01-05,中泰证券：看好券商板块 建议关注头部优质券商,证券时报网
1211,2021-01-05,中泰证券：国产Model Y降价上市 看好具备全球竞争力的国产供应链企业,证券时报网
1212,2021-01-04,中泰证券泰安及下属营业部7项违规 遭证监局责令改正 金融监管处罚,中国经济网
1213,2021-01-04,48股今日获机构买入评级9股上涨空间超20%,证券时报网
1214,2021-01-04,中泰证券七大问题遭监管点名:向客户提供礼品、前员工涉嫌犯罪 金融监管处罚,电鳗快报
1215,2021-01-04,向客户提供礼品、前员工涉嫌犯罪…中泰证券七大问题遭监管点名 金融监管处罚,券商中国
1216,2021-01-04,向客户提供礼品、前员工涉嫌犯罪…这家券商接罚单，七大合规问题遭监管逐一点名 金融监管处罚,券商中国
1217,2021-01-04,1月各行业观点及重点推荐标的,新浪
1218,2021-01-03,中泰证券：行情或步入进攻阶段仍建议均衡配置（附一月金股）,金融界
1219,2021-01-01,券商2020年度研究能力大起底：最牛金股阳光电源涨近600% 96股表现不如人意,时代财经
1220,2020-12-31,宁波色母过会：今年IPO过关第387家 国信证券过15单,中国经济网
1221,2020-12-31,富春染织过会：今年IPO过关第384家 国元证券过9单,中国经济网
1222,2020-12-31,午评丨市场情绪高涨 金融股爆发,21世纪经济报道
1223,2020-12-31,直奔2000元/股！刚刚，贵州茅台股价又创新高了！,上游新闻
1224,2020-12-31,保暖保供彰显国企担当,大众日报
1225,2020-12-31,“六个管住”夯实干事创业根基,大众日报
1226,2020-12-31,楚天龙过会：今年IPO过关第385家 中信证券过29单,中国经济网
1227,2020-12-31,盈科资本独家领投矽昌通信,中证网
1228,2020-12-31,康巴赫回应质疑：确系德国品牌 拥有专利技术,TechWeb
1229,2020-12-31,中国多地新冠病例散发 双节将至如何防传染？,中新网
1230,2020-12-31,中泰证券--2021年房地产行业年度策略：轻博弈 重经营,金融界
1231,2020-12-31,微盟集团(02013.HK)：视频直播、零售、广告，微盟发展三大强劲动力，维持“买入”评级,格隆汇
1232,2020-12-31,创业板IPO|哈焊华通冲刺创业板 背靠国资科技创新或难达预期,资本邦
1233,2020-12-31,天猫回应因不正当价格行为案被罚：真诚接受，全面整改,电商报
1234,2020-12-31,【异动股】信义香港(08328-HK)涨10.48%,财华社
1235,2020-12-31,【异动股】翼辰实业(01596-HK)涨10.91%,财华社
1236,2020-12-31,创业板股最新筹码变动：3股股东户数降逾一成,证券时报网
1237,2020-12-31,2021空调新冷年：涨价潮来袭 企业瞄准健康赛道,中国家电网
1238,2020-12-31,2020年海南省煤电行业淘汰落后产能公告,我的钢铁
1239,2020-12-31,停不下来！银行ETF暴力吸金逾7亿，最新规模首超90亿元创历史新高,华夏时报
1240,2020-12-31,热点解读丨5G：终端连接数超过2亿,维库电子市场
1241,2020-12-31,【山证非银】行业周报（20201228-20201231）：退市新规正式落地，提高上市公司质量再进一步,山西证券研究所
1242,2020-12-31,中泰证券：5G投资需关注结构性机会 重视AIOT应用与终端创新驱动的市场机遇,证券时报网
1243,2020-12-30,新能源车产业增长确定 锂相关产业链有望迎机遇,证券时报网
1244,2020-12-30,96家券商今年并购重组财务顾问执业能力评级出炉：14家获A、14家升级、这1家连升2级！,每日经济新闻
1245,2020-12-30,17家券商评价遭下调，这家券商连升两级 ！2020年度并购重组财务顾问执业能力评价出炉,中证报
1246,2020-12-30,证券行业周报：金融科技监管导向进一步明确,新浪
1247,2020-12-30,可交换私募债跟踪：私募EB每周跟踪,新浪
1248,2020-12-30,晶雪股份过会:今年IPO过关第380家 民生证券过18.5单,中国经济网
1249,2020-12-30,英诺激光过会：今年IPO过关第379家 长城证券过2单,中国经济网
1250,2020-12-29,连压特斯拉3个月，五菱“神车”火了！股民狂追却遭闪崩：原来炒错了 连续下跌,每日经济新闻
1251,2020-12-29,中泰证券刘珂滨谈刑法修改：突出警示“关键少数” 强化中介机构看门人职责,证券时报
1252,2020-12-29,中泰证券研报现数据重大错误被监管 涉化肥股史丹利 金融监管处罚,GPLP犀牛财经
1253,2020-12-29,"A股""餐饮供应链""第一股冲刺IPO",凤凰网
1254,2020-12-29,中泰证券：参股公司青鸟软通首发辅导备案登记已获受理,Wind
1255,2020-12-28,聚焦移动互联网开放生态，卓易科技终止上市辅导 IPO融资异常,资本邦
1256,2020-12-28,华蓝集团过会：今年IPO过关第376家 太平洋证券过2单,中国经济网
1257,2020-12-28,宏昌科技过会：今年IPO过关第377家 国信证券过14单,中国经济网
1258,2020-12-28,中泰证券：2021年新能源汽车板块中成长、周期和重塑的投资机会多点开花,证券时报网
1259,2020-12-26,因研报出现重大错误，又一家券商收罚单，今年已有5家券商被罚！ 金融监管处罚,证券时报网
1260,2020-12-26,监管点名批评！1200亿券商研报内容出现重大错误,中国基金报
1261,2020-12-26,突发！研报内容出现重大错误，1200亿券商“出事”！监管出手了,中国基金报
1262,2020-12-26,中泰证券“出事”：研报内容出现重大错误 监管出手了,中国基金报
1263,2020-12-25,研报内容现重大错误 中泰证券收行政监管措施决定书 其他违规处罚,上游新闻
1264,2020-12-25,中泰证券研报失真遭证监会处罚 金融监管处罚,网易
1265,2020-12-25,【公告抢先看】晚间重要公告:和邦生物孙公司拟投建年产8GW光伏封装材料及制品项目、乐山电力拟进行电价调整,金融界
1266,2020-12-25,研报内容出现重大错误 中泰证券被山东证监局采取责令改正监管措施 金融监管处罚,中证网
1267,2020-12-25,快讯｜中泰证券因史丹利研究报告被山东证监局责令改正 金融监管处罚,每日经济新闻
1268,2020-12-25,史丹利研报未遵循独立客观等原则，中泰证券被行政监管 金融监管处罚,中新经纬
1269,2020-12-25,12月25日上市公司晚间公告速递,新浪
1270,2020-12-25,"利亚德现7笔大宗交易 共成交6,188.44万元",新浪
1271,2020-12-25,中泰证券：因研报问题收到山东证监局行政监管措施决定书 金融监管处罚,Wind
1272,2020-12-25,创业板IPO|新三板摘牌企业华鸿科技闯关创业板，境外销售占比较高或存风险,资本邦
1273,2020-12-25,中泰证券首席分析师杨畅：一线城市房价上涨，或让货币政策制定陷入两难,时代在线
1274,2020-12-25,券商板块走高，中原证券涨停,Wind
1275,2020-12-25,券商股发力带领三大股指翻红 机构：布局券商板块的时间窗口正在临近,第一财经
1276,2020-12-25,浙江新能过会：今年IPO过关第374家 财通证券过6单,中国经济网
1277,2020-12-25,鑫铂股份过会：今年IPO过关第375家 华林证券过2单,中国经济网
1278,2020-12-25,“白酒信仰”松动？最牛板块惊现批量跌停，龙虎榜机构在出逃，近半受访者已落袋为安！,证券时报网
1279,2020-12-24,中联数据过会：今年IPO过关第371家 华泰联合过14单,中国经济网
1280,2020-12-24,中泰证券：客户行业拓展 重申人瑞人才(06919)“买入”评级,智通财经
1281,2020-12-24,中泰证券：教育行业建议重点关注竞争优势显著、业绩稳定增长的细分领域龙头,证券时报网
1282,2020-12-23,新瀚新材创业板IPO过会：保荐机构曾间接持股 实控人行贿被问询 其他违规处罚,中华网
1283,2020-12-23,继第一大股东股份被拍卖 中珠医疗第二大股东被申请破产清算 减资破产,中新经纬
1284,2020-12-23,江苏博云过会：今年IPO过关第368家 申港证券过2单,中国经济网
1285,2020-12-23,中熔电气过会：今年IPO过关第369家 中原证券过8单,中国经济网
1286,2020-12-23,申菱环境过会：今年IPO过关第367家 中信建投过31单,中国经济网
1287,2020-12-23,后疫情时代的模式优化与效率提升——教育行业2021年度投资策略 | 中泰社服教育,悦读文旅
1288,2020-12-23,私募EB每周跟踪：可交换私募债跟踪,新浪
1289,2020-12-23,中泰证券与枣庄市政府签署全面战略合作协议,大众日报
1290,2020-12-23,中泰证券：看好景气回升下的白电、厨电龙头公司（附股）,证券时报网
1291,2020-12-22,资本市场三十周年·中泰证券李迅雷：A股市场走向成熟不可能一蹴而就,中财网
1292,2020-12-22,非银金融板块加速走弱，机构认为后续上涨动能充足丨牛熊眼,第一财经
1293,2020-12-22,券商板块震荡走低，哈投股份跌逾6%,Wind
1294,2020-12-22,中泰证券：双循环是未来中国经济也是中国化工的重要发展方向（附股）,证券时报网
1295,2020-12-22,依托量化交易系统 中泰证券打造差异化发展逆袭样本,证券日报
1296,2020-12-21,47股今日获机构买入评级,证券时报网
1297,2020-12-21,中科驭数携加速芯片架构KPU亮相中泰证券开发者大会,凤凰网
1298,2020-12-21,中泰证券：预计未来几年煤价将在中高位 龙头煤企将维持较为稳健的盈利水平（附股）,证券时报网
1299,2020-12-21,中泰证券：竣工修复有望贯穿2021年 带家居动板块需求边际改善（附股）,证券时报网
1300,2020-12-20,中泰证券总裁毕玉国：XTP已成为对接优质量化私募和资方的桥梁,中证报
1301,2020-12-20,中泰证券：看好未来10-15年消费升级带来的投资机会,e公司
1302,2020-12-20,券商点将台之三：谁是2020年最火券商股？,华夏时报
1303,2020-12-19,争夺量化交易“蛋糕”，券商加码金融科技开发投入,澎湃新闻
1304,2020-12-19,以极速交易积累九成量化私募客户 中泰证券将全面发力资本对接,证券时报
1305,2020-12-18,中泰证券毕玉国：公司致力于成为连接超级资金和优秀资产的平台,中证网
1306,2020-12-18,策略日报：指数全线上涨 顺周期板块表现强势,新浪
1307,2020-12-18,双向拉伸聚丙烯薄膜生产商金田新材二度冲A，已完成上市辅导,资本邦
1308,2020-12-18,55股获杠杆资金大手笔加仓,证券之星
1309,2020-12-18,光大证券研报:再次推荐“增持”食品龙头白马股金龙鱼(300999),中国贸易新闻网
1310,2020-12-18,中泰证券：建筑行业已经具备了较好价值投资的机会（附股）,证券时报网
1311,2020-12-17,25股今日获机构买入评级7股上涨空间超20%,证券时报网
1312,2020-12-17,券商股尾盘续升，中泰证券、哈投股份涨停,Wind
1313,2020-12-17,快讯：券商尾盘持续发力 中泰证券拉升涨停,新浪
1314,2020-12-17,【行情】券商股继续走强，中泰证券封板，国联证券、中金公司、中银证券等大幅跟涨，哈投股份早盘涨停,金十数据
1315,2020-12-17,券商股强势拉升 哈投股份涨停 中金公司、中泰证券、国联证券等多股大涨,金融界
1316,2020-12-17,【行情】券商股走强，哈投股份拉升封板，中金公司、华鑫股份、中泰证券、湘财股份等跟涨,金十数据
1317,2020-12-17,中泰证券--房地产开发行业：供给因素重于需求 行业平稳发展趋势不变,金融界
1318,2020-12-16,“大物业”战略优势显著 中泰证券首予保利物业“买入”评级,乐居财经
1319,2020-12-16,可交换私募债跟踪：私募EB每周跟踪,新浪
1320,2020-12-16,港股异动︱保利物业(06049)涨超6% 获中泰证券首次覆盖给予“买入”评级,智通财经
1321,2020-12-16,中泰证券：首次覆盖保利物业(06049) 给予“买入”评级,智通财经
1322,2020-12-16,互联网医疗今年进入爆发期，医保放开后竞争进入下半场？,奥一网
1323,2020-12-15,斯达半导今日闪崩跌停，机构频繁出入，两券商研报喊增持 连续下跌,第一财经
1324,2020-12-15,斯达半导跌停 月内中泰证券与西部证券研报喊增持,中国经济网
1325,2020-12-15,中泰证券：预计风电2021年全球需求将达75.2GW,e公司
1326,2020-12-15,中泰证券：11月电动车产销超预期 预计明年年行业维持高景气（附股）,证券时报网
1327,2020-12-14,34股今日获机构买入评级,证券时报网
1328,2020-12-14,12月14日深市创业板活跃股公开信息,深交所
1329,2020-12-14,中泰证券：控股股东未质押公司股权,Wind
1330,2020-12-14,圣诺生物：今年科创板过会第197家 民生证券过10单,中国经济网
1331,2020-12-14,迈信林：今年科创板过会第198家 海通证券过20.5单,中国经济网
1332,2020-12-14,康拓医疗：今年科创板过会第200家 华泰联合过21单,中国经济网
1333,2020-12-12,华夏天信重启IPO：控股股东在国际造假案中获利颇丰 欺诈造假,21世纪经济报道
1334,2020-12-11,中泰证券拟增资全资另类投资子公司不超15亿元,证券日报网
1335,2020-12-11,21调查丨华夏天信重启IPO：更换保荐机构二度辅导 信披瑕疵能否“洗白”？,21世纪经济报道
1336,2020-12-11,港股异动 | 祖龙娱乐(9990.HK)涨4.6% 中泰证券首次覆盖予买入评级,格隆汇
1337,2020-12-11,中泰证券(600918.SH)：拟发行境内外债务融资工具,格隆汇
1338,2020-12-11,中泰证券(600918.SH)：拟向全资子公司中泰创投增资不超15亿元,格隆汇
1339,2020-12-11,关于同意中泰证券股份有限公司为嘉实中证先进制造100策略交易型开放式指数证券投资基金提供主流动性服务的公告,上交所
1340,2020-12-10,深度*行业*证券行业券商板块11月数据点评：市场回暖股承增长 转板上市办法出台,新浪
1341,2020-12-10,中泰证券：创新创造价值 寻找医药中的马拉松选手（附股）,证券时报网
1342,2020-12-09,首架“中泰证券”号飞机10日起飞 山东航空飞机总数达131架,重庆商报
1343,2020-12-09,李迅雷专栏 | 公募基金超高业绩能否持续——兼谈明年市场特征,中泰证券
1344,2020-12-09,华谊嘉信(300071.SZ)主要股东刘伟拟被动减持671.38万股 拟减持股份,智通财经
1345,2020-12-09,华谊嘉信(300071.SZ)：持股5%以上股东刘伟拟被动减持不超1%股份 拟减持股份,格隆汇
1346,2020-12-09,交易所一问询就跌停：金安国纪怎么了？此前连拉四个涨停板 问询,中国基金报
1347,2020-12-09,首架山东航空“中泰证券”号冠名飞机圆满交付,民航资源网
1348,2020-12-09,交易所一问询，就跌停！这只科技股怎么了？此前连拉四个涨停板 问询,中国基金报
1349,2020-12-09,这些股票首次进入券商“法眼”！其中3只最近5天涨超20%,中证报
1350,2020-12-09,瑞华泰：今年科创板过会第196家 国信证券过5单,中国经济网
1351,2020-12-09,【行情】证券板块异动拉升，湘财股份涨超5%，中银证券、中泰证券、国盛金控、招商证券等跟涨,金十数据
1352,2020-12-08,中泰证券刘凯：量化私募管理规模已超过5000亿元,第一财经
1353,2020-12-08,中泰证券刘凯：科技赋能 打造大PB业务综合服务生态圈,中证网
1354,2020-12-08,截至11月末，山东辖区共有76家拟IPO企业,资本邦
1355,2020-12-08,28股今日获机构买入评级,证券时报网
1356,2020-12-08,微众信科：今年科创板过会第193家 中信证券过28单,中国经济网
1357,2020-12-08,邦彦技术：今年科创板过会第194家 国信证券过4单,中国经济网
1358,2020-12-08,中泰证券：继续看好板块估值修复行情（附股）,证券时报网
1359,2020-12-07,机构“点名”茅台新高还在后面，白酒、食品与旅游“头部公司”酝酿跨年机会,红周刊
1360,2020-12-07,沃森生物跌停:中泰证券资管持股 中银证券刚研报唱多,中国经济网
1361,2020-12-07,第十届HED峰会于12月8日-9日在深圳举行,新浪
