,2021-12-31,年终盘点｜券商今年整体跑输市场 板块中8家上涨 中银证券年内腰斩成最“熊”,金融界
0,2021-12-31,好想你与中泰证券签署战略合作协议,上证报
1,2021-12-31,2021年A股年终盘点：十大“水逆”板块在哪里？,21世纪经济报道
2,2021-12-31,践行“专业”行业文化 建设顶级量化交易平台,发布易
3,2021-12-31,唐人神：中泰证券、中融基金等2家机构于12月29日调研我司,证券之星
4,2021-12-31,浙矿股份：中泰证券研究所、津投资本等27家机构于12月29日调研我司,证券之星
5,2021-12-30,华润三九：中泰证券于12月27日调研我司,证券之星
6,2021-12-29,券业2021年度罚单③丨5家券商研究所领8份罚单！中泰、国元等“连中两元” 业内质疑：“研报太乱罚得太少” 金融监管处罚,21世纪经济报道
7,2021-12-29,财富管理业务大步迈向“买方时代” 中泰证券“齐富投”基金投顾品牌正式上线,中证网
8,2021-12-29,年底又一副总辞任，中泰证券人事变动何时收官？ 董监高成员变化,每日财报
9,2021-12-28,新三板重要公告汇总（2021年12月28日）,同壁财经
10,2021-12-28,伊森新材进北交所上市辅导期：石油碳氢树脂生产商 上半年净利增长206%,同壁财经
11,2021-12-28,邦德股份通过北交所上市辅导验收 今年前三季度净利2932万元,同壁财经
12,2021-12-27,汐泰投资研究总监违法泄露信息 趋同交易者盈利719万 董监高成员异常事件,中国经济网
13,2021-12-25,远光软件：国泰基金、中泰证券等6家机构于12月24日调研我司,证券之星
14,2021-12-24,中泰证券研究所副所长、新能源首席苏晨将离职 下一站或为国金证券,新浪
15,2021-12-23,海底捞交了3500亿学费,投资界
16,2021-12-23,中泰证券首席经济学家李迅雷：2022年中国经济将稳中有进 财政政策有更大释放空间,每日经济新闻
17,2021-12-23,中泰证券获评“影响济南”经济人物评选组委会特别奖,证券日报之声
18,2021-12-22,中泰证券副总经理黄永刚因个人原因辞任 董监高成员变化,北京商报
19,2021-12-22,中泰证券：中泰证券股份有限公司关于副总经理辞职的公告 董监高成员变化,新浪
20,2021-12-22,中泰证券(600918.SH)：证监会对公司开展国债期货做市业务无异议,智通财经
21,2021-12-22,中泰证券(600918.SH)：黄永刚辞去副总经理职务 董监高成员变化,智通财经
22,2021-12-22,中泰证券：副总经理辞职 董监高成员变化,Wind
23,2021-12-21,“想要恋爱进行时，就来中泰红-N”券商推出新平台扮“红娘” 圣诞节将举办第一次线下活动,新浪
24,2021-12-21,中泰证券：中泰量化30系列产品是公司专门投向优质量化私募的资产配置品牌,Wind
25,2021-12-21,中泰证券：公司经营情况一切正常,Wind
26,2021-12-21,中泰证券：XTP是公司自主研发的极速交易平台,Wind
27,2021-12-21,沃森生物股价两连阴 中泰证券资管持股,中国经济网
28,2021-12-21,券商研究所负责人再现变动！中泰证券研究所副所长苏晨或转会国金证券,资本邦
29,2021-12-21,中泰证券5保代收警示函 执业广东明珠定增未勤勉尽责 金融监管处罚,中国经济网
30,2021-12-20,量化交易助推交易数字化转型 中泰证券李峰:XTP系统交易量超8.9万亿,和讯
31,2021-12-20,流金岁月接待中泰证券等共计6家机构调研，VR相关领域布局等受关注,资本邦
32,2021-12-20,中泰证券召开第三届X-Club XTP开发者大会 助推量化行业生态健康发展,凤凰网
33,2021-12-20,中泰证券：宽松周期降准先行 降息不会缺席,新浪
34,2021-12-20,中泰证券召开XTP开发者大会 数字化转型打造“智慧券商”,发布易
35,2021-12-18,中泰证券何波：XTP推动了中泰证券散户机构化的转型,新浪
36,2021-12-18,中泰证券发力XTP产品，量化私募代销增至130亿元,21世纪经济报道
37,2021-12-18,中泰证券何波：中泰量化30系列产品今年以来销量超130亿元,中证网
38,2021-12-18,中泰证券党委书记、董事长李峰：将不断完善XTP服务生态,中证网
39,2021-12-18,中泰证券党委书记、董事长李峰：高度重视金融与科技的融合发展,中证网
40,2021-12-18,中泰证券党委书记、董事长李峰：中泰XTP今年以来交易量超过8.9万亿元,中证网
41,2021-12-18,上市公司违规 中泰证券等三家中介被点名,中国经营报
42,2021-12-18,黑猫股份：国泰君安、中泰证券等6家机构于12月16日调研我司,证券之星
43,2021-12-17,年底加速洗牌！多家券商研究所所长将调整,Wind
44,2021-12-17,中泰证券以文化建设助推高质量发展,经济参考报
45,2021-12-16,【21工商银行二级02、03成功完成发行】,东方投行债券
46,2021-12-15,抓紧北交所东风，泰德股份通过上市辅导验收,鲁网
47,2021-12-15,第三届X-Club XTP开发者大会将在上海举行,金融界
48,2021-12-15,云程发轫万里期 共镶盛会开幕即,凤凰网
49,2021-12-14,股票全面注册制临近，哪些上市券商或将受益？|和讯睿见,和讯
50,2021-12-14,北交所个股今日全面飘红，中泰-北证模拟指数开市1月后跌近6%，2股月换手率近300%,每日经济新闻
51,2021-12-14,东方电热：宝盈基金、中泰证券等2家机构于12月10日调研我司,证券之星
52,2021-12-13,【中泰金工|基金研究】主动管理基金周报（12/12）：消费主题基金表现优秀，养老FOF规模破千亿,ZTQuant
53,2021-12-13,【中泰金工|基金研究】ETF指数产品周报（12/12）：首只中国外汇交易中心债券指数基金成立，指数增强ETF上市交易,ZTQuant
54,2021-12-13,科沃斯跌7.7% 招商证券中泰证券8月末唱多,中国经济网
55,2021-12-13,泰德股份通过北交所上市辅导验收，今年前三季度净利润2058万元,同壁财经
56,2021-12-13,证券股表现不俗，华林证券、中泰证券、浙商证券、兴业证券涨幅靠前,Wind
57,2021-12-12,【天风非银】证券行业周报：券商是全面注册制的核心受益载体！,新锐视角看金融
58,2021-12-11,中泰证券易主 下海官员李峰改革向何方 控制人变化,中国经营报
59,2021-12-10,中泰证券5名保荐人收警示函 事涉广东明珠非公开发行股票事宜 金融监管处罚,新浪
60,2021-12-09,中泰证券(600918.SH)5名保荐人收广东证监局警示函，事涉*ST广珠(600382.SH)非公开发行股票事宜 金融监管处罚,智通财经
61,2021-12-09,中泰证券与泰和新材启动战略客户“1+N”综合金融服务,证券时报网
62,2021-12-09,【中泰金工|基金研究】2022年，基金经理如何看待后市投资机会？,ZTQuant
63,2021-12-09,凝聚各方合力 共谋金融赋能绿色发展 金融助推山东绿色低碳发展论坛举办,凤凰网
64,2021-12-08,投行业务蓬勃发展，8家券商IPO 承销收入过10亿元|和讯睿见,和讯
65,2021-12-08,【行情】券商股异动，华林证券直线拉升封板，长城证券、中泰证券、中信建投、东兴证券、广发证券等涨超3%,金十数据
66,2021-12-08,快讯：券商股异动拉升 中泰证券涨超6%,新浪
67,2021-12-08,【行情】券商股异动拉升，中泰证券一度涨超7%，中信建投、长城证券、广发证券、中银证券等集体走高,金十数据
68,2021-12-03,中泰证券首予君实生物买入评级：稀缺的平台型创新药企，差异化布局向Biopharma进化,每日经济新闻
69,2021-12-03,每日财报|中天城投89亿元出售 中泰证券控股股东变更枣矿集团 控制人变化,每日财报
70,2021-12-03,"196亿大交易！这家上市券商控股股东易主，啥情况？""新老板""有何来头？ 控制人变化",券商中国
71,2021-12-03,大东南：中泰证券、南方基金等6家机构于11月30日调研我司,证券之星
72,2021-12-03,朗特智能：中泰证券于12月1日调研我司,证券之星
73,2021-12-03,科博达：创金合信、中泰证券等22家机构于11月5日调研我司,证券之星
74,2021-12-02,公告精选丨国海证券被没收违法所得1798万元；方正证券拟出售25.21亿元参股公司股权,21世纪经济报道
75,2021-12-02,中泰证券：公司控股股东变更为枣矿集团 控制人变化,Wind
76,2021-12-02,真豪！又有券商出手，买下上海核心区一栋办公楼,中国基金报
77,2021-12-02,"又见券商买楼！华泰证券将在陆家嘴购置办公楼，租金太贵？近两年券商扎堆购""买房""",券商中国
78,2021-12-01,中泰证券：公司控股股东将由莱钢集团变更为枣矿集团 实控人仍为山东省国资委 控制人变化,中证网
79,2021-12-01,鲁证期货(01461)控股股东中泰证券拟实施股权重组 最终实际控制人仍为山东国资委,智通财经
80,2021-12-01,鲁证期货(01461.HK)控股股东中泰证券进行股权重组,格隆汇
81,2021-12-01,证券板块持续走强，华鑫股份涨超5%，中金公司、中泰证券、财通证券跟涨。,新浪
82,2021-11-30,梦百合前三季度为何亏损1.8亿元？中泰证券专项调查结果出炉 亏损,中国经济网
83,2021-11-29,民和股份：中泰证券股份有限公司于11月24日调研我司,证券之星
84,2021-11-28,深圳机场：中泰证券于11月4日调研我司,证券之星
85,2021-11-27,齐鲁股交推出“中泰创新培育板” “量体裁衣”助推专精特新企业上市,证券日报网
86,2021-11-27,兴瑞科技：中泰证券、交银施罗德基金等2家机构于11月23日调研我司,证券之星
87,2021-11-27,迈普医学：中泰证券、圆信永丰等4家机构于11月23日调研我司,证券之星
88,2021-11-26,中泰证券：内容社区84页研究框架（附下载）,199IT
89,2021-11-26,奥特佳：海通证券、中泰证券等4家机构于11月16日调研我司,证券之星
90,2021-11-25,券商股短线拉升，中泰证券涨近5%,36氪
91,2021-11-25,【行情】证券板块短线拉升，中泰证券涨超4%，财通证券、中银证券、广发证券跟涨,金十数据
92,2021-11-23,中泰证券：加强员工培训 实施人才强企战略,中证网
93,2021-11-23,中泰证券资管张蓓蓓因公司安排离任3只债基,中国经济网
94,2021-11-23,【中泰金工|基金研究】ETF指数产品周报（11/21）：首批5只增强型ETF获批，本周ETF基金发行低迷,ZTQuant
95,2021-11-23,券商板块再度活跃，长城证券涨停，中泰证券等走高,证券时报
96,2021-11-23,【行情】证券板块异动拉升，长城证券涨近6%，中泰证券、广发证券、东方证券跟涨,金十数据
97,2021-11-22,【银华基金】交易日报 2021-11-22,新浪
98,2021-11-22,新三板重要公告汇总（2021年11月22日）,同壁财经
99,2021-11-22,11月22日深市创业板活跃股公开信息,深交所
100,2021-11-21,【申城论剑】领导致辞：中泰证券金融科技委主任兼科技研发部总经理、智能投研技术联盟副秘书长何波,新湖期货
101,2021-11-20,裕兴股份：中泰证券、中庚基金等28家机构于11月17日调研我司,证券之星
102,2021-11-20,冰轮环境：青岛久实投资、中泰证券等2家机构于11月19日调研我司,证券之星
103,2021-11-20,莱伯泰科：中泰证券、长盛基金等40家机构于10月27日调研我司,证券之星
104,2021-11-18,裕兴股份(300305.SZ)：11月17日接待了中泰证券等28家机构投资者调研,格隆汇
105,2021-11-18,中国公司债及企业债信用分析周报,新浪
106,2021-11-16,中泰证券：公司董事会、监事会延期换届,Wind
107,2021-11-16,【中泰金工|基金研究】主动管理基金周报（11/14）：FOF发行迎小高峰，本周权益基金表现亮眼,ZTQuant
108,2021-11-16,【中泰金工|基金研究】ETF指数产品周报（11/14）：A50 ETF交投活跃，房地产ETF反弹涨超8%,ZTQuant
109,2021-11-15,11月15日深市创业板活跃股公开信息,深交所
110,2021-11-13,中泰证券王作维：北交所差异化制度安排 为创新型中小企业开辟新航路,上证报
111,2021-11-13,高澜股份：中欧基金、中泰证券等2家机构于11月10日调研我司,证券之星
112,2021-11-12,11月12日深市大宗交易信息,深交所
113,2021-11-11,区块链如何解券商业务痛点？中泰证券SAAS中台让数据特征值上链，实现业务更高效、数据更安全、监管可追溯,财联社
114,2021-11-11,券商公募代销保有三季度跌近10%，中信华泰广发稳居前三，22家券商保有规模超百亿,财联社
115,2021-11-11,10只新股周一将登北交所，部分发行价较前收盘价下折,第一财经
116,2021-11-11,博杰股份：中泰证券、德邦证券等3家机构于11月5日调研我司,证券之星
117,2021-11-10,首席研说全文|中泰煤炭陈晨：十四五期间煤炭供给紧张，低库存高煤价是常态，继续看好板块价值重估,新浪
118,2021-11-10,景嘉微：天风证券、中泰证券等8家机构于11月4日调研我司,证券之星
119,2021-11-09,ETF生态圈|4只MSCI中国A50互联互通ETF做市商一览（附名单）,金融界
120,2021-11-09,苏州银行：中泰证券、南方基金等3家机构于11月5日调研我司,证券之星
121,2021-11-08,【中泰金工|基金研究】ETF指数产品周报（11/7）：首批A50互联互通ETF下周一正式上市,ZTQuant
122,2021-11-08,【中泰金工|基金研究】主动管理基金周报（11/7）：基金投顾迎重磅监管，TMT相关基金表现亮眼,ZTQuant
123,2021-11-08,上市首日攻下百亿成交，4只A50 ETF首秀成交比涨跌更抢眼！近20家做市券商名单公布，两大属性撞出火花,财联社
124,2021-11-07,前三季度IPO募资超3700亿创历史新高！Top10券商承销金额占比7成，中小券商异军突起，北交所将成竞争新赛道,每日经济新闻
125,2021-11-06,加码！精选层个股前十大股东频现券商身影,上证报
126,2021-11-06,博杰股份：中泰证券、银华基金等2家机构于11月2日调研我司,证券之星
127,2021-11-05,中泰证券今日大宗交易成交150万股，成交价8.28元折价9.61%,Wind
128,2021-11-05,"中泰证券现1笔大宗交易 共成交1,242.00万元",新浪
129,2021-11-03,中泰证券第三季度净利8.4亿降7.5% 加权ROE下降 盈利能力下降,中国经济网
130,2021-11-03,东方证券维持中泰证券增持评级：投行与自营大增超三成，助ROE创六年来新高,每日经济新闻
131,2021-11-03,浩洋股份：中泰证券研究所、中泰证券研究所等43家机构于10月31日调研我司,证券之星
132,2021-11-03,安利股份：中泰证券、中泰证券等5家机构于11月1日调研我司,证券之星
133,2021-11-03,味知香：中泰证券、太平洋证券等3家机构于10月29日调研我司,证券之星
134,2021-11-02,同和药业：中泰证券、中泰证券等15家机构于10月29日调研我司,证券之星
135,2021-11-02,海油发展：中泰证券、中泰证券等2家机构于10月28日调研我司,证券之星
136,2021-11-01,山西证券维持中泰证券增持评级：21Q3资管、经纪贡献业绩，关注北交所业务进展,每日经济新闻
137,2021-11-01,山西证券：给予中泰证券增持评级,证券之星
138,2021-11-01,中泰证券：选举张晖为职工董事,每日经济新闻
139,2021-11-01,中泰证券：变更职工董事 董监高成员变化,Wind
140,2021-10-30,广联达：中信证券、中泰证券等6家机构于10月27日调研我司,证券之星
141,2021-10-30,两大榜单展示券商三季度新三板业绩 北交所为中小券商 提供“超车”机遇,上证报
142,2021-10-29,千亿头部券商高管变动！银河证券将迎新副总裁，申万宏源另一老将已赴任中金,券商中国
143,2021-10-29,清水源：中泰证券股份有限公司、中泰证券股份有限公司等5家机构于10月27日调研我司,证券之星
144,2021-10-29,千味央厨：中泰证券、东兴证券等11家机构于10月27日调研我司,证券之星
145,2021-10-28,中泰证券：前三季度净利润25.44亿元 同比上升10.88%,上证报
146,2021-10-28,中泰证券公布三季报 前三季净利增加10.88%,新浪
147,2021-10-28,中泰证券：前三季度净利润同比增长10.88%,Wind
148,2021-10-28,图解中泰证券三季报：第三季度单季净利润同比减7.51%,证券之星
149,2021-10-28,中泰证券：2021年第三季度净利润约8.43亿元,每日经济新闻
150,2021-10-28,精选层撤单密度突然加大，不足俩月10个项目主动撤材料，北交所关键节点企业为何“临阵逃脱”？,财联社
151,2021-10-28,中金今年增员已近2000人，财富与科技布重兵，招聘还在继续，中金人也成外资券商挖角对象,财联社
152,2021-10-28,厦门银行：中泰证券、光大证券等5家机构于10月25日调研我司,证券之星
153,2021-10-27,新三板主办券商执业评价排名生变！开源证券蝉联榜首，长江、中信、东吴等排名大幅提升，却有券商逆势下滑,财联社
154,2021-10-27,海象新材：太平洋证券、中泰证券等12家机构于10月22日调研我司,证券之星
155,2021-10-25,国泰君安 | 信用债发行结果日报,国泰君安债券资本市场部
156,2021-10-23,房产税要来了吗？系列研究（一）：概念、内涵与现状,中泰证券
157,2021-10-22,为何调味品新一轮涨价“势在必行”？,华尔街见闻
158,2021-10-22,中泰证券(600918.SH)完成发行25亿元短期融资券,智通财经
159,2021-10-21,温氏股份跌3.12% 中信证券中泰证券华创证券高位唱多,中国经济网
160,2021-10-20,金南方信披违规实控人收警示函 主办券商为中泰证券 金融监管处罚,中国经济网
161,2021-10-19,寻找2022年经济增长的动能,新浪
162,2021-10-19,世优电气：中泰证券将为公司提供做市报价服务,同壁财经
163,2021-10-19,山钢集团将济钢100%股权划转至济南国资委，不含山东钢铁及中泰证券股权,钢企网
164,2021-10-18,丸美股份跌6.63% 长江证券中泰证券高点唱多,中国经济网
165,2021-10-16,北交所激活新三板，券商抢跑新赛道,新浪
166,2021-10-15,房产税要来了吗？系列研究（一）：概念、内涵与现状--当前经济与政策思考（2021.5.11）,凤凰网
167,2021-10-15,孤儿药仍在临床阶段 “生长茅”长春高新重挫8%,第一财经
168,2021-10-13,中泰证券：将于2021年10月29日披露三季报,每日经济新闻
169,2021-10-13,巨峰股份：中泰证券将为公司提供做市报价服务,同壁财经
170,2021-10-12,开足马力备战北交所！券商加快新三板业务布局，面对历史性机遇，如何排兵布阵？,中证报
171,2021-10-11,中泰证券：公司涉及多起诉讼 诉讼纠纷,Wind
172,2021-10-10,"""海尔系""有屋智能拟IPO，收入高度依赖房地产 | IPO观察",第一财经
173,2021-10-08,宏力能源未按规定披露年报收警示函 主办券商中泰证券 延期披露,中国经济网
174,2021-10-08,中泰证券：公司没有与华宝证券整合计划,每日经济新闻
175,2021-10-08,省地方金融监管局携手山东证监局中泰证券 北交所上,大众网
176,2021-09-30,白云电器：中泰证券研究所、天风证券研究所等6家机构于9月29日调研我司,证券之星
177,2021-09-30,中泰证券今日大宗交易成交117万股，成交价8.67元折价9.5%,Wind
178,2021-09-30,"中泰证券现1笔大宗交易 共成交1,014.39万元",新浪
179,2021-09-30,中泰证券：发挥业务优势 服务创新型中小企业,中证网
180,2021-09-30,携手资本市场赋能鲁企成长 山东举办北交所上市专题培训会,上证报
181,2021-09-30,山东企业北交所上市专题培训会成功举办,证券时报网
182,2021-09-29,A股共发生106宗大宗交易成交24.67亿元（9月29日）,Wind
183,2021-09-29,"中泰证券现1笔大宗交易 共成交1,660.56万元",新浪
184,2021-09-29,中泰证券今日大宗交易成交187万股，成交价8.88元折价7.79%,Wind
185,2021-09-29,新五丰：中泰证券于9月15日调研我司,证券之星
186,2021-09-29,塞力医疗：高盛汇金、融和诚投资等12家机构于9月16日调研我司,证券之星
187,2021-09-28,中泰证券：公司积极响应国家设立北京证券交易所的重要战略部署，高效推动北交所相关业务,每日经济新闻
188,2021-09-28,"中泰证券现2笔大宗交易 共成交6,433.95万元",新浪
189,2021-09-28,中泰证券今日大宗交易成交727万股，成交价8.85元折价10.33%,Wind
190,2021-09-28,【盛·严选】慢而行远，基金投资的下一个长期主题在哪里？,新浪
191,2021-09-28,广东依顿电子科技股份有限公司简式权益变动报告书,证券时报
192,2021-09-27,"中泰证券现1笔大宗交易 共成交2,588.30万元",新浪
193,2021-09-27,海油发展：中泰证券于9月18日调研我司,证券之星
194,2021-09-26,我武生物：中泰证券、金友创智等15家机构于9月24日调研我司,证券之星
195,2021-09-24,云海金属：中泰证券、季胜投资等3家机构于9月24日调研我司,证券之星
196,2021-09-23,万华化学跌3.36% 安信证券中泰证券高点喊买入,中国经济网
197,2021-09-23,中泰证券：公司全资子公司中泰创业投资（深圳）有限公司持有维远股份上市前2.42%的股份,每日经济新闻
198,2021-09-17,中泰证券(600918.SH)：发行次级公司债券获得证监会注册批复,格隆汇
199,2021-09-17,中泰证券(600918.SH)向专业投资者公开发行次级公司债券获中国证监会注册批复,智通财经
200,2021-09-17,日发精机：中泰证券于9月16日调研我司,证券之星
201,2021-09-15,唐人神：华泰证券、中泰证券等3家机构于9月14日调研我司,证券之星
202,2021-09-15,8月宏观点评|鲸平台智库专家、中泰证券研究所首席分析师杨畅：工业生产短期仍然平稳,鲸平台
203,2021-09-14,川发龙蟒：中泰证券、合创友量等8家机构于9月14日调研我司,证券之星
204,2021-09-14,"拟三板转A,唐山华熠携手中泰证券计划首次公开发行股票并上市",资本邦
205,2021-09-13,独家|信达证券或迎新总裁，中泰证券副总刘珂滨离职后下一站确定，冲击IPO路上信达高管变动颇频繁 董监高成员变化,财联社
206,2021-09-11,中泰证券又见人事变动，分管投行副总从不再分管到最终辞任，姜天坊、阎鹏均为热门人选，谁将胜出 董监高成员变化,财联社
207,2021-09-10,中泰证券(600918.SH)副总经理刘珂滨辞职 董监高成员变化,智通财经
208,2021-09-10,中泰证券：刘珂滨辞去公司副总经理职务 董监高成员变化,Wind
209,2021-09-10,中泰证券(600918)：自营大增叠加投行回暖助推业绩提速 ROE创近5年新高,新浪
210,2021-09-10,中泰证券副总经理刘珂滨因个人原因辞任 董监高成员变化,北京商报
211,2021-09-08,延安必康：平安证券股份有限公司、中泰证券股份有限公司等4家机构于9月7日调研我司,证券之星
212,2021-09-08,和晶科技：中泰证券股份有限公司于9月7日调研我司,证券之星
213,2021-09-07,青岛银行：浙商证券、中泰证券等13家机构于9月3日调研我司,证券之星
214,2021-09-07,金域医学跌3.10% 中泰证券浙商证券西部证券高点唱多,中国经济网
215,2021-09-06,中泰证券累计新三板推荐挂牌企业556家,挖贝网
216,2021-09-03,景嘉微：东吴证券、中泰证券等17家机构于8月30日调研我司,证券之星
217,2021-09-03,长盛轴承：中泰证券、华夏基金等16家机构于9月2日调研我司,证券之星
218,2021-09-03,北京证券交易所要来了，这些板块及个股或成大赢家,第一财经
219,2021-09-03,陈必昌会见中泰证券、省新动能基金公司客人,新浪
220,2021-09-02,苏州固锝：中泰证券研究所、中海基金等31家机构于9月1日调研我司,金融界
221,2021-09-02,中泰证券上半年营收净利均增2成 员工薪酬总额增34%,中国经济网
222,2021-09-01,南微医学：兴业证券、中泰证券等119家机构于8月26日调研我司,中金在线
223,2021-09-01,中泰证券：年初至今公司共保荐8家企业IPO,Wind
224,2021-08-31,剑桥科技：中泰证券、招商证券等16家机构于8月25日调研我司,证券之星
225,2021-08-31,晶丰明源：中泰证券、太保人寿等8家机构于8月23日调研我司,证券之星
226,2021-08-31,韦尔股份跌9.39% 中泰证券昨日刚喊买入,中国经济网
227,2021-08-30,浩洋股份：中泰证券、观富资产等25家机构于8月29日调研我司,证券之星
228,2021-08-30,中泰证券首席经济学家李迅雷：迈向共同富裕应促进人口流动并完善收入分配机制,每日经济新闻
229,2021-08-30,天宇股份：浙商证券、中泰证券等38家机构于8月27日调研我司,证券之星
230,2021-08-30,冀中能源：中泰证券、半夏投资等8家机构于8月27日调研我司,证券之星
231,2021-08-30,张家港行：中泰证券、国信证券等16家机构于8月26日调研我司,证券之星
232,2021-08-30,中泰证券2021年上半年实现净利润17.46亿元，同比增长23.87%,经济观察网
233,2021-08-30,汤姆猫：银河基金、中泰证券资管等54家机构于8月29日调研我司,证券之星
234,2021-08-28,信安世纪：中泰证券于8月12日调研我司,证券之星
235,2021-08-28,莱美药业：长城证券股份有限公司、中泰证券股份有限公司等10家机构于8月26日调研我司,证券之星
