4029,2018-11-02,11月02日 收盘突破年线个股一览,每日经济新闻
4030,2018-11-02,机场航运板块强势领涨，沪深股指高位震荡,华讯财经
4031,2018-11-02,【异动股】医疗板块再度走强 重药控股(000950-CN)等多股涨停,财华社
4032,2018-11-02,【医药】江琦、赵磊：医药上市公司2018三季报分析：研发创新驱动行业发展，高景气板块持续-20181101,中泰证券研究所
4033,2018-11-01,行业估值处于历史底部区域 医药板块有望逐步走出“至暗时刻”,中证报
4034,2018-11-01,华平在华全资并购第一单！已收购大昌华嘉中国医药保健业务,21财经搜索
4035,2018-11-01,医疗器械市场需求快速增长 优质国产设备有望迎来春天,前瞻研究院
4036,2018-11-01,"医药生物行业周报:新版基药目录公布,临床价值导向趋势明确",中证网
4037,2018-11-01,底部特征明显 医药板块有望走出“至暗时刻”,中证报
4038,2018-11-01,医药生物行业周报:走出黎明前的“至暗时刻”,光大证券
4039,2018-11-01,"医药生物行业周报:底部特征明显,关注绩优个股",华安证券
4040,2018-10-31,【国信医药|三季报点评】乐普医疗：业绩持续高增长，期待可降解支架获批,GuosenHealthcare
4041,2018-10-31,东北证券：上调乐普医疗评级至买入,Wind
4042,2018-10-31,医疗保健：基药目录调整 利好新增品种放量,国信证券
4043,2018-10-31,从哪里跌倒从哪里涨起来！白酒、医药等白马消费股强势归来？,顶尖财经网
4044,2018-10-31,市值20强前三季业绩大比拼：上药营收超千亿 恒瑞净利近30亿,医药网
4045,2018-10-31,2018版基药目录点评：从“保基本”到“保临床价值”,光大证券
4046,2018-10-31,上调评级至买入策略选股（10月31日）,Wind
4047,2018-10-30,跌出价值，做反弹还看次新，机构加仓名单出炉,Wind
4048,2018-10-30,机构评级精选：控量挺价增速换挡 五粮液评级获上调,巨丰财经
4049,2018-10-30,乐普医疗（300003）2018年三季报点评：业绩持续高增长，期待可降解支架获批,国信研究
4050,2018-10-30,券商首次关注3股并给予买入评级（10月30日）,Wind
4051,2018-10-30,2018年10月30日A股涨停股票预测：今日哪些热门股有望涨停？,南方财富网
4052,2018-10-30,30日公告透露利好 21只个股有望爆发,中金在线
4053,2018-10-30,同一赛场上的不同竞技者,证券日报
4054,2018-10-30,周二最新重磅公司传闻集锦(10月30日),证券之星
4055,2018-10-29,公告精选：多只白马股第三季度业绩“不达预期”，上市公司密集发布回购公告,每日经济新闻
4056,2018-10-29,A股头条之上市公司公告精选（10.30）,金融界
4057,2018-10-29,公告汇总：中国平安拟启动回购 耗资或达千亿,网易
4058,2018-10-29,前三季度赚近800亿 中国平安拟推千亿回购计划,新浪
4059,2018-10-29,29日晚间公告精选丨乐视网：前三季度净亏损14.89亿元 亏损,21经济网
4060,2018-10-29,乐普医疗：实控人提议公司3亿至5亿元回购股份,e公司
4061,2018-10-29,"医药生物行业:新版基药目录发布,关注受益品种",正点财经
4062,2018-10-29,四大机构三季度持股动向浮出水面：金融股地产股依然是机构最爱,深圳商报
4063,2018-10-29,新版基本药物目录实施在即 六股有掘金机会,证券日报
4064,2018-10-29,【乐普医疗】三季报点评：内生增速继续保持30%以上，即将迎来研发投入收获期,医心医意要健康
4065,2018-10-29,"乐普医疗:Q3单季度扣非净利润增长49.54%,超市场预期,经营活动现金流加速明显",东吴证券
4066,2018-10-28,医疗保健：长线战略资金逢机遇 荐9股,西南证券
4067,2018-10-28,医疗保健：积极配置优质龙头公司 荐8股,中泰证券
4068,2018-10-27,[快讯]乐普医疗:《中国证监会行政许可项目审查一次反馈意见通知书》之反馈意见回复,中财网
4069,2018-10-26,乐普医疗：前三季度净利润同比增54.89%,Wind
4070,2018-10-26,"医药行业政策点评:新版基药目录发布,优化结构、提升质量",西南证券
4071,2018-10-25,融资客最看好个股一览,证券时报
4072,2018-10-22,看好中国｜看好中国——健康中国 关注错杀的绩优股,巨丰财经
4073,2018-10-22,光大证券：目前医药行业处于历史底部区域,e公司
4074,2018-10-22,QFII偏爱小市值（10月22日）,巨丰财经
4075,2018-10-22,乐普医疗：10月19日融资余额为6.95亿元，较前一日骤降5.21%,Wind资讯
4076,2018-10-22,业绩超预期公司成二级市场资金布局重点,证券日报
4077,2018-10-22,迈瑞医疗上市 医疗器械走上“快车道”,国际金融报
4078,2018-10-22,"医药行业周报:政策底部明显,绩优股或反弹",西南证券
4079,2018-10-19,10月19日有24家公司获重要股东增减持 博济医药已被连续减持45次 减持股份,Wind
4080,2018-10-19,9月私募调研热情降温 但这只个股吸引了189家机构,经济观察网
4081,2018-10-19,37股获券商买入评级 隆华科技目标涨幅达54.48%,Wind
4082,2018-10-18,沪深上市公司18年10月18日晚间上市公司重要公告,全景网
4083,2018-10-18,乐普医疗：第一期员工持股计划完成股票购买,e公司
4084,2018-10-18,“独角兽”迈瑞医疗止步2涨停，估值已合理？,Wind
4085,2018-10-18,格上研究中心：9月份私募基金平均收益仅0.19%,中国经济网
4086,2018-10-18,数据王：洞悉近期外资动向寻找投资新方向,巨丰财经
4087,2018-10-18,"乐普医疗:业绩增长略超预期,经营性现金流快速增长",广发证券
4088,2018-10-18,10月18日券商晨会研报汇编,证券日报
4089,2018-10-18,51股获券商买入评级：鲁亿通目标涨幅达160%,Wind
4090,2018-10-18,华为新方案助力人工智能 近4亿大单布局9只概念股,证券日报
4091,2018-10-18,"医药生物行业深度报告:带量采购专题研究,以上海为例看政策方向",国海证券
4092,2018-10-17,医药企业陆续发布3季度预告 业绩有喜有忧,制药网
4093,2018-10-17,医疗保健：17种抗癌药进医保 荐12股,渤海证券
4094,2018-10-17,46股获券商买入评级 华力创通目标涨幅达102.49%,Wind
4095,2018-10-17,【研报精读】乐普医疗（300003.SZ）,联讯金融
4096,2018-10-17,"医药行业周报:17种抗癌药进医保,多省市发文响应",渤海证券
4097,2018-10-17,"乐普医疗三季报快报点评:业绩强劲增长,完全可降解支架3年数据即将公布",国海证券
4098,2018-10-17,"乐普医疗18年前三季度业绩快报点评:三季报扣非净利润增40.5%,可降解支架三年期数据靓丽",光大证券
4099,2018-10-16,9月市场小幅上行，为何私募调研次数环比巨减？这只个股是最爱！,每日经济新闻
4100,2018-10-16,医疗界华为今日上市冲破800亿 它能成为创业板第一吗,每日经济新闻
4101,2018-10-16,[买入评级]乐普医疗(300003)：业绩高速增长 符合预期,中财网
4102,2018-10-16,[买入评级]乐普医疗(300003)：扣非利润略超预期 器械快速增长 药品加速放量,中财网
4103,2018-10-16,9月百亿私募青睐电子和医药 重阳高毅星石调研热情高,新浪
4104,2018-10-16,乐普医疗（300003）三季报业绩快报点评：业绩持续高增长，期待可降解支架获批,微信
4105,2018-10-16,[增持评级]医药生物行业周报：17种抗癌药纳入医保目录 创新药研发长期享受政策红利,中财网
4106,2018-10-16,16日公告透露利好 19只个股有望爆发,中金在线
4107,2018-10-16,三季报行业展望之（二）医药生物：逾七成五公司三季报预喜,投资快报
4108,2018-10-15,乐普医疗：前三季净利11.43亿 同比增55%,e公司
4109,2018-10-15,[看好评级]医药生物行业2018年三季报业绩前瞻：医药需求刚性 预计增长保持稳健,中财网
4110,2018-10-15,[推荐评级]医药行业周报：17种抗癌药纳入国家医保 研发驱动型企业长期受益,中财网
4111,2018-10-15,【申万宏源医药闫天一团队】20181012周观点：医药需求刚性，预计增长保持稳健——医药生物行业2018年三季报业绩前瞻,申万投资健康
4112,2018-10-15,医药行业周报：三季报临近 关注业绩确定性机会,中财网
4113,2018-10-15,【数据揭秘】10月12日 融资客最看好的前20只个股,每日经济新闻
4114,2018-10-15,"医药行业周报:估值吸引力强,期待三季报行情",西南证券
4115,2018-10-12,医药行业：医药板块整体承压 推荐低估值个股,金融界
4116,2018-10-12,52股获券商买入评级，拓斯达目标涨幅达147.17%,Wind
4117,2018-10-12,107家公司披露三季报预告 10家业绩增幅同比超100%,证券日报
4118,2018-10-11,对比三大股指 创指前十大权重拖累指数度最高,中证网
4119,2018-10-11,"医药行业周报:抗癌专采持续推进,行业供给格局保稳向优",渤海证券
4120,2018-10-10,"【华泰医药代雯团队】乐普医疗 (300003.SZ, 买入) 事件点评：免疫治疗再下一城，外科器械锦上添花",谈医论股丨华泰医药
4121,2018-10-10,【乐普医疗】公告点评：参股美国Rgenix公司，完善肿瘤免疫治疗布局,医心医意要健康
4122,2018-10-10,乐普医疗：进一步布局肿瘤治疗 加码外科器械,中金公司
4123,2018-10-10,仿制药概念走弱 华海药业跌停,e公司
4124,2018-10-10,总募资59.3亿元！创业板最大规模IPO结果揭晓 迈瑞医疗冲刺创业板一哥,中证报
4125,2018-10-09,三季度机构调研偏爱中小创 海康威视最受宠,金融投资报
4126,2018-10-08,[快讯]乐普医疗:收到《中国证监会行政许可项目审查一次反馈意见通知书》,中财网
4127,2018-10-08,医疗保健：医药很可能迎来结构性艳阳天 荐14股,西南证券
4128,2018-10-08,热点追踪：肿瘤免疫治疗荣获诺贝尔奖，关注受益产业链板块,国元财富管理
4129,2018-10-07,医疗保健：反弹延续 结构化行情有望持续,川财证券
4130,2018-10-06,大宗交易市场温度回升 溢价成交公司明显增多 ——9月份大宗交易市场简析,红周刊
4131,2018-10-05,乐普医疗动态报告：员工持股计划落地，打造肿瘤免疫治疗产业链,国泰君安
4132,2018-10-05,最新！93药企净利公布，5家净赚超8亿,赛柏蓝
4133,2018-10-04,乐普医疗股票分析：肿瘤免疫治疗布局高瞻远瞩，有望成为未来业绩重要驱动力,中信建投
4134,2018-10-01,乐普医疗参股公司旗下企业PD-1创新型单抗药物已进入II期临床试验,Wind
4135,2018-10-01,乐普医疗参股公司旗下企业PD-1创新型单抗药物已进入II期临床试验,e公司
4136,2018-09-29,嘉实事件驱动多只重仓股大跌，海归基金经理“水土不服”,和讯
4137,2018-09-29,融资客斥资近70亿元净买入189只标的股机构扎堆看好7只三季报预喜股,顶尖财经网
4138,2018-09-29,九月沪指上涨3.53% 三路资金辗转腾挪欲搏金秋行情,证券日报
4139,2018-09-29,"医药周报2018第34期:关注结构性机会,看好创新药和生物类似药的发展",长城证券
4140,2018-09-28,医药行业：全方位深度解析带量采购对医药行业的影响,顶尖财经网
4141,2018-09-28,医疗生物中期业绩趋势向好高端医疗器械存机会,顶尖财经网
4142,2018-09-28,药品带量采购试点进入“倒计时”,南都报
4143,2018-09-28,"医药生物行业周报:抵扣新规落地,研发利好加码",光大证券
4144,2018-09-27,医药股集体大涨 机构揭秘打好四季度“反击战”的三条思路,证券时报网
4145,2018-09-27,财融汇·早间必读 | 20180927,财通证券融资融券部
4146,2018-09-27,医药行业向来是一片创新研发“沃土” 医药板块未来可期,证券日报
4147,2018-09-27,医药创新再迎政策激励 7只低估值业绩预喜股潜力足,证券日报
4148,2018-09-26,A股共发生79宗大宗交易成交25.94亿元（9月26日）,Wind
4149,2018-09-26,乐普医疗今日大宗交易成交10.31万股，成交价26.6元折价12.04%,Wind资讯
4150,2018-09-26,09月26日 收盘突破年线个股一览,每日经济新闻
4151,2018-09-26,医疗保健：浙江省抗癌药专项集中采购工作方案公布,川财证券
4152,2018-09-26,国开证券研究20180926,国开证券研究
4153,2018-09-26,迈瑞医疗周四启动申购 募资金额创出创业板IPO新高,新浪
4154,2018-09-26,"医药行业周报:基药制度进一步完善,制药业供给侧持续改革",渤海证券
4155,2018-09-25,日常消费品：上海调整药品带量采购规则,川财证券
4156,2018-09-24,深市多层次板块各有千秋 折射中国经济变革脉络,证券日报
4157,2018-09-24,带量采购重塑行业新秩序？医药白马股巨震 这些公司迎来机遇！,e公司
4158,2018-09-24,医疗保健：减税支持企业研发投入 荐5股,财通证券
4159,2018-09-24,医疗保健：版块有望延续反弹 荐6股,川财证券
4160,2018-09-24,30家上市公司获海外机构调研 鹏辉能源最受关注,证券时报
4161,2018-09-24,高管增持12只业绩暴增股,证券时报网
4162,2018-09-23,反弹市机构新动向曝光！百家机构扎堆调研这些股,Wind
4163,2018-09-23,医疗保健：持续看好创新药产业链 荐8股,中泰证券
4164,2018-09-23,机构、股东、高管争相买入这些业绩暴增股（名单）,证券时报
4165,2018-09-21,国家试点带量采购或重塑医药行业格局多家药企回应政策影响,顶尖财经网
4166,2018-09-21,88家创业板公司发三季报预告 5家公司净利润增长10倍,证券日报
4167,2018-09-20,海外机构调研股名单 洋河股份最受关注,证券时报网
4168,2018-09-20,【晨会聚焦】锂电中游再扬帆，医药价值渐显现,中泰证券研究所
4169,2018-09-19,医药行业：带量采购祸福相依 危机并存,光大证券
4170,2018-09-19,【国金策略】EPFR显示资金净流入中国--资金周度监测128期（李立峰/魏雪等）,策略李立峰与行业配置笔记
4171,2018-09-19,放量反弹大单动向成焦点 三因素筛出131只潜力股,证券日报
4172,2018-09-19,医药生物行业周报:关注超跌及子行业龙头,华安证券
4173,2018-09-19,"“大医保”动态跟踪系列报告之三:带量采购,祸福相依,危机并存",光大证券
4174,2018-09-18,A股市场资金变动一览（9月18日）,Wind
4175,2018-09-18,【数据揭秘】09月17日 融资客最看好的前20只个股,每日经济新闻
4176,2018-09-18,日常消费品：54个药品全国停止供货,川财证券
4177,2018-09-18,开盘：沪指低开0.28%报2644.30点 其他休闲服务等板块领跌,腾讯网
4178,2018-09-18,融资客青睐24股，四方股份买入占比高达58.43%,Wind
4179,2018-09-18,136亿主力资金近三日大量撤出中小创,证券时报网
4180,2018-09-18,【北上资金跟踪周报】北上资金逆市净买入，恒瑞医药被大幅净卖出,联讯金融
4181,2018-09-17,2018世界人工智能大会召开 16只绩优股获机构扎堆看好,证券日报
4182,2018-09-17,【收市点评】沪指缩量收跌逾1% 燃气板块活跃,兴业证券兴e通
4183,2018-09-17,上投摩根多只混基大跌引基民大吐槽，旗下基金上半年亏损超25亿,和讯
4184,2018-09-17,资金流:超反3股老妖1股流入居前 两市净流出178亿,金融界
4185,2018-09-17,【晨会纪要】策略丁文 银河证券晨会纪要—20180917,中国银河证券研究
4186,2018-09-17,A股三大股指收跌逾1%深成指失守8000点,搜狐
4187,2018-09-17,239亿资金争夺20股：主力资金重点出击7股(名单),新浪
4188,2018-09-17,医药生物：医药工业持续回升，关注业绩确定性龙头,国联研究
4189,2018-09-17,券商A股策略周报：历史底部区域 市场亟需重塑信心,证券时报网
4190,2018-09-17,乐普医疗：带量采购基本上不影响公司药品利润比率,Wind
4191,2018-09-17,A股三大股指均跌逾1% 台风登陆白糖股亮眼 平安资管重仓股普跌,每日经济新闻
4192,2018-09-17,乐普医疗：带量采购对公司是一个重要机遇，不会实质影响利润确定价格,Wind
4193,2018-09-17,乐普医疗：带量采购对公司是一个重要机遇 不会实质影响利润确定价格,e公司
4194,2018-09-17,"医药股中长期投资价值被看好 当前""追涨杀跌""已成风",新浪
4195,2018-09-15,86家药企晒三季度业绩预告：4家净利润超10亿元 2家首亏 亏损,米内网
4196,2018-09-14,9月14日有78家公司获重要股东增减持 包钢股份已被连续增持55次,Wind
4197,2018-09-14,【数据揭秘】09月13日 融资客最看好的前20只个股,每日经济新闻
4198,2018-09-14,征战龙虎榜：成都两券商营业部积极做多博云新材,顶尖财经网
4199,2018-09-14,【兴业定量任瞳团队】基金经理揭秘系列之八：嘉实基金齐海滔,XYQUANT
4200,2018-09-14,医保动态跟踪系列——药品带量集采全国试点：短期阵痛，中长期加速产业升级,申万宏源研究
4201,2018-09-14,东海晨报摘要(20180914),微信
4202,2018-09-14,千亿巨头登陆A股！迈瑞医疗拟募资57.5亿元 冲击A股创业板与医疗器械“双一哥”,中证报
4203,2018-09-14,互联网诊疗管理试行办法发布 医院IT市场望打开(股),金融界
4204,2018-09-14,两融余额持续两月低于9000亿 融资客捡漏15只潜力股,证券日报
4205,2018-09-13,公告“特意”强调乐普医疗董秘恐怕花式护盘变砸锅,新浪
4206,2018-09-13,【13日资金路线图】主力资金净流出56亿元 龙虎榜机构抢筹6股,证券时报网
4207,2018-09-13,龙虎榜|凉了？乐视网复牌跌停，欢乐海岸“清盘式”出逃1415万！ 减资破产,云掌财经
4208,2018-09-13,广发基金主动权益类产品七成亏损，多位资深老将业绩不佳,和讯
4209,2018-09-13,龙虎榜 | 大盘放量反弹 机构卖多买少,金融投资报
4210,2018-09-13,杠杆资金大幅加仓强势补跌股，释放一明显信号,Wind
4211,2018-09-13,资金流:金融2股5G2股流入居前 两市净流出96亿,金融界
4212,2018-09-13,乐普医疗龙虎榜数据（9月13日）,Wind
4213,2018-09-13,乐普医疗放量大跌超7%，机构深股通大举抛售,Wind
4214,2018-09-13,09月13日 主力资金抢筹最积极的前10股（附名单）,每日经济新闻
4215,2018-09-13,343亿资金争夺20股：主力资金重点出击8股(名单),新浪
4216,2018-09-13,广州万隆：利好变“套路”！扶不起的A股问题出在哪？,中金在线
4217,2018-09-13,采掘服务板块领涨两市,红周刊
4218,2018-09-13,医药股集体大幅杀跌,红周刊
4219,2018-09-13,9月13日大盘午评：沪指小幅上涨 油服概念股强势,南方财富网
4220,2018-09-13,乐普医疗跌停 汇添富基金持5000多万股日浮亏约2亿 重仓股票异动,新浪
4221,2018-09-13,带量采购清单重挫医药股 广誉远财务数据异常跌停,新浪
4222,2018-09-13,【数据揭秘】09月12日 融资客最看好的前20只个股,每日经济新闻
4223,2018-09-13,医药股跌幅继续扩大，恩华药业再遭跌停,Wind
4224,2018-09-13,医药股急速跳水，康泰生物、美年健康等多股迅速翻绿,Wind
4225,2018-09-13,道达投资手记：蓝筹白马补跌 调整进入尾声？,每日经济新闻
4226,2018-09-12,蓝筹白马补跌 调整进入尾声？——道达投资手记,每日经济新闻
4227,2018-09-12,老艾侃股：蓝筹砸盘为哪般？,新浪
4228,2018-09-12,【超级大单】 09月12日 8只个股特大单净流入超亿元,每日经济新闻
4229,2018-09-12,仿制药概念遭遇重挫 消息称第一批带量采购清单公布,证券时报网
4230,2018-09-12,医药板块表现疲软 恩华药业跌停,每经网
4231,2018-09-12,千山药机高开高走拉升7.08%报4.69元 成交2.11亿元,腾讯网
4232,2018-09-12,【数据揭秘】09月11日 融资客最看好的前20只个股,每日经济新闻
4233,2018-09-12,基因研究取得重要进展 关注精准医疗,第一财经
4234,2018-09-12,诺奖概念提前布局正逢时 抗癌靶心找到，打响一亿人关心的第一枪,金元证券指定乾坤
4235,2018-09-12,【赢家资讯】09月12日收盘简评,赢家之星
4236,2018-09-12,"医药生物行业周报:静待市场企稳,关注优质成长个股",万联证券
4237,2018-09-12,医药行业周报2018第32期:分化行情下兼顾业绩和估值,长城证券
4238,2018-09-11,社保基金已经赚万亿人民币 青睐医药生物等六行业,新浪
4239,2018-09-11,09月11日 22只股票封板 工艺商品板块涨幅最大,每日经济新闻
4240,2018-09-11,医药生物2018年中报总结既9月投资策略：价值渐显，适度乐观,国信研究
4241,2018-09-11,【数据揭秘】09月10日 融资客最看好的前20只个股,每日经济新闻
4242,2018-09-11,医疗保健：15药品拟纳入第32批优先审评程序,川财证券
4243,2018-09-11,28股获券商买入评级，东诚药业目标涨幅达49.40%,Wind
4244,2018-09-11,迈瑞医疗将登陆创业板,深圳商报
4245,2018-09-11,社保基金长期重仓股名单曝光，连续五年坚守24只个股,证券日报
4246,2018-09-11,社保基金长期重仓股名单曝光 连续五年坚守24只个股,证券日报
4247,2018-09-11,"医药生物行业:疫苗企业未发现质量安全问题,进口抗癌药专项采购启动",国联证券
4248,2018-09-11,乐普医疗事件点评:肿瘤免疫治疗进入战略部署阶段,国海证券
4249,2018-09-10,财融汇·个股研报精选,财通证券融资融券部
4250,2018-09-10,【数据揭秘】09月07日 融资客最看好的前20只个股,每日经济新闻
4251,2018-09-10,创业板上半年超九成公司实现盈利 并购回归理性溢价率下降35.82%,证券日报
4252,2018-09-09,乐视网拖累？还原创业板中报业绩增速较低“真相”,证券时报网
4253,2018-09-09,730家创业板企业中报扫描：信息技术、新材料、生物产业奋起,21经济网
4254,2018-09-09,医疗保健：自下而上选择穿越熊市 荐5股,财通证券
4255,2018-09-09,股转回应摘牌潮、做市商退出、基金退出难题等问题；滨会生物定增被上市公司子公司全额认购,新三板智库
4256,2018-09-08,迈瑞医疗市值或超千亿 冲A股医疗器械和创业板双一哥,中国基金报
4257,2018-09-08,恐慌情绪降温 A股底部形态趋明朗,中证报
4258,2018-09-07,沪深股市冲高回落：科技股午后一蹶不振，沪指险守2700点,澎湃新闻
4259,2018-09-07,09月07日 主力资金抢筹最积极的前10股（附名单）,每日经济新闻
4260,2018-09-07,09月07日 主力资金近三日都在买这些概念股,每日经济新闻
4261,2018-09-07,公布肿瘤免疫治疗产品布局，着眼长期发展动能,中信建投
4262,2018-09-07,医药行业：行业持续稳健增长分化明显强者恒强,顶尖财经网
4263,2018-09-07,乐普医疗高开高走拉升5.11%报33.53元 成交2.63亿元,腾讯网
4264,2018-09-07,【川财研究所*每日晨报】20180907：发改委再推民间资本参与PPP项目,川财研究
4265,2018-09-06,48家上市械企，赚钱能力大比拼！,中商情报网
4266,2018-09-06,2018年医药行业中报总结分析：暂时无方向性自下而上选择为主,顶尖财经网
4267,2018-09-06,以乐普生物为基石 重点打造肿瘤免疫治疗平台,中泰证券
4268,2018-09-06,【医药】乐普医疗：肿瘤免疫治疗布局高瞻远瞩，有望成为未来业绩重要驱动力,天风研究
4269,2018-09-06,"医药行业周报:基药目录大调整,国务院下令增补187个品种",渤海证券
4270,2018-09-05,乐普医疗：发行可转债申请获证监会受理,e公司
4271,2018-09-05,医疗保健：基药目录大调整 荐13股,渤海证券
4272,2018-09-05,乐普医疗：员工持股计划落地，打造肿瘤免疫治疗产业链,西南证券
4273,2018-09-05,医疗保健：国产医械首登《柳叶刀》,川财证券
4274,2018-09-05,医药行业：处方药压力渐显 非药景气依旧,光大证券
4275,2018-09-05,【乐普医疗】公告点评：肿瘤线产品、产业布局崭露头角,医心医意要健康
4276,2018-09-05,乐普医疗：立足乐普生物 全面布局肿瘤免疫,中金公司
4277,2018-09-05,"医药生物行业周报:处方药如期回落,非药延续高景气",光大证券
4278,2018-09-05,"医药生物行业周报:板块业绩高增长,短期关注超跌与绩优股",华安证券
4279,2018-09-04,乐普医疗第一期员工持股计划买入2070万股 高管年初以来多次增持,证券日报
4280,2018-09-04,【华泰医药代雯团队】医药板块2018中报总结：增长稳健，强者恒强,谈医论股丨华泰医药
4281,2018-09-04,处方药压力渐显，非药景气依旧｜【光大医药·2018H1总结】,医心医意要健康
4282,2018-09-04,招商证券：医药行业维持较高景气 关注优质白马及高成长个股,证券时报网
4283,2018-09-04,【太平洋证券策略】社保基金2018年2季度持仓分析,周雨策略观察
4284,2018-09-04,医疗保健：203个药品辽宁议价未成功,川财证券
4285,2018-09-04,机构动向：外资减消费加周期 私募在“吃面”,网易
4286,2018-09-04,【山证医药】医药生物行业周报（20180827-20180902）：行业整体业绩表现优异，关注细分领域,山西证券研究所
4287,2018-09-03,"中小盘行业周报:创业板业绩回落,顶固集创建议关注",正点财经
4288,2018-09-03,医疗保健：聚焦创新和消费主线 荐16股,西南证券
4289,2018-09-03,【天风医药】9月月报：中报季收官，震荡中寻找高防御性标的,思医辨药
