,2021-12-31,年终盘点|医药2021：白马纷纷倒下 创新药走出温室 医改重构医药投资价值逻辑,财联社
0,2021-12-31,SGI公司|高值医疗耗材龙头：乐普医疗VS三友医疗,和讯
1,2021-12-30,“A拆A”年终盘点：7公司无奈终止，11家喜过会，这3家已敲钟,搜狐
2,2021-12-24,乐普医疗：股东七二五所发行6亿元可交换公司债,每日经济新闻
3,2021-12-23,乐普医疗于北京成立新公司，注册资本2000万元,乐居财经
4,2021-12-22,乐普医疗：又一核酸提取或纯化试剂通过审批 试剂全面升级9分钟完成核酸提取,e公司
5,2021-12-22,五部委联合发文进一步缩小进口医疗器械减税范围，国产医疗器械迎来发展机遇,Wind
6,2021-12-21,宁夏回族自治区药品监督管理局：2批次医疗器械抽检不合格 产品问题,质量新闻网
7,2021-12-21,他53岁，刚刚收获第三家上市公司，市值45亿！,猎云网
8,2021-12-20,盘点2021 | 国内医械行业12大并购案,赛柏蓝器械
9,2021-12-15,热门股票基本面：行业越来越卷，乐普医疗如何破局？,新浪
10,2021-12-14,盘点丨2021年国内医疗器械行业大型收购,医疗器械创新网
11,2021-12-14,以植入介入器械为例，看国内医疗器械龙头的逆袭,艾美达行业研究
12,2021-12-09,乐普医疗冲刺港交所有戏吗？扩张的收益何时落袋？和讯SGI指数评分91,和讯
13,2021-12-09,医美、器械集体造好，医疗器械ETF放量大涨2.74％,Wind
14,2021-12-09,国内ESG基金是“标题党”么？,新浪
15,2021-12-09,超100家上市医疗器械企业披露2021年三季报：12家营收突破50亿元,制药网
16,2021-12-06,乐普医疗注册资本增加1.29%至18.05亿元,乐居财经
17,2021-12-03,乐普医疗(300003.SZ)超短期融资券获准注册,智通财经
18,2021-12-03,乐普医疗(300003.SZ)耗资8493.46万元累计回购388.4万股,智通财经
19,2021-12-03,乐普医疗：截至2021年12月3日已累计回购约388万股，占比0.2152%,每日经济新闻
20,2021-12-02,盘点丨2021年国内医疗器械行业大型收购（上篇）,贝壳社
21,2021-11-29,融资客青睐7股，上实发展买入占比高达42.74%,Wind
22,2021-11-25,深度！2021年中国医疗器械行业竞争格局及市场份额分析 市场集中度低且竞争较分散,前瞻研究院
23,2021-11-23,乐普医疗(300003.SZ)：已累计回购388.4万股,格隆汇
24,2021-11-19,乐普医疗(300003.SZ)：所属企业心泰医疗赴港IPO获中国证监会核准,格隆汇
25,2021-11-19,乐普医疗：心泰医疗发行境外上市外资股获中国证监会核准,财联社
26,2021-11-19,英科医疗、乐普医疗离价值王者有多远？,Ofweek
27,2021-11-18,布局肝纤维化无创检测！乐普医疗又一产品获NMPA批准上市！,思宇医械观察
28,2021-11-17,近20省“超大采购团”来袭，集采威慑之下，心脏起搏器格局会大变吗？,MedTrend医趋势
29,2021-11-17,乐普医疗：肝脏剪切波量化超声诊断仪获准上市,e公司
30,2021-11-12,乐普医疗收监管函：逾期未完成对乐普租赁的处置 问询,Wind
31,2021-11-12,深交所向乐普（北京）医疗器械股份有限公司发出监管函 问询,每日经济新闻
32,2021-11-11,金额同比翻番，914家公司年内回购超千亿,Wind
33,2021-11-10,乐普医疗(300003.SZ)控股股东蒲忠杰及其一致行动人合计解质8431.86万股,智通财经
34,2021-11-10,乐普医疗(300003.SZ)：控股股东及其一致行动人解押8431.86万股及质押4732万股,格隆汇
35,2021-11-10,乐普医疗：蒲忠杰累计质押股数约为1.31亿股,每日经济新闻
36,2021-11-05,医疗健康产业2022年投资策略：医疗投资进入百花齐放时代 国产自主化进入新高潮,新浪
37,2021-11-04,晚间重要公告2021年11月4日星期四,Wind
38,2021-11-04,乐普医疗(300003.SZ)首次回购48万股 耗资1018.92万元,智通财经
39,2021-11-04,乐普医疗：首次回购48万股,每日经济新闻
40,2021-11-03,乐普医疗(300003.SZ)股东七二五所拟非公开发行可交债获深交所无异议函,智通财经
41,2021-11-03,乐普医疗(300003.SZ)：七二五所拟非公开发行不超6亿元可交换公司债获深交所无异议函,格隆汇
42,2021-11-03,乐普医疗(300003.SZ)：11月3日首次回购48万股,格隆汇
43,2021-11-03,乐普医疗拟回购不低于3亿元公司股份,阿尔法工场
44,2021-11-03,A股早报2021年11月3日星期三,Wind
45,2021-11-03,上市公司正负面新闻2021年11月3日星期三,Wind
46,2021-11-02,晚间重要公告2021年11月2日星期二,Wind
47,2021-11-02,乐普医疗(300003.SZ)拟斥3亿元至5亿元回购股份 回购价不超35元/股,智通财经
48,2021-11-02,乐普医疗：拟以3亿元-5亿元回购股份,财联社
49,2021-11-02,利润爆减76.54%！集采下的医械龙头企业，距高点市值蒸发400亿,医疗器械创新网
50,2021-11-01,乐普医疗接受96家机构调研！短期主力资金净流出,每日经济新闻
51,2021-11-01,乐普发布公告，“支架龙头”利润几何？,赛柏蓝器械
52,2021-11-01,乐普，又一子公司赴港上市！,器械之家
53,2021-11-01,乐普医疗(300003.SZ)高级副总经理魏战江增持11.36万股公司股份,智通财经
54,2021-11-01,中泰证券维持乐普医疗买入评级：扣非利润持续快速增长，创新产品加速放量,每日经济新闻
55,2021-11-01,中泰证券：给予乐普医疗买入评级,证券之星
56,2021-11-01,A股早报2021年11月1日星期一,Wind
57,2021-11-01,乐普医疗介入无植入创新产品收入增10倍 持股君实生物损失逾2亿净利骤降逾76% 盈利能力下降,长江商报
58,2021-10-31,通策医疗股价大幅下跌市值缩水，掉出榜单前十「医疗器械周榜」,华夏时报
59,2021-10-30,多空博弈：“元宇宙”概念疯涨引市场关注　业绩大降乐普医疗股价跳水 盈利能力下降,财富动力网
60,2021-10-29,第三季度净利同比下滑，乐普医疗大跌超15%，四机构抛售近4亿元 盈利能力下降,第一财经
61,2021-10-29,三季度净利下降76%，这只医械龙头股价大跌，机构、北向集体抄底加仓 盈利能力下降,21世纪经济报道
62,2021-10-29,乐普医疗放量大跌 四机构合集卖出3.78亿元,第一财经
63,2021-10-29,龙虎榜|乐普医疗放量大跌15.86% 四机构合计卖出3.78亿元,财联社
64,2021-10-29,乐普医疗放量大跌近16%，机构、外资集体出逃,Wind
65,2021-10-29,“支架龙头”股价难支 乐普医疗破位大跌13%,第一财经
66,2021-10-28,图解乐普医疗三季报：第三季度单季净利润同比减76.54%,证券之星
67,2021-10-28,乐普医疗(300003.SZ)：第三季度扣非净利润降23.80%至3.67亿元,格隆汇
68,2021-10-28,乐普医疗最新公告：第三季度净利润1.95亿元 同比下降76.54% 盈利能力下降,证券之星
69,2021-10-28,乐普医疗：第三季度净利同比降76.54%,格隆汇
70,2021-10-28,乐普医疗：第三季度净利润1.95亿元 同比下降76.54%,财联社
71,2021-10-28,乐普医疗：前三季度净利润同比减少2.63% 盈利能力下降,Wind
72,2021-10-25,固定收益快评：可交换私募债跟踪,新浪
73,2021-10-15,入围“十四五”规划纲要的全降解血管支架亮相医博会！乐普创新产品获多方关注,器械之家
74,2021-10-13,医药生物行业双周报：行业估值处于历史平均以下 择优布局优质标的,新浪
75,2021-10-01,营收净利双升股价却跌超40% 健帆生物被“集采”和减持缠住手脚？ 盈利能力下降,投资者网
76,2021-09-29,乐普医疗：“乐普转2”10月8日起开始转股,Wind
77,2021-09-29,乐普医疗：“乐普转2”自10月8日起开始转股,每日经济新闻
78,2021-09-27,医药生物行业周报：从景气度、竞争力、外需逻辑看诺禾致源投资价值,新浪
79,2021-09-26,医药生物行业资金流入榜：6股净流入资金超亿元,证券之星
80,2021-09-24,药企集采一年：恒瑞降价7成增长停滞，乐普医疗季亏后上半年利润增50%,搜狐
81,2021-09-15,康泰生物、沃森生物、乐普医疗跌超4%，科创创业ETF（588360）跌超1%,资本邦
82,2021-09-14,乐普医疗：公司的甘精胰岛素还未获批上市，无缘本次集采，该产品未对公司营业收入和净利润产生影响,每日经济新闻
83,2021-09-14,乐普医疗收购天穹科技100%股份,乐居财经
84,2021-09-13,医药生物行业中报透视CXO：板块增长强劲 边际变化持续向好,新浪
85,2021-09-13,中国证监会北京监管局对乐普医疗董事长蒲忠杰出具警示函！ 金融监管处罚,medworld器械世界
86,2021-09-12,证监会警示：乐普医疗董事长蒲忠杰,器械之家
87,2021-09-11,乐普医疗：公司深圳大楼于2021年7月29日主体结构封顶，目前仍在施工建设当中,每日经济新闻
88,2021-09-10,天风证券维持乐普医疗买入评级：介入无植入产品销售快速增长，持续加大研发投入,每日经济新闻
89,2021-09-09,乐普医疗：总经理张志斌今日增持4.64万股公司股份,财联社
90,2021-09-09,乐普医疗(300003.SZ)总经理张志斌累计增持4.64万股,智通财经
91,2021-09-09,承诺事项超半年仍未完成 乐普医疗及董事长收证监局警示函 承诺失信,和讯
92,2021-09-09,乐普医疗发可转债未完成承诺 实控人蒲忠杰收警示函 金融监管处罚,中国经济网
93,2021-09-09,北京证监局决定对乐普（北京）医疗器械股份有限公司、蒲忠杰采取出具警示函监管措施 金融监管处罚,Wind
94,2021-09-09,关于对乐普（北京）医疗器械股份有限公司、蒲忠杰采取出具警示函监管措施的决定 金融监管处罚,北京证监局
95,2021-09-08,“问诊”冠脉支架集采：球囊破裂、手术缺支架，“以价换量”该如何“保质保量”？,21世纪经济报道
96,2021-09-08,最新！国家医保局连发3条回复，再次回应支架紧缺问题,Eshare医械汇
97,2021-09-08,联采办回应个别冠脉心脏支架紧缺：使用量已超全年协议采购量,羊城晚报
98,2021-09-08,和讯SGI新医疗TOP10：此消彼长，行业欣欣向荣，十年黄金发展期谁主沉浮？,和讯
99,2021-09-08,健康卫生板块首秀干货多,新浪
100,2021-09-07,一个药球抵20个支架！毛利80%冠脉球囊有多少降价空间？,第一财经
101,2021-09-07,“支架供大于求”背后，集采中标企业在如何满足市场？,第一财经
102,2021-09-07,迈瑞医疗跌超3%，科创创业ETF(588360)盘中跌近0.50%,资本邦
103,2021-09-07,医药板块迎来崛起，超30只医药ETF大涨超4%,资本邦
104,2021-09-07,基金早班车|医药板块“回血”涌现涨停潮 百亿量化私募数量频频刷新纪录,金融界
105,2021-09-06,医药股大爆发！最佳买点已现？公募基金紧急解盘,中国基金报
106,2021-09-06,北交所来了：小而美医药版图,雪球
107,2021-09-06,和讯SGI指数榜单更新！金山办公、迈瑞医疗并驾齐驱，江苏北人仍垫底,和讯
108,2021-09-05,国产冠脉球囊匆匆“带量” ，质量隐患已引起监管重视,第一财经
109,2021-09-05,全球首款！全降解铁基冠脉支架系统获准临床试验,器械之家
110,2021-09-04,医药生物行业本周跌2.03%，主力资金净流出173.71亿元,证券时报网
111,2021-09-03,2021上半年医疗耗材三巨头排名生变！乐普超越威高，微创亏损但市值第一 亏损,MedTrend医趋势
112,2021-09-03,2021年服贸会在京开幕 健康卫生版块首度亮相备受瞩目,艾美达行业研究
113,2021-09-03,迈瑞医疗10亿回购助力板块企稳上扬 医疗器械ETF午后上涨0.62%,资本邦
114,2021-09-03,迈瑞医疗10亿回购助力板块企稳上扬，医疗器械ETF（159883）午后上涨0.62%,资本邦
115,2021-09-03,华熙生物、昊海生科、爱美客医美“三剑客”业绩大增！行业监管趋严下有哪些新增长引擎？,medworld器械世界
116,2021-09-03,乐普医疗(300003)点评：创新产品快速放量 看好公司管线价值逐步兑现,新浪
117,2021-09-01,医疗器械最强夫妻档，上市公司生得比娃多！,21财闻汇
118,2021-09-01,基金早班车|2021年“翻倍基”出现！张坤、董承非、傅友兴、赵蓓、葛兰隐形重仓股,金融界
119,2021-08-31,葛兰、赵蓓、郑磊等医药基金二季度隐形重仓公司,新浪
120,2021-08-31,乐普医疗(300003)：业绩略超预期 期待创新器械发力,新浪
121,2021-08-31,和讯SGI公司|之江生物SGI最新得分84 公司上半年净利润降9.59%，集采致产品毛利下降 盈利能力下降,和讯
122,2021-08-31,萧楠等基金“顶流”隐形重仓股浮出水面,每日商报
123,2021-08-31,12年营收翻了20倍，董事长年薪却从193万元跌到0元,21商评网
124,2021-08-30,乐普医疗2021年上半年实现净利润18.16亿元，同比大幅增长53.35%,经济观察网
125,2021-08-29,乐普公布半年业绩，主营业务触底反弹？离彻底破局还有多远？,赛柏蓝器械
126,2021-08-29,中泰证券维持乐普医疗买入评级：业绩符合预期,Wind
127,2021-08-29,中泰证券维持乐普医疗买入评级：业绩符合预期，创新产品持续放量,每日经济新闻
128,2021-08-29,乐普医疗(300003)：业绩符合预期 创新产品持续放量,新浪
129,2021-08-28,今日621公司公布半年报 143家业绩增幅翻倍,证券时报网
130,2021-08-27,乐普医疗(300003.SZ)上半年归母净利润同比增长51%至17.26亿元,智通财经
131,2021-08-27,乐普医疗(300003.SZ)上半年净利升51.34%至17.26亿元,格隆汇
132,2021-08-27,乐普医疗：上半年净利润同比增长51.34%,Wind
133,2021-08-27,一台手术用破四个球囊！“集采唯低价论”的后遗症？,瞪羚社
134,2021-08-27,国君固收：与集采有关的转债标的梳理,Wind
135,2021-08-27,多只医疗器械股票大跌 行业前景不确定性增加？,中国经济网
136,2021-08-27,嘉实医药健康100ETF净值下跌3.61%,新浪
137,2021-08-26,基金持仓动向：泓德基金王克玉二季度加仓这些股（名单）,金融界
138,2021-08-25,官方文件 | 一批医用耗材再降60%，不降则出局,赛柏蓝器械
139,2021-08-25,因为90后“怕死又爱美”，口腔赛道的这12个创始人拿到了40亿融资,36氪
140,2021-08-22,一台手术用破四个球囊！业内呼吁“低价中标”理念应客观评价,第一财经
141,2021-08-21,估值创5年新低股票曝光，集中在这个行业,Wind
142,2021-08-21,估值创5年新低的股票曝光，集中在这个行业，具有高增长+低估值特征（附名单）,e公司
143,2021-08-20,被集采重锤的新产业：体外检测，熊路漫漫,格隆汇
144,2021-08-19,乐普医疗：公司目前正在整体布局齿科行业,每日经济新闻
145,2021-08-19,医疗医美持续回调，资金借ETF进场抢筹！医疗器械ETF（159883）连续6日净申购,资本邦
146,2021-08-17,乐普医疗：博思美今年三季度并入报表,Wind
147,2021-08-16,老牌械企新华医疗“瘦身”提速：并购“消化不良” 半年出售4家公司股权,每日经济新闻
148,2021-08-16,超信立泰，追赶君实、华大基因，义翘神州值400亿元？这些领域基本被外资垄断，生态链公司开始展露头角,E药经理人
149,2021-08-16,医药生物行业周报：医疗服务三问三答 何时会出现板块性机会？,新浪
150,2021-08-16,【兴证医药】坚守大赛道龙头，寻找“专精特新”小龙头 - 医药行业周报（2021.08.09.-2021.08.13）,兴证医药健康
151,2021-08-16,乐普医疗：公司的Sinocrown T A VR目前已完成FIM十例入选,每日经济新闻
152,2021-08-13,乐普医疗：新冠检测类产品目前出口包括但不仅限于德国等全球所有有进口资质的国家和地区,Wind
153,2021-08-13,鱼跃医疗看好家用POCT赛道，血糖仪市场比拼“准确性”,第一财经
154,2021-08-13,乐普医疗：公司新冠核酸检测试剂盒可有效涵盖突变株,Wind
155,2021-08-13,乐普医疗：公司新冠核酸检测试剂盒 可有效涵盖突变株,财联社
156,2021-08-13,平均降价93%！这些集采中选企业，都在布局“新赛道”,medworld器械世界
157,2021-08-12,亏损72亿，卖掉医疗业务来止渴？知名企业压力重重 亏损,赛柏蓝器械
158,2021-08-11,接连两笔收购，远大医药继续“跨界”器械，但布局点也是巨头重仓之地，怎么破？,经济观察网
159,2021-08-11,医疗AI的老大？深睿合并依图医疗业务,器械之家
160,2021-08-11,【兴证医药】新冠药物研发分析 -医药行业周报(2021.08.02-2021.08.06),兴证医药健康
161,2021-08-11,医药股震荡 民生加银医药健康股票成立近1年仍亏9%,中国经济网
162,2021-08-11,心玮医疗上市在即，是一场资本游戏的延续还是行业曙光将至？,美股研究社
163,2021-08-10,溢价950％收购，乐普医疗进军“暴利”行业,医药网
164,2021-08-10,东亚前海晨会 | 8月10日,新浪
165,2021-08-09,溢价950％收购，乐普进军“暴利”行业，这些头部企业都在“换赛道”,Eshare医械汇
166,2021-08-09,医疗器械ETF（159883）早盘上涨1.08%，连续三日吸金超3000万基金份额创上市新高！,资本邦
167,2021-08-08,2.37亿元溢价近10倍收购亏损企业，乐普医疗转战隐形正畸赛道能否分得一杯羹？ 亏损,华夏时报
168,2021-08-06,6年买31家公司之后，5年又卖10家，新华医疗“丢卒保车”，“收购后遗症”仍在,经济观察网
169,2021-08-05,中选产品价格联动效应加剧，降价风暴持续蔓延，如何走出“囚徒困境”？,Eshare医械汇
170,2021-08-05,省际联盟耗材集采结果出炉：13省冠脉导引导丝最高降77%，12省骨科创伤类均降88.65%,医药云端工作室
171,2021-08-05,【兴证医药】全球疫情再反弹，新冠疫苗相关标的业绩逐步释放-兴证医药2021年8月投资月报,兴证医药健康
172,2021-08-05,366家公司预告上半年业绩 近八成报喜,发布易
173,2021-08-05,366家公司预告上半年业绩 近八成报喜,中证报
174,2021-08-04,总市值135500亿！今天，创业板上市公司达1000家 最牛个股已涨超117倍！,全景网
175,2021-08-04,乐普医疗：暂无颅内支架领域产品的研发,每日经济新闻
176,2021-08-03,健帆生物：单一产品贡献9成收入和毛利，集采危机两个月股价下跌超40% 经营问题,搜狐
177,2021-08-03,新冠检测板块大涨，疫情仍在路上投资价值凸显,财华社
178,2021-08-03,新冠检测板块午后持续拉升，医疗器械ETF（159883）涨幅扩大至4.46％！,资本邦
179,2021-08-02,乐普医疗：生物可吸收支架目前不属于集采范畴,每日经济新闻
180,2021-08-02,医疗器械行业一周回顾（7月26日-8月1日）,Eshare医械汇
181,2021-08-02,投资者提问：面对来势汹汹的新冠病毒变异株，国内多个城市已经加大核酸筛查力度,新浪
182,2021-08-02,投资者提问：请问贵公司目前为国内多少家医疗机构建立新冠核酸检测生物实验室协,新浪
183,2021-08-02,骨科集采来了，这2家公司业绩危险了？,凤凰网
184,2021-08-01,又一家公司计划撤回精选层申请：概念股公布半年报 这些公司业绩亮眼,新浪
185,2021-07-30,解密主力资金出逃股 连续5日净流出815股,证券时报网
186,2021-07-30,冠脉支架系列报告之二：借鉴国外发展经验 国内冠脉支架“亮剑”,华安证券
187,2021-07-30,贡献九成收入冠脉支架无缘全国集采！赛诺医疗半年预亏超八千万 | 公司汇,投资时报
188,2021-07-29,不惧暴跌！高瓴抄底核心资产，坚定看好这一领域！,新浪
189,2021-07-29,解密主力资金出逃股连续5日净流出839股,证券时报网
190,2021-07-29,本土企业崛起步伐加快 我国血管介入导管领域发展势头强劲,中国医药报
191,2021-07-29,在瑞尔的招股说明书中，“高端”一词出现的频率较高，被企业当成自身特色大力宣传。,--
192,2021-07-29,医疗医美强势上攻，医疗器械ETF（159883）早盘涨超3％，此前5日净申购8823万！,资本邦
193,2021-07-28,乐普医疗为何以近乎十倍溢价，收购了一家亏损的企业？ 亏损,企查查
194,2021-07-28,聚焦动态血糖监测：三项技术难点建立高壁垒健康管理刚需撑起千亿市值巨头,财联社
195,2021-07-28,资本“野性”入局，口腔行业“风口分化”,MedTrend医趋势
196,2021-07-27,布局新赛道受挫？深交所发函十问乐普医疗！ 问询,器械之家
197,2021-07-27,瑞尔集团冲刺港股，高端牙科定位，为何3年却亏了12亿？ 亏损,节点财经
198,2021-07-27,国金鑫意医药消费混合C净值下跌4.35%,新浪
199,2021-07-26,医疗器械行业一周回顾（7月19日-7月25日）,Eshare医械汇
200,2021-07-26,产品可能致死，器械巨头深陷召回漩涡 产品问题,健识局
201,2021-07-26,乐普医疗回复深交所关注函：收购博思美有必要性和合理性 关注函,北京商报
202,2021-07-26,医美、医疗集体重挫，医疗器械ETF（159883）跌超5%再获资金逆势买入！,资本邦
203,2021-07-26,医疗机构检查检验结果互认工作加快推进,ZAKER
204,2021-07-26,资金借道ETF逢低布局，医疗器械ETF（159883）两日吸金5000万创上市规模新高！,资本邦
205,2021-07-26,乐普医疗：目前公司的可降解支架产品市占率较高,Wind
206,2021-07-25,乐普医疗回应逾2亿收购亏损公司：博思美短期盈利仍存不确定性,e公司
207,2021-07-25,乐普医疗：由于海外疫情以及公司战略的调整，公司的生物可吸收支架系统暂未申请海外注册,每日经济新闻
208,2021-07-25,乐普医疗：公司的PTA药物球囊、膝下PTA药物球囊、非顺应性PTA药物球囊导管正在临床阶段,每日经济新闻
209,2021-07-25,乐普医疗：乐普生物已于2021年4月28日向联交所已经提交A1申请,每日经济新闻
210,2021-07-25,乐普医疗：公司的监护设备其实已成熟运作20余年，主要面向海外市场，品质和服务都有很好的口碑,每日经济新闻
211,2021-07-24,华宝中证医疗ETF净值下跌3.52%,新浪
212,2021-07-23,冠脉支架业务“落选”全国集采 赛诺医疗半年业绩降幅超55%,经济观察网
213,2021-07-23,扛九成收入的冠脉支架业务“落选”全国集采，赛诺医疗半年业绩降幅超55%,经济观察报
214,2021-07-23,关于对王其红采取出具警示函监管措施的决定 金融监管处罚,北京证监局
215,2021-07-23,生物医药板块大幅走低，医疗器械ETF（159883）跌超3％获资金溢价买入,资本邦
216,2021-07-23,看中口腔正畸风口，溢价950%收购亏损资产，乐普医疗收关注函 关注函,金融界
217,2021-07-23,乐普医疗：在心脏电生理领域，公司在超声、射频、冷冻、标测等方向已进行研发布局,每日经济新闻
218,2021-07-23,乐普医疗：公司冠脉支架类产品主要是药物洗脱支架系统（Partner、GuReater），无载体含药洗脱支架系统（Nano）和生物可吸收药物洗脱支架系统（NeoVas）,每日经济新闻
219,2021-07-22,乐普医疗：公司暂未涉及可吸收的心脏瓣膜,每日经济新闻
220,2021-07-22,乐普医疗：继公司NeoVas获批销售后，目前仅有山东华安生物Xinsorb于2020年获批,每日经济新闻
221,2021-07-22,乐普医疗：通过控股博思美进入口腔正畸领域,每日经济新闻
222,2021-07-22,乐普医疗：为国际事业部定下“5年10倍”的计划，定下“国际事业部营业收入提升到30%”的目标，在2020年已见成效,每日经济新闻
223,2021-07-22,乐普医疗：宁波嘉度和宁波嘉呈为乐普心泰科技员工持股计划平台公司,每日经济新闻
224,2021-07-22,乐普医疗：自创立以来就不断在创新研发，推进心血管介入治疗走向介入无植入时代，独立创新制造发明的完全可降解封堵器是全球首例植入,每日经济新闻
225,2021-07-22,乐普医疗：针对主动脉瓣、二尖瓣和三尖瓣领域,Wind
226,2021-07-22,乐普医疗：公司医疗服务拥有线上心血管健康大数据平台,Wind
227,2021-07-22,投资者提问：郭总：请问公司今年4月份以来新冠检测试剂国际市场销售形势如何？,新浪
228,2021-07-22,乐普医疗：目前暂时没有布局神经介入领域,每日经济新闻
229,2021-07-22,乐普医疗：公司新一代生物可吸收支架正在研发中,每日经济新闻
230,2021-07-22,投资者提问：去年一季度中，冠脉支架产品销售额多少？期中，创新产品NeoVa,新浪
231,2021-07-22,乐普医疗：暂未涉及人工血管,每日经济新闻
232,2021-07-22,乐普医疗：董事长、副董事长目前在公司并不领取薪酬,每日经济新闻
233,2021-07-22,乐普医疗：2021年半年度介入无植入产品实现销售收入 3.64亿元，较去年同期增长1951.6%，二季度较一季度环比增幅 75.6%,每日经济新闻
234,2021-07-22,"乐普医疗：一季度营业收入为274,929.11万元，其中新冠疫情相关体外诊断产品业务收入为60,655.04万元",每日经济新闻
235,2021-07-22,乐普医疗：公司除常规产品外，还拥有金属支架、药物球囊、切割球囊、生物可吸收支架等一系列自研创新产品,每日经济新闻
236,2021-07-22,乐普医疗：公司PLLA初始原材料是外购的，但线管等半成品为公司自产，公司原材料储备及供应链体系完善,每日经济新闻
