,2021-12-31,【东吴电新】11月装机电量点评：装机量同环比高增，铁锂份额相对稳定,新兴产业汇
0,2021-12-31,2021公募冠军几无悬念！崔宸龙：在为2022做准备,Wind
1,2021-12-31,北向资金年内加仓超4300亿元创历史新高，宁德时代全年净买入超300亿,Wind
2,2021-12-31,二线厂商齐战「宁王」，动力电池格局生变,全天候科技
3,2021-12-31,2021年基金业绩今日收官：冠军包揽市场唯二“翻倍基”，股基平均回报逾7%，聪投TOP30“老将”也有出色表现,新浪
4,2021-12-30,疯涨/紧缺/争抢！2021年锂电行业十大关键词盘点（上）,Ofweek
5,2021-12-30,最全！2021年广东及浙江地区锂电池行业上市公司市场竞争格局分析 三大方面进行全方位对比,前瞻研究院
6,2021-12-30,前11月全球动力电池装机量超250GWh 5家中国企业翻倍增长,上海有色
7,2021-12-30,负极龙头产能再加码！订单充裕销量有望高增 中科电气（300035.SZ）：新增投资建设项目全部完成后公司负极材料产能将具备34-35万吨/年,智通财经
8,2021-12-30,11月全球动力电池榜：比亚迪超越松下跻身第三 欣旺达首上榜,第一电动网
9,2021-12-30,宁德时代、亿纬锂能、欣旺达，谁是成长能力最强的锂电池企业？,Ofweek
10,2021-12-30,浙商证券：电动车销量持续高增 重点把握三大投资主线,证券时报网
11,2021-12-29,能源材料行业数据跟踪,新浪
12,2021-12-29,上投摩根杜猛：中国下一个十年可能是一个能源周期,新浪
13,2021-12-29,亿纬锂能：拟以亿纬集能51%股权向亿纬动力增资,e公司
14,2021-12-29,亿纬锂能：拟向亿纬动力增资30.17亿元,财联社
15,2021-12-29,亿纬锂能(300014.SZ)：拟以所持亿纬集能51%股权向亿纬动力增资 增资作价30.17亿元,格隆汇
16,2021-12-29,亿纬锂能(300014.SZ)拟以亿纬集能51%股权作价30.17亿元增资亿纬动力,智通财经
17,2021-12-29,“缺芯”、预售、电池、新能源渗透率提升、“华为概念”……这几组热词看清了2021汽车市场冷暖,新浪
18,2021-12-29,电力系统新规出台利好国内大储能规模扩张；“猪周期”全面配置时点已至,开源证券研究所
19,2021-12-29,广州发展53亿定增落地18家机构捧场 亿纬锂能方获配5亿助推低碳能源发展,长江商报
20,2021-12-29,调仓+减持，市场赚钱效应衰退,Wind
21,2021-12-29,调仓+减持，市场赚钱效应衰退 减持股份,Wind
22,2021-12-28,年末新能源板块被调仓换股？基金经理这样说,Wind
23,2021-12-28,年底大宗交易井喷，四大行业获机构扫货！,Wind
24,2021-12-28,12月股东减持超650亿，45家大额解禁来袭,Wind
25,2021-12-28,机构且战且退，新能源板块何去何从,Wind
26,2021-12-28,"亿纬锂能布局多个热门领域 ""短线交易""乌龙事件引关注",投资者网
27,2021-12-27,广州发展披露非公开发行结果 广州产投、亿纬锂能等大手笔参投,中证网
28,2021-12-27,亿纬锂能(300014.SZ)：控股股东解除质押合计3270.699万股,格隆汇
29,2021-12-27,广州发展披露定增结果：亿纬锂能方面获配约5亿元,上证报
30,2021-12-27,亿纬锂能：亿纬控股累计质押股数为0股,每日经济新闻
31,2021-12-27,亿纬锂能(300014.SZ)控股股东亿纬控股解除质押3270.7万股,智通财经
32,2021-12-27,业绩驱动！第三轮锂涨价，2022年或迎最紧缺时刻,Wind
33,2021-12-27,新能源板块终于回血，机构却在悄悄出货……,Wind
34,2021-12-27,新能源板块终于回血 机构却在悄悄出货,上证报
35,2021-12-27,解盘：市场回暖，医药商业、基因检测、燃料电池、锂矿略涨,Wind
36,2021-12-27,新能源e周报丨新能源题材走势继续下挫 业内人士：资本市场动力电池概念或将降温,每日经济新闻
37,2021-12-27,新能源车ETF（515030）反弹涨1.5%,Wind
38,2021-12-27,【行情】锂电锂矿股反弹，永兴材料拉升涨超9%，蔚蓝锂芯、藏格矿业、亿纬锂能、科达制造、天华超净等冲高,金十数据
39,2021-12-27,盐湖提锂指数探底回升，藏格矿业、亿纬锂能、科达制造、盐湖股份表现活跃,Wind
40,2021-12-27,【电气设备】动力电池系列报告之一—动力电池行业龙头确立，二线企业有望崛起,中银证券研究
41,2021-12-27,A股早报2021年12月27日星期一,Wind
42,2021-12-27,每日理财观察：养老保险机构迎强监管,Wind
43,2021-12-25,翻倍基仅剩2只，年度冠军将是他？最惨基金已跌35%,Wind
44,2021-12-25,2200亿锂电巨头惊现15亿元大宗交易，全部为机构卖出，有什么信号？,财联社
45,2021-12-25,磷酸铁锂重回C位，未来动力电池竞争格局如何演变？,Wind
46,2021-12-25,“宁王”大跌7%，原因找到了！基金经理在调仓,Wind
47,2021-12-24,今日A股共发生293宗大宗交易，亿纬锂能成交额最高,第一财经
48,2021-12-24,透视大宗交易：12月24日共成交293笔，亿纬锂能成交15.1亿元,每经网
49,2021-12-24,"亿纬锂能现5笔大宗交易 共成交150,950.01万元",新浪
50,2021-12-24,亿纬锂能今日大宗交易成交1292.28万股，成交价116.81元溢价0.88%,Wind
51,2021-12-24,亿纬锂能今日出现超15亿元溢价大宗交易，为机构卖出,Wind
52,2021-12-24,A股收盘综述：吃中药喝高端酒，资金大举卖出新能源汽车股！宁王一度跌超9%,Wind
53,2021-12-24,宁德时代跌超9%，成交金额已超120亿元,Wind
54,2021-12-24,A股午盘综述：宁王跌7%、茅台涨3%，机构重仓股一通混战！五千亿电力龙头创新高,Wind
55,2021-12-24,公募年度业绩临近收官，多只基金“贴身肉搏”,Wind
56,2021-12-23,基金业绩排名战，这位“大神”似乎已锁定冠军,Wind
57,2021-12-23,年内94只基金战绩如何？崔宸龙领先，陈金伟紧跟,Wind
58,2021-12-22,2021汽车关键词（六）：万亿宁王,每日经济新闻
59,2021-12-22,北向资金连续4日净卖出累计出货超百亿，立讯精密遭大幅净卖出6.46亿元,Wind
60,2021-12-22,新纶新材：公司铝塑膜产品客户主要有国轩高科、蜂巢等,Wind
61,2021-12-22,【一语道破】动力电池11月装机量出炉，哪些数据正“悄悄改写”？,财华社
62,2021-12-21,北向资金交投意愿转淡连续3日净卖出，白酒、新能源均遭出货,Wind
63,2021-12-21,北向资金动向盘点：不仅没砸盘，反而逢低净买电子、传媒,Wind
64,2021-12-21,严打“假外资”影响几何？北向资金连续2日净卖出，出逃这些股（名单）,21世纪经济报道
65,2021-12-21,从严监管消“噪音”，凸显“真外资”属性,Wind
66,2021-12-20,北向资金今日净流出9.71亿元 大幅净买入比亚迪、亿纬锂能和立讯精密,钢企网
67,2021-12-20,新能源汽车超预期渗透，市场主线向智能化迁移,Wind
68,2021-12-19,EV观察系列11月国内新能车销量：11月新能车销量环比大增，LFP装车量继续领跑【民生电新】,电新邓永康团队
69,2021-12-18,富时中国指数成分股大调整，外资布局2022年,Wind
70,2021-12-17,富时中国指数成份股大调整，外资布局2022年,21世纪经济报道
71,2021-12-17,亿纬锂能(300014.SZ)高管李沐芬配偶买卖公司股票构成短线交易,智通财经
72,2021-12-17,亿纬锂能：公司高级管理人员配偶短线交易,Wind
73,2021-12-17,亿纬锂能大宗交易成交356.61万元，买卖双方均为机构专用席位,证券时报网
74,2021-12-17,亿纬锂能现1笔大宗交易 共成交356.61万元,新浪
75,2021-12-17,亿纬锂能今日大宗交易成交2.69万股，成交价132.57元溢价1.81%,Wind
76,2021-12-17,净买入超820亿元，北上资金单月流入金额又创新高,Wind
77,2021-12-16,北向资金追平年内最长净买入纪录，山西汾酒净卖出额创历史新高,Wind
78,2021-12-16,A股：下一个宁德时代？三大锂王厮杀激烈，谁能坐上锂电龙头宝座,腾讯网
79,2021-12-15,魅力难挡！这家锂电公司成立不到一个月，便引来一家重量级战投,上证报
80,2021-12-15,A股早报2021年12月15日星期三,Wind
81,2021-12-15,每日理财观察：四季度险资打新热情高涨,Wind
82,2021-12-14,金融街下午茶2021年12月14日星期二,Wind
83,2021-12-14,透视大宗交易：12月14日共成交239笔，亿纬锂能成交16.67亿元,每经网
84,2021-12-14,亿纬锂能现16.67亿元折价大宗交易，卖方为机构,阿尔法工场
85,2021-12-14,"亿纬锂能现6笔大宗交易 共成交166,740.00万元",新浪
86,2021-12-14,亿纬锂能现16.7亿元折价大宗交易,第一财经
87,2021-12-14,亿纬锂能今日出现16.67亿元折价大宗交易，机构卖出,Wind
88,2021-12-14,亿纬动力在荆门裂变式崛起,湖北日报
89,2021-12-14,19股获券商买入评级，中天科技目标涨幅达58.20%,Wind
90,2021-12-13,磷酸铁锂成车企新宠，涨价、扩产潮来临,Wind
91,2021-12-13,11月乘用车动力电池装机量TOP10：中创新航单月突破1GWh，小鹏渗透率快速爬升,Ofweek
92,2021-12-13,白酒带动年关行情 重仓基金“雄起”,金融投资报
93,2021-12-13,茅指数与宁组合同台竞技，两大赛道谁技高一筹？,Wind
94,2021-12-12,清华校企全部股权拟无偿划转，受让方国企四川能投,Wind
95,2021-12-11,最惨腰斩后，“茅指数”王者归来，股王重振雄风！,Wind
96,2021-12-10,亿纬锂能：公司及控股股东拟参与广州发展定增,e公司
97,2021-12-10,亿纬锂能(300014.SZ)拟将亿纬动力股权激励方案变更为一般的增资扩股方案,智通财经
98,2021-12-10,亿纬锂能(300014.SZ)拟参与认购广州发展非公开发行股票,智通财经
99,2021-12-10,亿纬锂能：公司及子公司累计对外担保总额约为207.85亿元 大额借贷担保,每日经济新闻
100,2021-12-10,亿纬锂能：公司及控股股东亿纬控股拟5亿元共同参与认购广州发展定增,财联社
101,2021-12-10,亿纬锂能：公司及控股股东拟5亿元共同参与认购广州发展定增,Wind
102,2021-12-10,国信证券：看好电池涨价盈利边际改善 建议关注宁德时代(300750.SZ)、亿纬锂能(300014.SZ)等,智通财经
103,2021-12-10,“内卷”的动力电池,36氪
104,2021-12-10,2021年11月中国A股电池行业上市企业市值排行榜：宁德时代总市值突破1.5万亿元,智研咨询
105,2021-12-09,亿纬锂能(300014.SZ)及控股股东拟以5亿元参与认购广州发展定增股份,格隆汇
106,2021-12-09,新能源车渗透率超20%！车企：动力电池不够用,时代周报
107,2021-12-09,85只创业板股最新筹码趋向集中,证券时报网
108,2021-12-09,外资爆买A股！一天狂加仓近百亿！抄底宁德时代，重仓茅台、招行,Wind
109,2021-12-09,经济日报：富时罗素指数调整折射中国经济之变,Wind
110,2021-12-09,A股突然启动上涨，茅台收复2000元，人民币连创新高！,Wind
111,2021-12-08,电力设备与新能源行业专题策略报告：电动车蓬勃发展 风光储吹响碳中和冲锋号角,新浪
112,2021-12-08,锂电池原料暴涨，宁德时代、蔚来们如何寻求突破？,钛媒体
113,2021-12-08,北向资金再度加仓近百亿，贵州茅台获大幅净买入超16亿元,Wind
114,2021-12-08,最新股东户数揭秘：这61股股东户数连降三期,证券时报网
115,2021-12-08,亿纬锂能股东套现7亿，还有这些锂电股股东清仓套现,Wind
116,2021-12-08,降准落地，A股仍涨不动？这一顶级赛道却吵翻了,Wind
117,2021-12-07,2500亿锂电巨头因实控人按错键，25亿减持计划被迫终止 拟减持股份,新浪
118,2021-12-07,乌龙？这家锂电巨头实控人“卖出”变“买入”！误操作？还是为终止减持计划？ 控制人变化,国际金融报
119,2021-12-07,亿纬锂能股东套现7亿，还有这些锂电股股东清仓套现 减持股份,第一财经
120,2021-12-07,两市共发生164宗大宗交易 机构抢筹这些个股,第一财经
121,2021-12-07,机械行业月度动态报告：PMI重回荣枯线以上 北交所开市关注中小创投资机会,新浪
122,2021-12-07,赢合科技：公司已开始批量向客户供应满足4680大圆柱电池生产的关键设备,Wind
123,2021-12-07,北向资金今日净买入79.49亿元，继续抄底大金融板块,Wind
124,2021-12-07,亿纬锂能现1笔大宗交易 共成交408.57万元,新浪
125,2021-12-07,亿纬锂能今日大宗交易成交3万股，成交价136.19元溢价0.91%,Wind
126,2021-12-07,电气设备行业周报：光伏硅片下调报价 产业博弈出现拐点,新浪
127,2021-12-07,58股筹码连续3期集中,证券时报网
128,2021-12-07,尴尬！2500亿锂电实控人“闹乌龙”，一天亏16万 控制人变化,中国基金报
129,2021-12-07,两则利空带崩锂电，亿纬锂能又现神操作，是喜是忧？,证券之星
130,2021-12-07,动力电池赛道竞争激烈，亿纬锂能缘何业绩“开挂”？,览富财经
131,2021-12-07,因实控人误操作，亿纬锂能减持计划终止，股价大幅下跌近4%,第一财经
132,2021-12-07,创业板股最新筹码变动：10股股东户数降逾一成,证券时报网
133,2021-12-07,科恒股份：公司锂电设备及正极材料产品均供应亿纬锂能，目前有较多其设备在手订单,Wind
134,2021-12-07,比亚迪(002594)：11月销量超预期 结构优化验证产品力,新浪
135,2021-12-07,中国“动力电池军团”集体崛起,青岛财经日报
136,2021-12-07,10月全球动力电池装机量前十：宁德时代独占鳌头，蜂巢能源和亿纬锂能登榜,Ofweek
137,2021-12-07,北向资金动向盘点：重手净买金融股,Wind
138,2021-12-07,北向资金连续4日净买入，大幅加仓银行板块近19亿元，增持这些银行股,21世纪经济报道
139,2021-12-07,2500亿锂电龙头实控人误陷短线操作，25亿减持被迫终止,Wind
140,2021-12-07,"尴尬！2500亿锂电龙头实控人误陷""短线操作""，25亿减持被迫终止，是喜是忧？ 减持股份",券商中国
141,2021-12-06,12月7日上市公司重要公告集锦：工商银行获准发行不超1900亿元二级资本债券,证券日报之声
142,2021-12-06,【晚间公告抢先看】牧原股份11月份生猪销售收入67.67亿元、亿纬锂能实控人减持时误买入2万股 终止减持计划,金融界
143,2021-12-06,尴尬！亿纬锂能实控人减持时误买入构成短线交易 减持计划终止,北京商报
144,2021-12-06,亿纬锂能最新公告：实控人减持时误买入2万股 终止减持计划,证券之星
145,2021-12-06,亿纬锂能(300014.SZ)实控人骆锦红误操作导致短线交易 减持计划提前终止 拟减持股份,智通财经
146,2021-12-06,亿纬锂能：实际控制人骆锦红因误操作买入2万股,每日经济新闻
147,2021-12-06,亿纬锂能：实际控制人今日减持0.269%公司股份，误买入2万股并终止减持计划,Wind
148,2021-12-06,北向资金连续4日净买入累计加仓超150亿，大幅抢筹券商、银行股,Wind
149,2021-12-06,进攻势头遭遇“黑周一”，跨年行情青睐低估值？,Wind
150,2021-12-06,电气设备行业周报：11月新势力销量大超预期 欧洲销量环比回暖,新浪
151,2021-12-06,电力设备新能源行业周报：“蔚小理哪”11月销量破万 第二批风光大基地启动,新浪
152,2021-12-06,A股资金流向：新能源再遭集中抛售，大金融成“避风港”,Wind
153,2021-12-06,10月全球动力电池装机量TOP 10：宁德独占鳌头，比亚迪超松下，中韩差距拉大,盖世汽车
154,2021-12-06,2021年基金，买了个“寂寞”,Wind
155,2021-12-06,亿纬锂能：公司在大圆柱电池领域已拥有成熟的相关技术，公司已规划在荆门高新区投资建设20GWh乘用车用大圆柱电池生产线及辅助设施项目,每日经济新闻
156,2021-12-06,亿纬锂能：公司在大圆柱电池领域已拥有成熟的相关技术,Wind
157,2021-12-06,锂电池概念持续火爆，机构扎堆调研延安必康,Wind
158,2021-12-05,硬核选基丨2021年买基金买了个“寂寞”？2022年追高新能源还是抄底大消费基金？,21世纪经济报道
159,2021-12-05,储能专题策划二|储能规模化建设覆盖多个场景 电芯和变流器弹性最大,财联社
160,2021-12-05,电气设备行业周报：硅片加速尺寸变革推动降本 11月国内外电车销量持续向上,新浪
161,2021-12-05,下周操盘攻略：均衡配置成长与价值,Wind
162,2021-12-05,10月全球动力电池装机Top10：中国占据榜单6席 第二梯队竞争激烈,财联社
163,2021-12-04,A股市场领涨全球，监管同意开展账户管理功能优化试点工作,Wind
164,2021-12-03,亿纬锂能(300014.SZ)向1634名激励对象授予1757.58万股限制性股票,智通财经
165,2021-12-03,新能源汽车行业2022年度策略：景气持续向上 关注格局分化,新浪
166,2021-12-03,第一名翻倍！基金经理排名战：崔宸龙领跑，张坤、葛兰能否翻盘吗？2022年要买什么？一起来围观,21世纪经济报道
167,2021-12-03,A股市场领涨全球，北上资金已开始“按捺不住”？,Wind
168,2021-12-03,10月全球动力电池榜：国轩高科首超中创新航 亿纬锂能首上榜,第一电动网
169,2021-12-02,北向资金今日净买入30.21亿元，宁德时代连续6日净买入累计加仓超24亿,Wind
170,2021-12-02,4700亿大白马被富时中国A50指数剔除，发生了什么？ 剔除指数,中证报
171,2021-12-02,11月汽车公司市值榜 | 沃尔沃、福特增幅超10%，大众下挫12%，半数中国车企市值下滑，动力电池成大赢家,每日经济新闻
172,2021-12-02,北向资金动向盘点：批量净卖新能源个股,Wind
173,2021-12-02,北向资金加仓A股30亿元，增持医疗服务业逾8亿元，抢筹这些龙头股（名单）,21世纪经济报道
174,2021-12-02,港股盘前必读：腾讯控股拟向不少于25700位奖励人士授予441万股奖励,Wind
175,2021-12-02,造车新势力交付量，新能源汽车YYDS？,Wind
176,2021-12-02,"重大调整！富时罗素大动作，4700亿白马被""意外剔除""，咋回事？3股新晋""A50""，外资270亿狂买这1股",券商中国
177,2021-12-01,比汽车电池需求量多100倍？这个产业不仅吸引了“宁王”,Wind
178,2021-12-01,富时中国A50指数新纳入亿纬锂能、海尔智家、片仔癀,上证报
179,2021-12-01,富时罗素调整富时中国A50指数成份股，纳入亿纬锂能、海尔智家、片仔癀,36氪
180,2021-12-01,富时罗素：亿纬锂能等三股获纳入富时中国A50指数,Wind
181,2021-12-01,北向资金12月首个交易日加仓A股30亿，紫光国微净买入超6亿元,Wind
182,2021-12-01,跌跌不休的港股，有个版块却创纪录新高,Wind
183,2021-12-01,华泰研究所12月金股推荐,新浪
184,2021-12-01,亿纬锂能(300014.SZ)11月份未回购公司股份,格隆汇
185,2021-12-01,亿纬锂能(300014.SZ)耗资1亿元累计回购137.24万股,智通财经
186,2021-12-01,得动力电池者得天下！宁德时代、亿纬锂能、比亚迪等企业掀起产能扩建“军备赛”,Ofweek
187,2021-12-01,亿纬锂能50GWh磷酸铁锂电池项目正式落地,长江有色
188,2021-12-01,5000 万！亿纬锂能跨界成立燃料电池子公司,中国能源网china5e
189,2021-12-01,亿纬锂能成立燃料电池子公司,我的钢铁
190,2021-12-01,北向资金甩卖白酒股逾24亿，增持医疗服务，这些个股受青睐（名单）,21世纪经济报道
191,2021-12-01,中科电气（300035）：兼具技术底蕴与成本优势，需求爆发驱动成长,中信证券研究
192,2021-11-30,南财脱水研报丨新能源汽车今年涨超114%，行情明年会否延续上行,21经济网
193,2021-11-30,“茅泸”重回视野！券商12月“金股”来了,Wind
194,2021-11-30,亿纬锂能进军燃料电池领域,Ofweek
195,2021-11-30,外资周报第105期：剧震之下 继续入场,新浪
196,2021-11-30,国泰君安晨报,新浪
197,2021-11-30,全国上下一盘棋 新能源政策推动储能板块持续上涨,和讯
198,2021-11-30,4680作先锋，在特斯拉的引领下，大圆柱电池将冲击电芯格局,Ofweek
199,2021-11-30,融资客青睐10股，兰生股份买入占比高达52.10%,Wind
200,2021-11-30,A股融资融券日报：两融余额增加18.95亿元（11月29日）,Wind
201,2021-11-30,“奥密克戎”冲击有限，中国资产吸引力强,Wind
202,2021-11-30,需求强劲，锂盐价格或持续上行,Wind
203,2021-11-29,美元指数继续攀升 中美利差收窄-市场资金面周观察*徐驰,新浪
204,2021-11-29,【一语道破】股价创历史新高！“被遗忘的锂电概念股”鹏辉能源“觉醒”了？,财华社
205,2021-11-29,浙商证券汽车行业周报：特斯拉扩产 产业链受益,新浪
206,2021-11-29,公募基金年内新发行近2.7万亿，新能源、环保主题受热捧！,Wind
207,2021-11-29,最新股东户数揭秘：这57股股东户数连降三期,证券时报网
208,2021-11-29,电力设备及新能源行业周报：政策大方向未改 短线利空扰动,华福证券有限责任公司
209,2021-11-29,汽车股涨跌榜：恒大汽车纾困领涨，整体市值增加1700亿,搜狐
210,2021-11-29,亿纬锂能燃料电池子公司正式成立，新能源产业进一步扩张,Ofweek
211,2021-11-29,自燃、爆炸？ 800亿锂电大牛股遭质疑，看最新回应,Wind
212,2021-11-29,科瑞技术(002957)：拟收购鼎力智能 强化锂电设备业务布局,新浪
213,2021-11-29,创业板股最新股东户数降幅排行榜,证券时报网
214,2021-11-29,机械行业周报：动力电池产能建设加速 锂电设备充分受益,新浪
215,2021-11-29,A股融资融券日报：两融余额减少44.66亿元（11月26日）,Wind
216,2021-11-29,隔膜龙头企业再掀扩产潮,中国能源报
217,2021-11-29,震裕科技：于11月18日调研我司,证券之星
218,2021-11-28,储能概念板块迎来6周连涨，亿纬锂能周内上涨15.92%,华夏时报
219,2021-11-28,一线电池商也要提价？二、三线已因提价“刺激”股价加速上涨！电池厂商“最困难”时期即将过去,红周刊
220,2021-11-27,112股本周股价创历史新高,证券时报网
221,2021-11-26,智通A股机构动向参考(11.26) | 收缩为上,智通财经
222,2021-11-26,亿纬锂能(300014.SZ)董高刘建华拟减持不超200万股 拟减持股份,智通财经
223,2021-11-26,亿纬锂能：公司董事及高级管理人员刘建华拟减持不超过200万股 拟减持股份,Wind
224,2021-11-26,亿纬锂能：董事刘建华拟减持不超200万股 拟减持股份,财联社
225,2021-11-26,深股通连续5日净卖出亿纬锂能 累计净卖出12.56亿元,证券时报网
226,2021-11-26,北向资金净卖出近45亿结束连续5日净买入，招商银行净卖出超6亿元,Wind
227,2021-11-26,53股股东户数连续下降 （附股）,证券时报网
228,2021-11-26,北上资金白酒新能源全都要，“微信、支付宝收款码禁用”被误读？,Wind
229,2021-11-26,硬核选基丨券商喊出“锂盐迎来第三轮涨价”，锂价又双叒叕创新高，同类排行第一的前海开源崔宸龙有话说,21世纪经济报道
230,2021-11-26,电力设备与新能源行业年度策略：高景气延续 寻找阿尔法机会,新浪
231,2021-11-26,科华数据与亿纬锂能深化战略合作，推动能源绿色低碳发展,乐居财经
232,2021-11-26,科华数据：与亿纬锂能深化战略合作,e公司
233,2021-11-26,创业板股最新筹码变动：8股股东户数降逾一成,证券时报网
234,2021-11-26,扩产狂奔！20家锂电上市企业定增超1300亿,长江有色
235,2021-11-26,A股融资融券日报：两融余额增加16.32亿元（11月25日）,Wind
236,2021-11-26,受益于下游景气高涨 一线锂电池厂商酝酿上调报价,Wind
237,2021-11-26,北向资金连续5日净买入，增持电池板块近10亿元，狂买这些龙头股！（名单）,21世纪经济报道
238,2021-11-26,北向资金动向盘点：打一枪换一个地方,Wind
239,2021-11-26,王者归来？谢治宇、刘格菘等多位“顶流”年末大爆发,Wind
240,2021-11-26,乘“双碳”东风 携手共赢“绿色”未来——科华数据与亿纬锂能深化战略合作,索比光伏网
241,2021-11-26,4680，谁的砒霜，谁的蜜糖？,锦缎
242,2021-11-26,陆家嘴财经早餐2021年11月26日星期五,Wind
243,2021-11-25,锂电材料企业瑞泰新材过会创业板，募投项目逆势扩张,Wind
244,2021-11-25,新能源汽车行业：小鹏首登新势力销冠 铁锂装机连续四月超三元,广发证券
245,2021-11-25,陆股通净买入11.72亿元，连续5日净买入,证券时报网
246,2021-11-25,亿纬锂能遭深股通连续4日净卖出 合计净卖出10.50亿元,证券时报网
247,2021-11-25,数据复盘｜主力资金撤离电子、电气设备等行业 北向资金加仓赣锋锂业、通威股份等,证券时报网
248,2021-11-25,北向资金连续5日净买入成交额创5个月新低，再度净买入贵州茅台超3亿元,Wind
249,2021-11-25,筹码连续集中股名单（附股）,证券时报网
250,2021-11-25,A股资金流向：题材股退潮，资金再度开启高切低模式,Wind
251,2021-11-25,2021年10月国内动力电池产量点评：产装继续维持高景气 三元装机有所回暖,新浪
252,2021-11-25,电气设备行业2021年10月国内新能源车销量点评：产销持续创记录 全年销量340万辆可期,新浪
253,2021-11-25,10月装机电量点评：装机量环比下降 三元份额有所回升,新浪
