1232,2021-08-03,8月3日四大证券报头版头条内容精华摘要,新浪
1233,2021-08-03,亿纬锂能携手恩捷股份 52亿投建锂离子电池隔离膜产线,上证报
1234,2021-08-03,公募齐唱咏“碳”调，15只“碳中和”基金密集登场,Wind
1235,2021-08-03,14万股民沸腾了！两大2000亿巨头联手放大招，一出手就是52亿！,Wind
1236,2021-08-03,14万股民沸腾了！两大2000亿巨头联手放大招，一出手就是52亿！网友嗨了：下一个宁德时代？,中国基金报
1237,2021-08-03,强强联手 恩捷股份与亿纬锂能合资建设16亿平米锂电池隔膜项目,上证报
1238,2021-08-02,今年来涨幅超过85%，排名靠前的基金都买了啥？,炒基蛋
1239,2021-08-02,电新行业周报：峰谷价差拉大利好光伏及储能推广 风电需求有望超预期,新浪
1240,2021-08-02,恩捷股份：拟投建总额52亿元锂电池隔离膜项目,中证网
1241,2021-08-02,晚间重要公告2021年8月2日星期一,Wind
1242,2021-08-02,锂电池核心材料扩产热 3家上市公司宣布投建计划,e公司
1243,2021-08-02,恩捷股份(002812.SZ)拟与亿纬锂能设立合资公司建设湿法锂电池隔离膜项目,智通财经
1244,2021-08-02,电气设备行业周报：屋顶分布式整县开发快速推进,新浪
1245,2021-08-02,亿纬锂能(300014.SZ)累计回购137.24万股 耗资1亿元,智通财经
1246,2021-08-02,亿纬锂能：拟与恩捷股份合作开展锂离子电池隔离膜和涂布膜的制造,Wind
1247,2021-08-02,亿纬锂能：拟与恩捷股份合作开展锂离子电池隔离膜和涂布膜的制造,e公司
1248,2021-08-02,新能源行业产业风向标：造车新势力迅速崛起 动力电池供应格局偏紧,新浪
1249,2021-08-02,电力设备新能源行业周报：《分时电价》机制助力储能大发展宁德时代钠离子电池横空出世,新浪
1250,2021-08-02,基础材料、机械、电力电气设备行业2Q21持仓及陆港通分析：公募持仓大幅提升 超配新能源,新浪
1251,2021-08-02,优质产能不足 “电池荒”折射新能源汽车行业核心焦虑,中国汽车报
1252,2021-08-02,储能行业专题报告(二)：成本下降与政策推动储能步入实质性成长期,新浪
1253,2021-08-02,电气设备新能源行业周报：分时电价政策推动储能发展 中央定调支持电动车产业,新浪
1254,2021-08-02,储能行业深度报告：碳中和集结号吹响 储能赛道一触即发,新浪
1255,2021-08-02,电气设备行业周报：钠离子电池产业化发展在即 峰谷电价政策或刺激储能市场提速,新浪
1256,2021-07-30,国金证券公用事业“电价分时”政策点评：分时电价差扩大 推动新型电力系统调峰建设,国金证券股份有限公司
1257,2021-07-30,亿纬锂能：子公司亿纬亚洲同意为其子公司EBIL提供连带责任担保 大额借贷担保,每日经济新闻
1258,2021-07-30,电力设备及新能源行业储能与新能源发展跟踪：分时电价机制点评-分时电价政策出台 “软”因素支持储能发展,新浪
1259,2021-07-30,电力设备新能源2021年8月投资策略：政策叠加技术双利好 储能开辟广阔蓝海,新浪
1260,2021-07-30,电新行业动态点评：我国进一步完善分时电价政策 新型电力系统储能大有可为,新浪
1261,2021-07-30,亿纬锂能(300014)公司深度报告：二十载新起点 锂电池航母再启航,新浪
1262,2021-07-30,旭升股份(603305)中报点评：多客户同发力 压、锻、挤三大工艺齐配备,新浪
1263,2021-07-30,重磅消息引爆储能概念，这些标的请收好！,证券之星
1264,2021-07-30,信达证券：给予亿纬锂能“买进”的初始评级,36氪
1265,2021-07-29,龙蟠科技(603906)深度研究报告：车用尿素高增长 切入铁锂或再造一个龙蟠,新浪
1266,2021-07-29,市场思考随笔之六十五：“宁”与“茅”分化的背后,新浪
1267,2021-07-29,储能板块爆发，深股通大幅买入阳光电源，机构看好四条投资主线,第一财经
1268,2021-07-29,从锂电材料长单看电池企业暗战,电池中国网
1269,2021-07-29,德方纳米：公司上半年磷酸铁锂产能8万吨/年,Wind
1270,2021-07-29,张坤、谢治宇、刘格菘们已行动，新能源基金开始调仓,Wind
1271,2021-07-29,芯片股突然飙涨：20%涨停潮！腾讯大涨4000亿,Wind
1272,2021-07-29,亿纬锂能：公司目前用于智能表计的锂原电池业务订单在正常交付中，全年预计能够达到稳定生产和出货,每日经济新闻
1273,2021-07-29,亿纬锂能：公司生产设备按年限平均法进行折旧，折旧年限为10年,每日经济新闻
1274,2021-07-29,亿纬锂能：公司目前各项业务都在正常生产和出货，产线运转良好,每日经济新闻
1275,2021-07-29,亿纬锂能：公司目前主要在扩产的有三元圆柱电池、磷酸铁锂电池和三元方形电池，在今年和明年都会有新产能陆续投产,每日经济新闻
1276,2021-07-29,亿纬锂能：公司和金昆仑合作的碳酸锂和氢氧化锂产能会按计划陆续投产,每日经济新闻
1277,2021-07-29,亿纬锂能：公司目前的三元软包电池还是以出口为主，国内的乘用车客户的开拓和出货正在按计划进行,每日经济新闻
1278,2021-07-29,亿纬锂能：根据与StoreDot Ltd. 签订《电动汽车战略合作框架协议》的内容，目前处于合作项目的联合研发和样品测试阶段,每日经济新闻
1279,2021-07-29,电动汽车召回事件引“热议” 软包电池遭遇“成长的烦恼” 产品问题,中国汽车报
1280,2021-07-29,700亿身价的锂电富豪，决定豪赌一把,21商评网
1281,2021-07-28,群雄逐鹿下一个蓝海？欣旺达子公司与吉利合资生产HEV动力电池,每日经济新闻
1282,2021-07-28,动力电池产能荒 锂电行业真的是个好行业么？,GPLP犀牛财经
1283,2021-07-28,欣旺达：由小锂电到大锂电，转型承压，仍有看点？,财华社
1284,2021-07-28,【最全】2021年广东及浙江地区锂电池行业上市公司全方位对比(附业务布局、业绩对比、业务规划等),前瞻研究院
1285,2021-07-28,电气设备行业简评报告：大型化助推风电格局重塑 硅料价格见顶带动需求提振,新浪
1286,2021-07-28,汽车行业周报：新能源车引领轻量化赛道,新浪
1287,2021-07-28,每日理财观察：国务院要求实施好三孩生育政策,Wind
1288,2021-07-28,最牛板块跌停潮，主力逆市抢筹股曝光,Wind
1289,2021-07-28,强势股补跌沪指失守3400点，机构称下跌带来优质股布局机会,Wind
1290,2021-07-27,两年多首次，上证50跌入技术性熊市，谁在砸盘？最牛板块跌停潮，主力逆市抢筹股曝光,证券时报网
1291,2021-07-27,A股、港股双双跳水，发生了什么？,Wind
1292,2021-07-27,北向资金今日净卖出41.72亿元，贵州茅台遭净卖出逾10亿元,Wind
1293,2021-07-27,什么情况？A股两天蒸发4万亿，港股狂泻1100点,Wind
1294,2021-07-27,A股资金流向（7月27日）：新能源产业链持续遭抛售，芯片龙头一枝独秀,Wind
1295,2021-07-27,A股收盘综述：指数尾盘跳水沪指失年线，新能源产业链大幅下杀,Wind
1296,2021-07-27,快讯：锂电股尾盘上演跌停潮 亿纬锂能等多股跌停,新浪
1297,2021-07-27,锂电池板块走弱，137只个股下跌，亿纬锂能下跌12.12%,每日经济新闻
1298,2021-07-27,【行情】锂电股尾盘上演跌停潮，亿纬锂能、久吾高科、赣锋锂业、西藏珠峰、西藏城投、中矿资源、江苏国泰等十余股跌停或跌超10%,金十数据
1299,2021-07-27,锂电池板块午后跌幅扩大，亿纬锂能跌超8%,Wind
1300,2021-07-27,电气设备行业周报：光伏硅料价格继续松动 奔驰全面转向BEV,新浪
1301,2021-07-27,电气设备行业跟踪点评：《新型储能发展的指导意见》落地 储能规模化发展腾飞在即,新浪
1302,2021-07-27,2021年电新行业周报7月第3期：奔驰电动化战略升级 2025年占新车销量50%,新浪
1303,2021-07-27,亿纬锂能7月26日现2笔大宗交易,证券时报网
1304,2021-07-26,A股共发生107宗大宗交易成交32.36亿元（7月26日）,Wind
1305,2021-07-26,机械周报：海外+国内扩产加速 锂电设备景气度持续性高,新浪
1306,2021-07-26,亿纬锂能今日大宗交易成交62.40万股，成交价120.09元溢价0.0%,Wind
1307,2021-07-26,机械设备行业周报(第二十九周),新浪
1308,2021-07-26,解盘：指标股低迷，资金流出，特高压、军工、盐湖提锂略涨,Wind
1309,2021-07-26,明星基金经理谁踩对了“宁组合”风口？赵诣、冯明远、葛兰、周应波、刘格菘等上榜,21世纪经济报道
1310,2021-07-26,电气设备新能源行业周报：海外车企电动化战略加码 储能指导意见落地产业化提速,新浪
1311,2021-07-26,未来三年供不应求，稀土行业景气度有望持续提升,东北证券
1312,2021-07-25,机械设备行业跟踪周报：制造业持续复苏带动机器人行业回暖 建议关注景气度高涨的光伏锂电设备,新浪
1313,2021-07-25,电气设备行业周报：新型储能政策正式落地 天赐和LG新能源签订长单,新浪
1314,2021-07-25,电气设备行业：《关于加快推动新型储能发展的指导意见》(征求意见稿)出台 新型储能春天到来,新浪
1315,2021-07-25,新洋丰(000902)拟收购雷波矿业公告点评：拟现金收购大股东磷矿资源 行业龙头完善磷化工产业链,光大证券
1316,2021-07-24,硬科技投向标|发改委、能源局：推动新型储能商业化规模应用亿纬锂能拟投建多个锂电池生产线,财联社
1317,2021-07-24,总投资5332亿 H1锂电产业投扩产追踪,盖世汽车
1318,2021-07-23,德方纳米(300769.SZ)收到《经营者集中反垄断审查不实施进一步审查决定书》,智通财经
1319,2021-07-23,A股震荡下行超46亿外资暂时撤离，新能源产业链股遭大幅抛售,Wind
1320,2021-07-23,电子烟监管趋于明朗 设备制造商静待花开,新浪
1321,2021-07-23,10万股民嗨了！锂电大白马亿纬锂能放大招，再砸24.5亿扩产,第一财经
1322,2021-07-23,电气设备行业跟踪点评：戴姆勒强化电气化战略 2030年有望实现纯电完全渗透,新浪
1323,2021-07-23,21Q2基金持仓结构分析：新能源赛道持仓比例超过20%,新浪
1324,2021-07-23,亿纬锂能：低配版的宁德时代？,新浪
1325,2021-07-23,狂砸25亿投建多个锂电池生产线 亿纬锂能早盘高开逾3%,新浪
1326,2021-07-23,砸近25亿，2000亿锂电大白马放大招,Wind
1327,2021-07-23,A股早报2021年7月23日星期五,Wind
1328,2021-07-23,基金经理抱得更紧了！大幅提升创业板、科创板仓位,Wind
1329,2021-07-23,亿纬锂能拟投资24.5亿元投建多个锂电项目，顶流基金经理重仓,中国基金报
1330,2021-07-23,19起兼并购洞悉动力电池供应链“新变”,高工锂电
1331,2021-07-23,砸近25亿，2000亿锂电大白马放大招！顶流基金经理狂重仓，10万股民嗨了，股价意念涨停！,中国基金报
1332,2021-07-23,18家千亿顶流基金公司调仓释放重要信息,Wind
1333,2021-07-23,小K播早报！中共中央、国务院：规划引导中部地区产业集群发展 科创板新一代信息技术指数将发布,财联社
1334,2021-07-22,投资24.5亿元 亿纬锂能投建锂电池项目,汽车产经网
1335,2021-07-22,公告精选丨深南股份实控人被刑拘，亿纬锂能拟投建多个锂电池生产线,21世纪经济报道
1336,2021-07-22,晚间重要公告2021年7月22日星期四,Wind
1337,2021-07-22,手握2.6万亿巨资！基金经理规模榜单来了,Wind
1338,2021-07-22,亿纬锂能(300014.SZ)：拟开展额度不超25亿元的外汇套期保值业务,格隆汇
1339,2021-07-22,【行情】主力怒杀回马枪，有业绩啥都好说！,搜狐
1340,2021-07-22,亿纬锂能(300014.SZ)：亿纬动力拟与荆门高新区管委会就锂电池项目签订合同书,智通财经
1341,2021-07-22,亿纬锂能：子公司拟与荆门高新区管委会签订《合同书》,每日经济新闻
1342,2021-07-22,亿纬锂能：拟24.5亿元投建多个锂电池生产线,e公司
1343,2021-07-22,亿纬锂能：子公司拟投建3GWh圆柱磷酸铁锂电池生产线等项目,财联社
1344,2021-07-22,亿纬锂能(300014.SZ)：拟投资24.5亿元建3GWh圆柱磷酸铁锂电池生产线等若干项目,格隆汇
1345,2021-07-22,亿纬锂能：公司及子公司累计对外担保总额为人民币约111.91亿元 大额借贷担保,每日经济新闻
1346,2021-07-22,主力怒杀回马枪，有业绩啥都好说！丨复盘论,第一财经
1347,2021-07-22,北向资金连续4日“买买买”累计加仓超160亿，歌尔股份净买入额创逾7个月新高,Wind
1348,2021-07-22,基金二季报重仓股调查：仓位稳中有升，增配三大行业,Wind
1349,2021-07-22,基金抱团50强出炉！顶流扎堆增持股曝光,Wind
1350,2021-07-22,重磅，基金抱团50强出炉！宁德时代成第二大重仓，顶流扎堆增持股曝光，持续高增长股仅10只,证券时报网
1351,2021-07-22,新能源板块行业信息点评：6月三元材料、三元前驱体出口持续高增,新浪
1352,2021-07-22,新能源与电力设备行业周报：电动车中游继续紧盯6中军与5缺口 关注上游,新浪
1353,2021-07-22,周报（2021.7.21）继续紧盯6中军5缺口，关注上游,电新产业研究
1354,2021-07-22,锂电池巨头创新高，滞涨绩优概念股请收藏,Wind
1355,2021-07-22,宁德时代成公募基金第二大重仓股，聪明钱却大幅减仓，增持医药酿酒等行业（名单）,21世纪经济报道
1356,2021-07-22,基金顶流压轴出场！仓位新低、重仓换血，未来咋走？,Wind
1357,2021-07-22,港股盘前必读：消息称爱美客计划于本月或下月向港交所递交上市申请,Wind
1358,2021-07-22,曾被苹果抛弃，后来傍上小米，这家公司如今市值550亿,网易
1359,2021-07-22,亿纬锂能-深度（三）：锂原电池开疆拓土，于物联网时代彰显价值,新浪
1360,2021-07-22,基金重仓股变化折射时代变迁，宁德时代晋升为公募基金第二大重仓股,Wind
1361,2021-07-22,又一批基金经理的调仓动作来了 朱少醒、刘彦春、谢治宇加减了这些股,每日经济新闻
1362,2021-07-21,又一批明星基金经理的调仓动作来了！朱少醒、刘彦春、谢治宇二季度加减了这些个股,每日经济新闻
1363,2021-07-21,富国朱少醒：看好半导体锂电池，在优质股票里寻找价值,21世纪经济报道
1364,2021-07-21,“手机电池一哥”移情新能源汽车,ZAKER
1365,2021-07-21,TOP30基金挖掘出天赐、天奈、中伟股份等仨月翻倍个股 周蔚文董承非袁芳均减仓,新浪
1366,2021-07-21,电气设备行业简评报告：六氟再度成为产能瓶颈 光伏关注户用发展浪潮,新浪
1367,2021-07-21,刘彦春、葛兰、蔡嵩松、曲扬……又一批流量型明星基金经理二季报出炉，持仓到规模全面看,财联社
1368,2021-07-21,北向资金今日净买入31.17亿元，东方财富获净买入逾11亿元,Wind
1369,2021-07-21,电气设备行业深度报告：新能源车大势所趋产能为王 碳中和下风光发展迎来正周期,新浪
1370,2021-07-21,重仓股大“换血”！顶流基金经理最新布局思路曝光,Wind
1371,2021-07-21,提升份额、扩充产能、谋求上市，动力电池第二梯队演练“攻守道”,中国汽车报
1372,2021-07-21,上半年最赚钱基金中报大换仓，哪些板块最受宠？,Wind
1373,2021-07-21,明星基金最新抢买股票名单来了,Wind
1374,2021-07-20,凑齐光伏、动力电池、模拟芯片三大龙头，延续一季度逻辑，刘格菘二季度调仓大曝光,经济观察网
1375,2021-07-20,朱少醒二季报：亿纬锂能、杰瑞股份、青岛啤酒再进十大重仓股,澎湃新闻
1376,2021-07-20,电力设备新能源行业2021年中报业绩前瞻：“双碳”驱动电动化加速 新能源发电需求持续向好,新浪
1377,2021-07-20,锂电设备领军者，乘新能源之风扶摇直上—海目星（688559）深度报告,机械盛宴
1378,2021-07-20,北上资金超700亿增仓新能源，宁德、隆基等还要涨？（附重仓股）,红周刊
1379,2021-07-20,动力电池增资扩产潮 警惕动力电池新一轮大干快上,中国汽车报
1380,2021-07-20,高端制造行业周报：绍兴中芯进入IPO辅导期 二期扩产前道制程设备国产化率有望进一步提高;全球产能周期共振 中国锂电设备龙头将迎来新一轮成长期,新浪
1381,2021-07-20,电气设备行业：大众发布2030战略 光伏多环节价格下行,新浪
1382,2021-07-20,刘格菘仓位仍超90%、萧楠大幅增持银行股,Wind
1383,2021-07-19,中银基金王帅最新持仓，重仓亿纬锂能（中银中国精选混合型开放式基金）,证券之星
1384,2021-07-19,铁锂回归|200亿市值！深绑宁德时代，德方纳米渐成铁锂正极“隐形冠军”？,金融界
1385,2021-07-19,顶流基金经理最新重仓股大曝光，狂买这些股！,Wind
1386,2021-07-19,刘格菘广发成长小盘二季报披露：增持隆基股份，减持亿纬锂能、京东方A 减持股份,证券之星
1387,2021-07-19,新能源赛道熄火，已披露的基金二季报透露了什么？,Wind
1388,2021-07-19,北向资金今日净买入近44亿元，持续加仓白酒、医药股,Wind
1389,2021-07-19,机械行业2021年中报业绩前瞻：业绩大幅改善 建议布局四大主线,新浪
1390,2021-07-19,深度*行业*机械设备行业周报机械设备行业周报：重视半导体量测设备赛道：上海精测交付首台OCD、REVIEW SEM设备,新浪
1391,2021-07-19,电气设备行业研究周报：新能源消纳改善已在进行中,新浪
1392,2021-07-19,政策有望加码 大型储能产业项目推进速度逐渐加快,上证报
1393,2021-07-19,大型项目接连启动政策有望加码 储能迎爆发式增长,上证报
1394,2021-07-19,储能行业进入发展快车道 大型项目接连开工,上证报
1395,2021-07-19,【银河电新周然】行业周报丨硅料价格出现松动，无钴电池正式装车,中国银河证券研究
1396,2021-07-19,大型项目接连开工，储能行业进入发展快车道,Wind
1397,2021-07-18,新能源板块罕见急跌预示调整开始？北向资金已高位离场,第一财经
1398,2021-07-18,“电池荒”下，亿纬锂能把采矿业务伸向了青海大柴旦盐湖,华夏时报
1399,2021-07-18,机械设备行业研究周报：锂电设备转入卖方市场 250CC+摩托车6月销量同比+71%,新浪
1400,2021-07-18,策略研究：正视扰动 迎接厚积薄发,新浪
1401,2021-07-18,机械设备行业跟踪周报：锂电光伏设备持续高景气 建议关注中报业绩亮眼的国产刀具龙头,新浪
1402,2021-07-18,“史上最内卷”的万亿赛道上，红杉、刘晓丹和小米押注的项目半年翻3倍,新浪
1403,2021-07-18,国君策略：正视扰动，迎接厚积薄发,Wind
1404,2021-07-17,广东区域股市周报：亿纬锂能市值增长383.92亿 海目星涨50.61%涨幅第一,每日经济新闻
1405,2021-07-17,新能源车市“期中考”成绩出炉：销量增长近两倍，比亚迪们站上市值高位，下半场要看自主品牌？,每经头条
1406,2021-07-17,北上资金调仓换股，抄底“最惨抱团股”,Wind
1407,2021-07-16,电气设备行业重大事项点评：大众与国轩合作落地 双方将合作开发铁锂标准化电芯,新浪
1408,2021-07-16,2021年电新行业中报前瞻：行业景气持续高位 中报业绩持续兑现,新浪
1409,2021-07-16,“电池荒”下，动力电池二梯队能抢到宁德时代的蛋糕吗？,新浪
1410,2021-07-16,又有基金遭爆炒：暴涨118%！基金公司紧急出手，跌停又跌停…,Wind
1411,2021-07-16,券商首次关注4股并给予买入评级（7月16日）,Wind
1412,2021-07-16,开源晨会0716丨6月经济释放的“信号”；通胀预期回升，市场定价逻辑将出现重要转换,开源证券研究所
1413,2021-07-15,2021年6月国内新能源车销量点评：终端销量稳步上升 新势力表现出色,新浪
1414,2021-07-15,锂电行业深度系列五-电动工具锂电池：国产圆柱小动力 千亿锂芯大格局,新浪
1415,2021-07-15,开源证券给予亿纬锂能买入评级：动力电池全面突破，三大业务齐头并进,每日经济新闻
1416,2021-07-15,亿纬锂能(300014.SZ)：建红土镍矿湿法冶炼项目的印尼合资公司完成注册登记,格隆汇
1417,2021-07-15,亿纬锂能(300014)：布局上游核心资源 竞争优势持续塑造,新浪
1418,2021-07-15,新能源板块行业信息点评：光伏多环节降价 动力电池装机同比高增,新浪
1419,2021-07-15,亿纬锂能方形三元电池“向上”,高工锂电
1420,2021-07-15,什么信号？基金优等生纷纷限购，一赛道产品大爆发,Wind
1421,2021-07-15,【行情】盐湖提锂板块拉升走高，天齐锂业涨超6%，三达膜、赣锋锂业、亿纬锂能跟涨,金十数据
1422,2021-07-15,新能源车深度报告：电动化加速 拥抱大时代,新浪
1423,2021-07-15,锂电上市公司千亿市值“俱乐部”,高工锂电
1424,2021-07-15,电气设备行业跟踪报告：环比微降 景气不减,新浪
1425,2021-07-15,2021年6月国内动力电池产量点评：环比再增 景气升温,新浪
1426,2021-07-15,基金经理继续看好新能源板块,Wind
1427,2021-07-14,宁德时代：信仰筑起“刚性泡沫”？,腾讯网
1428,2021-07-14,亿纬锂能(300014)重大事项点评：布局上游锂资源 一体化战略保障发展,新浪
1429,2021-07-14,亿纬锂能收到供应商选定通知 采用方形三元电池,资本邦
1430,2021-07-14,容百科技(688005)：护城河放大加深 剑指全球高镍龙头,新浪
1431,2021-07-14,创业板指再度转涨，部分锂电产业链龙头转暖,Wind
1432,2021-07-14,周期组联合会议：周期复兴：电话会议纪要,新浪
1433,2021-07-14,新能源概念股集体爆发，喊岀“新能源泡沫论”的杨东最近在干啥？,Wind
1434,2021-07-14,掘金新能源之德方纳米,新浪
1435,2021-07-14,后疫情时代，关注科技成长板块投资机会,国泰君安
1436,2021-07-14,创业板指冲击新高，两市成交额连续9天超万亿,Wind
1437,2021-07-13,公告精选丨亿纬锂能成为东风柳汽供应商，顺丰控股上半年业绩预减约八成,21世纪经济报道
1438,2021-07-13,锂电池制造商亿纬锂能将在青海建设锂工厂,TechWeb
1439,2021-07-13,新能源车行业动态：新能源车终端需求持续旺盛 中游排产环比提升,新浪
1440,2021-07-13,亿纬锂能(300014.SZ)被选定为东风柳汽M6PHEV项目电池包供应商,智通财经
1441,2021-07-13,北向资金今日净买入25.8亿元，中兴通讯、山西汾酒净买入额均创新高,Wind
1442,2021-07-13,亿纬锂能：成为东风柳汽M6PHEV项目电池包供应商,Wind
1443,2021-07-13,电力设备与新能源行业周报(第二十七周),新浪
1444,2021-07-13,国家无条件批准，腾讯200亿重磅收购！发生了什么？,Wind
1445,2021-07-13,南山铝业：2.1万吨高性能动力电池箔项目预计年底前建成投产,Wind
1446,2021-07-13,深度*行业*新能源车产业链观察之先惠技术：订单快速增长 突破产能瓶颈打开成长空间,新浪
1447,2021-07-13,锂电池板块大幅回落，璞泰来逼近跌停,Wind
1448,2021-07-13,电力设备及新能源行业周报：6月销量达25.6万辆 上半年新能源车渗透率接近10%,新浪
1449,2021-07-13,北向资金动向盘点：逢高净卖“电新”20.8亿,Wind
1450,2021-07-13,【东吴晨报0713】【个股】中顺洁柔、亿纬锂能、先惠技术、三峡水利、科达利,东吴研究所
1451,2021-07-13,新能源领域近两年缘何频出十倍股,Wind
1452,2021-07-12,创业板人气爆棚，知名基金已提前杀入这些大牛股,中证报
1453,2021-07-12,3年涨幅16倍，“风口之王”亿纬锂能投20亿扩产锂电寻找下一个风口？,环球老虎财经
1454,2021-07-12,电气设备行业周报：6月中欧新能源车销量再上新台阶,新浪
1455,2021-07-12,亿纬锂能(300014.SZ)：回购账户的55.8万股已过户至第八期员工持股计划,格隆汇
1456,2021-07-12,群益证券：给予亿纬锂能增持评级，目标价位146.0元,证券之星
1457,2021-07-12,"1.3万亿创年内新高：锂电池获北上资金2000亿""捧场"" 高毅、景林动作不断 还要涨？",红周刊
1458,2021-07-12,万亿行情启动！“电池荒”致缺口或达40%，相关概念股均创新高,国际金融报
1459,2021-07-12,“收购+自建”，亿纬锂能“大踏步”扩张锂电池产能,环球老虎财经
1460,2021-07-12,北向资金今日净买入16.42亿元，新能源股表现分化,Wind
1461,2021-07-12,重仓金融的哭了，私募：千万不要对炒股的说一路平安,Wind
1462,2021-07-12,“新能源车”批量涨停，需求大爆发已导致电池荒,Wind
1463,2021-07-12,1704亿资金争夺20股：主力资金重点出击10股(名单),新浪
1464,2021-07-12,亿纬锂能收购两大锂盐标的,高工锂电
1465,2021-07-12,强者恒强新能车(159806)盘中创历史新高领涨两市,资本邦
1466,2021-07-12,锂电池指数再创新高，多股涨停，业绩大增股一览,Wind
1467,2021-07-12,【行情】赣锋锂业午后封板，总市值近2400亿，盛新锂能、西藏矿业、诺德股份等多股涨停，新宙邦、道氏技术、天华超净、亿纬锂能等多股涨超10%,金十数据
