745,2021-03-29,睿远基金2020年报出炉，傅鹏博称关注中小盘股投资机会,澎湃新闻
746,2021-03-29,文化传媒行业周报：一季报陆续发布 关注出版行业龙头,渤海证券
747,2021-03-29,【万联传媒 | 分众传媒】点评：稀缺价值叠加向上周期，梯媒龙头业绩超预期增长,万联证券研究所
748,2021-03-29,傅鹏博、赵诣、赵枫等基金经理隐形重仓股浮出水面,Wind
749,2021-03-29,传媒周报：龙头公司阶段调整或已结束 广告营销和影视院线一季报恢复良好,新浪
750,2021-03-29,月度金股报告：4月金股配置 静待反弹,新浪
751,2021-03-29,千亿传媒巨头分众传媒一度闪崩跌停！A股这一板块罕见爆发 连续下跌,证券时报网
752,2021-03-29,茅台涨4%，A股大爆发！世纪“大堵船”成功上浮,Wind
753,2021-03-29,A股这一板块罕见爆发：分红360亿 股价果然疯涨！,e公司
754,2021-03-29,芯片突发，三部门联合释放利好！传媒大佬股价崩了，私募重仓股出炉，“民间股神”新进食品白马,证券时报
755,2021-03-29,财信证券--分众传媒：2021Q1盈利略超预期，梯媒增长势头延续【公司研究】,金融界股吧
756,2021-03-29,分众传媒盘初闪崩逼近跌停，成交额快速放大,Wind
757,2021-03-29,【早安新时代】2021/03/29 今日关注：歌尔股份、新华保险、分众传媒,新时代证券研究
758,2021-03-29,分众传媒手握楼宇电梯核心资源净利率近30%,新浪
759,2021-03-29,超九成公司预喜 一季报业绩哪家强?,财富动力网
760,2021-03-28,154股剧透一季报 青云科技等2股续亏 亏损,北京商报网
761,2021-03-28,分众传媒(002027)事项点评报告：稀缺价值叠加向上周期 梯媒龙头业绩超预期增长,新浪
762,2021-03-27,传媒周观察：字节跳动收购沐瞳科技 游戏研发商争夺战仍在持续,新浪
763,2021-03-26,万联证券维持分众传媒增持评级，事项点评报告：稀缺价值叠加向上周期，梯媒龙头业绩超预期增长,每日经济新闻
764,2021-03-26,分众传媒(002027)：业绩连续5个季度超预期 看好梯媒长期价值,新浪
765,2021-03-26,分众传媒2020年营收120.97亿，营业利润50.80亿,中国经济网
766,2021-03-26,分众传媒(002027)事项点评：业绩再超预期 龙头行稳走远,新浪
767,2021-03-26,新时代证券给予分众传媒强烈推荐评级，分众传媒2020年业绩快报&2021年一季度业绩预告点评：21年Q1净利预增3120%-3542%，新周期内营收净利或有望持续新高,每日经济新闻
768,2021-03-26,分众传媒(002027)：2021Q1单季业绩预告高增长 梯媒龙头价值凸显,新浪
769,2021-03-26,分众传媒(002027)：单季度收入创历史新高 梯媒需求成长性凸显,新浪
770,2021-03-26,平安证券--分众传媒:业绩再超预期，龙头行稳走远【公司研究】,金融界股吧
771,2021-03-26,2021年品牌增长逻辑：两微一抖两梯媒,云掌财经
772,2021-03-26,机构抱团股复苏，宁德、太保、汇川、分众、中远海控、亿纬锂能、国航涨超3%,Wind
773,2021-03-26,89股获券商买入评级 广联达目标涨幅达95.33%,Wind
774,2021-03-25,分众传媒(002027.SZ)发布业绩，未来看点在哪里？,格隆汇
775,2021-03-25,外资逆势加仓，A股情绪转暖！一季报披露时间表出炉,Wind
776,2021-03-25,江南春：如何成为消费者心智中的首选？,胡润百富
777,2021-03-25,互联网传媒周报2021第7期：谷歌降低内购分成比例 业绩期关注基本面及估值修复,新浪
778,2021-03-25,分众传媒超预期财报拆解,云掌财经
779,2021-03-25,分众传媒一季度业绩预增超31倍 去年净利润增长超113％,经济观察网
780,2021-03-25,西部证券：分众传媒(002027.SZ)梯媒投放逆势增长，维持“买入”评级,智通财经
781,2021-03-25,多只抱团股腰斩，机构给出反弹目标价，“矿茅”可涨125%,第一财经
782,2021-03-25,分众传媒(002027)2021Q1业绩预告及2020年业绩快报点评：淡季不淡 梯媒龙头投放需求保持强劲,新浪
783,2021-03-25,西部证券维持分众传媒买入评级，2020年业绩快报点评：梯媒投放逆势增长，行业高景气，公司盈利弹性强,每日经济新闻
784,2021-03-25,华安证券维持分众传媒增持评级：2021Q1业绩符合预期，全年增长可期,每日经济新闻
785,2021-03-25,分众传媒：20Q4创历史单季收入新高，21Q1净利略超预期，持续看好有效品牌媒体的稀缺价值｜方正传媒姚蕾,杨仁文研究笔记
786,2021-03-25,A股异动丨分众传媒(002027.SZ)涨4% 一季度预盈12.2亿元-13.8亿元 同比增长31倍-35倍,格隆汇
787,2021-03-25,超级牛股突然高位跌停，游资胜利大逃亡,Wind
788,2021-03-25,分众传媒一季净利预增3120%以上 财报密集期多股表现可佳,巨丰财经
789,2021-03-25,多家上市公司预告业绩 A股一季报行情开启 业绩高增股名单来了,证券之星
790,2021-03-25,【中证盘前】腾讯去年狂赚1227亿！今年最大力度结构性减税政策登场；分众传媒一季报预增超31倍；特斯拉官宣接受比特币购车,中证报
791,2021-03-25,主业复苏强劲，多家公司一季报大幅预增,Wind
792,2021-03-25,年报揭示百亿元级私募投资变化，高毅资产持股市值最高,Wind
793,2021-03-25,这些公司一季度净利润预增10倍以上 紫金矿业成“预增王”,第一财经
794,2021-03-24,后疫情时代消费行业崛起 分众传媒一季度业绩预计暴增31倍,e公司
795,2021-03-24,分众传媒：净利润去年40亿，今年一季度预计同比增逾30倍,澎湃新闻
796,2021-03-24,晚间重要公告2021年3月24日星期三,Wind
797,2021-03-24,分众传媒一季度业绩预增超31倍 2020年全年业绩增长超113％,中国经济网
798,2021-03-24,疫情影响逐步消除，分众传媒一季度利润暴增超30倍,第一财经
799,2021-03-24,疫情影响消退，分众传媒预计2021年一季度盈利12.2-13.8亿,资本邦
800,2021-03-24,分众传媒一季度业绩大幅预增 2020年全年净利同比增长超113%,证券时报网
801,2021-03-24,以席勒市盈率估值法甄选陕西煤业：基本面良好 投资收益无法判断,证券市场周刊
802,2021-03-24,分众传媒(002027.SZ)预计2021年第一季度归母净利润为12.2亿元-13.8亿元,智通财经
803,2021-03-24,分众传媒：一季度预计净利润同比增长3120.08%~3542.39%,Wind
804,2021-03-24,分众传媒(002027.SZ)年度归母净利润同比增长113.55%至40.04亿元,智通财经
805,2021-03-24,分众传媒：2020年度净利润40.04亿元，同比增加113.55%,每日经济新闻
806,2021-03-24,分众传媒(002027.SZ)业绩快报：2020年净利大增113.55%至40.04亿元,格隆汇
807,2021-03-24,分众传媒：预计一季度净利同比增长3120%-3542%,36氪
808,2021-03-24,分众传媒：预计第一季度净利润同比增长3120.08%-3542.39%,格隆汇
809,2021-03-24,分众传媒：一季度净利预增超31倍,e公司
810,2021-03-24,分众传媒：预计第一季度净利润为12.2亿-13.8亿元，同比增长3120%-3542%,Wind
811,2021-03-24,分众传媒：2020年净利润同比增长113.55%（业绩快报）,Wind
812,2021-03-23,业绩快报丨走出疫情阴霾，分众传媒一季度净利润预计同比大增31倍,36氪
813,2021-03-23,【传媒】行情有所活跃，关注出版行业龙头——文化传媒行业周报——看好,渤海证券研究
814,2021-03-23,吴晓波对谈江南春：如何摆脱“价格战”的困局 | 今日直播,吴晓波频道
815,2021-03-23,A股全面回暖！聪明资金再度返场，众泰停牌核查,Wind
816,2021-03-22,价值分析——分众传媒（002027）：中国梯媒龙头，未来增长潜力如何？,云掌财经
817,2021-03-22,文化传媒行业周报：行情有所活跃 关注出版行业龙头,渤海证券
818,2021-03-22,A股全面回暖！“聪明资金”再度返场，四行业获提前抢筹,Wind
819,2021-03-22,互联网传媒周报：芒果超媒《陪你一起长大》定档3月28日 有望验证丰富内容矩阵,新浪
820,2021-03-22,中国银河--传媒互联网行业周报：快手新游上线首日表现优异，“值得买科技”新十年战略启程【行业研究】,金融界股吧
821,2021-03-22,【中泰传媒-周观点】低风险电影院文娱场所人数不再受限，进入财报季关注业绩表现,传媒产业大视点
822,2021-03-21,【华创欣传媒·周观察】20210321：在线教育专业委员会成立，教育行业迎来强监管周期,鲸平台
823,2021-03-21,传媒行业：百度和哔哩哔哩将在港上市；关注龙头公司估值修复,广发证券
824,2021-03-19,分众传媒(002027)：从广告需求和媒介供给两端 看分众成长性,新浪
825,2021-03-19,A股融资融券日报：两融余额增加0.67亿元（3月18日）,Wind
826,2021-03-18,机构最近都在买哪些股？,证券时报网
827,2021-03-18,汇顶科技等33股近五日获机构净买入,证券时报网
828,2021-03-17,掘金龙虎榜 31股近期获机构净买入,证券之星
829,2021-03-16,江南春：2021年，用确定性的逻辑打赢不确定的市场,36氪
830,2021-03-16,传媒互联网行业数据月报：春节档助力影市回暖 2月手游市场规模环比增长12%,新浪
831,2021-03-16,渤海证券--文化传媒行业周报：行情低迷，继续关注一季报表现【行业研究】,金融界股吧
832,2021-03-16,机构近期抢筹这33股可关注（附名单）,证券之星
833,2021-03-16,【传媒】行情低迷，继续关注一季报表现——文化传媒行业周报——看好,渤海证券研究
834,2021-03-16,【中原晨会0316】周观点第八期、市场分析、券商板块周报、消费板块投资周思考、汽车行业周报、电力设备行业点评、传媒行业数据周报,中原证券研究所
835,2021-03-16,11家百亿元级私募重仓41只A股,Wind
836,2021-03-15,传媒互联网周观点：快手与寺库合作向高端奢侈品类冲刺 B站通过港交所上市聆讯,新浪
837,2021-03-15,中国银河--传媒互联网行业：快手与寺库合作向高端奢侈品类冲刺，B站通过港交所上市聆讯【行业研究】,金融界股吧
838,2021-03-15,方正传媒数据周报?Disney+会员数破亿，2月国内手游市场规模212亿元 ｜21年第11周,杨仁文研究笔记
839,2021-03-15,龙虎榜揭秘 近五日机构最青睐37股,证券之星
840,2021-03-15,北向资金大调仓！狂买5只银行股，2000亿市值钢铁巨头遭减仓,Wind
841,2021-03-15,一批基金最新持仓曝光！减仓前期热门股，重仓这些股票,Wind
842,2021-03-15,传媒行业周报：网易重磅新品《忘川风华录》即将上线 美团“团好货”日单突破十万 继续深化电商布局,广发证券
843,2021-03-15,互联网传媒周报：建议回调中加仓高性价且基本面向上的核心资产,新浪
844,2021-03-14,传媒周观察：快手扶持二次元内容 B站港股上市计划获批,新浪
845,2021-03-13,抱团白马股奋起反弹 包钢股份过热资金渐离,财富动力网
846,2021-03-12,机构本周净卖出近30亿元 北向资金反向做多持续净买入,大众证券报
847,2021-03-12,2021年的品牌营销之惑：种草过时，种树很难,36氪
848,2021-03-12,机构砸盘分众传媒 游资封板云铝股份|板块龙虎榜,第一财经
849,2021-03-12,分众传媒等25股获北向资金增持额超亿元,证券时报网
850,2021-03-12,分众传媒大涨5.08%，营销传播行业涨2.59%,中新经纬
851,2021-03-12,A股早报2021年3月12日星期五,Wind
852,2021-03-12,千亿大白马盘中跌停！四机构为何联手卖出14亿元？公司回应来了,Wind
853,2021-03-12,北向资金连续3日净买入累计达144亿元，哪些股受青睐？（附股）,21世纪经济报道
854,2021-03-12,机构加仓追涨华菱钢铁 游资跟风短期套利,财富动力网
855,2021-03-12,教育培训广告或遭全面叫停，百亿广告市场凭空蒸发,腾讯网
856,2021-03-12,懵圈，千亿巨头逆市暴跌！机构出逃14亿元，外资却疯狂抄底，这是什么操作？,券商中国
857,2021-03-11,千亿白马股分众传媒盘中跌停 公司回应来了,第一财经
858,2021-03-11,分众传媒回应大跌：公司基本面没事 现有业务一切正常 连续下跌,金融界
859,2021-03-11,北向资金今日净流入67.19亿元 大幅净买入分众传媒5.84亿元,中金在线
860,2021-03-11,超级大单:1400亿龙头突然暴跌7% 四机构狂卖“海归第一股”13.7亿 连续下跌,新浪
861,2021-03-11,数据复盘｜有色金属、银行等行业获主力资金青睐 北向资金连续3日净流入,证券时报网
862,2021-03-11,北向资金今日净买入分众传媒5.84亿元、招商银行4.88亿元,中金在线
863,2021-03-11,北向资金今日净流入67.19亿元 逆市跌7.16%的分众传媒获净买入,21世纪经济报道
864,2021-03-11,北向资金|合计净流入67.19亿元，分众传媒、招商银行、贵州茅台净买入居前,上游新闻
865,2021-03-11,A股主力资金流向（3月11日）：抱团股、周期股重获青睐,Wind
866,2021-03-11,最新出炉！3月11日沪深股通净流入67.19亿，分众传媒获净买入5.84亿,每日经济新闻
867,2021-03-11,3月11日龙虎榜，机构青睐这10股,证券时报网
868,2021-03-11,机构今日买入这10股，卖出分众传媒9.92亿元丨龙虎榜,第一财经
869,2021-03-11,北向资金今日净买入67.19亿元，持续加码机构抱团股、新能源股,Wind
870,2021-03-11,分众传媒跌超7%，全天成交近49亿，四机构卖出近14亿元,第一财经
871,2021-03-11,分众传媒龙虎榜数据（3月11日）,Wind
872,2021-03-11,分众传媒逆市跌7.16% 四个机构席位卖出近14亿元,金融界
873,2021-03-11,分众传媒逆势大跌7%，机构出逃近14亿,Wind
874,2021-03-11,传媒互联网年报业绩前瞻暨3月投资策略：关注估值底部的游戏板块及超跌龙头,新浪
875,2021-03-11,分众传媒子公司入股安徽丰策文化传媒有限公司，持股5%,企查查
876,2021-03-11,分众传媒逆市跌超7%，成交金额36亿元,Wind
877,2021-03-11,科技及智能设备产业链日报：半导体产品与半导体设备板块出现回暖,新浪
878,2021-03-10,中概股回A迎最好时机，跨市场溢价交易来临,Wind
879,2021-03-10,分众传媒大涨5.25%，领涨营销传播行业,中新经纬
880,2021-03-10,财信证券--传媒行业月度报告：春节档票房创历史新高，关注细分领域低估值龙头【行业研究】,金融界股吧
881,2021-03-10,传媒行业周报：2月电影市场强势复苏 关注游戏公司新品排期,新浪
882,2021-03-09,互联网传媒周报：互联网估值收缩明显 把握高景气 估值不高的核心资产和中小盘标的,新浪
883,2021-03-08,文化传媒行业周报：行情持续分化 关注一季报表现,渤海证券
884,2021-03-08,财信证券--营销传播行业点评：1月整体广告花费负增长，梯媒&影院广告持续高景气【行业研究】,金融界股吧
885,2021-03-08,中航证券--文化传媒行业周报：“女神节”掀起“她经济”热潮，建议短期关注社交营销板块【行业研究】,金融界股吧
886,2021-03-08,中国银河--传媒互联网行业周报：十年展翅迎风而起，知乎启动美股IPO【行业研究】,金融界股吧
887,2021-03-08,传媒行业周报：多只动漫游戏ETF上市流通 关注游戏板块结构性机会,华安证券
888,2021-03-08,分众传媒子公司入股马鞍山市分众广告有限公司，后者增资5.26%,企查查
889,2021-03-08,国盛证券--传媒行业周报：关注游戏Q2产品表现，重视低估值真成长个股投资机会【行业研究】,金融界股吧
890,2021-03-08,传媒互联网行业周报：1月广告市场梯媒持续高速增长 游戏公司新品可期,新浪
891,2021-03-06,传媒周观点9期：传媒细分板块进入新阶段 部分优质个股修复价值凸显,新浪
892,2021-03-06,【中原传媒】2020年广告市场回顾：疫情影响下刊例花费进一步下滑，梯媒渠道维持高景气度传媒行业点评报告,中原证券研究所
893,2021-03-05,分众市值一年回血1000亿，江南春的路却才走完一半,21商评网
894,2021-03-05,传媒互联网行业1月广告市场回顾：市场整体平淡 梯媒持续高速增长,新浪
895,2021-03-05,3月券商金股出炉：61股获2家以上机构推荐,证券时报
896,2021-03-05,3月券商金股出炉：61股获2家以上机构推荐,Wind
897,2021-03-04,中泰证券--传媒行业周报：优质内容带动国产游戏出海提速，进入财报季关注业绩表现【行业研究】,金融界股吧
898,2021-03-04,30家券商发布3月金股，四条选股主线曝光（附股）,Wind
899,2021-03-04,传媒互联网行业2020广告市场回顾：疫情拖累广告行业 但梯媒增速创近5年新高,新浪
900,2021-03-03,3月券商金股名单出炉，16股人气火爆，四条选股主线曝光（附股）,证券时报网
901,2021-03-03,东莞证券--传媒行业事件点评：2020年全媒体刊例花费同比降11.6%，仅梯媒刊例花费逆势增长【行业研究】,金融界股吧
902,2021-03-02,7只基金负收益：睿元跌近5% 东证资管高管频变背后怎么了？,投资时报
903,2021-03-02,中国银河--传媒互联网行业2月行业动态报告：电影市场开门红，成就史上最强春节档【行业研究】,金融界股吧
904,2021-03-02,A股收盘综述：上证指数下滑1.21%守住3500，资金流入碳中和概念股,Wind
905,2021-03-02,万华化学、药明康德、紫金矿业、分众传媒、康希诺等明星股下挫逾6%,Wind
906,2021-03-02,中国银河--传媒互联网行业：视音频内容分发数字版权管理标准体系发布，UFC和中国移动咪咕达成合作【行业研究】,金融界股吧
907,2021-03-02,【传媒】春节档表现火热，关注行业一季报表现——传媒行业月报——看好,渤海证券研究
908,2021-03-02,【中原晨会0302】市场分析、券商板块周报、传媒行业周报、固定收益周报20210301、消费板块投资周思考、2月PMI数据点评,中原证券研究所
909,2021-03-02,A股三月开门红，北向资金净买入38亿元，砸向这些股（名单）,21世纪经济报道
910,2021-03-01,北向资金今日净买入37.86亿元，爱尔眼科净买入近5亿元,Wind
911,2021-03-01,传媒周报：流媒体龙头公司业绩保持高速增长 电影行业持续复苏,新浪
912,2021-03-01,A股融资融券日报：两融余额减少103.02亿元（2月26日）,Wind
913,2021-03-01,【银河传媒杨晓彤】行业动态 2021.2丨电影市场开门红 成就史上最强春节档,中国银河证券研究
914,2021-03-01,【策略*陈李】东吴证券月度策略及金股组合：货币海洋上的资产泡沫,东吴研究所
915,2021-02-28,收藏：10大券商3月金股出炉！从100只金股再次聚焦10只重点股！,搜狐
916,2021-02-28,方正研究|3月十大金股,策略研究
917,2021-02-27,特别策划 | 企业的长期竞争力：必须成为客户的首选,财经杂志
918,2021-02-26,北向资金小幅净卖出 抛售抱团股增持地产股,21世纪经济报道
919,2021-02-25,江南春：流量是情人、品牌才是老婆,子弹财经
920,2021-02-25,分众传媒今日大宗交易成交275.89万股，成交价10.89元折价2.77%,Wind
921,2021-02-25,奇葩说90后辩手创业，打造线下商圈的“分众传媒”，帮支付宝、乐队的夏天打广告,云掌财经
922,2021-02-25,江南春：品牌致胜新姿势，双微一抖一分众,云掌财经
923,2021-02-25,57股获券商买入评级 兔宝宝目标涨幅达90%,Wind
924,2021-02-25,【山证传媒】2020年报业绩前瞻：业绩预告同比减亏，板块分化聚焦复苏与增长确定性 预亏,山西证券研究所
925,2021-02-24,传媒行业2020年报前瞻：业绩预告同比减亏 板块分化聚焦复苏与增长确定性 预亏,新浪
926,2021-02-24,传媒互联网行业周报：春节档票房超预期 把握细分行业龙头公司,新浪
927,2021-02-23,分众传媒子公司入股安庆市孑然广告有限公司,企查查
928,2021-02-22,传媒行业：1月手游环增6% 春节头部产品领先,新浪
929,2021-02-22,传媒行业周报：优质龙头基本面扎实 重视低估值真成长个股投资机会,新浪
930,2021-02-21,方正传媒?数据周报：三七两款游戏进入1月中国手游出海收入Top30，爱奇艺FY20全年亏损幅度收窄｜21年第8周 亏损,杨仁文研究笔记
931,2021-02-21,传媒周观点7期：快手强标签的社区属性 更具竞争壁垒,新浪
932,2021-02-21,传媒互联网行业周报：春节档表现超预期 1月手游市场规模环比稳中有升,新浪
933,2021-02-20,分众传媒(002027)：新国货崛起叠加一级市场持续景气 楼宇广告市场蓬勃发展,新浪
934,2021-02-19,A股共发生107宗大宗交易成交59.47亿元（2月19日）,Wind
935,2021-02-19,分众传媒现1笔大宗交易 共成交715.14万元,新浪
936,2021-02-19,分众传媒今日大宗交易成交58万股，成交价12.33元溢价0.0%,Wind
937,2021-02-19,财富证券--传媒行业点评：春节档票房量价齐升，全年影院广告有望超预期发展【行业研究】,金融界股吧
938,2021-02-19,中金公司：1月手游市场稳健增长，观影需求逐步恢复,证券时报网
939,2021-02-19,安信研究|晨会在线20210222,安信证券研究
940,2021-02-17,江南春：2021年最大的机遇是人心红利,经济观察报
941,2021-02-11,传媒互联网2月投资策略：春节档票房预售表现良好 关注港股SAAS及游戏板块,新浪
942,2021-02-10,互联网传媒2020年报业绩前瞻：视频和楼宇媒体龙头强者恒强 游戏新渠道和头部研发商高景气,新浪
943,2021-02-10,传媒互联网行业周报：快手上市市值破万亿 把握流媒体布局机,新浪
944,2021-02-10,增持11股！北上资金节前布局全扫描（附名单）,证券时报网
945,2021-02-09,传媒行业：快手上市首日收盘大涨 春节档预售票房累计达4.6亿,新浪
946,2021-02-08,文化传媒行业周报：继续关注春节假期利好的相关领域,渤海证券
947,2021-02-08,传媒互联网行业：游戏出海进程加速 国内研发商竞争力与日俱增,新浪
948,2021-02-08,传媒互联网行业周报：《原神》小米应用商店7：3分成 春节档预售票房破3亿元,新浪
949,2021-02-08,国盛证券--传媒行业周报：快手上市继续看好5G时代视频化发展，关注港股平台型公司【行业研究】,金融界股吧
950,2021-02-08,传媒行业周报：手游渠道分散化凸显研发商价值 快手上市关注流量变现,华安证券
951,2021-02-08,媒体Ⅱ周报：传媒互联网行业2020Q4基金持仓分析：持仓继续龙头集中,新浪
952,2021-02-08,传媒行业：快手火热上市 短视频创新内容,新浪
953,2021-02-07,传媒行业一周观点：继续重视全市场龙头 长假将至关注文娱活动数据表现,新浪
954,2021-02-07,传媒周观点6期：快手的用户特质较为突出 短视频平台的稀缺性突出,新浪
955,2021-02-07,北向资金一周动向盘点：净买253.3亿，近百亿去了新能源,Wind
956,2021-02-05,中国银河国际--传媒互联网行业1月行业动态报告：广告投放连续多月回升，春节档预售火爆【行业研究】,金融界股吧
957,2021-02-05,【银河晨报】2.5丨2021年制造业持续向好，高端制造引领业绩增长,中国银河证券研究
958,2021-02-04,【银河传媒杨晓彤】行业动态 2021.1丨广告投放连续多月回升，春节档预售火爆,中国银河证券研究
959,2021-02-02,英科医疗拟香港上市：卖手套年利润超68亿股价涨28倍,雷帝触网
960,2021-02-02,传媒行业月报：1月行业表现低迷 关注原地过年概念,渤海证券
961,2021-02-02,2月首日北向资金扫货34亿，哪些行业和个股最受青睐？（附名单）,21世纪经济报道
962,2021-02-02,A股融资融券日报：两融余额减少18.24亿元（2月1日）,Wind
963,2021-02-02,【传媒】1月行业表现低迷，关注原地过年概念——传媒行业月报——看好,渤海证券研究
964,2021-02-01,深港通十大成交活跃股排名（2月1日）,Wind
965,2021-02-01,北向资金今日净买入34.59亿元，中国中免净买入额创历史新高,Wind
966,2021-02-01,互联网传媒周报：不惧波动 紧抓视频游戏楼宇广告成长机会,新浪
967,2021-02-01,中国银河--传媒互联网行业：春节档影片预售火热，中国移动公布与中国广电5G合作细节【行业研究】,金融界股吧
968,2021-02-01,方正传媒?数据周报：1月国产游戏版号下发，抖音独家合作春晚红包互动｜21年第5周,杨仁文研究笔记
969,2021-02-01,新时代传媒周报：快手申购火爆超购逾1218倍 《唐探3》预售两天票房破亿,新浪
970,2021-01-31,特别策划｜企业如何借“定位”穿越周期，逆势上扬？,财经杂志
971,2021-01-30,分众传媒(002027)深度系列一：从下游角度看分众收入的确定性,华安证券
972,2021-01-29,华安证券--分众传媒：从下游角度看分众收入的确定性【公司研究】,金融界股吧
973,2021-01-29,15.9亿块手机屏幕不敌分众，83%流行广告语“电梯制造”,证券时报网
974,2021-01-28,公募1月调仓动向曝光：加配银行和港股，新发基金建仓谨慎,21世纪经济报道
975,2021-01-28,公募基金1月调仓动向曝光：加配银行、港股 同时建仓谨慎,Wind
976,2021-01-27,认知越强，后劲越足,华夏时报
