1457,2020-10-14,深港通十大成交活跃股排名（10月14日）,Wind
1458,2020-10-14,分众传媒(002027)2020年三季报预告点评：三季度业绩预增97%-140% 看好公司品牌服务带来的强劲恢复增长,新浪
1459,2020-10-14,分众传媒(002027)2020年前三季度业绩预告点评：前三季度业绩超预期 全年利润预计高增长,新浪
1460,2020-10-14,分众传媒(002027)：Q3净利同增97~140% 梯媒龙头增长强劲,新浪
1461,2020-10-14,分众传媒预计前三季净利19.73亿元-22.23亿元，同比上升45.07%-63.44%,资本邦
1462,2020-10-14,分众传媒(002027)：20Q3业绩预告大幅超预期 梯媒成新消费成长助推器,新浪
1463,2020-10-14,分众传媒（002027.SZ）：三季度业绩预增97%-140%，看好公司品牌服务带来的强劲恢复增长,关爱传媒成长小分队
1464,2020-10-14,分众传媒等业绩大增股遭机构抢筹,证券时报网
1465,2020-10-14,分众传媒(002027)2020三季报业绩预告点评：梯媒景气度持续高企 经营杠杆效应显着 积极把握右侧趋势,新浪
1466,2020-10-14,分众传媒(002027)20Q3单季度利润大超预期，重申推荐,杨仁文研究笔记
1467,2020-10-14,分众传媒发布2020年前三季度业绩预告 预计第三季度利润同比增长97.45%-140.37%,证券时报网
1468,2020-10-14,点评 | 梯媒景气度持续高企，经营杠杆效应显著，积极把握右侧趋势【建投传媒互联网】,CSC传媒互联网研究
1469,2020-10-14,A股异动丨分众传媒(002027.SZ)一字涨停前三季净利预增45.07%-63.44%,格隆汇
1470,2020-10-14,分众传媒一字涨停 Q3净利预增97.45%-140.37%超市场预期,新浪
1471,2020-10-14,上证指数低开0.18%、创业板指跌0.25%，格力电器高开2.74%,Wind
1472,2020-10-14,分众传媒第三季度净利预增97.45%-140.37% 超市场预期,中证网
1473,2020-10-13,分众传媒：前三季度预计净利润同比增长45.07%~63.44%,Wind
1474,2020-10-13,分众传媒：前三季度净利预增45.07%-63.44%,证券时报网
1475,2020-10-13,分众传媒：前三季度净利预增45%-63%,格隆汇
1476,2020-10-13,分众传媒：第三季度业绩预增97.45%-140.37%,Wind
1477,2020-10-13,A股互联网传媒行业2020年三季报业绩前瞻：楼宇媒体复苏超预期 视频龙头维持高景气 游戏有分化,新浪
1478,2020-10-12,互联网传媒周报：三季报临近 视频游戏和楼宇媒体龙头预计较高景气,新浪
1479,2020-10-12,传媒行业周报：国庆档符合预期 中长期看好电影行业,华安证券
1480,2020-10-12,传媒行业月度报告：国庆档顺利收官 关注Q4新游戏上线及双11营销板块催化,新浪
1481,2020-10-12,传媒行业周报：新游上线纷至沓来 直播电商风云再起,新浪
1482,2020-10-12,【行业动态】传媒 2020.9丨5G建设持续提速，国庆档带动影视行业加速回暖,中国银河证券研究
1483,2020-10-11,10月份A股布局时机再现？券商研判市场呈震荡上行趋势，“扎堆热捧”五粮液、中国平安等多只金股,证券日报
1484,2020-10-10,传媒本周观点：分众、芒果三季报预告超预期，梯媒、在线视频高景气度延续；持续推荐季报业绩高增长标的【建投传媒互联网】,CSC传媒互联网研究
1485,2020-10-10,方正传媒49页数据周报：9月手游收入同比增20%；关注三季报绩优公司,杨仁文研究笔记
1486,2020-10-09,东兴证券：9月金股组合亏损7.11% 10月荐股名单出炉 亏损,新浪
1487,2020-10-09,分众传媒(002027)：需求态势良好 关注成本优化带来的利润超预期可能,新浪
1488,2020-10-08,月报｜营销行业：广告市场回暖明显，梯媒刊例同增30%+；行业旺季即将到来，持续推荐分众传媒【建投传媒互联网】,CSC传媒互联网研究
1489,2020-09-30,国庆档新片预售总票房超3亿元 电影市场有望恢复常态 丨牛熊眼,第一财经
1490,2020-09-30,还原一个风口与业绩之外的分众传媒,亿欧网
1491,2020-09-30,刚赚了60亿，阿里又出手了！3.85亿参股A股上市公司,中国基金报
1492,2020-09-30,传媒互联网-8月广告市场回顾：广告需求持续向好 梯媒继续保持高景气度,新浪
1493,2020-09-29,分众传媒嵇海荣：和百度建立了搜索云 可以GPS定位精准投放广告,新浪
1494,2020-09-29,汤臣倍健(300146)2020年三季度业绩预告点评：Q3业绩提速 逐季改善兑现,新浪
1495,2020-09-28,互联网传媒周报：游戏渠道内容议价力有望改变,新浪
1496,2020-09-28,传媒互联网周报：“全国一网”取得突破性进展 推荐游戏、电商及广告,光大证券
1497,2020-09-27,传媒行业投资策略周报：精品游戏冲击渠道分账 《姜子牙》获国庆档预售冠军,广发证券
1498,2020-09-27,“定位的力量·消费品行业资本对接闭门会”在上海举行,证券时报
1499,2020-09-27,传媒互联网周报：新一批网游版号下发 国庆档临近关注票房表现,新浪
1500,2020-09-26,“巨无霸”接连登陆A股，千亿市值公司增至108家,Wind
1501,2020-09-25,核心公募基金公司持仓分析,新浪
1502,2020-09-25,【银河传媒】四季度策略：中国科技崛起—线下娱乐强势回归，5G赋能如期而至,中国银河证券研究
1503,2020-09-24,传媒行业2020年四季度策略报告-中国科技崛起：线下娱乐强势回归 5G赋能如期而至,新浪
1504,2020-09-23,分众传媒现1笔大宗交易 共成交232.00万元,新浪
1505,2020-09-23,分众传媒今日大宗交易成交29万股，成交价8.0元溢价1.27%,Wind
1506,2020-09-22,这份报告，揭露了饿了么、飞鹤等品牌被引爆的秘密,投中网
1507,2020-09-22,互联网传媒行业周报：楼宇媒体继续复苏 游戏国内迎来新品高峰,新浪
1508,2020-09-22,23股获券商买入评级，蓝帆医疗目标涨幅达108.93%,Wind
1509,2020-09-21,传媒周报：布局10.1双11影视与电商板块机会 游戏调整建议逢低加配,新浪
1510,2020-09-21,券商评级：三大指数下跌 九股迎来掘金良机,证券之星
1511,2020-09-21,阿里巴巴概念股分化，金固股份封涨停板,Wind
1512,2020-09-21,传媒互联网行业数据月报：8月游戏市场规模环比稳中有升 电影市场逐步恢复,新浪
1513,2020-09-21,TMT一周谈之传媒：阿里云游戏平台首发 全面赋能,新浪
1514,2020-09-20,传媒一周观点：持续提示的后疫情板块表现较强 关注Q3业绩兑现,新浪
1515,2020-09-19,方正传媒·数据周报·8月芒果TV DAU超优酷，三七《云上城之歌》进iOS游戏畅销榜前十｜2020年第38周,杨仁文研究笔记
1516,2020-09-18,品牌称王没有通用公式，底层逻辑只有一条 | 晓报告,吴晓波频道
1517,2020-09-17,“红星1949大师传承”上市 诠释新清香酒质新表达,中华网
1518,2020-09-16,晨会聚焦200916重点关注传媒互联网、纺织服装、游戏行业,国信研究
1519,2020-09-16,传媒互联网中期回顾暨9月投资策略：疫情影响上半年业绩表现，关注国庆档及游戏新品表现,国信研究
1520,2020-09-15,分众传媒现2笔大宗交易 共成交431.42万元,新浪
1521,2020-09-15,中信建投TMT团队最新研究观点,中信建投证券研究
1522,2020-09-15,分众传媒：“福建分众传媒有限公司”与公司无任何关系,Wind
1523,2020-09-15,兆讯传媒创业板上市在即：高铁站的“分众传媒” 2019年净利润破亿,IPO早知道
1524,2020-09-14,【万联TMT-传媒 | 中报综述】后疫情时代，持续看好线上经济持续&线下场景修复,万联证券研究所
1525,2020-09-14,传媒行业半年报综述：后疫情时代 持续看好线上经济持续&线下场景修复,新浪
1526,2020-09-14,互联网传媒周报：手游、楼宇媒体近期数据亮眼 小程序电商助推微信商业化,新浪
1527,2020-09-14,营销行业202009月报：梯媒投放同比增长持续超预期 重点推荐分众传媒,新浪
1528,2020-09-14,中信建投：传媒互联网板块基本面向好趋势不变 重点推荐分众传媒等,证券时报网
1529,2020-09-14,月度点评｜营销行业：梯媒投放同比增长持续超预期，重点推荐分众传媒,CSC传媒互联网研究
1530,2020-09-13,传媒互联网周报：8月游戏市场规模稳中有升 广告需求趋势向好,新浪
1531,2020-09-12,新潮VS分众：电梯广告重回风口,中国经营报
1532,2020-09-12,疫情之下九牧王推出品牌新战略 能否扭转业绩压力？,21世纪经济报道
1533,2020-09-11,传媒互联网7月广告市场回顾：广告需求向好 梯媒同比及环比均实现正增长,新浪
1534,2020-09-11,分众传媒营收创5年来中报新低 规模收缩愈发难圆两年前自设目标,投资者网
1535,2020-09-10,中国品牌令世界瞩目！九牧王匠心31年，拉开“全球销量领先的男裤专家”战略序幕！,第一财经
1536,2020-09-10,携手分众传媒 九牧王拉开“全球销量领先的男裤专家”战略序幕,经济观察报
1537,2020-09-10,九牧王携手分众传媒：战略布局三箭齐发 市值升至77亿,新浪
1538,2020-09-10,传媒行业2020年中报总结：线上消费持续高景气 线下文娱板块回暖进行时,新浪
1539,2020-09-10,传媒行业四季度投资策略报告：行业业绩有所恢复 关注景气度回升领域龙头,渤海证券
1540,2020-09-10,传媒行业2020年中报总结：院线和影视业绩恢复弹性大 线上娱乐催化较多 教育兼备确定性和成长性,新浪
1541,2020-09-09,重回千亿市值，分众迎来拐点？,全天候科技
1542,2020-09-08,传媒行业半年报业绩综述：基本面有所恢复 关注景气度回升的龙头,渤海证券
1543,2020-09-08,"分众传媒现1笔大宗交易 共成交6,349.50万元",新浪
1544,2020-09-08,传媒行业周报：前瞻性布局国庆档及直播电商产业链,新浪
1545,2020-09-08,互联网传媒行业周观点：9月首批游戏版号下发 数部新片定档进一步激活观影市场,新浪
1546,2020-09-08,A股融资融券日报：两融余额减少28.1亿元（9月7日）,Wind
1547,2020-09-07,传媒行业周报：内容供给逐步增加 电影院线加快复苏脚步,新浪
1548,2020-09-07,互联网传媒周报：线下持续复苏 美国禁令细则将公布,新浪
1549,2020-09-07,A股融资融券日报：两融余额减少32.45亿元（9月4日）,Wind
1550,2020-09-06,【中泰传媒-中报总结】持续看好线上娱乐消费及线下场景复苏的投资机会,传媒产业大视点
1551,2020-09-06,传媒互联网周报：新一批国产网游版号下发 电影票房逐步恢复,新浪
1552,2020-09-05,传媒行业：持续看好线上娱乐消费及线下场景复苏的投资机会,财富动力网
1553,2020-09-04,A股中报季900只超预期个股名单,锦缎
1554,2020-09-03,妙可蓝多蹊跷的预付款,证券市场周刊
1555,2020-09-03,A股互联网传媒行业2020年中报总结：游戏、新媒体持续高景气 线下场景不同程度复苏,新浪
1556,2020-09-01,分众传媒的“回春”谜团：真实改善还是会计操作？,锦缎
1557,2020-08-31,分众市值腾跃：数字化升级下的动能转换,每经网
1558,2020-08-31,【新时代传媒团队】梯媒刊例花费六月同增超25%，楼宇媒体引领广告行业逐步复苏,新时代证券研究
1559,2020-08-31,一大批消费股创新高！北向资金又嗨了，加仓这些股,中证报
1560,2020-08-31,下一个10年 线上线下70%的流量都在短视频,亿邦动力
1561,2020-08-31,明星基金经理“隐形”重仓股全曝光,中国基金报
1562,2020-08-30,北向资金上周重点加仓分众传媒等个股,证券时报网
1563,2020-08-29,一周研读｜上涨临近，旺季来临，龙头受益,中信证券研究
1564,2020-08-29,扫货龙头股加仓创业板，北上资金本周净买80亿,Wind
1565,2020-08-29,方正传媒·数据周报·游戏、视频板块中报表现亮眼｜2020年第35周,杨仁文研究笔记
1566,2020-08-28,妙可蓝多上半年大额广告占位费向谁支付？股价大涨股东违规减持谁在“割韭菜”？ 其他违规处罚,21世纪经济报道
1567,2020-08-28,分众传媒营收创5年来中报新低 再造一个分众遥遥无期,投资者网
1568,2020-08-28,北向资金动向盘点：“换子”电动汽车,Wind
1569,2020-08-28,创业板16股涨停，一指标达开板以来历史新高,Wind
1570,2020-08-28,险资加仓名单揭晓！新晋88家A股公司十大股东,中证报
1571,2020-08-28,分众传媒营收创5年来中报新低 规模收缩愈发难圆两年前自设目标,投资者网
1572,2020-08-28,险资二季度A股重仓股图谱曝光,Wind
1573,2020-08-27,公募权益类基金仓位连升两月，8月调研聚焦五行业,Wind
1574,2020-08-26,新潮传媒董事长：分众很优秀，我们为何一定要比个你死我活？,澎湃新闻
1575,2020-08-26,北向资金动向盘点：反手加仓茅台，但“食药”持仓占比已达31.3%,Wind
1576,2020-08-25,分众传媒“护城河决堤”上半年营收降二成影院广告收入降85% 盈利能力下降,GPLP犀牛财经
1577,2020-08-25,A股融资融券日报：两融余额增加76.78亿元（8月24日）,Wind
1578,2020-08-25,A股早报2020年8月25日星期二,Wind
1579,2020-08-25,【中原晨会0825】策略研究、市场分析、润达医疗公司点评报告、凯普生物半年报点评、分众传媒中报点评、消费行业投资周思考,中原证券研究所
1580,2020-08-25,【中原传媒】分众传媒(002027)中报点评： 上半年扣非净利润增长63%，下半年业绩弹性大,中原证券研究所
1581,2020-08-25,北向资金动向盘点：加仓行业龙头；“消费”摇摆不定,Wind
1582,2020-08-25,“梯媒现象”：分众上的这些消费股都涨翻了,阿尔法工场研究院
1583,2020-08-25,中信建投TMT团队最新研究观点,中信建投证券研究
1584,2020-08-25,文化传媒行业周报：行情有所活跃 关注半年报表现优秀个股,渤海证券
1585,2020-08-24,分众传媒困境反转后股价该怎么走？,格隆汇
1586,2020-08-24,机构现身34股，净买入分众传媒3.09亿元、净卖出中航光电5960万元,第一财经
1587,2020-08-24,机构今日卖出这25股，买入分众传媒超3亿元丨牛熊眼,第一财经
1588,2020-08-24,北向资金连续两日小幅净流入，顺周期行业龙头获外资青睐,Wind
1589,2020-08-24,机构重仓股跟踪周报,新浪
1590,2020-08-24,分众传媒(002027)：成本大幅下降业绩超预期 看好后续收入回暖带动的业绩增长弹性 盈利能力下降,新浪
1591,2020-08-24,分众传媒再度涨停，机构持续买入,Wind
1592,2020-08-24,46家公司获海外机构调研,证券时报网
1593,2020-08-24,分众传媒放量涨停 三机构合计买入4.32亿元,e公司
1594,2020-08-24,分众传媒龙虎榜数据（8月24日）,Wind
1595,2020-08-24,分众传媒再度涨停提振广告板块，华谊嘉信午后涨幅扩大至15%,Wind
1596,2020-08-24,分众传媒(002027)2020年中报点评：需求持续回暖 成本优化助力盈利增长强劲,新浪
1597,2020-08-24,8月24日早盘主力巨资抢筹四大板块(附股),金融界
1598,2020-08-24,A股异动|分众传媒(002027.SZ)再度冲击涨停板股价创约两年来新高,格隆汇
1599,2020-08-24,融资客青睐8股，浙江龙盛买入占比高达42.53%,Wind
1600,2020-08-24,A股融资融券日报：两融余额减少10.67亿元（8月21日）,Wind
1601,2020-08-24,A股早报2020年8月24日星期一,Wind
1602,2020-08-23,传媒行业周报：关注5G牌照、IP产业链的投资机会,新浪
1603,2020-08-22,方正传媒·数据周报·单日票房破2亿；教育部要求秋季学期恢复正常教学秩序｜2020年第34周,杨仁文研究笔记
1604,2020-08-21,【民生传媒周报】20200824：《我的侠客》付费侧开启，《八佰》带动院线行业加速复苏,MS互联网传媒
1605,2020-08-21,【新时代传媒】分众传媒（002027.SZ）：2020H1扣非净利同增63%，客户结构重构与点位调优助力业绩提振,关爱传媒成长小分队
1606,2020-08-21,9股特大单净流入资金超2亿元,证券时报网
1607,2020-08-21,分众传媒(002027)：利润超预期 经营拐点确立 向上趋势明确,新浪
1608,2020-08-21,千亿龙头被错估？分众传媒二季度净利7.86亿,环球老虎财经
1609,2020-08-21,龙虎榜：2.25亿资金涌入分众传媒孙哥加仓打板沧州明珠,金融界
1610,2020-08-21,8月21日龙虎榜，机构青睐这14股,证券时报网
1611,2020-08-21,影院广告骤降85%！这家千亿传媒巨头却涨停了,中国基金报
1612,2020-08-21,8月21日主力资金净流出201亿元,证券时报网
1613,2020-08-21,分众传媒中报亮眼今日涨停，外资交投活跃,Wind
1614,2020-08-21,分众传媒(002027)2020年上半年业绩点评：净利增长超预期 成本管控有效 盈利弹性空间大,新浪
1615,2020-08-21,中报点评 | 分众传媒：中报超预期，持续重点推荐高经营杠杆下，需求复苏带来利润高弹性,CSC传媒互联网研究
1616,2020-08-21,结束连续6个季度的利润下滑 分众传媒走出低谷期了吗？ 盈利能力下降,新浪
1617,2020-08-21,覆盖3.1亿城市主流人群，分众传媒逆势增长上半年净利润超8亿,每日经济新闻
1618,2020-08-21,分众传媒半年营收46亿元 二季度楼宇媒体日消品广告收入逆势增长25%,中国证券网
1619,2020-08-21,分众传媒大数据创新产品获客户认可效果显现 未来发展被多家券商看好,和讯
1620,2020-08-21,中报业绩推动机构重仓股冲板，投资人直呼“反弹超预期”！,21世纪经济报道
1621,2020-08-21,消费大白马罕见冲击涨停，走势完爆科技股！业绩超预期股名单来了，这个特征出牛股（附股）,证券时报网
1622,2020-08-21,分众传媒(002027)走出疫情影响，持续复苏可期,杨仁文研究笔记
1623,2020-08-21,A股午盘综述：上证指数半日升0.78%，食品、日化、白酒、苹果板块造好,Wind
1624,2020-08-21,电梯里看直播？分众做不了“安静美男”,新浪
1625,2020-08-21,快讯：分众传媒涨停 报于7.01元,金融界
1626,2020-08-21,分众传媒计提资产减值准备1.97亿元 上半年净利8.23亿元 资产异常,资本邦
1627,2020-08-21,分众传媒盘中涨停！市值重回千亿,金融界
1628,2020-08-21,分众传媒高开7%,第一财经
1629,2020-08-21,A股异动 | 分众传媒(002027.SZ)涨停 上半年扣非净利同比增长62.9%,格隆汇
1630,2020-08-21,传媒板块拉升 分众传媒、金科文化涨停,中证网
1631,2020-08-21,分众传媒(002027)：Q2业绩好于预期 客户结构持续改善,新浪
1632,2020-08-21,分众传媒封住涨停板，上半年扣非净利同比增长62.9%,Wind
1633,2020-08-21,歌尔股份、韦尔股份、分众传媒集体大幅高开，受益于中报业绩利好,Wind
1634,2020-08-21,上调评级至买入策略选股（8月21日）,Wind
1635,2020-08-21,分众传媒(002027)：业绩大超预期 经营拐点已现,新浪
1636,2020-08-20,分众传媒第二季度逆市增长，千亿龙头被市场错估了吗？,读懂财经
1637,2020-08-20,晚间重要公告2020年8月20日星期四,Wind
1638,2020-08-20,业绩快报 | 分众传媒上半年实现营收46.1亿，扣非净利同比增长62.9%,36氪
1639,2020-08-20,分众传媒半年报营收46亿二季度快消品广告同比增25％,雷帝触网
1640,2020-08-20,分众传媒：上半年营收46.1亿元 二季度快消品同比增长25%,中证网
1641,2020-08-20,众半年营收46亿 Q2楼宇媒体日用消费品广告收入增25％,和讯
1642,2020-08-20,分众传媒半年报出炉：上半年净利润8.23亿元 月线五连阳走高,金融界
1643,2020-08-20,分众传媒2020半年报营收46亿元 净利润8.23亿元,新浪
1644,2020-08-20,分众传媒：今年上半年营业收入46.11亿元，同比减少19.35% 盈利能力下降,36氪
1645,2020-08-20,分众传媒(002027.SZ)：上半年扣非净利升62.90%至6.22亿元,格隆汇
1646,2020-08-20,分众传媒：上半年净利润8.23亿元，同比增长5.85%,Wind
1647,2020-08-20,分众传媒：2020年上半年计提资产减值准备1.97亿元 资产异常,Wind
1648,2020-08-19,过气广告公司的复活：分众传媒半年报出炉即涨停,36氪
1649,2020-08-18,"分众传媒现1笔大宗交易 共成交5,940.00万元",新浪
1650,2020-08-18,北向资金动向盘点：重手加仓金融，大幅减仓白酒、医药,Wind
1651,2020-08-17,深港通十大成交活跃股排名（8月17日）,Wind
1652,2020-08-17,龙虎榜机构新动向：净买入14股 净卖出10股,证券时报
1653,2020-08-17,北向资金连续两日大幅净流入，平安银行获净买入9.73亿元居首,Wind
1654,2020-08-17,龙虎榜：分众传媒放量涨停 北向资金净买入约6.5亿元,e公司
1655,2020-08-17,分众传媒放量涨停，外资大手笔买入,Wind
1656,2020-08-17,大金融领涨，机构热议A股风格转换,Wind
1657,2020-08-17,传媒行业：调整出现买入良机 继续推荐绩优龙头,新浪
1658,2020-08-17,快讯：分众传媒涨停 报于6.73元,金融界
1659,2020-08-17,8月17日早盘主力巨资抢筹四大板块(附股),金融界
1660,2020-08-14,看完“初恋脸”腾讯业绩，我对广告行业有些看法,钛媒体
1661,2020-08-13,A股共发生82宗大宗交易成交18.16亿元（8月13日）,Wind
1662,2020-08-13,"分众传媒现1笔大宗交易 共成交1,611.97万元",新浪
1663,2020-08-13,A股融资融券日报：两融余额减少34.17亿元（8月12日）,Wind
1664,2020-08-13,传媒行业月报：游戏行业上半年增长 影院复工政策解禁 8月中报季来临 解禁,新浪
1665,2020-08-12,洽洽食品(002557)：Q2业绩超预期 期待坚果乘风破浪,新浪
1666,2020-08-12,2020年传媒行业中期投资策略报告：在线互联经济逆风飞翔 线下文娱服务向阳而生 推荐游戏流媒体 关注影视院线性价比,新浪
1667,2020-08-11,洽洽食品(002557)半年报点评：瓜子高增 坚果加速 业绩表现超预期,新浪
1668,2020-08-10,2020中国品牌节年会颁奖盛典圆满结束 “华谱奖”隆重揭晓,新浪
1669,2020-08-06,A股融资融券日报：两融余额增加126.72亿元（8月5日）,Wind
1670,2020-08-05,传媒互联网行业6月广告市场回顾：行业基本恢复 梯媒同比保持双位数增长,新浪
1671,2020-08-02,成为江南春的对手？碧桂园服务15亿收购城市纵横,观点地产网
1672,2020-08-01,方正传媒·数据周报·20H1中国手游收入同比增36%，8月中报季关注绩优个股｜2020年第31周,杨仁文研究笔记
1673,2020-07-28,20Q2公募基金配置传媒行业跟踪报告：传媒配置市值大幅提升 头部效应持续,光大证券
1674,2020-07-28,中国奶酪新势力——吉士汀奶酪强势发力，奶酪市场即将大洗牌？,凤凰网
1675,2020-07-28,传媒行业周报：市场波动中拥抱绩优股 继续坚守游戏视频龙头,新浪
1676,2020-07-28,2020中国企业国内外并购现状及并购策略研究预测报告,中研网
1677,2020-07-28,本金损失近90%！华宝信托投资人巨亏，背后有猫腻？ 重大损失,国际金融报
1678,2020-07-28,研发三厢车载投屏技术，「迈锆科技」要做移动的“分众传媒”,创业邦
1679,2020-07-27,新三板精选层过半破发！最新基金抱团股请及时收藏,证券时报网
1680,2020-07-27,传媒本周观点：CHINAJOY举办在即 关于云游戏板块相关催化及营销需求复苏下投资机会,新浪
1681,2020-07-27,洽洽食品(002557)点评：瓜子稳健前行 坚果乘风破浪 维持买入,新浪
1682,2020-07-27,瑞幸造假事件背后一个被忽略的公司：分众传媒,网易
1683,2020-07-27,传媒周报：无惧短期波动 业绩期握紧龙头,新浪
1684,2020-07-26,分众传媒，至暗时刻已过,和讯
1685,2020-07-26,传播与文化行业周报：恒生科技指数利好互联网 CJ将于7.31开幕,国金证券股份有限公司
1686,2020-07-26,【中泰传媒—周观点】传媒板块连续三季度获超配，持续关注在线娱乐与在线消费,传媒产业大视点
1687,2020-07-25,方正传媒44页数据周报·《最强蜗牛》登顶港澳台免费榜，全国影院复工率38.3% ｜2020年第29周,杨仁文研究笔记
1688,2020-07-24,六公司“赶考”创业板，多家机构现身股东榜,Wind
1689,2020-07-22,公募基金A股二季报出炉，17张图纵览持仓变化,Wind
1690,2020-07-22,分众传媒(002027)：从经营杠杆和ROE 的角度 关注需求周期复苏下分众传媒投资机会,新浪
1691,2020-07-20,“狠人”业之峰 逼出来的“十年质保”动了谁的奶酪？,乐居财经
1692,2020-07-20,互联网传媒行业周观点：影院时隔半年后复工 关注回调后主线配置机遇,新浪
1693,2020-07-17,家居业面对疫情大考，柯建生详解索菲亚高分答卷,金融投资网
1694,2020-07-16,分众传媒只赚热闹难赚钱？,云掌财经
1695,2020-07-16,梯媒两强争霸背后：2个月歇业，平台全年超10%成本打水漂,和讯
1696,2020-07-16,传媒互联网行业周报：中报季将至 把握业绩优秀的龙头公司,新浪
1697,2020-07-15,传媒互联网行业周报：关注云游戏等5G应用逐步落地带来投资机遇,新浪
1698,2020-07-14,被股东分众传媒指其助贷模式存“兜底” 数禾科技备受质疑,和讯
1699,2020-07-13,互联网传媒行业周观点：中报季将至 关注增长主线兑现&复苏主线回暖,新浪
1700,2020-07-13,立思辰（300010.SZ）：定增拟募资不超过13亿元，助力大语文“新五大梦想”照进现实 | 方正教育姚蕾,杨仁文研究笔记
