,2021-12-31,马笑传媒互联科技团队：2021年报告汇总,微信
0,2021-12-31,33股获券商买入评级，中新药业目标涨幅达68.41%,Wind
1,2021-12-30,【30日资金线路图】罕见！沉寂多年的传媒股爆发，分众传媒等获主力资金青睐,证券时报
2,2021-12-30,年报行情袭来！分众传媒暂列预增王，化工、电子板块表现出色,财联社
3,2021-12-30,分众传媒：公司已在智能屏领域向授权代理商开放了DSP系统,每日经济新闻
4,2021-12-29,北向资金年末交投持续低迷净买入逾6亿元，连续4日加仓宁德时代累计扫货超20亿,Wind
5,2021-12-29,北向资金动向盘点：连续净买电新，王者已归来？,Wind
6,2021-12-29,北向资金净买入13亿元，增持银行电池，扫货这些个股,21世纪经济报道
7,2021-12-28,美团连通快手：瞄准的不只是抖音,新浪
8,2021-12-28,国美折上折与分众传媒强强联合助力品牌摆脱流量之困,砍柴网
9,2021-12-28,北向资金假期后首日加仓近13亿，兴业银行、宁德时代净买入均超5亿元,Wind
10,2021-12-27,每周一报：长视频进入提价周期 盈利有望进一步改善,新浪
11,2021-12-27,分众传媒：分众特卖为公司与合作伙伴基于线下场景进行的新的业务尝试,每日经济新闻
12,2021-12-27,文化传媒行业周报：冬奥会召开在即 低位个股表现活跃,渤海证券
13,2021-12-25,103家公司预告2021年业绩，逾八成报喜,Wind
14,2021-12-24,网生品牌进退失据的尴尬，怎么破？,雪球
15,2021-12-23,净利超 90% 上市公司，“洗脑广告大户”也开始做电商了,ZAKER
16,2021-12-23,北向资金加仓近25亿结束连续4日净卖出，宁德时代净买入4.74亿元,Wind
17,2021-12-23,留给浑水做空的中概股“不多了” 被出具沽空报告,证券之星
18,2021-12-23,分众传媒今日大宗交易成交300万股，成交价7.75元溢价0.0%,Wind
19,2021-12-23,新势力品牌崛起，看分众传媒如何引爆线下,凤凰网
20,2021-12-23,中泰证券：关注虚拟人商业化投资趋势,财联社
21,2021-12-22,最高增幅超10倍！近百家A股公司披露全年业绩预告,Wind
22,2021-12-22,新潮传媒董事长张继学：电梯广告行业景气度走高，行业数字化转型需加速,每日经济新闻
23,2021-12-20,"分众传媒现1笔大宗交易 共成交1,341.12万元",新浪
24,2021-12-20,分众传媒今日大宗交易成交176万股，成交价7.62元溢价0.0%,Wind
25,2021-12-20,中国消费品牌崛起的硬核方法是什么？,雪球
26,2021-12-19,传媒行业：《幻塔》首日流水破5000万 爱奇艺宣布会员提价,广发证券
27,2021-12-18,富时中国指数成分股大调整，外资布局2022年,Wind
28,2021-12-17,分众传媒：公司目前已覆盖超过3.1亿中国城市主流人群,每日经济新闻
29,2021-12-17,北向资金结束连续12日净买入，药明康德遭大幅抛售超10亿元,Wind
30,2021-12-17,重度投入分众传媒，妙可蓝多抢占中国奶酪“蓝海市场”,凤凰网
31,2021-12-17,分众传媒：分众特卖为公司与合作伙伴基于线下场景进行的新的业务尝试,每日经济新闻
32,2021-12-17,分众传媒：今年刊例价已有所上调,财联社
33,2021-12-16,23股今日获机构买入评级,证券时报网
34,2021-12-15,国金证券：给予分众传媒买入评级，目标价位10.1元,证券之星
35,2021-12-15,传媒互联网行业周报：虚拟人概念空前火热 仍看好后续影视复苏,新浪
36,2021-12-15,谁动了中国的奶酪市场？,I黑马
37,2021-12-15,分众传媒：公司目前未涉及数字藏品业务,Wind
38,2021-12-15,互联网广告增速放缓，新政下行业面临新挑战,Wind
39,2021-12-14,分众传媒发生大宗交易 成交溢价率2.78%,证券时报网
40,2021-12-14,北向资金再度扫货超60亿，连续7日抢筹东方财富累计加仓超近61亿元,Wind
41,2021-12-14,分众传媒今日大宗交易成交182.03万股，成交价8.13元溢价2.78%,Wind
42,2021-12-14,江南春：流量红利结束 品牌红利正开启,中新网
43,2021-12-14,户外广告B2B产业互联网平台：找广网宣布已完成Pre-A近千万融资,凤凰网
44,2021-12-14,元宇宙满屏涨停，北上资金爆买金融白酒,Wind
45,2021-12-13,每周一报：数字产业融合发展 行业迎来重要机遇,新浪
46,2021-12-13,传统蓝筹“王者归来”，市场风格切换在即？,Wind
47,2021-12-13,北向资金连续9日净买入累计加仓近700亿，爆买东方财富超17亿,Wind
48,2021-12-13,分众上线分众特卖 网友：现在电商都内卷到电梯了吗？,新浪
49,2021-12-13,新消费品牌们：困了累了该怎么破？,亿邦动力
50,2021-12-11,基金年末排名，肥了分众传媒,新浪
51,2021-12-10,【经纬晚班车】马斯克称考虑辞职当全职网红 一度告诉员工公司或破产,中新经纬
52,2021-12-10,分众传媒1月至今获得政府补助4.18亿元,乐居财经
53,2021-12-10,分众传媒(002027.SZ)累计收到与收益相关的政府补助4.18亿元,智通财经
54,2021-12-10,北向资金本周净买入额创历史新高，连续6日抢筹贵州茅台累计加仓超47亿,Wind
55,2021-12-10,分众传媒：公司及子公司获得政府补助共计约4.18亿元,每日经济新闻
56,2021-12-10,分众传媒12月10日大宗交易成交790.00万元,证券时报网
57,2021-12-10,分众传媒现1笔大宗交易 共成交790.00万元,新浪
58,2021-12-10,分众传媒今日大宗交易成交100万股，成交价7.9元溢价0.0%,Wind
59,2021-12-10,传媒板块崛起，分众传媒涨超3%，消费龙头ETF（516130）7连涨！,金融界
60,2021-12-10,分众传媒连续大涨，传媒ETF（159755）量价齐升,资本邦
61,2021-12-10,一图解码：2021全年业绩抢先看！预喜超八成多分布在医药生物行业,财华社
62,2021-12-10,融资客青睐7股，长江通信买入占比高达38.22%,Wind
63,2021-12-09,深港通十大成交活跃股排名（12月9日）,Wind
64,2021-12-09,北向资金狂买A股超200亿净买入额创历史次高，继续大幅抢筹白酒股,Wind
65,2021-12-09,A股资金流向：金融、消费持续回暖，外资助推风格切换,Wind
66,2021-12-09,分众传媒收涨9.03%，现报7.73元,乐居财经
67,2021-12-09,快讯：分众传媒涨停 报于7.8元,金融界
68,2021-12-09,跨年行情继续火热，A50ETF（159601）涨超1%再创新高,Wind
69,2021-12-09,管理费降至0%，基民却开心不起来，发生了什么？,Wind
70,2021-12-08,面临着被摘牌的危机，美国人才知道FF是造车骗局？,Ofweek
71,2021-12-08,A股融资融券日报：两融余额减少43.44亿元（12月7日）,Wind
72,2021-12-08,财信证券传媒行业2021年11月报：游戏版号有望近期重启，关注贺岁档跨年行情,财信证券研究
73,2021-12-07,传媒互联网12月投资策略：元宇宙催化行情表现 持续关注游戏板块,新浪
74,2021-12-07,北向资金今日净买入79.49亿元，继续抄底大金融板块,Wind
75,2021-12-07,开源证券：冬奥会带来冰雪产业新机遇,财联社
76,2021-12-07,传媒行业：滴滴拟美股退市回港上市 微信群聊将试行电商外链直接访问 退市,广发证券
77,2021-12-06,文化传媒行业周报：行情有所低迷 中线继续看好,渤海证券
78,2021-12-06,快手升级电商分销平台 字节跳动火山引擎上线全系云产品,中泰证券
79,2021-12-06,北向资金连续4日净买入累计加仓超150亿，大幅抢筹券商、银行股,Wind
80,2021-12-06,年报预增股来了！三大行业表现亮眼，9股净利预计翻倍,Wind
81,2021-12-06,传媒行业周报：国内软实力出海 板块未来可期,新浪
82,2021-12-06,传媒行业月报：行业PPT报告元宇宙相关投资并购热度持续 积极关注行业拐点,国海证券
83,2021-12-06,63家上市公司披露全年业绩预告，逾八成预喜,Wind
84,2021-12-05,2021中国上市公司软实力巡礼：分众传媒价值76.29亿元 排序第64名,搜狐
85,2021-12-03,分众传媒现1笔大宗交易 共成交556.80万元,新浪
86,2021-12-03,分众传媒今日大宗交易成交87万股，成交价6.4元折价9.48%,Wind
87,2021-12-02,分众传媒大宗交易成交87.00万股 成交额678.60万元,证券时报网
88,2021-12-02,分众传媒现1笔大宗交易 共成交678.60万元,新浪
89,2021-12-02,分众传媒今日大宗交易成交87万股，成交价7.8元溢价9.7%,Wind
90,2021-12-01,分众传媒赴港IPO申请已获证监会接收材料 加速推进海外市场业务布局,e公司
91,2021-12-01,北向资金12月首个交易日加仓A股30亿，紫光国微净买入超6亿元,Wind
92,2021-12-01,年报业绩预增股来了，7家公司预计业绩翻倍增长,Wind
93,2021-11-30,证监会：分众传媒(002027.SZ)境外首次公开发行股份申请已获接收材料,智通财经
94,2021-11-30,每周一报：积极拥抱新兴技术 行业机遇不断涌现,新浪
95,2021-11-29,传媒行业周报：娱乐明星网上信息进一步规范 互联网广告新规征求意见稿发布,新浪
96,2021-11-29,发出退市警告，美国人才知道FF是造车骗局？ 风险警示,搜狐
97,2021-11-29,传媒互联网行业：互联网广告管理办法公开征求意见 青瓷游戏通过港交所聆讯,新浪
98,2021-11-29,传媒互联网周报：《长津湖》成中国影史票房冠军 互联网广告管理办法发布,新浪
99,2021-11-28,传媒行业周报：《互联网广告管理办法》公开征求意见；网易云音乐即将在港上市,广发证券
100,2021-11-27,还呗广告标语引争议，担保费超利息近四倍，网友曝出仅下载过APP就遭到近三年的电话骚扰,中国经济网
101,2021-11-26,北向资金净卖出近45亿结束连续5日净买入，招商银行净卖出超6亿元,Wind
102,2021-11-26,年报业绩预告提前看！近八成公司预喜，谁是预增王？,证券之星
103,2021-11-26,年报业绩提前看，6家公司预计全年净利翻倍,Wind
104,2021-11-26,年报业绩提前看 6家公司预计全年净利翻倍,证券时报
105,2021-11-25,元宇宙概念龙头在列，年报预增股曝光，6股业绩翻倍,Wind
106,2021-11-25,元宇宙概念龙头在列，年报预增股曝光，6股透露业绩翻倍（名单）,第一财经
107,2021-11-24,北向资金连续4日净买入累计加仓超170亿，批量扫货白酒股,Wind
108,2021-11-24,英科医疗：已与分众传媒、新潮传媒合作,每日经济新闻
109,2021-11-23,9家公司预计增幅超100%！一批公司已预告2021全年业绩,中证报
110,2021-11-23,“梯媒”龙头筹划赴港上市！业绩增长承压分众传媒何去何从？ 盈利能力下降,投资时报
111,2021-11-23,新时代传媒周报：《演出经纪人员管理办法》公开征求意见 元宇宙的探讨将会持续进行,新浪
112,2021-11-22,传媒行业周报：新技术趋势持续扩散 成长空间提振板块信心,新浪
113,2021-11-22,市场资金面周观察：股市流动性回暖 银行间资金偏紧,新浪
114,2021-11-22,北向资金今日净买入14.35亿元，宁德时代再获大幅净买入近17亿,Wind
115,2021-11-22,渤海证券：传媒行业基本面进入底部回升区间 关注出版和广告细分子行业,证券时报网
116,2021-11-22,毁三观的借贷广告：让你犯恶心的同时，再欠个债,ZAKER
117,2021-11-22,传媒互联网行业：数据安全新规将至 互联网安全边界设立愈加明确,新浪
118,2021-11-22,分众传媒(002027)：整装待发盼春来,新浪
119,2021-11-22,关注头部互联网公司新业务拓展及冬奥会投资机会,金融界
120,2021-11-21,传媒行业投资策略：顺应政策 拥抱变革 重启成长,新浪
121,2021-11-21,这家金融科技公司广告词引争议 网友：底线还成了“加分项”?,华夏时报
122,2021-11-19,北向资金今日大幅净买入近83亿，再度爆买宁德时代超14亿,Wind
123,2021-11-19,分众传媒：公司暂无元宇宙相关业务,Wind
124,2021-11-19,分众传媒：RECP政策对公司现有业务短期尚无实质性影响,Wind
125,2021-11-19,分众传媒：目前公司暂无元宇宙相关计划,每日经济新闻
126,2021-11-19,北向资金减持榜单：22股减持市值超亿元 减持股份,证券时报网
127,2021-11-19,北向资金动向盘点：反手减持食品饮料、医药,Wind
128,2021-11-19,北向资金抛售医药白酒，买入元宇宙、锂电概念（附股）,21世纪经济报道
129,2021-11-18,北向资金今日净卖出44.53亿元，传统核心资产集体遭抛售,Wind
130,2021-11-18,"分众传媒现2笔大宗交易 共成交1,761.68万元",新浪
131,2021-11-18,分众传媒今日大宗交易成交244万股，成交价7.22元溢价0.14%,Wind
132,2021-11-18,“数据会说话”之2021年10月数据解读：10月社零数据符合预期 看好中国消费韧性,新浪
133,2021-11-18,北向资金抛售白酒，买入电子元件！锂电池板块“王者归来”，这些个股受青睐（名单）,21世纪经济报道
134,2021-11-18,年末密集调研，海外资管巨头盯上A股“便宜货”,Wind
135,2021-11-17,A股资金流向：赛道股集体反弹，资金抢筹新能源龙头,Wind
136,2021-11-17,传媒互联网行业周报：元宇宙引领传媒互联网新时代,新浪
137,2021-11-17,还呗APP奇葩广告词引争议，平台运营主体系分众传媒旗下小贷公司,AI财经社
138,2021-11-17,传媒行业每周一报：行业市场表现亮眼 持续性还看基本面,新浪
139,2021-11-16,品渥食品：公司正式与分众传媒达成战略合作,每日经济新闻
140,2021-11-16,传媒行业投资策略周报：工信部解读“信息通信服务感知提升行动”；国内十月游戏市场持续增长,广发证券
141,2021-11-16,北向资金再度加仓近42亿连续4日净买入，批量扫货白酒医药股,Wind
142,2021-11-16,北向资金动向盘点：底部净买医药,Wind
143,2021-11-15,北向资金连续3日净买入累计加仓近160亿，中国中免获净买入超6亿元,Wind
144,2021-11-15,文化传媒行业周报：行情持续活跃 关注题材+业绩主线,渤海证券
145,2021-11-15,【中泰传媒】Q3总结及展望：持续看好线上娱乐消费及线下场景复苏，重点关注游戏板块投资机会,传媒产业大视点
146,2021-11-15,分众传媒现1笔大宗交易 共成交750.00万元,新浪
147,2021-11-15,分众传媒今日大宗交易成交100万股，成交价7.5元折价0.79%,Wind
148,2021-11-15,渤海证券：传媒行业基本面进入底部回升区间,证券时报网
149,2021-11-15,传媒互联网数据月报：10月手游回暖;国庆档及进口片推动影市环增,新浪
150,2021-11-15,A股融资融券日报：两融余额减少22.02亿元（11月12日）,Wind
151,2021-11-15,互联网传媒周报：从英伟达看元宇宙+互联互通,新浪
152,2021-11-12,分众传媒：公司目前暂无相关业务,Wind
153,2021-11-12,出海、上市，分众传媒还能再造一个“分众”吗？,Ofweek
154,2021-11-11,北向资金减持市值超亿元股票（附名单）,证券时报网
155,2021-11-10,北向资金大举出货超百亿连续4日净卖出，房地产产业链持续遭抛售,Wind
156,2021-11-10,分众传媒拟赴港二次上市，江南春葫芦里卖的什么药？,中金在线
157,2021-11-09,传媒互联网行业10月月报：2022年进口片边际改善 票房有望复苏,广发证券
158,2021-11-09,监管重拳出击，券商“大V”引流开户叫停！年报提前看，29股业绩有惊喜,新浪
159,2021-11-09,财信证券传媒行业2021年10月数据跟踪：2021年中国游戏市场仍为正增长，关注职教政策利好,财信证券研究
160,2021-11-08,财华洞察|启动赴港上市，分众传媒（002027.SZ）意欲何为？,财华社
161,2021-11-08,首席消费官周报：海底捞回应关停门店 盛天网络收关注函 业务变化,腾讯网
162,2021-11-08,分众传媒筹划赴港上市 在资本市场身影颇为活跃,北京日报
163,2021-11-08,A股融资融券日报：两融余额减少121.85亿元（11月5日）,Wind
164,2021-11-08,分众传媒三季报的潜台词,锦缎
165,2021-11-07,分众传媒(002027)重大事项点评：公司拟赴港上市 国际化征程或加速,新浪
166,2021-11-05,北向资金结束连续6日净买入，隆基股份连续3日遭抛售累计净卖出超30亿,Wind
167,2021-11-05,分众传媒今日大宗交易成交266万股，成交价7.55元溢价1.62%,Wind
168,2021-11-05,广告业千亿巨头计划赴港上市 股价较年内高点跌近40%,中新经纬
169,2021-11-05,年内股价跌超两成！分众传媒欲赴港上市，第四季度净利或下滑 盈利能力下降,中新经纬
170,2021-11-05,分众传媒计划赴港上市，目前部分海外业务已实现盈利,阿尔法工场
171,2021-11-05,32股受青睐，北向资金增持额超亿元,证券时报网
172,2021-11-05,分众传媒(002027)：拟在香港上市 推进海外拓展 资金实力将进一步增强,广发证券
173,2021-11-05,分众传媒(002027)：业绩稳健 关注广告市场需求周期变化,新浪
174,2021-11-05,犀牛财经早讯：中青宝再收关注函 同力日升收到问询函 关注函,GPLP犀牛财经
175,2021-11-05,千亿龙头赴港上市！这次all in海外市场，28万股民炸锅,中证报
176,2021-11-05,分众拟香港上市：瞄准海外百亿市场 要在海外再造分众,36氪
177,2021-11-05,千亿巨头放大招，要去香港再上市！,中国基金报
178,2021-11-04,11月5日十大利好公告：分众传媒筹划发行H股股票并在香港上市,上证报
179,2021-11-04,晚间重要公告2021年11月4日星期四,Wind
180,2021-11-04,分众传媒筹划赴港上市 预计全年净利润逾60亿元,e公司
181,2021-11-04,马云的私募：汇集史玉柱等大佬 云锋基金如何抱团投资？,凤凰网
182,2021-11-04,分众传媒：筹划发行H股股票并在香港上市，前三季度盈利44亿,资本邦
183,2021-11-04,分众传媒(002027.SZ)选举何培芳为职工监事,智通财经
184,2021-11-04,分众传媒(002027.SZ)筹划H股IPO相关事项 具体细节尚未确定,智通财经
185,2021-11-04,每经18点丨深圳住建局召集佳兆业和花样年参加专题会议，讨论流动性问题；北向资金净卖出隆基股份近9亿元；分众传媒筹划发行H股股票,每日经济新闻
186,2021-11-04,分众传媒(002027.SZ)：拟发行H股并在香港联交所主板上市,格隆汇
187,2021-11-04,分众传媒：拟申请在港交所上市,财联社
188,2021-11-04,分众传媒：计划发行境外上市外资股（H股）并申请在香港联合交易所有限公司主板挂牌上市,36氪
189,2021-11-04,分众传媒：筹划发行H股股票并在香港上市,Wind
190,2021-11-04,海外机构争相调研机器人龙头，机械设备行业备受关注,Wind
191,2021-11-04,A股融资融券日报：两融余额减少44.29亿元（11月3日）,Wind
192,2021-11-04,A股传媒三季报总结：游戏有回暖信号 梯媒体现韧性,新浪
193,2021-11-03,北向资金连续5日净买入，隆基股份遭大幅抛售超16亿元,Wind
194,2021-11-03,分众传媒(002027)：业绩及预告符合预期 梯媒韧性凸显,新浪
195,2021-11-02,分众传媒(002027)：经营节奏恢复正常 龙头优势持续巩固,新浪
196,2021-11-02,传媒行业：游戏拐点确认 部分子行业受到监管以及疫情等因素影响,广发证券
197,2021-11-02,传媒行业三季报业绩综述：业绩持续回升 关注三季报表现优秀的龙头,渤海证券
198,2021-11-02,北向资金连续4日净买入累计扫货近150亿，新能源龙头股集体获抢筹,Wind
199,2021-11-02,九牧王(601566)：品牌革新效果逐渐显现 短期费用支出较大,新浪
200,2021-11-02,分众传媒(002027)：业绩符合预期 行业良性竞争 公司利润弹性强,新浪
201,2021-11-01,业绩快报｜前三季度净利润同比翻倍，分众传媒走出疫情阴影了吗？,36氪
202,2021-11-01,国海证券维持分众传媒买入评级，三季报点评：21Q3单季收入同比增长17%，客户回款良好,每日经济新闻
203,2021-11-01,分众传媒可以投资了吗？,雪球
204,2021-11-01,分众传媒(002027)：业绩符合预期 楼宇广告价值凸显,新浪
205,2021-11-01,图解分众传媒三季报：第三季度单季净利润同比增10.39%,证券之星
206,2021-11-01,东吴证券维持分众传媒买入评级，2021年三季报点评：业绩符合市场预期，客户结构持续优化,每日经济新闻
207,2021-11-01,华安证券：给予分众传媒增持评级,证券之星
208,2021-11-01,华安证券维持分众传媒增持评级：需求增长稳健，看好公司长期价值,每日经济新闻
209,2021-11-01,"思维独角兽 | 日本角川集团：腾讯将以超17亿人民币收购角川股份；巨人网络：第三季度归母净利润为3亿元，同比减少3.37%
盈利能力下降",中金在线
210,2021-11-01,分众传媒注册资本减少1.6%至144.42亿元 减资破产,乐居财经
211,2021-10-31,平安证券：给予分众传媒买入评级,证券之星
212,2021-10-30,犀牛日讯：美的集团第三季度净利84.46亿 海天味业第三季度净利13.55亿,GPLP犀牛财经
213,2021-10-30,181股获买入评级 最新:白云机场,中财网
214,2021-10-30,分众传媒：预计2021年全年盈利60.20亿至62.00亿元,资本邦
215,2021-10-29,公告精选：招商轮船拟收购中外运集运；ST柏龙时任董事长陈伟雄等被终身市场禁入 其他违规处罚,e公司
216,2021-10-29,分众传媒：2021年净利预增50.36%-54.85%,e公司
217,2021-10-29,分众传媒2021年度净利润预增50.36%-54.85%,上证报
218,2021-10-29,分众传媒(002027.SZ)：前三季度净利升100.81%至44.23亿元,格隆汇
219,2021-10-29,推进国际化战略，分众传媒计划在港交所主版上市,亿欧网
220,2021-10-29,分众传媒前三季度营收111亿元，利润上涨100%,亿欧网
221,2021-10-29,分众传媒：2021年预计净利润同比增长50.36%~54.85%,Wind
222,2021-10-29,分众传媒：第三季度净利润15.22亿元 同比增长10.39%,财联社
223,2021-10-29,分众传媒：前三季度净利润同比增长100.81%,Wind
224,2021-10-29,传媒互联网行业周报：看好传媒高安全垫龙头,新浪
225,2021-10-28,北向资金逆市加仓超71亿，贵州茅台获大幅净买入13亿元,Wind
226,2021-10-27,史上最富马斯克！9个月赚巴菲特90年的钱,Wind
227,2021-10-27,每周一报：三季报行情渐次展开 关注超预期优质标的,新浪
228,2021-10-26,北向资金再度净买入超8亿，连续9日抢筹宁德时代累计加仓超55亿,Wind
229,2021-10-26,A股融资融券日报：两融余额增加78.07亿元（10月25日）,Wind
230,2021-10-26,【传媒】行情轮动特征明显，精选三季报业绩优秀个股——文化传媒行业周报——看好,渤海证券研究
231,2021-10-26,东证资管前三季11只基金跌超10% 总经理业绩同样欠佳,中国经济网
232,2021-10-25,传媒：谷歌拟下调基于订阅的应用抽成至15% 巨人拟收购淘米网络,国海证券
233,2021-10-22,"分众传媒现7笔大宗交易 共成交10,740.00万元",新浪
234,2021-10-22,传媒互联网行业周报：板块走势出现分化 看好传媒高安全垫龙头,新浪
235,2021-10-22,分众传媒10月21现4笔大宗交易,证券时报网
236,2021-10-21,"分众传媒现4笔大宗交易 共成交9,881.41万元",新浪
237,2021-10-20,传媒行业周报：头部新游有望吸引增量 看好行业长线发展,新浪
238,2021-10-19,传媒行业周报：高规格政策发布推动职教板块估值修复 国考招录人数同增超20%,国海证券
239,2021-10-19,品味各色美食，点亮校企创意——麦尖创意营销大赛正式启动！,凤凰网
240,2021-10-19,传媒行业：Q3国内手游同增9.09% 出海提速,新浪
241,2021-10-19,传媒行业Q3业绩前瞻：分化中寻找高景气公司,新浪
242,2021-10-18,文化传媒行业周报：行情表现中性 继续关注三季报表现,渤海证券
243,2021-10-18,北向资金净卖出额创近2个月新高，贵州茅台遭大幅抛售逾14亿元,Wind
244,2021-10-18,分众传媒：公司媒体点位租约期限约为1-3年,Wind
245,2021-10-17,传媒行业：进口片供应改善预期驱动影视院线修复；《原神》位列9月出海手游收入第一,广发证券
246,2021-10-17,传媒行业周报：龙头前三季度增长较快 我国影院银幕数突破8万块,新浪
247,2021-10-17,传媒行业周观察：职业教育再迎政策利好 搜狗并入腾讯,新浪
248,2021-10-15,传媒互联网双周报：国庆档票房良好 Q3游戏出海环比高增长,新浪
249,2021-10-15,分众传媒(002027.SZ)半年度每10股派2.08元,智通财经
250,2021-10-15,分众传媒(002027.SZ)半年度权益分派10派2.08元 股权登记日为10月21日,格隆汇
251,2021-10-14,A股融资融券日报：两融余额减少5.34亿元（10月13日）,Wind
252,2021-10-13,资金回流大消费！茅台王者归来，后市如何走,Wind
253,2021-10-13,传媒互联网行业周报：精品剧《鱿鱼游戏》爆火引领奈飞创股价新高,新浪
254,2021-10-13,分众传媒洞察人心红利，品牌营销抢占大众认知,凤凰网
255,2021-10-13,逆袭洋货的国牌标杆，是如何打赢翻身仗的？,搜狐
256,2021-10-12,北向资金成交缩量全天净卖出近14亿元，东方财富遭大幅净卖出6亿元,Wind
257,2021-10-12,跌超40%，分众传媒被严重低估？,新浪
258,2021-10-12,传媒行业周报：腾讯两款MOBA列畅销榜前2 新版《市场准入负面清单》征求意见稿发布,国海证券
259,2021-10-11,A股融资融券日报：两融余额增加127.02亿元（10月8日）,Wind
