2420,2019-01-03,"传媒行业周报2018第37期:网游审批恢复,仍应关注政策变动",正点财经
2421,2019-01-03,阿里赋能数字化分众 陈宝国期待合作新前景,凤凰网
2422,2019-01-03,阿里巴巴赋能数字化分众：面向3亿受众的精准投放如何打通线上线下,腾讯网
2423,2019-01-02,传媒互联网日报||分众传媒累计回购7亿元 ；中国电影获得中央国有资本经营预算1亿元【广发传媒 I 旷实团队】,实话传媒
2424,2019-01-02,马云150亿元入股5个月就腰斩 白马分众传媒再创新低,新浪
2425,2019-01-02,阿里携手分众推进“U众计划”,经济观察网
2426,2019-01-02,新年开局不利 2449点看上去有点悬——道达投资手记,每日经济新闻
2427,2019-01-02,阿里携手分众推U众计划品效协同 分众“种草”3亿人联动天猫品牌变现,证券日报
2428,2019-01-02,阿里巴巴赋能日活3亿数字化分众，与天猫端联动品效协同价值凸显,I黑马
2429,2019-01-02,分众传媒：出于谨慎性原则未在上月进行股份回购操作,TechWeb
2430,2019-01-02,今年限售股市值达2.66万亿元,羊城晚报
2431,2019-01-02,北上资金持续加仓“春季行情”,中证报
2432,2019-01-01,史上最大规模！美的集团40亿回购实施完毕，2018年回购金额过亿元公司已达百家,证券时报网
2433,2019-01-01,2019年解禁市值将超2.66万亿 1月迎高峰考验 解禁,金融界
2434,2018-12-29,2018年北上资金十大重仓股出炉 部分个股被逆势增持超1亿股,中证网
2435,2018-12-29,2019年限售股市值达2.66万亿元 三因素影响解禁股表现,大众证券报
2436,2018-12-28,下周1196亿市值限售股解禁，环比增逾1倍 解禁,Wind
2437,2018-12-27,盘点A股上市公司 谁是真正的房多多？,中财网
2438,2018-12-27,分众传媒77亿股解除限售股份1月2日上市流通 占总股本52.55%,TechWeb
2439,2018-12-26,[快讯]分众传媒771299万限售股1月2日解禁,中财网
2440,2018-12-26,"传媒行业:国务院发文支持文化企业发展,坚定看好传媒板块触底反弹",正点财经
2441,2018-12-25,"传媒行业2018年三季报前瞻暨十月投资策略:三季报业绩预告波澜不惊,行业估值处于历史低位",正点财经
2442,2018-12-25,大额回购+业绩预喜，这些超跌股已获北上资金“举牌” 盈利能力下降,证券时报
2443,2018-12-25,并购动态：阿里巴巴网络收购分众传媒5.28%股权,中金在线
2444,2018-12-24,分众传媒公布股东权益变动 阿里网络及关联方共持有7.99%股份,TechWeb
2445,2018-12-24,个股成交量骤增、骤减排行榜|2018年12月24日,云掌财经
2446,2018-12-24,"计算机行业周报:DRGs国家试点申报启动,医保改革再提速",安信证券
2447,2018-12-19,知商金融母公司汇桔网与分众传媒达成深度战略资本合作！,证券之星
2448,2018-12-18,"文化传媒行业周报:监管发文加快电影院建设,督促深化院线改革",首创证券
2449,2018-12-18,"传媒互联网周报(含全球互联网&教育):电影局发文标志文化传媒政策环境持续改善,推荐游戏及出版板块",申万宏源
2450,2018-12-17,2018年港资遭遇“滑铁卢”？数据告诉你他们的真正实力,每日经济新闻
2451,2018-12-17,A股低位震荡不改“聪明资金”流向 24股上演建仓大戏,证券日报
2452,2018-12-17,"计算机行业周报:个税抵扣新政实施在即,继续推荐财税信息化",安信证券
2453,2018-12-15,陈光明专户产品备案规模逾80亿 新基金相中哪些上市公司？,投资快报
2454,2018-12-15,年内492家公司推股份回购方案 陕西煤业等八大“回购王”浮出水面,证券日报
2455,2018-12-15,分众传媒 国内最大城市生活圈媒体网络,证券日报
2456,2018-12-14,广告板块午前异动拉升，省广集团、分众传媒涨逾3%,Wind
2457,2018-12-14,分众传媒面前的三座大山：新潮、毛利与解禁,新浪
2458,2018-12-14,年终盘点：2018年十大回购王 陕煤、美的等豪气出手,投资快报
2459,2018-12-13,国金策略李立峰：12月A股限售股解禁 我们需关注什么,国金证券
2460,2018-12-12,A股二十年，发生在我们身边的故事,大众证券报
2461,2018-12-12,【亿欧快讯】汇桔网与分众传媒达成深度战略资本合作,亿欧网
2462,2018-12-12,非票房收入成电影行业新增长点,证券时报
2463,2018-12-12,持续“地量”，A股估值处于历史大底位置,证券日报
2464,2018-12-12,A股整体市盈率不足14倍 38只年报预喜低估值股吸金2亿,证券日报
2465,2018-12-11,"文化传播行业周报:腾讯音乐IPO在即,数字音乐迎产业大发展",首创证券
2466,2018-12-08,年内逾2900亿元北上资金入场，中国平安等10只个股勇登“吸金榜”,Wind
2467,2018-12-08,分众传媒 构建最大城市生活圈媒体网络,证券日报
2468,2018-12-08,年内逾2900亿元北上资金入场 10只个股勇登“吸金榜”,证券日报
2469,2018-12-07,A股国际化步伐再加速，逾七成MSCI成份股受机构青睐,证券日报
2470,2018-12-06,77亿股解禁大潮将至：压垮分众传媒股价的最后一根稻草？,中新经纬
2471,2018-12-06,"传媒行业:精选个股,关注细分领域龙头和前期超跌标的",正点财经
2472,2018-12-06,富时中国A50指数将纳入宁德时代和中国铁建,Wind
2473,2018-12-05,分众传媒创始人江南春演讲,新浪
2474,2018-12-04,资金持续北上抄底 11月多只白马股获增持,每日经济新闻
2475,2018-12-04,放量上涨逾百亿元大单涌入A股，北上资金等三路资金现新动向,证券日报
2476,2018-12-03,广告巨头豪投“线下”群雄逐鹿能否水到渠成,证券之星
2477,2018-12-03,分众传媒累计回购9961万股公司股份 支付金额为7亿元,TechWeb
2478,2018-12-03,分众传媒：已累计回购7亿元股份,e公司
2479,2018-11-29,18股距机构目标价上涨空间超100%,证券时报
2480,2018-11-29,加仓金融白酒，北上资金持续净流入,中证报
2481,2018-11-28,董事长“豪赌”输光金立！有哪些上市公司遭遇了“无妄之灾”？,巨丰财经
2482,2018-11-27,被BAT盯上的线下楼宇广告,搜狐
2483,2018-11-26,一年估值突破20亿美金 瑞幸咖啡联手分众打破独角兽成长纪录,凤凰网
2484,2018-11-26,媒体：电梯媒体场景继续获巨头认可 荐10股,申万宏源
2485,2018-11-26,4000亿解禁洪峰12月抵达，2019年亦不乐观,Wind
2486,2018-11-26,北上资金上周合计净流出7亿 22只蓝筹股逆市吸金28亿,证券日报
2487,2018-11-25,上海电影拟签署影院广告项目合同 合同总金额达7.15亿元,TechWeb
2488,2018-11-23,分众传媒创始人江南春演讲,新浪
2489,2018-11-22,东证资管再踩两雷,证券市场周刊
2490,2018-11-22,东证资管再踩雷:华域汽车、分众传媒走弱 多基金受伤,证券市场周刊
2491,2018-11-20,京东数字科技加入“电梯间广告大战”,中证网
2492,2018-11-20,"传媒互联网周报(含全球互联网&教育):传媒板块强势反弹,幼儿园资产证券化受阻",申万宏源
2493,2018-11-19,分众传媒：扩张终端巩固竞争优势,中金公司
2494,2018-11-19,【传媒-焦娟】基金三季报传媒持仓分析：传媒已低配，持股更集中,安信证券研究
2495,2018-11-18,媒体：传媒已低配 持股更集中,安信证券
2496,2018-11-17,波司登良品铺子芝华士双11翻番 飞鹤奶粉破百亿背后有共同队友,凤凰网
2497,2018-11-16,149亿净资金流入 五大板块成资金热捧标的,证券之星
2498,2018-11-16,"分众传媒深度报告:电梯媒体价值重估,扩张锁定增量市场",正点财经
2499,2018-11-16,近200亿杠杆资金“抄底”，融资客押注这些强势股,证券时报
2500,2018-11-16,线上流量变现短板渐显 BAT纷纷杀向线下场景,投中网
2501,2018-11-15,飞鹤乳业持续携手分众传媒 瞄准主流人群,中证网
2502,2018-11-15,失算？ 贾跃亭未控股公司成广告行业黑马,华夏时报
2503,2018-11-15,融资客青睐50股，莫高股份买入占比高达45.13%,Wind
2504,2018-11-15,百度投资新潮传媒21亿 博弈阿里分众联盟,21世纪经济报道
2505,2018-11-14,阿里百度纷纷重金入局 线下广告市场加速裂变,每日经济新闻
2506,2018-11-14,百度战略投资新潮传媒 线下广告市场与阿里系交锋,新京报
2507,2018-11-14,影院广告骤降85%！这家千亿传媒巨头却涨停了,中国基金报
2508,2018-11-14,新潮传媒宣布融资21亿元，百度领投,国际金融报
2509,2018-11-14,新潮传媒获百度领投21亿元投资，与阿里系的分众PK线下广告,经济观察网
2510,2018-11-14,新潮传媒获百度战略领投21亿元 挑战分众传媒的底气更足了,中证网
2511,2018-11-13,媒体：游戏行业出海现状总结,长江证券
2512,2018-11-12,深港通十大成交活跃股排名（11月12日）,Wind
2513,2018-11-12,媒体：影视行业继续深入整治 双11再燃民众消费热情,中信建投
2514,2018-11-12,勇气可嘉！新潮拿10亿就想挑战江南春十几年构筑的分众传媒护城河？,阿尔法工场
2515,2018-11-12,让阿里巴巴亏损60亿的分众传媒，可以抄底吗？ 亏损,阿尔法工场
2516,2018-11-11,传新潮传媒获百度超15亿元投资后，分众传媒股价暴跌6.84%,腾讯网
2517,2018-11-11,信息科技：世界互联网大会闭幕 荐4股,渤海证券
2518,2018-11-11,媒体：看好进口片带动票房市场 荐12股,安信证券
2519,2018-11-09,分众传媒大跌6.84% 市值较年初缩水约1430亿元 连续下跌,腾讯网
2520,2018-11-09,新潮传媒被曝获百度40亿元投资 高管回应：消息不实,投中网
2521,2018-11-09,"文化传媒行业周报:三季报密集发布,优选细分龙头",中航证券
2522,2018-11-08,确认丨新潮传媒获百度、闻名投资共计15亿元战略投资，估值达120亿元,亿欧网
2523,2018-11-08,新潮传媒集团获百度投资 | 36氪独家,36氪
2524,2018-11-08,董秘解码：美好置业将于年底建成投产装配式建筑生产线,巨丰财经
2525,2018-11-07,不统计不知道，过去3年多，分众传媒竟偷偷吃下了这么多张“屏”,阿尔法工场
2526,2018-11-05,继大秀纽约之后波司登持续霸屏分众 引爆60城主力市场,凤凰网
2527,2018-11-05,分众传媒股价大跌5.02%,中金在线
2528,2018-11-04,媒体：关注基本面良好三季报资金面改善者 荐5股,和讯
2529,2018-11-03,分众传媒年内市值蒸发850亿 应收账款激增社保基金等减持 资产异常,中国网
2530,2018-11-02,分众传媒：公司未在2018年10月进行股份回购,TechWeb
2531,2018-11-02,分众传媒盘中大涨8.59% 市值再向1000亿挺进,腾讯网
2532,2018-11-01,"分众传媒:媒体资源点位扩张致成本增长,看好生活圈媒体龙头长期发展",正点财经
2533,2018-10-31,7000亿QFII伺机而动，三季度逆市加仓近50亿元,Wind
2534,2018-10-30,分众传媒龙虎榜数据（10月30日）,Wind
2535,2018-10-30,分众传媒大跌逾8%，机构多空混战,Wind
2536,2018-10-30,分众传媒重演财报见光死 应收票据及应收账款狂飙,中国经济网
2537,2018-10-30,快讯：分众传媒打开跌停 预计年报业绩略降,金融界
2538,2018-10-30,分众传媒第三季度净利增长22.8% 今日开盘股价大跌8.7%,腾讯网
2539,2018-10-30,分众传媒逾16万手卖单封住跌停，三季度净利不及预期,Wind
2540,2018-10-30,分众传媒早盘封跌停 成交额2.04亿元封单3.7万手,腾讯网
2541,2018-10-30,盘前必读公告：这些股不容错过！,巨丰财经
2542,2018-10-29,公告精选：多只白马股第三季度业绩“不达预期”，上市公司密集发布回购公告,每日经济新闻
2543,2018-10-29,媒体：投资逻辑不变 荐4股,开源证券
2544,2018-10-29,媒体：2018年年报前瞻下关注超跌标的 荐7股,国海证券
2545,2018-10-29,分众传媒公布第三季度财报 净利润同比增长5.73%,新浪
2546,2018-10-29,分众传媒前三季度净利48亿元 同比增22.8%,腾讯网
2547,2018-10-29,分众传媒：前三季度净利润48.1亿元，同比增长22.81%,Wind
2548,2018-10-29,日常消费品：重仓比例略回落 荐4股,长城证券
2549,2018-10-29,大消费板块大幅下挫，上证综指跌1%,Wind
2550,2018-10-29,中证报头版：公募基金三季度大手笔增持金融板块,中证报
2551,2018-10-29,【国君传媒】基金三季度传媒行业持仓分析：整体持续低配，聚焦细分行业龙头,国泰君安互联网传媒研究
2552,2018-10-24,快狗打车和分众传媒战略合作 到家集团将和分众有更深合作,腾讯网
2553,2018-10-23,A股共发生37宗大宗交易成交9.78亿元（10月23日）,Wind
2554,2018-10-23,分众传媒今日大宗交易成交365.70万股，成交价7.39元折价0.0%,Wind资讯
2555,2018-10-22,媒体：关注业绩成长标的 荐4股,开源证券
2556,2018-10-22,"传媒行业周报:三季报披露在即,关注业绩成长标的",开源证券
2557,2018-10-17,安信策略：A股基本面盈利结构变化下的信号和最优解,陈果A股策略
2558,2018-10-10,市值7681亿 四季度A股市场将迎限售股解禁大考,重庆商报
2559,2018-10-08,分众传媒累计回购约4980万股公司股份 耗资4亿元,TechWeb
2560,2018-10-08,分众传媒：已累计回购逾4亿元股份,e公司
2561,2018-10-04,分众传媒股票行情：业绩符合预期，加速扩张筑高行业竞争壁垒,西部证券
2562,2018-10-04,聚焦国庆档及三季报绩优股【申万互联网传媒】,微信
2563,2018-09-28,"分众传媒:领导者地位显著,重申买入",联讯证券
2564,2018-09-27,1249只A股纳入富时罗素（全名单）,券商中国
2565,2018-09-27,分众传媒：9月26日融资余额为9.17亿元，较前一日骤降5.93%,Wind资讯
2566,2018-09-26,A股已成香饽饽！6张图看外资在股、债之间大轮动,Wind
2567,2018-09-26,【北上资金跟踪周报】北上资金加速净买入，分众传媒为其持股增量之首,联讯金融
2568,2018-09-25,数据王：国庆前指数调整下的重点配置领域,巨丰财经
2569,2018-09-23,节后股市三大看点 8只个股有望突破大涨,中财网
2570,2018-09-21,北上资金加仓助贵州茅台重返700元,大众证券报
2571,2018-09-20,软银撤离A股事件调查：分众传媒等4股遭清仓，华大基因等3股仍持有,阿尔法工场
2572,2018-09-20,28亿净资金微弱流出 主力机构看空五类股,证券之星
2573,2018-09-20,A股放量反弹 10只龙头股备受机构青睐或具上涨潜力,证券日报
2574,2018-09-20,"2018年传媒行业中报总结:中报整体表现平淡,公司业绩分化",上海证券
2575,2018-09-19,"分众传媒:18Q2单季收入增速29%超预期,资源扩张进度超预期,维持“推荐”",方正证券
2576,2018-09-18,媒体：取消线上票补和限制服务费对电影行业的影响分析,长江证券
2577,2018-09-16,机构调研瞄准蓝筹价值标的 6只个股被机构联袂推荐,证券日报
2578,2018-09-14,CFi收盘揭秘:垃圾股走强 市场感觉有“任务”没完成,中财网
2579,2018-09-14,融资客青睐37股，东方集团买入占比高达55.30%,Wind
2580,2018-09-13,百亿私募调研猛增两倍，科技消费受关注,中证报
2581,2018-09-12,分众传媒:上半年楼宇广告高增长 资源拓展加快,西南证券
2582,2018-09-12,"国元传媒与互联网周报:电视剧上游去产能趋势明显,游戏板块有望走出政策阴霾",国元证券
2583,2018-09-10,媒体：继猫眼后腾讯音乐资本化热度渐起 版权及平台类公司可关注,国海证券
2584,2018-09-10,"分众传媒2018年中报点评:业绩符合预期,期待与阿里合作的落地",正点财经
2585,2018-09-09,媒体：关注A股细分领域龙头 荐6股,中泰证券
2586,2018-09-09,媒体：行业运行层面持续良好 荐12股,安信证券
2587,2018-09-08,三维度精选136只超跌白马股 36家公司被机构集中调研,中证报
2588,2018-09-07,霸屏！长城五星全媒体广告“轰炸”模式，打响旺季营销第一战,东方网
2589,2018-09-07,上半年社保基金现身558只个股，投向医药生物等行业,Wind
2590,2018-09-06,分众传媒股价大跌5.13% 股价创11个月以来新低,中金在线
2591,2018-09-06,媒体：腾讯加码微信广告业务 荐6股,中银国际
2592,2018-09-06,八月衰基金之六：安信价值精选抱守银行医药显颓势,中国经济网
2593,2018-09-05,千亿的梯媒市场里 新潮传媒的2.0版野心,金融界
2594,2018-09-04,30亿元回购计划近半年仅回购了3000万分众传媒套路了谁？,搜狐
2595,2018-09-04,媒体：游戏影视内容承压 荐7股,申万宏源
2596,2018-09-04,媒体：影视及营销盈利能力下滑 荐6股 盈利能力下降,东吴证券
2597,2018-09-04,分众传媒首次回购公司362万股 股价涨1.66%,网易
2598,2018-09-03,多家公司发布回购公告：恒信东方等获得力捧,Wind
2599,2018-09-03,分众传媒首次回购股份：今日回购362万股 斥资3050万元,TechWeb
2600,2018-09-03,分众传媒：首次回购公司362万股 耗资3050万元,e公司
2601,2018-09-03,分众传媒：9月3日首次回购362万股,Wind
2602,2018-09-03,分众传媒（002027）财报点评：生活圈媒体持续高景气，营收及利润增长强劲,国信研究
2603,2018-09-03,今年以来21只权益类基金涨幅超过10%，逾七成产品负收益,Wind
2604,2018-09-03,北上资金积极加仓 主力资金流出走出底部区域尚待新信号,证券时报网
2605,2018-09-02,一周机构去哪儿？摩根士丹利、千合资本等调研了这些股,证券时报网
2606,2018-09-02,媒体：市场情绪持续谨慎 荐4股,和讯
2607,2018-09-02,媒体：网游拟实施总量调控 有利于行业精品化发展,华金证券
2608,2018-09-02,媒体：短期游戏面临监管情绪压制 荐4股 其他违规处罚,广发证券
2609,2018-09-01,分众传媒：楼宇点位加速扩张 买入评级,中银国际
2610,2018-08-31,紧盯聪明钱，看“外来的和尚”如何念经？,Wind
2611,2018-08-31,"分众传媒:业绩完全符合预期,增长强劲",中证网
2612,2018-08-31,264股获券商买入评级，拓斯达目标涨幅达83.69%,Wind
2613,2018-08-31,GPLP早报：分众传媒财报与股价相悖云米科技美股上市,搜狐
2614,2018-08-30,深度资讯 | 分众传媒财报映射“消费升级”，消费类广告收入首次超过互联网,36氪
2615,2018-08-30,分众传媒中报净利高增长市值反蒸发128亿,搜狐
2616,2018-08-30,董秘解码：通合科技拟收购西安霍威 快速拓展军民融合领域,巨丰财经
2617,2018-08-30,分众传媒独大时代要结束了？,环球老虎财经
2618,2018-08-30,行业景气收入增速创新高，关注公司业务扩张和竞争格局变化 ——分众传媒2018半年报点评,关爱传媒成长小分队
2619,2018-08-30,分众传媒大跌背后：应收款激增20亿 Q3净利或低于预期,大众证券报
2620,2018-08-30,A股早报2018年8月30日星期四,Wind
2621,2018-08-30,279股获券商买入评级 建发股份目标涨幅达115.15%,Wind
2622,2018-08-30,公募风格转向均衡，下半年“性价比为王”,中证报
2623,2018-08-29,8月29日A股龙虎榜揭秘，机构净卖出8股,Wind
2624,2018-08-29,分众传媒:自营媒体点位高速扩张 生活圈广告龙头地位稳固,开源证券
2625,2018-08-29,龙虎榜：媒体龙头股成今日机构净买入第一,巨丰财经
2626,2018-08-29,机构今日买入这只股，卖出分众传媒4.4亿元,第一财经
2627,2018-08-29,分众传媒放量大跌9%市值蒸发百亿 深股通与机构龙虎榜对决 连续下跌,和讯
2628,2018-08-29,金融街下午茶2018年8月29日星期三,Wind
2629,2018-08-29,分众传媒放量大跌9.23% 机构资金净卖出逾4亿元,e公司
2630,2018-08-29,龙虎榜 | 机构加码卖出 游资重新活跃,金融投资报
2631,2018-08-29,分众传媒龙虎榜数据（8月29日）,Wind
2632,2018-08-29,分众传媒放量大跌9.23%，机构大举抛售深股通净买入,Wind
2633,2018-08-29,三季报增速不及预期 分众传媒大跌9% 盈利能力下降,e公司
2634,2018-08-29,三六零涨停分众传媒近跌停,红周刊
2635,2018-08-29,分众传媒低开低走重挫9.01%报8.58元 成交23.15亿元,腾讯网
2636,2018-08-29,What？分众传媒跌停了，它可是二季度基金增仓王,Wind
2637,2018-08-29,分众传媒财报见光死 应收账款狂增20亿元现金流剧降,中国经济网
2638,2018-08-29,第三季度净利润增速放缓，分众传媒接近跌停,Wind
2639,2018-08-29,分众传媒股价逼近跌停,e公司
2640,2018-08-29,分众传媒上半年净利润同比增长约32% ，早盘股价跌7%,金融界
2641,2018-08-29,【财通传媒】分众传媒(002027)：中报业绩增长强劲，持续看好“500城”计划,财通证券研究
2642,2018-08-29,分众传媒低开低走跳水7.32%报8.74元 成交7.65亿元,腾讯网
2643,2018-08-29,分众传媒（002027）半年报点评：版位快速扩张，牺牲短期毛利率谋求长期竞争优势,申万宏源研究
2644,2018-08-29,分众传媒中报：上半年很好三季度不好未来仍看好,新浪
2645,2018-08-29,分众传媒低开低走重挫6.04%报8.86元 成交1.23亿元,腾讯网
2646,2018-08-29,分众传媒 (002027) 18Q2单季收入增速29%超预期，资源扩张进度超预期 | 方正传媒杨仁文,杨仁文研究笔记
2647,2018-08-29,分众传媒：上半年楼宇广告高增长 资源拓展加快,西南证券
2648,2018-08-29,【中泰传媒】分众传媒（002027）2018年中报点评：上半年业绩符合预期，媒体点位高速扩张,传媒产业大视点
2649,2018-08-28,分众传媒上半年净利增长三成 净利率持续提升,e公司
2650,2018-08-28,分众传媒预计今年前9个月净利润为47.5至48.5亿元,TechWeb
2651,2018-08-28,分众传媒：上半年归属股东净利润28.18亿元 同比增33.68%,中国网
2652,2018-08-28,分众传媒：上半年净利超33亿元 同比增32%,e公司
2653,2018-08-28,分众传媒：上半年净利同比增长约32.14%,金融界
2654,2018-08-28,分众传媒：上半年净利润同比增32.14%,Wind
2655,2018-08-28,[优于大市评级]传媒行业周报：关注安全边际高、盈利模式稳定标的,中财网
2656,2018-08-28,【朝闻国盛】5G频谱预计将于下个月落地，通信板块投资标的梳理,国盛证券研究所
2657,2018-08-27,[中性评级]深度*行业*传媒互联网行业评论周报：中报业绩驱动个股走向 社会文体投资增速强劲,中财网
2658,2018-08-24,北上资金逆市“买买买” 六只个股彰显投资价值,证券日报
2659,2018-08-23,新潮传媒营收过亿但难言盈利 欲在半平米内“打一场千亿级的群架”,每日经济新闻
2660,2018-08-23,牵手分众 居然之家深耕精准营销,和讯
2661,2018-08-21,通众传媒骆飞：深耕中产住宅入口的千亿市场,财经网
2662,2018-08-21,家居企业拥抱“流量经济” 芝华士沙发联手天猫、分众传媒试水O2O,21世纪经济报道
2663,2018-08-21,[中性评级]深度*行业*传媒互联网行业评论周报：七夕档期电影票房同比翻番 游戏行业版号政策未明,中财网
2664,2018-08-20,居然之家和分众传媒达成战略合作,金融界
2665,2018-08-20,互联网下半场：消费升级背后的品牌激活之路,凤凰网
2666,2018-08-20,分众传媒接连与居然之家、敏华控股签署重要合作,经济观察网
2667,2018-08-20,分众传媒江南春：品牌与资本助推PPmoney网贷快速发展,南方财富网
2668,2018-08-20,[优于大市评级]传媒行业周报：中长期关注平台型公司,中财网
2669,2018-08-20,"互联网传媒行业周报:龙头业绩低于预期,游戏行业暂时遇冷",开源证券
2670,2018-08-18,媒体：关注业绩扎实的优质个股 荐14股,安信证券
2671,2018-08-16,阿里生态起航？居然之家、分众传媒登船后，互相间还做起了生意,每日经济新闻
2672,2018-08-16,居然之家董事长：零售行业越是不变，越是死亡 董监高成员异常事件,中新网
2673,2018-08-16,居然之家联手分众传媒 打造场景流量新入口,中证网
2674,2018-08-15,芝华仕头等舱沙发携手分众传媒、天猫 引领品牌新升级,证券日报
2675,2018-08-15,敏华控股与天猫战略合作 全面引领品牌新升级,股城网
2676,2018-08-15,敏华控股：与分众传媒、天猫战略合作启动联合营销,中证网
2677,2018-08-13,媒体：三大视频网站联合六大制作公司声明抵制行业乱象 荐10股,申万宏源
2678,2018-08-13,媒体：视频网站联合影视公司抵制天价片酬 荐6股,中银国际
2679,2018-08-10,北上资金抢筹58只个股 其中56只个股被券商看好,证券日报
2680,2018-08-10,"传媒互联网行业评论周报:ChinaJoy引领游戏行业趋势探讨,网络内容审核监管趋严",证券之星
2681,2018-08-09,分众传媒江南春：公司不要为收购而收购,金融界
2682,2018-08-08,媒体：内容付费与头部流量 荐10股,申万宏源
2683,2018-08-08,沪指强势反弹2.74% 多维度详解77只机构扎堆推荐股,中财网
2684,2018-08-08,广告业复苏 龙头公司业绩飘红,中证报
2685,2018-08-07,传媒:灿星完成新一轮融资 体育或成发展新风口,西南证券
2686,2018-08-07,浙商证券传媒行业周报(7.30~8.5),浙商证券
2687,2018-08-06,蓝色光标一口气发布14款机器人，不务正业只为拥抱营销传播之变,搜狐
2688,2018-08-06,媒体：网络内容审核监管趋严 荐6股,中银国际
