1464,2020-10-19,机械周观点：工程机械淡化周期 增量犹在 继续看好推荐,新浪
1465,2020-10-19,洋河股份、北方华创等股近五日获机构净买入,证券时报网
1466,2020-10-17,市场主力避险医疗制药 游资大哥深套恒星科技,财富动力网
1467,2020-10-16,【中金科技】科技硬件周报（10/17）：投资人关注半导体贸易摩擦及iPhone 12,乐平科技视角
1468,2020-10-16,央企股权激励新规落地近一年上市公司踊跃“争鲜”,上证报
1469,2020-10-16,央企股权激励新规落地近一年，上市公司尝“鲜气”,上证报
1470,2020-10-16,央企股权激励新规落地近一年 上市公司踊跃“争鲜”,上证报
1471,2020-10-15,凯德石英：将以中芯国际、北方华创等为核心，打造12英寸高端石英制品生产线,中电网
1472,2020-10-14,【国信机械10月策略】季报行情将至，关注产业趋势向上细分行业投资机会,机械老司机
1473,2020-10-13,刚过会就迎利空？盛美股份母公司ACMR被做空机构控诉二宗罪 被出具沽空报告,资本邦
1474,2020-10-13,电子设备、仪器和元件行业周报：旺季来临蓄势待发 电子行业振翅跃飞,新浪
1475,2020-10-13,A股早报2020年10月13日星期二,Wind
1476,2020-10-13,又被减持！芯片龙头怎么了？公募社保也抛售,券商中国
1477,2020-10-13,机构紧握科技与消费机会 两游资大哥合买易事特,财富动力网
1478,2020-10-12,北方华创放量涨停，一机构买入1.89亿元,Wind
1479,2020-10-12,北方华创龙虎榜数据（10月12日）,Wind
1480,2020-10-12,第三代半导体板块尾盘爆发，捷捷微电冲击涨停,Wind
1481,2020-10-12,第三代半导体板块午后发力，易事特冲击涨停,Wind
1482,2020-10-12,【太平洋机械】机械行业周报20201011：新能源加速发展，利好光伏及锂电设备,太平洋机械大讲堂
1483,2020-10-11,半导体设备 | 8月点评：中芯国际部分供应商受到美国出口管制限制更严，设备在内的国产化刻不容缓,透视先进制造
1484,2020-10-11,【中信建投电子|刘双锋&雷鸣团队】周报：苹果和华为新机即将发布，台积电9月营收创新高,中信建投电子研究
1485,2020-10-09,电子行业月报：消费电子旺季将至 半导体景气度持续提升,新浪
1486,2020-10-06,时间表！中国芯片去美化产业链形成在即,云掌财经
1487,2020-10-01,捷佳伟创(300724)公司点评：定增加码PERC+、HIT及半导体设备,新浪
1488,2020-09-29,过节红包来了！半导体板块率领A股反弹，节后市场焦点是这个,中证报
1489,2020-09-29,A股午盘综述：上证指数半日升0.52%，航天军工、半导体领涨,Wind
1490,2020-09-28,机械设备：预计9月挖掘机销量持续大幅增长；光伏设备下半年需求旺盛,新浪
1491,2020-09-27,【中信建投电子|刘双锋&雷鸣团队】周报：新机发布潮拉动消费电子旺盛需求，MOSFET和面板涨价明确投资机会,中信建投电子研究
1492,2020-09-27,机械行业周报：工程机械销售数据强劲 继续重点推荐行业龙头,新浪
1493,2020-09-27,北方华创(002371.SZ)：完成发行5亿元超短期融资券,格隆汇
1494,2020-09-27,机械行业周报：挺进深水增储上产战略取得阶段性成果 中芯国际新工艺演进利好本土制程先进设备公司,西南证券
1495,2020-09-25,银河证券：继续看好工程机械以及专用设备中的高端制造（附股）,证券时报网
1496,2020-09-25,【银河机械】四季度策略：跟随工程机械的β，追寻高端制造的α,中国银河证券研究
1497,2020-09-24,机械行业：跟随工程机械的Β 追寻高端制造的Α,新浪
1498,2020-09-23,【研报掘金】“十四五规划”呼之欲出 第三代半导体前景广阔看好产业链龙头公司,证券时报网
1499,2020-09-22,【华西电子孙远峰团队】北方华创*系列一张图-持续推荐,远峰电子
1500,2020-09-22,【太平洋机械】机械行业周报20200927：工程机械销售数据强劲，继续重点推荐行业龙头,太平洋机械大讲堂
1501,2020-09-22,《周观点》系列：电子周报：华为芯片供应迎转机助力预期改善 PCB预期修复毛正,新浪
1502,2020-09-21,【太平洋机械】机械行业周报20200919：工博会自动化新品发展迅速，相关企业订单饱满,太平洋机械大讲堂
1503,2020-09-21,半导体板块表现活跃，中微公司、紫光国微、北方华创、通富微电大涨,Wind
1504,2020-09-20,机械行业周报：地方专项债发行节奏加快拉动基建需求 中芯国际申请继续供货华为,西南证券
1505,2020-09-20,电子行业每周市场动态追踪：苹果发布IWATCH及IPAD新机 持续引领IOT创新,新浪
1506,2020-09-18,国家大基金再出手，两大芯片股遭抛售，为何密集减持？,券商中国
1507,2020-09-17,A股收盘综述：创业板综指收涨0.41%，半导体概念炒作聚拢人气,Wind
1508,2020-09-17,A股午盘综述：创业板综指半日跌0.72%，资金热炒半导体和注册制次新股,Wind
1509,2020-09-17,芯片股多数走升，中芯国际-U、沪硅产业-U、寒武纪-U集体飘红,Wind
1510,2020-09-16,策略流动性专题：成交维持相对低位 周期性行业较为抗跌,新浪
1511,2020-09-16,北向资金动向盘点：净流入33.2亿，比亚迪占19%,Wind
1512,2020-09-15,北方华创：国家集成电路基金累计减持1%股份 减持股份,Wind
1513,2020-09-15,北方华创(002371.SZ)：国家集成电路基金累计减持495.12万股 减持数量过半  减持股份,格隆汇
1514,2020-09-15,北方华创：公司可提供第三代半导体相关设备,第一财经
1515,2020-09-15,北方华创：公司“碳化硅外延炉”已开始供应市场,Wind
1516,2020-09-15,北方华创：“大基金二期”尚未对公司有具体投资计划,Wind
1517,2020-09-15,A股收盘综述：创业板综指缩量收升0.34%，成交金额连续两日超沪市,Wind
1518,2020-09-14,【太平洋机械】机械行业周报20200912：政策鼓励可再生能源发展，扩产及技术迭代利好光伏设备,太平洋机械大讲堂
1519,2020-09-13,机械行业周报：8月PPI延续修复趋势 顺周期低估值板块持续受益,西南证券
1520,2020-09-10,深度*行业*A股半导体设备中报综述：二季度业绩环比大幅改善 核心产品研发和工艺验证持续进行,新浪
1521,2020-09-10,北方华创(002371.SZ)：国家集成电路基金持股变动比例达1%,格隆汇
1522,2020-09-10,北方华创：国家集成电路基金减持比例达总股本1% 减持股份,Wind
1523,2020-09-10,北向资金动向盘点：总持仓市值已降至1.88万亿,Wind
1524,2020-09-10,8月份国联安2只权益基金跌超9% 重仓科技股悲催了,中国经济网
1525,2020-09-09,北方华创(002371)公司首次覆盖报告：国内半导体设备布局最全龙头 前景可期,新浪
1526,2020-09-09,开源晨会0909丨调的是结构，不是仓位；中小创业绩延续回暖趋势；跨境电商专题报告,开源证券研究所
1527,2020-09-09,北方华创热压烧结设备有效降低能耗,北京商报
1528,2020-09-08,深V反转又跳水？别慌！告诉大家一个好消息，芯片股就要涨了！,中财网
1529,2020-09-08,机械设备行业-双循环格局对高端装备产业的影响分析：双循环新格局下的高端装备曙光,新浪
1530,2020-09-08,基金重仓股遭大面积抛售，两大市场争夺战即将打响？,证券时报网
1531,2020-09-07,【A股收盘综述】“炒小不炒大”，创业板综指跌1.6%成交金额3548亿元创新高,Wind
1532,2020-09-07,上证指数跌破3300点，猪肉、半导体股领跌,Wind
1533,2020-09-07,芯片股巨震！但板块内这些股票大涨20%,中证报
1534,2020-09-07,多只千亿大白马杀跌，机构抱团松动？外资减仓近30亿,中国基金报
1535,2020-09-07,2020年中国半导体薄膜沉积设备行业市场规模及发展趋势分析 国产化任重道远【组图】,前瞻研究院
1536,2020-09-07,中微公司、北方华创、兆易创新等跳水，半导体板块跌幅扩大,Wind
1537,2020-09-06,机械军工行业周报：持续看好军工、工程机械；制造业龙头中报好于预期、景气持续,新浪
1538,2020-09-06,机械行业周报：PMI连续半年高于荣枯线 第三代半导体发展利好国产设备,西南证券
1539,2020-09-06,【太平洋机械】机械行业周报20200905：机械板块估值优势明显，推荐细分景气行业,太平洋机械大讲堂
1540,2020-09-06,电子行业每周市场动态追踪：持续看好行业Q3表现 中美科技分叉倒逼长期发展,新浪
1541,2020-09-04,A股收盘综述：创业板综指低开高走收升0.37%，连续两周录得上涨,Wind
1542,2020-09-04,“大妖股”大跌14%，竟然翻红了……,中国基金报
1543,2020-09-04,【A股午盘综述】创业板综指半日跌0.83%，资金热炒半导体概念股,Wind
1544,2020-09-04,半导体板块涨近2%，中芯国际-U、三安光电、沪硅产业-U、中微公司等集体拉升,Wind
1545,2020-09-04,一款“热搜”基金非理性追逐：爆款基金的“投资陷阱”？,21世纪经济报道
1546,2020-09-03,【中报点评】北方华创：2020H1业绩符合预期，国产替代助力快速成长,吉森电子研究
1547,2020-09-03,北方华创(002371)：设备业务增势迅猛 在手订单高企H2展望良好,新浪
1548,2020-09-03,29公司获得推荐评级-更新中,中财网
1549,2020-09-02,电子行业2020年半年度总结和9月投资策略：军工、红外和苹果产业链持续高景气,光大证券
1550,2020-09-02,49公司获得增持评级-更新中,中财网
1551,2020-09-02,芯片板块表现疲软，中芯国际-U、韦尔股份等普跌,Wind
1552,2020-09-02,周三机构一致看好的七大金股（09.02）,中金在线
1553,2020-09-02,深度*公司*北方华创(002371)：业绩高增长 半导体设备先进工艺验证取得阶段性成果,新浪
1554,2020-09-02,大基金又出手，拟减持这家芯片封测龙头，年内已抛售多家芯片股 拟减持股份,Wind
1555,2020-09-01,北方华创 | 点评：H1预收款大幅增长，受益于晶圆厂新一轮扩产,透视先进制造
1556,2020-09-01,【天风电子】北方华创：中报业绩符合预期，全年成长逻辑不变,科技伊甸园
1557,2020-09-01,16年历史铁律将重现？9月还看科技股？,中证报
1558,2020-09-01,电子行业周报：苹果产业链持续向好 半导体韧性依旧,新浪
1559,2020-08-31,北方华创：业绩符合预期，全面受益国内半导体行业高增长【国元电子贺茂飞团队】,茂飞电子研究
1560,2020-08-31,北方华创(002371)：收入利润稳定增长 持续推进IC装备产品开发和市场开拓,新浪
1561,2020-08-31,北方华创(002371)：2Q业绩好于预期 受益于国内产线进口替代加速,新浪
1562,2020-08-31,【太平洋机械】北方华创(002371)公司点评：上半年工艺装备较快增长，期间费率大幅下降,太平洋机械大讲堂
1563,2020-08-31,机械行业周报：异质结项目陆续落地 关注光伏、换电设备,新浪
1564,2020-08-31,32家集成电路公司研发投入比超8.5% 4家市值超千亿10家股价年内翻倍,长江商报
1565,2020-08-31,亦庄“芯”企获中国半导体大奖青睐,北京商报
1566,2020-08-31,上市公司正负面新闻2020年8月31日星期一,Wind
1567,2020-08-30,【华西电子孙远峰团队-持续推荐北方华创】半导体设备应用持续突破，同步业绩快速增长,远峰电子
1568,2020-08-30,公告精选：闻泰科技上半年净利增逾7倍；北方华创上半年净利增43%,e公司
1569,2020-08-30,北方华创：上半年净利1.84亿元 同比增43%,e公司
1570,2020-08-30,北方华创(002371.SZ)半年度净利润升43.18%至1.84亿元,格隆汇
1571,2020-08-30,北方华创：上半年净利润同比增长43.18%,Wind
1572,2020-08-29,装备制造业半年报业绩喜人,Wind
1573,2020-08-28,电子行业日报：二季度NANDFLASH产业营收增长6.5%,新浪
1574,2020-08-27,机器人(300024)：1H20业绩低于预期 拟增发布局半导体装备,创业板
1575,2020-08-26,全球芯片巨头透露重磅信息，3纳米芯片预计明年问世！,证券时报
1576,2020-08-26,中芯国际二季度业绩创历史新高，加码先进制程资本开支,Ofweek
1577,2020-08-26,中芯国际概念板块跌幅扩大至5%，安集科技、兆易创新、北方华创领跌,Wind
1578,2020-08-26,半导体板块连续下滑，隆基股份、兆易创新、中环股份、北方华创大跌,Wind
1579,2020-08-26,有研新材(600206)半年报点评报告：磁材增长平稳 靶材推动利润增长,新浪
1580,2020-08-26,芯片股大多疲软，韦尔股份再跌超3%,Wind
1581,2020-08-23,机械行业研究：装配式建筑快速推进 塔吊及预制件设备受益,新浪
1582,2020-08-20,北方华创助力国内先进封装技术新发展,证券日报
1583,2020-08-20,【太平洋机械】机械行业周报20200815：装配式建筑快速推进，塔吊及预制件设备受益,太平洋机械大讲堂
1584,2020-08-20,机械行业周报：7月机器人产量同比增加19.4％ 行业继续景气向上,新浪
1585,2020-08-20,芯片板块表现疲软，韦尔股份、北方华创、汇顶科技、景嘉微大跌,Wind
1586,2020-08-20,【太平洋机械】机械行业周报20200822：装配式建筑快速推进，塔吊及预制件设备受益,太平洋机械大讲堂
1587,2020-08-19,肖亚庆：加快关键核心技术攻关，推进智能制造和制造业数字化转型,Wind
1588,2020-08-19,芯片股局部活跃，韦尔股份大涨超6%,Wind
1589,2020-08-18,中芯国际产业链机会深度剖析：SMIC生态圈，重构“芯”阵列,新浪
1590,2020-08-18,国产刻蚀设备凭什么后发赶超？（附厂商盘点）,国际电子商情
1591,2020-08-18,大市值芯片股整体表现不振，中芯国际-U、中兴通讯、韦尔股份、中微公司等普跌,Wind
1592,2020-08-17,电子行业日报：长江存储128层QLC3DNAND正式亮相,新浪
1593,2020-08-17,涨近8成，超5成预喜：半导体国产替代愈演愈烈,Wind
1594,2020-08-17,机械设备周报2020年8月第2期：7月挖掘机销量同比增长54.8％ 工程机械持续高景气,新浪
1595,2020-08-16,【华创机械 | 点评】北方华创2020年三季报点评：Q3营收快速增长，技术实力持续巩固,华创机械
1596,2020-08-14,芯源微(688037)：涂胶显影打破垄断 湿法清洗国产先锋,新浪
1597,2020-08-14,【安信电子|公司深度】芯源微：涂胶显影打破垄断，湿法清洗国产先锋,晓说电子
1598,2020-08-14,真假“塔山计划”搅动A股?,21世纪经济报道
1599,2020-08-14,华为“塔山计划”搅动A股 上市公司或发澄清声明,21世纪经济报道
1600,2020-08-13,电子行业日报：板块持续轮动 短期震荡调整,新浪
1601,2020-08-13,半导体设备行业专题报告：国内需求增长，国产替代进展提速,新浪
1602,2020-08-12,印度又挑事！拟禁止华为、中兴参与5G网络建设，两家公司回应,Wind
1603,2020-08-12,华为再有大动作，参与成立私募股权基金,Wind
1604,2020-08-12,创新打底带动“亦庄智造”频出国门,北京商报
1605,2020-08-12,经开区多措并举应对“烤”验,北京商报
1606,2020-08-11,北方华创股权激励计划行权143万股 行权价35.25元/股,证券日报
1607,2020-08-11,机械设备周报2020年8月第1期：中芯国际调增全年计划资本开支至67亿美元 半导体设备产业链有望加快进口替代,新浪
1608,2020-08-10,千亿市值的股票，为何老是大涨大跌……,上证报
1609,2020-08-10,半导体板块午后全线转暖，北方华创冲击涨停,Wind
1610,2020-08-09,电子行业周报：中芯中报超预期验证代工高景气 面板持续涨价,新浪
1611,2020-08-09,机械设备：工程机械高景气持续 中芯国际合资扩产利好国产设备商,新浪
1612,2020-08-08,半导体设备行业7月数据点评：中芯国际合资扩产 上游设备商率先受益,新浪
1613,2020-08-08,【数说新闻】集成电路收政策大礼包 谁能免税十年？,经济观察网
1614,2020-08-07,【行情】半导体个股大幅走弱，长电科技、沪硅产业、清溢光电、北方华创等均跌逾6%,金十数据
1615,2020-08-06,电子设备行业动态点评：集成电路板块再迎政策支持 全产业链或将受益,新浪
1616,2020-08-06,中芯国际(688981)投资价值分析报告：新一轮扩产周期启动 这一次的中芯可有大不同？,光大证券
1617,2020-08-06,涨停复盘 | 军工成市场最强主线，北斗星通强势四连板,第一财经
1618,2020-08-06,高价股现分歧，普涨行情能否持续？,Wind
1619,2020-08-06,银河证券每日晨报,新浪
1620,2020-08-06,芯片板块迎大利好,证券导报
1621,2020-08-06,半导体行业报告：半导体制造龙头投建新厂 引领行业正向循环,新浪
1622,2020-08-06,半导体设备研究系列九-LAMRESEARCH：Q2业绩向好 Q3指引乐观,广发证券
1623,2020-08-06,电子行业事件点评：中国芯免 利好中芯,新浪
1624,2020-08-06,集成电路板块未如期强劲，主因主力兑现意愿强烈,Wind
1625,2020-08-05,集成电路和软件产业新政印发 “中国芯”及国产软件再迎大机遇,大众证券报
1626,2020-08-05,集成电路财税政策解读,半导体风向标
1627,2020-08-05,A股共发生113宗大宗交易成交23.28亿元（8月5日）,Wind
1628,2020-08-05,北方华创现1笔大宗交易 共成交387.00万元,新浪
1629,2020-08-05,北方华创今日大宗交易成交1.80万股，成交价215.0元溢价0.0%,Wind
1630,2020-08-05,半导体行业点评：国务院发布集成电路产业新政策 半导体行业迎来发展新时期,新浪
1631,2020-08-05,科技行业日报：三星取得思科与谷歌的芯片代工订单,新浪
1632,2020-08-05,半导体行业研究：全产业链加大扶持力度 分级优惠鼓励做强,国金证券股份有限公司
1633,2020-08-05,国务院出手：3万亿芯片板块迎超重磅利好，细分龙头全梳理,证券时报网
1634,2020-08-05,集成电路重磅文件发布 科技股行情再起？,中投网
1635,2020-08-05,中信证券：集成电路产业促进新政利好整体集成电路板块,Wind
1636,2020-08-05,3万亿芯片板块迎超重磅利好！科技股行情再起？细分龙头全梳理,上游新闻
1637,2020-08-05,国务院出手 3万亿芯片板块迎超重磅利好,金融界
1638,2020-08-05,芯片、软件迎爆炸性利好！更有万亿市场或更受益,券商中国
1639,2020-08-04,符合条件集成电路项目 免征十年所得税,每日经济新闻
1640,2020-08-04,最高十年免税！国务院出台半导体八大优惠政策，中芯国际领衔的这些企业将受益,每日经济新闻
1641,2020-08-04,晚间要闻2020年8月4日星期二,Wind
1642,2020-08-04,国务院八方面政策措施支持集成电路产业和软件产业发展 芯片最全产业链个股名单,证券时报网
1643,2020-08-04,国产芯片和软件迎利好：国务院拟推8方面政策 机构、北上提前布局,科创板日报
1644,2020-08-04,北水本周狂买美团22亿，继续涌入思摩尔；南水加仓茅台、北方华创,富途证券
1645,2020-08-04,北向资金今日净买入21.37亿元，贵州茅台净买入近8亿元,Wind
1646,2020-08-04,北方华创现1笔大宗交易 共成交319.50万元,新浪
1647,2020-08-04,半导体设备｜重要点评：中芯国际合资扩产，国产设备商有望加速获得订单,透视先进制造
1648,2020-08-03,半导体设备行业跟踪报告：中芯国际拟大规模投资成熟工艺 国产装备有望积极参与,广发证券
1649,2020-08-03,电子行业点评：中芯国际合作建设28NM项目 国产替代进程加速,新浪
1650,2020-08-03,中芯国际76亿美元蛋糕如何分配,中财网
1651,2020-08-03,A股收盘综述：上证指数涨1.75%，科创50大涨7.26%,Wind
1652,2020-08-03,机构重金封板北方华创 游资继续主攻医药股｜龙虎榜,第一财经
1653,2020-08-03,快讯：中芯国际概念板块表现活跃涨5.82% 新莱应材、至纯科技、北方华创收获涨停,证券日报
1654,2020-08-03,"一纸公告引概念股秒板 中芯国际坐实""带头大哥""地位",科创板日报
1655,2020-08-03,巨丰午评：大盘冲击箱体顶部 军工科技爆发涨停潮,巨丰财经
1656,2020-08-03,A股午盘综述：上证指数涨逾1%，军工股掀涨停潮,Wind
1657,2020-08-03,北方华创等58股近五日获机构净买入,证券时报网
1658,2020-08-03,半导体行业点评报告：扩产提升SMIC盈利能力 持续推进产业链国产化,新浪
1659,2020-08-03,A股早报2020年8月3日星期一,Wind
1660,2020-08-02,【太平洋机械】机械行业周报20200802：产业快速推进异质结电池，重点推荐核心设备厂商,太平洋机械大讲堂
1661,2020-08-02,本周股市龙虎榜一览：北方华创最受机构青睐,搜狐
1662,2020-08-02,科技股一浪接一浪 游资大买强势海汽集团,南方财经网
1663,2020-07-31,机构现身34股，净买入北方华创4.9亿元、净卖出鄂武商A1.05亿元,第一财经
1664,2020-07-31,龙虎榜揭秘：机构及北向资金集体抢筹20股,证券时报
1665,2020-07-31,百亿资金搏杀芯片龙头股，主力扫货近30亿元！科技股抢筹名单来了,证券时报网
1666,2020-07-31,龙虎榜：机构5.4亿巨资重仓入场孙哥1.9亿再杀回马枪,金融界
1667,2020-07-31,龙虎榜动向：2股机构及北向资金集体净买入,证券时报网
1668,2020-07-31,机构今日买入这22股，抢筹北方华创4.9亿元丨牛熊眼,第一财经
1669,2020-07-31,北方华创龙虎榜数据（7月31日）,Wind
1670,2020-07-31,半导体板块尾盘走高，安集科技涨逾10%，北方华创拉升封板，长,--
1671,2020-07-31,【行情】半导体板块尾盘持续拉升，北方华创涨停，沪硅产业大涨8%，中芯国际、长电科技、华润微、苏州固锝等集体拉升,金十数据
1672,2020-07-30,科技行业日报：高通与华为达成专利和解,新浪
1673,2020-07-30,信息科技行业动态点评：加快集成电路发展 产业链公司齐头并进,新浪
1674,2020-07-29,电子行业周报：集成电路生产恢复 5G智能手机价格下探,新浪
1675,2020-07-29,芯片股尾盘全线爆发，沪硅产业涨近15%,Wind
1676,2020-07-29,解盘：资金快速流入，半导体、生物疫苗、次新、高价股领涨,Wind
1677,2020-07-29,机械设备行业周报：工程机械中报向好 理性看多新兴行业扩产需求,新浪
1678,2020-07-29,科技行业日报：台积电获得英特尔6NM芯片订单,新浪
1679,2020-07-29,私募大佬葛卫东再出手！5亿入局这家半导体龙头,证券时报
1680,2020-07-27,北方华创现1笔大宗交易 共成交708.84万元,新浪
1681,2020-07-27,【太平洋机械】机械行业周报20200725：疫情后重视粮食生产，拖拉机行业销售大幅回升,太平洋机械大讲堂
1682,2020-07-26,【华西电子孙远峰团队-Q2持仓分析】Q2电子重仓配比提升，半导体配置创新高,远峰电子
1683,2020-07-26,电子行业每周市场动态追踪：消费终端需求回暖 看好三季度机会,新浪
1684,2020-07-26,电子元件行业周报：电子行业2020Q2基金持仓分析-板块持仓环比大增 消费电子增配明显,新浪
1685,2020-07-24,中芯国际：SMIC生态圈，重构“芯”阵列（附下载）,199IT
1686,2020-07-23,财报解读 | 连城数控：毛利率走低业绩“开倒车” 关联方贡献超六成营收,金融界
1687,2020-07-23,北方华创1亿元转让电控产投股权 标的两年多无营收,每日经济新闻
1688,2020-07-23,北方华创(002371.SZ)：子公司使用闲置募集资金5亿元暂补流动资金,格隆汇
1689,2020-07-23,晚间重要公告2020年7月23日星期四,Wind
1690,2020-07-23,北方华创：拟向关联方京东方转让持有的电控产投16.67%股权 资产异常,Wind
1691,2020-07-23,京东方拟斥1亿元受让北京电控产投股权 加码物联网布局,第一财经
1692,2020-07-23,京东方A：拟1亿元接手北方华创所持电控产投股份,中证网
1693,2020-07-23,京东方Ａ(000725.SZ)：拟受让北方华创持有的电控产投16.67%股权,格隆汇
1694,2020-07-22,半导体行业研究：进击的安徽新兴产业之半导体,华安证券
1695,2020-07-22,芯片股普涨，韦尔股份、中兴通讯、中微公司、兆易创新、紫光国微等纷纷上扬,Wind
1696,2020-07-21,科技行业日报：美国扩容实体清单 个股影响较小,新浪
1697,2020-07-21,科技行业日报：中报业绩陆续披露 关注优质个股,新浪
1698,2020-07-20,通信行业周报：华为下半年机遇挑战并存 NB-IOT产业链值得关注,华安证券
1699,2020-07-20,机械行业2020年7月策略：关注长期赛道 优选负债率低现金流好的低估值龙头公司,新浪
1700,2020-07-20,电子行业周报：台积电Q2业绩超预期 关注H1业绩优异企业,新浪
1701,2020-07-20,中芯国际上市大反转，券商预计本周不会再创新高,Wind
1702,2020-07-19,浙商早知道 | 7月21日,浙商证券研究所
1703,2020-07-18,【兴证电子】周报：台积电上修资本开支，TCL整合中环开启新战略,兴证电子谢恒团队
1704,2020-07-18,北方华创：自主创新为基 引领设备国产化大浪潮,巨丰财经
1705,2020-07-17,机械行业周报：6月挖机销售增速约63％ 预计景气有望持续,新浪
1706,2020-07-17,半导体板块低迷，兆易创新、北方华创、卓胜微、紫光国微均走软,Wind
