2214,2019-07-14,机械制造：将具备上海枢纽机场功能 荐20股,川财证券
2215,2019-07-11,一天九新股齐发，科创板真的是机构互砍吗？,搜狐
2216,2019-07-11,融资客青睐23股，华孚时尚买入占比高达65.30%,Wind
2217,2019-07-10,机械设备行业周报（20190708-20190714）：机械板块科创板首批新股发行总结【华创机械李佳团队】,华创机械
2218,2019-07-10,科创板市场化发行打破唯市盈率论 平均PE56倍再遭“三高”质疑,21世纪经济报道
2219,2019-07-09,"170倍估值！""疯抢""科创板最强芯片股",全景网
2220,2019-07-09,【节选】半导体设备下半年策略：国产集成电路工艺设备全线出击,机械王者联盟
2221,2019-07-09,科创板申购潮起 市盈率偏高是否合理？,红周刊
2222,2019-07-09,战配基金首现身！科创板网下密集申购 这家路演时一凳难求,金融界
2223,2019-07-09,科创板首现170倍PE发行定价 它的特别之处在哪？,第一财经
2224,2019-07-09,"电子行业周报:Mate20X获得5G终端进网许可,5G手机有望迎来上市潮",光大证券
2225,2019-07-07,机械制造：全国最大页岩油油田进入开发建设阶段,川财证券
2226,2019-07-06,【北方华创中报点评】业绩略低于预期，20亿定增将助力未来发展【东吴机械陈显帆】,透视先进制造
2227,2019-07-05,北方华创：为下属子公司提供担保1.5亿元 大额借贷担保,Wind
2228,2019-07-02,北方华创(002371.SZ)拟每10股派0.52元 股权登记日为7月9日,格隆汇
2229,2019-06-26,五大券商周四看好6板块32股,证券之星
2230,2019-06-24,【CS机械】迈为股份深度报告——光伏设备订单充足，外延扩张打开成长空间,CiticsMachinery
2231,2019-06-21,北方华创工业总产值增了近6亿,北京商报
2232,2019-06-21,中微如何估值？,半导体风向标
2233,2019-06-20,北方华创回复问询：会计所认为公司对补贴处理符合规定 问询,Wind
2234,2019-06-20,北方华创回复问询：公司业务面临的市场环境较为稳定 问询,Wind
2235,2019-06-18,半导体、电子设备：新产业生命周期的电子机遇 荐17股,长江证券
2236,2019-06-13,险资1个多月调研A股公司184次 被调研的94家公司中88家逆势上涨,证券日报
2237,2019-06-11,"电子行业周报:3家企业科创板过会,5G商用牌照加速产业进程",证券之星
2238,2019-06-10,半导体、电子设备：半导体设备国产化专题三 荐3股,中银国际
2239,2019-06-09,机械制造：锂电投资不断超预期 荐10股,东吴证券
2240,2019-06-09,A股龙头大PK：百强龙头贡献A股近五成市值（附名单）,证券时报
2241,2019-06-08,机械制造：南京规划到2020年建设地下综合管廊66公里,川财证券
2242,2019-06-06,【方正策略】科技龙头身在何处,策略研究
2243,2019-06-05,【电子行业深度研究报告】科创板电子行业估值专题报告,耿琛看科技
2244,2019-05-29,【半导体设备4月数据点评】科创板半导体企业产业链覆盖全面，国内半导体行业迎来发展良机【东吴机械陈显帆】,透视先进制造
2245,2019-05-29,中微半导体完成3轮问询 上交所三问资本化、存货及政府补助 问询,第一财经
2246,2019-05-29,国产芯片概念持续强势，机构普遍看好自主可控细分领域标的,第一财经
2247,2019-05-28,中微上市前的最后一次反馈,半导体风向标
2248,2019-05-28,"电子行业:税收优惠政策延续,继续看好集成电路自主可控",证券之星
2249,2019-05-27,上市公司豁免不减持承诺案例增多，实控人承诺为何落空？,第一财经
2250,2019-05-26,除了北方华创，还有这家小巨头,半导体风向标
2251,2019-05-22,"机械行业中微半导体跟踪:备品备件收入主要来自集成电路,ICP刻蚀设备市场正在超过CCP刻蚀设备市场",证券之星
2252,2019-05-20,华为概念股雄起，国产替代行情如何演绎,第一财经
2253,2019-05-20,机械设备行业周报：半导体设备板块持续增长，国产替代机遇值得关注【华创机械李佳团队】,华创机械
2254,2019-05-18,西南证券：华为芯片20年，主要设计了五类,Wind
2255,2019-05-12,中微半导体，330页干货浓缩,半导体风向标
2256,2019-05-12,半导体、电子设备：继续看好自主可控大方向 荐5股,和讯
2257,2019-05-11,5G迎来重要时间窗口期 近10亿元大单涌入15只概念股,证券日报
2258,2019-05-10,【红刊财经】主题研究|集成电路板块或成投资新风口,和讯
2259,2019-05-10,北方华创涨停，意味着什么,半导体风向标
2260,2019-05-10,北方华创龙虎榜数据（5月10日）,Wind
2261,2019-05-10,涨停板解密：软硬件国产化批量涨停！（5月10日）,Wind
2262,2019-05-09,中微半导体VS北方华创 谁能在半导体设备行业称王？,第一财经
2263,2019-05-08,至纯，超预期的背后,半导体风向标
2264,2019-05-08,[快讯]10:35北方华创、康强电子封涨停,中财网
2265,2019-05-06,北方华创一季度净利1991万元同比增长30% 现金流量净额为-2.54亿元,挖贝网
2266,2019-05-06,北方华创：业绩高增长，半导体设备龙头乘风而上,证券时报网
2267,2019-05-05,机械制造：机械行业一季度业绩触底回暖 荐10股,东吴证券
2268,2019-05-02,5G芯片霸主Q1说了啥？,半导体风向标
2269,2019-04-30,【中信证券电子研究】北方华创（002371.SZ）2019一季报点评—业绩稳步增长，研发助力未来,CITICS电子研究
2270,2019-04-30,"华创证券：将北方华创评级调低为""推荐"" 投资评级恶化",Wind
2271,2019-04-30,北方华创（002371）2019年一季报点评：营收稳步增长，加大研发投入，龙头地位料将进一步巩固 【华创机械李佳团队】,华创机械
2272,2019-04-29,北方华创(002371.SZ)一季度净利润升29.65%至1991.39万元,格隆汇
2273,2019-04-29,北方华创：一季度净利润同比增29.65%,Wind
2274,2019-04-28,【东吴机械周观点】预计挖机4月仍将正增长，宁德时代加速扩产节奏,透视先进制造
2275,2019-04-28,"北方华创:业绩保持高速增长,半导体装备持续突破放量可期",东北证券
2276,2019-04-26,北方华创（002371）2018年报点评：业绩大幅增长，半导体设备龙头蓄势待发【华创机械李佳团队】,华创机械
2277,2019-04-26,北方华创(002371)：产品开发和市场拓展显著进步,联讯证券
2278,2019-04-25,"北方华创2018年年报点评:各项产品下游需求旺盛,公司有望继续乘风而上",光大证券
2279,2019-04-25,"北方华创:受益国内半导体行业发展,半导体设备龙头业绩大幅增长",东吴证券
2280,2019-04-24,北方华创(002371.SZ)2018年净利润升86.05%至2.34亿元 拟10派0.52元,格隆汇
2281,2019-04-24,"北方华创:半导体设备收入翻倍,扣非净利润转正",证券之星
2282,2019-04-23,北方华创：2019年度对外担保情况,Wind
2283,2019-04-23,北方华创：2018年净利润同比增86.05%,Wind
2284,2019-04-23,机械制造：继续看好龙头全年表现 荐5股,和讯
2285,2019-04-21,【华创机械 | 周观点】一季度经济运行好于预期，继续关注结构分化中的机遇,华创机械
2286,2019-04-21,深度解读芯片刻蚀：国产5nm机器已就绪，2018全球销售额破历史新高【附下载】| 智东西内参,和讯
2287,2019-04-19,北方华创：增强核心竞争力 强烈推荐评级,和讯
2288,2019-04-19,北方华创：计划募投21亿元 推荐评级,和讯
2289,2019-04-17,机械制造：继续看好工程机械龙头全年表现 荐5股,和讯
2290,2019-04-17,【每日晨报】0417丨北斗系统进入全球密集组网期，产业链相关公司受益,中国银河证券研究
2291,2019-04-12,【每日晨报】0412丨猪价或于Q2中期加速上涨,中国银河证券研究
2292,2019-04-11,重磅 | 存储芯片的国产设备供应链格局最强解析——以长江存储为例,琨论机械
2293,2019-04-10,北方华创：大基金持股比例有望进一步提升 买入评级,和讯
2294,2019-04-10,半导体、电子设备：供需共振 国产半导体设备再启航,和讯
2295,2019-04-10,【机械】中微半导体：国际半导体设备产业界公认的后起之秀,微信
2296,2019-04-10,"半导体设备与材料行业:科创新秀之,安集微电子-190409",证券之星
2297,2019-04-10,"电子行业:短期面板供过于求,长期看好国内面板企业",东北证券
2298,2019-04-09,"电子行业:同股不同权亮相科创板,小米物联网战略加速落地",证券之星
2299,2019-04-08,111股获券商买入评级 全筑股份目标涨幅达78.65%,Wind
2300,2019-04-04,大幅上调目标价策略（4月4日）,Wind
2301,2019-04-03,【国金研究】科创板：助推高端制造产业突破、估值重构 ——“科创板-高端制造”系列报告【国金机械军工】,国金证券研究所
2302,2019-04-03,【国金晨讯】科创板助推高端制造估值重构；航空股一倍空间刚起步！财政分析手册高阶：社会保险基金篇,国金证券研究所
2303,2019-04-02,机械制造：关注一季报业绩超预期个股 荐5股,和讯
2304,2019-04-01,北方华创：未来公司净利润有望达到10-14亿元的量级水平,证券时报网
2305,2019-04-01,"北方华创:北方华创VS中微半导体,全方位对比分析",西南证券
2306,2019-03-31,【安信电子孙远峰团队-持续推荐北方华创】设备器件双增长，半导体设备龙头持续发力,远峰电子
2307,2019-03-31,北方华创2019年一季度业绩预告点评：业绩稳步增长，半导体设备龙头有望享受国产替代黄金期【华创机械李佳团队】,华创机械
2308,2019-03-29,北方华创：预计一季度净利润同比增长0%-50%,Wind
2309,2019-03-26,科创板望重构半导体业估值体系 8只相关龙头股或水涨船高,证券日报
2310,2019-03-25,【东吴机械周观点】光伏产能新周期、油服capex超预期,透视先进制造
2311,2019-03-25,"电子行业:面板需求强劲,关注相关产业链",东北证券
2312,2019-03-24,机械制造：国家重点研发计划智能机器人专项2018年项目公示,川财证券
2313,2019-03-21,头号研报：我国半导体产业迎黄金期——半导体设备,巨丰财经
2314,2019-03-21,电子元件行业周报:从英伟达收购mellanox看优秀半导体标的估值,正点财经
2315,2019-03-20,机械制造：重点推荐北方华创和天奇股份 荐9股,和讯
2316,2019-03-18,【半导体设备】国内半导体企业2018年营收大幅增长，预计2019年设备需求持续扩张【东吴机械陈显帆】,透视先进制造
2317,2019-03-18,机械制造：继续看好业绩高增长工程机械板块 荐5股,和讯
2318,2019-03-18,"电子行业:华为5G芯片提速,关注相关产业链",东北证券
2319,2019-03-18,"2019年机械行业周报3月第3期:铁路运输业投资明显加速,煤价维持高位利好设备龙头",证券之星
2320,2019-03-17,北方华创主要核心工艺设备已达到28纳米量产水平,SEMI
2321,2019-03-15,北方华创:科创估值方法论之一半导体设备,西南证券
2322,2019-03-14,北方华创：IC设备国产替代加速，“存量”+“增量”双重成长,证券时报网
2323,2019-03-13,征战龙虎榜：多只个股获机构过亿买入,金融投资报
2324,2019-03-12,3月12日A股龙虎榜揭秘，机构最青睐9股,Wind
2325,2019-03-12,北方华创龙虎榜数据（3月12日）,Wind
2326,2019-03-12,国产芯片板块逆势走强，士兰微直线封板,Wind
2327,2019-03-12,A股早报2019年3月12日星期二,Wind
2328,2019-03-11,3月11日A股龙虎榜揭秘，机构最青睐3股,Wind
2329,2019-03-11,北方华创巨震近19%，机构大举买入,Wind
2330,2019-03-11,电子行业周报:“超高清视频”计划带动相关产业链受益,正点财经
2331,2019-03-11,电子设备、仪器和元件行业:从科技创新角度看电子企业,正点财经
2332,2019-03-11,机械制造：科创板落地有望成为高端制造板块催化剂 荐10股,太平洋证券
2333,2019-03-11,软件股全线回落，汉得信息、浪潮软件跌停,Wind
2334,2019-03-11,"电子行业:科创板叠加增值税减税,自主可控仍是大方向",证券之星
2335,2019-03-09,芯片板块逆市吸金逾65亿 7只龙头股被机构扎堆推荐,证券日报
2336,2019-03-08,牛回头！大金融调整，科技股爆发，减持雷需重视,Wind
2337,2019-03-08,芯片个股掀起涨停潮 北方华创等超30股涨停,金融界
2338,2019-03-06,【研报精读】北方华创（002371.SZ）,联讯金融
2339,2019-03-06,A股早报2019年3月6日星期三,Wind
2340,2019-03-05,涨停板解密：市场火爆，多板块现涨停潮！（3月5日）,Wind
2341,2019-03-05,芯片板块快速拉升 北方华创等涨停,金融界
2342,2019-03-04,【异动股】芯片板块拉升走强 北方华创(002371-CN)封涨停,财华社
2343,2019-03-04,北方华创早盘封涨停 成交额5.27亿元封单1.92万手,腾讯网
2344,2019-03-01,4日机构强推买入 六股成摇钱树,证券之星
2345,2019-03-01,【机械】北方华创：年报业绩符合预期，半导体设备龙头快速成长,微信
2346,2019-03-01,【电子-孙远峰】北方华创：业绩快速增长，半导体设备步步为营,安信证券研究
2347,2019-03-01,"北方华创2018年业绩快报点评:营收高增长得益于设备业务发力,龙头持续快速成长",光大证券
2348,2019-02-28,北方华创2018年利润2.31亿增长84% 副总经理金路近期辞职,挖贝网
2349,2019-02-28,"北方华创:厚积薄发,成就国产半导体设备龙头",东北证券
2350,2019-02-27,北方华创：2018年净利润同比增84.27%（快报）,Wind
2351,2019-02-26,"电子行业:OLED利好消息频出,继续关注相关产业链",东北证券
2352,2019-02-25,MWC抢“鲜”看！除了华为、小米、中兴，还有哪些亮点,Wind
2353,2019-02-25,机械制造：地方政府债加速发行 荐7股,中银国际
2354,2019-02-25,机械设备行业周报:控制器、伺服电机、减速机列入我国工业强基计划重点,正点财经
2355,2019-02-24,机械制造：聚焦业绩高增长的工程机械和成长板块龙头 荐5股,中泰证券
2356,2019-02-22,北方华创：根据国内OLED产线投资情况，争取获得部分设备订单,Wind
2357,2019-02-19,电子行业每周专题:从MWC创新方向看产业链投资机会,正点财经
2358,2019-02-19,电子行业周报:关注新机发布潮带动消费电子板块估值修复,上海证券
2359,2019-02-18,北方华创副总经理金路辞职 年薪为60万元 董监高成员变化,挖贝网
2360,2019-02-18,"电子行业:三星率先推出折叠手机,关注OLED相关标的",正点财经
2361,2019-02-18,"机械设备行业:中芯国际先进制程取得重大进展,持续看好国内半导体产业发展",东北证券
2362,2019-02-17,机械制造：南京轨交2019年同时有12条在建6条新开工,川财证券
2363,2019-02-17,机械制造：重视周期股价值回归行情 荐3股,中银国际
2364,2019-02-17,北方华创：OLED设备在公司营业收入中占比较低,Wind
2365,2019-02-17,北方华创：OLED设备在公司营业收入中占比较低,e公司
2366,2019-02-01,"机械设备行业周报2019年1月第5期:基建补短板再提速,持续推荐轨交设备与工程机械板块",长城证券
2367,2019-01-29,半导体行业：国之重器大投入推进,维库电子市场
2368,2019-01-29,"电子行业2018年报前瞻:板块及个股持续分化,2019三大主线可乐观看待",申万宏源
2369,2019-01-27,机械制造：重庆轨道交通五A线和四号线二期工可研正式获批,川财证券
2370,2019-01-26,电子行业成基金布局重点 月内逾七成个股上涨,证券日报
2371,2019-01-25,华为发布5G基站芯片 相关概念股称霸A股,每日商报
2372,2019-01-25,融资客青睐32股，荣盛石化买入占比高达56.87%,Wind
2373,2019-01-24,这类股迎重磅利好，新华文轩再冲涨停2日累涨21%！明日留意这只5G概念股,每日经济新闻
2374,2019-01-23,"机械设备行业:油价持续反弹,关注油服板块投资机会",中证网
2375,2019-01-22,今年光伏市场乐观情绪上升 六股迎腾飞契机,证券日报
2376,2019-01-22,2019年券商开年金股出炉：为何贵州茅台招商蛇口备受宠爱,新浪
2377,2019-01-22,逾七成机构推荐股实现上涨 43.07亿大单抢筹8只强势股,证券日报
2378,2019-01-22,"机械设备行业:浙江鼎力全年利润持续高增长,关注优质标的业绩兑现",东北证券
2379,2019-01-21,2019券商已发千份研报 这只股预期上涨空间超200%,价值线
2380,2019-01-21,半导体板块午前冲高，易成新能再封涨停,Wind
2381,2019-01-20,【东吴机械周观点】我国跃升天然气第一大进口国，油气增产势在必行；持续看好新能源装备,透视先进制造
2382,2019-01-18,闻泰：业绩超预期（附点评）,半导体风向标
2383,2019-01-17,北方华创微电子企业技术中心获国家企业技术中心认定,证券日报
2384,2019-01-16,北方华创：非公开发行不超过9160.09万股获批复,金融界
2385,2019-01-16,北方华创：定增事项获北京市国资委批准,e公司
2386,2019-01-16,【头条研报】增速高于全球 半导体将迎投资机会,新浪
2387,2019-01-15,"2019年机械行业周报1月第3期:发改委密集批复铁路基建项目,LG化学扩建电池厂助推锂电设备",证券之星
2388,2019-01-13,【东吴机械周观点】挖掘机12月同比+14%，持续看好新能源和轨交设备,透视先进制造
2389,2019-01-12,新年伊始逾千份研报出炉，市场看点在哪里？这只个股预期上涨空间超100%,e公司
2390,2019-01-11,"电子行业动态双周报:韩国半导体市场遇冷,中国有望逆势扩张",正点财经
2391,2019-01-11,53股获券商买入评级 立讯精密目标涨幅达101.21%,Wind
2392,2019-01-11,北方华创拟募资21亿扩大研发,北京商报
2393,2019-01-11,北方华创投资价值分析报告:站在2020年看国内半导体设备龙头发展,光大证券
2394,2019-01-10,半导体、电子设备：国产设备再获支持 荐18股,和讯
2395,2019-01-10,北方华创：瞄准全球最先进制程 增持评级,和讯
2396,2019-01-10,"机械设备行业周报2019年1月第2期:持续关注轨交设备与工程机械,精选板块内优质个股",长城证券
2397,2019-01-09,42股获券商买入评级 恒顺醋业目标涨幅达66.82%,Wind
2398,2019-01-09,【北方华创】拟向大基金增发扩产，瞄准全球最先进制程【东吴机械陈显帆】,透视先进制造
2399,2019-01-09,"机械行业周报:铁总工作会议召开,关注2019年轨交板块业绩大年机会",平安证券
2400,2019-01-08,北方华创：半导体设备国产化正当其时 增持评级,申万宏源
2401,2019-01-08,【平安】北方华创*002371*计划募投21亿元，加速14nm设备量产和5/7nm设备研发*推荐,平安研究
2402,2019-01-08,9日机构强推买入 六股成摇钱树,证券之星
2403,2019-01-08,36股获券商买入评级 万科A目标涨幅达79.64%,Wind
2404,2019-01-08,【新时代机械 郭泰团队】北方华创：拟募资发力先进工艺IC装备，紧抓进口替代机遇,新时代证券研究
2405,2019-01-08,中银国际*每日速递20190108：广汇能源、太极股份、北方华创、上汽集团、恒顺醋业；降准点评；首席周观点等,微信
2406,2019-01-08,【电子】北方华创：大基金加持，提供长远发展动力,中银国际证券研究
2407,2019-01-08,"【机械-北方华创(002371)】王华君：拟定增21亿加码5/7nm关键集成电路装备,“大基金”持股比例有望进一步提升0107",中泰证券研究所
2408,2019-01-08,"北方华创点评报告:拟向大基金等定增21亿,加速高阶设备研发及扩产",浙商证券
2409,2019-01-07,"北方华创动态点评:非公开募集资金21亿元,加快集成电路设备产业化",正点财经
2410,2019-01-07,"北方华创:发力集成电路设备,赛道龙头紧握抓手",正点财经
2411,2019-01-07,北方华创：拟募资加码主业 持续看好行业及公司发展,东北证券
2412,2019-01-07,19家公司预告业绩翻倍 引381只基金重仓入驻,证券日报
2413,2019-01-07,"电子行业:苹果下注可折叠手机,关注相关产业链标的",东北证券
2414,2019-01-07,"机械行业2019年周报1月第2期:2019年铁路投资趋势向上,OPEC减产执行或促进油价复苏",证券之星
2415,2019-01-06,【安信电子孙远峰团队-北方华创】布局5/7nm先进制程，定增助力公司研发提升,远峰电子
2416,2019-01-04,北方华创：拟向国家集成电路基金等定增募资不超21亿元,证券时报
2417,2019-01-04,北方华创：拟定增募资不超21亿元加码主业,Wind
2418,2019-01-03,2018年十大新闻事件，你亲历了几件？,电子信息产业网
2419,2019-01-03,广州加大与港澳台芯片产业合作 四股现上车良机,证券时报
2420,2019-01-03,机械设备行业:看好新能源设备和轨交设备,东吴证券
2421,2019-01-02,机械设备行业周报:多重需求驱动2019工程机械行业平稳增长,正点财经
2422,2019-01-02,"机械设备行业:经济向左政策向右,关注低估值工程机械板块",东北证券
2423,2019-01-01,半导体、电子设备：国内半导体设备建设加速 荐19股,东北证券
2424,2018-12-27,"机械行业周报:为有源头活水来,轨交、工程机械有望受益",证券之星
2425,2018-12-24,"机械设备行业:中央经济工作会议定调“逆周期调节”,轨交装备、工程机械有望受益",正点财经
2426,2018-12-21,董秘解码：天通股份压电晶体已经实现量产,巨丰财经
2427,2018-12-19,"机械设备行业:看好长川科技收购STI,持续关注锂电及轨交板块",东北证券
2428,2018-12-18,4万亿蠢蠢欲动，军工“小资产大集团”逐渐改观,Wind
2429,2018-12-17,"北方华创:受益国产替代趋势,业绩增长动力充足",中证网
2430,2018-12-17,"半导体论坛IC China会议纪要:半导体黄金十年,国产化蓄势待发",正点财经
2431,2018-12-15,机械制造：甘肃省力争到2020年铁路营运里程达到7200公里,川财证券
2432,2018-12-14,电子行业2019年投资策略:关注可实现确定增长的半导体装备、PCB及智能控制器产业,正点财经
2433,2018-12-14,26家集成电路产业公司已披露年报预告，逾八成预喜,Wind
2434,2018-12-13,"北方华创2018年三季报点评:毛利率净利率提升显著,饱满在手订单保障业绩增长",正点财经
2435,2018-12-13,被机构超级看好的成长股 未来3年净利增速超30%个股（名单）,证券时报
2436,2018-12-11,"机械制造业2018年12月周报第2期:原油减产超预期提振油价,11月中挖销量首次同比下滑",正点财经
2437,2018-12-11,"北方华创:业绩符合预期,国产IC设备龙头地位稳固",方正证券
2438,2018-12-11,"电子行业:苹果发布快冲新产品,关注手机存量替换技术",东北证券
2439,2018-12-10,机械制造：OPEC+减产改善油服预期 荐5股,中银国际
2440,2018-12-10,"机械设备行业:轨交投资维持高位,持续推荐“黑五”数据亮眼的龙头科沃斯",东北证券
2441,2018-12-07,【机械】王华君、朱荣华、许忠海（研究助理）：半导体设备：中国成全球最大市场，龙头受益自主可控-20181206,中泰证券研究所
2442,2018-12-06,财闻点金：我国投资规模最大国家级商业航天项目启动,巨丰财经
2443,2018-12-04,"北方华创:预收账款创新高,国产设备发展进入快车道",中证网
2444,2018-12-04,【机械/电子-北方华创(002371)】王华君、朱荣华、张欣：半导体设备龙头：迎战略机遇期！20181203,中泰证券研究所
2445,2018-12-03,机构评级精选：低估明显 两大芯片龙头获机构买入评级,巨丰财经
2446,2018-11-25,机械制造：轨交行业投资维持高位 荐8股,东北证券
2447,2018-11-23,电子行业100份业绩预告 近七成公司年报预喜,投资快报
2448,2018-11-21,"北方华创:半导体设备龙头业绩翻倍,成长逻辑逐步验证",中证网
2449,2018-11-20,长江电子|步入18年尾声，关注5G进展,长江电子
2450,2018-11-19,"机械行业周报:行业估值趋向低点,建议关注估值合理的优质成长股",平安证券
2451,2018-11-16,巨丰周报：题材遍地开花 A股剑指箱体上沿,巨丰财经
2452,2018-11-14,电子行业周报:iPhone或采用新天线技术12寸硅晶圆价格有望持续走高,上海证券
2453,2018-11-13,"北方华创:晶圆制造扩产拉动业绩,光伏平价上网加码成长",上海证券
2454,2018-11-06,“绩优生”扎堆建筑材料等三行业 8只个股被机构推荐,证券日报
2455,2018-11-05,169家上市公司预告全年净利翻倍，705只“慧眼”基金早已悄悄布局,证券日报
2456,2018-10-30,联讯证券：北方华创增持评级,联讯证券
2457,2018-10-30,【机械】北方华创：业绩稳步增长，半导体设备龙头公司在成长,中银国际证券研究
2458,2018-10-30,半导体板块直线下坠，北方华创逼近跌停,Wind
2459,2018-10-29,北方华创：三季报持续高增长，看好半导体设备业务成长【国信机械】,机械老司机
2460,2018-10-29,【光大电子杨明辉团队】北方华创：业绩维持高增长，半导体设备国产化将迎黄金机遇期——2018年第三季度报告点评,杨明辉电子
2461,2018-10-28,【安信电子孙远峰团队-北方华创三季度业绩点评】半导体设备龙头，三季度维持高速增长,远峰电子
