,2021-12-31,2021协同办公市场规模超500亿，为何大型政企更偏爱“收费”的360织语？,Ofweek
0,2021-12-31,半导体设备板块持续高景气 供需分化观点分歧未来如何掘金？ 专题,投资者网
1,2021-12-30,A股资金流向：元宇宙领衔题材多点开花，年末“红包”行情可期,Wind
2,2021-12-29,北方华创离中国的“应用材料”还有多远？,第一财经
3,2021-12-28,北方华创(002371.SZ)：拟出资1亿元参设北京京国管股权投资基金,格隆汇
4,2021-12-28,北方华创(002371.SZ)拟参设北京京国管股权投资基金,智通财经
5,2021-12-28,北方华创：参与设立北京京国管股权投资基金（有限合伙）,Wind
6,2021-12-26,北方华创：半导体设备种类丰富，受益于半导体扩产潮,每日经济新闻
7,2021-12-21,北向资金交投意愿转淡连续3日净卖出，白酒、新能源均遭出货,Wind
8,2021-12-20,北方华创：公司半导体设备销售以直销方式为主,每日经济新闻
9,2021-12-20,北方华创：公司实际控制人公布的减持计划尚未实施完毕,每日经济新闻
10,2021-12-20,北方华创：公司目前订单情况良好，经营正常,每日经济新闻
11,2021-12-20,半导体：未来两年走势,半导体风向标
12,2021-12-19,2021年A股年终盘点：十大超级牛股关键词,Wind
13,2021-12-17,12月17日热点题材概念分析：云游戏、福建自贸区领涨,搜狐
14,2021-12-17,茅台大跌800亿 具体是发生了什么？,至诚财经
15,2021-12-17,发生了什么？刚刚，茅台大跌800亿，芯片股狂跌！基金上市，立马30CM涨停！还能涨吗？,中国基金报
16,2021-12-17,A股午盘综述：充电桩概念股批量涨停，半导体、白酒两大热门板块卖压沉重,Wind
17,2021-12-15,中国电子专用设备工业协会：10大国产半导体设备供应商,199IT
18,2021-12-14,深度*行业*机械设备行业周报：中央经济工作会议强调双碳工作科学考核 风电、光伏相关设备景气度上升,新浪
19,2021-12-12,如何区分“阶段性成长股”和“长期成长股”？,虎嗅网
20,2021-12-10,京山轻机：生产清洗制绒设备的上市公司有捷佳伟创、迈为股份、北方华创等,每日经济新闻
21,2021-12-09,A股再融资月报：11月合计募资2256亿，4家公司再融资规模超百亿，中环股份降价开启硅片价格战？,每日经济新闻
22,2021-12-08,盛剑环境(603324)：立足泛半导体工艺废气治理 开拓湿电子化学品系统等业务,新浪
23,2021-12-08,电子行业2022年投资策略：半导体创新与国产化并重 汽车、VR／AR空间广阔,新浪
24,2021-12-08,大基金二期频出手，这类芯片价格创六年新高，高增长概念股名单出炉,Wind
25,2021-12-08,地产产业链集体走强，高景气赛道股持续调整,Wind
26,2021-12-07,大基金加速减持兆易创新，同行释放涨价信号，行业变局来了？,Wind
27,2021-12-07,600万手封盘，“汉阳兵工厂”来A股了，抢筹资金两倍市值，北上资金扫货的军工股出炉！央行下调这两类再贷款利率,中国基金报
28,2021-12-07,流动性周观察12月第1期：公募发行有所回暖 宏微观流动性环境再宽松,新浪
29,2021-12-06,基金收益跑不过银行定期，易方达付浩选择直接“躺下”？,新浪
30,2021-12-06,机械设备行业：服务机器人 高速新赛道,新浪
31,2021-12-02,北方华创：2018-2020年营业收入年复合增长率39.67%，归母净利润年复合增长率62.29%,每日经济新闻
32,2021-11-30,北京经开区集成电路企业涨声一片,新京报
33,2021-11-30,元宇宙炒作图谱：2大新特征正在浮现,Wind
34,2021-11-30,元宇宙炒作图谱：游资前仆后继，上演“最小阻力式”博弈,Wind
35,2021-11-29,深度*行业*机械设备行业周报：持续推荐高景气的半导体、海上风电、光伏HJT赛道,新浪
36,2021-11-29,机械设备行业研究周报：国内半导体设备行业将迎来高速发展,新浪
37,2021-11-29,银河电子周观点：国内10月手机出货量大幅增长 看好射频前端国产替代机遇,新浪
38,2021-11-29,科技硬件周报：功率半导体高景气度有望延续、关注5G+AIOT投资机遇,新浪
39,2021-11-28,电子行业周报：估值开始切换 乐观反映明年苹果、MINILED、半导体设备,新浪
40,2021-11-26,A股收盘综述：锂电池、稀土题材大涨，数字货币概念盘中异动,Wind
41,2021-11-26,【行情】半导体板块早盘走低，富瀚微跌超8%，国民技术、安路科技、卓胜微、赛微电子、北方华创等跌幅居前,金十数据
42,2021-11-26,半导体清洗设备，为何能成为中国芯片自主替代的“敲门砖”？,Ofweek
43,2021-11-25,北方华创(002371.SZ)实控人北京电控累计减持203.04万股 减持时间过半 减持股份,智通财经
44,2021-11-25,北方华创(002371.SZ)：减持期过半 北京电控已减持203.0381万股 减持股份,格隆汇
45,2021-11-25,北方华创：北京电控累计减持0.39%股份，减持时间过半 减持股份,Wind
46,2021-11-25,半导体刻蚀设备国产化,Ofweek
47,2021-11-25,手握“王炸”的半导体“新兵”，露笑科技是“真笑”还是“假笑”？,Ofweek
48,2021-11-23,深度*行业*半导体行业周报：思瑞浦发布数字隔离产品 FPGA安路科技上市,新浪
49,2021-11-23,深度*行业*机械设备行业周报：“十四五”风电装机预期显著上提 风电零部件及主机龙头持续受益,新浪
50,2021-11-22,电子行业周报：折叠屏关注度继续升温 德仪宣布大额扩产计划,新浪
51,2021-11-22,电子行业周报：苹果公司重回全球第一的宝座,新浪
52,2021-11-22,科技硬件周报：AIOT产业加速 CMP材料与设备受关注,新浪
53,2021-11-22,机械行业周报：低碳+全球化助力 锂电/光伏/风电设备将超预期,新浪
54,2021-11-22,新能源需求持续景气，产业转移为半导体设备材料,金融界
55,2021-11-22,中信建投机械设备2022年投资策略报告：短期寻求α，中长期顺应双碳背景,Wind
56,2021-11-21,从晶圆厂，看设备国产化,半导体风向标
57,2021-11-21,7000亿大市场！傅鹏博、朱少醒、谢治宇、刘格菘…顶流们都来了,Wind
58,2021-11-21,7000亿大市场！傅鹏博、朱少醒、谢治宇等顶流们都来了,Wind
59,2021-11-19,捷佳伟创：公司已有HJT订单,Wind
60,2021-11-19,国泰君安：维持北方华创(002371.SZ)“增持”评级 目标价降至518.14元,智通财经
61,2021-11-19,北方华创(002371)：半导体国产设备平台型龙头 产品布局广阔,新浪
62,2021-11-18,盘中涨超60%！国产半导体设备龙头上市，供货华虹中芯海力士,搜狐
63,2021-11-18,清洗设备深度报告：芯片良率的重要保障 清洗设备国产替代正当时,新浪
64,2021-11-17,深度*公司*盛美上海(688082)：持续技术创新、不断自我超越的半导体设备龙头,新浪
65,2021-11-17,中信证券：产能扩张+国产替代积极推进，看好未来1~2年半导体设备行业发展,e公司
66,2021-11-17,风格转向？200亿元资金净流出，新能源又遭跷跷板,Wind
67,2021-11-16,北向资金再度加仓近42亿连续4日净买入，批量扫货白酒医药股,Wind
68,2021-11-16,国家大基金又出手！3亿投向这只芯片股，瑞银、摩根大通也来了,Wind
69,2021-11-15,北方华创：锦州神工半导体是北方华创的供应商,每日经济新闻
70,2021-11-15,北方华创：公司没有对异丙醇胺的需求,每日经济新闻
71,2021-11-15,至纯科技：今年半导体设备营收或翻两倍，大基金何以青睐它？,第一财经
72,2021-11-15,科技硬件周报：半导体板块高景气度延续、关注5G+AIOT新机遇,新浪
73,2021-11-15,融资客青睐7股，未来股份买入占比高达42.68%,Wind
74,2021-11-15,305家公司公布最新股东户数,证券之星
75,2021-11-15,电子行业周报：杂音干扰的旺季VS乐观看待的明年,新浪
76,2021-11-14,招商策略：风格悄然变化原因和年底布局思路,Wind
77,2021-11-14,北方华创：研究框架（100页）,半导体风向标
78,2021-11-14,600亿浮盈“诱惑”下，大基金开始了减持潮 减持股份,腾讯网
79,2021-11-12,北向资金再度加仓超36亿，东方财富本周净买入近28亿,Wind
80,2021-11-12,电子行业周报：消费电子估值显现吸引力,新浪
81,2021-11-12,国家大基金又减持3家公司，大基金二期布局已在路上 减持股份,资本邦
82,2021-11-12,2300亿中芯国际突发“大地震”，国家大基金减持三只科技股,Wind
83,2021-11-12,每日理财观察: MSCI公布半年度指数评审结果,Wind
84,2021-11-12,"大基金加速""收网""，一晚减持3家公司！战略性转移？二期资金加速布局这些个股 减持股份",券商中国
85,2021-11-12,北向资金净买入A股86亿元，超18亿元扫货东方财富，还加仓了这些股（名单）,21世纪经济报道
86,2021-11-12,国家大基金又减持！大基金二期风格有变？,Wind
87,2021-11-11,中银证券：给予安路科技评级,证券之星
88,2021-11-11,深港通十大成交活跃股排名（11月11日）,Wind
89,2021-11-11,股价创历史新高股一览,证券时报网
90,2021-11-11,半导体设备行业系列报告之一：高景气赛道 国内企业崭露头角,新浪
91,2021-11-11,金融街下午茶2021年11月11日星期四,Wind
92,2021-11-11,大基金密集加仓！半导体景气度不减，北方华创等创历史新高,证券之星
93,2021-11-11,半导体设备持续走高，芯源微涨停、北方华创创新高,第一财经
94,2021-11-11,A股收盘综述：地产股掀起涨停潮，半导体、元宇宙高空加油,Wind
95,2021-11-11,北方华创涨停 半导体概念股集体飙升 机构：国产化仍是行业最强主线,第一财经
96,2021-11-11,快讯：北方华创涨停 报于452.1元,金融界
97,2021-11-11,芯源微、瑞芯微、北方华创涨停，国科微、全志科技涨超10%，芯片ETF（512760）涨超3.5%,资本邦
98,2021-11-11,半导体设备股拉升 北方华创封涨停板,格隆汇
99,2021-11-11,快讯：半导体芯片股午后继续走高 芯源微、晓程科技、北方华创等多股涨停,新浪
100,2021-11-11,北方华创封住涨停并创新高，芯片板块午后继续扩大升幅,Wind
101,2021-11-11,北方华创涨停，股价创历史新高,Wind
102,2021-11-11,半导体龙头涨近9%创新高，蔡嵩松浮盈5.3亿，百亿经理也赚了不少,AI财经社
103,2021-11-11,45亿资金加仓 半导体板块强势 这些个股获青睐,第一财经
104,2021-11-11,A股午盘综述：地产股爆发，招商、金地、泰禾、阳光城等封板,Wind
105,2021-11-11,中芯国际产业链指数冲高，北方华创涨超7%再创新高,Wind
106,2021-11-11,芯片股盘中快速走高，北方华创大涨5%,36氪
107,2021-11-11,快讯：芯片股盘中快速走高 北方华创股价创历史新高,财联社
108,2021-11-11,大基金出手！千亿巨头又遭减持...,Wind
109,2021-11-10,2021Q3电子板块财报解读,吉森电子研究
110,2021-11-10,电子行业周报：从美股大涨看中国半导体投资机遇,新浪
111,2021-11-09,2021三季度机械业绩总结报告：整体持续高增 专用设备表现亮眼,新浪
112,2021-11-09,北方华创：定增落地（附深度）,半导体风向标
113,2021-11-09,A股收评：沪指重回3500点，军工、芯片股携手走强，绿电股冲高回落,格隆汇
114,2021-11-09,东亚前海晨会|11月9日,新浪
115,2021-11-08,三季报回顾：核心龙头延续增长 半导体持续呈现高景气,新浪
116,2021-11-08,电子周报：半导体制造年会再次强调供应链安全 汽车电子持续景气,新浪
117,2021-11-07,元宇宙立功！游戏主题基金年内扭亏，机构百页研报预判20年趋势,华夏时报
118,2021-11-06,大基金投资节奏加快，中国半导体公司扩产忙,半导体行业观察
119,2021-11-05,51亿定增宣告完成！大基金二期喜提“打折价”！华天科技意欲何为？,财华社
120,2021-11-05,除了华天科技，国家大基金二期还买了什么？,Wind
121,2021-11-05,北方华创：大基金参与是对公司的认可丨公司问答,第一财经
122,2021-11-05,11亿参与华天科技定增，大基金二期加快“扫货”步伐,环球老虎财经
123,2021-11-05,电子行业专题研究：3Q持仓分析 北上持续加码半导体,新浪
124,2021-11-05,“国家队”出手！半导体热潮再被引燃，万亿市场迎来十年黄金期,证券之星
125,2021-11-05,美股半导体集体飙涨，A股信号不断，半导体行情如何走,Wind
126,2021-11-05,大基金又有大动作，11亿狂买芯片龙头，四季度半导体还能加仓吗？,第一财经
127,2021-11-05,美股半导体集体飙涨，1.1万亿巨头一度涨超15%,Wind
128,2021-11-05,国家队大基金再出手，11亿狂买芯片龙头！,Wind
129,2021-11-04,436家公司公布最新股东户数,证券时报网
130,2021-11-04,26亿元！大基金定增入股这两家公司！,新浪
131,2021-11-04,北方华创定增85亿大基金加仓15亿 前三季度业绩倍增研发费用率超14%,长江商报
132,2021-11-04,煤炭板块触底反弹，新能源震荡波动,资本邦
133,2021-11-04,电子行业3Q21业绩回顾：上游显着好于下游,新浪
134,2021-11-04,大基金动向曝光：超8成持仓股遭减持、加码芯片龙头,Wind
135,2021-11-04,晶盛机电业绩高增难挡300只基金退出 拟定增新赛道能否打造第二曲线,投资者网
136,2021-11-04,公募激辩“高估值”，“星辰大海”中优选投资标的,Wind
137,2021-11-03,ETF日报：老能源重整旗鼓，新能源暂时熄火,新浪
138,2021-11-03,大基金二期豪掷15亿入股半导体设备龙头，北方华创85亿定增受机构热捧,21世纪经济报道
139,2021-11-03,14家机构“秒赚”23亿，芯片龙头股定增一锤定音,华夏时报
140,2021-11-03,北方华创85亿定增落地：大基金认购15亿元 今年股价上涨约115%,21经济网
141,2021-11-03,智通A股机构动向参考(11.03) | 孕育反弹,智通财经
142,2021-11-03,市界早知道｜广药集团等拟65亿重整康美；恒顺醋业提价,Wind
143,2021-11-03,大基金持仓明细曝光，加码芯片设备龙头，超八成遭遇减持。北交所开市在即，精选层大活跃 减持股份,新浪
144,2021-11-03,390家公司公布最新股东户数,证券时报网
145,2021-11-03,半导体、新能源等高景气赛道“估值过高”质疑之声再起，基金经理怎么看？,Wind
146,2021-11-03,公募砸40亿元参与这家公司定增！高景气赛道估值争论再起，基金经理怎么看？,中证报
147,2021-11-03,公募基金持股市值创新高，社保显著加仓周期股（附表）,Wind
148,2021-11-03,10月新基金发行遇冷，机构热议“布局黄金期来临”丨基金下午茶,证券之星
149,2021-11-03,猪禽概念股走高！元宇宙龙头股四天涨超50%,Wind
150,2021-11-03,北方华创定增结果出炉，国家大基金再次斥资15亿元认购！,环球老虎财经
151,2021-11-03,2000亿半导体龙头再获大基金“加仓”！账面浮盈已超4亿，一期更狂赚10倍,证券时报
152,2021-11-03,北方华创85亿定增落地，“国家队”重磅出手，股价回调迎来上车机会？,第一财经
153,2021-11-03,【电子】北方华创 — 保持高速成长，平台化效果显著,中银证券研究
154,2021-11-03,国内芯片公司利润大增，半导体设备企业的新动态,Ofweek
155,2021-11-03,国家队出手！斥15亿巨资加仓芯片龙头北方华创,证券之星
156,2021-11-03,2000亿芯片龙头再被国家大基金加仓！一期浮盈近10倍,Wind
157,2021-11-03,小K播早报|因缺芯苹果削减iPad产量 大基金重仓北方华创,财联社
158,2021-11-03,国家队15亿高位加仓2000亿芯片龙头！有何深意,Wind
159,2021-11-03,最新筹码集中股名单出炉，23股连续3期集中,Wind
160,2021-11-03,北方华创85亿元定增落地 大基金二期获配15亿元,上证报
161,2021-11-03,上市公司正负面新闻2021年11月3日星期三,Wind
162,2021-11-03,北方华创85亿定增落地 大基金二期认购15亿，已浮盈逾4.6亿,每日经济新闻
163,2021-11-03,"""国家队""重磅出手！15亿加码2000亿芯片龙头",Wind
164,2021-11-03,国家队大基金15亿加仓芯片龙头北方华创,中国基金报
165,2021-11-02,郑重看股：大基金二期认购近15亿 北方华创还有多大向上空间,新浪
166,2021-11-02,2000亿芯片龙头定增揭晓，大基金二期斥资15亿入局，影响有多大？,财联社
167,2021-11-02,北方华创非公开募资总额近85亿，大基金二期认购近15亿,上游新闻
168,2021-11-02,北方华创(002371.SZ)披露定增结果：国家集成电路产业投资基金二期获配15亿元、南方基金、博时基金及国泰君安等均参投,格隆汇
169,2021-11-02,北方华创(002371.SZ)2796.05万股新增股份于11月4日在深交所上市,智通财经
170,2021-11-02,北方华创发布定增情况报告书：大基金二期认购近15亿元,财联社
171,2021-11-02,北方华创披露定增情况报告书：大基金二期认购493.4万股,Wind
172,2021-11-02,策略研究：新股精要-国内半导体清洗设备龙头盛美上海,新浪
173,2021-11-02,解盘：资源股低迷，半导体、食品、IGBT、航母领涨,Wind
174,2021-11-02,半导体板块集体爆发：紫光国微、北方华创涨超5%,格隆汇
175,2021-11-02,【东北电子程雅琪】北方华创（002371）三季报点评：单季度业绩创新高，国产半导体补短板空间巨大,东北证券研究所
176,2021-11-01,国海证券维持北方华创增持评级，三季报点评：2021Q3 业绩超预期，引领国产替代大潮崛起,每日经济新闻
177,2021-11-01,安信证券维持北方华创买入评级：Q3业绩延续高增长，在手订单充足,每日经济新闻
178,2021-11-01,公募三季度全景图绘出， “百亿俱乐部”规模缩水,Wind
179,2021-11-01,华创证券：维持北方华创(002371.SZ)“强推”评级 目标价424.3元,智通财经
180,2021-11-01,公募三季度全景图绘出“百亿俱乐部”规模缩水,Wind
181,2021-10-31,国盛证券维持北方华创买入评级：收入高速增长，设备品类加速扩张,每日经济新闻
182,2021-10-31,北方华创(002371)：设备需求旺盛 业绩高增长,新浪
183,2021-10-30,北方华创：再创新高（附测算）,半导体风向标
184,2021-10-30,北方华创：业绩符合预期，盈利能力大幅改善——公司三季报业绩点评,机械倩影
185,2021-10-29,东吴证券：给予北方华创增持评级,证券之星
186,2021-10-29,东吴证券维持北方华创增持评级：业绩符合市场预期，半导体设备龙头持续受益于行业高景气,每日经济新闻
187,2021-10-29,信达证券维持北方华创买入评级：在手订单饱满，设备龙头稳步成长,每日经济新闻
188,2021-10-29,信达证券：给予北方华创买入评级,证券之星
189,2021-10-29,苏州珂玛材料宣布完成新一轮融资 沃衍资本联合投资,凤凰网
190,2021-10-29,北方华创：公司PECVD设备在光伏、LED领域已实现批量销售,Wind
191,2021-10-29,北方华创：公司PECVD设备在光伏、LED领域已实现批量销售,每日经济新闻
192,2021-10-29,A股最具潜力的高端制造企业，有的在细分行业排全球第一！,搜狐
193,2021-10-29,北方华创前三季净利润大增102% 下游需求旺盛 研发投入“亮眼”,产业经济新闻网
194,2021-10-29,晨会聚焦211029重点关注航天宏图、金禾实业、赛轮轮胎、瑞可达、北方华创、中晶科技、思瑞浦、长电科技、华测检测、广州酒家等,国信研究
195,2021-10-29,北方华创(002371)：Q3业绩创新高 下游市场需求旺盛,新浪
196,2021-10-28,北方华创(002371.SZ)前三季度归母净利润同比增长101.57%至6.58亿元,智通财经
197,2021-10-28,图解北方华创三季报：第三季度单季净利润同比增144.16%,证券之星
198,2021-10-28,北方华创：2021年第三季度净利润约3.48亿元，同比增长144.16%,每日经济新闻
199,2021-10-28,北方华创(002371.SZ)：第三季度扣非净利润升296.69%至3.00亿元,格隆汇
200,2021-10-28,北方华创：第三季度净利同比增长144%,格隆汇
201,2021-10-28,北方华创：第三季度净利3.48亿元 同比增长144%,财联社
202,2021-10-28,北方华创：前三季度净利润同比增长101.57%,Wind
203,2021-10-28,港股盘前必读：中国平安前三季度净利润816.38亿元同比下降20.8%,Wind
204,2021-10-27,基金最新“十大抱团股”名单出炉！,Wind
205,2021-10-27,电子周报：中芯国际积极扶持战略供应商 继续看好设备材料、功率和模拟,新浪
206,2021-10-27,融资客大举加仓的业绩暴增股来了,Wind
207,2021-10-26,北方华创(002371)：3Q21业绩预告超出预期 提高全年盈利预测,新浪
208,2021-10-26,半导体制造系列：先进封装扮演更重要角色,新浪
209,2021-10-26,机械行业周报(2021年10月第3周)：隆基HJT电池效率再破世界纪录；持续力推光伏／风电／锂电设备,新浪
210,2021-10-25,电子行业周报：景气度分化 重点看好半导体(设备/汽车/特种)+汽车电子+新硬件龙头,新浪
211,2021-10-25,电子行业周报：鸿蒙生态蓬勃发展 IOT产业加速,新浪
212,2021-10-24,机械设备行业跟踪周报：持续看好高景气度的光伏半导体设备 建议关注双控影响下景气延续的机床刀具行业,新浪
213,2021-10-22,寻找预期差！半导体持续高景气，35家公司净利增100%,Wind
214,2021-10-22,A股收盘综述：煤炭钢铁板块调整、动力煤连吃三跌停，资金转向芯片和消费股,Wind
215,2021-10-22,中一签亏6000，新股一上市就破发！煤炭又崩了,Wind
216,2021-10-22,A股午盘综述：半导体产业链、地产、家电复苏，煤炭、钢铁板块调整,Wind
217,2021-10-22,国科微前三季净利大增119倍，机构建议四主线关注半导体板块投资机会,第一财经
218,2021-10-20,深度*行业*机械设备行业周报：风光大基地一期约100GW有序开工 建议相关光伏、风电、锂电设备板块,新浪
219,2021-10-20,华亚智能：目前公司向北方华创提供少量的产品供应,每日经济新闻
220,2021-10-20,国家大基金二期投资版图再扩大，已布局13家产业链标的,Wind
221,2021-10-19,深度*行业*半导体行业周报：三季报业绩普遍高增长 台积电表示产能紧张延续至2022全年,新浪
222,2021-10-19,电子行业周报：台积电2021Q3业绩解读及2021Q4展望,国海证券
223,2021-10-19,北方华创跌4.26% 国盛证券高点喊买入,中国经济网
224,2021-10-19,电子行业周报：关注3Q公司业绩预告,新浪
225,2021-10-18,北方华创：公司ALD设备在部分客户已实现销售，部分客户处于工艺验证阶段,每日经济新闻
226,2021-10-18,北方华创：目前公司产能基本满足交付需求，个别零部件供应推迟，导致公司部分产品订单交付有所延后,每日经济新闻
227,2021-10-18,北方华创：公司主要产品为电子工艺装备和电子元器件，是国内主流高端电子工艺装备供应商,每日经济新闻
228,2021-10-18,深度*行业*机械设备行业周报：能源短缺背景下绿电前景广阔 能源结构转型利好锂电、光伏设备,新浪
229,2021-10-18,从盛美股份登陆科创板，看盛美半导体（ACMR.US）真实价值,智通财经
230,2021-10-18,科技硬件周报：半导体景气周期延续,新浪
231,2021-10-18,电子行业周报：关注折叠屏创新、荣耀崛起以及苹果MINILED新品发布,新浪
232,2021-10-18,陆家嘴财经早餐2021年10月18日星期一,Wind
233,2021-10-17,首批“茅”概念业绩出炉，“医药女神”大举加仓中药茅,Wind
234,2021-10-17,电子行业周报：景气度分化 重点看好半导体(设备/汽车/特种)+汽车电子+新硬件龙头,新浪
235,2021-10-17,机械行业周报：第一期风光大基地已开工 持续推荐光伏风电设备,新浪
236,2021-10-17,机械设备行业跟踪周报：持续看好高景气度的光伏设备行业 国产机床龙头业绩持续超预期 建议重点关注,新浪
237,2021-10-15,电子行业2021年四季度投资策略：消费电子环比改善 布局低估值龙头半导体持续关注国产替代,新浪
238,2021-10-15,北方华创前三季度业绩持续高增 超250倍市盈率与股东减持引关注 减持股份,投资者网
239,2021-10-14,市场被荷兰/美国/日本占据，国产半导体设备厂商有机会吗？,Ofweek
240,2021-10-14,新莱应材(300260)：Q3预告大超预期 低估值+成本反转在,新浪
241,2021-10-13,新莱应材(300260)公司动态点评：业绩增长超预期 三大业务引擎齐发力,新浪
242,2021-10-13,北方华创(002371.SZ)：完成发行5亿元超短期融资券,格隆汇
243,2021-10-13,国海证券：维持北方华创(002371.SZ)“增持”评级 Q3业绩超市场预期,智通财经
244,2021-10-13,千亿芯片龙头两天大跌17%，半导体景气度见顶了？,Wind
245,2021-10-12,21硬核投研丨千亿芯片龙头卓胜微两天大跌17%，半导体景气度见顶了？,21世纪经济报道
246,2021-10-12,国海证券：给予北方华创增持评级,证券之星
247,2021-10-12,北向资金成交缩量全天净卖出近14亿元，东方财富遭大幅净卖出6亿元,Wind
248,2021-10-12,电子行业周报：对当前半导体板块投资机会的深度思考,国海证券
