3404,2020-01-03,开年金股名单“露脸” 8家券商联合推荐三一重工,证券日报
3405,2020-01-02,华泰证券GDR盘中大跌11% 创去年6月上市以来最大跌幅 连续下跌,智通财经
3406,2020-01-02,华泰证券：秉持差异化理念，Fintech龙头业务多元发展,证券时报网
3407,2019-12-31,深度|2020年资本市场展望之政策篇,中信建投非银金融研究
3408,2019-12-31,中基协发布3季度证券公司私募资管月均规模前20榜单,Wind
3409,2019-12-31,中信建投：长期来看，头部券商发展空间仍值得期待,Wind
3410,2019-12-31,天风高层岁末换将 券业全年300位董监高生变 董监高成员变化,时代周报
3411,2019-12-30,《证券法》落地开启行业发展新时代 龙头券商股配置价值凸显,证券日报
3412,2019-12-30,热门融资标的股票分析,华龙掘金
3413,2019-12-30,券商股再度反攻，国投资本大涨6%,Wind
3414,2019-12-28,行业月报：基本面宽松延续，建议增配券商板块,微信
3415,2019-12-28,【中原非银】证券行业2020年中期投资策略：全面深化资本市场改革快速推进，证券行业驶入高质量发展的快车道,中原证券研究所
3416,2019-12-27,华泰证券：北京银行禀赋优越改善可期 给予增持评级,中国经济网
3417,2019-12-27,券商股持续火热，南京证券大涨6%,Wind
3418,2019-12-26,2019券商改革多点开花，业绩估值双提升,证券日报
3419,2019-12-25,华泰证券：同意为境外全资子（孙）公司4亿美元债券提供担保 大额借贷担保,Wind
3420,2019-12-24,券商股尾盘发力，华林证券大涨6%,Wind
3421,2019-12-22,【天风非银|周报】券商利好政策正密集出台，保险2020年负债端有望好转，把握非银机会,新锐视角看金融
3422,2019-12-20,36家上市券商前三季获逾27亿元补贴,Wind
3423,2019-12-19,12月20日涨停板早知道：七大利好有望发酵,新浪
3424,2019-12-19,华泰证券(06886.HK)：开展股指期权做市业务收到中国证监会复函,格隆汇
3425,2019-12-19,12月19日上市公司晚间公告速递,新浪
3426,2019-12-19,证监会对华泰证券(601688.SH)开展股指期权做市业务无异议,格隆汇
3427,2019-12-19,中证协公布优秀课题研究报告结果 21篇报告脱颖而出,中证协
3428,2019-12-19,华泰证券大动作！首届执委会刚亮相，又见证监会官员出任CFO！高管团队全部就位,券商中国
3429,2019-12-19,34股获券商买入评级 华泰证券目标涨幅达52.71%,Wind
3430,2019-12-17,[观点]华泰证券：2020年上半年家居板块收入增速仍有支撑,全景网
3431,2019-12-17,【国君非银】华泰证券(601688)事件点评：职业经理人制度确立，奠定长期竞争优势基础,欣琦看金融
3432,2019-12-16,信雅达携手华泰证券 共筑信息安全长城,企业新闻网
3433,2019-12-16,【安信非银第50期周报】利好政策持续释放，年底持续看好板块行情,新角度新金融
3434,2019-12-15,【天风非银|周报】券商利好政策正密集出台，保险开门红向好已充分验证，把握非银机会,新锐视角看金融
3435,2019-12-14,漫步者熄火遭机构抛售 两游资合力追涨普元信息 股票卖空,南方财经网
3436,2019-12-13,沪港通十大成交活跃股排名（12月13日）,Wind
3437,2019-12-13,华泰证券“功勋”董事长周易交棒，继任者系出苏高科,环球老虎财经
3438,2019-12-13,券商股大涨，业绩改善叠加政策红利，头部券商脱颖而出,第一财经
3439,2019-12-13,任职资格获批 张伟将接任华泰证券董事长,上证报
3440,2019-12-12,116只低估值股获机构重仓且全年业绩有望高增长,Wind
3441,2019-12-11,挂牌转让1.99%股权 华泰证券“清仓”退出证通公司 资产异常,上证报
3442,2019-12-10,券商大变局风口：需中国的高盛、大摩承载资本市场核心功能,每日经济新闻
3443,2019-12-10,张辉：未来市场发展或由头部券商去做,和讯
3444,2019-12-10,【行业深度】证券丨证券行业业绩增长确定性强，业态亟需转型,中国银河证券研究
3445,2019-12-09,[公司]华泰证券开展商品期权做市业务获证监会复函同意,全景网
3446,2019-12-09,水泥板块全线上涨，砂石水泥价格涨势未歇,第一财经
3447,2019-12-09,华泰证券周易：锻造“科技赋能+创新进取”文化基因,证券时报
3448,2019-12-08,【天风非银|周报】开门红保费好转信号出现，股票期权标的有望扩容，非银迎来较好配置时点,新锐视角看金融
3449,2019-12-07,吴祖芳：客户需求将逐步趋向于个性化、多元化和专业化,和讯
3450,2019-12-07,华泰证券副总裁吴祖芳：我国证券市场服务实体经济功能稳步增强,中证网
3451,2019-12-07,11月业绩改善明显 上市券商全年业绩靓丽在望,中证报
3452,2019-12-06,华泰证券(601688.SH)：“16华泰G4”16日付息每手派息39.70元,格隆汇
3453,2019-12-06,深度|金融科技如何赋能企业转型升级？,中信建投非银金融研究
3454,2019-12-06,【天风非银|券商】11月月报：自营、投行等回暖驱动业绩环比+16%,新锐视角看金融
3455,2019-12-06,11月净利增20倍！一大波券商业绩牛了,中证报
3456,2019-12-05,券商11月业绩出炉！中信证券位居月度营收榜首 营收环比下滑幅度最大 盈利能力下降,资本邦
3457,2019-12-05,华泰证券：母公司11月净利为9891万元,证券时报
3458,2019-12-05,华泰证券(06886.HK)11月母公司净利润减少58.4%至9891.4万元 盈利能力下降,格隆汇
3459,2019-12-05,华泰证券(601688.SH)11月合计净利润2.14亿元 同比下降37.57% 盈利能力下降,格隆汇
3460,2019-12-05,华泰证券：11月净利润9891万元 同比下降78.5% 盈利能力下降,第一财经
3461,2019-12-05,华泰证券：母公司11月净利润9891.4万元,Wind
3462,2019-12-05,华泰证券：11月母公司净利润9891万元，10月净利为4.6亿元,Wind
3463,2019-12-05,45股获券商买入评级，工业富联目标涨幅达72.21%,Wind
3464,2019-12-05,起拍价下降两成！这家公司控股股东股份又被司法拍卖，此前被申请强制平仓，存在暂停上市风险！ 股票质押异常,e公司
3465,2019-12-03,融资客青睐12股，海亮股份买入占比高达57.50%,Wind
3466,2019-12-03,"白马股罕见连续两跌停,暴涨20倍大牛股罕见翻车,它们还有机会吗 连续下跌",证券时报
3467,2019-12-03,MSCI：将增加华泰证券A股股份数量从65.32亿股增加至73.57亿股,Wind
3468,2019-12-02,航母级券商“呼之欲出”，投资逻辑会有怎样的变化？,格隆汇
3469,2019-12-02,券商股拉升，中国银河涨超5%,Wind
3470,2019-11-29,券业文化建设明确路线图 券商塑造专业文化直面国际竞争,21世纪经济报道
3471,2019-11-28,华泰证券(601688.SH)：”16华泰G2“12月6日付息 每手派息37.80元,格隆汇
3472,2019-11-27,华泰证券：把握低估值和提价弹性，重视餐饮赛道,证券时报网
3473,2019-11-26,"华泰证券(06886.HK)""16华泰G1""12月6日付息及摘牌 退市",格隆汇
3474,2019-11-26,华泰证券(601688.SH)：“16华泰G1”12月6日付息 每手派息35.70元,格隆汇
3475,2019-11-26,华泰证券今日大宗交易成交80万股，成交价17.15元溢价0.82%,Wind
3476,2019-11-25,证券行业文化建设系列之一：打造科技赋能创新进取的文化特色与品牌形象——华泰证券对文化建设的思考与实践,中证协
3477,2019-11-25,【兴证金融】他山之石，解析国内外券商并购路径,兴证金融
3478,2019-11-20,谁在豪赌？长生退竟已大涨70% 退市在即却上演末日狂欢,证券时报网
3479,2019-11-20,长生退暴涨70%！退市在即近亿资金抢筹上演末日狂欢，谁在豪赌？,证券时报网
3480,2019-11-19,更多中企有望发行GDR，招股书如何讲故事大有门道,第一财经
3481,2019-11-18,华泰证券(601688.SH)：“18华泰G1”及“18华泰G2”26日付息,格隆汇
3482,2019-11-18,【川财研究所*深度报告】计算机：国际投行金融科技转型启示录,川财研究
3483,2019-11-18,境外子公司频频获增资——券商“走出去”再进一步,中国经济网
3484,2019-11-14,华泰证券(601688.SH)完成发行50亿元短期融资券,格隆汇
3485,2019-11-11,北上资金10月以来500亿加仓A股，家电三巨头合计买入超百亿,Wind
3486,2019-11-11,华泰证券：前三季度房企销售、拿地、融资集中度依然在进一步提升,乐居财经
3487,2019-11-10,大手笔增资子公司 这些券商境外布局又进一步,中证报
3488,2019-11-10,【天风非银|周报】宏观环境利好保险股，政策环境利好券商股，非银迎来较好配置时点,新锐视角看金融
3489,2019-11-08,中国太保将成首家发行GDR的A股上市险企！沪伦通将继续扩容,第一财经
3490,2019-11-07,【天风非银|券商】上市券商10月业绩环比下降26%，受益于18年低基数同比大增90% 盈利能力下降,新锐视角看金融
3491,2019-11-07,券商10月业绩滑坡 中信证券仍月赚27亿！ 盈利能力下降,中证报
3492,2019-11-06,加仓近百亿！券商三季度新入138股，三行业成最大赢家！四季度买啥？机构疯狂调研这些股票,券商中国
3493,2019-11-06,周易获聘成为华泰证券首任首席执行官兼执委会主任,中证报
3494,2019-11-05,钟情科创板券商自营真金白银来表白,证券时报
3495,2019-11-04,华泰证券：地产销售拿地融资集中度全面提升,乐居财经
3496,2019-11-04,周末影响一周市场的10大消息(新股+点评),证券时报
3497,2019-11-03,【天风非银】券商3季度综述：前三季度业绩高增长，政策驱动业务规模扩张,新锐视角看金融
3498,2019-11-03,从三季报看券业：光大入前十 自营业务利润主要来源,第一财经
3499,2019-11-01,531股获券商买入评级 福田汽车目标涨幅达71.57%,Wind
3500,2019-11-01,MSCI即将大扩容北上资金大举增持白马股,证券时报
3501,2019-11-01,上市券商前三季盈利797亿增逾六成自营贡献最大,证券时报
3502,2019-11-01,36家上市券商业绩出炉:17家净利翻番 看最新业务排名,新浪
3503,2019-10-31,【中信建投非银】华泰证券2019年三季报简评：净利润同比+44%，GDR套利压力已充分释放,中信建投非银金融研究
3504,2019-10-31,36家上市券商三季报扫描：行业全线回暖马太效应显著,经济观察报
3505,2019-10-30,机构调研:伟星新材两跌停 汇川技术称新能源车毛利低,新浪
3506,2019-10-30,【非银】华泰证券2019年三季报点评-三季度业绩增长稳定，龙头优势凸显,爱建证券研究所
3507,2019-10-30,季报点评 | 华泰证券：投资驱动，业绩略超预期,丁丁带你玩转金融
3508,2019-10-29,上市券商三季度大丰收：12家净利翻倍，最多增长近13倍,Wind
3509,2019-10-29,华泰证券(06886.HK)前三季度净利润64.4亿元 同比增长43.77%,格隆汇
3510,2019-10-29,华泰证券公布三季报 前三季净利增加43.77%,新浪
3511,2019-10-29,华泰证券：拟对部分募集资金用途进行调整,Wind
3512,2019-10-29,华泰证券：前三季度净利润64.41亿元，同比增长43.77%,Wind
3513,2019-10-28,华泰证券股票质押风险未知 机构减持套利动作频频 股票质押异常,投资者报
3514,2019-10-27,北上资金新动向：偏爱绩优超跌股,Wind
3515,2019-10-26,华泰证券GDR兑回比例达50% 双向转换机制顺利实施,上证报
3516,2019-10-25,沪伦通首只GDR交易活跃 ：打开兑回仅一周，华泰证券GDR存续量已不足核准发行量50%,21世纪经济报道
3517,2019-10-25,沪伦通渡过兑回限制期 华泰证券GDR与A股顺畅联通,新浪
3518,2019-10-25,华泰证券：GDR存续数量不足中国证监会核准发行数量的50%,Wind
3519,2019-10-24,华泰证券160亿元公司债获证监会核准批复,中金在线
3520,2019-10-23,罕见：券商股下跌引来北上资金大手笔抄底,新浪
3521,2019-10-23,北向资金今日净流出18.04亿元，万科A遭净卖出3亿元,Wind
3522,2019-10-22,A股共发生44宗大宗交易成交15.62亿元（10月22日）,Wind
3523,2019-10-22,北向资金小幅净流入近3亿元，华泰证券连续两日获外资大额买入,Wind
3524,2019-10-22,高盛：华泰证券(601688.SH)估值吸引 评级升至“买入”,格隆汇
3525,2019-10-22,融资客青睐14股，新华传媒买入占比高达47.51%,Wind
3526,2019-10-22,两大消息空袭券商股！天风证券巨量解禁致跌停，机会来了？长城证券近200亿解禁下周将至 解禁,券商中国
3527,2019-10-22,道达投资手记：券商股成杀跌主力 华泰证券GDR惹祸,腾讯网
3528,2019-10-21,天量解禁后天风证券一字跌停：高估值堰塞湖何时开闸放水？ 解禁,第一财经
3529,2019-10-21,券商股成杀跌主力！大户“武器库”又添新品种——道达投资手记,每日经济新闻
3530,2019-10-21,142亿市值解禁天风证券“一字”跌停！华泰证券也跌近6%，券商股何去何从？ 解禁,每日经济新闻
3531,2019-10-21,北向资金净流入逾29亿元，华泰证券获大幅净买入超8.5亿元,Wind
3532,2019-10-21,140亿市值解禁，天风证券一字跌停！更有多只短期暴涨大牛股闪崩 解禁,中国基金报
3533,2019-10-21,A股异动丨华泰证券跌5.7% GDR价格相较A股股价存在着约8%的折价,格隆汇
3534,2019-10-21,券商股走弱，天风证券跌停,Wind
3535,2019-10-20,安信证券：GDR兑换机制将如何影响华泰证券A股股价？,新浪
3536,2019-10-19,机构争相出逃合兴包装 游资穷追不舍诚迈科技,南方财经网
3537,2019-10-18,上市券商前三季累计盈利逾733亿元,Wind
3538,2019-10-17,华泰证券：金科股份业绩保持高增速，销售预计超额完成全年目标,乐居财经
3539,2019-10-17,9月份券商APP活跃度全线拉升 14家活跃人数超300万人,证券日报
3540,2019-10-17,中资券商股首选华泰证券,南方财经网
3541,2019-10-16,华泰证券(06886)前三季度累计新增借款325.88亿元 大额借贷担保,智通财经
3542,2019-10-16,华泰证券：当年累计新增借款超过上年末净资产20% 大额借贷担保,Wind
3543,2019-10-16,华泰证券(601688.SH)当年累计新增借款超上年末净资产20% 大额借贷担保,格隆汇
3544,2019-10-16,贵州茅台低开跌3.5% 失守1200元关口,21世纪经济报道
3545,2019-10-16,券商板块年内平均涨幅近50%,Wind
3546,2019-10-15,券商9月业绩分化：国元净利同比增16倍领跑，9家环比下滑 盈利能力下降,澎湃新闻
3547,2019-10-15,国泰君安布局东南亚 上半年国际业务营收同比增六成,新浪
3548,2019-10-15,华泰证券(06886-HK)9月净利润5.08亿人民币增4.6%,财华社
3549,2019-10-14,华泰证券(06886.HK)9月净利润增4.60%至5.08亿元,格隆汇
3550,2019-10-14,华泰证券：母公司9月净利5.08亿元，8月净利为3.8亿元,Wind
3551,2019-10-13,华泰证券(601688.SH)完成发行50亿元短期融资券,格隆汇
3552,2019-10-11,【安信非银第2期周报】券商业绩高增持续看好，规范发展健康险利好龙头,新角度新金融
3553,2019-10-11,【华泰证券GDR交易非常积极，更多中国企业正筹备赴英上市】目前，沪伦通已正式开通约4个月时间，中国企业通过沪伦通登陆伦敦,金十数据
3554,2019-10-10,华泰证券：低基数叠加推盘提速，9 月百强房企销售增速超预期反弹,乐居财经
3555,2019-10-10,沪伦通进入股份跨境转换阶段 华泰证券GDR即将开放兑回,中证报
3556,2019-10-09,华泰证券：GDR兑回限制期即将届满,Wind
3557,2019-10-09,华泰证券GDR即将开放兑回，不会导致公司股份数量发生变化,澎湃新闻
3558,2019-10-09,华泰证券GDR开放兑回倒计时，国投电力、太保赴伦上市在路上,第一财经
3559,2019-10-09,华泰证券：GDR兑回限制期即将届满,证券时报网
3560,2019-10-09,华泰证券(601688.SH)：8251.5万份GDR兑回限制期即将届满,格隆汇
3561,2019-10-09,华泰证券：重点关注三季报，目前少动多看，维持谨慎观望,证券时报网
3562,2019-10-07,金融：关注龙头价值 荐7股,广发证券
3563,2019-09-30,从科创板承销排行看券商变革的机遇,格隆汇
3564,2019-09-30,港股开盘前瞻：百威亚太IPO上市 锦州银行拟定增不超62亿股,智通财经
3565,2019-09-27,小摩减持华泰证券(06886) 1984.91万股，每股作价12.61港元 减持股份,智通财经
3566,2019-09-27,最被看好十大港股：瑞信给予腾讯控股目标价469港元,Wind
3567,2019-09-26,券商股权质押旧疾难愈 谁最受伤？,新浪
3568,2019-09-23,监管层继续重拳整治ABS领域中违规行为，长城证券接到监管警示 其他违规处罚,Wind
3569,2019-09-23,港股复盘：6连跌，资金提前开启休假模式？ 连续下跌,YY港股圈
3570,2019-09-23,金融：券商向主动管理转型 荐2股,爱建证券
3571,2019-09-22,华泰证券：华侨城A：资源禀赋兑现盈利，片区模式穿越周期,乐居财经
3572,2019-09-22,金融：行业分化不断显现 荐7股,广发证券
3573,2019-09-21,QFII扎堆A股核心资产大举加仓机构抱团股,证券时报
3574,2019-09-20,外资增持再现强信号：贵州茅台股价再创新高 华泰证券喊至1300元,21世纪经济报道
3575,2019-09-20,华泰证券：贵州茅台终端需求旺盛 业绩或将持续较快增长,e公司
3576,2019-09-19,多重利好聚集A股，9月份行情以稳为主,Wind
3577,2019-09-17,中信、华泰完成首笔外汇交易 对找到代客业务突破口有信心,中金网
3578,2019-09-16,独家！1.77亿收不回来，124人身陷其中，这一中科招商资管计划有啥猫腻？,每日经济新闻
3579,2019-09-16,小摩减持华泰证券(06886)约1999.26万股，每股作价约12.70港元 减持股份,智通财经
3580,2019-09-16,券商投行进入“强者为王”和“品牌为王”时代,Wind
3581,2019-09-12,华泰证券今日大宗交易成交13.50万股，成交价20.66元折价0.72%,Wind
3582,2019-09-12,港股公告精选：香港交易所拟与伦交所合并，打造领先的全球性金融基础设施,Wind
3583,2019-09-11,A股共发生71宗大宗交易成交13.11亿元（9月11日）,Wind
3584,2019-09-11,"非银金融行业周报:降准释放流动性,市场活跃情绪继续发酵",爱建证券
3585,2019-09-10,"非银行金融行业:股权融资缩水,业绩环比回落 盈利能力下降",证券之星
3586,2019-09-09,港股投资日历：友邦保险、安踏体育、复星国际等股除净,Wind
3587,2019-09-09,32家上市券商8月份合计盈利81亿元，同比增350%,Wind
3588,2019-09-06,时隔近5年：券商结售汇资格扩容 透露怎样的信号？,国际金融报
3589,2019-09-06,机构重金追击华工科技 深南股份暴涨游资难割舍,财富动力网
3590,2019-09-06,外汇市场参与主体扩大三家券商获结售汇业务资格,证券时报
3591,2019-09-06,3家头部券商结售汇试点获批,北京商报
3592,2019-09-06,时隔四年半 券商结售汇业务再扩容,券商中国
3593,2019-09-05,华泰证券(601688.SH)：结售汇业务经营资格获国家外汇管理局批复,格隆汇
3594,2019-09-05,中信证券、华泰证券、招商证券获结售汇业务试点资格,中证网
3595,2019-09-05,华泰证券：母公司8月净利润3.81亿元，7月净利为3.53亿元,Wind
3596,2019-09-05,外管局：积极开展证券公司结售汇业务试点，促进非银行金融机构外汇业务健康发展,Wind
3597,2019-09-04,中信建投再遭同业卖出评级 高估值成市场分歧点,证券市场周刊
3598,2019-09-04,【山证非银】华泰证券（601688.SH）：财富管理和机构服务双轮驱动， 平台化优势明显,山西证券研究所
3599,2019-09-03,自营发力增厚业绩，财富管理日益精进-华泰证券2019年中报点评,中信建投非银金融研究
3600,2019-09-03,上调评级至买入策略选股（9月3日）,Wind
3601,2019-09-03,QFII二季度末现身293只个股仍偏爱大消费蓝筹,证券时报
3602,2019-09-02,36家上市券商九成涨薪：中信证券人均薪酬36万登顶,澎湃新闻
3603,2019-09-02,36家A股券商半年赚554亿元 中信海通国君排前三,新浪
3604,2019-09-02,华泰证券：境外子公司获得伦交所会员资格,e公司
3605,2019-09-02,华泰证券：境外子公司获得伦敦证券交易所会员资格,Wind
3606,2019-09-02,36家上市券商六项指标大排名！中信、海通、中信建投霸占投行三强,券商中国
3607,2019-09-02,券商股集体发力，行业估值处于历史底部，头部券商更获青眯,第一财经
3608,2019-09-01,证金、汇金、QFII最新持股曝光 他们最爱哪些股？,重庆商报
3609,2019-08-30,【非银】华泰证券2019年中报点评-优势业务成绩亮眼，国际化拓展领先,爱建证券研究所
3610,2019-08-30,中报点评 | 华泰证券：业绩符合预期，海外布局亮眼,丁丁带你玩转金融
3611,2019-08-30,睿智投资｜华泰证券 (6886 HK) - 资管业绩抢眼，净利息收入及投资收益表现薄弱,招银国际
3612,2019-08-30,【国君非银】华泰证券19年中报点评：经纪和资管收入增长强劲，国际化战略持续深化,欣琦看金融
3613,2019-08-29,华泰证券披露中报：首单GDR增厚资本实力 扣非净利润增32.68%,中国经济网
3614,2019-08-29,华泰证券：上半年净利40.57亿元 同比增28%,e公司
3615,2019-08-29,华泰证券：上半年净利润40.57亿元，同比增长28.43%,Wind
3616,2019-08-29,非典型化工股华西股份：纺织主业滑坡 加杠杆投资,证券市场周刊
3617,2019-08-28,小摩减持华泰证券（06886）651.73万股，每股作价11.62港元 减持股份,智通财经
3618,2019-08-27,华泰证券：龙光地产盈利增长确定性强,格隆汇
3619,2019-08-26,江苏证监局：对华泰证券采取责令改正监督管理措施 其他违规处罚,Wind
3620,2019-08-26,江苏自贸区金融领域开放有大动作，9家本地银行均无实际控制人,Wind
3621,2019-08-25,中报披露前30日频繁卖股 雪莱特董事长被动减持涉敏感期 减持股份,大众证券报
3622,2019-08-24,华西股份：非典型化工股,证券市场周刊
3623,2019-08-23,华泰证券(06886.HK)将全部赎回“16华泰C1”次级债券,格隆汇
3624,2019-08-22,华泰证券(601688.SH)完成发行60亿元金融债券 票面利率3.4%,格隆汇
3625,2019-08-22,华泰证券：用科技重新定义券商服务全链条,证券日报
3626,2019-08-22,"非银金融行业周报:马太效应显著,关注中报利好兑现",爱建证券
3627,2019-08-21,华泰证券：刘晓丹女士不再担任华泰联合证券董事长，江禹接任 董监高成员变化,Wind
3628,2019-08-21,上半年券商净赚666亿 超九成实现盈利,长江商报
3629,2019-08-21,服务国家战略华泰证券28年从江苏走向世界,证券时报
3630,2019-08-21,再次走到十字路口的华泰证券,证券时报
3631,2019-08-21,"A股""加杠杆""！两融标的扩容，首日吸引120亿杠杆资金爆买新增标的",Wind
3632,2019-08-20,壮丽70年 行业排头兵丨华泰证券：用一次次自我颠覆完成华丽蜕变,证券时报
3633,2019-08-20,券商上半年净赚666亿元：中信证券第一 国泰君安紧随其后,经济观察网
3634,2019-08-19,宏图高科：参股公司华泰证券实施现金分红,金融界
3635,2019-08-16,131家券商上半年业绩放榜，中信最能赚！这项业务已成为比拼实力关键,中证报
3636,2019-08-16,券商上半年表现131家排座次 8家自营赚超20亿竟有一家亏1000万 亏损,每日经济新闻
3637,2019-08-16,"非银金融行业周观点:风控计算标准和两融政策放松,关注后续市场改善",万联证券
3638,2019-08-15,高评级券商占比下降明显 长江和广发大降级大跌眼镜 投资评级恶化,证券市场周刊
3639,2019-08-14,"华泰联合刘晓丹将交棒 曾表示""要做热爱生活的勇士""",国际金融报
3640,2019-08-14,刘晓丹将卸任华泰联合证券董事长，现任总裁江禹有望接棒,澎湃新闻
3641,2019-08-14,华泰证券将于19日发行60亿元金融债,中证网
3642,2019-08-14,乘用车格局：供给侧加速出清 头部公司更强,财富动力网
3643,2019-08-14,"非银金融行业告动态跟踪报:风控计算标准修订,利好高评级券商资本释放",万联证券
3644,2019-08-12,【主力龙虎榜】主力抱团这个板块,财富动力网
3645,2019-08-12,五连板华阳国际闪崩，市值蒸发12亿，活跃游资借巨震出逃 连续下跌,第一财经
3646,2019-08-09,华泰证券短期融资券发行 总额为40亿元,挖贝网
3647,2019-08-09,"非银金融行业周观点:保险减税增厚中报业绩,券商低基数效应初显",万联证券
3648,2019-08-08,华泰证券2018年年度权益分派实施 每股现金红利人民币0.30元,挖贝网
3649,2019-08-08,[快讯]华泰证券公布2018年年度分红实施方案,中财网
3650,2019-08-08,华泰证券：A股每10股现金红利人民币3.00元（含税）,Wind
3651,2019-08-08,华泰证券(601688.SH)2018年年度权益分派10派3元 股权登记日为8月15日,格隆汇
3652,2019-08-08,华泰证券(06886.HK)将于8月16日派发A股每股现金红利0.3元,格隆汇
3653,2019-08-08,机构抱银河磁体大腿 游资大哥出逃九鼎新材,南方财经网
3654,2019-08-07,华泰证券：华泰创新投资有限公司变更董事长,Wind
3655,2019-08-07,华泰证券2019年7月母公司营业收入10.51亿元,挖贝网
