943,2021-06-10,华泰证券(06886.HK)：“20华泰G6”将于6月18日付息,格隆汇
944,2021-06-10,加码锂电池项目，三机构近3亿元抢筹中国宝安,第一财经
945,2021-06-10,赛轮轮胎：新华联控股已累计被动减持1292万股 减持股份,Wind
946,2021-06-10,连续抛售！朱雀基金一周减持套现3亿港元华泰H股，原因竟是…券商股还能买吗？ 减持股份,证券时报
947,2021-06-10,曹申：数字化，标准化是华泰证券投资特色,乐居财经
948,2021-06-10,高瓴参股的这家公募，正被中原证券拿下控股权,财联社
949,2021-06-10,港股盘前必读：我国又一新冠灭活疫苗上市使用，港交所或提高主板上市门槛,Wind
950,2021-06-10,一周减持套现3亿港元？朱雀基金抛售华泰H股，原因竟是……,Wind
951,2021-06-10,华泰证券(06886)：“20华泰G5”将于6月18日本息兑付及摘牌,智通财经
952,2021-06-10,华泰证券(06886.HK)“20华泰G5”将于6月18日兑付并摘牌,格隆汇
953,2021-06-09,高瓴参股的合煦智远基金正被中原证券拿下控股权 控股或参股公募已成券商“新估值”,财联社
954,2021-06-09,【权益变动】华泰证券(06886.HK)被朱雀基金减持938.8万股 减持股份,财华社
955,2021-06-09,大豪科技嫁接红星二锅头的“豪饮”之路,阿尔法工场研究院
956,2021-06-08,"上海本地股掀涨停潮,聪明钱加速抢筹，四主线布局浦东“这盘棋”",时代财经
957,2021-06-08,朱雀基金减持华泰证券(06886)938.8万股，每股作价11.55港元 减持股份,智通财经
958,2021-06-08,北京首笔公募REITs项目成功募资13.38亿，场外销售机构含北京银行等8家,Wind
959,2021-06-08,白酒业务亏损还无生产基地，ST岩石九连涨已成妖精 亏损,华夏时报
960,2021-06-08,看好券商行业投资机会，关注两条主线,东北证券
961,2021-06-07,券商中期策略集中出炉：当前至三季度末是关键期，看好成长股,澎湃新闻
962,2021-06-07,华泰证券现1笔大宗交易 共成交241.14万元,新浪
963,2021-06-07,华泰证券今日大宗交易成交14.50万股，成交价16.63元溢价0.0%,Wind
964,2021-06-07,成都限制同踩“三道红线”房企拿地，这6家公司危险了？,Wind
965,2021-06-07,非银金融行业周报：规范发展定制医疗保险 资本市场发展成效显着,光大证券
966,2021-06-07,非银金融行业周报：规范城市定制型商保 医疗资源布局优先者受益,新浪
967,2021-06-07,【非银】市场交投活跃，行业继续向高质量发展推进——证券行业月报——中性,渤海证券研究
968,2021-06-07,【十大券商一周策略】全球资金流动时钟正流向股市,Wind
969,2021-06-06,下周操盘攻略：上市银行触发稳定股价措施，台积电4nm提前一季试产,Wind
970,2021-06-04,证券及其他：首批券商白名单出炉 关注行业高质量发展,新浪
971,2021-06-04,印花税消息引爆券商股机构已看好这些概念股,第一财经
972,2021-06-04,IPO业务大增 今年以来券商首发承销进账近百亿元,中证报
973,2021-06-03,债牛归来？“资金松”叠加“资产荒”，中高等级信用债配置价值凸显,21世纪经济报道
974,2021-06-03,华泰证券联合深交所举办基础设施公募REITs主题专项投教活动,中国网
975,2021-06-03,富时最新调仓名单出炉！多家券商曝光下半年资产配置策略,Wind
976,2021-06-02,华泰证券中期投资峰会：当前至三季度末是投资的关键时点,上证报
977,2021-06-02,华泰证券2021中期投资峰会：债市大概率难以摆脱震荡市,中国经济网
978,2021-06-02,债券估值二三事,东海基金
979,2021-06-02,券商白名单成入场券？基金投顾第二批考生焦急等待,Wind
980,2021-06-02,【券商聚焦】华泰证券削快手目标价12%至300.84港元 维持“买入”评级,凤凰网
981,2021-06-02,【权益变动】华泰证券(06886.HK)被朱雀基金管理减持756.62万股 减持股份,财华社
982,2021-06-02,非银金融行业周报：证监会公布证券“白名单” 合规风控成为关注重点,新浪
983,2021-06-01,华泰证券金融行业联席负责人李健：代理人团队需要一场脱胎换骨式的改革,证券日报网
984,2021-06-01,赛轮轮胎(601058.SH)主要股东新华联控股所持公司股票被动减持,智通财经
985,2021-06-01,券商杠杆率和ROE持续提升 龙头券商表现优于中小券商,新浪
986,2021-05-31,华泰证券充分发挥协同作用，全方位服务全国首批公募REITs发行,中国经济网
987,2021-05-31,十大券商：做多窗口继续！存量博弈向增量行情演进,Wind
988,2021-05-30,【国君非银】高基数效应影响，新增规模环比下降——2021年4月券商场外衍生品业务数据点评,欣琦看金融
989,2021-05-30,在三十而立的起点看华泰证券：坚信科技的力量，肩负起新担当,中国网
990,2021-05-29,北上资金大举加仓，刷新多项历史纪录,Wind
991,2021-05-28,寻找金融科技的赋能王者,新浪
992,2021-05-28,券商APP两大用户黏性指标排名生变：人均使用时长平安证券突出，启动次数安信证券居首，异军突起者各有秘籍,财联社
993,2021-05-28,证券行业投资策略专题报告：超跌明显 左侧布局,国联证券
994,2021-05-28,华泰证券(06886)：每手“13华泰02”将于6月7日派息51元,智通财经
995,2021-05-28,华泰证券(06886.HK)：“13华泰02”将于6月7日开始付息,格隆汇
996,2021-05-28,华泰证券现1笔大宗交易 共成交453.68万元,新浪
997,2021-05-28,“全球资管中心”引爆券商新龙头，兴业、东方证券领涨，公募上市预期大大提升参控股券商估值想象力,证券之星
998,2021-05-28,在华泰证券，O45是如何落地的？,恒生电子
999,2021-05-28,野村：看好优质券商龙头未来表现 首选中信证券(06030)及中金公司(03908),智通财经
1000,2021-05-27,6只公募REITs询价 22家券商自营86次参与认购,每日经济新闻
1001,2021-05-27,【重视券商|天风非银】券商的“大财富管理”业务的高速发展将提升整体估值,新锐视角看金融
1002,2021-05-27,华夏幸福蹊跷涨停：572亿元债务难挡北上资金、知名游资狂买,Wind
1003,2021-05-27,日本进口光刻胶供应紧张，A股光刻胶板块大涨,观察者网
1004,2021-05-27,《股东来了》2021湖北片区举办投教进校园活动,证券时报网
1005,2021-05-26,哄抢！22家券商自营累计出动86次参与6只公募REITs询价! 1家券商自营竟成唯一无效报价机构！,每日经济新闻
1006,2021-05-26,华泰证券今日大宗交易成交57万股，成交价16.81元溢价0.18%,Wind
1007,2021-05-26,上交所 华泰证券联合主办“共话财富管理 激发沪市活力”第一期会员交流活动,陆家嘴金融网
1008,2021-05-26,诺唯赞过会：今年IPO过关第159家 华泰联合过6.5单,中国经济网
1009,2021-05-26,证券步入可持续增长新时代，金融科技迈向行稳致远新周期,金融界
1010,2021-05-26,券商财富管理转型成效凸显，基金代销规模展现硬实力,Wind
1011,2021-05-25,非银金融财富管理专题研究系列之一：权益公募与财富管理的未来是星辰大海,新浪
1012,2021-05-25,非银行金融行业2021年下半年投资策略：选择“差异化”成长龙头 分享股权投资大时代,新浪
1013,2021-05-25,一季度前20强券商私募主动管理占比首次超60%，更有9家超过70%，中金公司高居榜首！,每日经济新闻
1014,2021-05-25,华泰证券：成功发行60亿元人民币公司债,Wind
1015,2021-05-25,华泰证券完成发行60亿元公司债券,Wind
1016,2021-05-25,上市券商补血汹涌，广发证券500亿公司债获批,Wind
1017,2021-05-25,行业高质量发展可期，券商股受资金青睐,Wind
1018,2021-05-24,A股收盘综述：上证指数止步三连跌，创业板指涨0.85%,Wind
1019,2021-05-24,东吴证券：券商板块当前估值处于历史相对底部，配置价值显着,证券时报网
1020,2021-05-24,【中信建投非银周报】板块开启左侧布局机会，关注券商短期磨底反弹,中信建投非银金融研究
1021,2021-05-24,券商板块再度活跃，板块估值已至底部，关注两类股,证券时报网
1022,2021-05-24,诺唯赞IPO之前的业绩暴增，是不是保荐机构华泰证券设的局？,新浪
1023,2021-05-24,【非银】监管层再申高质量发展，关注板块长期投资价值——非银金融行业周报——中性,渤海证券研究
1024,2021-05-24,2000亿“东北茅台”闪崩跌停！高瓴易方达等300家机构紧急调研,Wind
1025,2021-05-22,华泰：买方基金投顾的特点、现状与展望,华泰证券研究所
1026,2021-05-22,锂电池概念反复走强 资金获利出逃西藏矿业,财富动力网
1027,2021-05-22,3500点关口上演拉锯战，资金反复试探突破口,Wind
1028,2021-05-21,长春高新放量跌停，两机构卖出3.59亿元,Wind
1029,2021-05-21,奥精医疗首日涨478% IPO募5.48亿华泰联合赚0.38亿,中国经济网
1030,2021-05-21,龙头股一个月大涨90%，游资扎堆冲向这里……,Wind
1031,2021-05-20,证券行业2020年报及21年一季报总结：行业盈利能力稳步提升 龙头券商业务优势凸显,新浪
1032,2021-05-20,华泰证券(06886.HK)：提名区璟智为独立非执行董事候选人,格隆汇
1033,2021-05-20,搜于特：马鸿及兴原投资合计减持1.53%公司股份 减持股份,Wind
1034,2021-05-20,券商板块异动拉升，次新股财达证券十连板,第一财经
1035,2021-05-19,华泰证券(601688)2021年一季报点评：投行业务高速增长 期待公司治理的正反馈,新浪
1036,2021-05-19,QFII炒股能力揭秘：前十机构回报均超20倍,Wind
1037,2021-05-18,数字化驱动差异化服务升级，华泰证券发布股份管理一体化平台,中国网
1038,2021-05-18,规模骤降、成本上升，5月公司发债融资变化大！,Wind
1039,2021-05-18,康拓医疗上市首日涨431% IPO募2.5亿华泰联合赚0.3亿,中国经济网
1040,2021-05-18,金融行业：公募基金销售保有规模发布券商渠道销售家数居首,新浪
1041,2021-05-18,华泰证券(06886.HK)成功60亿元公司债,格隆汇
1042,2021-05-17,【行情】港股中资券商股走弱，光大证券跌超3%，华泰证券跌超2%，中信证券跌1.94%，国泰君安跌1.57%,金十数据
1043,2021-05-17,【中信建投非银周报】券商财富管理业务提速，险企代理人改革持续推进,中信建投非银金融研究
1044,2021-05-17,非银金融行业周报：券商反弹背后是估值见底 看好财富管理主线,新浪
1045,2021-05-17,财信证券证券行业2021年4月月度报告：一季报行业业绩偏乐观，估值处历史后8%分位,财信证券研究
1046,2021-05-17,券商股掀涨停潮 两主线布局掘金,财富动力网
1047,2021-05-17,估值和业绩“背离”加剧 航母券商概念逐步凸显,中国基金报
1048,2021-05-16,【券商年报&一季报】行业盈利能力稳步提升，龙头券商业务优势凸显【中泰金融·戴志锋/陆韵婷/高崧】,传统借贷vs新型金融
1049,2021-05-16,基金代销前100强出炉，47家券商上榜,Wind
1050,2021-05-16,周末证券|白酒医药大金融要买先看“性价比”,金融投资报
1051,2021-05-15,“牛市旗手”突然大爆发！估值和业绩“背离”太久了，航母公司要火了？,中国基金报
1052,2021-05-15,核心资产板块呈现分化走势 逢低关注白酒、医药、大金融,金融投资报
1053,2021-05-14,基金圈的“宝藏券商”：东方证券非货公募销售保有排名行业第十，如何以一成客户撬动六成规模？,财联社
1054,2021-05-14,证券1Q21公募销售保有量数据点评：看好深度参与权益公募产业链的券商股,新浪
1055,2021-05-14,罕见10只券商股齐掀涨停潮：牛市旗手似苦尽甘来 这一波行情延续性来了？,财联社
1056,2021-05-14,非银金融行业2021Q1销售机构公募基金保有数据点评：独立三方份额快速提升 行业或加速转向保有竞争,新浪
1057,2021-05-14,【港股热点】中芯国际电话会议：产能优先满足长期客户 市场供需缺口巨大 展望第二季营收增19%,--
1058,2021-05-14,华泰证券大涨,新浪
1059,2021-05-14,最新追查，2确诊病例省外详细轨迹公布！医药股飙升,Wind
1060,2021-05-14,华泰证券(06886)：2021年公司债券(第三期)票面利率为3.71%,智通财经
1061,2021-05-14,经纪业务走量不可持续,证券市场周刊
1062,2021-05-14,财信证券：券商板块目前估值处于历史底部位置，具有一定的安全边际,Wind
1063,2021-05-14,券商板块再当旗手：浙商证券等3股涨停，现阶段能否逐步买入？,第一财经
1064,2021-05-13,财富管理进入黄金期 券商迎来业绩增量空间,大众证券报
1065,2021-05-12,华泰证券：H&H国际(01112)业务将逐渐复苏 有望带动估值重估 目标价40港元,智通财经
1066,2021-05-12,非银金融行业周报：收入普增 业绩驱动因素分化,新浪
1067,2021-05-12,年初以来三家券商股价接近腰斩，行业PB跌入历史低位，接近10年期机会值，股价否极泰来近了吗？,财联社
1068,2021-05-12,中泰证券：龙头券商有望实现强者恒强，行业目前估值相对低位，具备左侧配置价值,证券时报网
1069,2021-05-11,上期所公布黄金等期货、铜等期权做市商增补名单,Wind
1070,2021-05-11,券商海外业务排座次：海通与中金连续四年收入占比霸榜，中信建投增速最快，券业大举发力“走出去”,财联社
1071,2021-05-11,券商板块强势上扬，华创阳安等涨停，关注低估值下板块配置机会,证券时报网
1072,2021-05-11,又见券商股跌停，咋回事？谁在抛弃券商板块？,Wind
1073,2021-05-11,华泰证券：疫情冲击下表现分化，在线数字经济享红利但边际递减，营销出版复苏,证券时报网
1074,2021-05-10,渤海证券--非银金融行业周报：券商一季度经营向好，关注低估值下板块配置机会【行业研究】,金融界股吧
1075,2021-05-10,【中信建投非银周报】一季报业绩收官，非银板块估值磨底待修复,中信建投非银金融研究
1076,2021-05-10,机构懵了！茅台5连跌，3个月跌没了一个五粮液,Wind
1077,2021-05-10,科技化平台化打法持续发力，投行及自营表现亮眼———华泰证券（601688）2021Q1业绩点评,强思非银
1078,2021-05-10,【非银】券商一季度经营向好，关注低估值下板块配置机会——非银金融行业周报——中性,渤海证券研究
1079,2021-05-10,非银金融行业双周报：估值低位 关注短期边际变化个股,新浪
1080,2021-05-10,【十大券商一周策略】当下是周期股最佳布局窗口,Wind
1081,2021-05-09,【中信建投 非银&金融科技】各项业务全面开花，头部券商优势尽显——证券业2021年一季报综述,中信建投非银金融研究
1082,2021-05-09,券商业绩大分化！自营业务拉开业绩差距,Wind
1083,2021-05-08,【兴证金融】创新业务蓬勃发展，行业景气度再攀升——证券业2020年报&2021Q1综述,兴证金融
1084,2021-05-08,数钱数到手抽筋：券商“卖产品”卖出7万亿大市场！“财富管理转型”之路由此开启？,每经头条
1085,2021-05-08,非银金融行业：非银板块一季报业绩向好 估值走低性价比凸显,新浪
1086,2021-05-07,券商年报|中信建投信用减值损失增23倍 中金公司信披惜墨如金,新浪
1087,2021-05-07,华泰证券：上调JS环球生活(01691)目标价14.9%至29.64港元 预计2021年海外需求仍旺盛,智通财经
1088,2021-05-07,国信证券：华泰证券(601688.SH)投行业务大增，维持“增持”评级,智通财经
1089,2021-05-07,国信证券--华泰证券2021年一季报点评：投行业务大增，投资贡献突出【公司研究】,金融界股吧
1090,2021-05-07,券商行业周报：一季报业绩显着提升 头部券商表现亮眼,新浪
1091,2021-05-07,关于同意华泰证券股份有限公司为国泰中证细分机械设备产业主题交易型开放式指数证券投资基金提供主流动性服务的公告,上交所
1092,2021-05-07,临停核查！“妖股”锦泓集团10连板背后：游资狂欢与巨额商誉减值压力 资产异常,证券之星
1093,2021-05-07,中信建投金融团队最新研究观点,中信建投证券研究
1094,2021-05-06,【天风非银】2020年上市券商年报综述：大资管+大财富快速发展，头部效应显着,新锐视角看金融
1095,2021-05-06,华东医药今日跌停，外资择机出货,Wind
1096,2021-05-06,去年净利超百亿上市券商增至5家，国盛金控和太平洋出现亏损 亏损,澎湃新闻
1097,2021-05-06,最全！40家上市券商2020年业绩大起底：中信、国君、海通等5家净利超百亿；兴业证券增速最惊艳！,每日经济新闻
1098,2021-05-06,徐翔狱中也踩雷！百万股民当心，21股今天将被ST 风险警示,Wind
1099,2021-05-06,关于同意华泰证券股份有限公司为嘉实中证沪港深互联网交易型开放式指数证券投资基金提供主流动性服务的公告,上交所
1100,2021-05-06,481股获券商买入评级 宇信科技目标涨幅达145.25%,Wind
1101,2021-05-06,北京市天元律师事务所关于西安康拓医疗技术股份有限公司 首次公开发行股票并在科创板上市战略配售专项核查的法律意见,证券时报
1102,2021-05-05,出手稳狠准！看看大券商自营操盘手法,腾讯网
1103,2021-05-05,"40家上市券商一季度业绩大比拼：中信、国泰君安、海通净利居前三，第一创业、太平洋暴降9成！投资业务为利润最大变量！
盈利能力下降",每日经济新闻
1104,2021-05-03,瑞信：上调华泰证券(6886.HK)目标价至19.3港元 评级“跑赢大市”,格隆汇
1105,2021-05-02,41家券商一季度自营收入大比拼:太平洋、光大亏损 亏损,每日经济新闻
1106,2021-05-01,41家上市券商一季度自营收入大比拼：海通、长江、兴业等6家同比增逾100%；但太平洋、光大、第一创业亏损！,每日经济新闻
1107,2021-05-01,"哪家券商""炒股""最牛？一季度榜单出炉，国泰君安暴增50倍，海通投资收益近50亿，这3家出现亏损 投资失误",券商中国
1108,2021-05-01,这一决定性板块又亮了：4月券商金股平均涨幅创年内新高，7大组合年内累计收益超10%！,每日经济新闻
1109,2021-05-01,一季度头部券商也分化：国君净利大增142% 中信建投却下滑12%,新浪
1110,2021-05-01,券业净资产收益率已升至7.6%，重资本业务知易行难,Wind
1111,2021-04-30,2021年，这些药企更受资本青睐！,制药网
1112,2021-04-30,华泰证券(601688)：投行品牌强化带动收入提升 信用减值谨慎计提,新浪
1113,2021-04-30,收入创十年新高！投行盛宴之下：人才换血，内卷加剧,Wind
1114,2021-04-30,2020年报数据显示：江苏上市公司实现营收近2.5万亿元,经济日报
1115,2021-04-30,赚翻了！券商一季报出炉，“一哥”狂赚51亿,Wind
1116,2021-04-30,券商一季报出炉，“一哥”中信证券狂赚51亿！,中国基金报
1117,2021-04-30,赚翻了！券商一季报出炉，“一哥”狂赚51亿！更有龙头净利猛增141%,中国基金报
1118,2021-04-30,业绩总体稳健增长，投行业务表现亮眼丨华泰证券（601688）2021年一季报点评【华创非银】,华创非银
1119,2021-04-30,仍处高增长！上市券商首季业绩排名出炉，中信国君海通营收超百亿，东财净利位居第九，各业务排名有看点,证券之星
1120,2021-04-30,交银国际：华泰证券目标价降至12港元 给予中性评级 机构下调估值,新浪
1121,2021-04-30,交银国际：下调华泰证券(06886)目标价17.2%至12港元 评级“中性” 机构下调估值,智通财经
1122,2021-04-30,上市公司炒股众生相，有人欢喜有人愁,资本邦
1123,2021-04-30,华泰证券：2021年第一季度净利润约33.09亿元，同比增长14.58%,每日经济新闻
1124,2021-04-29,华泰证券(601688.SH)一季度归母净利同比增长14.58%至33.09亿元,智通财经
1125,2021-04-29,牛市旗手彻底爆发！啥情况？3家券商首季营收超百亿,Wind
1126,2021-04-29,华泰证券：一季度净利润同比增长14.58%,Wind
1127,2021-04-29,华泰证券(06886.HK)一季度净利升14.58%至33.09亿元,格隆汇
1128,2021-04-29,华泰证券(06886)首季归母净利同比增长14.58%至33.09亿元,智通财经
1129,2021-04-29,华泰证券：一季度净利润33.09亿元，同比增长14.58%,Wind
1130,2021-04-29,一季度业绩靓丽 国泰君安、海通证券等大幅走高,证券时报网
1131,2021-04-29,"券商股迎""业绩涨"" 头部券商领衔爆发 总市值座次重排",财联社
1132,2021-04-29,早评：沪指高开0.03% 农业相关板块走强,网易
1133,2021-04-29,券业科技投入大比拼！华泰18亿居榜首，招商大增52%,Wind
1134,2021-04-29,拥抱金融科技 前十券商去年花费超百亿,全景网
1135,2021-04-29,券商“联姻”风声再起，证券业新一波并购浪汹涌来袭,Wind
1136,2021-04-28,风险对冲需求提升，场外金融衍生品业务2020年增至4.76万亿， 华泰中信申万宏源新增交易量霸榜前三,21世纪经济报道
1137,2021-04-28,北向资金连续4日增持A股，贵州茅台逆市遭抛售近10亿元,Wind
1138,2021-04-28,华泰证券：华夏航空（002928.SZ）2020盈利正增长，维持“买入”评级,智通财经
1139,2021-04-28,券商2020年报释放强烈信号：经纪业务、投行全面内卷化生存,Wind
1140,2021-04-28,券商2020年报释放强烈信号：经纪业务、投行全面内卷化生存,21世纪经济报道
1141,2021-04-28,北向资金3日扫货超百亿，加仓这些个股,21世纪经济报道
1142,2021-04-27,两融市场继续上演争夺战，30家上市券商两融收入榜出炉，价格战火不断，融资利率跌破6%,财联社
1143,2021-04-27,华泰证券(06886)：“18华泰C2”将于5月10日本息兑付及摘牌,智通财经
1144,2021-04-27,华泰证券(06886)完成发行50亿元公司债券 票面利率3.42%,智通财经
1145,2021-04-27,重庆银行业绩发布高效透明，300多位投资者用行动点赞！,--
1146,2021-04-27,华泰证券：长海股份（300196.SZ）21Q1业绩高增，维持“买入”评级,智通财经
1147,2021-04-27,华泰证券：维持H&H国际(01112)“买入”评级 预计1Q21起业务逐渐复苏 目标价40港元,智通财经
1148,2021-04-26,非银金融行业周报：并购题材有望带领券商板块反弹,新浪
1149,2021-04-26,【非银】券商一季报业绩表现分化，关注板块长期配置价值——非银金融行业周报——中性,渤海证券研究
1150,2021-04-26,北京市天元律师事务所关于博众精工科技股份有限公司 首次公开发行股票并在科创板上市战略配售专项核查的法律意见,证券时报
1151,2021-04-26,部分一线券商盈利能力表现强劲 探寻新商业模式发力新增长点,中国基金报
1152,2021-04-25,券商火拼千亿融券市场：券源渠道、利率价格成竞争关键,第一财经
1153,2021-04-25,机构持仓清单来了！这些个股被重点加仓（附表）,Wind
1154,2021-04-25,惊呆！大牛市，这家券商净资产收益率居然不到1%，连续三年！,证券之星
1155,2021-04-24,千亿白马歌尔股份强势反弹 混改兑现徐工机械高位承压,财富动力网
1156,2021-04-23,华泰证券(06886.HK)2021年公司债券(第二期)票面利率为3.42%,格隆汇
1157,2021-04-23,华泰证券：新易盛（300502.SZ）毛利率呈现下滑趋势，下调至“增持”评级 盈利能力下降,智通财经
1158,2021-04-23,北京市天元律师事务所关于西安康拓医疗技术股份有限公司首次公开发行股票并在科创板上市战略配售专项核查的法律意见,证券日报
1159,2021-04-22,"华泰证券(06886.HK)：""20华泰G3""将于4月29日付息",格隆汇
1160,2021-04-22,6个月暴增50%，融券余额首破1500亿大关,Wind
1161,2021-04-22,卸包袱释风险，券商“抱团”减值真相起底,Wind
1162,2021-04-22,融券余额首破1500亿，券商火速布局抢占市场,Wind
1163,2021-04-21,再现高管变更 长江资管总经理离职 母公司长江证券资产托管部总经理杨忠接任 董监高成员变化,每日经济新闻
1164,2021-04-21,上市券商一季度业绩分化 盈利能力下降,证券之星
1165,2021-04-21,犀牛财经视频：华泰总经理离职，挖下属创新私募 董监高成员变化,和讯
1166,2021-04-21,华泰证券(06886.HK)：为境外全资附属公司发行1亿美元债券提供担保 大额借贷担保,格隆汇
1167,2021-04-21,华泰证券(06886.HK)：境外债券4月21日开始在联交所上市,格隆汇
1168,2021-04-21,华泰证券(601688.SH)完成增发1亿美元固定利率美元债券,智通财经
1169,2021-04-21,华泰证券：为境外全资附属公司发行美元债券提供担保 大额借贷担保,Wind
1170,2021-04-21,券商发力场外业务这一年！新增规模逼近5万亿，头部券商大施拳脚，收益互换大爆发，华泰中信申万宏源居前三,财联社
1171,2021-04-20,中国证监会市场禁入决定书（黄建雄） 其他违规处罚,证监会
1172,2021-04-20,中国证监会行政处罚决定书（黄建雄） 金融监管处罚,证监会
1173,2021-04-20,5000亿资管巨头进军公募！券商资管最新排名曝光,Wind
