1221,2020-10-28,定增市场周报：华润微定增加码半导体封测 豆神教育募资额上调逾五成,新浪
1222,2020-10-28,半导体行业高景气持续演绎 华润微拟定增50亿加码主业,投资者网
1223,2020-10-27,白马股接连闪崩！多次闪崩的大牛股却拉涨停，出逃资金在怎么布局？,中证报
1224,2020-10-27,社保基金持有6只科创板股：新进3股，增持2股,证券时报网
1225,2020-10-26,电子行业研究：Q4消费电子将迎较高出货动能 产业基金持续加码CIS存储等高端方向,新浪
1226,2020-10-26,“特色工艺”集成电路制造市场广阔,Wind
1227,2020-10-24,华润微：三季报四大看点,半导体风向标
1228,2020-10-23,华润微前三季度业绩亮眼净利润增长154.6% 注重研发提升竞争力,凤凰网
1229,2020-10-23,森未科技获Pre-A轮融资背后：国产功率半导体市场呈现这一趋势,科创板日报
1230,2020-10-23,社保基金现身2只科创板股前十大流通股东榜,证券时报网
1231,2020-10-22,【国元电子】华润微：IDM龙头业绩符合预期，持续受益景气度回暖,茂飞电子研究
1232,2020-10-22,又是半导体，23连板后突然封跌停！这些行业在“变暖”,中证报
1233,2020-10-22,解盘：沪指破3300点关口，光刻胶、传感器、创业板低价股领涨,Wind
1234,2020-10-22,华润微(688396)：Q3高增长延续 定增夯实IDM优势,国联证券
1235,2020-10-22,解码科创板三季报：四成预告报喜，盈利成投资风向标,21世纪经济报道
1236,2020-10-22,79股获券商买入评级，招商积余目标涨幅达72.83%,Wind
1237,2020-10-22,【东北晨会1022】银行行业周报/东方雨虹、中联重科、华润微/复盘笔记,东北证券研究所
1238,2020-10-22,解码科创板三季报：四成预告报喜，盈利成投资风向标,Wind
1239,2020-10-22,芯片白马“失蹄”，机构称A股结构性机会居多,Wind
1240,2020-10-21,“双十一”前夕提前打折？芯片龙头股紫光国微闪崩跌停 连续下跌,环球老虎财经
1241,2020-10-21,700亿芯片大牛股跌停，发生了什么？,中国基金报
1242,2020-10-21,44股获机构买入型评级 华润微关注度最高,证券时报网
1243,2020-10-21,华润微三季度净利润增长154.6% 募资专注功率半导体增强行业竞争力,凤凰网
1244,2020-10-21,紫光国微封住跌停打压芯片板块，北方华创、华润微等普跌,Wind
1245,2020-10-21,华润微(688396)公司动态点评：Q3 业绩超预期增长 功率半导体需求向好,新浪
1246,2020-10-21,杜坤维：700亿元芯片龙头股价闪崩背后的21条公告 连续下跌,中财网
1247,2020-10-21,88股获券商买入评级 招商积余目标涨幅达79.91%,Wind
1248,2020-10-20,抛50亿定增预案又遇核心技术人员离职 华润微跌12% 员工变动,每日经济新闻
1249,2020-10-20,公布50亿定增预案 华润微加码封测布局,每日经济新闻
1250,2020-10-20,道达投资手记：汽车板块迎利好 撑起市场一片天,每日经济新闻
1251,2020-10-20,闪崩！700亿芯片巨头暴跌12%，一夜狂发21条公告，7万股东懵了,中国基金报
1252,2020-10-20,【主力资金】大跌12%，芯片巨头遭资金砸盘，公司核心技术人员离职 员工变动,证券时报网
1253,2020-10-20,700亿芯片巨头华润微突然暴跌12%！原因出自50亿元定增预案？ 连续下跌,环球老虎财经
1254,2020-10-20,三季度QFII调仓紧盯科技和医药！小摩新进5股，高盛减持2股,Wind
1255,2020-10-20,利好引爆一个超级大行业——道达投资手记,每日经济新闻
1256,2020-10-20,华润微50亿定增加码功率半导体封测谋转型：上市8个月人事变动频频 两核心技术人员先后离职 员工变动,和讯
1257,2020-10-20,华润微拟募资50亿用于功率半导体封测基地，前三季度实现净利润6.87亿元,资本邦
1258,2020-10-20,【投行参要】每日审核要点及市场动态 | 2020.10.19,兴业证券订阅号
1259,2020-10-20,前三季度业绩大增个股逆势涨停亦有资金出逃兑现盈利,经济观察报
1260,2020-10-20,华润微今跌12% 中金公司国金证券给目标价超62元囧了,中国经济网
1261,2020-10-20,电子元器件周报：苹果公司发布新款IPHONE 全系标配5G、摄像头大幅升级,新浪
1262,2020-10-20,华润微(688396)：3Q需求全面景气推动净利润再超预期 维持跑赢行业评级,新浪
1263,2020-10-20,芯片龙头又崩了两个！这份10倍潜力股名单曝光,中证报
1264,2020-10-20,芯片龙头又崩了两个！继续为信仰买单？这份10倍潜力股名单曝光,中证报
1265,2020-10-20,芯片板块下挫 华润微跌逾12%,中证网
1266,2020-10-20,晨会聚焦201020重点关注阳光城、拓邦股份、工业机器人行业、京东数科、拓普集团、兆驰股份、华润微,国信研究
1267,2020-10-20,拟募资50亿主攻半导体封测 华润微领跌第三代半导体板块,新浪
1268,2020-10-20,第三代半导体板块下挫 华润微跌近11%,e公司
1269,2020-10-20,华润微跌超11%，半导体硅片板块跌幅扩大至3%,Wind
1270,2020-10-20,【中金科技】华润微（688396.SH）：3Q需求全面景气推动净利润再超预期，维持跑赢行业评级,乐平科技视角
1271,2020-10-20,最新公告透露利好 13只个股有望爆发（10.20）,中金在线
1272,2020-10-20,三季度业绩超预期 拟定增38亿投向封测环节 华润微背后存这一逻辑,科创板日报
1273,2020-10-20,10月20日 13股盘前利好公告速递,中财网
1274,2020-10-20,华润微拟定增募资50亿元 主攻功率半导体封测,上证报
1275,2020-10-20,华润微公布三季报 前三季净利增加154.59%,新浪
1276,2020-10-19,10月20日十大利好公告：三环集团第三季度净利润预增110%-130%,中国证券网
1277,2020-10-19,【华西电子孙远峰团队-持续推荐华润微】毛利率稳中有升，产品结构持续优化,远峰电子
1278,2020-10-19,华润微2020年第三季度归母净利同比增169%,上证报
1279,2020-10-19,华润微前三季度净利同比增逾150% 拟定增募资50亿元,e公司
1280,2020-10-19,上市未满八个月 华润微欲再募资不超50亿元,北京商报网
1281,2020-10-19,华润微(688396.SH)：提名李虹担任公司董事,格隆汇
1282,2020-10-19,华润微：前三季度净利润6.87亿元，同比增长154.59%,第一财经
1283,2020-10-19,华润微(688396.SH)拟向特定对象发行不超1.35亿股募资不超50亿元,智通财经
1284,2020-10-19,华润微(688396.SH)：前三季净利升154.59%至6.87亿元,格隆汇
1285,2020-10-19,华润微：拟定增募资不超过50亿元,Wind
1286,2020-10-19,华润微(688396.SH)核心技术人员邓小社离职 员工变动,格隆汇
1287,2020-10-19,华润微：公司核心技术人员离职 员工变动,Wind
1288,2020-10-19,金石亚药：终止《股权收购意向协议》 并购重组异常,Wind
1289,2020-10-19,【行情】芯片股早盘活跃，寒武纪-U、光迅科技、振芯科技、北斗星通、中科曙光、华润微、纳思达、中芯国际-U集体录涨,金十数据
1290,2020-10-19,芯片股活跃，寒武纪-U、北斗星通、中科曙光、华润微、中芯国际-U普涨,Wind
1291,2020-10-19,中概股回归增一路径！科创板迎首只CDR,Wind
1292,2020-10-18,【中信建投电子|刘双锋&雷鸣团队】周报：苹果新机预售火爆，台积电Q3创新高，半导体产业链基本面稳健向好,中信建投电子研究
1293,2020-10-18,【东方-电子】晶圆代工：制造业巅峰，国内追赶加速,电子论剑
1294,2020-10-18,功率行业9月跟踪报告：台湾功率企业9月营收再创新高 国内电动两轮车8月产量持续攀升,新浪
1295,2020-10-18,电子行业周报：手机新品先后亮相 半导体代工持续火热,华安证券
1296,2020-10-15,【东方-电子】功率半导体需求旺盛，涨价潮与国产替代驱动业绩增长,电子论剑
1297,2020-10-14,电子行业：功率半导体需求旺盛,财富动力网
1298,2020-10-12,半导体板块发力走高 沪硅产业中芯国际等涨逾10%,证券时报网
1299,2020-10-12,专主业、勇创新、讲诚信、补短板 沪市公司书写高质量发展“答卷”,上证报
1300,2020-10-11,【中信建投电子|刘双锋&雷鸣团队】周报：苹果和华为新机即将发布，台积电9月营收创新高,中信建投电子研究
1301,2020-10-11,下周操盘攻略：苹果将举行新品发布会，A股三季报披露开启,Wind
1302,2020-10-09,晨会聚焦201009重点关注医药生物、上海家化,国信研究
1303,2020-10-09,华润微：上半年对第三代半导体研发投入占营收1.09%,Wind
1304,2020-10-09,华润微：公司国内首条6英寸商用SiC晶圆生产线量产新闻属实,Wind
1305,2020-10-09,电子设备：第三代半导体大有可为,新浪
1306,2020-10-01,市值增长超240%，科创板三季度榜单全面揭晓,Wind
1307,2020-09-30,下游需求旺盛+上游产能紧张，半导体细分领域产品开始涨价，这些概念股业绩亮眼,证券时报网
1308,2020-09-30,国联证券研究所10月金股组合,国联研究
1309,2020-09-30,32股获券商买入评级，富满电子目标涨幅达97.77%,Wind
1310,2020-09-28,华润微：公司积极布局和拓展碳化硅业务及供应链,Wind
1311,2020-09-28,【行情】第三代半导体板块走强，赛微电子涨8%，捷捷微电、扬杰科技、华润微等跟涨,金十数据
1312,2020-09-28,华润微第三代半导体首条生产线量产 主要领域核心技术领先拥有自主产权,长江商报
1313,2020-09-28,电子行业周报：面板产业加速整合集中度持续提升 功率半导体再添新兵,华安证券
1314,2020-09-27,【中信建投电子|刘双锋&雷鸣团队】周报：新机发布潮拉动消费电子旺盛需求，MOSFET和面板涨价明确投资机会,中信建投电子研究
1315,2020-09-25,华润微(688396)：借特色工艺平台优势 高话语权细分市场持续拓宽,新浪
1316,2020-09-25,华润微：暂未布局碳基芯片，暂未被纳入科创50指数,Wind
1317,2020-09-25,晨会聚焦200925重点关注海外、旗滨集团、科锐国际,国信研究
1318,2020-09-24,华润微：目前在积极布局第三代半导体,Wind
1319,2020-09-24,晨会聚焦200924重点关注固定收益,国信研究
1320,2020-09-24,华润微：目前在积极布局第三代半导体,格隆汇
1321,2020-09-24,【东方电子】MOSFET供需紧张，国产厂商迎量价齐升机遇,电子论剑
1322,2020-09-23,新三板主题报告：绿鞋机制或现身第二批精选层,新浪
1323,2020-09-23,【研报掘金】“十四五规划”呼之欲出 第三代半导体前景广阔看好产业链龙头公司,证券时报网
1324,2020-09-23,晨会聚焦200923重点关注大炼化行业、半导体行业、银行业,国信研究
1325,2020-09-23,中小券商谋突围：民生以量取胜，东莞国元发力创业板,第一财经
1326,2020-09-23,华润微：有部分功率半导体产品适用于5G基站电源、储能、手机充电器等终端产品中,格隆汇
1327,2020-09-22,晨会聚焦200922重点关注半导体行业、韵达股份、奕瑞科技,国信研究
1328,2020-09-22,电子元器件行业：8寸产能吃紧ASP有望调涨 MOSFET产品缺货迹象已现,新浪
1329,2020-09-22,IPO募资连续三月超500亿，有新股破发逾20%,Wind
1330,2020-09-22,H1半导体概念股业绩报告：41家营收超10亿元，IDM企业合计净利大涨150%,搜狐
1331,2020-09-22,《周观点》系列：电子周报：华为芯片供应迎转机助力预期改善 PCB预期修复毛正,新浪
1332,2020-09-21,融资融券周报2020年第37周,新浪
1333,2020-09-21,国元证券：功率半导体赛道分析,新浪
1334,2020-09-20,大基金年内投资金额远高于其减持回笼的资金金额,Wind
1335,2020-09-19,第三代半导体SIC行业深度报告：爆发式增长的明日之星,华安证券
1336,2020-09-18,半导体行业深度报告：功率半导体赛道分析,新浪
1337,2020-09-16,晨会聚焦200916重点关注传媒互联网、纺织服装、游戏行业,国信研究
1338,2020-09-16,芯片股继续活跃，中芯国际-U、韦尔股份、华润微、兆易创新普涨,Wind
1339,2020-09-16,31股获券商买入评级，华菱钢铁目标涨幅达56.86%,Wind
1340,2020-09-15,A股融资融券日报：两融余额增加37.47亿元（9月14日）,Wind
1341,2020-09-15,两周暴涨50%！游资扎堆抢筹 这只第三代半导体概念股要“飞”？,中财网
1342,2020-09-15,头部券商齐聚A股在即，中金公司IPO疾进上会,21世纪经济报道
1343,2020-09-14,融资融券周报2020年第36周,新浪
1344,2020-09-14,芯片巨头被美收购，国产芯片未来如何突围,证券之星
1345,2020-09-14,A股收盘综述：创业板综指放量升3%超80股涨超10%，成交金额再超沪市,Wind
1346,2020-09-14,A股午盘综述：创业板综指半日升3.08%共71股涨超10%，成交金额再超沪市,Wind
1347,2020-09-14,芯片板块连续拉升，韦尔股份、沪硅产业-U、中微公司、寒武纪-U、芯原股份-U等集体上涨,Wind
1348,2020-09-14,华润微（688396）深度：聚焦优质赛道的半导体制造龙头,国信研究
1349,2020-09-13,电子行业周报：静待苹果发布会 关注消费电子产业链,华安证券
1350,2020-09-12,科创板71家TMT公司半年报解密！芯片股爆发 中芯研发下血本,凤凰网
1351,2020-09-11,华润微：公司目前在积极布局第三代半导体,e公司
1352,2020-09-10,社保和养老金青睐的科创板个股,证券导报
1353,2020-09-09,解读：进击的中国第三代半导体,LED在线
1354,2020-09-08,第三代半导体热度不减快充“爆发”科创板这家企业正悄悄布局,科创板日报
1355,2020-09-08,第三代半导体系列报告之一：第三代半导体大势所趋 国内厂商全产业链布局,光大证券
1356,2020-09-07,社保+养老金重仓的科创板股票名单来了，共同持股仅两只,证券时报网
1357,2020-09-07,融资融券周报2020年第35周(8月31日至9月4日),新浪
1358,2020-09-07,电子元器件周报：科技限制不改半导体行业景气度向上 第三代半导体可望政策支持力道加大,新浪
1359,2020-09-04,国家大基金板块拉升，赛微电子涨超10%，士兰微、华润微涨超3%,Wind
1360,2020-09-02,“投行贵族”中金公司回A加速，再提“战略性并购”,Wind
1361,2020-09-02,养老金账户持有科创板股全名单,证券时报
1362,2020-09-02,沪硅产业-U(688126)：新傲科技并表带动收入增长 12英寸硅片销量提升,新浪
1363,2020-09-02,券商自营半年大赚702亿元,Wind
1364,2020-09-01,华润微：主要功率器件产品暂未提价，目前在手订单饱满,Wind
1365,2020-09-01,华润微：主要功率器件产品暂未提价目前在手订单饱满,格隆汇
1366,2020-09-01,原华润微常务副董事长陈南翔加入紫光集团,Wind
1367,2020-09-01,电报|原华润微常务副董事长陈南翔加入紫光集团担任集团联席总裁,科创板日报
1368,2020-09-01,科创板公司上半年净利124亿增长42%,Wind
1369,2020-08-31,上交所：上半年科创板上市公司持股基金数量比一季度增长10倍,Wind
1370,2020-08-28,【华西电子孙远峰团队-持续推荐沪硅产业】技术&工艺验证稳步推进，通过龙头客户认证,远峰电子
1371,2020-08-28,中信证券：9月科创50指数样本股调整，中芯国际等或有望纳入,Wind
1372,2020-08-28,“国家队”二季度，持股路线图浮出水面,Wind
1373,2020-08-28,上市公司正负面新闻2020年8月28日星期五,Wind
1374,2020-08-28,证券日报头版：科创板魅力绽放，蚂蚁上市或将引发羊群效应,Wind
1375,2020-08-27,电子行业行业深度：模拟IC黄金赛道 本土配套渐入佳境,新浪
1376,2020-08-27,华润微常务副董事长、核心技术人员陈南翔辞职 董监高成员变化,中国经济网
1377,2020-08-27,华润微(688396.SH)：聘任李虹为公司副总裁兼首席运营官,格隆汇
1378,2020-08-27,华润微(688396.SH)：陈南翔辞去常务副董事长职务 董监高成员变化,格隆汇
1379,2020-08-27,华润微：核心技术人员陈南翔申请辞去公司常务副董事长职务 董监高成员变化,Wind
1380,2020-08-27,市场热点量化解析系列第36期：2020年9月科创50指数样本股调整分析,新浪
1381,2020-08-27,“国家队”持股路线图曝光！这两大板块最受青睐,中证报
1382,2020-08-26,社保基金持有科创板股清单：新建仓8股，增持3只,证券时报
1383,2020-08-25,养老金最新持仓科创板股：重仓9股，5只新建仓,证券时报
1384,2020-08-24,本周上市公司解禁市值773.77亿：中国广核占近三成 超50亿有5家 解禁,每日经济新闻
1385,2020-08-24,电子行业研究周报：功率半导体推进第三代半导体材料发展,新浪
1386,2020-08-23,下周解禁市值暴增，中国广核就占近三成，解禁市值超50亿元达5家！ 解禁,每日经济新闻
1387,2020-08-23,电子行业周报：中报陆续披露 关注绩优龙头,新浪
1388,2020-08-22,科创板周监控第25期：科创板IPO加速扩容,新浪
1389,2020-08-22,基金掘金科创板 金山办公获青睐,金融投资报
1390,2020-08-21,下周758亿市值限售股解禁，环比增加218.17% 解禁,Wind
1391,2020-08-21,偏爱三大行业 机构持股科创板图谱曝光,大众证券报
1392,2020-08-21,“国家队”掘金科创板，社保基金持有11家公司超1200万股,21世纪经济报道
1393,2020-08-20,机构持科创板股票仓位曝光：这两只股票成“宠儿”,21世纪经济报道
1394,2020-08-19,发生了什么？创业板大跌3%，千亿疫苗股跌停,中国基金报
1395,2020-08-19,半导体板块持续走低，沪硅产业跌近12%,Wind
1396,2020-08-19,【行情】半导体板块开盘走弱，沪硅产业大跌6%，芯原股份跌5%，雅克科技、瑞芯微、华润微等跟跌,金十数据
1397,2020-08-18,华润微：1190.78万股限售股8月27日上市流通 解禁,Wind
1398,2020-08-18,华润微(688396.SH)：1190.78万股限售股8月27日解禁 解禁,格隆汇
1399,2020-08-17,电子元器件行业：台湾功率厂商7月营收创新高 功率景气度持续上行,新浪
1400,2020-08-16,华润微(688396.SH)：子公司转让矽磐微电子(重庆)195万美元股权和105万美元股权 资产异常,格隆汇
1401,2020-08-16,华润微：华微控股拟转让所持矽磐微电子股权 资产异常,Wind
1402,2020-08-15,券商持仓曝光！新进重仓五公司,Wind
1403,2020-08-12,社保基金新进重仓股名单来了，精准布局智飞生物、西藏药业！,环球老虎财经
1404,2020-08-12,华润微：预计今年年底完成8英寸高端传感器和功率半导体项目厂房建设,科创板日报
1405,2020-08-11,基金掘金科创板 医药仍受青睐,金融投资报
1406,2020-08-11,外资A股持仓更新，高盛、小摩、瑞银重仓名单抢先看,Wind
1407,2020-08-11,华润微：可为客户提供110纳米的工艺制程特色晶圆制造技术服务,科创板日报
1408,2020-08-11,闻泰科技(600745)：5G驱动ODM业务景气向上 协同安世打开长期成长空间,新浪
1409,2020-08-11,融资融券周报2020年第31周(8月3日至8月7日),新浪
1410,2020-08-10,社保基金现身54股，青睐消费医药和制造业,Wind
1411,2020-08-07,社保基金二季度持有3只科创板股：新进2股 加仓1股,证券时报网
1412,2020-08-07,科创板股机构持仓揭秘：社保重仓3股，养老金青睐4股，两大机构同时建仓这只半导体龙头,证券时报
1413,2020-08-07,日发4家成常态？新股扎堆“三高发行”再现市场,Wind
1414,2020-08-06,半导体利好来了中国IDM模式迎机遇?|科技心语,第一财经
1415,2020-08-06,中芯国际(688981)投资价值分析报告：新一轮扩产周期启动 这一次的中芯可有大不同？,光大证券
1416,2020-08-06,社保基金最新持仓！追高大消费、甩卖中小市值,券商中国
1417,2020-08-06,半导体行业报告：半导体制造龙头投建新厂 引领行业正向循环,新浪
1418,2020-08-06,国家队调仓路线图抢先看！最牛持仓股涨373%,证券时报网
1419,2020-08-06,二季度养老金最新持仓动向曝光，8只个股成“新宠”,Wind
1420,2020-08-05,中芯国际-U(688981)点评报告：开启国产半导体发展黄金10年 惠及全产业链加速成长,新浪
1421,2020-08-05,主力凶猛扫货芯片股，9股上亿资金杀入！,证券时报网
1422,2020-08-05,半导体行业研究：全产业链加大扶持力度 分级优惠鼓励做强,国金证券股份有限公司
1423,2020-08-05,国务院出手：3万亿芯片板块迎超重磅利好，细分龙头全梳理,证券时报网
1424,2020-08-05,国务院出手 3万亿芯片板块迎超重磅利好,金融界
1425,2020-08-05,8月A股解禁规模骤减，部分个股减持压力依然较大 减持股份,Wind
1426,2020-08-04,社保基金、养老金最新扫货路线图曝光！这些重仓股都涨嗨了,Wind
1427,2020-08-03,融资融券周报2020年第30周,新浪
1428,2020-08-03,电子行业周报：苹果财报发布 关注面板涨价周期,新浪
1429,2020-08-03,一周概念股：全球手机镜头市场格局有望重塑，特斯拉零部件国产化提速,搜狐
1430,2020-08-01,华润微：超预期（附点评）,半导体风向标
1431,2020-07-31,【行情】半导体板块尾盘持续拉升，北方华创涨停，沪硅产业大涨8%，中芯国际、长电科技、华润微、苏州固锝等集体拉升,金十数据
1432,2020-07-31,A股“期中考”发榜 贵州茅台、宝丰能源等成绩亮眼 未来可期,红周刊
1433,2020-07-31,社保、养老金同时盯上2股，包括一只半导体龙头股,证券时报网
1434,2020-07-31,82股获券商买入评级，创源文化目标涨幅达92.86%,Wind
1435,2020-07-31,【读财报】华润微半年报：折旧下降助推毛利率提升 疫情影响或在三季度体现,新华网
1436,2020-07-31,66家科创板公司剧透中报业绩：二季度疫情影响减弱、业绩分水岭再现,Wind
1437,2020-07-30,国家队重仓股曝光 社保、养老金同时盯上两股,新浪
1438,2020-07-30,华润微2020上半年营收30.63亿元，归母净利润增速145.27%,凤凰网
1439,2020-07-30,【电子】华润微：盈利能力提升明显，H1业绩高增长,中银证券研究
1440,2020-07-30,特斯拉八成零部件国产化有多香？半导体和手机产业链企业跨界分食,搜狐
1441,2020-07-30,科创板中报：疫情影响减弱分水岭再现,21世纪经济报道
1442,2020-07-30,A股融资融券日报 ：两融余额增加148.46亿元（7月29日）,Wind
1443,2020-07-30,【华润微（688396.SH）】20H1业绩超预期，中国“英飞凌”指日可待——2020年中报点评（刘凯）,光大证券
1444,2020-07-30,科创板成绩单出炉:6成企业盈利 东方生物猛增12倍,华夏时报
1445,2020-07-30,66家科创板公司剧透中报业绩： 二季度疫情影响减弱，业绩分水岭再现,21世纪经济报道
1446,2020-07-29,“新基建”下功率半导体龙头持续发力 华润微上半年扣非净利同比增466.46%,证券日报
1447,2020-07-29,华润微(688396)2020年中报点评：20H1业绩超预期 中国“英飞凌”指日可待,光大证券
1448,2020-07-29,华润微上半年营收超30亿 “新基建”下功率半导体龙头持续发力,证券时报网
1449,2020-07-29,巨·热点|人气回升迎来强势反弹 五大板块倍受市场青睐！,巨丰财经
1450,2020-07-29,华润微(688396)：中报业绩超预期 盈利能力有望趋势性提升,广发证券
1451,2020-07-29,华润微(688396)：特色工艺平台龙头 盈利进入加速释放期,新浪
1452,2020-07-29,芯片股尾盘全线爆发，沪硅产业涨近15%,Wind
1453,2020-07-29,茅台的投资逻辑不变，医药股卷土重来，消费、医药和科技热点轮动，A股核心资产的结构化牛市很美味,财经
1454,2020-07-29,市场交易主力资金系列：红筹回归&CDR全景投资手册,新浪
1455,2020-07-29,华润微上半年净利润4.03亿元 主要系公司产能利用率提升较大,资本邦
1456,2020-07-29,解盘：资金快速流入，半导体、生物疫苗、次新、高价股领涨,Wind
1457,2020-07-29,华润微(688396)：无惧疫情逆势增长 持续受益国产替代,新浪
1458,2020-07-29,华润微发布2020年半年度募集资金存放与实际使用情况 募集资金37.5亿元,和讯
1459,2020-07-29,【面包财报】华润微：2020年上半年归母净利润4.03亿元，同比增长145.27%,面包财经
1460,2020-07-29,华润微（688396）财报点评：多业务齐头并进，业绩超预期,国信研究
1461,2020-07-29,A股异动丨华润微(688396.SH)高开8.78% 上半年净利升145.27%至4.03亿元,格隆汇
1462,2020-07-29,华润微高开近9%，上半年净利同比增145%,Wind
1463,2020-07-29,华润微(688396)：产品结构改善及费用控制带动2Q净利润大幅超预期,新浪
1464,2020-07-29,A股早报2020年7月29日星期三,Wind
1465,2020-07-28,华润微公布半年报 上半年净利增加145.27%,新浪
1466,2020-07-28,华润微：上半年净利润同比增长145.27%,中证网
1467,2020-07-28,净利增长145.27%！华润微半年报发布SiC功率器件、IGBT等多个项目在研,科创板日报
1468,2020-07-28,华润微半年报：上半年净利润同比增长145%国家集成电路产业投资基金持股比例上升到6.43%,科创板日报
1469,2020-07-28,华润微(688396.SH)：与关联方联合开展科技研发项目,格隆汇
1470,2020-07-28,华润微(688396.SH)：上半年净利升145.27%至4.03亿元,格隆汇
