473,2021-07-04,招商基础化工行业周报2021年7月第1周：原油价格持续上涨，继续关注优质成长股,招商基础化工
474,2021-07-04,化工行业周报：化纤、纯碱继续向好 旺季化工景气可期,新浪
475,2021-07-04,中泰周期·大宗指南：周期品周度运行变化,新浪
476,2021-07-03,基础化工行业周报：2021H1化工上市企业涨跌幅出炉 2021H2看好具有确定性的景气子行业,光大证券
477,2021-07-03,半导体材料行业跟踪报告之三：六部门发文推动制造业优质企业发展 关注半导体材料等关键领域成长空间,光大证券
478,2021-07-02,湖北宜化：公司可用于置换的尿素产能60万吨,Wind
479,2021-07-01,6月金股组合盈利25.37% 7月荐股名单出炉,新浪
480,2021-06-30,基础化工行业2021年中期投资策略：行业景气持续 关注低估值高成长的细分龙头,新浪
481,2021-06-29,生意社：6月29日山东华鲁恒升醋酸产销动态,生意社
482,2021-06-29,大宗指南周期品周度运行变化,新浪
483,2021-06-29,生意社：6月29日华鲁恒升异辛醇报价暂稳,生意社
484,2021-06-28,生意社：6月28日山东华鲁恒升液氨报价持稳,生意社
485,2021-06-28,生意社：6月28日华鲁恒升DMF最新动态,生意社
486,2021-06-25,生意社：6月25日山东华鲁恒升醋酸产销动态,生意社
487,2021-06-24,化工行业日报：川财研究能源及公用事业产业链核心数据跟踪日报,新浪
488,2021-06-24,生意社：6月24日山东华鲁恒升液氨报价持稳,生意社
489,2021-06-22,首席周观点：多债券、空商品,新浪
490,2021-06-21,生意社：6月21日华鲁恒升异辛醇报价暂稳,生意社
491,2021-06-21,看料炒股—看原材料涨跌，炒股票！（2021年6月21日）,生意社
492,2021-06-21,煤炭开采行业周报：周期品周度运行变化,新浪
493,2021-06-21,化工行业周报：关注二季度高增长标的 中长期继续看好优质成长股,新浪
494,2021-06-21,建议重视中报行情 | 中信建投晨会,中信建投证券研究
495,2021-06-21,磷矿石、电石领涨市场，MDI开启反弹之路,中信建投证券研究
496,2021-06-20,申港证券首予华鲁恒升买入评级：熨平周期，释放成长，合理价44.87-45.12元,每日经济新闻
497,2021-06-20,华鲁恒升(600426)：熨平周期 释放成长,新浪
498,2021-06-17,瞰鉴鲁股：板块总市值连续两周下跌，全国老六位置或被福建反超 连续下跌,每日经济新闻
499,2021-06-17,山东区域股市周报：总市值跌274亿 中泰证券跌出板块市值9强,每日经济新闻
500,2021-06-17,生意社：6月17日山东华鲁恒升液氨报价持稳,生意社
501,2021-06-17,化工行业2021年中期投资策略：周期品兼顾景气与成长 新材料布局需求端放量,广发证券
502,2021-06-16,生意社：6月16日山东华鲁恒升液氨报价调涨,生意社
503,2021-06-16,首席周观点：光伏产业柳暗花明景气重启 海风地补落地确定性夯实,新浪
504,2021-06-16,化工行业周报：化工行业结构性乐观 关注纯碱、钛矿、氨纶等子行业,新浪
505,2021-06-16,基础化工行业周报：中报行情临近 周期成长龙头进攻,新浪
506,2021-06-15,基础化工行业周报：化肥继续大涨 事件推动DMC再上行,新浪
507,2021-06-15,基础化工行业：化肥：十年折戟 景气归来,新浪
508,2021-06-15,生意社：6月15日华鲁恒升DMF最新动态,生意社
509,2021-06-15,2021年下半年投资策略：周期景气有望持续 产业变革趋势孕育成长新机遇,新浪
510,2021-06-15,生意社：6月15日山东华鲁恒升液氨报价持稳,生意社
511,2021-06-15,基础化工行业周报：油价上涨 三聚氰胺、磷酸一铵、有机硅DMC等产品价格上涨,新浪
512,2021-06-15,每日理财观察：7万亿理财市场重磅新规落地,Wind
513,2021-06-14,招商基础化工行业周报2021年6月第2周：尿素价格大涨，关注Q2业绩好估值低的公司,招商基础化工
514,2021-06-14,【广发化工|周观点】化工品价格涨多跌少，尿素价格持续上涨,广发化工微平台
515,2021-06-13,化工行业研究周报：尿素、有机硅价格持续上涨,新浪
516,2021-06-11,石化行业OPEC月报点评：OPEC逐步放松减产 需求复苏提供支撑,新浪
517,2021-06-11,揭秘送转股 132只除权以来股价上涨,证券时报网
518,2021-06-11,【银河化工】2021年中期策略丨需求引领景气，布局成长、把握周期,中国银河证券研究
519,2021-06-11,华鲁恒升党委书记、董事长常怀春：传承红色基因奋进开创未来,证券日报
520,2021-06-10,化工行业：聚焦周期景气龙头 看好低估值优质成长,新浪
521,2021-06-10,129只送转股走出贴权走势,证券时报网
522,2021-06-09,尿素价格飙升带动业绩超预期，华鲁恒升市值突破700亿关口！,环球老虎财经
523,2021-06-09,生意社：6月9日山东华鲁恒升醋酸产销动态,生意社
524,2021-06-09,煤炭石油钢铁顺周期板块集体爆发 天风证券：继续看好,证券之星
525,2021-06-09,乙二醇板块强势 华鲁恒升涨幅居前,新浪
526,2021-06-09,化工板块超20股涨逾5% 机构：顺周期业绩将迎兑现期丨牛熊眼,第一财经
527,2021-06-08,生意社：6月8日华鲁恒升DMF最新动态,生意社
528,2021-06-08,生意社：6月8日华鲁恒升异辛醇报价暂稳,生意社
529,2021-06-08,首席周观点：股债小双牛还能持续吗？,新浪
530,2021-06-08,化工行业动态点评：尿素涨价具有持续性 关注生产企业,新浪
531,2021-06-07,化工周期新征程系列三：化纤布局正当时,新浪
532,2021-06-07,化工行业：海外事件频发 关注化肥板块性投资机会,广发证券
533,2021-06-07,【兴证化工】5月PMI公布，菊酯、草甘膦、尿素、氯化钾、六氟磷酸锂延续涨势，纯碱、氨纶、醋酸、丁辛醇价格走高(6月6日),兴证化工
534,2021-06-07,生意社：6月7日山东华鲁恒升液氨报价持稳,生意社
535,2021-06-07,化工行业周报：重点看好资本开支下实现跨越式增长的周期成长股,新浪
536,2021-06-03,牛人重仓｜1/4流通盘被机构锁定！北向资金和融资客在这只股上“开怼”？,每日经济新闻
537,2021-06-03,北向资金今日净买入15.21亿元，二线白酒股获追捧,Wind
538,2021-06-03,基础化工行业周报：MDI挂牌价理性回调 轮胎双反靴子落地,新浪
539,2021-06-03,生意社：6月3日华鲁恒升DMF最新动态,生意社
540,2021-06-03,25股受青睐，北向资金增持额超亿元,证券之星
541,2021-06-03,北向资金净卖出20.14亿元 这些行业和个股被抛售最多 股票卖空,21世纪经济报道
542,2021-06-02,沪港通十大成交活跃股排名（6月2日）,Wind
543,2021-06-02,北向资金今日净卖出20.14亿元，恒瑞医药净卖出额创历史新高,Wind
544,2021-06-02,6月2日晚间重要行业研究汇总(附股),中金在线
545,2021-06-02,产品价格调涨 华鲁恒升(600426.SH)再度触及涨停,格隆汇
546,2021-06-02,生意社：6月2日山东华鲁恒升液氨报价调涨,生意社
547,2021-06-02,【异动股】化肥行业板块拉升，华鲁恒升(600426.CN)涨8.49%,财华社
548,2021-06-01,首席周观点：人民币的投机性升值难以持续,新浪
549,2021-06-01,中金行业首选：2021年6月,新浪
550,2021-06-01,基础化工／石油化工行业周报(第二十一周),新浪
551,2021-06-01,涨停板解密：资金抢筹，三板块个股火爆上攻！（6月1日）,Wind
552,2021-06-01,【行情】化工板块午后明显拉升，龙头万华化学涨近6%，恒力石化涨近3%，华鲁恒升涨超8%，恒逸石化涨近4%,金十数据
553,2021-06-01,生意社：6月1日华鲁恒升电厂硫酸铵价格动态,生意社
554,2021-05-31,化工行业6月投资策略：看好黄磷：草甘膦产业链景气度,新浪
555,2021-05-31,化工行业：黄磷-草甘膦继续引领化工涨幅 可降解塑料政策密集发布,新浪
556,2021-05-30,中泰化工周度观点21W22：MDI价格跌势趋缓 市场回暖曙光或现,新浪
557,2021-05-28,生意社：5月28日山东华鲁恒升液氨报价调涨,生意社
558,2021-05-27,生意社：5月27日华鲁恒升DMF最新动态,生意社
559,2021-05-26,首创证券--化工行业周报：周期行情持续分化，甄选攻守兼备品种【行业研究】,金融界股吧
560,2021-05-25,东吴证券：业绩为王，挖掘化工投资机会,第一财经
561,2021-05-25,化工行业2021年中期策略：业绩为王，挖掘化工投资机会,东吴石化化工
562,2021-05-25,化工行业数据周报：1Q21化工行业基金持仓分析,新浪
563,2021-05-25,石油石化行业数据周报：假期油价走势回顾,新浪
564,2021-05-25,基础化工行业周报：4月化工品出口大增 重视高景气持续性,新浪
565,2021-05-24,能源化工行业周观点：化工行业处传统淡季 农化、钛白粉等延续强势,新浪
566,2021-05-24,北向资金今日净买入超18亿，继续加仓医药股,Wind
567,2021-05-24,首创证券--市场策略报告：首席周观点，黑色价格见顶，其他还有多远？【投资策略】,金融界股吧
568,2021-05-24,化工行业周报：看好周期低估值弹性标的及高增长成长股,新浪
569,2021-05-24,生意社：5月24日山东华鲁恒升液氨报价调涨,生意社
570,2021-05-24,化工股大涨，多种化工品价格大涨，顺周期业绩将迎兑现期,第一财经
571,2021-05-24,化工周报：草甘膦、尿素上涨 周期品格局仍然向好 持续关注细分行业龙头,新浪
572,2021-05-24,化工行业周报：万华搭建生物降解塑料产业联盟 聚合MDI价差扩大,新浪
573,2021-05-23,化工行业周报：万华化学攻克L-薄荷醇技术 新材料领域持续突破,新浪
574,2021-05-21,化工行业2020年＆2021Q1财报总结：疫情后行业盈利能力迅速恢复 上半年仍延续高景气,新浪
575,2021-05-21,基础化工行业化工碳中和系列报告四：碳交易市场对化工行业影响如何？,新浪
576,2021-05-19,兴业证券基础化工行业周报：4月PMI公布 万华发布5月MDI挂牌价 醋酸、钛产业链、丁辛醇、制冷剂等延续涨势 电石、PVC等涨价,新浪
577,2021-05-19,生意社：5月19日山东华鲁恒升醋酸产销动态,生意社
578,2021-05-19,生意社：5月19日华鲁恒升异辛醇报价暂稳,生意社
579,2021-05-19,风享 · 新制造 | 9大团队联袂汇报 深度挖掘投资机会,天风研究
580,2021-05-18,深度*行业*化工行业2021下半年策略：行业维持高景气 碳中和背景下的产业升级与集中度提升将是未来主基调,新浪
581,2021-05-18,首席周观点：大宗商品价格见顶了吗？,新浪
582,2021-05-18,化工行业：丁辛醇、尿素、草甘膦价格继续上涨 DMF、蛋氨酸价格走高,新浪
583,2021-05-17,华峰化学(002064)重大事件快评：拟扩建30万吨氨纶、115万吨己二酸项目 稳固行业领先地位,新浪
584,2021-05-17,化工行业周报：丁辛醇、丙烯酸及酯价格持续上涨 重点关注龙头企业表现,新浪
585,2021-05-17,化工周报：地产链条景气持续 行业淡季价格仍坚挺 持续关注细分龙头,新浪
586,2021-05-17,生意社：5月17日华鲁恒升DMF最新动态,生意社
587,2021-05-17,化工行业：如何看聚酯减产和三类进口油征税？,新浪
588,2021-05-17,2021Q1化工行业总结：供需格局改善 盈利大幅提升 看好景气持续,新浪
589,2021-05-17,中泰周期·大宗指南：周期品周度运行变化,新浪
590,2021-05-17,化工周报：万华宁波技改扩产 草甘膦强势领涨农药板块,新浪
591,2021-05-17,生意社：5月17日山东华鲁恒升液氨报价调涨,生意社
592,2021-05-16,石油石化、基础化工、新材料行业北上资金流向周报：石油化工新材料行业北上资金周报,新浪
593,2021-05-16,化工行业5月策略：从新产能周期再议化工投资机会,新浪
594,2021-05-15,基础化工行业周报：供应偏紧正丁醇辛醇涨幅居前 原料成本上行支撑甲醇价格,光大证券
595,2021-05-14,化工行业国有上市企业动态报告：国有企业改革叠加内源性增长 化工上市央企估值有望修复,光大证券
596,2021-05-14,华鲁恒升(600426.SH)拟每股送0.3股派0.3元 于5月21日除权除息,智通财经
597,2021-05-14,华鲁恒升(600426.SH)：2020年度拟10送3派3元5月20日股权登记,格隆汇
598,2021-05-13,首创证券--化工行业周报：顺周期风云再起，Q2景气持续可期【行业研究】,金融界股吧
599,2021-05-13,天风证券：预计后续化工品价格走势将分化，二季度是重要观察窗口期,证券时报网
600,2021-05-13,行业观察丨下游需求激增致三聚氰胺价格创10年新高 业内人士：供需仍失衡短期内维持高价,财联社
601,2021-05-12,石油化工行业跟踪报告：需求仍有支撑 全年供需格局向好――OPEC月报点评,新浪
602,2021-05-12,基础化工行业研究：公募基金连续四个季度加仓化工行业 加大景气度向上细分行业龙头布局,国金证券股份有限公司
603,2021-05-11,【国金化工&新材料】2021Q1公募基金持仓分析：公募基金连续四个季度加仓化工行业，加大景气度向上细分行业龙头布局,点石化金
604,2021-05-11,基础化工行业2020年年报及2021年一季报总结：化工产品价格指数探底回升 橡塑制品、农化、化纤等板块表现亮眼,新浪
605,2021-05-11,北向资金创一个半月最大净卖出，京东方A、通威股份净卖出超6亿元,Wind
606,2021-05-11,石油天然气、化工行业2020&1Q21业绩回顾：行业高景气 盈利创新高,新浪
607,2021-05-11,生意社：5月11日山东华鲁恒升液氨报价持稳,生意社
608,2021-05-11,北向资金动向盘点：周期类，独甩煤炭,Wind
609,2021-05-11,北向资金连续3日加仓A股，“茅五”最受青睐（附股）,21世纪经济报道
610,2021-05-11,化工行业2021年中期策略报告：周期修整再出发 成长赛道需要重视,新浪
611,2021-05-10,【兴证化工】钛白粉、丁辛醇、三聚氰胺、电石、PVC、草甘膦等 继续涨价，六氟磷酸锂、苯胺、氯化钾价格走高（5月09日）,兴证化工
612,2021-05-10,化工行业：国际油价上行 六氟磷酸锂、草甘膦价格再创新高,新浪
613,2021-05-10,基础化工行业2020年报及2021年一季报综述：越过山丘 班行秀出,新浪
614,2021-05-10,通胀无牛市？这份通胀预期下的投资指南请查收,Wind
615,2021-05-10,化工周报：钛白粉、草甘膦、PVC 上涨 大宗品周期情绪升温 推荐业绩持续改善的细分龙头,新浪
616,2021-05-10,能源化工行业周观点：化工产品景气高位延续 关注碳中和、农化、海外复苏等主线,新浪
617,2021-05-10,化工行业报告：粘胶和VE需求持续恢复 价格呈现上涨趋势,新浪
618,2021-05-10,中国银河--化工行业：丁辛醇、丙烯酸及酯价格上涨，重点关注龙头企业表现【行业研究】,金融界股吧
619,2021-05-10,【牛人重仓】华鲁恒升:1日、3日、5日和8日融资余额同步增仓形成共振，今日资金流入-676.33万元，北向资金持股5223.18万股，融资余额34897.27万元；前3个交易日，北向资金增持-286.92万股，融资额增加9389.13万元，主力资金净流入6929.54万元,每日经济新闻
620,2021-05-10,石油石化、基础化工、新材料行业北上资金流向周报,新浪
621,2021-05-10,全产业链价格价差研究：丁辛醇、丙烯酸及酯价格上涨 重点关注龙头企业表现,新浪
622,2021-05-08,生意社：5月8日华鲁恒升DMF最新动态,生意社
623,2021-05-07,深度*行业*化工行业2020年报及2021年一季报综述：景气持续上行 新增投资放缓,新浪
624,2021-05-07,生意社：5月7日山东华鲁恒升液氨报价持稳,生意社
625,2021-05-07,化工行业：从SASOL的努力看煤化工企业的减排,新浪
626,2021-05-06,基础化工行业2020年报及2021一季报总结：2020化工行业景气呈现“V”型复苏 21Q1景气加速上行 行业盈利能力大幅修复,新浪
627,2021-05-06,5月6日晚间重要行业研究汇总(附股),中金在线
628,2021-05-06,4月金股组合盈利5.26% 5月荐股名单出炉,新浪
629,2021-05-06,社保基金长线坚守36只股（附股）,证券时报网
630,2021-05-06,生意社：5月6日山东华鲁恒升液氨报价下调,生意社
631,2021-04-30,华鲁恒升(600426)：醋酸及三聚氰胺价格大涨 基本面持续向好,新浪
632,2021-04-30,生意社：4月30日华鲁恒升异辛醇报价上涨,生意社
633,2021-04-30,社保基金连续4个季度以上持有191股 最长已持有50个季度,证券时报网
634,2021-04-30,全世界都在涨价！巨头们也扛不住了，这些A股业绩爆发,Wind
635,2021-04-30,原材料紧缺基建项目“窝工”，大宗牛市蝴蝶效应显现,Wind
636,2021-04-29,生意社：4月29日华鲁恒升异辛醇报价暂稳,生意社
637,2021-04-29,社保基金长线坚守31只股（附股）,证券时报网
638,2021-04-29,A股盘前利好利空：监管出手应对大宗商品涨价，郑爽被查事涉北京文化,腾讯网
639,2021-04-29,中信建投大周期团队最新研究观点,中信建投证券研究
640,2021-04-28,生意社：4月28日山东华鲁恒升醋酸产销动态,生意社
641,2021-04-28,生意社：4月28日华鲁恒升辛醇报价上涨,生意社
642,2021-04-27,化工行业周报：丙烯酸及酯价格继续上涨，重点关注龙头企业表现,每日经济新闻
643,2021-04-27,中银证券化工行业点评：继续加大持仓比例，强化更多个股配置,每日经济新闻
644,2021-04-27,生意社：4月27日华鲁恒升DMF最新动态,生意社
645,2021-04-27,生意社：4月27日山东华鲁恒升液氨报价持稳,生意社
646,2021-04-27,【银河策略曾万平】策略专题丨在业绩中寻找投资机会,中国银河证券研究
647,2021-04-26,中泰周期·大宗指南：周期品周度运行变化,新浪
648,2021-04-26,化工周度观点21W17：工信部发文 重柴国六时代来临,新浪
649,2021-04-26,基础化工行业周报：钛白粉涨价势头不改 农药价格加速上行,新浪
650,2021-04-26,化工板块2021Q1持仓分析：环比持续改善 中小市值公司获得加持,新浪
651,2021-04-26,基础化工行业周报(第十六周),新浪
652,2021-04-26,能源化工行业周观点：业绩披露期即将结束 多数子行业景气高位,新浪
653,2021-04-26,首席周观点：外盘是胜负手,新浪
654,2021-04-26,A股策略专题：20210426在业绩中寻找投资机会,新浪
655,2021-04-26,社保基金一季度新进32股 增持28股,证券时报网
656,2021-04-25,最新！顶流基金重仓股大洗牌，40张图表全披露,Wind
657,2021-04-23,一季度社保基金持仓曝光：集中高配化工板块，云图控股最受青睐！“小而美”风潮又要来了？,每经牛眼
658,2021-04-23,67只绩优龙头股名单出炉！北上资金扫货名单曝光,Wind
659,2021-04-22,"推荐胜率超六成：23股获机构高频""买入""评级 21股机构看涨空间超20%",腾讯网
660,2021-04-22,社保、明星基金经理都爱的化工股，Q2还能接着涨吗？,资本邦
661,2021-04-22,10张图一览社保、多名明星基金经理最新重仓股,Wind
662,2021-04-21,高增长低估值+机构扎堆推荐，市盈率最低1.5倍（附表）,Wind
663,2021-04-21,首创证券--化工行业周报：顺周期板块持续分化，回归阿尔法主线正当时【行业研究】,金融界股吧
664,2021-04-21,中银证券：农产品牛市提升需求，本轮化肥周期有望超预期,Wind
665,2021-04-21,新时代证券--华鲁恒升2021年一季报点评：行业景气复苏，公司单季度盈利创新高【公司研究】,金融界股吧
666,2021-04-21,东北证券--华鲁恒升：煤化工盈利提升显着，Q1业绩超预期【公司研究】,金融界股吧
667,2021-04-21,【化工】氮肥磷肥行业深度报告—农产品牛市提升需求，本轮化肥周期有望超预期,中银证券研究
668,2021-04-21,04.21股市早8点丨兴奋起来！小牛市说来就来！,中金在线
669,2021-04-21,银河证券：需求复苏助力景气上行，化工行业一季度业绩将显著提升,Wind
670,2021-04-21,社保基金一季度持仓透视：新进10股 增持7股,证券时报
671,2021-04-21,社保最新重仓股揭秘：大举抄底光伏龙头（附股）,Wind
672,2021-04-21,社保大举抄底 光伏龙头,财富动力网
673,2021-04-21,社保基金一季度持仓透视：新进10股，增持7股,Wind
674,2021-04-20,中国银河--化工行业深度：需求复苏助力景气上行，21Q1业绩将显着提升【行业研究】,金融界股吧
675,2021-04-20,机构调研大幅升温，三大板块看多逻辑不变,Wind
676,2021-04-20,东吴证券--华鲁恒升2021一季报点评：业绩大超市场预期，涨价助推单季度业绩创新高【公司研究】,金融界股吧
677,2021-04-20,社保基金一季度重仓股揭秘：新进10股增持7股,证券之星
678,2021-04-20,光大证券--基础化工行业周报：油价和需求共同好转，2021Q1化工企业业绩表现强劲【行业研究】,金融界股吧
679,2021-04-20,社保最新重仓股揭秘：大举抄底光伏龙头 最长连续重仓34个季度,南方财经网
680,2021-04-20,化工行业有望维持高景气度,大众证券报
681,2021-04-20,化工行业有望维持高景气度,证券之星
682,2021-04-19,供不应求难缓解，价格三个月上涨70%，概念龙头今日涨停，这个化工品涨价势头强劲,证券之星
683,2021-04-19,上市公司一季报陆续出炉，社保基金持仓新进3股,资本邦
684,2021-04-19,4月19日晚间重要行业研究汇总(附股),中金在线
685,2021-04-19,国金证券：华鲁恒升(600426.SH)多化工产品价格大幅上行，维持“买入”评级,智通财经
686,2021-04-19,新玩家加速入局 碳酸酯行业格局或生变,中国证券网
687,2021-04-19,中国银河--化工行业周报：碳酸二甲酯、丙烯酸及酯价格上涨，重点关注龙头企业表现【行业研究】,金融界股吧
688,2021-04-19,国信证券--华鲁恒升2021Q1财报点评：一季度业绩创新高，DMF、醋酸持续高景气【公司研究】,金融界股吧
689,2021-04-19,股东哀嚎！爆炒股突发公告，一线游资提前拉高出逃！最新社保持仓股曝光，最“痴情”股长拿超8年，4股获扎堆买入（附名单）,证券之星
690,2021-04-19,一季度社保基金持股名单出炉，6股均获社保基金持仓超4年,同壁财经
691,2021-04-19,【国金化工&新材料】华鲁恒升点评——产品盈利大幅提升，公司兼具稳健和成长属性（2021-04-18）,点石化金
692,2021-04-18,大曝光！社保基金、百亿私募最新调仓换股名单,Wind
693,2021-04-18,社保基金、百亿私募最新动向来了，调仓明细曝光,证券时报
694,2021-04-18,上市公司一季报火热披露 社保基金、百亿私募最新调仓换股来了,同壁财经
695,2021-04-18,大曝光！社保基金、百亿私募最新调仓换股来了,中国基金报
696,2021-04-17,山东华鲁恒升化工股份有限公司 2021年第一季度报告正文,证券日报
697,2021-04-16,0417日报/华鲁恒升一季度净利润约15.76亿元同比增加266.87%【东北基础化工】,东北基础化工
698,2021-04-16,公告精选：欧菲光预计2020年亏损18.5亿元；华鲁恒升等一季度业绩大增,e公司
699,2021-04-16,华鲁恒升：一季度净利润同比增长267%,格隆汇
700,2021-04-16,华鲁恒升(600426.SH)一季度肥料销售量达61.86万吨,智通财经
701,2021-04-16,华鲁恒升：一季度净利润同比增长266.87%,Wind
702,2021-04-16,社保基金现身248只股前十大流通股东榜,证券之星
703,2021-04-15,行业观察|醋酸清明后大涨至7000元/吨创10年新高业内人士：下游需求坚挺，短期供应不足导致,证券之星
704,2021-04-14,化工板块表现活跃 机构建议关注两条主线,中财网
705,2021-04-14,浙商证券--化工行业周报：化工一季度业绩靓丽，化工品景气度持续回升【行业研究】,金融界股吧
706,2021-04-14,从可降解塑料推涨BDO，看己二酸未来趋势,金融界
707,2021-04-13,中国银河--化工行业周报：醋酸系列价格大幅上扬，重点关注龙头企业表现【行业研究】,金融界股吧
708,2021-04-13,社保基金去年四季度重仓股揭秘：新进41股 增持78股,中财网
709,2021-04-12,石油石化行业周报：醋酸价格快速上涨 建议关注相关投资机会,新浪
710,2021-04-12,基础化工行业周报：钛产业链价格再创新高 继续建议双主线布局,新浪
711,2021-04-12,化工周报：钛白粉、醋酸大幅上涨 一季报进入兑现期 关注Q2基本面持续向好的细分龙头,新浪
712,2021-04-12,化工行业：PPI上升较快影响短期超额收益率 看好产能周期下化工景气持续,新浪
713,2021-04-12,化工行业周度观点22W15：3月PPI同比和环比涨幅扩大 化工行业一季度表现亮眼,新浪
714,2021-04-12,平安证券--化工行业一季报业绩前瞻：关注一季报业绩超预期子行业和上市公司【行业研究】,金融界股吧
715,2021-04-12,生意社：4月12日山东华鲁恒升液氨报价下调,生意社
716,2021-04-12,化工行业周报：Q1业绩持续向上共振 万华Q1业绩创历史新高,新浪
717,2021-04-12,社保基金现身212只股前十大流通股东榜,证券时报网
