1461,2020-07-09,科技行业日报：国内首款中国芯DDR4内存条大规模量产,新浪
1462,2020-07-09,卓胜微：上半年净利润同比预增125.09%-134.91%,新浪
1463,2020-07-09,卓胜微：上半年净利润预增125%～135%,e公司
1464,2020-07-09,卓胜微(300782.SZ)：上半年预盈3.44亿元-3.59亿元 同比增长125.09%-134.91%,格隆汇
1465,2020-07-09,卓胜微：预计上半年净利润同比上涨125.09%～134.91%,格隆汇
1466,2020-07-09,卓胜微：预计上半年净利润3.44亿-3.59亿元，同比增长125.09%-134.91%,Wind
1467,2020-07-08,科技行业日报：半年报业绩陆续出炉 优质个股涌现,新浪
1468,2020-07-08,"卓胜微现3笔大宗交易 共成交7,629.38万元",新浪
1469,2020-07-08,A股早报2020年7月8日星期三,Wind
1470,2020-07-08,近百份减持公告来袭，最高拟减持17%，合计要套现超200亿！,Wind
1471,2020-07-07,【华西电子孙远峰团队-持续推荐信维通信】二季度业绩同比大幅增长，全年业绩可期,远峰电子
1472,2020-07-07,47股大宗交易超千万元 卓胜微交易额最高,证券时报网
1473,2020-07-07,透视大宗交易：7月7日共成交135笔，卓胜微成交3.92亿元,每日经济新闻
1474,2020-07-07,"卓胜微现11笔大宗交易 共成交39,218.79万元",新浪
1475,2020-07-07,中一签或赚10万！又有新股大肉签 每股64.39元！,中国基金报
1476,2020-07-07,芯片概念股午后维持强势，沪硅产业-U、卓胜微冲击涨停,Wind
1477,2020-07-07,朱邦凌：清华生归国创“国芯”巨头！助力华为5G 打破国外基站通信垄断,金融界
1478,2020-07-06,【华西电子孙远峰团队-持续推荐信维通信】 射频天线龙头稳固，5G综合方案扬帆当时,远峰电子
1479,2020-07-06,科技行业日报：中芯国际将申购 利好半导体设备与材料,新浪
1480,2020-07-06,电子行业点评：旺季来临 看好三季度表现,新浪
1481,2020-07-06,中芯国际股价一个月翻番，芯片股共襄盛宴,Wind
1482,2020-07-06,紫光国微(002049)：中国特种集成电路平台型王者,光大证券
1483,2020-07-05,紫光国微三个涨停板，背后的秘密是什么？,凤凰网
1484,2020-07-03,A股接下来往哪走？6大维度揭秘资金流向,每日经济新闻
1485,2020-07-03,芯片板块出现调整，韦尔股份、中微公司、兆易创新、卓胜微普跌,Wind
1486,2020-07-03,突然变脸！地产板块暴涨千亿，500亿科技龙头却闪崩,券商中国
1487,2020-07-03,暴涨20倍大牛股出事，股东大手笔减持：要卖22个亿！ 减持股份,中国基金报
1488,2020-07-03,突发！暴涨20倍大牛股出事，股东大手笔减持：要卖22个亿！,中国基金报
1489,2020-07-02,【安信电子|每日观点】紫光同芯THD89获全球最高等级安全认证，助推国内物联网发展,晓说电子
1490,2020-07-02,卓胜微：股东计划减持公司股份合计不超过3.00% 减持股份,第一财经
1491,2020-07-02,警惕！卓胜微：持股5%以上股东南通金信计划减持不超过540万股,每日经济新闻
1492,2020-07-02,卓胜微：拟定增募资不超30.06亿元 用于高端射频滤波器芯片项目等,金融界
1493,2020-07-02,卓胜微：南通金信拟减持不超3% 拟减持股份,Wind
1494,2020-07-02,电子行业中报展望专题：电子行业2020年中报业绩展望,新浪
1495,2020-07-02,科技行业日报：中芯国际将开启申购 国产替代逻辑长存,新浪
1496,2020-07-01,冯柳席位或继续增持完美世界 45家公司机构买入过亿元（附表）,红周刊
1497,2020-07-01,电子行业2020年中报业绩展望：电子行业中报展望专题,新浪
1498,2020-06-30,【华西电子孙远峰-每日观点&资讯】（2020-07-01）,远峰电子
1499,2020-06-30,卓胜微：公司尚未实施权益分派,Wind
1500,2020-06-30,芯片产业链暴涨，外资重金杀入！看活跃资金重点加仓股,证券时报网
1501,2020-06-30,卓胜微今日除权强力反弹，后复权股价再创新高,Wind
1502,2020-06-30,杜坤维：第一高价科技股卓胜微56亿元减持给抱团持股提了一个醒 减持股份,金融界
1503,2020-06-30,卓胜微：股东减持系外部基金 内部股东没有减持意愿｜公司问答 减持股份,第一财经
1504,2020-06-29,科技股王遭利空突袭逼近“跌停”！此前一年暴涨19倍,上游新闻
1505,2020-06-29,科技股王遭利空！暴涨19倍后要减持，机构刚买进12亿 减持股份,证券时报
1506,2020-06-29,芯片股整体表现不振，卓胜微、兆易创新、中微公司、纳思达、圣邦股份跌幅居前,Wind
1507,2020-06-29,科技股王突遭利空！暴涨19倍后近60亿减持计划袭来 机构刚刚买进10多亿 拟减持股份,证券时报
1508,2020-06-29,26股即将实施分红 卓胜微派现最大方,证券时报网
1509,2020-06-29,A股异动 | 卓胜微(300782.SZ)跌6% 股东拟最多减持8%股份 拟减持股份,格隆汇
1510,2020-06-29,分红季来了，51只股即将分红,证券时报网
1511,2020-06-29,卓胜微低开超4%，公司股东拟合计减持不超8%股份,Wind
1512,2020-06-29,卓胜微等43股近五日获机构净买入,证券时报网
1513,2020-06-29,财经早报：科技股王抛57亿减持计划 A股7月中旬开启“中报时间”,新浪
1514,2020-06-28,两市百元股数量达89只 这个行业领衔，有股票半年涨超6倍！,中国财富网
1515,2020-06-28,本周无上市公司计划增持卓胜微解禁后就接预披露减持计划 解禁,每日经济新闻
1516,2020-06-28,【国君策略】结构行情：哪些公司将进入机构“瞄准镜”？,Wind
1517,2020-06-28,下周操盘攻略：A股再迎“打新潮”，全球重磅数据周来临,Wind
1518,2020-06-28,"股价仅次于茅台高，科技""股王""卓胜微股东计划大手笔减持套现，两月前公司称暂未获悉有减持意向 拟减持股份",和讯
1519,2020-06-25,科技股王抛57亿减持计划：新高后迎当头斩抛 压能不能顶住？ 拟减持股份,中证报
1520,2020-06-25,半年涨16倍，科技“股王”抛57亿元减持计划！创新高之日迎来“当头斩”，抛压能不能顶住？ 拟减持股份,中证报
1521,2020-06-24,晚间公告热点追踪：创业板第一高价股卓胜微遭股东减持,新浪
1522,2020-06-24,负面！卓胜微：首发前持股5%以上股东IPV计划减持不超过600万股 拟减持股份,每日经济新闻
1523,2020-06-24,卓胜微(300782.SZ)：IPV、天津浔渡及宁波联利拟合计减持不超8%的股份 拟减持股份,格隆汇
1524,2020-06-24,卓胜微：股东拟合计减持不超8%股份 拟减持股份,e公司
1525,2020-06-24,卓胜微：股东IPV、天津浔渡和宁波联利拟合计减持不超过8% 拟减持股份,新浪
1526,2020-06-24,卓胜微：首发持股5%以上股东拟合计减持不超8%股份 减持股份,Wind
1527,2020-06-24,银行板块异动，有什么消息？另有五只个股已被外资买爆,上证报
1528,2020-06-23,卓胜微发生2笔大宗交易 合计成交1.06亿元,证券时报网
1529,2020-06-23,电子行业2020年下半年投资策略：一个世界两套系统 创新重启加速替代,光大证券
1530,2020-06-23,"卓胜微现2笔大宗交易 共成交10,575.12万元",新浪
1531,2020-06-23,睿财看市场：坚定改革和开放 资本市场带人民币乘风破浪,新浪
1532,2020-06-22,卓胜微发生5笔大宗交易 合计成交4亿元,证券时报网
1533,2020-06-22,"卓胜微现5笔大宗交易 共成交40,043.74万元",新浪
1534,2020-06-22,机构看好这些半导体产业股票,第一财经
1535,2020-06-21,大宗交易本周成交金额环比翻倍 机构砸逾7亿接盘两市第二高价股,每日经济新闻
1536,2020-06-21,A股4600亿解禁洪峰7月来袭，11股超百亿 解禁,证券时报
1537,2020-06-20,一周龙虎榜：6股获机构大手笔净买入,中财网
1538,2020-06-19,卓胜微(300782.SZ)年报推10转8派10元股权登记日6月29日,格隆汇
1539,2020-06-19,"卓胜微现1笔大宗交易 共成交30,420.00万元",新浪
1540,2020-06-19,解禁潮来袭!已有个股3个跌停! 解禁,南方财经网
1541,2020-06-19,电子行业：射频前端行业深度报告 5G发展正当时 射频前端方兴未艾,新浪
1542,2020-06-19,A股早报2020年6月19日星期五,Wind
1543,2020-06-18,【华西电子孙远峰-每日观点&资讯】（2020-06-19）,远峰电子
1544,2020-06-18,龙虎榜机构新动向：净买入14股 净卖出19股,证券时报网
1545,2020-06-18,卓胜微大宗交易成交70万股 成交额4.33亿元,证券时报网
1546,2020-06-18,科技行业日报：160亿元第三代半导体产业项目落户长沙,新浪
1547,2020-06-18,机构现身35股，净买入卓胜微4.1亿元，净卖出华北制药5368万元,第一财经
1548,2020-06-18,75亿元主力资金潜入电子行业 卓胜微获机构净买入逾4亿元,证券时报网
1549,2020-06-18,龙虎榜：卓胜微涨停 一机构买入4.35亿元,e公司
1550,2020-06-18,"卓胜微现1笔大宗交易 共成交43,306.20万元",新浪
1551,2020-06-18,卓胜微龙虎榜数据（6月18日）,Wind
1552,2020-06-18,大盘小步反攻 机构做多热情回升,金融投资报
1553,2020-06-18,快讯：卓胜微涨停 报于634.52元,金融界
1554,2020-06-18,5G板块震荡攀升，卓胜微、中兴通讯大涨,Wind
1555,2020-06-17,6月逾200亿减持，4千亿巨量解禁下月将至,Wind
1556,2020-06-17,47家公司本周合计解禁26.61亿股 解禁,中证网
1557,2020-06-17,A股解禁迎来高峰，百元科技股股价或承压,Wind
1558,2020-06-16,创业板第一高价股盘中大跌8%发生了什么？,中证报
1559,2020-06-16,主力资金：暴涨17倍的芯片龙头突然崩了，2亿资金蜂拥出逃,中财网
1560,2020-06-16,A股掀起“华为行情”，半导体龙头盘中闪崩近8%！发生了什么？ 连续下跌,上游新闻
1561,2020-06-16,卓胜微、韦尔股份盘中跳水压制芯片板块,Wind
1562,2020-06-16,事情正在起变化？华为概念股集体暴涨！外资半天猛加仓45亿,中国基金报
1563,2020-06-16,卓胜微(300782.SZ)一度跳水跌超7% 6月18日将迎大解禁 解禁,格隆汇
1564,2020-06-16,卓胜微盘中快速跳水 股价大跌近8% 连续下跌,金融界
1565,2020-06-15,主动量化周报：后疫情周期进攻路线下的两种选择,新浪
1566,2020-06-15,本周解禁量减但市值增加，注意这三只股票的风险 解禁,财富动力网
1567,2020-06-15,Wind风控日报2020年6月15日星期一,Wind
1568,2020-06-14,一年股价涨幅16倍 两市第二高价股近3900万限售股下周解禁 解禁,每日经济新闻
1569,2020-06-14,晚间重要公告2020年6月14日星期日,Wind
1570,2020-06-14,周末要闻2020年6月14日星期日,Wind
1571,2020-06-14,卓胜微(300782.SZ)：3881.6995万股限售股将解禁 解禁,格隆汇
1572,2020-06-14,卓胜微：占总股本38.82%股份解除限售,Wind
1573,2020-06-14,卓胜微：3882万股限售股将解禁 解禁,金融界
1574,2020-06-13,下周解禁规模同比增加27% 十倍大牛股卓胜微领衔 解禁,大众证券报
1575,2020-06-12,下周638亿市值限售股解禁，环比增加96.24% 解禁,Wind
1576,2020-06-12,创业板强势翻红！外资300亿猛加仓！中一签赚19万超级大肉签也来了,中国基金报
1577,2020-06-11,芯片板块几乎回吐日内2%升幅，卓胜微、韦尔股份均跌2%左右,Wind
1578,2020-06-09,中小公司研究：一周策略回顾与展望,新浪
1579,2020-06-09,半导体板块午后延续升势，卓胜微、韦尔股份、南大光电等均大涨,Wind
1580,2020-06-08,电子行业周报：景气度复苏 关注电子板块低位布局机遇,新浪
1581,2020-06-08,卓胜微：华为背后神秘的5G供应链巨头,DoNews
1582,2020-06-08,卓胜微股价年涨15倍居A股前三 30亿加码高端芯片加速推进国产替代,长江商报
1583,2020-06-07,5G建设将在下半年提速，套餐和终端降价加速普及,Wind
1584,2020-06-06,5G概念股出奇迹:卓胜微一年涨超1022% 近4成股价翻倍,新浪
1585,2020-06-05,卓胜微(300782)：享5G与自主可控红利 国产射频龙头加速成长,国海证券
1586,2020-06-03,走进“芯”时代系列深度之二十七“射频芯片”：射频芯片千亿空间 国产替代曙光乍现,新浪
1587,2020-06-03,寒武纪来了，影子股走起，国产芯片核心资产名单扩容,证券时报网
1588,2020-06-03,小心，清仓减持又来了！注意，1天4家公司被举牌（附名单）,Wind
1589,2020-06-03,科创板AI芯片第一股来了：300亿估值！,中国基金报
1590,2020-06-02,卓胜微股价高居A股第三、创业板榜首 拟定增募资不超30.06亿元,证券日报
1591,2020-06-02,232只公募基金参与!定增市场为何突然开始红火?,中国财富网
1592,2020-06-02,深交所：深证成指、创业板指、深证100等指数调整样本股,Wind
1593,2020-06-02,40股今日获机构买入评级 11股上涨空间超20%,证券时报网
1594,2020-06-02,5月450亿减持创年度新高，科技医疗抛售居前,Wind
1595,2020-06-02,电子行业2020中期策略报告：5G创新持续 半导体国产空间大,新浪
1596,2020-06-02,【卓胜微|国信电子】点评：定增30亿，加码高端滤波及5G基站射频器件,国信电子研究
1597,2020-06-02,26股获券商买入评级，卓胜微目标涨幅达43.12%,Wind
1598,2020-06-01,【华西电子孙远峰-每日观点&资讯】（2020-06-02）,远峰电子
1599,2020-06-01,【华西电子孙远峰团队-持续推荐卓胜微】射频龙头强势增长，中报预告超预期,远峰电子
1600,2020-06-01,两市百元股逼近90只，高价科技股6月迎来解禁大考 解禁,第一财经
1601,2020-06-01,卓胜微逾6亿募资未投入拟再融30亿，国产替代名义下补流7.5亿一掷千金,21世纪经济报道
1602,2020-06-01,【中金科技】卓胜微（300782.SZ）：定增助力专线建设，打开接收端模组市场,乐平科技视角
1603,2020-06-01,卓胜微：拟定增30亿元，扩大国内射频龙头领先优势,证券时报网
1604,2020-06-01,这10家公司发布公告有看点 业绩“回暖”股望有好表现,巨丰财经
1605,2020-06-01,卓胜微强化芯片及5G通讯布局 定增30亿控制权被大幅稀释,和讯
1606,2020-06-01,补血、投资、买资产，多家公司扎堆定增,Wind
1607,2020-06-01,【中信建投电子|刘双锋&雷鸣团队】卓胜微定增募资简评：定增募资约30亿元，布局高端滤波器及5G基站射频研发及产业化项目,中信建投电子研究
1608,2020-05-31,6月1日上市公司重要公告集锦：招商蛇口拟收购南油集团24%股权,证券日报
1609,2020-05-31,卓胜微定增30亿投资5G射频芯片模组 国产替代进程加速,证券时报
1610,2020-05-31,百元股的两大梯队 白马蓝筹和次新股成长,红周刊
1611,2020-05-31,卓胜微：非公开发行股票拟募集资金额不超过30.06亿,新浪
1612,2020-05-31,卓胜微：拟定增募资不超30亿元 投资5G基站射频器件研发等项目,e公司
1613,2020-05-31,卓胜微：拟定增募资不超过30.06亿元用于高端射频滤波器芯片等项目,Wind
1614,2020-05-31,卓胜微：拟定增募资不超过30.06亿元拟用于高端射频滤波器芯片及模组研发和产业化等项目,格隆汇
1615,2020-05-30,卓胜微200余亿解禁市值来袭创6月份A股第一，股价雄踞创业板首位机构继续唱多 解禁,21世纪经济报道
1616,2020-05-30,两大芯片龙头百亿解禁在即，5股解禁前夕股价创下历史高点 解禁,每经网
1617,2020-05-30,两大芯片龙头百亿解禁在即！5股竟走出逆天行情，23股超一半市值将流通 解禁,证券时报
1618,2020-05-29,科技行业日报：震荡调整下防御为主,新浪
1619,2020-05-29,募资近300亿，国内半导体新贵谋划“芯”布局,36氪
1620,2020-05-24,百元股扩容至近70只 抓业绩搞价值投资才有出路,投资快报
1621,2020-05-21,年度减持1400亿科技股承压，将再迎解禁高峰,Wind
1622,2020-05-21,市场进入“两会”行情，机构资金买入了这些板块,财经
1623,2020-05-20,最狠每股跌50元！百元股集体重挫，有机构在大举抄底！一大利空逼近高价次新股 连续下跌,证券时报网
1624,2020-05-20,【行情】半导体芯片走弱，圣邦股份跌停，卓胜微、江苏雷利、芯源微、韦尔股份等跌逾6%。,金十数据
1625,2020-05-20,A股IPO年报业绩掘金榜：瓜分饕餮盛宴的六大真相,投资者网
1626,2020-05-19,华为限令搅动芯片股，半导体板块会否复制上一年行情,第一财经
1627,2020-05-18,全市场都看好却暴跌560亿 “国产替代”何时发力？,券商中国
1628,2020-05-18,市场快速轮动：茅台新高消费人气高涨，科技股回调机构分歧严重,Wind
1629,2020-05-18,卓胜微龙虎榜数据（5月18日）,Wind
1630,2020-05-18,卓胜微高位放量跌停，机构激烈博弈,Wind
1631,2020-05-18,发生了什么？科技股遭狙击，卓胜微等龙头跌停（附策略）,证券时报网
1632,2020-05-18,半导体行业事件点评：华为限令影响仍需观察 国产替代愈发坚定,新浪
1633,2020-05-18,1531家科技企业跻身上市“后备军”，苏企期待创业板注册制“初体验”,Wind
1634,2020-05-17,美国针对华为芯片的限制升级 机构：国产替代迎最好时代,新浪
1635,2020-05-17,美国针对华为芯片的限制升级 机构周末紧急研判：国产替代将迎来最好时代 谁是下一个卓胜微？,21世纪经济报道
1636,2020-05-17,巨丰原创 | 卓胜微（300782）：700元的科技一哥 机构最高给到851,巨丰财经
1637,2020-05-15,华为概念股异动,Wind
1638,2020-05-14,卓胜微：进一步推出多款SAW滤波器产品,Wind
1639,2020-05-13,【华西电子孙远峰-每日观点&资讯】（2020-05-13）,远峰电子
1640,2020-05-12,【华西电子孙远峰团队】国内手机市场出货反弹，5G占比接近四成,远峰电子
1641,2020-05-12,卓胜微：公司已顺利完成部分WiFi PA的设计、验证及测试,Wind
1642,2020-05-10,卓胜微18倍上涨背后，华为国内供应商崛起,凤凰网
1643,2020-05-10,【国盛郑震湘团队】卓胜微：射频龙头持续超预期,湘评科技
1644,2020-05-07,卓胜微(300782.SZ)：实控人之一冯晨晖解除质押100万股,格隆汇
1645,2020-05-06,2019年年报2020年一季报总结：业绩整体承压，TWS/基站高频PCB/国产替代高景气，结构性增长突出,晓说电子
1646,2020-05-06,射频芯片供应链风险上升 200亿美元规模国产替代谁先行,第一财经
1647,2020-04-30,卓胜微(300782.SZ)：实控人之一冯晨晖质押26.4万股,格隆汇
1648,2020-04-30,一季度净利增长逾2倍 卓胜微股价创新高位居创业板榜首,证券日报
1649,2020-04-30,一根大阳线拔地而起，五月好兆头？,上证报
1650,2020-04-30,[路演]卓胜微：射频前端芯片行业的市场规模将持续快速增长,全景网
1651,2020-04-30,[路演]卓胜微：适用于sub-6GHz频段的系列产品已逐步实现量产销售,全景网
1652,2020-04-30,[路演]卓胜微：多款SAW滤波器产品均已量产或出货,全景网
1653,2020-04-30,上证指数午盘涨1.3%，半导体引领科技股爆发,Wind
1654,2020-04-30,快讯：半导体板块早盘异动拉升 长电科技等多股涨停,新浪
1655,2020-04-30,【行情】半导体芯片走强，长电科技拉升封板，聚辰股份、闻泰科技、卓胜微、通富微电等涨逾7%。,金十数据
1656,2020-04-29,中泰电子|卓胜微2019年报&2020一季报点评：研发与销售并驾齐驱，射频龙头爆发式增长,刘翔电子研究
1657,2020-04-29,机构重金封板白云机场 游资抢筹射频龙头卓胜微丨板块龙虎榜,第一财经
1658,2020-04-29,净利增长206%，卓胜微和它的同行们都被大客户“绑架”了,Ofweek
1659,2020-04-28,卓胜微收关注函，说明公司上市后第一个年度即进行股本转增的必要性、合理性 关注函,Wind
1660,2020-04-28,A股龙虎榜揭秘：机构席位净买入个股9只，净卖出9只,Wind
1661,2020-04-28,【华西电子孙远峰-每日观点&资讯】（2020-04-29）,远峰电子
1662,2020-04-28,【中信建投电子|刘双锋&雷鸣团队】卓胜微财报简评：新品进展超预期，成高通芯片供应商；新增4家制造封测供应商备战高增长,中信建投电子研究
1663,2020-04-28,卓胜微放量涨停，机构产生分歧,Wind
1664,2020-04-28,5G和国产替代助推卓胜微业绩逆势高增长，股价跃居创业板榜首面临222亿解禁潮压 解禁,21世纪经济报道
1665,2020-04-28,A股探底回升，上证指数收盘跌0.19%,Wind
1666,2020-04-28,卓胜微：多个5G产品进展超预期,EBSCN电子
1667,2020-04-28,卓胜微：一季度延续高增长，5G射频放量可期,证券时报网
1668,2020-04-28,解盘：权重撑指数，特斯拉概念活跃，半导体、创投领涨,Wind
1669,2020-04-28,【中金电子与通信】卓胜微（300782.SZ）：2019/1Q20业绩符合预期，模组化产品进一步打开市场空间,乐平科技视角
1670,2020-04-28,卓胜微(300782.SZ)涨近8% 年报及一季报营收净利均双双增长,格隆汇
1671,2020-04-28,晨会聚焦200428重点关注立讯精密、传艺科技、宋城演艺、柏楚电子、澜起科技、传音控股、卓胜微、恒生电子,国信研究
1672,2020-04-28,这10家公司发布公告有看点 季报超预期公司值得关注,巨丰财经
1673,2020-04-28,卓胜微(300782)：新品进展超预期，成高通芯片供应商；新增4家制造封测供应商备战高增长,中信建投证券研究
1674,2020-04-28,上市公司正负面新闻2020年4月28日星期二,Wind
1675,2020-04-27,全面布局5G射频前端技术研发平台 卓胜微2019年净利同比增长206.27%,金融界
1676,2020-04-27,卓胜微业绩持续大增 获半导体、5G等主题基金加持,e公司
1677,2020-04-27,卓胜微：2019年净利润同比增长206.27%,Wind
1678,2020-04-27,【华西电子孙远峰团队-Q1持仓分析】电子行业重仓占比下降，半导体逆势增长,远峰电子
1679,2020-04-27,【华西电子孙远峰-每日观点&资讯】（2020-04-28）,远峰电子
1680,2020-04-27,晚间重要公告2020年4月27日星期一,Wind
1681,2020-04-27,卓胜微：2019年每股收益5.68元 拟10转8派10,上游新闻
1682,2020-04-27,卓胜微年报拟10转8派10元 一季度净利同比增263%,上证报
1683,2020-04-27,卓胜微：2019年实现净利4.97亿元 同比增长206.27%,中证网
1684,2020-04-27,卓胜微：一季度净利润同比增长263.41%,Wind
1685,2020-04-27,卓胜微年报：2019年净利润同比上涨206.27%拟10转8派10元,科创板日报
1686,2020-04-27,卓胜微(300782.SZ)：2019年度净利润升206.27%至4.97亿元 拟10转8派10元,格隆汇
1687,2020-04-27,卓胜微(300782.SZ)：一季度净利升263.41%至1.52亿元,格隆汇
1688,2020-04-27,卓胜微：2019年净利润增长206% 拟10转8派10,e公司
1689,2020-04-27,卓胜微：2019年全年净利润4.97亿 拟10转8派10元,新浪
1690,2020-04-23,【华西电子孙远峰-每日观点&资讯】（2020-04-23）,远峰电子
1691,2020-04-21,方正证券：坚定看好射频产业链，建议关注卓胜微等,证券时报网
1692,2020-04-17,卓胜微：适逢5G代际升级，创领射频主供平台,证券时报网
1693,2020-04-16,半导体板块尾盘发力，华天科技冲击涨停,Wind
1694,2020-04-15,上证指数午盘跌0.15%，创业板指涨0.69%,Wind
1695,2020-04-13,国内手机市场回暖！3月出货量环比大增240%，产业链上市公司首季成绩单来了,Wind
1696,2020-04-13,国内手机市场回暖！3月出货量环比大增240%，产业链上市公司首季成绩单来了,中证报
1697,2020-04-11,国内VS国外：电子板块核心公司2020Q1业绩展望对比,吉森电子研究
1698,2020-04-09,七公司一季报预增超10倍 高德红外荣膺“预增王”,投资快报
1699,2020-04-09,卓胜微为华为三星供货 受益国产替代加速一季度净利预增2.6倍,长江商报
1700,2020-04-09,【新时代电子 吴吉森团队】卓胜微：Q1 业绩指引大超预期，射频芯片国产替代不断加速,新时代证券研究
1701,2020-04-09,『早安，新时代！』晨会早读2020/04/09:今日关注：卓胜微、立讯精密,新时代证券研究
1702,2020-04-09,【东吴电子王平阳团队】卓胜微：5G和射频国产替代加速推进，业绩延续高增长,东吴电子研究
1703,2020-04-08,【安信电子|预告点评】卓胜微：国产射频龙头，国产替代推动业绩高速增长,晓说电子
1704,2020-04-08,【中信建投电子|刘双锋&雷鸣团队】卓胜微一季报预告点评：5G景气向上叠加本土替代节奏加快，国产射频龙头连续5个季度强势增长,中信建投电子研究
1705,2020-04-08,【卓胜微|国信电子】财报预告：5G产品放量，国内射频龙头加速进击,国信电子研究
1706,2020-04-08,卓胜微：20Q1持续高增长,EBSCN电子
1707,2020-04-08,卓胜微大涨7.00%首季净利润暴增,证券时报网
1708,2020-04-08,卓胜微（300782）20年1季度业绩预告点评：5G产品放量，国内射频龙头加速进击,国信研究
1709,2020-04-08,半导体板块异动拉升,Wind
1710,2020-04-08,科创板早报|中国5G手机等供应链寻求国产化替代华为发布会今日召开支持VR直播,科创板日报
1711,2020-04-08,A股早报2020年4月8日星期三,Wind
1712,2020-04-07,卓胜微：预计一季度盈利1.49亿元-1.53亿元 同比增长256.48%-266.48%,中证网
1713,2020-04-07,卓胜微：一季度净利润同比预增256.48%-266.48%,金融界
1714,2020-04-07,[公司]卓胜微：一季度净利1.49亿-1.53亿元 预增2.5-2.6倍,全景网
