,2021-12-31,招商积余一周内耗资2.84亿元收购两家航空物业公司股权,中国网
0,2021-12-31,航空股的2021年：“快乐飞”没有想象中的那么“快乐”,智通财经
1,2021-12-30,连续收购上航南航物业 招商积余抢占航空物管赛道,观点地产网
2,2021-12-30,招商积余(001914)：并购项目接力落地 轻重分离有望提速,新浪
3,2021-12-30,南方航空今日大宗交易成交398.40万股，成交价6.8元溢价0.0%,Wind
4,2021-12-30,A股共发生275宗大宗交易成交59.59亿元（12月30日）,Wind
5,2021-12-30,南方航空大宗交易成交1354.58万元，买方为机构专用席位,证券时报网
6,2021-12-30,招商积余(001914)收并购公告点评：航空业态收并购再落一子 央企物管旗舰发展可期,新浪
7,2021-12-30,南方航空今日大宗交易成交199.20万股，成交价6.8元溢价0.0%,Wind
8,2021-12-30,招商积余捡了两个“包袱”,乐居财经
9,2021-12-29,【中金固收·信用】中国短期融资券及中期票据信用分析周报,中金固定收益研究
10,2021-12-29,连进“两航”！招商积余再购南航物业 持续扩大航空赛道领先优势,经济观察网
11,2021-12-29,解盘：题材股分化，大飞机、盐湖提锂、军工、肺炎检测略涨,Wind
12,2021-12-29,航空板块发力上扬，吉祥航空一度触及涨停，南方航空等大涨,证券时报网
13,2021-12-29,【行情】航空股逆市走高，吉祥航空涨超7%，南方航空、中国国航、中国东航、中信海直等跟涨,金十数据
14,2021-12-28,南方航空(600029.SH)李家世辞去第九届监事会主席及监事职务 董监高成员变化,智通财经
15,2021-12-24,【银华基金】交易日报 2021-12-24,新浪
16,2021-12-21,12月21日上市公司晚间公告速递,新浪
17,2021-12-21,南方航空(600029.SH)：A+H股定增方案获南航集团批复,格隆汇
18,2021-12-21,南方航空：非公开发行A、H股股票获南航集团批复,Wind
19,2021-12-21,南方航空：非公开发行A股、H股股票获得中国南方航空集团有限公司批复,Wind
20,2021-12-19,龙头航司纷纷推航空快线 业内称其为航空运输竞争的“拳头产品”,每日经济新闻
21,2021-12-16,11月民航运输盘点：客运需求持续低迷，货运环比相对亮眼,澎湃新闻
22,2021-12-16,航空运输业2021年11月经营数据点评：国内局部疫情反复 压制航空需求复苏,光大证券
23,2021-12-15,【华创交运】航空行业11月数据点评：多地散发疫情致当前民航业受冲击，不改本轮核心逻辑，持续看好行业2022年起步入复苏之路,新浪
24,2021-12-15,晚间重要公告2021年12月15日星期三,Wind
25,2021-12-15,南方航空(01055.HK)11月载客人数同比下滑53.24%,财华社
26,2021-12-15,南方航空(600029.SH)：11月旅客周转量同比下降53.21%、客座率为63.22%,格隆汇
27,2021-12-15,南方航空：旅客周转量同比下降53.21%,财联社
28,2021-12-15,南方航空：11月客运运力投入（按可利用座公里计）同比下降45.42%,Wind
29,2021-12-14,50款APP，竟有四成存在问题！淘宝、饿了么、滴滴......都被中消协点名了,上证报
30,2021-12-14,中消协：20款APP存不同程度账号注销问题，涉腾讯视频等,澎湃新闻
31,2021-12-14,过度收集个人信息？中消协：20款APP存在不同程度问题,Wind
32,2021-12-14,过度收集个人信息？中消协：20款APP存在不同程度问题,财联社
33,2021-12-14,最后一架完工，A380生产告终,虎嗅网
34,2021-12-13,买下海航，方威到底花了多少钱？,环球旅讯
35,2021-12-13,【银河交通王靖添】行业周报丨中国物流集团正式成立，全面看好综合物流赛道长期投资价值,中国银河证券研究
36,2021-12-10,A股融资融券日报：两融余额增加7.33亿元（12月9日）,Wind
37,2021-12-09,A股融资融券日报：两融余额增加42.4亿元（12月8日）,Wind
38,2021-12-08,11月全球大型航司准点TOP10 南航、东航、国航位居前三甲,民航资源网
39,2021-12-08,今年民航扭亏恐无望，明年有望加速回暖,民航资源网
40,2021-12-08,A股融资融券日报：两融余额减少43.44亿元（12月7日）,Wind
41,2021-12-07,交运行业年度策略报告：关注物流高质量发展 珍惜航空左侧机遇,新浪
42,2021-12-07,A股收盘综述：地产相关产业链风云再起；资金撤离锂电池，宁德时代放量下跌！,Wind
43,2021-12-07,航空股走强，中国国航、华夏航空、南方航空、吉祥航空走强,Wind
44,2021-12-07,国泰君安：关注航空机场“逆向时机”,财联社
45,2021-12-07,A股融资融券日报：两融余额减少24.72亿元（12月6日）,Wind
46,2021-12-06,物流和出行服务行业航空重构繁荣系列之六：黎明前夜 及时布局,新浪
47,2021-12-06,民航黎明的前夜，强烈建议关注三大航高Beta弹性释放、重构繁荣,金融界
48,2021-12-06,【银河交通王靖添】行业周报丨“客改货”政策调整叠加奥密克戎影响，国际航空货运价格再创新高,中国银河证券研究
49,2021-12-05,快递监管要求反内卷，积极布局行业拐点【安信交运|周报1205】,微信
50,2021-12-05,交运社服行业周报(12月第1周)：中免暂缓H股发行上市 港版健康码上线,新浪
51,2021-12-05,交通运输行业周报：国内疫情仍有反复 国外防输入压力持续加大,光大证券
52,2021-12-03,波音市值暴涨逾80亿美元，咋回事？,上证报
53,2021-12-03,物流和出行服务行业B737MAX获中国民航局适航许可跟踪点评：B737MAX获适航许可 距国内复飞再近一步,新浪
54,2021-12-02,A股融资融券日报：两融余额增加5.37亿元（12月1日）,Wind
55,2021-12-02,海口美兰机场二期今日通航投运,Wind
56,2021-12-01,中国短期融资券及中期票据信用分析周报,新浪
57,2021-12-01,交通运输行业周报数据库：快递盈利改善持续 关注航空逆向时机,新浪
58,2021-12-01,大湾区红利释放新趋向，链接长三角特大城市——南京，产业协同共迎新机遇,Wind
59,2021-11-30,业绩压力太大？升级版“随心飞”集中上新 航司或仍难借此“纾困”,财联社
60,2021-11-30,A股融资融券日报：两融余额增加18.95亿元（11月29日）,Wind
61,2021-11-29,南航恢复乌鲁木齐-喀纳斯航线 助力冬季旅游,民航资源网
62,2021-11-29,解盘：股指震荡走高，锂电、储能、肺炎检测领涨,Wind
63,2021-11-29,【行情】A股民航机场板块开盘领跌，白云机场、中国国航、南方航空、上海机场、吉祥航空等跌幅居前,金十数据
64,2021-11-29,航空及机场股下挫，中国国航跌超6%,Wind
65,2021-11-28,以数字化转型开启新征程——访中国南方航空集团有限公司董事长、党组书记马须伦,经济日报
66,2021-11-26,航空股走弱，春秋航空、中国国航、吉祥航空、南方航空跌幅明显,Wind
67,2021-11-26,A股融资融券日报：两融余额增加16.32亿元（11月25日）,Wind
68,2021-11-25,A股融资融券日报：两融余额增加23.98亿元（11月24日）,Wind
69,2021-11-24,中国短期融资券及中期票据信用分析周报,新浪
70,2021-11-24,慧眼识道——南方航空联合亮亮视野基于AR技术实现全业务流程数字化的实践探索,砍柴网
71,2021-11-24,交通运输行业周报数据库：航空复苏趋势确定 快递盈利弹性或超预期,新浪
72,2021-11-24,南方航空：选举杨斌为本公司第九届监事会职工代表监事,Wind
73,2021-11-24,南方航空(600029.SH)选举杨斌为职工代表监事,智通财经
74,2021-11-23,【国君交运】南方航空A：短暂旺季展现弹性，大循环下盈利可期,郑武看交运
75,2021-11-23,【国君交运】南方航空H：短期业绩仍将承压，未来复苏趋势确定,郑武看交运
76,2021-11-23,国产新冠特效药要来了，布局困境反转,菜鸟理财
77,2021-11-23,国泰君安：维持南方航空(01055)“增持”评级 目标价5.97港元,智通财经
78,2021-11-22,每日报告回放,新浪
79,2021-11-22,交运中小盘行业周报：快递持续边际改善 疫情消退利好出行复苏,新浪
80,2021-11-22,【银河交通王靖添】行业周报丨电商快递单价呈现拐点信号，头部快递公司流量优势有望增厚业绩,中国银河证券研究
81,2021-11-20,民航数据洞察|“回暖期”在10月中途遇阻 专家预期民航业下半年表现或将不及去年,每日经济新闻
82,2021-11-19,运输“十四五”规划印发，谁是行业“最强王者”？,Wind
83,2021-11-17,航空机场10月数据点评：数据乏善可陈 但或代表未来几个月的常态,新浪
84,2021-11-17,中国短期融资券及中期票据信用分析周报,新浪
85,2021-11-17,航空运输行业：10月疫情扰动中 民航平稳恢复,新浪
86,2021-11-17,物流和出行服务行业10月航空机场运营数据跟踪：黎明切近 及时布局,新浪
87,2021-11-17,航空10月数据点评：短期疫情再袭 继续看好长期趋势,新浪
88,2021-11-16,晚间重要公告2021年11月16日星期二,Wind
89,2021-11-16,南方航空：10月客座率为69.57%，同比下降6.88%,阿尔法工场
90,2021-11-16,南方航空：19月旅客周转量同比下降27.72%,资本邦
91,2021-11-16,南方航空：10月旅客周转量同比下降27.72%,Wind
92,2021-11-16,南方航空(600029.SH)10月份客运运力投入同比降20.57%,智通财经
93,2021-11-16,南方航空：10月旅客周转量同比下降27.72%,第一财经
94,2021-11-16,南方航空(600029.SH)：10月旅客周转量同比下降27.72%、客座率为69.57%,格隆汇
95,2021-11-16,交通运输2022年年度策略：谷雨春光晓 王者再归来,新浪
96,2021-11-16,南方航空：全球客运量未来三年将逐步恢复，2023年有望超过疫情前的水平,每日经济新闻
97,2021-11-16,南方航空：公司董事长未持有本公司股票,每日经济新闻
98,2021-11-15,运输行业：航空布局确定复苏 快递峰值平滑助力改善,新浪
99,2021-11-15,交通运输行业2022年投资策略：柳暗花明 拨云见日,光大证券
100,2021-11-15,【银河交通王靖添】行业周报丨“双十一”快递件量增速超20%，航空货运价格处于阶段性高位,中国银河证券研究
101,2021-11-15,双十一期间快递量增超两成，中小市值公司表现亮眼【国信交运中小盘周观点】,微信
102,2021-11-12,急推“随心飞”，重征燃油附加费，三季度巨亏的航司们忙自救 重大损失,ZAKER
103,2021-11-12,花旗：予南方航空(01055)“买入”评级 目标价降至5.7港元,智通财经
104,2021-11-10,南方航空：12月28日召开2021年第二次临时股东大会,Wind
105,2021-11-10,前三季度上市航司减亏约147亿元 上海机场营收净利同比双降 亏损,每日经济新闻
106,2021-11-09,中国航企进博会采购签约近百亿 观点：全球合作全球共赢,民航资源网
107,2021-11-09,“白菜价”算什么，巨亏的航企为“笼络”旅客真拼了 重大损失,36氪
108,2021-11-09,A股融资融券日报：两融余额增加39.23亿元（11月8日）,Wind
109,2021-11-09,新能源主线继续领跑，机构建议布局“跨年行情”,Wind
110,2021-11-08,机场航运股集体走高，多因素拖累三季报业绩，板块何时迈入复苏周期？ 盈利能力下降,财联社
111,2021-11-08,9000亿赛道重挫、美国突发大消息，市场预期巨变？,Wind
112,2021-11-08,A股收盘综述：锂电池王者归来，天齐锂业上板并获主力净流入27亿元,Wind
113,2021-11-08,海外传来利好，美国取消这项禁令，今年巨亏板块闻讯拉升！机构：它们将迎来业绩拐点,证券时报
114,2021-11-08,恒指午盘跌0.57%，博彩、航空、餐饮股逆市走强,Wind
115,2021-11-08,解盘：大盘转暖，锂电、航空、稀土、环保、游戏领涨,Wind
116,2021-11-08,A股午盘综述：锂电池板块再度崛起，稀土、环保、航运、元宇宙炒作积极,Wind
117,2021-11-08,民航机场板块走强，中国国航、南方航空触及涨停,金融界
118,2021-11-08,港股异动：航空股全线走强，南方航空大涨10%、国泰航空涨4%,证券之星
119,2021-11-08,港股异动 | 南方航空(01055)涨超15%领涨航空股 辉瑞新冠口服药疗效显著叠加美国放宽入境限制,智通财经
120,2021-11-08,港A航空及航空服务股集体大涨：上海机场逼近涨停，南方航空H股涨超12%,格隆汇
121,2021-11-08,机场航运板块板块开盘走强，南方航空触板，中国国航、白云机场、上海机场、春秋,新浪
122,2021-11-08,航空运输板块飙升，南方航空触及涨停,Wind
123,2021-11-07,解密航企“进博购物车”：数十亿美元大单背后的新角色,第一财经
124,2021-11-05,财华聚焦|航空股何时现曙光？,财华社
125,2021-11-05,交通运输行业周报(第四十二周)：首选电商快递 布局航空、油运,新浪
126,2021-11-04,交通运输行业周报(第四十三周)：“双十一”启动 首选电商快递;关注航空、机场、油运,新浪
127,2021-11-04,金融街下午茶2021年11月4日星期四,Wind
128,2021-11-04,航空行业21Q3季报总结：航空复苏曲折向上 春秋为唯一盈利航企,西南证券
129,2021-11-04,多家航司将恢复征收国内航线燃油附加费,Wind
130,2021-11-03,航空龙头重征燃油附加，多家跟进。行业三季报承压，2022年复苏之路将呈现差异（附股）,新浪
131,2021-11-03,美股航空股多数下跌，沃拉里斯航空跌逾5%,Wind
132,2021-11-02,北向资金连续4日净买入累计扫货近150亿，新能源龙头股集体获抢筹,Wind
133,2021-11-02,航空燃油附加费即将复出，机票要涨多少钱？,环球旅讯
134,2021-11-02,《个人信息保护法》对航空公司业务数据处理有什么影响？,环球旅讯
135,2021-11-02,民航业亏损持续 三季度仅一家廉航盈利,北京商报
136,2021-11-02,民航业亏损持续 三季度仅一家廉航盈利 亏损,北京商报
137,2021-11-01,三季度业绩仍亏损 升级“快乐飞”的航司们能顺利渡过寒冬吗？ 亏损,北京商报
138,2021-11-01,重整计划被批准，1.1万亿元债务海航如何偿还？,新浪
139,2021-11-01,图解南方航空三季报：第三季度单季净利润同比减301.27% 盈利能力下降,证券之星
140,2021-11-01,航司日均亏损超9千万，燃油附加费重出江湖 亏损,36氪
141,2021-10-31,南方航空三季报点评：疫情影响业绩为负，亏损小于预期【国信交运中小盘】,微信
142,2021-10-31,【国海交运李跃森】南方航空：疫情散发冲击暑运，旺季盈利不及预期 盈利能力下降,许可交运参考
143,2021-10-31,如何看极兔收购百世快递？【安信交运|周报1031】,微信
144,2021-10-30,五家航空公司三季报：四家亏损共计逾80亿，仅春秋航空盈利 亏损,澎湃新闻
145,2021-10-30,6家上市航司前三季度合计亏损279.3亿仅春秋盈利，民航何时迎来复苏拐点？ 亏损,民航资源网
146,2021-10-30,中国南方航空股份有限公司非公开发行A股股票预案,证券时报
147,2021-10-30,Wind风控日报2021年10月30日星期六,Wind
148,2021-10-29,南方航空(600029.SH)拟非公开发行A股股票募集不超过45亿元,智通财经
149,2021-10-29,南方航空(600029.SH)前三季度归母净亏61.19亿元 亏损,智通财经
150,2021-10-29,公告精选：招商轮船拟收购中外运集运；ST柏龙时任董事长陈伟雄等被终身市场禁入 其他违规处罚,e公司
151,2021-10-29,【晚间公告抢先看】中青宝研发《酿酒大师》预计于明年3月完成、文山电力本次标的建设周期长或造成财务负担,金融界
152,2021-10-29,南方航空拟定增募资不超45亿元，前三季亏损61.19亿元 亏损,澎湃新闻
153,2021-10-29,三季度南航亏损14.31亿元 亏损,民航资源网
154,2021-10-29,南方航空：拟非公开增发募资不超过45亿元,每日经济新闻
155,2021-10-29,南方航空：任积东因工作变动不再担任公司副总经理 董监高成员变化,每日经济新闻
156,2021-10-29,新鲜出炉！南方航空：2021年第三季度净利润亏损14.31亿元 亏损,每日经济新闻
157,2021-10-29,南方航空：拟非公开发行A股募资45亿元 补充流动资金,e公司
158,2021-10-29,南方航空：前三季度亏损缩窄，净亏损61.19亿元 亏损,Wind
159,2021-10-29,南方航空：第三季度净亏损14.3亿元 拟定增募资不超45亿元用于补充流动资金 亏损,财联社
160,2021-10-29,南方航空：拟向控股股东南航集团定增A股募资不超45亿元,Wind
161,2021-10-29,3000元不限次数飞行，网友：疫情一来就推随心飞...顾客、航司到底谁赚了？,北京商报
162,2021-10-29,南方航空第三季度净利润亏损约14.31亿元 亏损,北京商报
163,2021-10-28,民航迎淡季 多家航司推“随心飞”3.0自救,北京商报
164,2021-10-28,半个月内超5款产品亮相 航司们的“随心飞”3.0版你会买单吗？,北京商报
165,2021-10-28,财面儿丨南方航空拟转让旗下物业公司95%股权 底价1.01亿元,财经网
166,2021-10-28,钛媒体联合创始人万宁：从业务数字化到数字化业务｜2021全球数字价值峰会,钛媒体
167,2021-10-28,南航物流总经理刘祖斌走访中原龙浩航空 洽谈航空货运合作,民航资源网
168,2021-10-27,南航生态圈建设取得新突破 获国际航协新零售成熟度认证,民航资源网
169,2021-10-26,傅鹏博、赵诣、冯明远、林英睿、赵枫持仓思路各有不同,Wind
170,2021-10-24,双11预售启动，冬春航季供给增速收窄【安信交运|周报1024】,微信
171,2021-10-21,交通运输动态点评：三季报前瞻 布局航空和油运,新浪
172,2021-10-21,航空行业9月报：主要运输指标环比改善,新浪
173,2021-10-19,交通运输行业周报：预计航空Q3业绩承压 快递价格显着回升,新浪
174,2021-10-18,交通运输行业周报：海运价格回调 民航客运环比改善,新浪
175,2021-10-18,交通运输行业周报聚焦9月数据：航空环比修复 快递单价环比上涨 部分公司披露三季报预告,新浪
176,2021-10-17,交通运输行业三季报前瞻：繁荣的集运产业链 成长的大宗供应链,新浪
177,2021-10-16,9月生产运输逐步恢复态势，民航如何抵御今年最后的淡季,澎湃新闻
178,2021-10-15,南方航空：9月旅客周转量同比下降25.67%,财联社
179,2021-10-15,南方航空(600029.SH)：9月旅客周转量同比降25.67% 货邮周转量降20.63%,格隆汇
180,2021-10-15,南方航空：9月客运运力投入（按可利用座公里计）同比下降16.24%,Wind
181,2021-10-15,南航物流、海尔生物战略合作，推动航空温控物流高质,中经导报
182,2021-10-14,至暗时刻已过，吸收合并加快，机场旅游大爆发,Wind
183,2021-10-14,南航拥抱鲲鹏，引领航空智慧、安全、高效运行,TechWeb
184,2021-10-14,2021年了，我们为什么还没用上空中Wi,新浪
185,2021-10-13,交通运输物流3Q业绩预览：Β仍在演绎 关注Α,新浪
186,2021-10-13,8年普及率仅5.5%，旅客何时才能在飞机上实现上网自由？,环球旅讯
187,2021-10-12,交通运输行业2021年秋季投资策略：长期趋势确定 把握逆向时机,新浪
188,2021-10-11,运输行业：快递旺季提价在即 航空国庆客源不足,新浪
189,2021-10-09,航空市场国庆假期跟踪点评：出行指引受限 国庆客源不足,新浪
190,2021-10-09,社会服务/交通运输动态点评：国庆假期疫情控制与需求恢复同行,新浪
191,2021-10-09,交通运输物流：“十一”交运数据：疫情影响下客流量偏弱,新浪
192,2021-10-09,交通运输行业周报(第三十九周)：首选电商快递 布局干散、油运和航空,新浪
193,2021-10-09,逾千家A股公司披露ESG报告，信息含金量有待进一步提高,Wind
194,2021-10-08,南方航空：“南航转债”第三季度转股约1.28万股，累计转股约16.19亿股,每日经济新闻
195,2021-10-08,板块异动 | 航空股迎投资机遇期 民航机场板块持续走强,智通财经
196,2021-10-06,国君交运：集运警惕需求拐点，关注航空双重复苏逻辑,证券之星
197,2021-10-05,陆家嘴财经早餐2021年10月5日星期二,Wind
198,2021-10-05,欧美股市普跌，Facebook等科技巨头宕机拖累科技板块,Wind
199,2021-10-05,美国三大股指全线收跌，科技股遭重挫,Wind
200,2021-10-04,港股旅游、航空板块逆市走强，中国国航涨超7%,Wind
201,2021-09-30,南方航空：“南航转债”2021年付息,Wind
202,2021-09-29,【中金固收·信用】中国短期融资券及中期票据信用分析周报,中金固定收益研究
203,2021-09-29,交通运输行业周报(第三十七周)：旺季提价兑现 继续推荐快递;左侧布局油运和航空,新浪
204,2021-09-29,“国之重器”亮相珠海航展，30家A股公司积极参与,Wind
205,2021-09-28,中国商飞：6架C919正试验试飞，CR929研制进展顺利,Wind
206,2021-09-28,抄优信作业？瓜子二手车升级为新电商，分期购车强行分36期,凤凰网
207,2021-09-28,中国上市公司董秘勋章奖,证券时报
208,2021-09-26,交通运输行业：继续推荐电商快递板块 政策催化与龙头提价共振,广发证券
209,2021-09-26,交运社服行业周报(9月第4周)：中秋民航旅客恢复至65% 海南开展免税促销活动,新浪
210,2021-09-26,交通运输行业周报：快递供给变化加速 关注竞争格局潜在变化,新浪
211,2021-09-26,快递供给变化加速，关注竞争格局潜在变化【安信交运|周报0926】,明兴交运研究
212,2021-09-26,下周1003亿市值限售股解禁，环比减少22.37% 解禁,Wind
213,2021-09-25,大兴机场累计完成旅客吞吐量超3800万人,Wind
214,2021-09-24,下周解禁市值不足千亿元 解禁,大众证券报
215,2021-09-24,抄优信作业？瓜子二手车升级为新电商，分期购车强行分36期,和讯
216,2021-09-23,工信部通报52款问题APP未完成整改 南方航空、滴答出行、喜茶GO等在列,新快报
217,2021-09-23,南方航空：10月29日举行董事会会议,Wind
218,2021-09-23,滴答出行、南方航空、喜茶等被通报整改！ 其他违规处罚,工信部
219,2021-09-23,航空行业8月报：疫情扩散影响下 客货运量大幅下降 盈利能力下降,新浪
220,2021-09-23,工信部通报今年第十批侵害用户权益行为APP 南方航空、GoFun出行等334款未完成整改,工信部
221,2021-09-23,工信部通报！52款APP未完成整改：涉驴妈妈、南方航空等,中新经纬
222,2021-09-22,运输行业：快递单价如期回升 建议关注估值修复,新浪
223,2021-09-22,两地上市或成未来主流趋势，年内6股实现“A+H”,Wind
224,2021-09-21,交通运输行业周报：快递价格回升 中秋节客流符合预期,新浪
225,2021-09-21,交通运输行业周报：海运价格趋稳 民航增加旺季航班,新浪
226,2021-09-18,交通运输物流：航空：疫情反复 8月经营承压,新浪
227,2021-09-17,南方航空(600029.SH)：约4.8920亿股限售股将解禁 解禁,格隆汇
228,2021-09-17,南方航空：4.89亿股限售股9月27日上市流通 解禁,Wind
229,2021-09-17,航空运输业2021年8月经营数据点评：疫情反复不改需求恢复趋势 一线机场航司仍具配置价值,光大证券
230,2021-09-16,晚间重要公告2021年9月16日星期四,Wind
231,2021-09-16,交通运输行业周报(第三十六周)：旺季提价兑现 继续推荐快递;左侧布局油运,新浪
232,2021-09-15,晚间重要公告2021年9月15日星期三,Wind
233,2021-09-15,晚间公告｜9月15日这些公告有看头,第一财经
234,2021-09-15,南方航空：8月客运运力投入同比下降40.82%,36氪
235,2021-09-15,南方航空：8月旅客周转量（按收入客公里计）同比下降51.23% 盈利能力下降,Wind
236,2021-09-14,交通运输行业周报：民航扭亏确定性强 盐田港吞吐量恢复常态,新浪
237,2021-09-13,交通运输行业周报：大宗供应链高增长 低估值龙头受青睐,新浪
238,2021-09-13,交运社服行业周报(9月第2周)：出行大反弹 免税强促销,新浪
239,2021-09-10,交运社服行业周报：重大推荐白云机场,新浪
240,2021-09-09,早读拾光（9.9）丨福州第二轮集中土拍“降温” 南方航空拟转让南航物业95%股权,和讯
241,2021-09-08,中国短期融资券及中期票据信用分析周报,新浪
242,2021-09-08,南方航空拟转让南航物业95%股权 截止7月底负债总计9457万元,观点地产网
243,2021-09-08,南方航空挂牌转让南航物业95%股权,乐居财经
244,2021-09-08,晨报0908 | 基金专题、石化专题、通信专题、南方航空（600029）,国泰君安证券研究
245,2021-09-07,【国君交运】南方航空A：Q2较2019年减亏，上调评级至增持——2021年中报点评,郑武看交运
246,2021-09-07,【国君交运】南方航空H：淡季超预期恢复，维持增持评级——2021年中报点评,郑武看交运
247,2021-09-07,每日报告回放,新浪
248,2021-09-06,航司Q2业绩恢复显着超预期，建议珍惜底部机会,金融界
249,2021-09-04,至暗时刻已过，民航业亏损中难掩回暖大势,Wind
250,2021-09-01,航空行业：国内大循环下 航司有望超预期盈利,新浪
251,2021-08-31,交通运输行业周报：通达系全部上调派费 行业价格回暖确定,新浪
