735,2021-03-15,"新浪财经汽车行业""消费扫帚榜""发布:宝马负面评价热度最高",新浪
736,2021-03-15,多家航空公司公布2月运营数据，机构看好行业复苏丨牛熊眼,第一财经
737,2021-03-15,民航需求加速恢复，这些股有望受益，北上资金重金杀入4股,证券时报网
738,2021-03-15,各种“茅”集体重挫！外资仍在扫货，资金流向低估值赛道？,Wind
739,2021-03-15,民航发展基金征收标准再降20%，港A航空股集体走强！,环球老虎财经
740,2021-03-15,港股收盘(3.15)|恒指收涨0.33% 航空股涨幅居前 南方航空(01055)涨超9%,智通财经
741,2021-03-15,A股主力资金流向（3月15日）：半导体白酒及新能源股抛压较重,Wind
742,2021-03-15,A股也“沙尘暴”，创业板一度跌超5%，基金又上热搜,Wind
743,2021-03-15,南方航空：2月客运运力投入同比上升65.14%,Wind
744,2021-03-15,南方航空：2月集团客运运力投入同比上升65%,e公司
745,2021-03-15,南方航空(600029.SH)2月旅客周转量同比升127.06%,格隆汇
746,2021-03-15,“快乐飞”难快乐，部分航司“随心飞”产品暗藏陷阱,时代在线
747,2021-03-15,收评 | 基金重仓股重挫创业板跌4% 如何应对,第一财经
748,2021-03-15,民航发展基金征收标准再降20%，航空板块集体起飞，南方航空涨停！,格隆汇
749,2021-03-15,A股收盘综述：上证指数跌0.96%守住3400关口，创业板指再挫逾4%,Wind
750,2021-03-15,复苏概念股启动“暴涨”模式，机构纷纷这样表态,汇通网
751,2021-03-15,航空股涨幅居前 南方航空涨超8%东方航空涨超7%,新浪
752,2021-03-15,南方航空回封涨停板，中国国航、东方航空跟涨,Wind
753,2021-03-15,航空板块突然集体起飞：为什么 能追吗？,上证报
754,2021-03-15,创业板大跌超3%，茅台破2000元！半导体白酒领跌,Wind
755,2021-03-15,这个板块突然集体起飞！为什么？能追吗？,Wind
756,2021-03-15,南方航空(600029.SH)涨停,格隆汇
757,2021-03-15,解盘：复苏逻辑兑现，航空、旅游、免税店板块逆市走强,Wind
758,2021-03-15,A股午盘综述：上证指数跌0.61%、创业板指跌超3%，机构抱团股再度重摔,Wind
759,2021-03-15,需求迅速恢复，航空旅游等板块集体大涨，南方航空等涨停,证券时报网
760,2021-03-15,【异动股】民航机场板块拉升，南方航空(600029-CN)涨9.97%,财华社
761,2021-03-15,南方航空封住涨停，东方航空、中国国航飙升,Wind
762,2021-03-15,【行情】航空股异动拉升，东方航空涨近5%，华夏航空、南方航空、中国国航等拉升跟涨,金十数据
763,2021-03-15,航空股迅速走强，东方航空涨超4%,Wind
764,2021-03-14,民航需求加速恢复，继续推荐航空板块【安信交运丨周报0314】,明兴交运研究
765,2021-03-14,航空：疫苗时间表日趋明晰，清明五一需求或超预期【国信交运中小盘姜明】,微信
766,2021-03-12,业绩亏损叠加大额债券年内到期，2张表一览这28家上市公司状况,Wind
767,2021-03-12,南方航空开通广州至腾冲直飞航线,云南日报
768,2021-03-11,东航物流IPO：退役机型占比高 关联交易频发引质疑,新浪
769,2021-03-11,“两会·问计河南” 河南本土客运航空何时启航？,大河报
770,2021-03-10,2月全球大型航司准点率TOP榜 东方航空跻身TOP3,民航资源网
771,2021-03-10,光大证券--交通运输行业周报：春运后期旅客量恢复明显，国内客运需求拐点已至【行业研究】,金融界股吧
772,2021-03-09,疫情下机队重组后 哪家航司飞机最多？,民航资源网
773,2021-03-09,交通运输行业双周报148期：快递业务量修复强劲 灵便型散货船创11年新高,新浪
774,2021-03-09,八大券商主题策略：寒冬已过、春日可期！这是下一轮航空周期的起点？,中金在线
775,2021-03-08,东方航空(600115)：周期复苏 东方燕来,新浪
776,2021-03-08,2021年1月民航共完成货邮运输量66.9万吨，同比增长10.5%,重庆商报
777,2021-03-07,交通运输行业周报：航空需求持续复苏 民航发展基金减收降负,新浪
778,2021-03-06,航空行业月报：航空需求拐点将至，看好行业周期上行-20210304,国元国际
779,2021-03-05,3·15判例|航班延误少于4小时南方航空拒绝补偿 法院判赔1400元 诉讼纠纷,新浪
780,2021-03-05,会见企业家｜春秋航空王煜：中国航空客运的黄金十年才刚开始,澎湃新闻
781,2021-03-05,【近期研报】必选消费月报；航空行业月报,国元国际
782,2021-03-04,航空装备行业：C919商业化运营在即 航空制造产业链有望受益,新浪
783,2021-03-04,中国民航维修业十三五回顾与思考,民航资源网
784,2021-03-04,南方航空：已开展新冠疫苗运输,Wind
785,2021-03-04,纳指又崩盘，拜登迎上任后最大考验,Wind
786,2021-03-04,【行情】美股航空股走高，夏威夷航空涨5.52%，南方航空涨5.25%，美国航空集团涨5.11%，捷蓝航空涨3.63%，美国联合航空涨超3%,金十数据
787,2021-03-03,民航板块稳步走升，华夏航空大涨7%,Wind
788,2021-03-02,民航局对南方航空、阿尔及利亚航空发出熔断指令,中证网
789,2021-03-02,入股苏宁易购，深圳国资在走怎样一步棋？,Wind
790,2021-03-01,签署购机合同，国产大飞机全球首单正式落地,Wind
791,2021-03-01,安信证券--交通运输行业周报：《国家综合立体交通网规划纲要》发布【行业研究】,金融界股吧
792,2021-03-01,交通运输行业周报：我国社会物流总额迈上新台阶 鄂州航空物流产业园开工,新浪
793,2021-03-01,中国在一周内夺回“最大航空市场”宝座，美国航空也再次成为第一,环球旅讯
794,2021-03-01,从一路飚进到四面楚歌，海航究竟经历了什么？,环球旅讯
795,2021-03-01,招商交运物流每周专题报告：交运出行明显复苏 大宗商品物流景气维持,新浪
796,2021-02-27,民航数据洞察｜客运解析：1月航空旅客不足去年同期六成，南航客运量最大,每日经济新闻
797,2021-02-27,民航数据洞察｜开年首月六大航司流失旅客1709万人次 国航逆势引进5架飞机,每日经济新闻
798,2021-02-26,全国政协委员许玲呼吁：设立大湾区职业教育改革试验区,南方+
799,2021-02-25,华西证券--交通运输行业航空复苏系列报告之一：疫苗有序接种且有效性渐得验证，三大航国际需求恢复空间巨大【行业研究】,金融界股吧
800,2021-02-24,航空行业月报：1月防疫政策压抑出行需求 静待民航客流修复,新浪
801,2021-02-24,每日理财观察：易方达中小盘暂停申购并启动大比例分红,Wind
802,2021-02-24,港股盘前必读：汇丰控股2020年净利润38.98亿美元同比下降34.7%,Wind
803,2021-02-24,美股绝地反击！鲍威尔表态，国内市场将如何演绎？,券商中国
804,2021-02-24,美股航空股普涨 中概股南方航空涨逾15%,中证网
805,2021-02-24,欧美股市涨跌不一，鲍威尔暗示将坚持宽松货币政策美股探底回升,Wind
806,2021-02-24,美国三大股指收盘涨跌不一，鲍威尔暗示将坚持宽松货币政策,Wind
807,2021-02-23,美股三大指数全线低开 特斯拉跌超7%,中新经纬
808,2021-02-23,热门中概股多数下跌，嘉楠科技跌18.9%,Wind
809,2021-02-23,2021年1月及春节假期航空数据更新：2021年1月国内民航复苏放缓 但春节假期后期已呈现回暖趋势,新浪
810,2021-02-23,香港恒生指数午盘涨1.48%报30769.20点，能源股、金融股及航空股涨幅居前,Wind
811,2021-02-23,中国国航拉升，南方航空、吉祥航空、东方航空纷纷跟涨,Wind
812,2021-02-23,交通运输行业动态报告：春运需求前低后高 航空有望否极泰来,新浪
813,2021-02-22,南方航空今日大宗交易成交344万股，成交价6.35元溢价0.63%,Wind
814,2021-02-22,航空运输行业：利空逐步出尽 积极布局航空板块,新浪
815,2021-02-22,"南方航空现1笔大宗交易 共成交2,184.40万元",新浪
816,2021-02-22,航空1月经营数据点评：航空仍处于复苏进程 优选春秋航空,新浪
817,2021-02-22,汇丰证券降南方航空评级至持有，维持目标价5港元 投资评级恶化,Wind
818,2021-02-22,交通运输行业周报：疫情反复致1月民航客座率处低位 低基数下快递行业业务量大幅增长 关注京东物流提交IPO申请,新浪
819,2021-02-21,航空公司行业跟踪报告：受疫情影响 航司1月及春运开局数据平淡；但抗疫渐入佳境 看好航空周期上行,新浪
820,2021-02-20,“渝穗深”快线试运行上线，旅客可在三家航空公司自由变更三地往来行程,重庆商报
821,2021-02-20,京北方：中标4571万元南方航空服务外包项目,e公司
822,2021-02-20,航空运输业2021年1月经营数据点评：全国高风险地区清零 国内航空需求拐点将至,光大证券
823,2021-02-20,博睿数据(688229)投资价值报告：APM龙头 布局IT运维蓝海,新浪
824,2021-02-19,航空运输行业2021年1月数据点评：疫情反复致1月及春节假期客座率处低位 2月起航班量同比明显增长 持续强推春秋航空与华夏航空,新浪
825,2021-02-19,三大航1月运营表现：客运运力同比降幅超五成，货运回暖上升,澎湃新闻
826,2021-02-19,【研报掘金】航空需求复苏确定性高叠加估值重回低位 板块迎来绝佳投资机会,证券时报网
827,2021-02-19,交运｜寒冰渐融，及时布局：从春运数据看出行板块配置时机,中信证券研究
828,2021-02-19,上市公司理财持续降温，结构性存款仍受追捧,Wind
829,2021-02-19,民航1月客运需求低迷 未来板块复苏确定性高,证券时报
830,2021-02-18,民航1月客运需求低迷 航空板块后市仍获机构看好,e公司
831,2021-02-18,交通运输行业从春运数据看出行板块配置时机专题报告：寒冰渐融 及时布局,新浪
832,2021-02-18,南方航空(600029.SH)1月旅客周转量同比下降59.16%,智通财经
833,2021-02-18,南方航空：1月本集团旅客周转量（按收入客公里计）同比下降59.16% 盈利能力下降,格隆汇
834,2021-02-18,交通运输行业：抗疫渐入佳境 航空再迎买点,新浪
835,2021-02-18,中金：中资航空股今年下半年有望复苏，推荐国航,Wind
836,2021-02-18,航空股集体走强，华夏航空、中国国航涨幅靠前,Wind
837,2021-02-17,看好快递、航空反弹！【安信交运丨周报0217】,明兴交运研究
838,2021-02-10,巴航工业计划启动E系列飞机客改货项目,民航资源网
839,2021-02-10,中国短期融资券及中期票据信用分析周报,新浪
840,2021-02-09,1月全球大型航司准点率TOP榜 南航跻身TOP5,民航资源网
841,2021-02-09,润建股份预中标南方航空约1.45亿元合作开发集采项目,上证报
842,2021-02-08,润建股份(002929.SZ)拟中标南方航空二采购项目 涉资1.44亿元,智通财经
843,2021-02-08,六家航空公司合计预亏千亿元 行业现金流承压 预亏,中证报
844,2021-02-08,长假刺激 港A航空股集体上涨 南方航空领涨,格隆汇
845,2021-02-08,招商交运行业物流每周专题报告：疫苗接种加速 航空迎来全面复苏,新浪
846,2021-02-07,交通运输行业研究周报：商流携手物流 春节快递件量增长有望加速,新浪
847,2021-02-07,交通运输行业周报：顺丰筹划收购事宜 关注节后航空客流复苏,新浪
848,2021-02-07,顺丰筹划收购事宜，关注节后航空客流复苏【安信交运丨周报0207】,明兴交运研究
849,2021-02-07,交通运输行业周报：1月电商物流业务量同比增速超三成,新浪
850,2021-02-06,民航的艰难与自救：机票仅够覆盖机组工资，有时一班飞机只卖出几张票,腾讯网
851,2021-02-06,"民航的艰难与自救 ""一班飞机总共只卖出个位数客票""",经济观察报
852,2021-02-05,民航股午盘前异动，吉祥航空大涨5%,Wind
853,2021-02-05,【行情】民航板块再度冲高，吉祥航空大涨6%，东方航空、南方航空、中国国航等纷纷拉升,金十数据
854,2021-02-05,上市航企巨亏预警 航空业2021年面临大考 重大损失,中华工商时报
855,2021-02-04,东方航空拟向控股股东定增近108亿元 行业寒冬航司积极自救,证券日报网
856,2021-02-04,民航板块逆势走强，春秋航空大涨4%,Wind
857,2021-02-04,定增逾百亿 东航集团再度输血东方航空,证券时报
858,2021-02-03,东航集团股权多元化改革4个月后：东方航空拟定增获百亿“驰援”,e公司
859,2021-02-03,交通运输行业2020年年报报前瞻＆机构配置增加：机场机构配置减少 华贸物流机构配置增加,新浪
860,2021-02-03,上海机场为何连续跌停？躺赚时代成过往 连续下跌,第一财经
861,2021-02-03,从上海机场2跌停看疫情年航空业变革：机场流量生意变天，三大航日亏一亿低成本航司异军突起 亏损,金融界
862,2021-02-02,去年国内6家上市航司合计亏损或超千亿， “史上更差春运”接踵而至？ 亏损,环球旅讯
863,2021-02-02,交银国际：将南方航空(01055)目标价上调7.7%至5.69港元 评级“买入”,智通财经
864,2021-02-02,瑞信维持东航、国航、南航跑赢大市评级,Wind
865,2021-02-02,六家航空公司合计预亏千亿元 预亏,中证网
866,2021-02-01,航空行业：ARJ21商业经济性初步探讨,新浪
867,2021-02-01,南方航空(600029)：料亏损额三大航最低 高BETA释放曙光或现 预亏,新浪
868,2021-02-01,交运一周天地汇：UPS出售陆运业务 节前BDI、内贸集运季节性回落但同比维持强势,新浪
869,2021-02-01,1400亿大白马跌停，众兄弟跟跌！中金、高盛下调评级,e公司
870,2021-02-01,罕见！1400亿大白马一字跌停，众兄弟都跟跌！中金、高盛纷纷下调评级，到底什么情况？ 连续下跌,证券时报网
871,2021-02-01,富瑞：中国三大航企发盈警不意外，料国内旅游将反弹,Wind
872,2021-02-01,民航板块再度走高，春秋航空涨超6%脱颖而出,Wind
873,2021-02-01,周末集中爆雷，郑爽有份！82只A股预亏3000亿,新财富
874,2021-02-01,2386份年报业绩预告：近六成报喜，龙头公司领跑势头强劲,Wind
875,2021-01-31,六大航空股拉响千亿亏损预警 “史上更差春运”接踵而至 亏损,时代在线
876,2021-01-31,周末影响A股十大事件，券商称最恐慌时点已过,中国基金报
877,2021-01-31,【华创交运*周报】多公司披露2020年业绩预告，民航板块受疫情影响多数预亏 预亏,华创交运与供应链研究
878,2021-01-31,春运客流下降，上机签订免税补充协议【安信交运丨周报0131】,明兴交运研究
879,2021-01-30,沪深两市年报预告收官，多家公司2020年预亏上百亿元 预亏,Wind
880,2021-01-29,凛冬已至！三大航空公司巨亏300多亿，每天亏近1亿！春运首日旅客再度猛降 重大损失,证券时报网
881,2021-01-29,【盈警】南方航空(01055-HK)料年度净亏损79.07亿到108.61亿元人民币 预亏,财华社
882,2021-01-29,南方航空(600029.SH)：2020年度由盈转亏预亏79.07亿元-108.61亿元 预亏,格隆汇
883,2021-01-29,南方航空：预计2020年度净利润亏损79.07亿元到108.61亿元 预亏,Wind
884,2021-01-29,A股收盘综述：上证指数创4个月来最大周跌幅,Wind
885,2021-01-29,免费研报精选：交运最难的时刻已过去！估值处于历史底部 优质标的全梳理,中金在线
886,2021-01-29,解盘：成交量低迷，航空、白酒、CRO、影视略涨,Wind
887,2021-01-29,【A股午盘综述】上证指数涨0.23%，创业板指涨0.51%.,Wind
888,2021-01-29,航空股午前拉升，华夏航空率先涨停,Wind
889,2021-01-29,机场、民航板块逆势走强，华夏航空大涨6%,Wind
890,2021-01-28,东方航空、南方航空等40多家国内航空公司春运机票退改政策出炉,河南商报
891,2021-01-26,民航局再对四入境航班发出熔断指令，涉及肯尼亚航空、南航等,Wind
892,2021-01-26,【行情】航空股持续走强，春秋航空涨停，华夏航空涨逾6%，南方航空涨近2%,金十数据
893,2021-01-26,机场航运板块逆势走强，机构建议民航股这么选丨牛熊眼,第一财经
894,2021-01-25,2020年境内航司总载客量下降35.1%，南航航班量第一 盈利能力下降,环球旅讯
895,2021-01-25,培训飞行员！东方时尚接1.9亿元大单要“上天”,华夏时报
896,2021-01-25,疫情下航司机场生存图鉴：2020年旅客流失超2亿人次 每架飞机平均少飞近40天,每日经济新闻
897,2021-01-24,关注快递春节需求，春运客流预期下调【安信交运丨周报0124】,明兴交运研究
898,2021-01-23,晋级双国际机场第三城，成都如何挖掘航空“发动机效应”？,澎湃新闻
899,2021-01-23,【民生周末重点推荐】首席看社服&交运：长期关注免税板块潜在投资机会，医美、化妆品行业乘风而上高速增长,MS研究
900,2021-01-22,航空行业月报：12月淡季疫情反复 防控升级或压制春运需求,新浪
901,2021-01-22,南方航空(01055.HK)：委任竞天公诚为公司在香港接受送达法律程序文件的授权代表,格隆汇
902,2021-01-22,天府，起飞！成都“双枢纽”模式如何实现1+1>2？,民航资源网
903,2021-01-22,飞行员培训订单达3.6亿元 东方时尚的通航梦起飞,北京商报
904,2021-01-21,A股共发生151宗大宗交易成交31.94亿元（1月21日）,Wind
905,2021-01-21,南方航空大宗交易成交518.25万股成交额2943.65万元,证券时报网
906,2021-01-21,"南方航空现1笔大宗交易 共成交2,943.65万元",新浪
907,2021-01-21,南方航空今日大宗交易成交518.25万股，成交价5.68元溢价0.0%,Wind
908,2021-01-20,中国短期融资券及中期票据信用分析周报,新浪
909,2021-01-20,债市风云|佳兆业拟增发3亿美元票据 南航取消超短期融资,中新经纬
910,2021-01-20,赣州机场将开通直飞北京大兴机场航线,民航资源网
911,2021-01-20,南方航空：取消发行“21南航股SCP001”,Wind
912,2021-01-19,【行情】美股航空股普涨，南方航空、东方航空涨超4%，美国航空集团涨2.8%，美国联合航空、西南航空涨近2%，消息称美国各航空公司将从财政部的工资支持项目中获得月30亿美元的补助,金十数据
913,2021-01-19,南方航空大宗交易成交530.00万股成交额3079.30万元,证券时报网
914,2021-01-19,"南方航空现1笔大宗交易 共成交3,079.30万元",新浪
915,2021-01-19,航空公司行业研究：淡季叠加局部疫情影响 12月航司客座率普降,新浪
916,2021-01-19,广东三年攻坚换来碧空蓝天,中国环境报
917,2021-01-18,交运物流行业每周专题报告：新冠疫情反复 快递、集运龙头逆向而行,新浪
918,2021-01-18,航空机场2020年12月数据点评：疫情波动加剧短期压制 继续推荐华夏航空,新浪
919,2021-01-18,交通运输：出口数据表现亮眼，推荐集运、跨境双主线，维持“强于大市”评级,天风证券
920,2021-01-18,十三年后重返首都机场T2 国航“一市两场三区”巩固北京枢纽地位,华夏时报
921,2021-01-18,航空12月数据点评：疫情反复拖累淡季需求恢复,新浪
922,2021-01-17,快递行业全年增速31%，民航力争2021年减亏增盈 【安信交运丨周报0117】,明兴交运研究
923,2021-01-16,【华创交运】航空行业12月数据点评：淡季客座率环比普降，春秋保持领先，持续强推核心标的春秋航空与华夏航空,华创交运与供应链研究
924,2021-01-16,疫情下A股掌舵者图鉴：591家上市公司换帅，董事长离职人次创5年新高 董监高成员变化,每日经济新闻
925,2021-01-15,晚间重要公告2021年1月15日星期五,Wind
926,2021-01-15,南方航空(01055-HK)2020年12月客运运力投入同比下降23.89%,财华社
927,2021-01-15,南方航空(01055.HK)将于3月30日举行董事会会议以审批年度业绩,格隆汇
928,2021-01-15,南方航空(01055.HK)12月旅客周转量同比下降34.10%,格隆汇
929,2021-01-15,南方航空：2020年12月集团国内客运运力投入同比上升9.54%,格隆汇
930,2021-01-14,"南方航空现1笔大宗交易 共成交3,031.60万元",新浪
931,2021-01-14,航空深度报告：从需求的底部逐渐复苏,新浪
932,2021-01-14,1月14日晚间重要行业研究汇总(附股),中金在线
933,2021-01-13,每日晨报-20210113,国元国际
934,2021-01-13,【即时点评】2021年全国民航工作报告重点总结回顾,国元国际
935,2021-01-12,"南方航空现2笔大宗交易 共成交6,084.40万元",新浪
936,2021-01-11,交通运输行业2021年度策略：拨云见日 布局龙头,新浪
937,2021-01-11,南方航空(01055-HK)：毛娟获选举为第九届监事会职工代表监事,财华社
938,2021-01-11,交通运输行业周报：2021年高铁浮动票价将推广 顺丰上海总部开工,新浪
939,2021-01-10,丰巢获4亿美元融资，国产疫苗接种有序推进 【安信交运丨周报0110】,明兴交运研究
940,2021-01-08,民航发展基金恢复征收的影响和展望,兴业证券
941,2021-01-08,12只个股大宗交易超5000万元,证券之星
942,2021-01-07,"南方航空现1笔大宗交易 共成交2,994.50万元",新浪
943,2021-01-07,摩通：上调内地航空及相关股目标价首选南航(1055.HK)等三股,格隆汇
944,2021-01-06,"南方航空现1笔大宗交易 共成交2,645.00万元",新浪
945,2021-01-04,交通运输行业：快递春节不打烊 疫苗有望加速航空客流恢复,新浪
946,2021-01-01,国产飞机市场化提速：ARJ21入列一二三航空，大飞机C919明年底运营,财经杂志
947,2020-12-30,第一上海丨【行业评论】航空客运行业：2021年行业盈利端恢复在即,第一上海金融
948,2020-12-30,三大航混改落地新格局形成 着眼未来发展如何走？,民航资源网
949,2020-12-30,拼多多上线南方航空机票官方直销 春运多地机票价格远低于火车票,中研网
950,2020-12-30,盘点多家航司“随心飞”，谁最有诚意？,环球旅讯
951,2020-12-30,航空机场行业2021年度策略：复苏在望 左侧布局,新浪
952,2020-12-30,大和下调南航东航评级，料今年客运收入降幅扩大 盈利能力下降,Wind
953,2020-12-30,拼多多彻底火了！一夜狂涨1800亿，黄峥财富“碾压”马化腾,中国基金报
954,2020-12-29,拼多多与南航开展直销合作，下沉市场的机票大战来了？,环球旅讯
955,2020-12-29,美股异动 | 拼多多(PDD.US)涨超6%，此前南方航空正式在拼多多上线机票官方直销业务,智通财经
956,2020-12-29,美国三大股指全线高开，阿里巴巴涨近4%,Wind
957,2020-12-29,美股盘前：三大期指普涨,Wind
958,2020-12-29,上拼多多买机票？南方航空先试水打通直营通道,DoNews
959,2020-12-29,南方航空联手拼多多 上线机票官方直销业务,金融界
960,2020-12-28,交通运输行业周报：圣诞旺季需求旺盛 供需矛盾抬涨运价,新浪
961,2020-12-28,【银河交运王靖添】行业点评丨南航物流混改落地，催化航空物流产业持续深化发展,新浪
962,2020-12-27,南航“最美机长”贺中平去世,北京青年报
963,2020-12-25,物流行业：南航物流混改落地 催化航空物流产业持续深化发展,新浪
964,2020-12-25,三大航货运混改均落定 各自“单飞”难“一统”,华夏时报
965,2020-12-25,央企航司混改跑步前进 三管齐下成为“标配”,证券时报
966,2020-12-24,半年亏损近20亿元，厦航如何自救？ 亏损,环球旅讯
967,2020-12-23,每日理财观察：证监会明确明年资本市场六项重点工作,Wind
968,2020-12-23,南航物流混改落地 航空货运竞争力待提升,中证报
969,2020-12-22,南航物流混改完成，普洛斯隐山资本、钟鼎资本等入股,企查查
970,2020-12-22,南方航空换帅：王昌顺退职董事长 原总经理马须伦接任 董监高成员变化,中国网
971,2020-12-22,南航物流混改落地 引入上海隐南等8家战略投资者,中证网
972,2020-12-22,南方航空(600029.SH)：南航物流增资33.55亿元，引入中外运等8家投资者,格隆汇
973,2020-12-22,南方航空：子公司南航物流引入33.55亿元增资,e公司
974,2020-12-22,南方航空：全资子公司南航物流增资扩股33.55亿元暨引进投资者,Wind
975,2020-12-21,南方航空：与厦门建发及福建投资向厦门航空增资40亿元,中证网
976,2020-12-21,南方航空(01055.HK)：与南航集团订立资产租赁框架协议,格隆汇
977,2020-12-21,南方航空(01055.HK)：厦门航空注册资本将增至140亿元,格隆汇
978,2020-12-21,南方航空(600029.SH)：选举马须伦为公司第八届董事会董事长,格隆汇
979,2020-12-21,南方航空(01055.HK)委任马须伦为董事长,格隆汇
980,2020-12-21,南方航空(01055.HK)拟修订公司章程,格隆汇
981,2020-12-21,晚间重要公告2020年12月21日星期一,Wind
982,2020-12-21,南方航空(01055.HK)订立新物业管理框架协议,格隆汇
983,2020-12-21,交通运输行业周报：冬春重点人群接种疫苗 通达整合处关键期,新浪
984,2020-12-21,交通运输行业：11月全货机货邮量增速21.2% 国际航空货运持续保持高景气度,新浪
985,2020-12-21,南方航空(600029.SH)拟向厦门航空增资22亿元,格隆汇
