1199,2020-08-13,券商调仓重点出炉：新进增持24只个股,Wind
1200,2020-08-12,北上资金8月增持榜：高盛14亿建仓科技龙头,证券时报网
1201,2020-08-12,研发投入劲增12倍 宝丰能源完善产业链立体化提升核心竞争力,证券日报
1202,2020-08-12,宝丰能源上半年营收75亿同比增长15% 经营现金流增长超6成,经济观察网
1203,2020-08-12,宝丰能源(600989)：业绩符合预期 产能扩张持续驱动增长,新浪
1204,2020-08-12,宝丰能源(600989)：盈利稳步增长 成长空间广阔,新浪
1205,2020-08-12,宝丰能源(600989)：疫情凸显竞争优势 烯烃巨头已起航,光大证券
1206,2020-08-12,宝丰能源项目投产助推业绩向好 上半年净利20.92亿同比增超10%,长江商报
1207,2020-08-11,宝丰能源：多渠道维护好投资者关系 以互动促互信,中证网
1208,2020-08-11,宝丰能源(600989)2020年中报点评：Q2净利率大幅回升 公司业绩再超预期,新浪
1209,2020-08-11,【方正化工】宝丰能源2020中报点评：业绩亮眼，一体化配套进一步提升成本优势,靠谱化工股
1210,2020-08-11,外资A股持仓更新，高盛、小摩、瑞银重仓名单抢先看,Wind
1211,2020-08-11,上半年盈利21亿，宝丰能源逆势扩产,第一财经
1212,2020-08-11,【面包财报】宝丰能源：2020年上半年归母净利润20.92亿元，同比增长10.75%,面包财经
1213,2020-08-11,【财报智读】宝丰能源：2020年上半年归母净利润20.92亿元，同比增长10.75%,面包财经
1214,2020-08-11,项目投产推升业绩 宝丰能源上半年营收75亿元同比增15%,中国网
1215,2020-08-11,宝丰能源（600989）2020年半年报业绩点评：盈利能力突出，业绩逆势增长,国信研究
1216,2020-08-11,宝丰能源太阳能电解制氢储能项目一期年底投运,北极星电力
1217,2020-08-11,宝丰能源2020年中报业绩交流,中信证券研究
1218,2020-08-11,【开源煤炭&石化-张绪成】宝丰能源中报点评：半年报业绩对冲疫情影响，成本优势&产能规模继续强化,能源观察站
1219,2020-08-10,宝丰能源公布半年报 上半年净利增加10.75%,新浪
1220,2020-08-10,打造循环经济产业链 宝丰能源上半年实现净利润21亿元,中证网
1221,2020-08-10,煤化工龙头宝丰能源上半年营收净利双增 转产口罩无纺布用聚丙烯产品获益,和讯
1222,2020-08-10,能源行业日报：环氧丙烷价格及价差扩大 关注生产企业,新浪
1223,2020-08-10,宝丰能源上半年营收增长15.35%,北京商报
1224,2020-08-10,宝丰能源上半年实现净利润21亿元 循环经济产业链进一步完善,证券时报
1225,2020-08-10,宝丰能源(600989.SH)：上半年净利升10.75%至20.92亿元,格隆汇
1226,2020-08-10,宝丰能源：上半年净利润同比增长10.75%,Wind
1227,2020-08-10,煤炭开采Ⅱ行业周报：焦炭近期偏强 动力煤和焦煤筑底,新浪
1228,2020-08-10,北上资金流出速度放缓重点加仓轻工制造业,证券时报
1229,2020-08-07,宝丰能源(600989)：无惧低油价逆势增长 甲醇煤炭投产成本优势再提升！,新浪
1230,2020-08-05,宝丰能源(600989)：煤制烯烃标杆 焦化值得看好,新浪
1231,2020-08-03,A股核心资产股价纷创新高背后：“内循环”经济下的估值重构,证券时报网
1232,2020-08-03,7月金股组合盈利13.53% 8月荐股名单出炉,新浪
1233,2020-07-31,A股“期中考”发榜 贵州茅台、宝丰能源等成绩亮眼 未来可期,红周刊
1234,2020-07-31,开源晨会0731丨开源金股，8月推荐；创业板注册制展望；金石资源、宝丰能源,开源证券研究所
1235,2020-07-30,【开源煤炭石化-张绪成】宝丰能源中报点评：半年报业绩同比大涨，成本优势强化&产能快速扩张,能源观察站
1236,2020-07-29,产销放量 宝丰能源上半年营收75.2亿增15.35%,证券时报网
1237,2020-07-29,宝丰能源（600989）2020年半年度业绩快报点评：上半年逆势增长，成本优势持续强化,国信研究
1238,2020-07-28,宝丰能源：上半年实现营收75.2亿元 同比增长15.35%,中证网
1239,2020-07-28,基础化工：油价上涨 丁二烯、MDI-50、R125、环氧树脂、软泡聚醚等产品价格上涨,新浪
1240,2020-07-28,宝丰能源(600989)：Q2环比大幅改善 重回增长轨道,新浪
1241,2020-07-28,宝丰能源：上半年实现净利20.9亿元 同比增长11%,我的钢铁
1242,2020-07-28,宝丰能源业绩快报：上半年净利润20.92亿元 同比增长11%,金融界
1243,2020-07-28,宝丰能源(600989.SH)业绩快报：上半年净利升10.75%至20.92亿元,格隆汇
1244,2020-07-28,宝丰能源：上半年净利润同比增长10.75%（业绩快报）,Wind
1245,2020-07-27,中证指数公司：8月6日发布中证兴业证券ESG盈利100指数,Wind
1246,2020-07-25,煤炭开采行业周报：看好经济复苏和行业变革 继续看多煤炭股-行业周报,新浪
1247,2020-07-24,宝丰能源(600989)：红四煤矿获采矿许可证 煤炭自给率提高巩固低成本优势,新浪
1248,2020-07-24,基础化工行业基建地产材料产业梳理：基建地产风来了 哪些化工品受益？,新浪
1249,2020-07-24,红四煤矿获采矿许可 宝丰能源俩月连发仨“大招”提质增效,红周刊
1250,2020-07-24,晨会0724 | 国内免税业市场争夺,中信建投证券研究
1251,2020-07-23,宝丰能源子公司红四煤业收到采矿许可证,资本邦
1252,2020-07-23,宝丰能源(600989)：红四煤矿取得采矿许可证 有望近期投产 进一步增加煤炭自给,新浪
1253,2020-07-23,基础化工行业周报：PPI从环比转正趋向同比转正 加配化工正当时,光大证券
1254,2020-07-23,银行系调研路径揭晓：医药、科技、消费和可转债,上证报
1255,2020-07-22,红四煤矿获采矿许可证 宝丰能源进一步提升原料自给率,上证报
1256,2020-07-22,宝丰能源产业链优化加速 红四煤矿获采矿许可证,中证网
1257,2020-07-21,宝丰能源(600989.SH)：全资子公司红四煤业取得采矿许可证,格隆汇
1258,2020-07-20,石油化工行业周报：IEA预测下半年需求好转 重点关注OPEC+减产规模调整,光大证券
1259,2020-07-16,券商首次关注8股并给予买入评级（7月16日）,Wind
1260,2020-07-15,化工龙头宝丰能源屡获推荐 股价大幅拉升创4个月新高,红周刊
1261,2020-07-15,【产业梳理|国信化工】基建地产风来了，哪些化工品受益？,化工之诚
1262,2020-07-14,A股早报2020年7月14日星期二,Wind
1263,2020-07-13,煤炭石化行业周报：油煤价格短期见顶 焦炭宜积极看待,新浪
1264,2020-07-09,[路演]宝丰能源：公司生产经营正常 主要生产装置保持高负荷稳定运行,全景网
1265,2020-07-08,5次“买入”3次“增持”评级 宝丰能源连获推荐 新启内蒙布局,红周刊
1266,2020-07-06,基础化工行业周报：关注低估值及较高成长性的二线蓝筹,光大证券
1267,2020-07-06,大宗商品行业周报：国内经济持续改善 大宗商品或延续涨势,新浪
1268,2020-07-06,内蒙古异地产能布局上线 宝丰能源全力开拓聚烯烃“顶配”市场,网易
1269,2020-07-06,宝丰能源瞄准高端化“新版图” 10亿元异地布局煤化工项目,证券日报
1270,2020-07-05,石化行业周报：油价及政策推动石化行业发展,新浪
1271,2020-07-04,煤炭开采行业周报：低估值+业绩改善 煤炭股底部配置正当时,新浪
1272,2020-07-03,一周通读：光大证券重点报告精选,光大证券
1273,2020-07-03,宝丰能源(600989)开启产业版图扩张计划复制宁东基地经验打开新一轮成长周期,格隆汇
1274,2020-07-03,宝丰能源拟9.5亿设立煤制烯烃子公司,中国煤炭资源网
1275,2020-07-03,新版图！首启异地产能扩张 宝丰能源拟设内蒙古子公司,凤凰网
1276,2020-07-03,宝丰能源9.5亿设子公司，继续押宝煤制烯烃,华夏能源网
1277,2020-07-02,能源行业日报：上周EIA原油库存减少719.50万桶,新浪
1278,2020-07-02,40股获机构买入型评级 宝通科技、宝丰能源关注度最高,证券时报网
1279,2020-07-02,以发展践行责任 煤化工龙头宝丰能源首启宁夏内蒙两地推进,中国经济网
1280,2020-07-02,10亿元内蒙古设立子公司，宝丰能源首次异地扩产,第一财经
1281,2020-07-02,宝丰能源(600989)：延伸煤化工循环产业链 布局内蒙基地成本或更具优势,新浪
1282,2020-07-02,宝丰能源(600989)动态点评：布局内蒙 有望复制宁东项目,新浪
1283,2020-07-02,宝丰能源拟10亿元设立内蒙古子公司 煤化工龙头优势倍增,中证网
1284,2020-07-02,宝丰能源：拟投10亿元在内蒙古成立子公司,新浪
1285,2020-07-01,延伸煤化工循环产业链 宝丰能源拟设内蒙古子公司,上证报
1286,2020-07-01,宝丰能源拟10亿元成立内蒙古子公司 延伸煤化工循环经济产业链,证券时报
1287,2020-07-01,宝丰能源(600989.SH)：拟在内蒙古设立子公司进一步延伸煤化工循环经济产业链,格隆汇
1288,2020-07-01,化工行业专题：盈利增速阶段性见底 估值有望修复,新浪
1289,2020-07-01,特斯拉大涨 再燃国内新能源概念 哪些公司又站风口,红周刊
1290,2020-06-23,中国天辰工程有限公司承接的宝丰能源全球单体最大甲醇装置成功投产,国家煤化工网
1291,2020-06-23,宝丰能源：以增长促就业 打造社会责任践行标杆,中新网
1292,2020-06-19,宝丰能源(600989)公司深度报告：行业对标构建低成本优势 二期烯烃甲醇完全自给降本再发力,新浪
1293,2020-06-11,宝丰能源募投项目全面投产 聚烯烃成本每吨下降过千元,21世纪经济报道
1294,2020-06-11,西部大开发政策推动煤制烯烃产业升级 宝丰能源低成本优势迎机遇,环球老虎财经
1295,2020-06-10,宝丰能源获“地方经济突出贡献企业”高质量发展践行责任使命,中新网
1296,2020-06-09,宝丰能源(600989)：60万吨MTO全线投产 公司业务体量再上新台阶,新浪
1297,2020-06-08,能源行业日报：油价大涨 估值修复机会显现,新浪
1298,2020-06-08,石油化工行业周报：历史性减产协议将延长到7月,光大证券
1299,2020-06-03,宝丰能源大手笔分红超20亿 10派3.2 世界级甲醇项目投产,格隆汇
1300,2020-06-03,小心，清仓减持又来了！注意，1天4家公司被举牌（附名单）,Wind
1301,2020-06-02,5月450亿减持创年度新高，科技医疗抛售居前,Wind
1302,2020-06-02,26股获券商买入评级，卓胜微目标涨幅达43.12%,Wind
1303,2020-06-02,上市公司正负面新闻2020年6月2日星期二,Wind
1304,2020-06-01,宝丰能源上市募投项目全面投产，原料甲醇将实现完全自给,澎湃新闻
1305,2020-06-01,宝丰能源：全球单体最大甲醇装置成功投产 募投项目如期兑现,发布易
1306,2020-06-01,6月1日晚间上市公司十大重磅公告,巨丰财经
1307,2020-06-01,宝丰能源：首发募投项目全面投产 实现高端产品进口替代,中证网
1308,2020-06-01,宝丰能源(600989.SH)：首发上市募投项目焦炭气化制60万吨/年烯烃项目全面投产,格隆汇
1309,2020-06-01,39股今日获机构买入评级 6股上涨空间超20%,证券时报网
1310,2020-06-01,全球首套年产220万吨戴维甲醇合成塔助力宝丰项目一次试车成功,东方锅炉
1311,2020-05-30,6月份A股或迎筑底反弹，逾四成采掘股获机构推荐,Wind
1312,2020-05-29,【重磅|深度，开源煤炭石化】宝丰能源：行业对标构建低成本优势，二期烯烃甲醇完全自给再降本,能源观察站
1313,2020-05-29,开源金股，6月推荐,开源证券研究所
1314,2020-05-29,宝丰能源：实施“10派3.2元”年度分红方案 合计现金分红20.53亿元,中证网
1315,2020-05-29,开源晨会0604丨风格切换隐藏于交易结构与投资者行为中；化妆品行业深度报告；万华化学、宝丰能源,开源证券研究所
1316,2020-05-28,宝丰能源(600989.SH)2019年度权益分派股权登记日为6月3日,格隆汇
1317,2020-05-25,石化行业周报：油价回升带动乙烯、丙烯价格上涨,新浪
1318,2020-05-22,"华西煤炭|动力煤上涨超预期,继续看好动力煤龙头神华陕煤",华西交运煤炭研究
1319,2020-05-21,年度减持1400亿科技股承压，将再迎解禁高峰,Wind
1320,2020-05-20,宝丰能源20.53亿分红将于6月7日前到位 分红季A股公司更偏好现金分红,经济观察网
1321,2020-05-19,宝丰能源控股股东兑现5亿增持 熔喷专用料产线成功投产,21世纪经济报道
1322,2020-05-19,金发科技、宝丰能源等发力保卫口罩“中国芯”,中新网
1323,2020-05-18,宝丰能源：5月兑现增持承诺 6月前完成分红,全景网
1324,2020-05-18,利好！宝丰能源：控股股东及其关联方增持计划完成 增持5亿元,每日经济新闻
1325,2020-05-18,宝丰能源(600989.SH)：控股股东及关联方增持完毕 累计增持5451.94万股,格隆汇
1326,2020-05-18,宝丰能源：在建熔喷专用料产线首批产品成功下线,证券时报网
1327,2020-05-17,警惕！网下打新收益率近500%，金山办公200多位股东下周解禁！一口罩概念股解禁超100亿元！ 解禁,每日经济新闻
1328,2020-05-17,周末要闻2020年5月17日星期日,Wind
1329,2020-05-17,下周操盘攻略：5月是今年二季度最好的投资窗口,Wind
1330,2020-05-17,太戏剧！巨额解禁前意外“闹乌龙”，蹭热点概念股暴涨！5股超一半市值即将流通 解禁,证券时报
1331,2020-05-16,宝丰能源：熔喷专用料产线5月底前投产,中证网
1332,2020-05-15,下周685亿市值限售股解禁，环比增加79.44% 解禁,Wind
1333,2020-05-15,下周解禁：四公司解禁数量超3亿股 解禁,大众证券报
1334,2020-05-15,宝丰能源：控股股东在增持过程中误卖出4.2万股，造成短线交易,Wind
1335,2020-05-14,宝丰能源：熔喷料专用产线开始安装调试 预计5月底投产,上证报
1336,2020-05-14,宝丰能源：熔喷料产线开始安装调试 预计2周后投产,中证网
1337,2020-05-13,【财报点评|国信化工】聚烯烃系列——宝丰能源(600989)-财报点评：Q1业绩增长阶段性放缓，煤制烯烃成本优势仍在 盈利能力下降,化工之诚
1338,2020-05-13,MSCI中国A股在岸指数成份股调整：老凤祥宝丰能源尔康制药等18只股票被剔除 剔除指数,和讯
1339,2020-05-13,基于原油市场供需层面的持续跟踪检验：当前原油市场的三个关键变量,光大证券
1340,2020-05-13,MSCI中国A股在岸指数增加成份股61只，剔除18只,Wind
1341,2020-04-30,【开源煤炭石化-张绪成】宝丰能源一季报点评：Q1业绩受油价大跌影响，新项目陆续投产成长可期 盈利能力下降,能源观察站
1342,2020-04-29,宝丰能源一季度营收36亿增长13% 转产熔喷布原料开建7条产线,长江商报
1343,2020-04-29,一季度化工行业下滑超3成宝丰能源(600989.SH)战“疫”增长13%超预期,格隆汇
1344,2020-04-29,宝丰能源一季度营收36亿 转产熔喷布原料开建7条产线,新浪
1345,2020-04-28,宝丰能源一季度收入超36亿同比增长13.01% 快速转产、增产口罩原料,21世纪经济报道
1346,2020-04-28,宝丰能源：一季度实现营收36.1亿元 同比增长13%,e公司
1347,2020-04-28,烯烃产能扩充 宝丰能源第一季度营收增长13.01%,金融界
1348,2020-04-28,宝丰能源发布一季报 营收超36亿元同比增长13.01%,中证网
1349,2020-04-28,疯狂的价格背后是疯狂的市场，聚丙烯或成新一轮口罩风口？,中国纺织报
1350,2020-04-27,宝丰能源2020年一季报：营业收入超36亿 同比增长13.01%,格隆汇
1351,2020-04-27,宝丰能源：一季度净利润同比减少19.46% 盈利能力下降,Wind
1352,2020-04-24,宝丰能源开建7条熔喷布原料产线,Wind
1353,2020-04-24,宝丰能源开建7条熔喷布原料产线 日产能80吨,e公司
1354,2020-04-23,宝丰能源多联产项目布局焦化行业清洁产能建设,中新网
1355,2020-04-21,国内最大一体化可再生能源制氢储能项目在宁夏开建,中国能源网china5e
1356,2020-04-21,我国最大一体化可再生能源制氢储能项目正式开工建设,集邦新能源网
1357,2020-04-21,宁东能源化工基地氢能产业首个项目开工,国资委
1358,2020-04-21,瞄准“终极能源”低碳市场 宝丰能源14亿元投建“绿氢”项目,证券日报
1359,2020-04-20,多项国际国内首创、宝丰能源高标准布局电解水制氢综合应用项目,红周刊
1360,2020-04-20,次新股业绩“变脸秀” 盈利能力下降,国际金融报
1361,2020-04-19,宝丰能源：太阳能电解水制氢项目预计今年底投产,e公司
1362,2020-04-19,宝丰能源：开建全球最大一体化太阳能电解水制氢项目,中证网
1363,2020-04-19,宝丰能源太阳能电解水制氢储能及应用示范项目开工建设,中证网
1364,2020-04-16,次新股成绩秀：18只股票符合巴菲特选股标准！值得抄底？看完文章再决定,腾讯网
1365,2020-04-15,聚烯烃S2040价格暴涨4成 宝丰能源等增产急补需求缺口,红周刊
1366,2020-04-14,口罩原料聚丙烯S2040价格暴涨 宝丰能源等多企业全力保供应,中证网
1367,2020-04-12,5月是原油市场的双重拐点 ——OPEC+减产协议及G20能源部长会议的影响分析,化海锋云
1368,2020-04-10,聚丙烯价格大涨 OPEC史上第一大减产协议出炉 利好宝丰能源等,红周刊
1369,2020-04-09,国内最大空分装置在宝丰能源试车成功,中证网
1370,2020-04-08,油价暴力反弹，华鲁恒升、宝丰能源等煤化工龙头机会来临,全景网
1371,2020-04-02,宝丰能源：建设投资成本节约30％以上 运营成本比同行低约35％,金融界
1372,2020-04-01,宝丰能源俩项目双问鼎：焦炭规模及EVA产量均第一 机构推荐买入,中国网
1373,2020-03-27,A股早报2020年3月27日星期五,Wind
1374,2020-03-26,宝丰能源：首批一次性防护口罩成功下线,证券日报
1375,2020-03-26,宝丰能源：近期获68家机构密集调研,中证网
1376,2020-03-26,[互动]宝丰能源：口罩原料S2040牌号聚丙烯产品已经满产满销,全景网
1377,2020-03-26,超200家公司披露分配方案 还有哪些公司具备分红潜力？,投资快报
1378,2020-03-24,宝丰能源：首批口罩产品下线 将尽快投放市场,e公司
1379,2020-03-24,宝丰能源口罩火速下线 跑步供给复产防疫黄金期,中证网
1380,2020-03-19,宝丰能源（600989）2019年年报点评：全年业绩逆势增长，看好龙头成长空间,CITICS化工研究
1381,2020-03-19,国内财经媒体头版2020年3月19日星期四,Wind
1382,2020-03-17,【化工-张汪强】宝丰能源：业绩符合预期，新产能布局构建长期成长链,安信证券研究
1383,2020-03-17,宝丰能源募投项目相继投产 “护航”产能翻番公司拟10股派3.2元（含税），分红总额约20.53亿元,证券日报
1384,2020-03-16,【开源煤炭-张绪成】宝丰能源年报点评：2019年业绩稳健增长，新项目陆续投产成长空间大,能源观察站
1385,2020-03-16,宝丰能源2019年净利38亿元，同比增长2.88%,澎湃新闻
1386,2020-03-16,鹰眼预警:宝丰能源资产收入产出值持续降 在建转固慢 盈利能力下降,新浪
1387,2020-03-16,新能源新材料公司业绩参差不齐：某创投机构暂缓对行业多家企业投决,21世纪经济报道
1388,2020-03-16,宝丰能源：公司医用口罩及防护服项目2月22日开工 总投资额为1100万元,e公司
1389,2020-03-16,宝丰能源：紧急转产生产高熔指纤维料S2040 可用于生产医用无纺布,e公司
1390,2020-03-16,宝丰能源：公路免征通行费政策将显著降低公司疫情期间的运输成本,e公司
1391,2020-03-16,宝丰能源：公司正在规划建设三期烯烃项目,e公司
1392,2020-03-16,宝丰能源：烯烃产品价格呈现波动下滑 专家预测相关产品价格已基本处于周期低点,e公司
1393,2020-03-16,宝丰能源：公司二期烯烃项目将实现全年满产,e公司
1394,2020-03-16,烯烃二期项目投入生产，宝丰能源2019年盈利同比增2.88%至38.02亿元,资本邦
1395,2020-03-16,宝丰能源(600989.SH)：2019年净利升2.88%至38.02亿元 拟10派3.2091元,格隆汇
1396,2020-03-16,宝丰能源（600989）2019年财报点评：成本优势明显，新项目开启新一轮成长周期,国信研究
1397,2020-03-15,宝丰能源去年净利润38亿 疫情下转产医用口罩生产原料,每日经济新闻
1398,2020-03-15,增产降本 宝丰能源2019年盈利38亿元,上证报
1399,2020-03-15,宝丰能源：2019年实现净利38亿元,中证网
1400,2020-03-15,宝丰能源：2019年年度主要财务指标,上交所
1401,2020-03-15,宝丰能源首份年报：产能翻番，成本优势应对油价危机,第一财经
1402,2020-03-15,宝丰能源：2019实现净利润38亿元 拟10派3.2元,e公司
1403,2020-03-15,宝丰能源2019利润38亿 继续高分红 2020年产能翻番,红周刊
1404,2020-03-15,宝丰能源：2019年净利润同比增长2.88%,Wind
1405,2020-03-15,宝丰能源(600989.SH)拟向宁夏燕宝慈善基金会捐赠3亿元,格隆汇
1406,2020-03-13,聚烯烃产业链获关注 宝丰能源综合优势显著,金融界
1407,2020-03-13,能源股下跌 宝丰能源等聚烯烃产业链获关注,中证网
1408,2020-03-12,湖北襄阳“点对点”运送117名技术人员到宁夏,中新网
1409,2020-03-12,宁夏发布重点排污单位名录 305家企业列入重点监管范围,科技日报
1410,2020-03-11,杭汽轮：国之重器如何炼成,浙商网
1411,2020-03-09,中国天辰工程有限公司宝丰能源项目空分装置汽轮机一次冲转成功,国家煤化工网
1412,2020-03-06,新华500指数6日收跌1.52% 报4420.98点,新华网
1413,2020-03-06,新华500指数（989001）6日收跌1.49%,新华网
1414,2020-03-05,宝丰能源再添新亮点：中旬口罩产品下线 积极拓展销售渠道,红周刊
1415,2020-03-04,宝丰能源传利好入选全国抗击疫情重点保障企业,证券日报
1416,2020-03-03,转产稳产！煤化工龙头宝丰能源纳入“全国疫情防控重点保障企业”名单,全景网
1417,2020-03-03,中国化学工程宁夏宝丰项目空分装置2号汽轮机试车一次成功,国资委
1418,2020-03-03,我国口罩日产能产量均突破1亿只 口罩生产概念股持续走俏,新京报
1419,2020-02-26,化工产业链梳理专题报告：化繁为简，看懂化工产业链,国信研究
1420,2020-02-25,油服板块复苏 海油发展迎来发展提速期,财经网
1421,2020-02-23,宝丰能源医用口罩和防护服生产项目正式开工建设,全景网
1422,2020-02-22,宁夏14家上市公司复工率达93%,中新网
1423,2020-02-22,发布会回放丨宁夏密集出台金融举措，支持企业复工复产！,搜狐
1424,2020-02-21,宁夏首批1080吨口罩原料铁路集结 驰援全国医用防疫物资生产,中新网
1425,2020-02-21,机构推荐采掘行业名列其中 后市或迎补涨期,证券日报
1426,2020-02-21,宝丰能源首批千吨口罩原料起运发货,红周刊
1427,2020-02-21,宝丰能源（600989）快评：积极转产口罩材料助力抗“疫”,国信研究
1428,2020-02-20,宁夏宝丰投资137.7亿元煤制烯烃项目核准,煤炭网
1429,2020-02-20,22家公司重要股东开启增持模式累计增持8.83亿元,证券时报网
1430,2020-02-19,【国盛策略】偏股基金募集火爆，未来还有多少增量？,尧望后势
1431,2020-02-19,受益高速免费政策 宝丰能源预计物流成本将显著下降,中证网
1432,2020-02-19,【公司快评I国信化工】宝丰能源（600989）：积极转产口罩材料助力抗“疫”,化工之诚
1433,2020-02-19,高速免费 物流成本大降 宝丰能源再获千万级别利好,全景网
1434,2020-02-19,【粤开策略流动性专栏】北上资金流向梳理（附净买入前十个股）,微信
1435,2020-02-19,18家公司重要股东开启增持模式累计增持7.60亿元（附股）,证券时报网
1436,2020-02-18,宝丰能源：公路免征通行费政策将大幅降低公司物流运输成本,证券时报
1437,2020-02-18,8股获买入评级 最新:宝丰能源,中财网
1438,2020-02-17,2020年中国物流行业市场现状及发展趋势分析 利好政策保障加速企业复工复产,前瞻研究院
1439,2020-02-17,口罩供应瓶颈：工人未返工，运输严重受限,Wind
1440,2020-02-17,物流企业迎政策利好 复工复产加速,中证报
1441,2020-02-16,口罩供应瓶颈： 工人未返工，运输严重受限,第一财经
1442,2020-02-16,宝丰能源首批口罩原材料成功出货 与多家医用无纺布企业对接,中证网
1443,2020-02-14,宁夏上市公司捐款超3700万元,中证网
1444,2020-02-14,宝丰能源(600989.SH)：边海燕累计增持1160.9万股,格隆汇
1445,2020-02-13,宁夏宝丰集团：始终冲在援鄂抗疫“最前沿”,中国经济网
1446,2020-02-12,【华创化工】化工行业“战疫”系列报告之复工情况：边“战疫”，边复工，行业秩序将逐步恢复,华创化工
1447,2020-02-11,除了比亚迪，又有格力地产等20家上市公司跨界加入口罩生产军团,21世纪经济报道
1448,2020-02-11,宝丰能源拟调整部分产线用于医用口罩原料生产，支持疫情防控,澎湃新闻
1449,2020-02-11,宝丰能源：决定将部分生产线转产，生产可用于医用无纺布制造的高熔指纤维聚丙烯,证券时报网
1450,2020-02-11,新华500指数开盘报4180.58点 涨0.26%,新华网
