943,2021-01-18,宝丰能源：公司建设的一体化太阳能电解水制氢项目是目前国内最大的一体化可再生能源制氢储能项目,北极星电力
944,2021-01-18,宝丰能源：宁东三期项目预计2022年底投产,Wind
945,2021-01-18,化工行业周报：维生素、橡胶等涨势明显 关注细分领域业绩表现,新浪
946,2021-01-17,煤炭周观点【国君煤炭翟堃】供需错配难改，煤价再超预期,煤市乾坤
947,2021-01-15,煤价涨势超出市场预期，煤炭股龙头有望继续反弹,第一财经
948,2021-01-14,化工行业周观点：油价再破前高 化工品持续复苏,中国能源网china5e
949,2021-01-13,【研报掘金】当前正处在煤炭经济新一轮周期上行早期 板块配置正当时,证券时报网
950,2021-01-12,周期股的阿尔法与贝塔：全球供需两振 中国制造优势,新浪
951,2021-01-11,2021年1月第1周煤炭行业周报：焦炭十二轮提涨100元／吨 动煤焦煤双双继续强势上涨,新浪
952,2021-01-08,"宝丰能源现1笔大宗交易 共成交8,672.68万元",新浪
953,2021-01-08,宝丰能源今日大宗交易成交644.33万股，成交价13.46元折价1.03%,Wind
954,2021-01-08,12只个股大宗交易超5000万元,证券之星
955,2021-01-07,"宝丰能源现1笔大宗交易 共成交9,267.36万元",新浪
956,2021-01-07,宝丰能源现4笔大宗交易合计成交1037.00万股,证券时报网
957,2021-01-07,【研报掘金】油价处于持续回升周期中 积极布局油价回升及需求复苏受益板块,证券时报网
958,2021-01-07,【银河周知】顺应新趋势，基于短期机遇和中长期趋势，推荐月度金股,中国银河证券研究
959,2021-01-07,A股早报2021年1月7日星期四,Wind
960,2021-01-06,A股共发生108宗大宗交易成交19.95亿元（1月6日）,Wind
961,2021-01-06,"宝丰能源现4笔大宗交易 共成交13,314.59万元",新浪
962,2021-01-06,油气开采板块走强，油价进入持续回升周期，布局三条主线,第一财经
963,2021-01-06,A股早报2021年1月6日星期三,Wind
964,2021-01-05,"宝丰能源现22笔大宗交易 共成交24,175.69万元",新浪
965,2021-01-05,2021年1月份上海证券研究所投资组合报告,新浪
966,2021-01-05,安信研究|晨会在线20210105,安信证券研究
967,2021-01-05,【化工-张汪强】需求复苏和补库共振，化工行业景气可期,安信证券研究
968,2021-01-04,"宝丰能源现1笔大宗交易 共成交5,960.00万元",新浪
969,2021-01-04,开源证券：12月金股组合亏损2.16% 1月荐股名单出炉 亏损,新浪
970,2021-01-04,石油化工行业周报：2020年石油化工重点回顾与2021年趋势展望,新浪
971,2021-01-04,10个涨停起？超低价+超高中签率！这只新股亮点多,证券时报网
972,2020-12-31,"宝丰能源现3笔大宗交易 共成交3,000.80万元",新浪
973,2020-12-31,投资策略专题：开源金股 1月推荐,新浪
974,2020-12-31,中信建投大周期团队最新研究观点,中信建投证券研究
975,2020-12-30,预计2021年油价中枢向上,天然橡胶网
976,2020-12-29,石化行业：油价2021年有望中枢上行 预计行业周期业绩改善,新浪
977,2020-12-29,"宝丰能源现2笔大宗交易 共成交3,649.80万元",新浪
978,2020-12-29,做对社会有价值的企业 宝丰能源荣获2020年“金质量·社会责任奖”,上证报
979,2020-12-29,银河证券每日晨报,新浪
980,2020-12-29,中信建投：化工短期进入淡季，布局明年回调正是买入时,Wind
981,2020-12-28,化工行业动态：化工短期进入淡季 布局明年回调正是买入时,新浪
982,2020-12-28,"宝丰能源现9笔大宗交易 共成交12,287.22万元",新浪
983,2020-12-28,石油化工行业周报：涤纶长丝有望长期好转 大炼化比较优势明显与估值溢价空间提升,新浪
984,2020-12-28,煤炭化工行业周报：宜重视顺周期 继续强推涤纶复苏机遇,新浪
985,2020-12-28,煤炭行业周报：寒潮降至 煤炭需求进一步提升,新浪
986,2020-12-28,化工行业周报-全产业链价格价差研究：制冷剂、焦炭等涨势较好 关注细分龙头业绩表现,新浪
987,2020-12-28,A股早报2020年12月28日星期一,Wind
988,2020-12-26,【民生周末重点推荐】首席看石化：关注油价上涨带来的油服、烯烃及长丝投资机会,MS研究
989,2020-12-25,"宝丰能源现24笔大宗交易 共成交27,880.24万元",新浪
990,2020-12-25,A股早报2020年12月25日星期五,Wind
991,2020-12-24,"宝丰能源现21笔大宗交易 共成交40,659.38万元",新浪
992,2020-12-24,中信建投大周期团队最新研究观点,中信建投证券研究
993,2020-12-23,【研报掘金】需求复苏驱动价格盈利向好 看好化工顺周期龙头及优质成长股,证券时报网
994,2020-12-23,宝丰能源：原料煤涨价对公司影响不大 产品涨价比成本涨价更多,e公司
995,2020-12-23,A股早报2020年12月23日星期三,Wind
996,2020-12-22,煤炭周观点：【国君煤炭翟堃】寒潮降至，煤炭需求进一步提升,煤市乾坤
997,2020-12-22,原油周报第179期：IEA再次下调原油需求预期 关注美国财政刺激计划,光大证券
998,2020-12-22,化工行业2021年度投资策略报告：疫情后时代 掘金“双循环”,新浪
999,2020-12-22,中泰证券：双循环是未来中国经济也是中国化工的重要发展方向（附股）,证券时报网
1000,2020-12-21,"宝丰能源现7笔大宗交易 共成交9,408.96万元",新浪
1001,2020-12-21,化工行业动态：原油、煤炭、天然气三大能源齐飙涨 夯实行业景气持续的判断,新浪
1002,2020-12-21,A股早报2020年12月21日星期一,Wind
1003,2020-12-21,煤炭化工行业周报：继续强推涤纶复苏机遇 煤炭股估值有望持续向上,新浪
1004,2020-12-20,煤炭行业：宏观方向定调 煤炭板块望持续强势,新浪
1005,2020-12-18,"宝丰能源现4笔大宗交易 共成交27,880.71万元",新浪
1006,2020-12-18,【方正化工】化工周报：涤纶长丝、PTA持续涨价，玲珑轮胎董事长获安永企业家奖,靠谱化工股
1007,2020-12-17,"宝丰能源现19笔大宗交易 共成交20,868.78万元",新浪
1008,2020-12-17,行业供给偏紧格局较难改，煤炭板块午后走高丨牛熊眼,第一财经
1009,2020-12-15,宝丰能源现4笔大宗交易均为折价成交,证券时报网
1010,2020-12-15,"宝丰能源现4笔大宗交易 共成交29,255.15万元",新浪
1011,2020-12-14,化工行业周报：醋酸、PVC价格持续上涨 继续推荐顺周期龙头标的,新浪
1012,2020-12-14,煤炭行业：调控预期初显 供需格局难变,新浪
1013,2020-12-14,总投资674亿元 400万吨煤化工项目三大主装置工艺盘点,国家煤化工网
1014,2020-12-14,【银河新年之声】周期股的成长之美,中国银河证券研究
1015,2020-12-14,2021年投资策略：关注油价上涨带来的油服、烯烃及长丝投资机会,新浪
1016,2020-12-14,煤炭化工行业周报：强推涤纶景气度回升机遇 煤价待政策压制,新浪
1017,2020-12-14,煤炭行业周报：煤价持续上涨 超额收益持续,新浪
1018,2020-12-11,港股收评：恒指涨0.36%石油股大幅反弹光伏板块持续活跃,格隆汇
1019,2020-12-11,【研报掘金】煤炭行业景气度稳中向好 板块具备较大的估值修复空间,证券时报网
1020,2020-12-11,宝丰能源：公司未来将形成620万吨/年聚烯烃的产能,格隆汇
1021,2020-12-11,煤炭行业年度策略报告：量价温和上涨 业绩逐季改善,新浪
1022,2020-12-11,晨会1211｜外资加配香港本地股,中信证券研究
1023,2020-12-10,宝丰能源(600989.SH)拟向汇丰祥光伏购电 金额不超6000万元/年,智通财经
1024,2020-12-10,晚间重要公告2020年12月10日星期四,Wind
1025,2020-12-10,宝丰能源拟超3亿元转让光伏发电项目资产及相关债权债务,上证报
1026,2020-12-10,犀牛财经晚报：天齐锂业跌停 每日优鲜筹资3.05亿美元,GPLP犀牛财经
1027,2020-12-10,宝丰能源(600989.SH)拟出售光伏发电项目以聚焦主业 资产异常,智通财经
1028,2020-12-10,"宝丰能源现3笔大宗交易 共成交20,982.00万元",新浪
1029,2020-12-10,宝丰能源：拟出售宁东90MWp分布式光伏发电项目,e公司
1030,2020-12-10,宝丰能源：拟将宁东90MWp分布式光伏发电项目出售给汇丰祥光伏,Wind
1031,2020-12-08,宝丰能源发生2笔大宗交易合计成交2.08亿元,证券时报网
1032,2020-12-08,基础化工行业12月投资策略：行业景气上行 看好化工迎来“大”时代 维持“超配”评级,格隆汇
1033,2020-12-08,石化行业2021年度投资策略：油价复苏主旋律 石化掘金正当时,新浪
1034,2020-12-07,原油周报第177期：OPEC+就明年年初生产计划达成一致,光大证券
1035,2020-12-07,"宝丰能源现9笔大宗交易 共成交11,650.00万元",新浪
1036,2020-12-07,煤炭行业周报：本周CCI停更重庆矿难 基本面支撑现货煤价继续上涨,新浪
1037,2020-12-07,石油化工行业周报：烯烃价格维持强势 解读炼油加工对于石化的影响,新浪
1038,2020-12-06,石油石化、基础化工、新材料行业北上资金流向周报,新浪
1039,2020-12-05,【煤炭】宝丰能源（600989）首次覆盖：全产业链布局煤制烯烃行业，看好焦化板块业绩提升,天风研究
1040,2020-12-03,2020年11月行业利差跟踪：国企超预期违约后行业利差普遍走扩 违约失信,新浪
1041,2020-12-02,“申万宏源十大金股组合”,申万宏源
1042,2020-12-01,煤炭行业2021年度策略——需求回升时代，产能扩张为王【国君煤炭翟堃】,煤市乾坤
1043,2020-12-01,原油周报第176期：OPEC＋预期推迟增产计划,光大证券
1044,2020-12-01,煤炭化工行业周报：原料价格延续强势 产品价格上涨趋势弱化,新浪
1045,2020-11-30,化工行业：周期景气仍在延续 原油、有机硅、钛白粉、醋酸继续冲高,新浪
1046,2020-11-30,2020年11月第4周煤炭行业周报：动力煤焦煤继续强势上涨 持续看好煤炭板块估值修复,新浪
1047,2020-11-30,化工行业周观点：化工品价格普涨 顺周期持续性可期,新浪
1048,2020-11-30,聚丙烯价格持续上涨 宝丰能源迎来“超长待机”旺季利好,证券日报网
1049,2020-11-30,煤价超预期上涨 机构看好煤炭板块估值修复行情丨牛熊眼,第一财经
1050,2020-11-29,煤炭开采行业周报：供暖季动力煤价维持高位 继续看好煤炭股顺周期行情,新浪
1051,2020-11-27,2021年基础化工行业年度投资策略：继续拥抱顺周期 布局优质赛道龙头,新浪
1052,2020-11-25,多重利好叠加 油价长期持续回升... 券商这样看,第一财经
1053,2020-11-25,石油股大涨 中曼石油涨停 石化油服、洲际油气、准油股份等多股跟张,金融界
1054,2020-11-25,石油石化行业国际油价点评：积极布局油价中长期持续回升周期,新浪
1055,2020-11-24,采掘行业周报：原料价格高位运行 供需错配为产品涨价主因,新浪
1056,2020-11-23,化工行业：补库存周期＋需求旺季 产品价格普涨 顺周期继续高仓位配置,新浪
1057,2020-11-23,煤炭行业周报：冷空气+北港低库存 煤价上行趋势不变 进口为变量,新浪
1058,2020-11-23,基础化工行业周报：从MTO的技术迭代看新型煤化工的进化,光大证券
1059,2020-11-23,化工行业周报：加大顺周期资产配置 首推化工核心资产,新浪
1060,2020-11-23,中信证券：顺周期板块持续爆发 关注化工行业两条配置主线,金融界
1061,2020-11-23,化工｜顺周期板块持续爆发，化工行业配置什么？,中信证券研究
1062,2020-11-22,【行业快评|国信化工】需求共振，行业迎来景气上行周期,化工之诚
1063,2020-11-20,煤炭化工行业2021年度投资策略：面向景气度 着眼低估值,新浪
1064,2020-11-20,【开源煤炭&石化-张绪成】宝丰能源公司点评：产品价格大涨推升业绩，看好公司价值和成长空间,能源观察站
1065,2020-11-20,券商首次关注1股并给予买入评级（11月20日）,Wind
1066,2020-11-20,26股获券商买入评级，拓邦股份目标涨幅达68.77%,Wind
1067,2020-11-19,"宝丰能源现6笔大宗交易 共成交4,800.93万元",新浪
1068,2020-11-19,34股今日获机构买入评级6股上涨空间超20%,证券时报网
1069,2020-11-19,礼包｜中信建投证券三季报解读系列之二,中信建投证券研究
1070,2020-11-18,宝丰能源(600989)：成长潜力巨大的煤制烯烃龙头！,新浪
1071,2020-11-18,景气上行，量价齐升，化工行业迎高光时刻,Wind
1072,2020-11-18,行业迎景气上行周期，化工板块走势活跃，金浦钛业六连板,证券时报网
1073,2020-11-17,宝丰能源现23笔大宗交易均为折价成交,证券时报网
1074,2020-11-17,"宝丰能源现23笔大宗交易 共成交21,294.00万元",新浪
1075,2020-11-17,宝丰能源(600989)：内蒙项目快速推进 增长预期逐步落地,新浪
1076,2020-11-17,2021年石油化工行业投资策略：守正不移：油价或震荡上行 把握石化龙头竞争力,新浪
1077,2020-11-17,化工行业动态点评：需求共振，行业迎来景气上行周期,国信研究
1078,2020-11-16,"宝丰能源现9笔大宗交易 共成交7,255.54万元",新浪
1079,2020-11-13,化工行业策略报告：探寻高成长标的，优质细分龙头业绩可期,新浪
1080,2020-11-13,"宝丰能源现19笔大宗交易 共成交14,144.11万元",新浪
1081,2020-11-13,A股早报2020年11月13日星期五,Wind
1082,2020-11-12,"宝丰能源现29笔大宗交易 共成交30,765.63万元",新浪
1083,2020-11-12,A股早报2020年11月12日星期四,Wind
1084,2020-11-11,"宝丰能源现31笔大宗交易 共成交35,763.69万元",新浪
1085,2020-11-11,化工行业：Q3内外需驱动景气回升明显 产品涨价与业绩回升共舞,新浪
1086,2020-11-11,基础化工行业-海外需求复苏 库存回补 叠加油价上行 全面看多化工,新浪
1087,2020-11-10,化工行业周报：抓住这波被动去库+价差提升的机会,新浪
1088,2020-11-10,石油化工行业周报：以PTA为例 验证行业龙头集中与成本曲线陡峭化,新浪
1089,2020-11-09,基础化工行业周报：油价上涨 环氧树脂、顺酐 己二酸、有机硅DMC、双酚A等产品价格上涨,新浪
1090,2020-11-06,开源晨会1105丨中小创、煤炭行业2020年三季报综述；10月百强销售增速高位回落，建议四季度关注地产 盈利能力下降,开源证券研究所
1091,2020-11-05,"宝丰能源现12笔大宗交易 共成交23,513.85万元",新浪
1092,2020-11-04,"宝丰能源现21笔大宗交易 共成交25,885.64万元",新浪
1093,2020-11-02,【三季度总结|国君煤炭翟堃】盈利持续改善，现金优势加速显现,煤市乾坤
1094,2020-11-02,石油化工行业周报：原油基本面有所承压 天然气需求向好&长丝价差维持高位,新浪
1095,2020-10-30,宁夏宝丰能源集团：“三不减”保障生产稳就业,光明日报
1096,2020-10-29,【东吴化工】宝丰能源三季报点评：烯烃装置放量，以量补价实现逆势增长,东吴石化化工
1097,2020-10-28,宝丰能源一体化优势明显 煤化工龙头进入新一轮成长周期,证券日报网
1098,2020-10-28,宝丰能源(600809)2020年三季报点评：盈利能力维持强劲 资本开支持续推进,光大证券
1099,2020-10-28,【财报点评|国信化工】宝丰能源(600989)：成本优势继续强化，新一轮成长开始启航,化工之诚
1100,2020-10-28,A股早报2020年10月28日星期三,Wind
1101,2020-10-28,207股获券商买入评级，中国中铁目标涨幅达81.01%,Wind
1102,2020-10-27,"宝丰能源现10笔大宗交易 共成交29,760.00万元",新浪
1103,2020-10-27,【开源煤炭&石化-张绪成】宝丰能源三季报点评：扣非业绩优异，产能扩张&成本优势打造煤制烯烃龙头,能源观察站
1104,2020-10-27,宝丰能源(600989)：盈利平稳增长 顺周期弹性标的 未来成长空间广阔,新浪
1105,2020-10-26,宝丰能源(600989)：产品售价环比回升，业绩稳步增长【国君煤炭翟堃】,煤市乾坤
1106,2020-10-26,"宝丰能源现11笔大宗交易 共成交7,066.24万元",新浪
1107,2020-10-26,【华安化工 | 三季报点评】宝丰能源：三季度延续增长势头，新项目建设奠定发展基础,化工阿尔法
1108,2020-10-26,宝丰能源(600989)2020年三季报点评：三季度检修销量环比略降 产品涨价推升毛利 盈利能力下降,新浪
1109,2020-10-26,基础化工行业周报：油价下跌 双氧水、纯MDI、硝酸铵、丁苯橡胶、PS等产品价格上涨,新浪
1110,2020-10-26,宝丰能源(600989)：油价新常态下盈利能力稳健 产销两旺新项目促高速发展！,新浪
1111,2020-10-26,宝丰能源三季报出炉：或将迎来新一轮高速发展期,21世纪经济报道
1112,2020-10-25,产销两旺 宝丰能源前三季度净利润增长11.27%,上证报
1113,2020-10-25,宝丰能源：前三季度营业收入112.99亿元 同比增长15.93%,中证网
1114,2020-10-25,宝丰能源三季报：营收113亿净利润31.5亿股权结构进一步优化,格隆汇
1115,2020-10-25,宝丰能源(600989.SH)前三季度扣非净利润升19.74%至33.2亿元,格隆汇
1116,2020-10-25,宝丰能源前三季度实现净利润31.5亿元 社保基金等机构投资者上榜前十大流通股东,证券时报
1117,2020-10-25,宝丰能源：前三季度净利润同比增长11.27%,Wind
1118,2020-10-25,【方正化工】宝丰能源2020三季报点评：220万吨甲醇投产，成本优势凸显,靠谱化工股
1119,2020-10-23,宝丰能源：暂未考虑收购实控人旗下光伏资产,Wind
1120,2020-10-23,券商首次关注5股并给予买入评级（10月23日）,Wind
1121,2020-10-23,宝丰能源(600989)：产能持续扩张 煤化工成本降低带动行业竞争力提升,新浪
1122,2020-10-19,宝丰能源六工程同期推进获500亿授信 降低进口依赖度投673亿首次异地扩产,长江商报
1123,2020-10-18,化工行业周报：海外订单回流带动纺织行业景气回升 继续推荐细分行业龙头和高成长标的,新浪
1124,2020-10-15,宁夏巧用“加减法” 让发展更“氢”洁,中国能源网china5e
1125,2020-10-14,工商银行内蒙古分行与宝丰能源达成300亿元全面战略合作,中证网
1126,2020-10-14,宝丰能源与工行内蒙古分行签署300亿元战略合作协议,上证报
1127,2020-10-14,宝丰能源与工商银行300亿元战略合作，首次异地扩产,Wind
1128,2020-10-14,宝丰能源：9月份公司主要产品聚烯烃、焦炭产品价格均有不同幅度的上涨,格隆汇
1129,2020-10-14,A股早报2020年10月14日星期三,Wind
1130,2020-10-12,盛视早参：众多利好释放 A股顺势而为,新浪
1131,2020-10-12,煤炭开采板块二波上攻,Wind
1132,2020-10-11,煤炭周观点：冷冬来袭、进口限制，煤炭板块超额收益可持续【国君煤炭翟堃】,煤市乾坤
1133,2020-10-11,下周操盘攻略：苹果将举行新品发布会，A股三季报披露开启,Wind
1134,2020-10-10,宝丰能源荣获煤制烯烃生产企业能效“领跑者”标杆企业,中证网
1135,2020-10-10,下周655亿市值限售股解禁 解禁,Wind
1136,2020-10-09,下周解禁：彩虹股份定增股东目前仍“被套” 解禁,大众证券报
1137,2020-10-09,开源证券：9月金股组合亏损5.2% 10月荐股名单出炉 亏损,新浪
1138,2020-10-09,10月超2200亿市值限售股上市 这家破发的农商行解禁规模居首 连续下跌,中投网
1139,2020-10-09,宝丰能源：公司烯烃三期聚乙烯装置将采用巴塞尔高压环管工艺,Wind
1140,2020-10-09,宝丰能源：上半年煤制烯烃生产成本比2019年有进一步降低,Wind
1141,2020-10-09,石化行业2020年三季报前瞻：曙光乍现 黎明已至,新浪
1142,2020-09-30,宝丰能源：目前公司内蒙项目进展顺利,Wind
1143,2020-09-29,关于召开2020中国煤化工技术交流会暨第九届中国煤化工年会的通知,国家煤化工网
1144,2020-09-29,银河证券：给予化工行业“推荐”评级 优质细分龙头业绩可期,第一财经
1145,2020-09-29,开源金股，10月推荐,开源证券研究所
1146,2020-09-28,宝丰能源：“鄂尔多斯项目”煤源有保证,Wind
1147,2020-09-28,【研报掘金】供给偏紧需求恢复煤价持续反弹 看好业绩向好、股息率有保障低估值龙头,证券时报网
1148,2020-09-28,千股遭减仓，北上资金本周连卖5天，茅台“风向”有变？,证券时报网
1149,2020-09-27,基础化工周报：政策加码助推半导体材料发展 万华上调MDI挂牌价,光大证券
1150,2020-09-27,石油石化、基础化工、新材料行业北上资金流向周报,新浪
1151,2020-09-27,石油化工行业周报：原油基本面或有承压 长丝销售节前明显好转,新浪
1152,2020-09-27,基础化工：油价下跌 液氯、环氧丙烷、碳酸二甲酯DMC、三聚氰胺、纯MDI等产品价格上涨,新浪
1153,2020-09-25,宝丰能源：相关项目建成后，将牢牢巩固公司煤制烯烃的龙头地位,Wind
1154,2020-09-25,21股获券商买入评级，三诺生物目标涨幅达50.66%,Wind
1155,2020-09-25,【银河化工】四季度策略：量价角度探寻高成长标的，优质细分龙头业绩可期,中国银河证券研究
1156,2020-09-24,宝丰能源聚烯烃新项目升级 煤基新材料产业链创新智造,中新网
1157,2020-09-23,强化产业“内循环” 宝丰能源聚烯烃新项目扩容产能翻番,中国经济网
1158,2020-09-23,宝丰能源新项目扩容烯烃产业链 助推宁夏重点产业发展,中证网
1159,2020-09-23,百万吨级烯烃项目开工，宝丰能源逆势扩产发力高端,第一财经
1160,2020-09-23,着眼规模化高端化水平整体提升 宝丰能源50万吨/年煤制烯烃项目开建,上证报
1161,2020-09-21,煤炭周观点：顺周期和现金价值显现，板块持续贡献超额收益【国君煤炭翟堃】,煤市乾坤
1162,2020-09-21,宝丰能源：公司有项目属于新能源领域,Wind
1163,2020-09-16,基础化工行业2020H财报总结：Q2恢复增长趋势 上半年业绩触底反弹,新浪
1164,2020-09-13,煤炭开采行业周报：淡季不淡煤价上涨 “金九银十”煤炭股犹显韧性,新浪
1165,2020-09-10,北上资金8月概况及9月展望,新浪
1166,2020-09-07,宝丰能源：获得交通银行200亿元授信,e公司
1167,2020-09-07,交通银行与宝丰能源(600989.SH)签订200亿元授信战略合作协议,格隆汇
1168,2020-09-05,上市公司正负面新闻2020年9月5日星期六,Wind
1169,2020-09-04,宝丰能源与交通银行签署战略合作协议 将获200亿元授信额度,中证网
1170,2020-09-04,晚间重要公告2020年9月4日星期五,Wind
1171,2020-09-04,9月4日晚间上市公司十大重磅公告,巨丰财经
1172,2020-09-04,宝丰能源：与交通银行签订战略合作协议,Wind
1173,2020-09-04,宝丰能源(600989.SH)签订战略合作协议 交通银行拟提供200亿元授信等金融服务,格隆汇
1174,2020-09-04,A股中报季900只超预期个股名单,锦缎
1175,2020-09-02,券商金股出炉！看“金九月”如何布局？,上证报
1176,2020-09-01,陆股通8月增仓幅度排行榜（附股）,证券时报网
1177,2020-08-31,基础化工行业周报：油价上涨 聚合MDI、液氯、PVC糊树脂、纯碱、DMF等产品价格上升,新浪
1178,2020-08-30,煤炭行业：板块二季度盈利改善 神华H股回购彰显价值,新浪
1179,2020-08-28,【重磅|深度系列三，开源煤炭&石化】宝丰能源：鉴宝求真，再议成本优势&周期成长,能源观察站
1180,2020-08-25,百名投资者集中调研宝丰能源,凤凰网
1181,2020-08-24,宝丰能源(600989)深度报告：产能持续扩张 一体化推动盈利上行,新浪
1182,2020-08-23,煤炭开采行业周报：煤企中报业绩频超预期 关注挖潜及成长性标的,新浪
1183,2020-08-23,原油周报第162期：OPEC+减产规模仍将保持稳定,光大证券
1184,2020-08-23,基础化工行业周报：核心布油价格下跌 丙酮、维生素、TDI、纯MDI、ABS等产品价格上涨,新浪
1185,2020-08-21,现代煤化工龙头宝丰能源 持续打造煤炭清洁高效利用项目,中证网
1186,2020-08-21,低油价时代煤制烯烃遇“劫”：成本优势缩小 巨头加码前景如何？,中国网
1187,2020-08-20,低油价时代煤制烯烃遇“劫”：成本优势缩小 巨头加码前景如何？,新浪
1188,2020-08-20,宝丰能源近期将启动50万吨/年煤制烯烃项目建设 一体化规模优势凸显,证券时报
1189,2020-08-18,氢能以奖代补政策正在研讨 六股迎腾飞契机,证券时报
1190,2020-08-17,煤炭开采Ⅱ行业周报：煤炭三大子行业均见底探涨 继续看好板块估值修复,新浪
1191,2020-08-17,快讯：宝丰能源涨停 报于13.62元,金融界
1192,2020-08-17,【华安证券 | 中报点评】宝丰能源：烯烃产品助力营收利润双增长,化工阿尔法
1193,2020-08-17,能源行业日报：OPEC会议周三召开 关注印染行业整合,新浪
1194,2020-08-13,风格大变，这些冷门股获机构首次关注，社保基金扎堆持股煤化工龙头,搜狐
1195,2020-08-13,【开源煤炭&石化-张绪成】宝丰能源：十问十答，鉴宝求真,能源观察站
1196,2020-08-13,解盘：大盘止跌，生物育种、乡村振兴、军工、光伏略涨,Wind
1197,2020-08-13,宝丰能源研发投入劲增12倍 股价给力31天飙涨47%,产业经济新闻网
1198,2020-08-13,券商重仓股名单新鲜出炉！新进13只，增持11只,中证报
