3536,2018-09-09,机械制造：继续防御性配置 荐13股,川财证券
3537,2018-09-07,恩智浦与富士康工业互联网开展合作 携手开展工业物联网解决方案创新,--
3538,2018-09-06,2018恩智浦未来科技峰会隆重召开,C114通信网
3539,2018-09-06,为了留住打工者，这座一线城市宣布：在“村”里为你们安排保障房,每日经济新闻
3540,2018-09-05,恩智浦与富士康工业互联网开展合作 催生全新智能制造产业变革,维库电子市场
3541,2018-09-05,亲兄弟不能明算账恒铭达IPO冲关审核被取消,新浪
3542,2018-09-05,新经济龙头企业估值分化，长期价值待挖掘,中证报
3543,2018-09-05,新经济龙头企业估值分化 长期价值待挖掘,中证报
3544,2018-09-04,鹏鼎控股：公司间接控股股东的第一大股东为富士康,e公司
3545,2018-09-04,富士康工业互联网股份有限公司董事长陈永正：建议扶持中小企业工业互联网改造与实施,中国电子报
3546,2018-09-03,“智”造引领 “数”享未来-中国数字化产业发展论坛成功举办！,慧聪电子网
3547,2018-09-03,机构8月密集调研科技类公司,中证报
3548,2018-09-03,上市公司发力自主研发，上半年研发投入逆势增逾两成,中证报
3549,2018-08-31,紧盯聪明钱，看“外来的和尚”如何念经？,Wind
3550,2018-08-31,50万元的蔚来ES8被抠标 究竟打了谁的脸？,华夏时报
3551,2018-08-31,房企参与产业新城开发开拓新空间,南方日报
3552,2018-08-31,富士康与威斯康星州三家公司合作，成立规模1亿美元的风险投资基金,维库电子市场
3553,2018-08-30,领先8K遇5G 富连AIoT未来更精彩,砍柴网
3554,2018-08-30,国调基金布局战略新兴产业思路渐明,Wind
3555,2018-08-30,“独角兽”业绩半年考 估值分化几家欢乐几家愁,21世纪经济报道
3556,2018-08-29,申万宏源电子|每日资讯公告,申万宏源电子研究
3557,2018-08-29,工业富联子公司入选国家工信部2018年智能制造试点示范项目,中证网
3558,2018-08-29,随锐科技获鸿海2.5亿投资 富士康成随锐新背书,证券之星
3559,2018-08-29,富士康将联合组建1亿美元投资基金，加速初创企业发展,搜狐
3560,2018-08-29,分析称三款新iPhone出货量将创iP6后新高：台积电/富士康赚翻,驱动之家
3561,2018-08-29,投行不好过？2018年IPO过会企业审计费工业富联第一,新浪
3562,2018-08-28,8K生态契如榫卯 夏普伴你夜游博物馆,砍柴网
3563,2018-08-28,富士康携三家企业共建风投基金Wisconn Valley，规模1亿美元、聚焦跨领域,猎云网
3564,2018-08-27,威斯康辛州失业率创新低，富士康面临招工难问题,Wind
3565,2018-08-27,QFII建仓动静大 青睐两主线,金融投资报
3566,2018-08-27,他打败富士康成为苹果最赚钱的供应商，生产的手机喇叭全球第一,维库电子市场
3567,2018-08-27,鸿海应该卖掉夏普？日媒爆首选买家是海信,维库电子市场
3568,2018-08-25,美图千亿市值缩水八成 独角兽低下了高昂的头 连续下跌,钱江晚报
3569,2018-08-24,报道称和硕获得6.1寸iPhone 60%订单,驱动之家
3570,2018-08-24,腾讯“云+未来”峰会亮相重庆 助力智慧民生,中新网
3571,2018-08-23,"工业富联:1H18收入稳定增长,成本上升影响利润增速",中证网
3572,2018-08-23,QFII加仓优质标的，新进资金偏好多元化,Wind
3573,2018-08-22,A股“独角兽”中期扫描：业绩分化严重 股价3家欢喜1家忧,金融投资报
3574,2018-08-22,夏普关闭工厂采用代工 日本制造跌落下神坛 经营问题,Ofweek
3575,2018-08-22,718家上市公司汇兑损失近7亿，企业外汇套保应对汇率波动,21世纪经济报道
3576,2018-08-22,1146份中报显示：逾七成公司净利增长,证券日报
3577,2018-08-21,QFII抱团取暖 岂料在这只股票上挨了套,每日经济新闻
3578,2018-08-21,耳机制造商万魔声学上位 共达电声二季度扭亏,e公司
3579,2018-08-21,"工业富联:通讯、云服务持续走强,工业互联网稳步推进",正点财经
3580,2018-08-21,助力中国芯片，这个巨头进军半导体产业，寻求由代工向自产的转变,维库电子市场
3581,2018-08-20,长沙银行有望成近两月顶格申购最容易中的新股,证券时报网
3582,2018-08-20,两只高中签率新股等你打！中签率有望排到年内前8，重点是新股平均盈利在提升,证券时报网
3583,2018-08-20,[推荐评级]机械行业周报：从能源安全和投资效率的角度 关注油服装备、5G产业链、铁路装备,中财网
3584,2018-08-20,蔚来被严重高估了,虎嗅网
3585,2018-08-18,日本科技巨头陨落：因背负400亿巨债，它卖掉了最核心的芯片业务,凤凰网
3586,2018-08-17,珠海市政府与富士康科技集团签署战略合作协议，将在半导体方面开展合作,Wind
3587,2018-08-17,重磅！富士康工业互联网喜提两大试点示范,苏南网
3588,2018-08-17,QFII二季度持股新动向：新进增持30股,证券时报
3589,2018-08-17,巨头争霸工业互联网平台 富士康BEACON如何出道？,21世纪经济报道
3590,2018-08-16,[增持-A评级]工业富联(601138)中报点评：通讯、云服务持续走强 工业互联网稳步推进,中财网
3591,2018-08-16,让苹果低头，是工业富联“第三次进化”的序幕？,阿尔法工场
3592,2018-08-16,83只次新股“破发” 5成业绩变脸 连续下跌,长江商报
3593,2018-08-15,工业富联的“毛利率困境”：代工模式亟需转型,搜狐
3594,2018-08-15,今年的iPhone竟然都是国产！这家企业真厉害,腾讯网
3595,2018-08-15,333亿资金恐慌逃离 五类股遭主力机构抛,证券之星
3596,2018-08-15,褪去独角兽外衣的工业富联：两个月市值蒸发2100亿 连续下跌,搜狐
3597,2018-08-15,富士康与随锐合作，共同开拓工业互联网云服务领域,砍柴网
3598,2018-08-15,工业富联：独角兽变形记,腾讯网
3599,2018-08-15,大参考：香港特首将出席粤港澳大湾区建设领导小组首次会议,巨丰财经
3600,2018-08-15,三大数据解密外资新动向 QFII二季度增仓21只个股,证券日报
3601,2018-08-14,从“一颗苹果”到“一片果园” 河南年产3亿部手机,中新网
3602,2018-08-14,工业富联上半年人力成本降低超一成 “机器人换人”立功？,每日经济新闻
3603,2018-08-14,工业富联半年报：净利润54.44亿元 工业互联网领域稳步前进,通信产业网
3604,2018-08-14,富士康发布二季度财报：净利润创下五年来最低点,新京报
3605,2018-08-14,中金：工业富联上半年毛利率因汇率冲击而承压,国际金融报
3606,2018-08-14,外媒爆富士康量产新iPhone 苹果良心发现降低售价？,腾讯网
3607,2018-08-14,工业富联首份半年报：净利润54.44亿元 人力成本出现下降,经济观察网
3608,2018-08-14,富邦证券：今秋三款新iPhone全由富士康与和硕代工,TechWeb
3609,2018-08-14,工业富联：多产品线齐头并进 “先进制造+工业互联网”典范企业,平安证券
3610,2018-08-14,工业富联上半年千亿营收稳增长 研发持续高投入,证券日报
3611,2018-08-14,工业富联上半年净利增长2.24%,中证报
3612,2018-08-13,工业富联净利微增2.24% 人工成本降一成,第一财经
3613,2018-08-13,股价濒临破发，外资大举买入被套！富士康上半年成绩单：净利润仅增长2%,中国基金报
3614,2018-08-13,伤心独角兽工业富联破发，净利增速低至2.24% 连续下跌,21世纪经济报道
3615,2018-08-13,富士康17亿不投鹤壁投武汉 上半年营收1589亿元,新浪
3616,2018-08-13,沪深上市公司18年8月13日晚间上市公司重要公告,全景网
3617,2018-08-13,13日公告精选：工业富联上市后首份半年出炉，上半年净利54.44亿,和讯
3618,2018-08-13,公告精选：工业富联发布上市后首份半年报 ST长生控股股东19.51%股份被冻结 股权冻结,e公司
3619,2018-08-13,一线|工业富联半年报：总收入达1590亿 净利仅54.44亿,腾讯网
3620,2018-08-13,工业富联半年报：净利润54.4亿元 同比增长2.24％,金融界
3621,2018-08-13,工业富联:拟开展不超过100亿元的衍生性商品交易业务,新浪
3622,2018-08-13,工业富联：推进工业互联网应用改造 上半年人力成本同比降12%,e公司
3623,2018-08-13,工业富联上市后首份半年报：上半年净利54.44亿元 同比增2%,e公司
3624,2018-08-13,"工业富联上半年营业总收入1,589.94亿元，同比增长16.29%",金融界
3625,2018-08-13,工业富联：上半年净利润54.44亿元，同比增2.24%,Wind
3626,2018-08-13,"富士康需要控制夏普的制造成本,未来富士康加快夏普的战略转型",维库电子市场
3627,2018-08-13,"苹果iPhoneX大卖,所以实习生加班加点一天干11小时?",搜狐
3628,2018-08-10,夏普逐步停止日本制造源于富士康推进的战略转型,腾讯网
3629,2018-08-10,Skyworks将以4.05亿美元收购ASoC芯片厂商Avnera,SEMI
3630,2018-08-09,光环褪去股价暴跌，这些独角兽公司变成了毒角兽,搜狐
3631,2018-08-09,跌破发行价的“毒角兽”，谁该背这样的“黑锅”？,搜狐
3632,2018-08-09,“独角兽”们遭重挫：工业富联缩水超2000亿逼近破发 连续下跌,新浪
3633,2018-08-09,中国彩电厂商十分不满郭台铭，让夏普电视的降价太猛,维库电子市场
3634,2018-08-09,工业富联接近破发，曾被寄予厚望的独角兽为何风光不再？ 连续下跌,搜狐
3635,2018-08-08,工业富联股价逼近破发 市值已蒸发2237亿元 连续下跌,新浪
3636,2018-08-08,一线丨“独角兽”工业富联逼近破发 市值已蒸发2000多亿 连续下跌,腾讯网
3637,2018-08-07,苹果能不能扶起另一个“富士康”？,腾讯网
3638,2018-08-07,以航天云网为例 详解中国工业互联网的平台价值,中国企业报
3639,2018-08-06,富士康缩减美国威斯康辛项目规模 降级为6代线工厂,新浪
3640,2018-08-06,快讯：工业富联持续走低 股价再创调整新低,新浪
3641,2018-08-04,iPhone下一代旗舰支持双卡双待富士康确认爬坡量产即将抢钱,搜狐
3642,2018-08-04,苹果和富士康为什么能“甜蜜”十年？,搜狐
3643,2018-08-03,揭秘工业互联网 工业富联场景应用随处可见,维库电子市场
3644,2018-08-02,苹果对关键下级供应商的管控,维库电子市场
3645,2018-08-02,华为第二季手机出货量超苹果 特斯拉第二季度营收40亿美元,巨丰财经
3646,2018-08-02,富士康又助攻！正在代工4款iPhone，6.5寸新iPhone支持双卡双,搜狐
3647,2018-08-02,iPhone X Plus来了！3480毫安大电池，A12处理器，跑分将,搜狐
3648,2018-08-01,富士康员工：新iPhone全面量产 双卡双待+屏幕指纹,驱动之家
3649,2018-08-01,手机大佬们的虚幻“PC梦”,钛媒体
3650,2018-07-31,美年健康7成收入来自单位体检 第一大客户为富士康,腾讯网
3651,2018-07-30,富士康否认大规模裁员、关闭产线 但存在“汰弱留强”,证券时报
3652,2018-07-27,全球教育与商务行业互动屏领导者SMART正式入华,中新网
3653,2018-07-27,工业互联网平台：迎政策红利 路线图基本形成,中国电子报
3654,2018-07-27,告别新股不败 平均连板数低至8.19,21世纪经济报道
3655,2018-07-26,京东云携手富士康旗下教育科技品牌SMART科技 开启智能教育新模式,财经网
3656,2018-07-25,国泰君安中小盘·IPO专题【打新基金二季度收益遇寒冬，持续减持银行股】,易研九鼎
3657,2018-07-23,申洲国际=富士康？这个实力有点强,亿邦动力
3658,2018-07-23,【新时代中小盘 孙金钜团队】 打新基金：小规模基金遭赎回最为明显，底仓共同增持食品饮料,新时代证券研究
3659,2018-07-20,前线 | 旗舰机大降价、官微清空，夏普手机或再次退出中国,凤凰网
3660,2018-07-20,华电富士康郑州分布式能源站项目获补贴,Ofweek
3661,2018-07-20,富士康为何要在印度建厂？除了人力还有此原因,中关村在线
3662,2018-07-20,富士康将推“区块链”智能手机：不仅仅是挖矿,中关村在线
3663,2018-07-19,278只次新股披露中报预告 三成宣告“变脸”,金融投资报
3664,2018-07-18,"制造巨无霸实力强大,品牌转型是富士康的关键",维库电子市场
3665,2018-07-18,夏普手机官方微博突然清空 疑似退出中国？,TechWeb
3666,2018-07-17,花旗给予工业富联买进初始评级，看好其销售和盈利展望,金融界
3667,2018-07-17,“全球代工之王”谁来接班?他说，被我骂最凶的人,搜狐
3668,2018-07-16,谁是富士康接班人？郭台铭：被我骂的越凶，越有可能是接班人,搜狐
3669,2018-07-16,富士康接班人爆料！郭台铭：被我骂得最凶的最有机会,搜狐
3670,2018-07-16,富士康8月或与印度马哈拉托特拉邦签署建厂协议,新浪
3671,2018-07-16,富士康与印度马哈拉施特拉邦接近达成投资协议,金融界
3672,2018-07-13,不走寻常路，富士康在硅谷成立人工智能公司,维库电子市场
3673,2018-07-12,信心堪比黄金，A股量价齐升成交额破4000亿元，增量资金入场？,Wind
3674,2018-07-12,收评：中兴通讯强势涨停 A股人气回暖收涨2.16%,央视
3675,2018-07-12,巨丰资金流向：市场强势反弹一扫贸易阴霾 电子元件板块成今日吸金王,巨丰财经
3676,2018-07-12,独角兽板块集体大涨，宁德时代强势涨停,Wind
3677,2018-07-12,独角兽概念股集体大涨 工业富联午后逼近涨停,腾讯网
3678,2018-07-12,快讯：两市维持高位 工业富联一度冲击涨停,第一财经
3679,2018-07-12,工业富联午后逼近涨停，宁德时代大涨7%，药明康德大涨5%,每日经济新闻
3680,2018-07-12,工业富联：贸易战未对公司产生较大影响，有充分应对能力及对策,Wind
3681,2018-07-12,纬创并未被淘汰出局：今年可能代工6.1英寸LCD版iPhone,TechWeb
3682,2018-07-12,工业富联：资产负债率进一步下降,中证网
3683,2018-07-12,沃特股份：为工业富联、海信、联想等的材料供应商,中证网
3684,2018-07-12,快讯：富士康概念股早盘走强 春秋电子意华股份涨停,新浪
3685,2018-07-12,[互动]工业富联：已在大量使用工业机器人,全景网
3686,2018-07-12,[互动]工业富联：工业互联网对外服务板块将成利润增长点,全景网
3687,2018-07-11,郭台铭: 中国可以做出自己的芯片和操作系统,元器件交易网
3688,2018-07-11,[中性评级]证券行业7月投资策略：龙头优势继续演绎 估值修复可期,中财网
3689,2018-07-11,富士康成立人工智能公司 开发实现工厂生产自动化的AI技术,维库电子市场
3690,2018-07-11,富士康已在硅谷成立AI公司 计划招募100名专业人员,TechWeb
3691,2018-07-10,打新基金名存实亡:收益成鸡肋 国投瑞银新价值遭清盘,中金在线
3692,2018-07-09,新股网下申购收益成“鸡肋” 打新基金已名存实亡,第一财经
3693,2018-07-08,沪市公司上半年投资价值凸显 增持回购彰显信心,上交所
3694,2018-07-07,富士康一年裁员37万？富士康：谣言,Wind
3695,2018-07-07,富士康一年裁员37万？富士康：谣言,21世纪经济报道
3696,2018-07-06,数据王：科技股成为主力交易主要标的 3只个股吸金超13亿元,巨丰财经
3697,2018-07-06,桂浩明：小米估值下降？“独角兽”有望回归理性,搜狐
3698,2018-07-06,富士康投资美国，华为搬迁东莞，谁之过？,搜狐
3699,2018-07-06,富邦证券：今秋新iPhone大部分由富士康代工 没有纬创资通,TechWeb
3700,2018-07-06,[推荐评级]工业富联(601138)调研纪要：工业互联网市场前景广阔 公司技术积累雄厚,中财网
3701,2018-07-06,险资打新热情不减 半年浮盈1.69亿元,证券日报
3702,2018-07-05,"中小盘IPO专题:IPO发行速度减缓叠加底仓亏损,网下打新账户数量下滑超千只",正点财经
3703,2018-07-05,宁德时代、药明康德、工业富联盘中拉升,e公司
3704,2018-07-05,中金公司：首次给予工业富联推荐评级 目标价21.7元,新浪
3705,2018-07-05,工业富联：全球领先的通信网络设备制造商,中金公司
3706,2018-07-05,因品质管理问题 纬创无缘新iPhone手机代工,TechWeb
3707,2018-07-05,从智能家居的几经沉浮，看优点科技如何解锁时代大门,搜狐
3708,2018-07-05,巨丰早评：短线提防创业板破位创新低,巨丰财经
3709,2018-07-05,万科半年“期中考”放榜 收金3047亿元与宝万残影,观点地产网
3710,2018-07-05,“独角兽”IPO抬高打新收益 券商半年打新浮盈3000万,证券日报
3711,2018-07-05,解码上半年新股之最,北京商报
3712,2018-07-04,准时达亮相美国威州工业展，颠覆当地企业对供应链的认知,仓储自动化网
3713,2018-07-04,巨丰微策略：强势股为何补跌？,巨丰财经
3714,2018-07-04,巨丰收评：创业板补跌打破市场预期,巨丰财经
3715,2018-07-03,A股上半年IPO融资额同比下降26%，下半年或将继续从严,澎湃新闻
3716,2018-07-03,528亿资金争夺20股：主力资金重点出击10股(名单),新浪
3717,2018-07-03,谁能圆梦互联网造车？成为汽车行业的“富士康”,第一电动网
3718,2018-07-03,A股再创新低 阿里CDR项目后延,21世纪经济报道
3719,2018-07-02,富士康年底推出九摄像头手机，这个造型雷死人,搜狐
3720,2018-07-02,IPO募资少收了三五斗,深圳商报
3721,2018-07-02,[推荐评级]智能制造系列深度报告之六：装备制造业视角的工业互联网发展机会,中财网
3722,2018-07-02,宋清辉：工业富联想象空间不如药明康德大,搜狐
3723,2018-07-01,Light获富士康投资：将在年底发布9颗摄像头的手机,驱动之家
3724,2018-07-01,18天，我赚了1万2！,融360
3725,2018-06-30,特朗普赞富士康新工厂是“世界第8大奇迹”，补贴达40亿美元,搜狐
3726,2018-06-30,孙金钜：CDR对流动性影响与战略配售基金收益测算探讨,金融界
3727,2018-06-30,富士康投百亿美国建厂，留给这些城市的时间不多了,和讯
3728,2018-06-30,机构大笔抛售！5天市值蒸发近1500亿！这家上市公司跌惨了,和讯
3729,2018-06-30,巨丰访谈：月底暴力反弹揭示重大信号 7月将开启真正长牛的契机？,巨丰财经
3730,2018-06-30,三只独角兽折射不同投资方向,金融投资报
3731,2018-06-30,特朗普再发推夸富士康在美工厂“不可思议”,汇通网
3732,2018-06-30,富士康美国面板厂正式营运前 还需两项许可,元器件交易网
3733,2018-06-30,IPO上半年融资不到千亿 从严审核下“堰塞湖”快速泄洪,21世纪经济报道
3734,2018-06-29,深圳城中村改造之困,中国经营网
3735,2018-06-29,万科股东会:不知宝能接盘方 万科10年后不是地产公司,中证网
3736,2018-06-29,郁亮：十年后如果万科还是地产公司会很惨淡,中国经营网
3737,2018-06-29,工业富联：富士康各地工厂已开始实施智能制造及工业互联网改造,Wind
3738,2018-06-29,工业富联：富士康各地工厂已开始工业互联网改造 后续将开放解决方案,e公司
3739,2018-06-29,工业富联: 有充分应对贸易摩擦的能力和对策,e公司
3740,2018-06-29,eBay和富士康加入以太企业联盟,Bianews
3741,2018-06-29,特朗普站台富士康美国工厂：这是第八大奇迹，用美国钢筋建造,澎湃新闻
3742,2018-06-29,特朗普称软银在美投资720亿美元 比500亿的承诺多,网易
3743,2018-06-29,万科张旭：万村计划遇到很多困难 棚改政策影响不大,金融界
3744,2018-06-29,万科谈富士康员工信：城中村改造将保持租金稳定,新浪
3745,2018-06-29,工业富联董事长谈股价：波动难以避免，有信心给股东好的回报,Wind
3746,2018-06-29,富士康美国新工厂获40亿补贴，特朗普将参加动工典礼,维库电子市场
3747,2018-06-29,特朗普参加富士康美国工厂动工仪式 盛赞其为“世界第八大奇迹”,腾讯网
3748,2018-06-29,富士康美国建厂获巨额补贴 财政成本过高引发不满,和讯
3749,2018-06-28,股指叠创新低 独角兽新股加速价值回归,第一财经
3750,2018-06-28,工业大数据赋能智能制造,信产网
3751,2018-06-28,特朗普出席富士康工厂动土典礼,凤凰网
3752,2018-06-27,Longhorn从富士康手中收购前夏普半导体专利,元器件交易网
3753,2018-06-27,工业富联与海康威视达成战略合作,证券时报
3754,2018-06-27,工业富联携手海康威视 在工业互联网等领域深入合作,e公司
3755,2018-06-27,工业富联与海康威视在深圳签订战略合作框架协议,元器件交易网
3756,2018-06-25,技术工人不足 富士康美国宣布招募三千退伍兵入厂,腾讯网
3757,2018-06-25,机构:准备弹药 CDR+中报领衔 创板欠宁德涨停该还了,中财网
3758,2018-06-25,次新股再次上攻，欣锐科技、宏川智慧强势涨停,Wind
3759,2018-06-25,小米今日公开招股：自降身价怕重蹈工业富联老路？,Ofweek
3760,2018-06-25,富士康为独角兽炒作敲了一记警钟,新京报
3761,2018-06-24,工业富联牵手中国电子信息产业发展研究院赋能中国智造,证券日报
3762,2018-06-24,富士康iPhone生产线自动化进展太缓，无法遵守加班条例？,腾讯网
3763,2018-06-24,德勤中国股市年中IPO盘点 新股数大幅下挫 下半年抱紧独角兽,搜狐
3764,2018-06-23,市值暴跌1500亿！富士康跌出一个中国联通，郭台铭：不关心！,搜狐
3765,2018-06-23,陈永正：制造业“双创” 赋能中小企业,电子信息产业网
3766,2018-06-23,富士康工业互联网股份有限公司与中国电子信息产业发展研究院签署工业互联网战略合作备忘录,电子信息产业网
3767,2018-06-23,分化的独角兽,中国经营报
3768,2018-06-23,宁德时代开板首日上演“过山车”行情,证券时报
3769,2018-06-22,郭台铭：最多10年时间，富士康将用机器人取代80%人力,澎湃新闻
3770,2018-06-22,宁德时代黯然开板、工业富联强势反弹，大盘企稳全靠独角兽异动？A股动向要锁定这只指标股！,每日经济新闻
3771,2018-06-22,宁德时代开板：引巨量资金博弈 一机构抢筹4.38亿元,中证网
3772,2018-06-22,数据王：科技股迎资金回流6股资金净流入均超1亿,巨丰财经
3773,2018-06-22,何小鹏：造车新势力做大必须具备三个条件,中国企业家网
3774,2018-06-22,68岁郭台铭：5年内绝不会退休，不关心富士康股价,澎湃新闻
3775,2018-06-22,郭台铭回应市值大缩水:现在是转型关键期 不关心股价,新浪
3776,2018-06-22,房租不断上涨！生存空间被不断压缩！年轻人真的要崩溃了！,环球老虎财经
3777,2018-06-22,和信投顾：独角兽周期或影响A股的市场格局,中金在线
3778,2018-06-22,午评：股指止跌回升 宁德时代结束连续涨停,e公司
3779,2018-06-22,宁德时代8连板后跌停又翻红 另两独角兽共缩水2000亿,新浪
3780,2018-06-22,传富士康旗下夏普收购东芝PC业务,e公司
3781,2018-06-22,郭台铭：富士康计划在10年内用机器人替代80%的工人,金融界
3782,2018-06-22,“独角兽”集体萎靡:宁德时代盘中跌停 富士康逼近破发,中国网
3783,2018-06-22,独角兽概念集体回暖，创业板指涨超2%,Wind
3784,2018-06-22,郭台铭：富士康正在为谷歌生产新的手持设备,Wind
3785,2018-06-22,市值蒸发过千亿 富士康转型咋就这么难？,搜狐
3786,2018-06-22,宁德时代开板大跌，A股低开高走创业板翻红,全景网
3787,2018-06-22,快讯：工业富联快速拉升大涨4% 成交额超12亿,证券时报
3788,2018-06-22,快讯：独角兽概念板块强势拉升 工业富联涨近4%,新浪
3789,2018-06-22,工业富联拉升翻红,每日经济新闻
3790,2018-06-22,格力全面屏手机曝光 产品推新难掩“强卖”隐忧,中国家电网
3791,2018-06-22,独角兽受难日：宁德时代开板大跌，A股全线重挫,全景网
3792,2018-06-22,工业富联直线攀升，目前涨逾3%,Wind
3793,2018-06-22,独角兽概念集体疲软，宁德时代打开一字涨停,Wind
3794,2018-06-22,工业富联是这轮下跌止跌与否的重要指标,阿尔法工场
3795,2018-06-22,曹中铭:独角兽基金只能带来有限的增量资金,中财网
3796,2018-06-22,富士康增加对Vizio投资，加强美国市场部署,新浪
3797,2018-06-21,逆境重生 夏普连续两年618夺冠背后我们看到了这些,凤凰网
3798,2018-06-21,收购东芝PC业务，富士康艰难转型,腾讯网
3799,2018-06-21,两大独角兽暴跌：市值蒸发2000亿 富士康逼近发行价,中国基金报
3800,2018-06-21,沪指创年内收盘新低 两个板块已提前见底——道达投资手记,每经网
3801,2018-06-21,5天蒸发1500亿！富士康已跌破首日收盘价，A股两大独角兽被困,和讯
3802,2018-06-21,“闪崩股”频现引舆论质疑 高比例股权质押成引爆点,中财网
3803,2018-06-21,工业富联市值蒸发1600亿 距离破发只差2个跌停,腾讯网
3804,2018-06-21,工业富联跌超8%：连跌5个交易日 市值蒸发1487亿,中国经济网
3805,2018-06-21,小米推迟CDR背后：估值争议 硬件企业极易触及天花板,砍柴网
3806,2018-06-21,4天市值蒸发超千亿，工业富联已经跌掉了一个宁德时代,财经网
