,2021-12-31,消息称立讯精密将成苹果顶级供应商：逐步取代富士康,快科技
0,2021-12-31,视频｜富士康工业互联网股份有限公司董事长李军旗：用数据来驱动制造业的转型升级,每日经济新闻
1,2021-12-31,牵手富士康入场“造芯”，联手孚能科技布局动力电池，吉利“借力”多点开花,Ofweek
2,2021-12-30,从半导体元器件到电池和底盘，富士康要实现电动汽车的全产业链造车？,36氪
3,2021-12-30,与富士康正式合体，吉利的代工“历险记”开启？,ZAKER
4,2021-12-30,印度富士康 iPhone 生产再次中断 工厂被苹果列入合规观察名单,ZAKER
5,2021-12-30,元宇宙半导体新能源汽车齐发力工业富联跻身深圳上市公司十强,挖贝网
6,2021-12-30,苹果：富士康印度工厂住宿及餐厅条件不合标准 将确保全面纠正,格隆汇
7,2021-12-29,联创电子：公司产品的毛利率略有下降主要是近年来公司产品结构有所调整 盈利能力下降,Wind
8,2021-12-29,先百度后富士康 吉利的“新造车”版图,北京商报
9,2021-12-29,吉利与富士康合资的“专业汽车代工厂”落地，FF或为首个客户,经济观察网
10,2021-12-29,深圳466家上市公司扫描：多指标领先京沪,Wind
11,2021-12-29,食物中毒事件后 富士康宣布重组印度工厂管理层,TechWeb
12,2021-12-29,吉利与富士康成立富吉康公司 经营范围涉及芯片产品制造等,第一电动网
13,2021-12-29,深圳466家上市公司扫描：2020年员工人均薪酬18.96万，人均净利润等指标领先京沪,21世纪经济报道
14,2021-12-29,苹果公司：将富士康位于印度斯里佩鲁姆布杜尔的工厂列入观察期,财联社
15,2021-12-29,苹果公司：富士康印度钦奈郊区工厂进入试用期 将进行详细评估,财联社
16,2021-12-29,苹果(AAPL.O)发言人：富士康在印度的钦奈郊区Sriperumbudur工厂进入试用期，将继续密切关注情况,金十数据
17,2021-12-29,吉利、富士康成立富吉康智能制造公司，含集成电路芯片及产品制造,IT之家
18,2021-12-29,吉利与富士康成立富吉康,北京商报
19,2021-12-29,吉利、富士康成立富吉康智能制造公司，注册资本1亿元,Wind
20,2021-12-29,吉利、富士康成立富吉康智能制造公司，注册资本1亿元,e公司
21,2021-12-29,吉利与富士康成立富吉康 经营范围含芯片产品制造等,财联社
22,2021-12-28,利和兴：公司与富士康交易结算币别为人民币,每日经济新闻
23,2021-12-28,工业富联ESG再获国际权威机构认可 MSCI再次上调评级,挖贝网
24,2021-12-27,富士康淡季罕见大招工奖金1万 苹果13提前备货：我国高级技工人才缺口巨大,快科技
25,2021-12-27,工业富联入选APEC中国工商理事会“中国数字经济产业示范样本50”,挖贝网
26,2021-12-27,20亿股解禁 居然之家如何面对这场“大考”？ 解禁,凤凰网
27,2021-12-27,市场消息：在停产一周后，富士康位于印度钦奈的工厂将再关闭三天，预计12月30日恢复投产 经营问题,金十数据
28,2021-12-27,富士康位于印度钦奈工厂将再关闭三天 经营问题,Wind
29,2021-12-27,富士康等工厂春节前大量招工，入职奖励1万元，业内人士：可能有套路，打卡期满前被辞退,新浪
30,2021-12-27,立讯精密出手迅速，郭台铭始料未及，富士康市场遭瓜分,中国家电网
31,2021-12-25,富士康印度工厂因中毒事件再关三天，已试产iPhone 13,36氪
32,2021-12-24,光华科技：公司客户有：罗门哈斯、霍尼韦尔、美维、富士康、宝洁、安利、高露洁、依利安达、惠亚集团等,每日经济新闻
33,2021-12-24,富士康未告知员工职业病危害被罚15万,新京报
34,2021-12-24,工业富联刘宗长：灯塔工厂如何引领制造业数字化转型？,金融界
35,2021-12-24,富士康否认有意介入 东风裕隆重整前景扑朔迷离,ZAKER
36,2021-12-24,2021中国智能制造企业百强榜：富士康、海尔、吉利控股位列前三,OFweek
37,2021-12-23,工业富联子公司回应“被列入经营异常”：已移出异常名录 列入经营异常名录,上证报
38,2021-12-23,工业富联李军旗：保持清醒，打持久战,中国企业家杂志
39,2021-12-23,富士康关联公司被列入经营异常名录！公示企业信息弄虚作假 列入经营异常名录,奥一网
40,2021-12-23,立讯精密扩厂剑指富士康？,挖贝网
41,2021-12-23,工业富联子公司被列经营异常 公示企业信息弄虚作假 经营问题,中国经济网
42,2021-12-23,富士康申请注册元宇宙商标,零壹财经
43,2021-12-23,科技专题策划稿四|歌尔凭VR突围 欧菲光借新能源车“翻盘” “果链”们明年如何发力？,财联社
44,2021-12-23,金牛奖榜单揭晓 工业富联获殊荣,质量新闻网
45,2021-12-23,富士康独家回应：富士康与东风裕隆预重整项目没有关系，不会介入,经济观察网
46,2021-12-23,工业富联荣获中国证券报“金牛最具投资价值奖”,挖贝网
47,2021-12-23,美国建厂三年后，富士康首次获得税收减免,新浪
48,2021-12-22,工业富联大宗交易成交3006.49万元,证券时报网
49,2021-12-22,"工业富联现1笔大宗交易 共成交3,006.49万元",新浪
50,2021-12-22,工业富联今日大宗交易成交251.80万股，成交价11.94元溢价0.25%,Wind
51,2021-12-22,联得装备：公司客户包括京东方、华星光电、苹果、富士康、夏普、业成、华为、蓝思科技等,每日经济新闻
52,2021-12-22,消息称立讯精密正建造大型苹果iPhone组装工厂以打破富士康垄断,Wind
53,2021-12-22,消息称立讯精密正建造大型苹果iPhone组装工厂，打破富士康垄断,IT之家
54,2021-12-22,“果链”嗨了！3500亿龙头将建大型iPhone组装厂，欲破富士康垄断,AI财经社
55,2021-12-22,工业富联于莆田参股成立股权投资合伙企业,乐居财经
56,2021-12-21,工业富联大宗交易成交208.50万股 成交额2535.36万元,证券时报网
57,2021-12-21,"工业富联现1笔大宗交易 共成交2,535.36万元",新浪
58,2021-12-21,工业富联今日大宗交易成交208.50万股，成交价12.16元溢价0.08%,Wind
59,2021-12-21,工业富联进军半导体 “芯”路征程已开启,质量新闻网
60,2021-12-21,手握大量专利技术 工业富联积极布局元宇宙产业链,上证报
61,2021-12-21,印度清奈富士康工厂试产iPhone 13 预估明年2月正式量,砍柴网
62,2021-12-21,“隐形巨兽”工业富联入局半导体 将为中国芯片行业带来什么？,挖贝网
63,2021-12-21,12月21日盘前重要公司新闻,上证报
64,2021-12-21,元宇宙+半导体+新能源汽车“三驾马车”谋转型 工业富联郑弘孟： 这是一场面向星辰大海的征途,上证报
65,2021-12-20,工业富联牵手恩智浦布局新能源汽车 2023年量产智能座舱,21经济网
66,2021-12-20,起底知网：大发学术财？学术富士康？定位偏差的知识工程？,IT时报
67,2021-12-20,解码工业富联的半导体战略：夯实主业 瞄准“中国芯”,挖贝网
68,2021-12-20,线上盛会，重磅来袭-“OFweek 2021中国智造CIO在线峰会暨智能制造数字化转型在线展”即将启幕,Ofweek
69,2021-12-19,失去华为后，台积电的弊端越来越明显，陷入富士康“同款陷阱”,搜狐
70,2021-12-18,富士康印度工厂突发食物中毒事件 iPhone 11生产悬了?,快科技
71,2021-12-18,国内财经媒体头版2021年12月18日星期六,Wind
72,2021-12-18,工业富联：“早鸟”的机遇与烦恼,Wind
73,2021-12-16,工业富联牵手恩智浦加速进军新能源汽车领域,上证报
74,2021-12-16,恩智浦(NXPI.US)携手工业富联(601138.SH)，加速汽车技术创新,智通财经
75,2021-12-16,印度拿100亿美元吸引半导体/显示屏制造商建厂，富士康感兴趣,网易
76,2021-12-15,工业富联：剑指高端制造,新浪
77,2021-12-15,长江证券：看好工业富联参与半导体产业链投资,凤凰网
78,2021-12-14,工业富联(601138)：参与设立产业投资基金 把握优质投资机会,新浪
79,2021-12-14,工业富联再做LP！出资22亿牵手东莞、珠海国资设高精制造基金，背后更有千亿级集成电路生态版图,创业资本汇
80,2021-12-14,20股获买入评级 最新:聚合顺,中财网
81,2021-12-14,牵手智路资本、地方国资成立投资基金 工业富联半导体布局落下关键一子,上证报
82,2021-12-14,富士康又开始“招兵买马”，积极备战新年销售季,Ofweek
83,2021-12-14,金百泽：公司与富士康工业互联网全资子公司统合电子在杭州成立合资公司佰富物联，为客户提供中小批量的EMS服务,每日经济新闻
84,2021-12-14,富士康工业互联网投资成立合伙企业 注册资本33.31亿,Ofweek
85,2021-12-14,工业富联出资22亿元，参与设立投资基金,投资界
86,2021-12-13,苹果卖疯了富士康忙疯了：日产5000台，流水线女工“脑袋突突响，心跳特别快”,时代财经
87,2021-12-13,工业富联牵手珠海、东莞国资成立合资公司 执行事务合伙人为智路资管,上证报
88,2021-12-13,北向资金连续9日净买入累计加仓近700亿，爆买东方财富超17亿,Wind
89,2021-12-13,华泰研报：工业富联为“元宇宙”基建核心标的,凤凰网
90,2021-12-13,工业富联(601138.SH)：拟认缴晟丰(广州)产业投资合伙企业份额22.2亿元,格隆汇
91,2021-12-13,工业富联：2021年OTT产品出货逾6000万个,财联社
92,2021-12-13,工业富联投资成立产业投资合伙企业，注册资本33.31亿,搜狐
93,2021-12-13,港股异动 | 富智康集团(02038)涨超6% 郑州富士康大招工，iPhone市况并未如外传疲弱,智通财经
94,2021-12-13,富士康在淡季积极招工 明年iPhone出货量提升可期,金融界
95,2021-12-12,华为芯片的关键时期，富士康站了出来,搜狐
96,2021-12-12,郑州富士康罕见在淡季招工，或迎接苹果 iPhone 13 新年旺季需求,IT之家
97,2021-12-12,报道称郑州富士康罕见在淡季启动招工 迎接iPhone 13旺季需求,财联社
98,2021-12-10,中金研报：工业富联发力元宇宙基建,挖贝网
99,2021-12-09,比起苹果、小米，富士康更把造车的野心写在了脸上,OFweek
100,2021-12-08,DNeX与富士康商讨马来西亚8英寸厂扩产计划,财联社
101,2021-12-08,斯特兰蒂斯与富士康计划联手研发专用半导体 满足80%需求,TechWeb
102,2021-12-08,Stellantis发布软件战略：二度牵手富士康，5年投资 300亿欧元进行软件及电气化转型,21经济网
103,2021-12-08,【国际快讯】Stellantis将与富士康合作设计芯片；宝马电动车销量突破100万辆；标致2030年在欧洲全面电动化,盖世汽车
104,2021-12-07,工业富联拟收购鸿海精密全资子公司相关资产，耗资2.88亿,AI财经社
105,2021-12-07,富士康2.88亿收购鸿海精密子公司机器设备等资产,OFweek
106,2021-12-07,工业富联最新公告：拟收购鸿海精密全资子公司相关资产,证券之星
107,2021-12-07,工业富联(601138.SH)拟以2.88亿元购买兰考裕富相关资产,智通财经
108,2021-12-07,工业富联(601138.SH)：拟收购兰考裕富精密持有的机器设备相关资产,格隆汇
109,2021-12-07,财联社12月7日电，工业富联公告，拟通过全资子公司富联科技（兰考）有限公司以自有资金收购鸿海精密的全资子公司兰考裕富精密科技有限公司持有的机器设备（CNC精雕机、抛光机、清洗机等）相关资产，交易价格为,财联社
110,2021-12-07,工业富联：拟购买抛光机、清洗机等相关资产,Wind
111,2021-12-07,粤开策略：流动性相对宽松 关注跨年行情,新浪
112,2021-12-06,龙华创赛赛后路演：富士康与入选企业探讨智能制造未来,凤凰网
113,2021-12-06,售价低于3万美元 富士康代工生产：特斯拉美国老对手要造“梨”车,快科技
114,2021-12-05,【德邦金工|周报】资金密集流入医药，关注工业富联巨额解禁 20211205 解禁,微信
115,2021-12-05,下周这只股票解禁市值超1800亿元，但股东不能减持！新能源电力龙头股东浮盈近70亿元（附名单） 解禁,中证报
116,2021-12-04,基于宝马平台研发！富士康拟建立新合资公司,快科技
117,2021-12-04,下周将有50只股解禁 合计解禁市值2547.71亿元 解禁,证券时报网
118,2021-12-04,广东省政府约谈恒大！2500亿解禁洪流来袭，知名龙头股提前备好“定心丸”，大股东承诺不减持（附股） 解禁,证券时报网
119,2021-12-03,下周2549亿市值限售股解禁，环比增加697.21% 解禁,Wind
120,2021-12-03,下周解禁：工业富联解禁市值超1800亿元 解禁,大众证券报
121,2021-12-03,富士康计划与沙特方面合作成立电动汽车合资企业,TechWeb
122,2021-12-03,【国际快讯】富士康或与沙特合建电动车合资企业；特斯拉推儿童版Cyberquad,盖世汽车
123,2021-12-02,晚间重要公告2021年12月2日星期四,Wind
124,2021-12-02,工业富联公告限售股解禁大股东已承诺不减持 解禁,挖贝网
125,2021-12-02,富士康据称正在磋商帮助沙特制造电动汽车,新浪
126,2021-12-02,工业富联(601138.SH)：167亿股限售股将于12月8日起上市流通 占比达84.07% 解禁,智通财经
127,2021-12-02,工业富联(601138.SH)：约167.0171亿股限售股将解禁 解禁,格隆汇
128,2021-12-02,工业富联：167亿股首发限售股12月8日上市流通 解禁,Wind
129,2021-12-02,市场消息：苹果合作伙伴富士康正在就帮助沙特阿拉伯生产电动汽车进行谈判,金十数据
130,2021-12-02,12月限售股解禁前瞻：逾5000亿市值迎解禁 包含7支北交所个股 解禁,面包财经
131,2021-12-01,华勤技术踹门科创板：智能手机ODM龙头能否破解资本之路,21世纪经济报道
132,2021-12-01,工业富联最新公告：子公司设立有担保最高为20亿美元境外中期票据计划 大额借贷担保,证券之星
133,2021-12-01,工业富联(601138.SH)全资子公司设立有担保的境外中期票据计划,智通财经
134,2021-11-30,工业富联回应限售股解禁：大股东早已承诺不会抛售 解禁,挖贝网
135,2021-11-30,掘金新三板之邦力达：为富士康、比亚迪供应印制电路板离型膜,OFweek
136,2021-11-30,富士康半导体高端封测项目正式投产,中电网
137,2021-11-30,别让富士康跑了，全球智造龙头的影响力有多大？,IT时代网
138,2021-11-29,海外信用评级汇总2021年11月29日星期一,Wind
139,2021-11-29,标普：授予工业富联长期发行人信用评级为“A-”，展望“稳定”,Wind
140,2021-11-29,工业富联：本次拟解禁股份均系公司控股股东中坚公司与鸿海精密（中坚公司母公司）直接和间接持有 解禁,每日经济新闻
141,2021-11-29,逐鹿智能制造新时代，锐捷网络与富士康云智汇科技达成战略合作,砍柴网
142,2021-11-27,共筑中国制造强国强企之路 | 鼎捷软件【2021中国“智造”数字化转型峰会】盛大召开,砍柴网
143,2021-11-26,富士康首座晶圆级封测厂在青岛投产，装配国产 28nm 光刻机,IT之家
144,2021-11-26,富士康首座晶圆级封测厂在青岛西海岸新区投产,财联社
145,2021-11-26,与苹果相爱相杀，Apple Car到来之际，富士康能否有效处理,OFweek
146,2021-11-26,鼎捷软件(300378)：制造业ERP专家 智能制造再上层楼,新浪
147,2021-11-26,新鲜早科技丨富士康称旗下准时达暂无IPO规划；百度Apollo获国内首个自动驾驶收费订单；传三星将在明年停产Note系列 经营问题,21世纪经济报道
148,2021-11-25,消息称富士康子公司准时达寻求IPO前3-4亿美元融资,和讯
149,2021-11-25,富士康旗下准时达寻求至多4亿美元融资,财联社
150,2021-11-25,富士康旗下准时达寻求至多4亿美元融资,Wind
151,2021-11-25,市场消息：富士康的子公司准时达据悉寻求在IPO前融资，据悉寻求在新一轮融资中筹集至多4亿美元,金十数据
152,2021-11-25,富士康购买V2X专家Autotalks股份 价值1000万美元,盖世汽车
153,2021-11-25,三花智控：“富士康”有用到三花汽零产品,Wind
154,2021-11-25,看好明年A股机会，全球两大资管巨头齐唱多,Wind
155,2021-11-24,凭借数字化转型及灯塔工厂 富士康斩获两项大奖,质量新闻网
156,2021-11-24,数字化转型标杆 富士康以灯塔工厂引领实效,砍柴网
157,2021-11-24,Wi-Fi6相关产品年出货量超三千万套 工业富联具元宇宙基建领先优势,北国网
158,2021-11-24,华龙内参2021年第216期 总第1047期(电子版)：分化行情 如何操作？,新浪
159,2021-11-24,富士康 14.69 亿拿下通用前工厂，“多线程布局”能成为电动汽车领域的安卓吗？,ZAKER
160,2021-11-23,工业富联《灯塔工厂引领制造业数字化转型》入选5G+工业互联网大会优秀白皮书,东方网
161,2021-11-23,跨界布局汽车15年，“多路并进”加速跑，富士康这次能成功吗？,Ofweek
162,2021-11-23,新能源车、元宇宙引爆算力市场 工业富联预计GPU业务营收2025年达300亿人民币,凤凰网
163,2021-11-22,通信周报2021年第45期：工信部发布“十四五”信息通信行业发展规划,新浪
164,2021-11-22,"工业富联现1笔大宗交易 共成交4,543.21万元",新浪
165,2021-11-22,赋能加速，龙华“创赛”优质项目入选富士康智能制造加速营,凤凰网
166,2021-11-22,科技硬件周报：AIOT产业加速 CMP材料与设备受关注,新浪
167,2021-11-22,专题｜智能制造板块业绩大增 “灯塔工厂”数字化变革的喜与忧,投资者网
168,2021-11-19,特斯拉在打工仔圈子里，可是顶尖好企业，BYD的工人待遇甚至不如富士康？,观察者网
169,2021-11-19,工业富联(601138)：各项业务稳步推进 “灯塔工厂”赋能行业,新浪
170,2021-11-18,日签劳动合同1W+份，法大大助推富士康iDPBG事业群HR数字化,凤凰网
171,2021-11-17,从“参考原型车”，看富士康的另类造车战略,36氪
172,2021-11-16,华丰股份：公司目前未与富士康公司接触,每日经济新闻
173,2021-11-15,富士康已不敢谨慎：电子产品收入将下降，为造车买下通用旧厂 盈利能力下降,新浪
174,2021-11-15,富士康入局造车 2.3亿美元收购通用工厂,卡车之家
175,2021-11-15,富士康示警：芯片短缺问题将持续到2022年下半年,国际电子商情
176,2021-11-15,富士康将以2.3亿美元在美获得首座汽车工厂,Ofweek
177,2021-11-15,富士康2.3亿美元收购通用旧工厂，造车首战签皮卡,质量新闻网
178,2021-11-15,“芯慌”将持续到明年下半年，苹果(AAPL.US)供应商富士康对2022年收入前景持谨慎态度,智通财经
179,2021-11-15,台积电改变了全球芯片格局，富士康也想出手改变电动汽车格局？,Ofweek
180,2021-11-15,郭台铭造车梦成真，富士康造“4个轮子的iPhone”终成现实,Ofweek
181,2021-11-15,苹果因搜查员工赔偿近3000万美元 网友：富士康岂不赔掉底,快科技
182,2021-11-15,富士康警告称全球芯片短缺问题将持续到2022年下半年,TechWeb
183,2021-11-14,富士康造车新进展 明年扩充墨西哥车厂,第一电动网
184,2021-11-13,强瑞技术：公司目前和富士康、荣耀等厂商合作稳定,每日经济新闻
185,2021-11-13,强瑞技术：公司与富士康、立讯精密等制造商保持积极稳定合作,每日经济新闻
186,2021-11-13,富士康提醒芯片短缺问题会持续到明年下半年,36氪
187,2021-11-13,因为持续性的芯片短缺 富士康对2022年前景持“谨慎”态度,新浪
188,2021-11-12,苹果 iPhone 13/Pro 需求强劲，代工商鸿海富士康盈利超预期,IT之家
189,2021-11-12,工业富联(601138)：春风已至 大象起舞,新浪
190,2021-11-12,富士康大手笔2.3亿美元收购，代工生产电动皮卡,搜狐
191,2021-11-12,市场消息：富士康预计芯片业务销售额在2023年将达1000亿元新台币,金十数据
192,2021-11-12,富士康预计芯片业务销售额在2023年将达1000亿元新台币,Wind
193,2021-11-12,新鲜早科技丨天猫双11总成交额达5403亿元；中芯国际高管团队变动；富士康15亿元收购前通用汽车工厂,21世纪经济报道
194,2021-11-12,电动汽车制造商Lordstown宣布电动皮卡推迟一个季度量产：富士康代工,新浪
195,2021-11-12,近5日29只个股首获机构关注（附表）,Wind
196,2021-11-12,LORDSTOWN将使用富士康电动商务车平台,Wind
197,2021-11-12,LORDSTOWN和富士康同意联合生产Endurance皮卡,金十数据
198,2021-11-12,LORDSTOWN将使用富士康电动商务车平台,金十数据
199,2021-11-11,耗资15亿元，富士康靠收购拿下首座造车工厂,36氪
200,2021-11-11,美股异动 | Lordstown Motors(RIDE.US)盘前涨超16%，已与富士康达成5000万美元股票交易,智通财经
201,2021-11-11,Lordstown Motors盘前涨近18%，富士康将收购其在俄亥俄州的一家汽车组装工厂,新浪
202,2021-11-11,富士康造车按下“快进键”,36氪
203,2021-11-11,富士康豪掷15亿元！将前通用汽车工厂揽入怀中,快科技
204,2021-11-11,每经午时|富士康2.3亿美元收购美国汽车组装厂；恒指早盘下跌0.15%；马斯克再出售近359万股特斯拉股票，价值约40亿美元,每日经济新闻
205,2021-11-11,富士康15亿元正式收购洛兹敦汽车工厂,财经网
206,2021-11-11,富士康已与Lordstown(RIDE.US)达成5000万美元股票交易，预计全部交易将于明年完成,智通财经
207,2021-11-11,富士康2.3亿美元收购美国汽车组装厂，此前属于通用汽车,澎湃新闻
208,2021-11-11,富士康有了首家造车厂 15亿收购前通用工厂,第一电动网
209,2021-11-11,斥资5000万美元！富士康收购Lordstown部分股份,盖世汽车
210,2021-11-11,富士康宣布2.3亿美元收购通用汽车旧工厂,Wind
211,2021-11-11,富士康首座汽车工厂：15亿元正式收购前通用汽车工厂,36氪
212,2021-11-11,【快讯】富士康与Lordstown Motors(RIDE.O)建立战略伙伴关系,金十数据
213,2021-11-10,华泰证券：予工业富联(601138.SH)“买入”评级 目标价19.04元,智通财经
214,2021-11-09,百炼智能与富士康旗下钜亿科技成功举办战略合作签约仪式,砍柴网
215,2021-11-08,通信周报2021年第43期：巨头加码XR与卫星互联网,新浪
216,2021-11-07,盖世周报 | 赣锋锂业与特斯拉再签三年订单；富士康或在印尼建完整产业链,第一电动网
217,2021-11-05,从“大郑县”到“国际郑”：郑州如何被富士康改变？,网易
218,2021-11-04,富士康拟投资印尼电动汽车行业，预计年内签署谅解备忘录,乐居财经
219,2021-11-04,印尼方面表示，富士康热切希望在印尼投资，预计今年将签署有关富士康投资的谅解备忘录,金十数据
220,2021-11-04,印尼政府表示富士康对在当地投资有浓厚兴趣,Wind
221,2021-11-04,励志成为汽车界的“安卓”的富士康，发明了四个轮子的“iPhone”,Ofweek
222,2021-11-04,工业富联：五大看点,半导体风向标
223,2021-11-03,三季度财报逆势成长工业富联业绩持续稳增的背后逻辑,挖贝网
224,2021-11-03,东方证券：给予工业富联买入评级，目标价位17.17元,证券之星
225,2021-11-03,东方证券给予工业富联买入评级：各业务齐头并进，业绩稳步提升,每日经济新闻
226,2021-11-03,富士康造车悬念再起,中国能源报
227,2021-11-03,“造”手机老大富士康，能成为新能源汽车领域的代工龙头吗？,Ofweek
228,2021-11-03,5G业务增势强劲！工业富联前三季度净利润同比增长25%,维库电子市场
229,2021-11-02,手机概念股Q3业绩报告：95家企业净利负增长，供应商产量或将继续下调 盈利能力下降,搜狐
230,2021-11-02,工业富联全球供应链管理优异 多种措施强力保障产能,凤凰网
231,2021-11-02,通信行业跟踪周报：本周专题 通信第三季度基金持仓环比持平 持续关注物联网及能源信息化赛道投资机会,新浪
232,2021-11-02,工业富联业务布局多点开花 前三季盈利110亿增长25%,长江商报
233,2021-11-02,工业富联：长江证券股份有限公司、长江证券股份有限公司等12家机构于10月30日调研我司,证券之星
234,2021-11-01,工业富联接受6家机构调研！短期主力资金净流入,每日经济新闻
235,2021-11-01,工业富联大股东承诺解禁“不减持” 5G、智能家居、工业互联等业务齐驱并进,证券日报网
236,2021-11-01,工业富联董事长李军旗：新品爬坡三季度已到位，对全年经营充满信心,每日经济新闻
237,2021-11-01,恒生指数收跌0.88% 智能医疗、富士康概念板块跌幅居前,财华社
238,2021-11-01,自动驾驶中间件平台 AutoCore.ai 完成 A 轮融资，富士康、高瓴创投、IDG 领投,猎云网
239,2021-11-01,奥特酷获A轮融资，富士康、高瓴领投,猎云网
240,2021-11-01,富士康入局电动车领域：醉翁之意不在酒？,Ofweek
241,2021-11-01,图解工业富联三季报：第三季度单季净利润同比增13.69%,证券之星
242,2021-11-01,富士康或在印尼生产电动车和电池，双方谈判中,盖世汽车
243,2021-11-01,天风证券维持鼎捷软件买入评级：业绩稳健增长，经营性现金增长显著,每日经济新闻
