2243,2020-05-07,曾获富士康天使轮投资，「宾通智能」为工业企业打造智能化决策和调度系统,36氪
2244,2020-05-07,36氪首发 | AI近视防控医疗成果快速落地，「欧欧」获富士康近千万元第二轮投资,36氪
2245,2020-05-06,犀牛财经晚报：维维股份被立案调查 富士康回应放假四个月,GPLP犀牛财经
2246,2020-05-06,富士康要强制休假4个月？回复来了！,Ofweek
2247,2020-05-06,苹果12稳了！富士康称无大规模裁员及休假：保证合作伙伴订单生产 业务变化,快科技
2248,2020-05-06,富士康回应“部分员工放假4个月”传闻：无大规模裁员及休假状况,Wind
2249,2020-05-06,富士康回应传闻：无大规模裁员及休假情况 业务变化,上证报
2250,2020-05-06,网传员工将放假至9月 富士康：运作正常，无大规模休假,证券时报网
2251,2020-05-06,外媒称富士康已有足够工人，开始为苹果准备4款iPhone 12量产,唯样资讯
2252,2020-05-04,跳槽创业还收到前老板4000万贺礼 刚成立就获富士康大单！这家公司拟创业板上市,国际金融报
2253,2020-05-02,富士康成印度人眼中“香饽饽”？高工资不加班，郭台铭不开心了,网易
2254,2020-05-01,工业富联一季度管理费用激增 致使扣非净利润下降30.9% 盈利能力下降,中国家电网
2255,2020-05-01,【中金电子与通信】工业富联（601138.SH）：云服务设备强劲增长部分弥补智能手机下滑影响,乐平科技视角
2256,2020-05-01,富士康两度投资他：新品上线1年销售额5千万 为30万孩子防近视,和讯
2257,2020-04-30,工业富联一季度净利同比下滑超三成 管理费用激增至17.12亿 盈利能力下降,中国网
2258,2020-04-30,工业富联一季度呈现发展韧性,金融界
2259,2020-04-30,工业富联发布2020年一季报 兼备发展韧性和长期成长性,证券日报
2260,2020-04-30,工业富联2020年Q1净利润18.67亿元 同比下降35.01% 盈利能力下降,新浪
2261,2020-04-30,【华西电子孙远峰团队-持续推荐工业富联】业绩增长短期承压，不改长期发展前景,远峰电子
2262,2020-04-30,工业富联：一季度营收800.54亿元 积极应对疫情冲击,中证网
2263,2020-04-30,工业富联第一季度净利润18.68亿元 同比下滑35.01% 盈利能力下降,TechWeb
2264,2020-04-30,工业富联一季度营收800.5亿 口罩已累计出货5000万只,证券时报
2265,2020-04-30,工业富联：一季度净利润同比减少35.01% 盈利能力下降,Wind
2266,2020-04-27,富士康3月销售额同比下降7.7% 盈利能力下降,唯样资讯
2267,2020-04-27,沪深300公司召开业绩说明会数量明显增加,Wind
2268,2020-04-24,富士康、和硕开始缩减员工规模 员工变动,国际电子商情
2269,2020-04-24,武汉园区产能恢复八成，富士康两周内招聘5000人,证券时报网
2270,2020-04-24,大干新基建｜专访工业富联CEO：5G建设提速的机遇和挑战,证券之星
2271,2020-04-23,工业富联李军旗：采购的熔喷布价格已达每吨64万元,上证报
2272,2020-04-23,[快讯]工业富联李军旗：制造业永远不变的主题就是掌握核心技术,全景网
2273,2020-04-23,工业富联董事长：公司业务与新基建的四大大领域密切相关,e公司
2274,2020-04-23,工业富联董事长：公司已生产口罩5000多万只,e公司
2275,2020-04-23,[快讯]工业富联李军旗：二月初至今已经生产了5000多万只口罩,全景网
2276,2020-04-23,企业上云加速 云计算产业链公司业绩迅速增长,中证网
2277,2020-04-23,24家公布年报全部盈利 云计算产业链公司业绩迅速增长,中证报
2278,2020-04-22,工业富联董事长李军旗：融身新基建 创造新的增长极,e公司
2279,2020-04-22,工业富联：“灯塔工厂”整体解决方案已在领域落地,e公司
2280,2020-04-22,工业富联：Wi-Fi 6路由器目前已实现量产出货,e公司
2281,2020-04-22,工业富联：坚定不移实施“智能制造+工业互联网”双轮驱动战略,证券时报网
2282,2020-04-22,工业富联：新基建快速发展 有利于公司科技服务业务推进,e公司
2283,2020-04-22,工业富联：在新基建领域已具备较强“先发优势”,e公司
2284,2020-04-22,工业富联：公司科技服务合作项目已在汽车零配件等多个领域落地,e公司
2285,2020-04-22,工业富联：2019年云计算科技服务业收入双增长,e公司
2286,2020-04-22,工业富联：内部生产模式向智能制造转型升级 大力发展云计算业务及科技服务业务,e公司
2287,2020-04-22,【财经明星会预告】工业富联董事长李军旗：新基建下的智造之“变”,e公司
2288,2020-04-21,富士康威斯康星州工厂开始生产口罩 而非之前承诺的显示屏,TechWeb
2289,2020-04-21,物联网智库：2019年工业富联Fii投资价值白皮书（附下载）,199IT
2290,2020-04-18,两消息刷屏！蘑菇街裁员14% 郑州富士康有员工送外卖了 员工变动,金融界
2291,2020-04-17,富士康又开新厂！在青岛建设高端半导体封测工厂，今年开建，明年投产,经济网
2292,2020-04-17,富士康封测项目落户青岛，与中国半导体之父张汝京成邻居,Ofweek
2293,2020-04-17,台媒：富士康今年将在青岛建设高端半导体封测工厂,IT之家
2294,2020-04-16,郑州富士康停止招工不加班，员工送外卖补贴家用,网易
2295,2020-04-16,新进12只股增持2只股 钟爱这类股票,中投网
2296,2020-04-16,订单减少不再加班 郑州富士康员工送外卖补贴家用,新浪
2297,2020-04-16,富士康落子青岛 欲投建芯片“组装厂”,经济观察网
2298,2020-04-16,富士康半导体封测项目落户青岛 计划2025年量产,21世纪经济报道
2299,2020-04-16,富士康半导体高端封测项目落户青岛西海岸新区,e公司
2300,2020-04-14,工业富联抢答“新基建”,中金在线
2301,2020-04-14,专注新基建，工业富联从超前布局到持续加码,凤凰网
2302,2020-04-13,圈地招工成泡影？外媒发现富士康美国创新中心仍闲置中,TechWeb
2303,2020-04-13,富士康内部爆料：派遣工、小时工遭清退，或与传闻遭苹果砍单有关,Ofweek
2304,2020-04-13,最快本周发！富士康防疫升级 全力保证新iPhone SE生产,快科技
2305,2020-04-13,富士康又违诺？威斯康星州多个创新中心未投入使用,网易
2306,2020-04-12,发改委推“上云用数赋智”， 关注云计算、数字基建和数字生态新模式｜英博前瞻,英博前瞻
2307,2020-04-10,富士康称已达到威斯康星州招聘人数目标，现在需要政府补贴,36氪
2308,2020-04-09,复工后的富士康：20人一个工作组，日产200万医用口罩供内部使用,IT之家
2309,2020-04-08,富士康一季度营收降12% 预计上半年零增长全年将下调 盈利能力下降,GPLP犀牛财经
2310,2020-04-08,富士康将与Medtronic合作研发呼吸器,每日经济新闻
2311,2020-04-08,富士康将生产呼吸机,Wind
2312,2020-04-08,A股掘金新基建 这些公司可能最有戏,巨丰财经
2313,2020-04-07,技术驱动，精准布局：工业富联战略投资「凌云光技术」,砍柴网
2314,2020-04-07,凌云光获得富士康的2.5亿元战略投资,资本邦
2315,2020-04-07,富士康3月份实现营收115亿美元，同比下滑7.7% 盈利能力下降,Wind
2316,2020-04-07,富士康3月份实现营收115亿美元 同比下滑7.7% 盈利能力下降,TechWeb
2317,2020-04-07,富士康3月份营收下降7.7% 希望第二季度表现更好 盈利能力下降,网易
2318,2020-04-07,富士康3月销售又下跌：正全力生产新款iPhone SE 性价比无敌？ 盈利能力下降,快科技
2319,2020-04-07,富士康3月销售额同比下降7.7% 盈利能力下降,新浪
2320,2020-04-06,【安信通信每周观点】工信部计划2020年底全国5G基站超60万个，增加700MHz频谱用于5G,通信投研汪
2321,2020-04-04,今年第三次降准：市场会如何走？,Wind
2322,2020-04-03,二季度如何布局？机构持续看好科技、医药,Wind
2323,2020-04-03,工业富联拟派现近40亿元,上证报
2324,2020-04-03,裁员4.2万利润却增长10% 工业富联换帅如换刀 员工变动,无线通信世界
2325,2020-04-03,持续看好华为产业链投资机遇 六股上车行情,证券时报网
2326,2020-04-02,工业富联：预计从二季度开始可以通过加班来增加产量，弥补前期损失,Wind
2327,2020-04-02,疫情过后制造业将发生哪些变化？宋志平在富士康看到了这些趋势,中国企业家杂志
2328,2020-04-02,富士康：回来吧，我的员工！,商学院
2329,2020-04-02,对话富士康工业互联网管理层：结合三大战略，2020科技服务会有非常大的突破,智通财经
2330,2020-04-02,跳出苹果，富士康讲述的下一个故事是工业富联吗？,新京报
2331,2020-04-01,苹果5G手机今年秋季推出？富士康：不对单一客户产品发评论,澎湃新闻
2332,2020-04-01,苹果新款5G手机秋季上市？富士康回应：不评论单一客户,新京报
2333,2020-04-01,工业富联：紧抓新基建机遇 推动“智能制造+工业互联网”战略,Wind
2334,2020-04-01,富士康回应“保证5G版iPhone秋季推出”：不针对单一客户、产品发表评论,金十数据
2335,2020-04-01,富士康坚持认为5G iPhone 12有望按期于秋季发布,Wind
2336,2020-04-01,市场消息：富士康向投资者保证5GiPhone可在今年秋季推出。,金十数据
2337,2020-04-01,民生银行第二十次会议遭两董事投反对和弃权票 大唐发电盈利下滑 盈利能力下降,金融界
2338,2020-04-01,工业富联交出了一份不错的年报不过疫情影响可能超出预期,投中网
2339,2020-04-01,净利润增长10%，工业富联扎根“新基建”,时代在线
2340,2020-04-01,【中金电子与通信】工业富联（601138.SH）：“智能制造+工业互联网”战略初见成效,乐平科技视角
2341,2020-04-01,去年业绩稳中有进 工业富联布局新基建四大领域,中证报
2342,2020-03-31,【天风电子】工业富联：19业绩略超预期，内部赋能显成效,科技伊甸园
2343,2020-03-31,【安信通信】工业富联2019年报点评：短期承压不改长期发展趋势，5G互联赋能中国工业重塑,通信投研汪
2344,2020-03-31,【华西电子孙远峰团队-持续推荐工业富联】2019年业务整体平稳，双轮驱动前景可期,远峰电子
2345,2020-03-31,工业富联2019年总收入4087亿元 净利润186.06亿元,自动化网
2346,2020-03-31,工业富联：已生产2000多万只口罩,上证报
2347,2020-03-31,工业富联：去年净利润增长10% 将紧抓新基建发展机遇,澎湃新闻
2348,2020-03-31,工业富联：2019年净利润同比增长10.08%,Wind
2349,2020-03-31,迪士尼高管全员减薪应对疫情丨特斯拉Model Y搭载新型热泵【Do说】,DoNews
2350,2020-03-31,工业富联去年净利增10% 董事长李军旗：未来将抓住新基建机遇,每日经济新闻
2351,2020-03-31,工业富联董事长：复工复产已恢复到往年的水准|公司问答,第一财经
2352,2020-03-31,工业富联：将分红率从2018年的15.03%提升到21.3%|公司问答,第一财经
2353,2020-03-31,工业富联2019年总收入4087亿元 同比下降1.6% 盈利能力下降,中国网
2354,2020-03-31,2020年报风云丨工业富联2019年净利增长10.08%，复工率恢复至节前水平 高管表态将紧抓“新基建”机遇,21世纪经济报道
2355,2020-03-31,研发投入近百亿，工业富联布局“新基建”,科技日报
2356,2020-03-31,工业富联2019年净利润增长10% 目前产能基本恢复到节前正常水平,21世纪经济报道
2357,2020-03-31,工业富联2019年净利增长10.08%至186.06亿元,资本邦
2358,2020-03-31,工业富联董事长：防疫是一季度的重点 产线已恢复至节前水平,第一财经
2359,2020-03-31,工业富联发布2019年财报：净利润186.06亿元 同比增长10%,新浪
2360,2020-03-31,工业富联复工复产已恢复正常 将紧抓新基建发展机遇,e公司
2361,2020-03-31,[公司]工业富联发布2019年财报：扎根“新基建” 科技服务收入增长亮眼,全景网
2362,2020-03-31,[公司]工业富联：公司仅用三天就实现了口罩自产,全景网
2363,2020-03-31,工业富联董事长李军旗：公司业务覆盖新基建四领域,e公司
2364,2020-03-31,工业富联董事长李军旗：复工复产已基本恢复正常,e公司
2365,2020-03-31,工业富联（601138）财报点评：新基建机遇来临，打开成长天花板,国信研究
2366,2020-03-31,晨会聚焦200331重点关注中设集团、新泉股份、希望教育、中信出版、中国科培、鹏鼎控股、工业富联、拓邦股份、江苏神通、药明生物等,国信研究
2367,2020-03-30,电报|工业富联2019年度云计算营收占比近40%,科创板日报
2368,2020-03-30,电报|工业富联2019年度研发投入近百亿,科创板日报
2369,2020-03-30,订单骤降富士康停招中国普工？他要用成本仅10万的机器人省人工？,搜狐
2370,2020-03-30,工业富联：2019年净利润增长10% 积极布局“新基建”,中证网
2371,2020-03-30,工业富联(601138.SH)2019年度净利润升10.08%至186.06亿元 拟10派2元,格隆汇
2372,2020-03-30,工业富联：2019年净利186亿元 同比增10%,e公司
2373,2020-03-30,工业富联2019年全年营收4087亿元人民币,21世纪经济报道
2374,2020-03-30,工业富联2019年全年营收4087亿元 全年净利润186亿元,新浪
2375,2020-03-30,工信部：华为全面复工 富士康27厂区复工81万人,快科技
2376,2020-03-30,工信部：华为复产率稳定在90% 富士康已复工81万人,腾讯网
2377,2020-03-30,揭秘隐形投资巨头富士康的资本版图,36氪
2378,2020-03-26,美股巨头都扛不住？这只瞬间蒸发1.3万亿，还有37只跌掉10年涨幅,证券时报
2379,2020-03-25,印度全面封锁3周，富士康、纬创相继停工！ 经营问题,国际电子商情
2380,2020-03-25,受新冠病毒疫情影响 富士康和纬创公司暂停印度工厂生产 经营问题,TechWeb
2381,2020-03-25,富士康暂停印度厂区运作，OPPO、小米等印度工厂也停工 经营问题,澎湃新闻
2382,2020-03-25,受新冠病毒影响 富士康暂停印度业务运营 经营问题,TechWeb
2383,2020-03-25,富士康暂停印度业务运作至4月14日 复工时间依政府公告而定 经营问题,每日经济新闻
2384,2020-03-25,【快讯】富士康将暂停印度业务运营，直至4月14日，将根据政府的进一步通知恢复印度业务。 经营问题,金十数据
2385,2020-03-25,富士康暂停印度业务运营，直到4月14日 经营问题,Wind
2386,2020-03-25,富士康开始准备量产iPhone 12？潘九堂：新机量产还很远,快科技
2387,2020-03-24,工业互联网再成网红，如何抓住“牛鼻子”？,Wind
2388,2020-03-24,富士康：我们已经招募足够工人满足苹果季节性需求,猎云网
2389,2020-03-24,富士康已有足够工人 开始准备苹果 iPhone 12/Pro/Max 量产,TechWeb
2390,2020-03-24,外媒称富士康已有足够工人，开始为苹果准备4款iPhone 12量产,中国家电网
2391,2020-03-24,苹果：苹果iPhone生产商富士康员工全线生产。,金十数据
2392,2020-03-24,富士康：已有足够员工上岗，满足中国所有主要工厂的“季节性需求”,Wind
2393,2020-03-24,【快讯】富士康称其已经有足够的员工上岗，来满足中国所有主要工厂的“季节性需求”。,金十数据
2394,2020-03-23,解密主力资金出逃股连续5日净流出729股,证券时报网
2395,2020-03-23,10股主力资金净流入超亿元,证券时报网
2396,2020-03-21,富士康小哥：新人为7000元奖励进厂，两三天就跑了,IT之家
2397,2020-03-20,24股主力资金净流入超亿元,证券时报网
2398,2020-03-19,34股主力资金净流入超亿元,证券时报网
2399,2020-03-19,武汉富士康获复工审批：首批员工已返回园区,观察者网
2400,2020-03-19,工业富联：研发占比2%，去年解决25万人就业，市值已蒸发2000余亿 连续下跌,搜狐
2401,2020-03-18,战“疫”告捷！富士康武汉厂复工获批,国际电子商情
2402,2020-03-17,打赢防疫生产“双线战役”，工业富联为工业企业“保驾护航”,砍柴网
2403,2020-03-17,钟南山当总顾问、最贵入职金加持，富士康为何仍不能全面复工,腾讯网
2404,2020-03-16,富士康砸钱招工保订单，但郭台铭更担心客户销量,腾讯网
2405,2020-03-16,富士康的工业互联网转型之路,亿欧网
2406,2020-03-14,外媒称低价iPhone订单量缩减一半 现在由印度富士康生产,腾讯网
2407,2020-03-13,郭台铭：iPhone中国产量恢复超富士康预期，美国市场令人担忧,腾讯网
2408,2020-03-12,郭台铭：富士康在中国的生产逐步恢复，好于预期,腾讯网
2409,2020-03-12,郭台铭：iPhone复产速度超富士康预期、担心美国消费疲软,快科技
2410,2020-03-11,稀缺！低位科技龙头股仅29只，机构扎堆推荐，多股底部爆量涨停,e公司
2411,2020-03-10,工业富联推出无忧复工App 分享防疫解决方案,e公司
2412,2020-03-10,投资界24h|复工后富士康疯狂抢人；2月VC/PE投资回暖；315晚会确认延期,投资界
2413,2020-03-09,富士康疯狂抢人！工厂老板：300元一天 还是招不到人,新浪
2414,2020-03-09,断货让iPhone11酝酿涨价富士康郑州园区：复工率超80%,快科技
2415,2020-03-08,抗疫时期的工业富联：千里送“氧”，驰援武汉,金融投资网
2416,2020-03-08,富士康郑州园区复工复产率超过80%,Wind
2417,2020-03-08,富士康河南各厂区到岗总人数已达18万 复工复产率超过80%,中证网
2418,2020-03-07,富士康郑州工厂一员工跳楼详情：房门反锁11层阳台跳下,运营商财经网
2419,2020-03-07,富士康河南各厂区18万员工到岗,河南日报
2420,2020-03-06,富士康2月营收创近年新低，急补用工缺口入职一个奖励6750元,第一财经
2421,2020-03-06,外媒：受疫情影响iPhoneSE2量产可能推迟至今年第二季度,金十数据
2422,2020-03-06,富士康2月份营收降至72.6亿美元 创7年来最大月度跌幅 盈利能力下降,DoNews
2423,2020-03-06,iPhone 11售罄缺货？郑州富士康：供应链复工达80%，获客户追单,国际电子商情
2424,2020-03-06,传富士康郑州厂获客户追单，供应链复工达80%,国际电子商情
2425,2020-03-06,富士康面临7年来最大月度降幅 2月营收降至72.8亿美元 盈利能力下降,TechWeb
2426,2020-03-06,富士康2月营收降幅7年最大：全年仍有望正增长,观察者网
2427,2020-03-06,富士康2月份营收降至72.6亿美元，环比暴跌逾40% 盈利能力下降,网易
2428,2020-03-06,疫情严重影响复工，富士康2月营收创7年来最大跌幅 盈利能力下降,腾讯网
2429,2020-03-05,富士康2月营收同比下滑18% 创7年来最大跌幅 盈利能力下降,新浪
2430,2020-03-05,复工产能不足，富士康是否要反思“机器换人”？,和讯
2431,2020-03-05,富士康2月营收同比大降18% 创7年来最大月跌幅 盈利能力下降,凤凰网
2432,2020-03-05,富士康郑州园区一员工坠亡，所在部门为苹果代工iphone,第一财经
2433,2020-03-05,富士康回应郑州一员工坠楼去世：与新冠肺炎无关,澎湃新闻
2434,2020-03-04,口罩价格暴涨超10倍！概念股稀缺，龙头逆袭成大黑马（附名单）,中财网
2435,2020-03-04,传苹果要将部分手机代工订单给比亚迪 富士康要被甩？,运营商财经网
2436,2020-03-04,郑州iPhone生产基地一名工人在厂区外死亡 富士康：很悲伤正协助调查 安全事故,腾讯网
2437,2020-03-04,富士康证实一名员工不幸去世 已协助家属处理后事,新京报
2438,2020-03-04,富士康：Q1消费类电子产品等业务收入将下降15％,Wind
2439,2020-03-04,任天堂 Switch 大规模缺货 富士康工厂紧急接单,中关村在线
2440,2020-03-03,富士康：3月底恢复在华生产 无法预估疫情对业绩的影响,网易
2441,2020-03-03,富士康母公司鸿海集团启动量子计算机项目，台媒：从软件入手,澎湃新闻
2442,2020-03-03,富士康大陆工厂预计3月底前恢复正常生产：半数以上季节工已上岗,快科技
2443,2020-03-03,富士康印度建厂不开心 50亿投资不知道能否收回,运营商财经网
2444,2020-03-03,任天堂Switch持续热销：鸿海获紧急订单，富士康高额奖金招工,IT之家
2445,2020-03-03,富士康深圳龙华科技园有序复工，自制口罩400万只,Wind
2446,2020-03-02,富士康的苹果突击战：最高奖七千抢人，但仍然缺人,新京报
2447,2020-03-02,继富士康后 鸿海日本子公司夏普将生产口罩,新浪
2448,2020-03-02,疫情期口罩销售乱象调查：我们整理了所有的套路,新浪
2449,2020-03-01,新冠病毒造成差旅限制苹果iPhone12筹备工作已推迟,金十数据
2450,2020-02-29,富士康可以开心了 库克暗示苹果公司不会更换代工企业,运营商财经网
2451,2020-02-27,疫情时的富士康：为了复工开出史上最高奖金 工厂包车到村里接人,凤凰网
2452,2020-02-26,富士康聘钟南山任防疫总顾问 日产口罩将超百万只,新京报
2453,2020-02-26,郑州富士康开工率仅10% 2020郑州富士康招聘薪资及奖励政策 新冠肺炎对手机行业影响分析,腾讯网
2454,2020-02-26,近百万员工急待复工 富士康请钟南山做防疫总顾问,21世纪经济报道
2455,2020-02-26,富士康聘请钟南山为复工顾问,格隆汇
2456,2020-02-26,富士康聘请钟南山任复工总顾问，深圳工厂招新每人奖7000元,南都报
2457,2020-02-25,富士康防疫复工两不误,中证网
2458,2020-02-25,钟南山担任富士康防疫及复工总顾问,上证报
2459,2020-02-25,富士康聘钟南山任防疫及复工总顾问 旗下有百万员工,网易
2460,2020-02-25,富士康：聘请钟南山院士担当集团防疫及复工总顾问,Wind
2461,2020-02-25,富士康：聘请钟南山院士担当集团防疫及复工总顾问,e公司
2462,2020-02-25,王国生到国际陆港、郑州机场、富士康调研时强调 疫情挡不住河南对外开放的脚步,河南日报
2463,2020-02-25,郑州富士康开工率仅十分之一：每位工人奖励从3000元提高至5250元,腾讯网
2464,2020-02-25,同益股份：向富士康供应手机等外观件及结构件制造用工程塑料,中证网
2465,2020-02-25,为了iPhone产能，富士康下“血本”了！,国际电子商情
2466,2020-02-25,宁德时代大涨5%，总市值超越海康威视跃居科技股次席,Wind
2467,2020-02-25,王国生到郑州国际陆港郑州机场富士康 检查指导疫情防控复工复产等工作,大河网
2468,2020-02-25,【通信-夏庐生】工业富联：中国智能制造“灯塔”，聚焦5G+工业互联网对外赋能模式,安信证券研究
2469,2020-02-24,深圳富士康奖励新员工最高7110元 上班前隔离包吃住,新京报
2470,2020-02-24,深圳富士康：分批次小范围复工 员工每天发自产口罩,新京报
2471,2020-02-24,美股异动 | 苹果(AAPL.US)盘前跌逾4%，富士康产能不足或致廉价iPhone推迟发布,智通财经
2472,2020-02-24,上岗就发奖金：富士康新员工入职奖励7000元,金融界
2473,2020-02-23,独家电报|郑州富士康新员工入职现金奖励7000元,科创板日报
2474,2020-02-23,一线|复工不足3万人，郑州富士康新员工入职现金奖7000元，河南省出面动员返岗,科创板日报
2475,2020-02-22,疫情导致富士康产能难以恢复，或让苹果狙击安卓手机的愿望落空,新浪
2476,2020-02-22,曝苹果推迟低价 iPhone 9（SE 2） 发布时间，富士康产能不足 50％,IT之家
2477,2020-02-22,外媒称苹果推迟低价iPhone发布时间富士康产能不足50％,金十数据
2478,2020-02-22,深圳富士康部分新入职员工奖励超七千元,IT之家
2479,2020-02-22,外媒称苹果推迟低价iPhone发布时间，富士康产能不足50%,Wind
2480,2020-02-22,苹果已推迟低价新iPhone发布时间 富士康产能不足50％,腾讯网
2481,2020-02-21,砸钱抢人，深圳富士康入职奖励高达7110元,时代周报
2482,2020-02-21,富士康预计疫情将影响全年营收 大陆复工进度会谨慎,新京报
2483,2020-02-21,深圳富士康流水线逐步复产 本地员工为主,澎湃新闻
2484,2020-02-21,富士康产能恢复不足1/5？ 机构提醒疫情或致生产延缓,新京报
2485,2020-02-21,探访深圳龙华区富士康：“渴望”复工新入职员工奖励7120元，自产口罩尚未满足自用,华夏时报
2486,2020-02-21,富士康称中国大陆主要厂区复工进度谨慎 或加剧iPhone供货危机,腾讯网
2487,2020-02-20,电报|富士康：中国大陆主要厂区复工进度谨慎海外厂区营运满载,科创板日报
2488,2020-02-19,实探郑州富士康：4天返厂不足千人 进宿舍要查30天轨迹,中财网
2489,2020-02-18,复工进入抢人模式：福州包大巴接员工返岗 富士康每人发三千奖金,上游新闻
2490,2020-02-17,郑州富士康奖励3000元急招工，组装线“抢人”，iPhone备货能否赶上？,华夏时报
2491,2020-02-17,郑州富士康激励复工，每人3000元！,国际电子商情
2492,2020-02-17,郑州富士康：新招员工须在宿舍隔离7天工资照发,快科技
2493,2020-02-17,郑州富士康向河南省非郑州地区员工发布返厂报到通知,Wind
2494,2020-02-16,复工不顺，富士康急了？,雷锋网
