1495,2020-10-26,【华创计算机王文龙团队】计算机板块短期承压，三季报后为主题投资酝酿时机,蚊子搞科研
1496,2020-10-26,计算机行业周观点：数字货币时代加速到来,新浪
1497,2020-10-26,蚂蚁周四申购 A股迎来市值超万亿金融科技公司,证券时报
1498,2020-10-26,资管行业三大发展趋势 金融科技将是投资的军备竞赛,中国基金报
1499,2020-10-26,蚂蚁集团周四申购 沪指面临下跌压力 关注概念股,证券时报
1500,2020-10-25,蚂蚁集团三大战略深度剖析：从支付工具到数字金融服务体系,新浪
1501,2020-10-25,【民生计算机|周观点】蚂蚁上市在即，C端B端赋能完善金融科技生态圈,MS计算机
1502,2020-10-25,恒生电子开放新一代数字化金融基础设施LIGHT,证券时报
1503,2020-10-24,马云宣布定价已确定！3万亿庞然大物上市对A股影响几何？概念股名单来了,上游新闻
1504,2020-10-24,【兴证计算机】拥抱开源后浪-聚焦“1024”程序员节,兴业计算机团队
1505,2020-10-24,马云宣布一件大事，3年前都不敢想，但奇迹发生了！3万亿庞然大物奔向A股，数据揭秘影响,证券时报
1506,2020-10-23,逆风：证券服务机构信息系统备案，证券IT企业直接受益！,新浪
1507,2020-10-23,方德证券：首个万亿互联网巨头即将上市，你准备好打新了吗,凤凰网
1508,2020-10-23,【申港计算机】周观点：“新四跨”活动总结：车联网行业全面接近前装应用-201101,猫猫王看计算机
1509,2020-10-23,万亿蚂蚁与产业链研究深度：蚂蚁集团—成长、边界、生态,华西证券
1510,2020-10-23,【蚂蚁与产业链研究】PPT（70页）：成长-边界-生态,科技晶选
1511,2020-10-23,36氪首发 | 定位社交型证券经纪服务商，「长桥证券LongBridge」获Pre-A+轮数千万美元融资,36氪
1512,2020-10-23,四箭齐发，易方达投顾全客户类型布局初现,新浪
1513,2020-10-23,银河证券：关注产业物联网以及确定性更强的云计算、金融IT等投资机会（附股）,证券时报网
1514,2020-10-22,10月22日主力资金净流出181亿元,证券时报网
1515,2020-10-22,计算机行业动态报告：三季报业绩预告样本显示行业持续反弹,新浪
1516,2020-10-22,蚂蚁集团IPO进入倒计时 蚂蚁集团概念股闻风大涨(附股),至诚财经
1517,2020-10-22,688688！蚂蚁集团A股打新规模约200亿，概念股逆市走强丨牛熊眼,第一财经
1518,2020-10-22,蚂蚁集团发行时间表敲定 概念股逆势活跃，易联众等大涨,证券时报网
1519,2020-10-22,蚂蚁集团来了，靴子落地？对市场将产生哪些影响？,证券时报网
1520,2020-10-22,蚂蚁集团上市利好哪些股票?,财富动力网
1521,2020-10-22,试点一年 基金投顾业务渐入佳境,财富动力网
1522,2020-10-21,小米值多少钱？（附测算）,半导体风向标
1523,2020-10-21,Copy To China，企业创业到股票投资,新浪
1524,2020-10-21,晨会聚焦201021重点关注9月快递数据、医药政策、建龙微纳、新洋丰,国信研究
1525,2020-10-20,【浙商策略】以史为鉴，人民币升值期间的外资流入情况 | A股市场策略周报,王杨策略研究
1526,2020-10-20,晨会聚焦201020重点关注阳光城、拓邦股份、工业机器人行业、京东数科、拓普集团、兆驰股份、华润微,国信研究
1527,2020-10-20,银河基金7只混基单月跌幅超7% 明星基金经理光环掉色,中国经济网
1528,2020-10-20,【计算机】信创进程将提速——计算机行业周报——看好,渤海证券研究
1529,2020-10-19,计算机行业周观点：中央政治局集体学习量子科技 深圳数字货币红包投入使用,新浪
1530,2020-10-19,计算机行业周报：信创进程将提速,渤海证券
1531,2020-10-19,971亿主力资金近三日撤出全A(等权)概念股,证券时报网
1532,2020-10-19,计算机行业周报：财报季布局宜着眼中长期收益 淡化板块短期预期,广发证券
1533,2020-10-19,为柯桥高质量发展增添新动能！恒生凤凰数字经济产业园二期开工仪式举行,全球纺织网
1534,2020-10-19,晨会聚焦201019重点关注国防军工、医药行业、深科技,国信研究
1535,2020-10-18,【民生计算机|周观点】三季度业绩有望持续改善，金融IT、云表现亮眼,MS计算机
1536,2020-10-17,一周基金热评：2020.10.9-10.16,新浪
1537,2020-10-16,北向资金本周净买入超百亿，34股上榜成交活跃榜,证券时报
1538,2020-10-16,恒生百川完成8044万人民币战略投资融资,亿邦动力
1539,2020-10-16,高校兼职和灵活用工平台青团社完成战略投资融资,亿邦动力
1540,2020-10-16,59股今日获机构买入评级,证券时报网
1541,2020-10-16,1005亿主力资金近三日撤出全A(等权)概念股,证券时报网
1542,2020-10-16,易方达投顾签约恒生电子,中国网
1543,2020-10-16,晨会聚焦201016重点关注计算机、美国四大行三季报、安踏体育,国信研究
1544,2020-10-16,信易搜母公司：信用算力入选2020年银行科技服务商TOP30榜单,凤凰网
1545,2020-10-16,北向资金继续出逃，但净买入这只个股逾11亿元,21世纪经济报道
1546,2020-10-16,9股获融资净买入额超亿元 金龙鱼居首,证券时报网
1547,2020-10-16,杠杆资金大幅加仓股曝光 澄星股份买入占比高达40.83%,e公司
1548,2020-10-16,A股融资融券日报：两融余额增加30.9亿元（10月15日）,Wind
1549,2020-10-16,A股早报2020年10月16日星期五,Wind
1550,2020-10-16,【早间资讯】2020-10-16,大通证券投教基地
1551,2020-10-16,股海导航 10月16日沪深股市公告提示,新浪
1552,2020-10-16,趋势巡航：期指交割能否带来惊喜,金融界
1553,2020-10-16,北向资金动向盘点：持续加仓“电动车”，发掘“银行”,Wind
1554,2020-10-16,易方达投顾签约上市公司客户,新浪
1555,2020-10-15,周五最新重磅公司新闻集锦(10月16日),证券之星
1556,2020-10-15,【收盘简评】2020-10-15,赢家之星
1557,2020-10-15,今日27只个股主力资金净流入超亿元 金龙鱼净流入居首,第一财经
1558,2020-10-15,【华西计算机】恒生电子｜2020Q3点评：合同负债大增超预期，全年业绩极具确定性,科技晶选
1559,2020-10-15,10月15日北向资金成交活跃股名单,证券时报网
1560,2020-10-15,晚间重要公告2020年10月15日星期四,Wind
1561,2020-10-15,【主力资金】超20亿资金杀入这只股，机构却悄悄跑路,证券时报网
1562,2020-10-15,【公告抢先看】晚间重要公告：科创板首份三季报出炉、华夏航空拟向中国商飞购买和接收100架ARJ21等系列飞机,金融界
1563,2020-10-15,主力资金撤离医药生物行业，北向资金持续加仓格力电器,证券时报网
1564,2020-10-15,公告点题｜10月15日这些公告有看头,第一财经
1565,2020-10-15,恒生电子：拟收购恒生百川48.91%股权,Wind
1566,2020-10-15,恒生电子：拟收购恒生百川48.91%股权,e公司
1567,2020-10-15,恒生电子(600570.SH)旗下投资平台拟对弧途科技进行投资,格隆汇
1568,2020-10-15,恒生电子(600570.SH)拟与恒生云投资合计受让恒生百川48.9117%股权,格隆汇
1569,2020-10-15,北向资金净流出3.32亿元 净卖出恒生电子3.51亿元,上游新闻
1570,2020-10-15,北上资金今日净买入格力电器11.84亿元、招商银行5.94亿,--
1571,2020-10-15,这家公司三季报业绩预增逾34倍，北向资金大幅买入，尾盘强势涨停（附股）,21世纪经济报道
1572,2020-10-15,北向资金净流出3.33亿 恒生电子被净卖出3.51亿,e公司
1573,2020-10-15,北向资金小幅净流出3.33亿元，格力电器连续获外资大幅加仓,Wind
1574,2020-10-15,市场要闻丨多家券商系统卡单，原来耽误我赚钱的是深交所？,微博
1575,2020-10-15,908亿主力资金近三日撤出全A(等权)概念股,证券时报网
1576,2020-10-15,外资小幅流出：金龙鱼市值冲入前三 24亿资金买入银行股,新浪
1577,2020-10-15,736亿资金争夺20股：主力资金重点出击8股(名单),新浪
1578,2020-10-15,投资者称股市交易卡单，深交所致歉，恒生电子躺枪,第一财经
1579,2020-10-15,今早多个交易系统出现卡单！深交所致歉：已恢复正常,环球外汇网
1580,2020-10-15,深交所确认今日早上系统出现故障 券商人士：早市深市下单后结果返回曾出现短时卡顿,每日经济新闻
1581,2020-10-15,外资小幅流入：22亿主力买入银行股 恒生电子遭卖出超6亿,新浪
1582,2020-10-15,解盘：金融拉指数，半导体、新能源汽车、卫星互联网略涨,Wind
1583,2020-10-15,恒生电子放量暴跌 是中国领先的金融交易软件供应商,新浪
1584,2020-10-15,蚂蚁金服概念股多数下滑，恒生电子、君正集团跌超4%,Wind
1585,2020-10-15,晨会聚焦201015重点关注非金属建材行业、基础化工行业、机械行业、创新药盘点、华天科技、中公教育,国信研究
1586,2020-10-15,美美证券大涨36.73% 刚与亨达海天签署咨询服务协议,上游新闻
1587,2020-10-15,债基踩雷，基金公司动用自有资金接盘,证券时报
1588,2020-10-15,债基踩雷康得新 新华基金竟开始动用自有资金接盘,新浪
1589,2020-10-15,债基踩雷 基金公司动用自有资金接盘,证券时报
1590,2020-10-14,风雨同路 共铸辉煌,期货日报
1591,2020-10-14,1只个股尾盘净流入资金超亿元,证券时报网
1592,2020-10-14,考虑了良久，为何定投选择了科技50策略指数？,养基司令
1593,2020-10-14,晨会聚焦201014重点关注丽人丽妆、交运行业、纺织服装、证券行业、有色行业、汽车行业,国信研究
1594,2020-10-14,卓胜微：超预期（附点评）,半导体风向标
1595,2020-10-14,9月份超九成混基亏损 农银汇理长盛重仓新能源领涨 亏损,中国经济网
1596,2020-10-13,把握第三次科技迭代机遇 华夏科技龙头蓄势待发,中国证券网
1597,2020-10-13,恒生电子收到《民事判决书》，原告远方信息的上诉请求与理由均不能成立 诉讼纠纷,资本邦
1598,2020-10-13,晨会聚焦201013重点关注铜行业、安恒信息、卓胜微、国瓷材料、回天新材、珀莱雅、扬杰科技、捷捷微电,国信研究
1599,2020-10-13,【计算机】金融科技迎政策利好，四季度建议重点关注——计算机行业周报——看好,渤海证券研究
1600,2020-10-12,计算机行业三季报日历,半导体风向标
1601,2020-10-12,国家金融科技认证中心落地，三大独角兽准备上市，把握龙头机会,第一财经
1602,2020-10-12,计算机行业周报：数字货币、自动驾驶等出现积极信号 市场风险偏好回升,新浪
1603,2020-10-12,恒生电子方晓明：要通过科技让数据在投资中的价值真正发挥出来,中证网
1604,2020-10-12,金融科技视角下的TOB企业服务,中信建投非银金融研究
1605,2020-10-12,【华创计算机王文龙团队】数字货币、自动驾驶等出现积极信号，市场风险偏好回升,蚊子搞科研
1606,2020-10-12,A股上市公司理财变局：理财规模连降 结构性存款、信托受热捧,中国经营报
1607,2020-10-12,任泽平解码蚂蚁：如何成为全球最大独角兽,泽平宏观
1608,2020-10-12,任泽平解码蚂蚁：如何成为全球最大独角兽,金融界
1609,2020-10-12,盘前情报丨三季报行情要来了；数字货币迎重磅利好，概念股曝光,21世纪经济报道
1610,2020-10-12,数字货币概念股有这些 机构看好,证券时报网
1611,2020-10-12,易方达华夏输出投顾策略 加大与销售渠道合作,中国基金报
1612,2020-10-12,蚂蚁+DCEP演绎金融科技双主线,财富动力网
1613,2020-10-11,【兴证计算机】工业软件：政策与产业共振，国产厂商空间广阔,兴业计算机团队
1614,2020-10-11,三季报日历 l 一张图（电子）,半导体风向标
1615,2020-10-10,计算机行业研究：资本市场地位再提升 金融IT领军Q3业绩或加速,新浪
1616,2020-10-10,【兴证计算机】智能汽车：鲶鱼搅动的一池春水,兴业计算机团队
1617,2020-10-10,计算机行业动态分析：计算机板块三季报业绩前瞻,新浪
1618,2020-10-09,恒生电子总裁刘曙峰：正处数字化下半场 未来十年资管迎大变局,新浪
1619,2020-10-09,【兴证计算机】2021年投资策略：以静制动，聚焦计算机强规模效应龙头,兴业计算机团队
1620,2020-10-09,强势股追踪主力资金连续5日净流入85股,证券时报网
1621,2020-10-09,晨会聚焦201009重点关注医药生物、上海家化,国信研究
1622,2020-10-06,史上十大牛股，茅台只排第三！（附名单）,中证报
1623,2020-10-06,史上十大牛股，茅台只排第三！来见识一下，什么叫做“历史的进程”,中证报
1624,2020-09-30,每日研报干货专享：市场仍将维持弱势震荡格局,搜狐
1625,2020-09-30,2020年Q3基金TOP榜，老面孔褪去，新面孔登台,基尔摩斯
1626,2020-09-30,恒生电子刘曙峰：金融机构如何迎接数字化浪潮,经济观察网
1627,2020-09-30,计算机行业周报：“外滩大会”召开 持续关注金融科技,渤海证券
1628,2020-09-30,银河证券计算机行业四季度策略：切换到“塑长板”业绩驱动,第一财经
1629,2020-09-29,恒生电子今日大宗交易成交13万股，成交价88.59元折价10.0%,Wind
1630,2020-09-29,恒生电子(600570.SH)：董事蒋建圣减持期过半累计减持18万股 减持股份,格隆汇
1631,2020-09-29,恒生电子：董事蒋建圣累计减持0.02%股份 减持股份,Wind
1632,2020-09-29,晨会聚焦200929重点关注第三方独立医学实验室（ICL）专题、投资商业银行二级资本债,国信研究
1633,2020-09-29,【计算机】“外滩大会”召开，持续关注金融科技——计算机行业周报——看好,渤海证券研究
1634,2020-09-28,恒生电子现1笔大宗交易 共成交989.80万元,新浪
1635,2020-09-28,【西南海外】2020 INCLUSION-外滩大会 会议纪要,西南海外编年史
1636,2020-09-28,资本市场供需结构调整 财富资管行业如何平衡“速度与初心”？,每日经济新闻
1637,2020-09-27,计算机行业周报：从蚂蚁外滩大会看FINTECH“云库链智”趋势,新浪
1638,2020-09-27,交银理财副总裁张秦华：信息化建设是理财公司竞争力的关键,中国金融新闻网
1639,2020-09-27,兴业银行财富业务中心总经理王海青：客户价值是资管核心竞争力,中国金融新闻网
1640,2020-09-27,恒生电子总裁刘曙峰：中国财富资产管理黄金新十年 关键变量是数字化,证券时报
1641,2020-09-27,计算机行业研究周报：“云、库、链”技术风起 看好金融科技持续落地,新浪
1642,2020-09-27,中环股份：布局大硅片,半导体风向标
1643,2020-09-27,计算机行业周报：哪些趋势？外滩大会与华为全联接大会,新浪
1644,2020-09-26,平安基金四季度策略报告：短期砥砺蓄势，长期风景独好,平安基金
1645,2020-09-26,业绩不彰商誉压顶 高伟达再募4.5亿元扩张,中国经营报
1646,2020-09-25,信息数字化推动资管行业转型，提升金融科技竞争力将是持久战,澎湃新闻
1647,2020-09-25,恒生电子刘曙峰：没有数据沉淀 无法让AI模型有用武之地,第一财经
1648,2020-09-25,【民生计算机|周观点】赋能金融+融合B端，看好蚂蚁Fintech生态发展,MS计算机
1649,2020-09-25,恒生电子发布资产管理一站式解决方案O45,中证网
1650,2020-09-25,交银理财副总裁张秦华：理财子公司发展速度超预期,新浪
1651,2020-09-25,晨会聚焦200925重点关注海外、旗滨集团、科锐国际,国信研究
1652,2020-09-25,过去、现在和未来：上海需要具有全球影响力的金融科技生态圈,上观
1653,2020-09-25,41股获北向资金加仓超3000万元,证券时报网
1654,2020-09-25,机构看好这9只超跌人工智能股,证券时报网
1655,2020-09-25,人工智能大会即将开幕：万亿板块起航，多只龙头股回调超40%,新浪
1656,2020-09-25,终于回复问询函 湘财收购大智慧15%股权成功在即？ 问询,证券时报
1657,2020-09-25,延期了三次，哈高科终于回复收购大智慧问询函，需借款13亿，一年利息超亿元 问询,券商中国
1658,2020-09-24,广州开发区金控与多家银行达成900亿元战略合作,上证报
1659,2020-09-24,阿里云参与构建恒生证券交易系统 每秒交易委托次数创行业纪录,电商报
1660,2020-09-24,晨会聚焦200924重点关注固定收益,国信研究
1661,2020-09-23,阿里云参与构建恒生分布式证券核心交易系统 可助力单一券商服务1亿股民,中国电子银行网
1662,2020-09-23,阿里云参与构建恒生分布式证券核心交易系统 可将交易峰值提升10倍以上,金融界
1663,2020-09-23,晨会聚焦200923重点关注大炼化行业、半导体行业、银行业,国信研究
1664,2020-09-23,混合型基金：长线布局消费、医药、科技板块 提前迅速建仓获取超额收益,面包财经
1665,2020-09-22,晨会聚焦200922重点关注半导体行业、韵达股份、奕瑞科技,国信研究
1666,2020-09-22,因为相信，所以看见|西湖大学发展分享会暨第七届西溪全球论坛ICT产业峰会圆满举办,投资者网
1667,2020-09-22,国泰基金饶玉涵：追寻“阿尔法”个股，把控“黑天鹅”风险,和讯
1668,2020-09-22,计算机行业周报：二季度云市场延续强劲增长 看好重点细分领域,新浪
1669,2020-09-21,【东兴计算机】金山办公（688111）：中期2000亿市值，中长期3000亿市值成长逻辑,王者计算机
1670,2020-09-21,ROE差异榜:警惕新城控股高ROE陷阱 永辉超市孵化超级物种亏损出表 亏损,新浪
1671,2020-09-21,ROE差异榜:美的、恒生电子存差异 京东方、神火股份盈利存水分？,新浪
1672,2020-09-21,鹏鼎电话会议（9月情况）,半导体风向标
1673,2020-09-21,又一大公司测试数字货币应用，产业链细分领域受益丨牛熊眼,第一财经
1674,2020-09-21,计算机行业周观点：阿里发布工业大脑3.0 国家网络安全宣传周举办,新浪
1675,2020-09-21,2020 恒生 LIGHT 开发者大会，早鸟票限时开售,TechWeb
1676,2020-09-21,卡方科技获数千万元B轮融资，由广发信德领投,投中网
1677,2020-09-21,晨会聚焦200921重点关注PDF行业、医药行业、安车检测、券商,国信研究
1678,2020-09-21,计算机行业周报：电子票据系统建设进入高峰期 订单明显增长,国海证券
1679,2020-09-21,算法交易服务商卡方科技B轮融资数千万 广发信德领投,猎云网
1680,2020-09-21,数字货币真要来了？引爆万亿市场，概念股名单曝光,证券时报
1681,2020-09-21,招商银行牵手易方达投顾 推出全国首个金融机构基金投顾服务平台,新浪
1682,2020-09-21,数字货币真要来了？引爆万亿市场 概念股名单曝光,证券时报
1683,2020-09-21,官宣！数字货币真要来了？央行主管媒体：具备落地条件！万亿市场或将引爆，概念股名单曝光,证券时报
1684,2020-09-20,传媒一周观点：持续提示的后疫情板块表现较强 关注Q3业绩兑现,新浪
1685,2020-09-19,【华创计算机王文龙团队】外部冲击释放到位，三季报复苏节奏、年度估值切换、集中招投标叠加带来机会,蚊子搞科研
1686,2020-09-19,安信证券：阿里云进入2.0时代，有望开创全新云计算形态,证券时报网
1687,2020-09-19,计算机行业：二季度业绩显著回暖 费用率稳中有降,财富动力网
1688,2020-09-19,科技板块再度走强 三大新兴技术领域爆发在即,金融投资报
1689,2020-09-18,北上资金本周净买入108.32亿元,证券时报网
1690,2020-09-18,上市公司热衷理财 481家公司半年间花1500亿元买理财产品,新浪
1691,2020-09-18,"恒生电子现1笔大宗交易 共成交7,969.50万元",新浪
1692,2020-09-18,399亿主力资金近三日撤出全A(等权)概念股,证券时报网
1693,2020-09-18,计算机行业2020半年报综述：Q2业绩显著回暖 费用率稳中有降,新浪
1694,2020-09-18,晨会聚焦200918重点关注基础化工行业,国信研究
1695,2020-09-18,36氪首发 | 定位算法交易服务商，「卡方科技」获数千万元B轮融资,36氪
1696,2020-09-17,国常会提出推动油气基础设施开放 Oculus新一代VR设备面世丨明日主题前瞻,第一财经
1697,2020-09-17,数字中国建设峰会下月举行 机构：未来十年产业新增空间超4万亿丨牛熊眼,第一财经
1698,2020-09-17,刚刚，这一板块点位创2年半新高，千亿龙头股封涨停,证券时报网
1699,2020-09-17,600亿主力资金近三日撤出全A(等权)概念股,证券时报网
1700,2020-09-17,市场有一个危险的信号,中财网
1701,2020-09-16,【收盘简评】2020-09-16,赢家之星
1702,2020-09-16,北上资金净买入7.42亿元宁德时代净买入居首,证券时报网
1703,2020-09-16,恒生电子(600570)：业绩企稳回升 有待释放,新浪
1704,2020-09-16,【主力资金】尾盘主力悄悄抛售多晶硅概念龙头，出逃资金近亿元 股票卖空,证券时报网
1705,2020-09-16,17股特大单净流入资金超1亿元,证券时报网
1706,2020-09-16,数据复盘| 52亿主力资金撤离医药生物行业 北向资金连续2日净流入,证券时报
1707,2020-09-16,2019年中联百强榜出炉 “创转升”驱动制造业上市公司更强劲表现,中国发展网
1708,2020-09-16,21股主力资金净流入超亿元,证券时报网
1709,2020-09-16,主力资金连续13天净流出,证券时报网
1710,2020-09-16,510亿主力资金近三日撤出全A(等权)概念股,证券时报网
1711,2020-09-16,主力资金重点出击6股(名单),中财网
1712,2020-09-16,晨会聚焦200916重点关注传媒互联网、纺织服装、游戏行业,国信研究
1713,2020-09-15,晨会聚焦200915重点关注道通科技、华工科技,国信研究
1714,2020-09-15,9月15日主力资金净流出106亿元,证券时报网
1715,2020-09-15,东芯半导体拟冲刺科创板：四大募投项目披露 实控人“长袖善舞”,新浪
1716,2020-09-15,冲击3连板，这只“妖股”半日换手率超50%！机构重仓股分化，创业板这一特征值得警惕,Wind
1717,2020-09-15,蚂蚁上市在即提振行业发展，支付与金融科技将成A股重要力量,雪球
1718,2020-09-15,【计算机】行业估值有所回调，关注龙头地位巩固、行业前景向好的标的——计算机行业周报——看好,渤海证券研究
1719,2020-09-14,第三代半导体 | 一张图,半导体风向标
1720,2020-09-14,区块链行业动态追踪报告：各地政务应用持续推进,新浪
1721,2020-09-14,计算机行业二季度业绩改善明显，下半年重点关注这些个股,第一财经
1722,2020-09-14,计算机行业周报：云计算市场回暖 关注高景气板块,国海证券
1723,2020-09-14,A股300 余公司掘金超万亿新基建 半年营收2.65 万亿预收款同比增680 亿,长江商报
1724,2020-09-13,计算机行业周报：计算机进入合理估值阶段了吗？,新浪
1725,2020-09-11,大赚3000亿！2.6万亿社保基金成绩单来了：收益率超14%，重仓这些绩优股（名单）,中国基金报
1726,2020-09-11,计算机行业第四季度投资策略报告：科技新时代，关注细分行业龙头,渤海证券
1727,2020-09-11,2020年主板申报上市 粤开证券计划3至5年跻身行业前二十,证券时报网
1728,2020-09-11,2022年主板申报上市 粤开证券计划3至5年跻身行业前二十,证券时报网
1729,2020-09-10,恒生电子：加速扩张,半导体风向标
1730,2020-09-10,通信计算机行业中报总结：通信行业持续向好发展 计算机板块经营质量维持,新浪
1731,2020-09-10,计算机行业动态报告：非零基式增长 SALESFORCE奠定全球SAAS标杆地位,新浪
1732,2020-09-10,粤开证券聚焦区域优势谋发展,中证报
1733,2020-09-10,粤开证券聚焦区域优势谋发展,上证报
1734,2020-09-10,节奏加快！三天两家大券商上线产品，有何新特点?,中国基金报
1735,2020-09-10,8月份国联安2只权益基金跌超9% 重仓科技股悲催了,中国经济网
1736,2020-09-10,安集：国产替代加速,半导体风向标
1737,2020-09-09,计算机行业：一季度业绩同比下滑 二季度改善明显 盈利能力下降,财富动力网
1738,2020-09-08,计算机行业2020年中报业绩综述：2020H1业绩同比下滑 Q2明显改善,渤海证券
1739,2020-09-08,TMT板块2020Q2财报分析：关注线上化持续和终端需求改善,中信证券
1740,2020-09-08,云计算专题报告：SaaS，计算机中的消费股,新浪
1741,2020-09-08,兑吧（1753.HK）：加速渗透金融行业，静待SaaS业务驱动估值切换,YY港股圈
1742,2020-09-08,福昕软件：百页重磅！,半导体风向标
1743,2020-09-08,Analytics Zoo助力腾讯云提升智能钛机器学习平台性能,和讯
1744,2020-09-08,万达信息：国寿拟大额增持,半导体风向标
1745,2020-09-08,中国债券市场开放加码，恒生电子旗下子公司推债券全球发行技术平台,凤凰网
1746,2020-09-08,科技创新转型步入正轨，美股上市公司希伯伦科技宣布更名宁圣国际 业务变化,凤凰网
1747,2020-09-08,计算机行业周观点：银联发布首款数字银行卡 华为云发布实时数仓,新浪
