4075,2019-04-25,信息科技：持仓更加分散 荐12股,和讯
4076,2019-04-25,25日公司新闻聚焦：罗欣药业拟75亿借壳东音股份,证券时报网
4077,2019-04-25,中信证券：坚定看好计算机配置价值，云+AI+安全将成三大方向,证券时报网
4078,2019-04-25,25日最新公告透露利好 14只个股有潜力,中金在线
4079,2019-04-25,计算机｜坚定看好配置价值，云+AI+安全将成三大方向,中信证券研究
4080,2019-04-25,"2019q1公募基金计算机板块持仓跟踪:持仓比例上升0.72个百分点,集中度明显下降",光大证券
4081,2019-04-24,A股头条之上市公司公告精选（4.25）,金融界
4082,2019-04-24,恒生电子(600570.SH)一季度净利润升593.66%至3.98亿元,格隆汇
4083,2019-04-24,恒生电子：一季度净利3.98亿元 同比增长约6倍,e公司
4084,2019-04-24,恒生电子：一季度净利润同比增593.66%,Wind
4085,2019-04-24,04月24日 65只股票封板 电信运营板块涨幅最大,每日经济新闻
4086,2019-04-24,沪指V形反转创业板指涨超2% 北向资金全天净流出近30亿元,金融界
4087,2019-04-24,两融余额六连增 逼近万亿元关口,中证报
4088,2019-04-23,晨会0423｜生猪养殖大幅增配,中信证券研究
4089,2019-04-23,计算机｜Zoom对于企业SaaS服务的启示：全环境云融合，聚焦移动互联营销,中信证券研究
4090,2019-04-22,平安证券：计算机行业重点关注处于高景气期或产业拐点的细分领域,证券时报网
4091,2019-04-22,上交所“22问”，能否揭开大智慧扣非连亏7年的原因？ 亏损,第一财经
4092,2019-04-22,今日上市公司重磅新闻全览,中财网
4093,2019-04-22,基金公司布局科技通信类ETF,中国基金报
4094,2019-04-22,3200点拉锯战酝酿变盘 从三大数据探寻多头主力新动向,证券日报
4095,2019-04-20,大智慧净利润连续7年为负，上交所下发“22问”年报问询函 问询,第一财经
4096,2019-04-19,巡市 |科大讯飞五成利润靠政府补助 成了长不大的“巨婴”,腾讯网
4097,2019-04-19,【朝闻国盛0419】拉卡拉上市，关注中美市场新股行情,国盛证券研究所
4098,2019-04-18,资金入市井喷！两融余额再近万亿 信用账户新增开户暴增308%,21世纪经济报道
4099,2019-04-18,信息科技：从UCLOUD财务数据拆解IAAS黑箱 荐10股,和讯
4100,2019-04-18,“实时行情”提供商 恒生电子宣布直连纳斯达克,中金在线
4101,2019-04-18,信息科技：拉卡拉独立上市 荐19股,国盛证券
4102,2019-04-18,新华系基金“股债全线齐升” 出手前瞻布局 年内8只收益超30%,投资者网
4103,2019-04-17,最赚钱一季度 9只基金收益率超50%,中国经济网
4104,2019-04-17,【广证恒生电子】深度报告-[立讯精密]（002475）-多业务齐发力，打造商业模式新生态,广证恒生
4105,2019-04-17,【广证恒生电子】深度报告-[立讯精密]（002475）-业绩高增长，看好公司商业模式新生态,广证恒生
4106,2019-04-16,华创证券：持续看好金融IT及自主可控（附股）,证券时报网
4107,2019-04-16,1484家公司披露一季报业绩预告 逾5成预喜股扎堆银行等四行业,证券日报
4108,2019-04-15,孔明直播：《4月15日热点信息+个股公告》,中金在线
4109,2019-04-14,【国君计算机】科创系列 | 柏楚电子：中低功率激光切割控制系统龙头,计墨社
4110,2019-04-14,社融超预期，券商股回调——非银金融行业周报20190414,湘怀看非银
4111,2019-04-13,257只社保重仓股被券商看好 11只个股成两类机构“香饽饽”,证券日报
4112,2019-04-13,298只社保持仓股今年以来浮盈305.81亿 12只标的股贡献高,证券日报
4113,2019-04-12,海天瑞声七成员工是“技术党”，BAT都是大客户，现在要上科创板,IPO日报
4114,2019-04-12,"恒生电子:经营改善强劲,下游需求叠出符合预期",广发证券
4115,2019-04-12,"计算机行业周报:首批区块链备案名单出台,科创板迎计算机公司",正点财经
4116,2019-04-12,"恒生电子深度报告:三大“飞轮”共驱业绩,研发创新引领未来",渤海证券
4117,2019-04-12,增逾两成，1178家公司去年研发费用达3846亿,中证报
4118,2019-04-11,收评：沪股通净流出14.73亿 深股通净流出22.15亿,新浪
4119,2019-04-10,【国君计算机】科创系列 | 安博通：国内领先网络安全产品和服务提供商,计墨社
4120,2019-04-10,11日机构强推买入 六股成摇钱树,中财网
4121,2019-04-10,信息科技：MOM新规对金融IT影响的定性和定量分析 荐2股,和讯
4122,2019-04-10,信息科技：金融与科技融合趋势明显 荐11股,和讯
4123,2019-04-10,"华泰证券：将恒生电子评级调低为""增持""",Wind
4124,2019-04-10,两融余额超9600亿再创新高 融资客追捧化工有色等周期类股,证券日报
4125,2019-04-10,287家公司研发占比超高新技术企业门槛 机构调研30只潜力股,证券日报
4126,2019-04-10,439股一季度业绩预喜股价亮眼投资者该如何布局？,上游新闻
4127,2019-04-10,恒生电子：六届二十七次董事会决议公告,上交所
4128,2019-04-09,马云、雷军现身两家科创板受理企业 已问询企业总数升至15家,e公司
4129,2019-04-09,以海外科技公司为例分析算法、云计算公司的估值方法,建投海外研究
4130,2019-04-09,云SaaS龙头受益于云化趋势，云业务核心指标正复制海外巨头成长之路,建投海外研究
4131,2019-04-09,恒生电子股价大跌5.05%,中金在线
4132,2019-04-09,应收账款是净利5倍，多家子公司离奇亏损，中科软离上市还有多远？ 亏损,财经网
4133,2019-04-09,信息科技：业绩真空期关注政策利好驱动 荐4股,和讯
4134,2019-04-09,因为这个变化，有公司靠“炒股”业绩暴增30倍！新会计准则的影响到底有多大？,Wind
4135,2019-04-09,信息科技：关注景气度确定与边际预期改善细分领域,和讯
4136,2019-04-09,信息科技：持续看好信息领域 荐3股,和讯
4137,2019-04-09,秘诀！熬出大牛股，A股史上百倍牛股的成长逻辑！,中财网
4138,2019-04-08,【国君计算机】科创系列 | 中科星图：GEOVIS核心技术驱动，军民业务融合发展,计墨社
4139,2019-04-08,【国君计算机】科创系列 | 鸿泉物联:卡位无人驾驶，深耕智能物联---科创板受理鸿泉物联分析,计墨社
4140,2019-04-08,恒生电子：一季度业绩大增，全年高增可期,证券时报网
4141,2019-04-08,信息科技：AI不断取得突破 荐4股,和讯
4142,2019-04-08,分级基金合并细节最终落地 持有人需关注折溢价等因素,天天基金网
4143,2019-04-08,【个股公告】今日公布重磅利好,金元证券指定乾坤
4144,2019-04-08,8日公司新闻聚焦：多家公司一季度业绩预喜,证券时报网
4145,2019-04-08,一季报首枪打响！强力新材股东数大增2.62倍 多家业绩增幅超5倍公司炒股收益大,中证报
4146,2019-04-08,计算机 | 自动驾驶最新产品技术集中亮相，产业进入加速发展阶段,中信建投证券研究
4147,2019-04-08,本周操盘攻略：季报年报齐上阵，3月宏观数据揭晓,Wind
4148,2019-04-07,观点 | 数字政府建设提速，集约统一利于龙头布局（中银计算机周报0407）,一计之长
4149,2019-04-07,【国君计算机】周观点：5G商用与政策落地共驱智能网联汽车产业发展,计墨社
4150,2019-04-07,【天风计算机】周观点：车联网V2X的价值演绎才刚刚开始，长线机会中关注医疗IT的业绩兑现,微信
4151,2019-04-06,恒生电子：控股股东恒生集团股权变更已完成工商变更登记手续 控制人变化,TechWeb
4152,2019-04-05,周五最新重磅公司传闻集锦(4月05日),证券之星
4153,2019-04-04,公告精选：贵州茅台一季度净利预增约30%；中船集团旗下两公司重组方案出炉,e公司
4154,2019-04-04,公告精选：中国银行拟发行优先股募资不超过1000亿元；万达信息获中国人寿增持3.98%股份；华大基因收入核算不规范收到监管函,每日经济新闻
4155,2019-04-04,４月4日晚间上市公司十大重磅公告,巨丰财经
4156,2019-04-04,晚间上市公司公告集锦(更新中)：外高桥4涨停提示风险,腾讯网
4157,2019-04-04,恒生电子(600570.SH)：恒生集团股权结构变更完成 公司控股股东和实控人未变,格隆汇
4158,2019-04-04,恒生电子：控股股东股权结构变更完成,Wind
4159,2019-04-04,恒生电子：一季度净利同比预增579.98%-622.7%,证券时报网
4160,2019-04-04,恒生电子：预计一季度净利3.9亿-4.15亿，同比增长六倍左右,Wind
4161,2019-04-04,五大券商节后看好6板块47股,证券之星
4162,2019-04-04,上市公司炒股热潮：有捕获3倍牛股 有狂买54只票,每经网
4163,2019-04-04,年内第8只分级基金触发上折,证券时报
4164,2019-04-04,沪指强势站上3200点 四个交易日北上资金合计净流入逾193亿,证券日报
4165,2019-04-03,【兴证计算机】为什么我们看好工业软件-三维度深度剖析,兴业计算机团队
4166,2019-04-03,恒生电子：公司及控股子公司均未研发、销售任何配资软件,Wind
4167,2019-04-03,信息科技：外资控股券商获批 荐3股,和讯
4168,2019-04-03,恒生电子(600570.SH)：公司并未研发及销售配资软件,格隆汇
4169,2019-04-03,恒生电子：目前公司及控股子公司均未研发、销售任何配资软件,e公司
4170,2019-04-03,午间公告：中国平安拟减持云南白药不超3%股份 减持股份,Wind
4171,2019-04-03,招商策略：主题市场热度延续 确定性+弹性双线布局,金融界
4172,2019-04-03,先科蓝后恒生，蚂蚁金服持续加码传统金融toB服务,证券之星
4173,2019-04-03,恒生电子：扣非增速亮眼 业绩增长确定性强,证券时报网
4174,2019-04-03,沪指开盘跌0.56% 交通银行跌2.71%,腾讯网
4175,2019-04-03,【晨观方正】保险行业2018年报综述：无畏短期投资扰动，结构优化助增价值，2019蓄势待发,方正证券研究
4176,2019-04-03,"恒生电子:内部管理提升、外部双轮驱动,走上生态化扩张之路",国金证券
4177,2019-04-03,"计算机行业:投哪些,弃哪些轻松“估值洼地”",申万宏源
4178,2019-04-02,兴证·私募与企业部今日推荐汇总-2019.4.2,A股组合投资策略
4179,2019-04-02,只差3亿：宇宙行VS零售之王，基金销售谁是老大？,每日经济新闻
4180,2019-04-02,沪港通十大成交活跃股排名（4月2日）,Wind
4181,2019-04-02,20190402收评：如何看待高位强势股尾盘出现的分歧,中金在线
4182,2019-04-02,信息科技：龙头公司财报靓丽 风险偏好影响较大,和讯
4183,2019-04-02,905亿资金争夺20股：主力资金重点出击8股(名单),新浪
4184,2019-04-02,恒生电子：科创板系统预计会为公司带来一定的业务量,Wind
4185,2019-04-02,恒生电子：科创板系统预计会为公司带来一定的业务量,e公司
4186,2019-04-02,【广证恒生计算机】恒生电子（600570）-业绩点评-公司人员效率显著提升，海外业务高速增长,广证恒生
4187,2019-04-02,行业步入增长轨道 区块链35股掀起涨停潮,大众证券报
4188,2019-04-02,【每日晨报】0402丨首批区块链信息服务备案落地，相关产业链迎利好,中国银河证券研究
4189,2019-04-02,中银国际*每日速递20190402：宁波银行、金风科技、伟星新材、恒生电子、安科生物、中炬高新、梦百合等,微信
4190,2019-04-02,『早安，新时代！』晨会早读2019/4/2:今日关注中文传媒、恒生电子、华友钴业、宏发股份、赣锋锂业,新时代证券研究
4191,2019-04-02,【新时代计算机 田杰华团队】恒生电子：营收同比增长22.38%，内外多重因素叠加驱动业务成长,新时代证券研究
4192,2019-04-02,"计算机行业周报:热情未减,19Q1业绩分化应深挖个股 盈利能力下降",证券之星
4193,2019-04-02,"恒生电子:下游快速回暖,三大契机带动业绩持续增长",安信证券
4194,2019-04-02,"恒生电子:业绩大幅增长,志在构建全球金融科技生态",东北证券
4195,2019-04-01,《东方IT主题图鉴》,申万宏源S全民全流量计算机话报
4196,2019-04-01,恒生电子去年净利6.45亿元 同比增长37% 董事长彭政纲年薪380万元,挖贝网
4197,2019-04-01,头号研报：摆脱误解 区块链有望走得更远,巨丰财经
4198,2019-04-01,今日大盘：沪指刷新近一年新高，成交额再度突破万亿,股涨通
4199,2019-04-01,苏宁易购耗资1.45亿回购公司股份丨刘强东新增一家对外投资【Do说】,DoNews
4200,2019-04-01,指数新高后还会有新高,中财网
4201,2019-04-01,两市约170股涨停 区块链概念掀涨停潮,新浪
4202,2019-04-01,1021亿资金争夺20股：主力资金重点出击14股(名单),新浪
4203,2019-04-01,国海证券：首批区块链备案名单出炉2019迎来应用元年,国海证券
4204,2019-04-01,报告| 2019年3月浙江省A股上市公司市值排行榜,挖贝网
4205,2019-04-01,信息科技：预投哪些 弃哪些,申万宏源
4206,2019-04-01,蚂蚁金服拟直接持股恒生电子控股股东,每日经济新闻
4207,2019-04-01,观点 | 热情未减，19Q1业绩分化应深挖个股（中银计算机周报0331） 盈利能力下降,一计之长
4208,2019-04-01,首批区块链信息备案涉及哪些上市公司？一图读懂,国盛证券
4209,2019-04-01,蚂蚁金服拟收购恒生100%股权:从间接变为直接持股,澎湃新闻
4210,2019-04-01,蚂蚁金服拟收购恒生100%股权：实际控制人无变化,新浪
4211,2019-04-01,197家区块链备案挖不过来？这张表get了A股全映射,国盛证券
4212,2019-04-01,区块链概念股掀涨停潮 易见股份等近15股涨停,e公司
4213,2019-04-01,巨丰热点：区块链呈现市场走强 晨鑫科技等多股盘中封板,巨丰财经
4214,2019-04-01,快讯：区块链板块大幅高开 易见股份等多股涨停,新浪
4215,2019-04-01,A股异动丨恒生电子(600570.SH)涨停开盘 去年净利润超预期,格隆汇
4216,2019-04-01,01日最新公告透露利好 16只个股有潜力,中金在线
4217,2019-04-01,【新时代证券】四月金股组合——成长，新时代！每周交流会（第33期）,新时代证券研究
4218,2019-04-01,区块链第一批备案项目亮相 涉及多家上市公司(名单),金融界
4219,2019-04-01,今天将再次挑战压力位,中金在线
4220,2019-04-01,A股公司持续加码研发投入装建行业“最舍得”,重庆商报
4221,2019-04-01,蚂蚁金服拟收购恒生集团100%股权,中金在线
4222,2019-03-31,恒生电子 | 业绩符合预期之外的三个看点,一计之长
4223,2019-03-31,【国君计算机】恒生电子：RegTech、创新双轮驱动，业绩爆发式增长,计墨社
4224,2019-03-31,一季度基金回报喜人！最高斩获56%收益 冠军基金经理看好这两大板块,中证报
4225,2019-03-30,【天风计算机】周观点：安全可控与电子签名SaaS成板块最强音，新增关注无人驾驶V2X机会,兵哥看IT
4226,2019-03-30,首届财通私募大赛在杭州启动,中证网
4227,2019-03-30,蚂蚁基金去年营收超14亿元 远超天天基金,证券时报网
4228,2019-03-30,恒生电子：2018年年度主要财务指标,上交所
4229,2019-03-30,恒生电子：六届二十六次暨2018年度董事会决议公告,上交所
4230,2019-03-29,恒生电子：2018年净利润同比增37%，拟10送3派3.2元,Wind
4231,2019-03-29,恒生电子：控股股东恒生集团股权结构变更，蚂蚁金服将直接持有其全部股权,Wind
4232,2019-03-29,29日晚公告精选丨工业富联：2018年净利润169亿元 同比增6.5%,21世纪经济报道
4233,2019-03-29,恒生电子：2018年净利同比增37% 拟10送3派3.2元,e公司
4234,2019-03-29,恒生电子(600570.SH)2018年扣非净利润升142.77%至5.16亿元 拟10送3股派3.2元,格隆汇
4235,2019-03-29,厚信投资助力美美证券美股成功上市,证券之星
4236,2019-03-29,信息科技：关注弱周期 荐3股,和讯
4237,2019-03-29,信息科技：2019年科技金融板块有望脱颖而出 荐4股,和讯
4238,2019-03-29,天源迪科（300047）：业绩高增长，5G+公安+金融大数据驱动长期成长【天风通信团队】,海陆清风
4239,2019-03-28,国盛证券推荐关注区块链行业中涉及数字产权标的,证券时报网
4240,2019-03-28,华鑫证券：看好金融科技、医疗信息化等细分领域投资机会,证券时报网
4241,2019-03-28,信息科技：智慧医院建设推进 荐5股,和讯
4242,2019-03-28,"计算机行业周报:首批科创板受理企业名单出炉,利好相关概念板块",渤海证券
4243,2019-03-27,信息科技：中央深改组通过AI+战略 荐9股,和讯
4244,2019-03-27,中国银河：计算机行业景气度稳健上升看好具备核心技术企业发展前景,顶尖财经网
4245,2019-03-26,科蓝软件与蚂蚁金服子公司达成合作：公告披露前股价两涨停 深交所询问细节,挖贝网
4246,2019-03-26,科创板受理9家企业申请科技股有望价值重估(附股),广证恒生
4247,2019-03-26,民生证券:没有盈利怎么估值 浅析科创板适用估值方法,新浪
4248,2019-03-25,【招商策略】陆股通减仓食品家电，美股调整扰动外资流向——金融市场流动性与监管动态周报(0325),和讯
4249,2019-03-25,华创证券：科创板再迎进展科技股有望重估,华创证券
4250,2019-03-25,光大证券：继续看好保险板块，科创板头部券商更为受益,证券时报网
4251,2019-03-25,中银国际：科创估值差异或加大分歧 仍看多计算机板块估值上行,证券时报网
4252,2019-03-23,【申万宏源计算机】聚焦广深“文化N虎”，基本面领军突出,申万宏源S全民全流量计算机话报
4253,2019-03-22,关注云计算、医疗信息化等细分领域,证券时报网
4254,2019-03-22,主力资金尾盘流出加速 券商股逆市“吸金”,中证报
4255,2019-03-21,幽兰行天下：3月22淘金早参,中金在线
4256,2019-03-21,获蚂蚁金服子公司增持，科蓝软件连续四个涨停,腾讯网
4257,2019-03-21,03月21日 96只股票封板 贵金属板块涨幅最大,每日经济新闻
4258,2019-03-21,03月21日 主力资金抢筹最积极的前10股（附名单）,每日经济新闻
4259,2019-03-21,大智慧官司缠身折戟互联网彩票 连续变卖资产助扭亏,新浪
4260,2019-03-21,[资金报告] 主力29.75亿净流出A股 最新资金流向排名一览(表),万隆证券网
4261,2019-03-21,A股异动 | 科蓝软件再度涨停 录得4连板,格隆汇
4262,2019-03-21,21日早间公司新闻聚焦：广州国资入主金明精机,证券时报网
4263,2019-03-20,科蓝软件：获蚂蚁金服旗下上海云鑫增持3.4% 推进深度合作,e公司
4264,2019-03-20,科蓝软件与股东蚂蚁金服签署合作协议,挖贝网
4265,2019-03-20,从“3元”到“13元” 这只股翻倍行情背后何逻辑,中财网
4266,2019-03-20,50页报告看多此细分行业：用户超“优爱腾”会员总和，19年国字头巨无霸诞生，自带“联通+BATJ”级混改预期；科创板最快本周五落地，此热门板块蕴藏再上攻机遇，前期疯涨的细分领域再获政策催化【3.20必看研报】,和讯
4267,2019-03-19,关注计算机板块细分领域龙头标的(附股),证券时报网
4268,2019-03-19,渤海证券：科创板加速落地关注计算机板块新机遇,渤海证券
4269,2019-03-19,信息科技：证券IT拾级而上 荐4股,和讯
4270,2019-03-19,信息科技：短期调整概率大 荐3股,和讯
4271,2019-03-19,"【计算机行业动态】2019年最重要投资主线：超高清视频产业,5G应用先行者",格隆汇
4272,2019-03-18,中信建投：2019年最重要投资主线，超高清视频产业，5G应用先行者,证券时报网
4273,2019-03-18,信息科技：科创板渐行渐近 荐5股,和讯
4274,2019-03-18,信息科技：产业兑现迎戴维斯双击 荐8股,和讯
4275,2019-03-18,“3·15”大动作！监管层严查非法配资,国际金融报
4276,2019-03-18,获百度5.5亿投资 汉得信息股价创三年新高,投资者网
4277,2019-03-15,基金赚钱效应显现 新华外延增长主题基金年内收益超50%,全景网
4278,2019-03-15,[增持评级]计算机：监管边际变化持续助推金融IT,中财网
4279,2019-03-14,信息科技：新亮点 荐2股,和讯
4280,2019-03-14,信息科技：MSCI扩大A股纳入因子 荐9股,和讯
4281,2019-03-13,高位震荡，满地鸡毛,中金在线
4282,2019-03-13,信息科技：持续看好金融IT 荐3股,和讯
4283,2019-03-13,国盛证券：香港虚拟银行牌照将落地 概念股值得关注,证券时报网
4284,2019-03-13,信息科技：科创板制度正式落地 荐3股,和讯
4285,2019-03-13,信息科技：计算机板块一季报前瞻 荐8股,和讯
4286,2019-03-13,[中性评级]计算机行业点评：香港虚拟银行牌照将落地 金融科技大趋势加强,中财网
4287,2019-03-13,"计算机行业周报:主题关注安全可控与工业互联网,重视基本面标的补涨机会",光大证券
4288,2019-03-12,【国君计算机杨墨团队】专题||监管边际变化持续助推金融IT,计墨社
4289,2019-03-12,马云再出手！入股申通、备战科创板，A股小伙伴玩到嗨,Wind
4290,2019-03-12,1044亿资金争夺20股：主力资金重点出击9股(名单),新浪
4291,2019-03-12,03月12日 主力资金抢筹最积极的前10股（附名单）,每日经济新闻
4292,2019-03-12,信息科技：边缘计算市场规模巨大,和讯
4293,2019-03-12,信息科技：边缘计算 荐10股,和讯
4294,2019-03-12,互联网金融概念股集体拉升 大智慧、中科金财等涨停,e公司
4295,2019-03-12,"计算机行业:自主可控持续,芯片及软件尤为重要",国联证券
4296,2019-03-12,"计算机行业周报:板块大幅领涨,计算机也需要慢牛",证券之星
4297,2019-03-11,财通证券：央行研究发展规划，持续看好金融IT,证券时报网
4298,2019-03-11,渤海证券：继续看多计算机板块春季行情,证券时报网
4299,2019-03-11,央行将研究出台金融科技发展规划 金融IT或将长期受益,证券时报网
4300,2019-03-11,无惧猪瘟！这个原料药小品种需求反弹 历史底价启动上涨 两家A股龙头率先受益；接力边缘计算！“电力物联网”成国家电网战略重心 终端数将暴涨4倍达20亿 三只产业链个股自带资产注入预期【3月11日必看研报】,和讯
4301,2019-03-11,解密爆炒股背后疯狂的游资：21家席位上榜100次,证券时报网
4302,2019-03-10,观点 | 板块大幅领涨，计算机也需要慢牛（中银计算机周报0310）,微信
4303,2019-03-08,报告| 2019年2月浙江省A股上市公司市值TOP50,挖贝网
4304,2019-03-07,华鑫证券：增值税降税叠加MSCI利好 计算机板块行情有望延续,证券时报网
4305,2019-03-07,收评：做多情绪不减不去猜顶！,中金在线
4306,2019-03-07,1173亿资金争夺20股：主力资金重点出击5股(名单),新浪
4307,2019-03-07,互联网金融概念股持续走高 恒生电子冲击涨停,证券时报网
4308,2019-03-06,证券软件服务商击鼓传花之后，A股下轮牛市难有慢牛,财华社
4309,2019-03-05,"计算机行业周报:科创板规则正式发布,关注计算机板块新机遇",渤海证券
4310,2019-03-05,"计算机行业周报:证监会谈科创板,关注金融IT相关公司投资机会",正点财经
4311,2019-03-05,A股单日成交额再破万亿元 三大动能助沪指突破3000点,中国经济网
4312,2019-03-04,阿里云宕机引关注 国内云计算市场发展情况如何？,格隆汇
4313,2019-03-04,五大券商周二看好6板块29股,中财网
4314,2019-03-04,1166亿资金争夺20股：主力资金重点出击6股(名单),新浪
4315,2019-03-04,一图看懂科创板潜在名单及其影子股,21世纪经济报道
4316,2019-03-04,科技｜MSCI影响下的TMT科技投资,微信
4317,2019-03-04,【计算机-胡又文】汉得信息：百度入股发力云业务，To C转To B趋势确定,安信证券研究
4318,2019-03-03,阿里云凌晨宕机轩然大波！华北2地域故障，一大波互联网公司炸锅了，官方称紧急恢复并尽快赔偿,券商中国
4319,2019-03-03,科创板来了｜A股投资机会透视：七行业率先受益（附概念股）,澎湃新闻
4320,2019-03-01,【常长亭】又迎来超级大利好！(附股),中金在线
4321,2019-03-01,《云计算半月刊》第二十三期（2019.3.1）,计算机司令部
4322,2019-03-01,902亿资金争夺20股：主力资金重点出击12股(名单),新浪
4323,2019-03-01,信息科技：金融IT活力绽放 荐5股,和讯
4324,2019-03-01,信息科技：证券IT到泛互金趋势不断确立 荐14股,和讯
4325,2019-03-01,信息科技：计算机领域多点开花 荐7股,和讯
4326,2019-03-01,信息科技：第十三次集体学习举行 荐6股,和讯
4327,2019-03-01,信息科技：MOM新规对金融IT影响的定性和定量分析 荐2股,和讯
4328,2019-03-01,信息科技：通用服务器成本及CPU国产化替代商业价值简析 荐9股,和讯
4329,2019-03-01,恒生电子：主推2条联盟链 但链上交易至今不到30笔,中金在线
4330,2019-03-01,券商近四成“荐股”已达目标价 34家已达最高目标价,证券日报
4331,2019-03-01,A股进入技术性牛市 详解2月份五大牛股暴涨基因,证券日报
4332,2019-03-01,两融余额时隔4月重上8000亿 标的个股净流入超8成,每日经济新闻
