1507,2020-03-10,热点前瞻： 维生素一周大幅上涨18.2% 全国各地鸡苗毛鸡价格上涨,巨丰财经
1508,2020-03-10,新和成(002001)优质精细化工龙头开启成长新征程,聚氨酯网
1509,2020-03-10,巨丰早参：原油“黑天鹅”引发美股史上第二次熔断,巨丰财经
1510,2020-03-10,新和成业绩低于预期股价创新高 市场热度能维持多久？,投资者网
1511,2020-03-09,15股最新股东户数降逾一成,证券时报网
1512,2020-03-09,天风证券：原油价格大幅调整，关注必选消费需求化工品,证券时报网
1513,2020-03-09,维生素概念股近期表现逆势 背后逻辑是什么？｜今日异动数据,第一财经
1514,2020-03-09,17只股股价创历史新高,证券时报网
1515,2020-03-09,【平安医药】原料药行业全景图,平安研究
1516,2020-03-09,【研报掘金】维生素价格有望持续上扬 机构看好这几股,证券时报网
1517,2020-03-09,业内：特色原料药、中间体将迎来戴维斯双击,制药网
1518,2020-03-09,劲爆！涨价题材股轮番领涨成A股最强风口！业内人士：小心虚火！,重庆商报
1519,2020-03-09,化工行业重大事项点评：维生素价格持续上扬，推荐龙头公司,CITICS化工研究
1520,2020-03-09,粤开证券 | 首席观点周荟萃：A股存在较丰富的结构性机会,微信
1521,2020-03-09,天风证券：供需改善，蛋氨酸景气有望复苏,证券时报网
1522,2020-03-09,欧洲非冠疫情蔓延 维生素等添加剂国际供应引关注,证券时报网
1523,2020-03-08,花园生物：高利润率难持续,证券市场周刊
1524,2020-03-07,建行浙江上虞支行投放央行专项再贷款3.18亿元,中国金融新闻网
1525,2020-03-06,产品涨价——这次A股走牛的原因找到了,Wind
1526,2020-03-06,172家医药公司2019业绩快报：8家盈利超10亿 3家亏损超20亿 亏损,医药网
1527,2020-03-05,424亿主力资金近三日大量撤出中小创,证券时报网
1528,2020-03-05,维生素涨价！相关概念股成了香饽饽维生素涨价！相关概念股成了香饽饽,中国证券网
1529,2020-03-05,【东吴化工】浙江医药：维生素业务反转，医药业务破局在即,东吴石化化工
1530,2020-03-04,巨·热点 | 市场休整孕育新机遇 涨价题材受追宠！,巨丰财经
1531,2020-03-04,和信投顾：指数短期震荡无碍 风险主要集中在个股,新浪
1532,2020-03-04,浙江医药(600216.SH)领涨维生素概念股维生素B1价格大涨,格隆汇
1533,2020-03-04,供需紧张 涨幅巨大 维生素行业景气度有望持续丨牛熊眼,第一财经
1534,2020-03-04,粤开策略：首席观点周荟萃--A股现阶段具备较强的投资价值,金融界
1535,2020-03-04,供需紧张！部分维生素品种价格翻倍，机构预计景气度有望持续,证券时报
1536,2020-03-03,94股今日获机构买入评级,证券时报网
1537,2020-03-03,股东户数降幅榜：9股最新股东户数降逾一成,证券时报网
1538,2020-03-03,186股获券商买入评级，天康生物目标涨幅达77.28%,Wind
1539,2020-03-02,【策略联合行业】库存回补带来哪些机会？,分析师徐彪
1540,2020-03-02,天风证券：关注3月维生素和肥料涨价行情,第一财经
1541,2020-03-02,226股获券商买入评级 联瑞新材目标涨幅达71.56%,Wind
1542,2020-02-29,大幅上调目标价策略（2月29日）,Wind
1543,2020-02-29,上调评级至买入策略选股（2月29日）,Wind
1544,2020-02-28,筹码新动向：172股筹码趋向集中,证券时报网
1545,2020-02-27,新和成业绩快报：2019年营收降12.40%，净利降27.95% 盈利能力下降,证券时报网
1546,2020-02-27,主要产品价格下降 新和成营收与净利双降 盈利能力下降,新京报
1547,2020-02-27,新和成(002001.SZ)业绩快报：2019年度净利润降27.95%至22.18亿元 盈利能力下降,格隆汇
1548,2020-02-27,新和成：2019年净利润同比降27.95% 盈利能力下降,Wind
1549,2020-02-27,【国金化工】新和成点评——公司业绩符合预期，看好公司成长性（2020-02-27）,点石化金
1550,2020-02-26,股东户数降幅榜：13股最新股东户数降逾一成,证券时报网
1551,2020-02-24,基础化工行业：物流运输略有好转，农资产品价格上行，维持“增持”评级,国金证券
1552,2020-02-24,【西南化工—生物素行业专题报告】供需矛盾激化，景气高度提升,化工林谈
1553,2020-02-23,等闲不识医药面，核心资产总是牛！【西南证券医药|0223周报】,国广有话说
1554,2020-02-22,【西南化工周观点】下游开工率提升，化工产品价格回暖,化工林谈
1555,2020-02-21,2020-2-21 NESC复盘笔记：创指涨1.82% 两市成交额连续三日破万亿,复盘笔记
1556,2020-02-21,一天跳涨40%！这个化工品供需逆转价格暴涨，概念股解析（附股）,证券时报网
1557,2020-02-20,只卖60亿，却有1200亿抢购的基金，他们选了什么标的股？,中投网
1558,2020-02-19,多种维生素价格近期出现上涨 关注相关产业链股,证券时报网
1559,2020-02-19,齐俊杰：一天又来了1200亿 陈光明的睿远基金为啥这么火？,金融界
1560,2020-02-19,根本抢不到，基金一天卖了1200亿！市场咋就这么火,Wind
1561,2020-02-19,根本抢不到 基金一天卖了1200亿！市场咋就这么火,Wind
1562,2020-02-19,暗藏潜力牛207家公司筹码集中度今年持续走高,重庆商报
1563,2020-02-18,一天狂卖1200亿！陈光明又火了！一图集齐10大重仓股,上游新闻
1564,2020-02-18,一天狂卖1000亿！陈光明这只基金火了！赚钱机会来了？一图集齐：陈光明10大重仓股,21世纪经济报道
1565,2020-02-18,新发基金配售比例仅5%！东方雨虹、隆基股份……一图集齐陈光明重仓股,21世纪经济报道
1566,2020-02-18,中泰证券：维生素价格普涨，建议关注VE\生物素\B1等强势品种,证券时报网
1567,2020-02-18,紧急抢货？筹码大幅集中的业绩暴增股名单出炉，锂电池龙头在列,证券时报
1568,2020-02-18,维生素行业：全球供给波动 关注产品涨价机会,财富动力网
1569,2020-02-17,捐赠1000万 新和成助力疫情阻击战,新浪
1570,2020-02-17,打开爱心门 新和成公司员工疫情捐款已超110万,新浪
1571,2020-02-17,申港证券：全球蝗虫灾害形势严峻，有望拉动农药出口,证券时报网
1572,2020-02-17,42股获券商买入评级 中国铁建目标涨幅达61.27%,Wind
1573,2020-02-17,【本周观点】从48个子行业开工率与库存透视强势子行业,化海锋云
1574,2020-02-15,【西南化工周观点】海外维生素价格整体大涨，看好VE、生物素价格趋势上涨,化工林谈
1575,2020-02-15,【国金化工-研究周报】维生素报价走强，农药化肥关注度提升（2020-02-15）,点石化金
1576,2020-02-14,58股获机构买入评级18股上涨空间超20%,证券时报
1577,2020-02-14,疫情扰动全球维生素供给 产业链个股有望受关注,证券时报网
1578,2020-02-14,被忽略潜力题材！疫情下需求激增，概念股稀缺，龙头呼之欲出？,证券时报网
1579,2020-02-13,疫情推动维生素价格春节期间涨超10% 它们成市场焦点（股）,金融界
1580,2020-02-13,维生素国外报价大涨，产业热度“疫”外升温,Wind
1581,2020-02-12,战略性看好锂电材料板块 五股腾飞在即掘金良机,证券时报网
1582,2020-02-12,光大证券：战略性看好锂电材料板块,证券时报网
1583,2020-02-12,【化工行业点评】疫情扰动全球维生素供给，建议关注VE、生物素涨价机会,化工林谈
1584,2020-02-11,维生素题材午后异动，兄弟科技大涨5%,Wind
1585,2020-02-07,午间公告2020年2月7日星期五,Wind
1586,2020-02-07,午间公告：宇晶股份实控人计划增持股份；新和成等公司捐款支持抗疫,e公司
1587,2020-02-07,病毒无情人有情 上市公司捐赠战“疫”物资还在继续,投资快报
1588,2020-02-07,A股头条：新闻联播6日两度提及A股 瑞德西韦两周内出临床结果,金融界
1589,2020-02-06,公告汇总：中国电影下属141家影院全部暂停营业,网易
1590,2020-02-06,晚间公告热点追踪：永太科技收到吉利德业务询盘,新浪
1591,2020-02-06,刚刚！2月6日晚间上市公司十大重磅公告 多股或冲涨停,巨丰财经
1592,2020-02-06,[公司]新和成捐赠1000万元支持抗击新型冠状病毒感染肺炎疫情|资本市场 同心抗疫,全景网
1593,2020-02-06,新和成(002001.SZ)及子公司合计捐赠1000万元支持抗击新型冠状病毒感染肺炎疫情,格隆汇
1594,2020-02-06,瑞德西韦正式启动临床试验，这些抗流感股筹码大幅集中,证券时报网
1595,2020-02-03,【申港基础化工】行业周报：疫情压制短期需求 中长期影响较小,化工深度研究
1596,2020-02-03,【华安化工 | 系列报告】金禾实业 ：全球食品添加剂领军者,化工阿尔法
1597,2020-02-02,【华创化工】复盘2003年“非典疫情”看化工板块：短期情绪和基本面双杀，但中长期的黄金坑即将到来,华创化工
1598,2020-01-31,国联证券研究所2月投资组合,国联研究
1599,2020-01-30,谁为本轮医药上涨的赢家？【西南证券医药|0216周报】,国广有话说
1600,2020-01-25,一周337只个股突破一年新高,中财网
1601,2020-01-23,【申万宏源化工】每日信息速递20200123,申万宏源化工投资
1602,2020-01-22,【申万宏源化工】每日信息速递20200122,申万宏源化工投资
1603,2020-01-22,最新的股东数据来了！383家公司披露股东户数 逾六成趋向集中,投资快报
1604,2020-01-21,【申万宏源化工】每日信息速递20200120,申万宏源化工投资
1605,2020-01-20,【申万宏源化工】每日信息速递20200121,申万宏源化工投资
1606,2020-01-20,陈光明旗下首只公募基金股票仓位升至逾九成，增持了这些股票,澎湃新闻
1607,2020-01-20,陈光明爆款基金重仓股曝光，还有基金经理买了这些股（附股）,中证报
1608,2020-01-20,陈光明旗下爆款基金重仓股曝光，高仓位下继续加仓！还有金牛基金经理买了这些股（附股）,中证报
1609,2020-01-20,【平安生物医药行业动态跟踪报告】新冠疫情影响下，维生素、抗生素多品种涨价,平安研究
1610,2020-01-19,【金财富决策参考】2020-01-20,赢家之星
1611,2020-01-19,明日A股机会早知道,第一财经
1612,2020-01-19,秘鲁停捕致鱼粉开启暴涨模式 蛋氨酸替代需求望提升,e公司
1613,2020-01-18,一周362只个股突破一年新高,中财网
1614,2020-01-17,狠降价才能中标 上市药企接受第二批带量采购考验,上证报
1615,2020-01-17,【大行报告】安捷:第二轮集采科伦药业(02422-CH)是最大贏家,财华社
1616,2020-01-17,首批四季报出炉 冠军基金新进三股,金融投资报
1617,2020-01-15,哪些股票属于中小盘,中财网
1618,2020-01-15,老沙:外资扫货内资扫兴,中财网
1619,2020-01-14,【申万宏源化工】每日信息速递20200114,申万宏源化工投资
1620,2020-01-14,【申万宏源化工】每日信息速递20200117,申万宏源化工投资
1621,2020-01-14,碾压一大片牛股，这份最新筹码大幅集中股名单请收好,证券时报网
1622,2020-01-14,股东户数降幅榜：9股最新股东户数降逾一成,证券时报网
1623,2020-01-14,【化工行业】芳纶高端突破，国产化突进,格隆汇
1624,2020-01-13,【申万宏源化工】每日信息速递20200113,申万宏源化工投资
1625,2020-01-13,这9股股东户数骤降筹码大幅集中（附股）,证券时报
1626,2020-01-12,【本周观点】再论维生素E,化海锋云
1627,2020-01-11,一周325只个股突破一年新高,中财网
1628,2020-01-10,419家公司公布最新股东户数,证券时报网
1629,2020-01-09,【申万宏源化工】每日信息速递20200109,申万宏源化工投资
1630,2020-01-09,【国盛策略】全球估值比较：哪些周期核心资产被低估？,尧望后势
1631,2020-01-09,概念 | 能繁母猪存栏量持续回升，养殖后周期概念反转可期！,中邮证券
1632,2020-01-08,【申万宏源化工】每日信息速递20200108,申万宏源化工投资
1633,2020-01-07,【西南证券—间甲酚行业专题报告】间甲酚国产替代加速，下游薄荷醇盈利可观,化工林谈
1634,2020-01-06,【申万宏源化工】每日信息速递20200106,申万宏源化工投资
1635,2020-01-06,【申港基础化工】行业周报：转基因作物公示对草甘膦市场影响几何？,化工深度研究
1636,2020-01-06,股票质押解押一览表（1月6日）,Wind
1637,2020-01-03,新和成(002001.SZ)：实控人提前解押966.787万股 已无质押股份,格隆汇
1638,2020-01-02,【申万宏源化工】每日信息速递20200102,申万宏源化工投资
1639,2020-01-02,2020年1月份券商月度金股出炉 5家券商推荐这家公司,证券日报
1640,2020-01-02,医药行业涟漪效应显现 生物制品板块增速最高,中国报告大厅
1641,2020-01-01,2020年A股怎么走？这个风向标胜率高达90%，两大投资主线曝光，机构称春季躁动行情或提前,e公司
1642,2019-12-31,【申万宏源化工】每日信息速递20191231,申万宏源化工投资
1643,2019-12-31,科技龙头争当C位 2020年看两大板块 六股热,证券时报
1644,2019-12-31,和信投顾：技术性多头市场已来 积极把握年后行情,中金在线
1645,2019-12-31,国联证券研究所1月投资投资组合,国联研究
1646,2019-12-31,【朝闻国盛1231】周期核心资产：“低估值陷阱”有望解除,国盛证券研究所
1647,2019-12-30,【申万宏源化工】每日信息速递20191230,申万宏源化工投资
1648,2019-12-30,机构荐股到底靠不靠谱，今年押中哪些大牛股，又踩中哪些雷？2020年金股抢先看（附股）,e公司
1649,2019-12-30,国盛证券：低估值陷阱有望解除,国盛证券
1650,2019-12-30,【开源化工】金石资源点评报告：股权激励业绩考核方案调整，公司高成长动能不改,Au化工
1651,2019-12-30,如何看待当前化工板块的投资机会？,方正证券
1652,2019-12-30,早报：新证券法明年3月起施行 5G产业基金正式成立,新浪
1653,2019-12-30,太平洋证券：周期持续修复，化工龙头溢价，关注成长估值切换,证券时报网
1654,2019-12-28,风起--再论ppi转正与化工配置电话会议纪要,化海锋云
1655,2019-12-27,杭州湾上虞经开区：“两区”整合新典范绘就发展新蓝图,国际商报
1656,2019-12-27,财融汇·早间必读 | 20191227,财通证券融资融券部
1657,2019-12-27,化工行业深度：生物素供给紧缺，价格持续上涨，维持“增持”评级,国盛证券
1658,2019-12-27,生物素供给紧缺，价格持续上涨，相关个股望受关注,证券时报网
1659,2019-12-27,机构调研关注五大行业 32家公司获扎堆调研,中证报
1660,2019-12-27,国盛证券：生物素价格上涨 聚焦板块个股,第一财经
1661,2019-12-27,浙江医药：新药研发取得进展 但维生素价格决定短期业绩？,面包财经
1662,2019-12-27,【朝闻国盛1227】生物素价格上涨，聚焦板块个股,国盛证券研究所
1663,2019-12-27,【晨观方正】宏观/化工/有色/电子20191230,方正证券研究
1664,2019-12-27,创新药行业相关ETF：易方达沪深300医药ETF和汇添富中证医药卫生ETF,每日经济新闻
1665,2019-12-26,【申万宏源化工】每日信息速递20191226,申万宏源化工投资
1666,2019-12-26,【异动股】维生素板块，圣达生物(603079-CN)涨停,财华社
1667,2019-12-26,大豆概念领跌 *ST工新突跌,中财网
1668,2019-12-26,中国原料药企升级换代对印度市场供应构成一定程度挑战,制药网
1669,2019-12-26,维生素板块异动拉升,证券时报网
1670,2019-12-26,维生素概念开盘走升，圣达生物冲击涨停,Wind
1671,2019-12-25,【申万宏源化工】每日信息速递20191225,申万宏源化工投资
1672,2019-12-25,25日中小板指涨0.52%,新华网
1673,2019-12-25,92家公司获机构调研（附名单）,证券时报网
1674,2019-12-25,【化工】生物素价格大涨，行业景气有望超预期,天风研究
1675,2019-12-24,【申万宏源化工】每日信息速递20191224,申万宏源化工投资
1676,2019-12-23,23日中小板指跌1.76%,新华网
1677,2019-12-23,【申港基础化工】行业周报：近期碳酸二甲酯市场货紧价扬,化工深度研究
1678,2019-12-23,化工：化工品价格小幅上涨 荐8股,安信证券
1679,2019-12-20,招商基础化工行业周报2020年12月第2周：醋酸、醋酸乙烯本周涨幅居前，水合肼、工业萘跌幅较大,招商基础化工
1680,2019-12-20,【申万宏源化工】每日信息速递20191220,申万宏源化工投资
1681,2019-12-20,机构调研：无线耳机、维生素概念股受机构扎堆拜访,新浪
1682,2019-12-20,招商基础化工行业周报2020年12月第4周：盐酸、国际硫酸本周涨幅居前，DMC、水合肼跌幅较大,招商基础化工
1683,2019-12-20,招商基础化工行业周报2020年12月第3周：聚四氟乙烯、辛醇本周涨幅居前，水合肼、丙酮跌幅较大,招商基础化工
1684,2019-12-20,43股今日获机构买入评级9股上涨空间超20%,证券时报网
1685,2019-12-20,新和成：蛋氨酸进口未来会由国内生产替代，公司产品在市场竞争有优势,Wind
1686,2019-12-20,基础化工行业2020年年度策略：坚守一线龙头，拥抱核心资产,格隆汇
1687,2019-12-20,【方正化工】2020年化工行业投资策略报告：优选景气底部的周期成长股,方正证券研究
1688,2019-12-19,4股最新股东户数降逾一成,证券时报网
1689,2019-12-19,基础化工2020年年度策略：静候需求复苏掘金优质赛道,川财证券
1690,2019-12-19,【川财研究所*2020年年度策略】基础化工：静候需求复苏，掘金优质赛道（20191215）,川财研究
1691,2019-12-18,【申万宏源化工】每日信息速递20191219,申万宏源化工投资
1692,2019-12-18,中信建投2020年化工行业展望：龙头香如故，材料急先锋,中信建投证券研究
1693,2019-12-17,【申万宏源化工】每日信息速递20191218,申万宏源化工投资
1694,2019-12-17,股东户数降幅榜：3股最新股东户数降逾一成,证券时报网
1695,2019-12-17,52亿主力资金近三日大量撤出中小创,证券时报网
1696,2019-12-17,基础化工行业2020年投资策略：守正出奇，拥抱新材料发展大浪潮,广发证券
1697,2019-12-17,周二机构一致看好的七大金股（12.17）,中金在线
1698,2019-12-15,【申万宏源化工】每日信息速递20191216,申万宏源化工投资
1699,2019-12-13,【申万宏源化工】每日信息速递20191213,申万宏源化工投资
1700,2019-12-13,2019精细化工企业影响力TOP50,硅谷动力
1701,2019-12-13,加码食品添加剂，金禾实业（002597.SZ）拟13.85亿元投建两项目,格隆汇
1702,2019-12-12,【申万宏源化工】每日信息速递20191212,申万宏源化工投资
1703,2019-12-12,维生素概念股异动 浙江医药涨停,证券时报网
1704,2019-12-12,【朝闻国盛1212】11月金融数据的六大信号,国盛证券研究所
1705,2019-12-11,【申万宏源化工】每日信息速递20191211,申万宏源化工投资
1706,2019-12-11,中泰证券：下游需求回暖趋势已现，维生素板块预期拐点向上,第一财经
1707,2019-12-10,【申万宏源化工】每日信息速递20191210,申万宏源化工投资
1708,2019-12-10,廖宗魁：政治局会议定调2020年政策,粤开崇利论市
1709,2019-12-10,券商荐股迎“期末考” 个股下半年以来最大涨幅超120%,证券日报
1710,2019-12-09,【申万宏源化工】每日信息速递20191209,申万宏源化工投资
1711,2019-12-09,中原证券2020年十大金股出炉 中信证券、招商银行等热门个股上榜,证券日报
1712,2019-12-09,【朝闻国盛1209】2020年政策的变与不变,国盛证券研究所
1713,2019-12-09,【川财研究所*每日晨报】20191209：反弹开启，优质成长和周期是主线,川财研究
1714,2019-12-08,【申万化工周观点】周期品部分企稳反弹，建议配置一二线龙头白马,申万宏源化工投资
1715,2019-12-07,2019金股表现优异，2020再出发！,中原证券研究所
1716,2019-12-06,【申万宏源化工】每日信息速递20191206,申万宏源化工投资
1717,2019-12-06,西南证券：VE供需格局逐步改善，打开涨价空间,证券时报网
1718,2019-12-06,【化工品价格跟踪】OPEC+深化减产，油价反弹，地产相关化工品价格平稳20191208,太平洋化工信息平台
1719,2019-12-05,【申万宏源化工】每日信息速递20191205,申万宏源化工投资
1720,2019-12-05,A股明日风口：国家文化公园建设方案出台,新浪
1721,2019-12-05,原料供应缩减、产能收紧 维生素E价格再度上涨,第一财经
1722,2019-12-05,原料供应缩减、产能收紧 维生素E四季度又涨价,上证报
1723,2019-12-05,维生素E又涨了 这些上市公司有望“坐享其成”,上证报
1724,2019-12-05,川财证券：四川省取缔省内全部P2P网贷机构,川财证券
1725,2019-12-04,【申万宏源化工】每日信息速递20191204,申万宏源化工投资
1726,2019-12-04,2800点，王牌基金经理回归，能带你一飞冲天吗？,腾讯网
1727,2019-12-03,回归价值本位 机构扎堆看好14只优质白马股,证券日报
1728,2019-12-02,上海证券：重提化工行业优质白马龙头长期配置价值,证券时报网
1729,2019-12-02,不爱“凑热闹”，六年完美碾压沪深300的他又回来了！,和讯
1730,2019-12-02,[公司]新和成：11月维生素采购量明显好于10月,全景网
1731,2019-12-02,新和成：维生素采购量11月比10月明显要好，显示猪存栏量在恢复,Wind
1732,2019-12-02,这个行业获机构扎堆调研，股价大涨，百亿私募均盯上它,21世纪经济报道
1733,2019-12-02,太平洋证券：各行业周观点12月1日,太平洋证券研究
1734,2019-12-02,【周期识真】华泰周期团队数据周报 第48周,和讯
1735,2019-12-01,进医保目录者得市场！这家药企30个品种被纳入，百余机构抢着调研,e公司
1736,2019-12-01,机构密集调研医药行业，股价大涨，百亿私募均盯上它,南方财经网
1737,2019-11-30,医药行业：复盘2019，策略2020,格隆汇
1738,2019-11-29,机构调研:百家机构关注仙琚制药 多家外资访海康威视,新浪
1739,2019-11-29,【申万宏源化工】每日信息速递20191129,申万宏源化工投资
1740,2019-11-29,国联证券研究所12月投资组合,国联研究
1741,2019-11-28,【申万宏源化工】每日信息速递20191128,申万宏源化工投资
1742,2019-11-27,【申万宏源化工】每日信息速递20191127,申万宏源化工投资
1743,2019-11-27,可繁母猪存栏环比转正生猪后周期建议关注维生素和氨基酸板块,光大证券
1744,2019-11-26,周二机构一致看好的十大金股,中财网
1745,2019-11-25,龙头的标志是突破“商业边界”,红周刊
1746,2019-11-25,十张图带你解读2018年维生素类原料药产能格局！,前瞻研究院
1747,2019-11-25,【朝闻国盛1125】短期震荡，重视安可集成,国盛证券研究所
1748,2019-11-24,【申万化工周观点】VE价格上涨，继续推荐一二线白马及成长龙头,申万宏源化工投资
1749,2019-11-23,【西南化工周观点】间甲酚供应紧张推高VE价格，棕榈油、天胶价格持续大涨,化工林谈
1750,2019-11-22,【申万宏源化工】每日信息速递20191122,申万宏源化工投资
1751,2019-11-22,国联证券发布2020年基础化工行业选股策略(附股),证券时报网
1752,2019-11-22,化工板块震荡上扬 低估值优质龙头配置价值显现,证券时报网
1753,2019-11-22,国金证券：新和成增持评级,国金证券
1754,2019-11-22,新和成：公司成长动能巨大 目标价23.6元,证券时报网
1755,2019-11-22,太证研究11月22日最新观点,太平洋证券研究
1756,2019-11-21,【申万宏源化工】每日信息速递20191125,申万宏源化工投资
1757,2019-11-21,【申万宏源化工】每日信息速递20191121,申万宏源化工投资
1758,2019-11-21,【申万大化工团队】深度报告精选,申万石油化工
1759,2019-11-21,【化工*柴沁虎】 化工行业2020年度策略： 抓住供给侧机会，共享成长端未来,东吴研究所
1760,2019-11-21,【东吴晨报1121】【行业】社服、化工、通信【个股】哔哩哔哩,东吴研究所
1761,2019-11-21,新和成：维生素价格上行 业绩改善值得期待,南方财经网
1762,2019-11-20,【申万宏源化工】每日信息速递20191120,申万宏源化工投资
1763,2019-11-19,【申万宏源化工】每日信息速递20191119,申万宏源化工投资
1764,2019-11-19,生物素近一个月涨幅达17.85%，相关受益公司有哪些？,格隆汇
1765,2019-11-19,融资客青睐16股，赣粤高速买入占比高达46.46%,Wind
1766,2019-11-19,30股获券商买入评级 金山办公目标涨幅达69.05%,Wind
1767,2019-11-18,国金证券：VE 价格有望继续上行 重点关注2股,证券时报网
1768,2019-11-18,【异动股】维生素板块拉升，浙江医药(600216-CN)涨5.81%,财华社
1769,2019-11-18,维生素板块快速走高 浙江医药涨逾5%,证券时报网
1770,2019-11-18,医药股异动走强 九典制药率先涨停,证券时报网
1771,2019-11-18,维生素概念板块持续走强 新和成(002001.SZ)涨超4%,格隆汇
