1011,2020-10-18,【兴证金融 傅慧芳】银行业周报（10.12-10.18）:社融高增行业景气度提升，银行法修改稿聚焦金融风险防范,兴证金融
1012,2020-10-16,千淘万漉虽辛苦 四季度要配银行股？,中投网
1013,2020-10-16,银行9月金融数据点评：社融超预期多增，M2增速提升，给予“强于大市”评级,中银国际
1014,2020-10-16,服装巨头成股神？两个月狂卖宁波银行大赚22亿,券商中国
1015,2020-10-15,外资小幅流出：金龙鱼市值冲入前三 24亿资金买入银行股,新浪
1016,2020-10-15,【研报掘金】低估值与经济复苏共振 银行股有望否极泰来应积极看多,证券时报网
1017,2020-10-15,外资小幅流入：22亿主力买入银行股 恒生电子遭卖出超6亿,新浪
1018,2020-10-15,快讯：银行板块早盘大涨 杭州银行涨7%,新浪
1019,2020-10-15,金融股普涨 杭州银行、平安银行涨约5%,e公司
1020,2020-10-14,银行角度看9月社融：经济修复、融资需求旺盛，利好银行板块【中泰银行戴志锋/邓美君/贾靖】,传统借贷vs新型金融
1021,2020-10-14,21金融研究： 商业银行资本消耗加剧，如何拓宽资本补充路径？,21世纪经济报道
1022,2020-10-14,21金融研究：商业银行资本消耗加剧，如何拓宽资本补充路径？,21世纪经济报道
1023,2020-10-13,杭州银行高管团队去年人均年薪近200万，副行长最高年薪270万,和讯
1024,2020-10-13,杭州银行高管去年最终薪酬：11人有1人年薪未过百万,中国经济网
1025,2020-10-10,深扒券商10月金股：浙商证券连续两月推荐焦点科技 最具接盘风险,新浪
1026,2020-10-09,21测评丨“妖股专业户”天风证券变乖了,21世纪经济报道
1027,2020-10-09,21金股测评丨30家券商10月金股榜 医药食饮热度下降,21世纪经济报道
1028,2020-10-09,东兴证券：9月金股组合亏损7.11% 10月荐股名单出炉 亏损,新浪
1029,2020-10-09,银行业三季报前瞻：人间正道是沧桑,新浪
1030,2020-10-09,银行网点变少影响几何,中国金融信息网
1031,2020-10-09,银行行业月报：预期底部 修复可期,新浪
1032,2020-10-03,银行网点变少，影响几何,中国经济网
1033,2020-09-30,杭州银行贷款结构存隐患 业绩光鲜但难掩风险瑕疵,新浪
1034,2020-09-30,板块破净率近七成机构把脉银行股价值,中证报
1035,2020-09-30,今年银行永续债发行突破4000亿元，中小银行成“生力军”,Wind
1036,2020-09-29,杭州银行(600926.SH)：唐荣汉独立董事任职资格获监管机构核准,格隆汇
1037,2020-09-28,银行行业：LPR报价不变 银行板块仍具防御性,新浪
1038,2020-09-27,非银行金融／银行行业周报(第三十九周),新浪
1039,2020-09-27,银行到底降薪没？苏农银行上半年平均薪酬近38万,每日经济新闻
1040,2020-09-26,上海银行业绩起伏不定，过高负债成本降低息差、吞噬利润，难以提供股东稳定回报,红周刊
1041,2020-09-26,运营迈出关键一步，敏捷引领二次飞跃，看银行如何把握转型新“基”遇,中国电子银行网
1042,2020-09-25,【读财报】上半年普惠型小微企业贷款哪家银行支持力度强？,新华网
1043,2020-09-25,【东北晨会0925】光伏行业动态点评/银行行业周报/宝钢包装,东北证券研究所
1044,2020-09-25,【东北银行王凤华/陈玉卢】行业周报：小贷公司融资上限5倍杠杆，开启行业规范监管,东北证券研究所
1045,2020-09-24,银行股估值躺底 资金二季度精准加仓,上证报
1046,2020-09-23,【读财报】上市银行核心监管指标排行：10家拨备覆盖率超300% 交行、浦发、华夏垫底,新华网
1047,2020-09-23,【中原晨会0923】市场分析、银行行业月报,中原证券研究所
1048,2020-09-22,银行行业月度报告：信贷结构调整，负债成本上行，维持“同步大市”评级,财信证券
1049,2020-09-22,部分银行保本理财产品清零，中小行揽储“压力山大”,第一财经
1050,2020-09-21,杭州银行：颜延辞去独立董事等职务 董监高成员变化,Wind
1051,2020-09-21,金融控股公司管理办法点评：金控新牌照 管理有章法,新浪
1052,2020-09-21,全国100家商业银行财富管理能力排名报告（2020上半年）,和讯
1053,2020-09-20,银行业周报229期：金控新牌照 管理有章法,新浪
1054,2020-09-19,中小银行密集介入隐性债务置换，监管提示风险,21世纪经济报道
1055,2020-09-18,研究 | 厦门银行：利息净收入连续两年“开倒车” 向老赖放贷风控存漏洞 经营问题,中金在线
1056,2020-09-17,杭州银行授权高管可动态调整理财业务转型安排,上证报
1057,2020-09-17,杭州银行(600926.SH)：董事会通过关于进一步推动理财业务转型发展的议案,格隆汇
1058,2020-09-17,A股融资融券日报：两融余额增加1.73亿元（9月16日）,Wind
1059,2020-09-17,"两融透析：大盘缩量震荡,拉卡拉融资盘小幅流入",财富动力网
1060,2020-09-17,"大盘缩量震荡,拉卡拉融资盘小幅流入",财富动力网
1061,2020-09-16,大金融护盘，银行板块再扛大旗,Wind
1062,2020-09-15,宽信用稳步推进：银行业2020年8月金融数据点评,中信证券
1063,2020-09-15,A股融资融券日报：两融余额增加37.47亿元（9月14日）,Wind
1064,2020-09-15,今年以来永续债发行规模逾3800亿元,Wind
1065,2020-09-14,2020年8月金融数据点评：地方债放量 社融结构继续向好,新浪
1066,2020-09-14,【读财报】上市银行监管指标排行：10家拨备覆盖率超300%,面包财经
1067,2020-09-14,新华财经·读财报|上市银行拨备覆盖率半数超250%,光明网
1068,2020-09-14,理财规模上半年降至22.1万亿元，部分银行保本理财产品“清零”,Wind
1069,2020-09-13,【浙商||银行梁凤洁/邱冠华】地方债拉动社融超预期,大话金融
1070,2020-09-13,银行角度看8月社融：需求修复是主要驱动 利于经济和银行板块,新浪
1071,2020-09-12,8月金融数据点评：8月地方债贡献社融高增 M1增速持续上行,新浪
1072,2020-09-10,房抵贷之殇：极难实现纯线上化，微众、新网等互联网银行跃跃欲试,和讯
1073,2020-09-10,八家城商行科技战略对比：这家银行研发人员占比超11%,零壹财经
1074,2020-09-10,杭州银行北京分行：引金融活水浇灌文化企业,北京商报
1075,2020-09-10,银行代销他行理财产品将成大趋势，专家称应注意风险隔离,Wind
1076,2020-09-09,杭州银行(600926)：资产质量稳定基石 业务转型锦上添花-调研纪要,新浪
1077,2020-09-09,拨备增长吞噬上市银行净利，上半年计提资产减值逾8600亿元同比增38.61%,Wind
1078,2020-09-08,银行股走强 杭州银行涨逾4%,中证网
1079,2020-09-08,金融股逆市走强，银行ETF早盘涨超1%,Wind
1080,2020-09-08,【行情】银行板块开盘走高，杭州银行大涨4%，平安银行、常熟银行、兴业银行、长沙银行跟涨,金十数据
1081,2020-09-08,快讯：银行股小幅拉升 杭州银行涨4%,新浪
1082,2020-09-08,银行板块拉升，杭州银行涨超4%,Wind
1083,2020-09-08,银行降薪实锤？合计下降5.9亿元，但人均仍超2万,21世纪经济报道
1084,2020-09-07,养猪、做美妆、办银行…水泥企业是怎样“不务正业”的,中国水泥网
1085,2020-09-07,城商行上半年业绩表现突出 中间业务收入成新利润增长点,新浪
1086,2020-09-07,上市银行中期盈利8554亿加大拨备计提 不良率平均1.43%七成拨备覆盖率超200%,长江商报
1087,2020-09-06,深度！银行业2020中报的关键词：稳健、分化；重申转看多行业【中泰银行·戴志锋/邓美君/贾靖】,传统借贷vs新型金融
1088,2020-09-05,13家上市城商行中报对比：六家规模破万亿，北京和郑州银行增收反降利,零壹财经
1089,2020-09-05,A股城商行净利多呈正增长，有头部城商行存业绩隐忧,Wind
1090,2020-09-04,【银行中报观察】A股城商行净利多呈正增长有头部城商行存业绩隐忧,经济观察报
1091,2020-09-04,杭州银行(600926)中报点评：业绩增长与资产质量齐头并进,新浪
1092,2020-09-04,银行业20年半年报综述：相信自然增长 出清存量风险,新浪
1093,2020-09-03,上市银行2020年半年报综述：今年大不同 上市银行中报的五个关注点,新浪
1094,2020-09-02,13家城商行11家净利正增长：宁波银行杭州银行增逾12%,澎湃新闻
1095,2020-09-02,今年银行永续债融资即将突破4000亿！3张图了解现状,Wind
1096,2020-09-02,银行股估值躺底，资金二季度精准加仓,Wind
1097,2020-09-02,银行业上半年净利增速普遍下降 银行股四季度估值或合理修复 盈利能力下降,南方财经网
1098,2020-09-01,九月金股汇：低估值和高增长齐舞,新浪
1099,2020-09-01,【研报掘金】经济持续复苏估值底部确认 银行板块已进入绝对收益期,证券时报网
1100,2020-09-01,半年报季银行股价哪家强：城商行表现抢眼，国有大行整体萎靡,澎湃新闻
1101,2020-09-01,半年报里的秘密：银行拨备计提实情,21世纪经济报道
1102,2020-09-01,杭州银行上半年业绩增长放缓因计提信用减值损失49.56亿元 盈利能力下降,GPLP犀牛财经
1103,2020-09-01,银行股估值已在底部 资金二季度精准加仓,中国证券网
1104,2020-09-01,银行2Q20业绩回顾：一轮非典型盈利提升 一次更彻底的报表出清,新浪
1105,2020-09-01,银行股估值已在底部 资金二季度精准加仓,上证报
1106,2020-09-01,受三大因素影响，上市银行上半年净利润同比降逾9%,Wind
1107,2020-09-01,详解3973份A股半年报：25家“双增”公司市值合计比年初增长逾3824亿元,Wind
1108,2020-09-01,加大拔备、让利实体,时代周报
1109,2020-09-01,加大拨备让利实体 银行业绩负增长无需悲观,时代在线
1110,2020-08-31,上市城商行中报交卷，净利表现PK掉了大行和股份行,第一财经
1111,2020-08-31,机构强烈推荐22只个股-更新中,中财网
1112,2020-08-31,杭州银行(600926.SH)：徐云鹤和吴建民董事任职资格获监管机构核准,格隆汇
1113,2020-08-31,中泰金工可转债发行跟踪周报(0830),ZTQuant
1114,2020-08-31,杭州银行不良率1.24%达上市以来最佳 净息差逆势提升减值前利润增逾25%,长江商报
1115,2020-08-31,杭州银行上半年信用减值损失增36% 人均薪酬近26万元,中国经济网
1116,2020-08-30,【兴证金融 傅慧芳】银行业周报（08.24-08.30）：上市银行中报显著分化，营收普遍放缓但不良/拨备差异性加大,兴证金融
1117,2020-08-29,【杭州银行】业绩保持高增速，资产质量改善,志明看金融
1118,2020-08-29,上市银行中报：净利润增速创3年新低 盈利能力下降,中证报
1119,2020-08-29,多家银行中间收入大增 盈利结构转型提速,中国经营报
1120,2020-08-28,杭州银行2020上半年净利增长12%至41亿，不良贷款率降至1.24%,零壹财经
1121,2020-08-28,杭州银行2020半年报：净利润40.68亿元 同比增长12.11％,金融界
1122,2020-08-28,杭州银行(600926)：经营靓丽 资产质量持续改善,新浪
1123,2020-08-28,杭州解百：择机出售持有的杭州银行股票不超过418.20万股,Wind
1124,2020-08-28,A股收盘综述：创业板综指本周累升超5%，上证指数连涨五周,Wind
1125,2020-08-28,杭州银行(600926)：增速保持靓丽 息差支撑业绩,新浪
1126,2020-08-28,A股午盘综述：创业板综指半日升0.56%，“喝酒”炒创业板行情再现,Wind
1127,2020-08-28,杭州银行(600926)：利润继续双位数增长 不良率再创新低,新浪
1128,2020-08-28,杭州银行发挥“科技金融”优势 深度服务科创型企业,上证报
1129,2020-08-28,快讯：杭州银行涨停 报于12.58元,金融界
1130,2020-08-28,银行股大幅拉升 杭州银行涨停 多股大涨,金融界
1131,2020-08-28,银行股拉升，杭州银行触及涨停,Wind
1132,2020-08-27,杭州银行上半年实现净利润40.68亿元 同比增长12.11%,上证报
1133,2020-08-27,杭州银行资产规模破万亿元，上半年净利润40.7亿元、同比增长12.11%,证券时报
1134,2020-08-27,杭州银行半年报：关键业绩指标好于预期 资产质量持续改善,新浪
1135,2020-08-27,杭州银行上半年营收增23%净利增12%，不良率1.24%,澎湃新闻
1136,2020-08-27,杭州银行半年报：成本收入比23.71% 较上年同期下降1.44% 盈利能力下降,新浪
1137,2020-08-27,杭州银行(600926.SH)半年度净利润升12.11%至40.68亿元,格隆汇
1138,2020-08-27,杭州银行：上半年净利同比增12% 拟发行不超150亿元可转债,e公司
1139,2020-08-27,杭州银行(600926.SH)拟发行不超150亿元A股可转债,格隆汇
1140,2020-08-26,杭州银行打造资本市场融资服务体系,上证报
1141,2020-08-26,中国短期融资券及中期票据信用分析周报,新浪
1142,2020-08-21,城商行异地放款迎强监管？多家助贷平台选择这一策略破局,腾讯网
1143,2020-08-21,杭州银行董事会秘书毛夏红任职资格已获得批复,资本邦
1144,2020-08-20,杭州银行(600926.SH)：毛夏红董秘任职资格获监管机构核准,格隆汇
1145,2020-08-20,银行行业深度专题：他山之石 探索我国存款利率市场化的深入改革,新浪
1146,2020-08-20,A股早报2020年8月20日星期四,Wind
1147,2020-08-19,A股共发生119宗大宗交易成交27.99亿元（8月19日）,Wind
1148,2020-08-19,"杭州银行现1笔大宗交易 共成交14,842.50万元",新浪
1149,2020-08-19,杭州银行今日大宗交易成交1381.98万股，成交价10.74元折价8.36%,Wind
1150,2020-08-18,A股收盘综述：上证指数小涨0.36%收于两年半高点，中国人寿再涨5%,Wind
1151,2020-08-18,A股午盘综述：上证指数半日升0.42%，食品、农业、黄金板块大涨,Wind
1152,2020-08-18,银行股临近午盘仍旧低迷，杭州银行跌超5%,Wind
1153,2020-08-18,银行股回调，杭州银行、长沙银行均跌超2%,Wind
1154,2020-08-18,金融股昨日爆发，券商保险分级B集体大涨,Wind
1155,2020-08-17,深度*行业*银行业周报：银行业中期业绩利空落地 业绩期关注绩优个股,新浪
1156,2020-08-17,银行行业周报225期：风险溢价下降和基本面向上,新浪
1157,2020-08-17,多项利好刺激，行情风向标券商股“卷土重来”,第一财经
1158,2020-08-17,ABS一周市场回顾,新浪
1159,2020-08-17,银行业周报：防范化解金融风险 行业估值修复可期,新浪
1160,2020-08-17,A股暴涨1.6万亿，五大事件驱动市场走强,券商中国
1161,2020-08-17,银行业周报：H1行业利润下降9.4%靴子落地 H2预计处置力度继续加大 盈利能力下降,新浪
1162,2020-08-17,A股收盘综述：上证指数劲升2.34%，中国人寿、成都银行、招商证券收于涨停,Wind
1163,2020-08-17,大金融板块持续发力！杭州银行涨停 聚焦浙江省获券商青睐,金融界
1164,2020-08-17,快讯：杭州银行涨停 报于12.8元,金融界
1165,2020-08-17,A股沸腾！沪指再上3400，有机构称月度级回调结束,中证报
1166,2020-08-17,银行行业报告：首份上市行中报落地稳定预期 看好银行低估值修复行情,新浪
1167,2020-08-17,杭州银行午后封住涨停，本月大涨超35%,Wind
1168,2020-08-17,解盘：资金流入400亿，炒股软件、次新、数字货币领涨,Wind
1169,2020-08-17,A股午盘综述：上证指数半日涨2.27%，中国人寿连续两日涨停,Wind
1170,2020-08-17,【行情】银行板块持续拉升，成都银行触及涨停，无锡银行、杭州银行、平安银行、常熟银行等跟涨,金十数据
1171,2020-08-17,银行板块迎来久违普涨又有股东“择机”减持 减持股份,证券时报
1172,2020-08-16,【兴证金融 傅慧芳】银行业周报（08.10-08.14）：H1行业利润-9.4%靴子落地，H2预计处置力度继续加大,兴证金融
1173,2020-08-14,银行股拉升背后：破净率超七成，外资提前抢筹,Wind
1174,2020-08-14,A股收盘综述：上证指数收涨1.19%连续三周上扬，创业板指连跌两周,Wind
1175,2020-08-14,【行情】银行板块午后急拉，成都银行大涨7%，南京银行、杭州银行、宁波银行纷纷走强,金十数据
1176,2020-08-14,银行板块拉升，成都银行、杭州银行快速上涨,Wind
1177,2020-08-14,北京元六鸿远电子科技股份有限公司关于使用部分暂时闲,证券时报
1178,2020-08-13,降薪传闻四起，“金饭碗”还香吗？一文揭开金融业薪酬全景图,腾讯网
1179,2020-08-13,助力科技起飞 杭州银行陪伴企业共同成长,和讯
1180,2020-08-13,银行：预计头部银行信用成本短期见顶 重估银行股的开始,新浪
1181,2020-08-12,赛微电子(300456.SZ)及子公司向银行申请综合授信额度,格隆汇
1182,2020-08-12,银行2020年7月金融数据点评：信贷结构大幅优化 宏观经济向好趋势明朗,新浪
1183,2020-08-12,二季度监管数据点评：提足拨备 做实利润,新浪
1184,2020-08-12,银行业7月社融点评：低于预期的社融数据其实并不弱-7月社融点评,新浪
1185,2020-08-11,让利意图明显银行业中报负增符合预期 银行股估值有望稳步提升,搜狐
1186,2020-08-11,解盘：权重拉升指数，稀土、航母、白酒领涨,Wind
1187,2020-08-11,银行股拉升！上半年净利降9.4%，机构这样看丨牛熊眼 盈利能力下降,第一财经
1188,2020-08-11,银行板块强势拉升 成都银行涨停 杭州银行、常熟银行、等涨幅均超过5％,金融界
1189,2020-08-11,银行业研究：负增长客观反映经营压力 头部银行信用成本有望短期见顶,新浪
1190,2020-08-10,【兴证金融 傅慧芳】银行业周报（08.10-08.14）：H1行业利润-9.4%靴子落地，H2预计处置力度继续加大,兴证金融
1191,2020-08-10,【中信建投银行杨荣】上半年银行业监管数据点评：《净利润负增长，资产质量夯实》,eResearch杨荣团队
1192,2020-08-10,银行行业跟踪：政策边际收紧 看好低估值修复行情,新浪
1193,2020-08-09,银行行业周报：货币政策确认中性 7月社融料延续较高增速,新浪
1194,2020-08-09,【兴证金融 傅慧芳】货币政策确认中性，7月社融料延续较高增速 ——银行业周报（2020.08.03-2020.08.07）,兴证金融
1195,2020-08-06,银行业主题研究系列之一：银行如何投基建及本轮基建影响解析,新浪
1196,2020-08-06,杭州银行(600926.SH)高管任职资格获监管机构核准,格隆汇
1197,2020-08-06,巴菲特20亿美元买美国银行股票停不住手，A股银行股能买吗,中证报
1198,2020-08-05,每日理财观察：现货黄金突破2000美元关口,Wind
1199,2020-08-05,银行行长离职去哪儿了？密集“下海”案例锐减 董监高成员变化,Wind
1200,2020-08-04,银行Ⅱ行业：不良资产处置的新方式,新浪
1201,2020-08-04,公募基金持银行股比例降至历史次低,Wind
1202,2020-08-04,基金持仓占比降至历史次新低，银行保险为何“失宠”？,Wind
1203,2020-08-03,银行点评资管新规延期至2021年底：过渡期正式延长 银行整改压力减轻,新浪
1204,2020-08-03,今天3家银行限售股解禁，其中一家流通盘激增近400% 解禁,中证报
1205,2020-08-03,银行行业周报：过渡期延长落地 银行整改压力减轻,新浪
1206,2020-07-30,杭州银行(600926.SH)：三位高管任职资格获监管机构核准,格隆汇
1207,2020-07-28,独家丨全国288家银行理财能力排行榜（2020年2季度）,和讯
1208,2020-07-27,银行业周报222期：资金流向与货币政策走向,新浪
1209,2020-07-27,银行行业周报：中小银行MPA考核或放松 信贷扩张可期,新浪
1210,2020-07-27,杭州银行(600926)公司深度研究：五年战略成果亮眼 业绩高增前景广阔,新浪
1211,2020-07-26,非银金融行业本周聚焦：券商Q2经营业绩向好 关注大金融板块“超低持仓”下的投资机会,新浪
1212,2020-07-24,小银行想玩“断舍离”？不良资产成为定增新搭头,Wind
1213,2020-07-23,2020年二季度银行板块基金持仓分析：人弃我取 抓住仓位史低机会,新浪
1214,2020-07-23,银行Ⅱ：二季度继续减持 看好底部反弹 减持股份,新浪
1215,2020-07-23,银行系调研路径揭晓：医药、科技、消费和可转债,上证报
1216,2020-07-23,杭州银行股份有限公司关于变更,证券时报
1217,2020-07-22,杭州银行变更注册资本获得核准,上证报
1218,2020-07-22,杭州银行(600926.SH)：变更注册资本获浙江银保监局核准,格隆汇
1219,2020-07-22,2020Q2公募基金持仓分析：公募配置降至低位 板块配置价值提升,广发证券
1220,2020-07-22,银行周报第23期：理财步入正轨 LPR利率已维持4个月无变化,新浪
1221,2020-07-20,银行板块异动，银行ETF涨1.7%成交超3亿元,Wind
1222,2020-07-20,中信证券：银行股价下行概率和空间低,Wind
1223,2020-07-20,银行行业：影子银行及互联网贷款监管加强 公开市场操作利率平稳,新浪
1224,2020-07-19,【兴证金融 傅慧芳】信贷资金投放监管趋严，中小金融机构供给侧改革推进——银行业周报（200711—200717）,兴证金融
1225,2020-07-16,上市公司正负面新闻2020年7月16日星期四,Wind
1226,2020-07-15,晚间重要公告2020年7月15日星期三,Wind
1227,2020-07-15,杭汽轮B：收到“杭州银行”分红收益9515.63万元,Wind
1228,2020-07-09,海联讯(300277.SZ)拟向两家银行申请综合授信额度,格隆汇
1229,2020-07-07,A股早报2020年7月7日星期二,Wind
1230,2020-07-07,2020上半年过会零记录中小银行IPO缘何“入冬”,Wind
1231,2020-07-06,银行Ⅱ：明确标债资产认定 引导融资成本下行,新浪
1232,2020-07-06,涨停板解密：金融股掀涨停潮！（7月6日）,Wind
1233,2020-07-06,【研报掘金】资金面与基本面共振 银行板块估值有非常大的提升空间,证券时报网
1234,2020-07-03,银行点评：银行要如何配置 向上空间如何？,新浪
1235,2020-07-03,A股乘风破浪，还有哪些价值洼地在隐秘角落？,证券时报网
1236,2020-07-02,银行Ⅱ：注资中小行 补血加活血,新浪
1237,2020-06-30,杭州银行(600926.SH)年报推10派3.5元股权登记日7月8日,格隆汇
1238,2020-06-28,主承销商：精功集团“17精功MTN001”违约后续工作进展情况 未按时兑付本息,Wind
1239,2020-06-24,上证综指半日升0.15%，半导体概念板块大涨稳定市场,Wind
1240,2020-06-23,杭州银行今日大宗交易成交63万股，成交价8.84元溢价0.0%,Wind
1241,2020-06-19,2020年中期投资策略报告：中小银行深化改革,新浪
1242,2020-06-19,一银行将迎全“70后”高管团队,Bank资管
1243,2020-06-19,银行行业研究：【太平洋银行】共生共荣 风雨过后 便是彩虹,新浪
1244,2020-06-18,杭州银行(600926.SH)：王平董事任职资格获监管机构核准,格隆汇
1245,2020-06-17,央行及银保监会行政处罚汇总（6月17日） 金融监管处罚,Wind
1246,2020-06-17,让利意图明显银行业中报负增符合预期银行股估值有望稳步提升,财华社
1247,2020-06-17,低过房贷利率？多家银行定向降低利率抢收“个贷”,证券时报
1248,2020-06-17,新老基建齐飞，A股现普涨格局,Wind
1249,2020-06-16,银行息差、资产质量和估值的国际比较-天风|银行,志明看金融
1250,2020-06-12,【研报掘金】悲观预期充分反映在银行股走势中 目前正是板块布局重要时机,证券时报网
1251,2020-06-12,A股早报2020年6月12日星期五,Wind
1252,2020-06-12,1142只理财子公司产品得以登记，固收类占比近八成,Wind
1253,2020-06-11,杭州银行八亿贷款六年有借无还 胜诉后借款恐仍难追回,新浪
1254,2020-06-11,这家大行股价盘中跌逾5% 股票解禁日股价必“受伤”？ 解禁,中投网
1255,2020-06-11,网贷天眼晚报：杭州银行12亿贷款打水漂银行员工出售客户征信被判刑,和讯
1256,2020-06-11,银行股解禁大考表现分化 5家银行年内推出股价稳定方案 解禁,中证报
1257,2020-06-10,75张罚单披露：被挪用贷款资金主要流向房地产、股市、理财 其他违规处罚,澎湃新闻
1258,2020-06-10,时代热评 | 杭州银行量产千万富豪高管，近12亿贷款若“打水漂”谁担责？,时代在线
1259,2020-06-10,邮储银行大跌逾5%！机构：原因有这些 连续下跌,中证报
1260,2020-06-09,80后捞金不良资产反成不良 欠下银行本金18.73亿,新浪
1261,2020-06-08,杭州银行(600926.SH)：1.89亿股首发限售股6月12日解禁 解禁,格隆汇
1262,2020-06-08,时代热评 | 金华银行盈利能力持续下滑，徐雅清连任董事长达十年 盈利能力下降,时代在线
1263,2020-06-08,8亿多贷款6年仍未归还杭州银行沦为钢贸“接盘侠”？,证券时报
1264,2020-06-02,杭州银行：公司上海分行与璟合实业等金融借款合同纠纷案获一审判决 诉讼纠纷,Wind
1265,2020-05-30,机构看好八成以上银行成份股，投资优质银行将获确定性回报,Wind
1266,2020-05-28,深化金融改革 强化服务实体,金融界
1267,2020-05-27,快讯：银行板块早盘小幅拉升 南京银行等多股走强,新浪
1268,2020-05-27,券商首次关注6股并给予买入评级（5月27日）,Wind
1269,2020-05-27,20股获券商买入评级 金达威目标涨幅达39.61%,Wind
