757,2021-02-28,利润增速骤降、跌落千亿台阶 杭州银行这件事偷着乐 盈利能力下降,新浪
758,2021-02-28,中银早刊-20210302,中银证券研究
759,2021-02-27,上市公司正负面新闻2021年2月27日星期六,Wind
760,2021-02-26,晚间重要公告2021年2月26日星期五,Wind
761,2021-02-26,中国可转债周报：上行转震荡后 转债的四条对策,新浪
762,2021-02-26,【浙商|梁凤洁/邱冠华】再迎业绩催化，看好银行板块,大话金融
763,2021-02-26,【银行视点】615家上市公司购买结构性存款产品，杭州银行0.94％股份被划转，盛银消金“风控老将”上任！,金融界
764,2021-02-26,杭州银行：2020年净利润同比增长8.22%（业绩快报）,Wind
765,2021-02-26,杭州银行：2020年净利润71.45亿元同比增长8%,格隆汇
766,2021-02-26,0.94％股份被划转！杭州银行股东权益发生变动，实际控制人仍为杭州市财政局 减持股份,金融界
767,2021-02-25,杭州银行：杭州钱塘新区财政金融局将所持公司0.94%股份划转给钱塘新区产业集团 资产异常,Wind
768,2021-02-24,银行：为何近期银行龙头个股出现调整？,新浪
769,2021-02-22,【行情】银行板块大幅分化，平安银行跌逾6%，杭州银行、无锡银行、兴业银行等跌幅居前，常熟银行、工商银行、建设银行等处于上涨状态,金十数据
770,2021-02-22,A股午盘综述：创业板指跌2.53%，基金重仓股持续杀跌,Wind
771,2021-02-22,银行股走弱，宁波银行跌近4%,Wind
772,2021-02-19,【专栏】消金公司化解杠杆风潮初现，这家持牌消金拟出让大部分股权？,零壹财经
773,2021-02-19,【行情】银行板块活跃，长沙银行涨4%，常熟银行、杭州银行、青岛银行等跟随上涨,金十数据
774,2021-02-10,4Q20银保监会监管指标点评：大行业绩回归正增长 中小行不良率回落至疫情前,新浪
775,2021-02-09,银行行业跟踪：大环境利好明显 板块估值有望进一步回升,新浪
776,2021-02-09,每日理财观察：央行发布中国货币政策执行报告,Wind
777,2021-02-09,消费金融公司增资“补血”进行时,Wind
778,2021-02-08,银行行业周报：央行规范地方银行异地揽储 上市银行首份年报披露,新浪
779,2021-02-08,股海导航 2月8日沪深股市公告提示,新浪
780,2021-02-08,大金融板块上演“冰火两重天”,Wind
781,2021-02-07,晚间公告热点追踪：欧菲光抛售摄像头业务 闻泰科技“接盘”,新浪
782,2021-02-07,杭银消金再次启动增资扩股 大股东杭州银行拟认购3.749亿股,新浪
783,2021-02-07,2月7日晚间上市公司重要公告汇总,中金在线
784,2021-02-07,周度跟踪 | 流动性回归平稳，北向资金继续增持银行【中泰银行·戴志锋/邓美君/贾靖】,传统借贷vs新型金融
785,2021-02-07,2月7日上市公司晚间公告速递,新浪
786,2021-02-07,杭州银行：拟参与杭银消费金融股份有限公司增资扩股,Wind
787,2021-02-07,杭州银行：拟参与杭银消金增资扩股,e公司
788,2021-02-07,银行业周报：互联网存款监管持续收紧 料社融高位小幅回落,新浪
789,2021-02-07,什么信号？社保基金“逆市”减持中行，7个月套现19亿,券商中国
790,2021-02-05,资本饥渴？杭州银行上市不到五年再融资超570亿 信用减值损失大增遭监管问询 问询,投资时报
791,2021-02-05,招商银行连创三天新高！银行股起飞？这些大佬已布局,上证报
792,2021-02-04,策略日报：指数全线回落 市场二八分化,新浪
793,2021-02-04,一“酱”功成万股哭!A股险守3500点，科技白马再遭估值杀,Wind
794,2021-02-04,A股收盘综述：上证指数跌0.44%，创业板指跌0.72%,Wind
795,2021-02-04,银行股持续逆市走高，机构认为其配置价值凸显丨牛熊眼,第一财经
796,2021-02-04,解盘：“股王”涨超5%，科技、基本金属、互联网表现低迷,Wind
797,2021-02-04,银行板块再度拉升 招商银行杭州银行等盘中再创新高,证券时报网
798,2021-02-04,【行情】银行板块拉升，成都银行涨4%，杭州银行、邮储银行、无锡银行涨3%,金十数据
799,2021-02-04,6只银行股创新高！巴菲特门徒开始布局，银行板块彻底起飞？,券商中国
800,2021-02-03,【行情】银行板块异动拉升，平安银行涨5%，兴业银行、杭州银行、成都银行、邮储银行等跟涨,金十数据
801,2021-02-03,银行周报：利率上行 经济向好 看好银行,新浪
802,2021-02-01,多地按揭贷款额度大幅收紧11家A股上市银行房贷集中度“越红线”,每日经济新闻
803,2021-02-01,证监会：东方盛虹等三家企业发行可转债事项获通过,Wind
804,2021-02-01,杭州银行：公开发行可转债申请获证监会审核通过,e公司
805,2021-02-01,杭州银行：公开发行可转债申请获证监会审核通过,Wind
806,2021-02-01,杭州银行(600926.SH)：公开发行A股可转债申请获得通过,格隆汇
807,2021-01-30,11家A股上市银行房贷集中度“越红线”，多地按揭贷款额度大幅收紧,腾讯网
808,2021-01-28,研究所2021年2月精选组合,新浪
809,2021-01-28,证监会：东方盛虹、杭州银行、帝欧家居发行可转债事项将于2月1日上会,Wind
810,2021-01-28,银行-工业企业利润数据点评：制造业拉动作用明显 稳杠杆下风险下降,新浪
811,2021-01-27,银行基本面跟踪二十三：Q4持仓延续回升 继续看好板块修复,新浪
812,2021-01-27,解盘：金融撑指数，网络游戏、网红经济、影视略涨,Wind
813,2021-01-27,浙江银保监局持续深化金融支持创新发展 助力数字浙江建设和高水平创新强省战略,中国网
814,2021-01-27,银行股盘初走高，无锡银行升逾5%领涨,Wind
815,2021-01-25,歌华有线(600037.SH)：认购银行结构性存款合计12.5亿元,格隆汇
816,2021-01-24,凛冬将至！多家银行被爆停贷！万亿房企债务将到期,21世纪经济报道
817,2021-01-23,房贷新规与信贷变局：房企债务置换有新花样,Wind
818,2021-01-21,杭州银行两宗违法遭罚 经收的海关税款存在延压情况 金融监管处罚,中国经济网
819,2021-01-21,银行业央行4Q20问卷调查点评：贷款供需良好 经济稳健发展,新浪
820,2021-01-21,22天赚10亿！“巴菲特接班人”再度抢筹银行股,券商中国
821,2021-01-19,上市银行首批业绩快报超预期，A股“三傻”开年成“双雄”,Wind
822,2021-01-19,"什么情况？这家券商竟可""匹敌""蚂蚁集团？基金投顾业务规模突破60亿，为何券商都在发力？",券商中国
823,2021-01-18,银行行业周报：社融下降不改基本面 多项政策呵护市场,新浪
824,2021-01-14,杭州银行8亿元借款或难收回 贷款管理多次被罚 信用减值损失飙升至74亿,中金在线
825,2021-01-11,解盘：人气略有回升，半导体设备、稀土、摄像头、汽车领涨,Wind
826,2021-01-11,【异动股】银行板块拉升，杭州银行(600926-CN)涨5.3%,财华社
827,2021-01-11,业绩快报超预期 银行股出现小幅反弹,北京商报
828,2021-01-09,杭州银行8.37亿元借款收回遇阻 信用减值损失增幅超营收增速,电鳗快报
829,2021-01-06,杭州银行8亿本金贷款难收 去年前3季信用减值损失74亿,中国经济网
830,2021-01-06,银行股逆市走强，银行ETF涨近2%,Wind
831,2021-01-06,看重高股息率，险资今年仍愿加仓银行股,Wind
832,2021-01-05,房企融资“三条红线”试点或扩围,Wind
833,2021-01-05,数字人民币在上海试点使用，三主线关注产业链投资机会丨牛熊眼,第一财经
834,2021-01-05,银行房地产贷款占比考核冲击：7股跌超6%，零售转型逻辑生变？,Wind
835,2021-01-05,解盘：能源、金融拖累指数，乳业、白酒、猪产业领涨,Wind
836,2021-01-05,银行股尽墨持续回调，银行ETF获资金逆向加仓,Wind
837,2021-01-05,银行板块延续弱势 杭州银行、成都银行跌超4%,e公司
838,2021-01-05,银行板块跌势不止，成都银行、招商银行、兴业银行、杭州银行均下挫逾3%,Wind
839,2021-01-05,银行ETF新年首日成交12.14亿元，成当日全市场成交额最大银行ETF,Wind
840,2021-01-05,房贷新规下银行股大跌，调整资产结构迫在眉睫,Wind
841,2021-01-04,A股收盘综述：2021年开门红，上证指数重回3500上方、宁德时代涨15%,Wind
842,2020-12-31,【银行】房贷集中度监管文件点评：整改压力可控，差异化监管促平稳过渡。,中银证券研究
843,2020-12-25,【兴证金融 傅慧芳】银行业周报（201221-201227）：银保监会明确五大监管方向，理财子销售渠道迎来变革,兴证金融
844,2020-12-25,杭州银行积极践行普惠金融 切实服务小微企业,北京商报
845,2020-12-25,选读 | 杭州银行：谋数字创新 求转型发展,银行家杂志
846,2020-12-25,【民生研究】总量+行业：2021年年度投资策略(更新宏观信贷和社融展望、金融、计算机),MS研究
847,2020-12-24,银行股拉升，厦门银行涨超5%,Wind
848,2020-12-23,先锋电子：拟授权管理层可择机出售杭州银行不超235.2万股,Wind
849,2020-12-23,先锋电子(002767.SZ)：拟授权管理层可择机出售杭州银行不超235.2万股,格隆汇
850,2020-12-23,先锋电子(002767.SZ)拟择机出售杭州银行股票不超235.2万股,智通财经
851,2020-12-23,银行业点评报告-延期还本付息和信用贷款支持计划延长点评：资产质量压力很有限,新浪
852,2020-12-23,资本补充债发行逾万亿，银行再添“补血”新途径,Wind
853,2020-12-22,资产证券化分析周报：ABS一周市场回顾,新浪
854,2020-12-17,银行行业月度报告：存款增速回升，资金利率下行，维持“同步大市”评级,格隆汇
855,2020-12-17,金融地产行业2021年行业策略：蛰伏已久 蓄势待发,新浪
856,2020-12-15,银行行业周观点报告：同业存单发行规模大幅上升,新浪
857,2020-12-15,解盘：利空来袭资金流出，医药、疫苗、自主可控略涨,Wind
858,2020-12-15,【行情】银行板块走低，厦门银行跌4%，平安银行、西安银行、兴业银行、杭州银行等下挫,金十数据
859,2020-12-11,首届全国信创产业生态创新大赛结果出炉,消费日报网
860,2020-12-11,首届信创大赛总决赛获奖项目全览，一文了解信创“新势力”,砍柴网
861,2020-12-10,银行角度看11月社融：高位维持，支撑经济修复和银行板块逻辑【中泰银行·戴志锋/邓美君/贾靖】,传统借贷vs新型金融
862,2020-12-09,巨资借道ETF扫货 暴力吸金13亿！银行股冲上涨停板,中国基金报
863,2020-12-09,A股午盘综述：上证指数涨0.06%，创业板指跌0.32%,Wind
864,2020-12-09,守初心 谋创新 杭州银行北京分行践行社会责任 助力经济发展,北京商报
865,2020-12-09,银行板块走强，青农商行涨停,Wind
866,2020-12-08,银行行业深度：数字人民币时代银行何去何从 维持“同步大市”评级,格隆汇
867,2020-12-08,中泰证券：继续看好板块估值修复行情（附股）,证券时报网
868,2020-12-07,杭州银行(600926.SH)拟派发优先股股息 每股优先股发放5.2元,智通财经
869,2020-12-07,银行专题-银行核心资本前瞻：补充的规模与方式,新浪
870,2020-12-06,银行业周报：D-SIBS评估影响有限 料社融将延续积极增长,新浪
871,2020-12-04,银行业关于《系统重要性银行评估办法》的点评：评估系统重要性 强化金融稳定性,新浪
872,2020-12-03,WEMONEY研究室日报：央行、银保监发布系统重要性银行评估指标；原猫眼CFO施康平加盟水滴公司,凤凰网
873,2020-12-03,杭州银行拟发150亿可转债 3年间违法违规遭处罚33次,中国经济网
874,2020-12-03,杭州银行拟发可转债 信用减值损失升上半年50亿增36% 资产异常,中国经济网
875,2020-12-02,快讯：银行板块分化 青岛银行再涨停杭州银行下挫,新浪
876,2020-12-02,深度*公司*杭州银行(600926)：基本面持续向好 盈利领先同业,新浪
877,2020-12-01,丰乐种业(000713.SZ)为子公司向银行办理相关业务承担主合同最高额3000万元提供担保 大额借贷担保,智通财经
878,2020-12-01,银行行业月报：修复持续 星火燎原,新浪
879,2020-12-01,点燃市场热情，定增融资实现0突破，银行股发力行情来了,Wind
880,2020-12-01,重新聚焦科技成长，热门板块机构2021策略前瞻,Wind
881,2020-12-01,银行板块午后涨幅略有收窄，邮储银行、杭州银行转跌,Wind
882,2020-12-01,【银行】银行业2021年度策略：老树开新花，厚积以薄发,中银证券研究
883,2020-12-01,银行转型加速 上市银行再融资需求增加,财富动力网
884,2020-11-30,银行行业：ROE底部 估值向上,新浪
885,2020-11-30,银行专题研究报告：大行上涨后买什么？,新浪
886,2020-11-30,巨·个股 | 银行板块上演冲高回落大戏！回落之后，是否具备低吸机会？（附股）,巨丰财经
887,2020-11-30,本周股市三大猜想及应对策略,财富动力网
888,2020-11-29,计算机行业周报：华为智联汽车对计算机行业较详细影响分析！,新浪
889,2020-11-27,恒生电子(600570)：参与公募投顾IT建设一周年 后续仍大有可为,新浪
890,2020-11-27,杭州银行(600926.SH)：李常青独立董事任职资格获监管机构核准,格隆汇
891,2020-11-27,银行角度看3季度货币政策执行报告：贷款利率回升及未来展望,新浪
892,2020-11-26,贷款利率回升及未来展望 ——银行角度看3季度货币政策执行报告【中泰银行·戴志锋/邓美君/贾靖】,传统借贷vs新型金融
893,2020-11-26,中小银行面临四大压力，破局之路抱团取暖,21世纪经济报道
894,2020-11-26,资产超20万亿的127家中小银行，新形势下如何抱团发展？,澎湃新闻
895,2020-11-25,当下操作策略,华安证券订阅号
896,2020-11-25,杭州银行深圳分行开展爱心捐赠、助农扶贫活动,南都网
897,2020-11-24,银行业周报：LPR七连平 金融委定调稳定债市,新浪
898,2020-11-24,【东北银行王凤华/陈玉卢】行业周报：配股重启，外源性资本补充助力银行发展,东北证券研究所
899,2020-11-24,经济回暖业绩向好 机构看好银行股反弹,财富动力网
900,2020-11-23,银行行业周报：配股重启提振银行资本补充动力 本周MLF超额续作,新浪
901,2020-11-22,银行板块创4个多月新高，掘金银行股该怎么选？,重庆商报
902,2020-11-20,【投行参要】每日审核要点及市场动态 | 2020.11.20,兴业证券订阅号
903,2020-11-20,杭州银行今日大宗交易成交551万股，成交价13.32元折价9.08%,Wind
904,2020-11-20,"杭州银行现1笔大宗交易 共成交7,339.32万元",新浪
905,2020-11-20,A股收盘综述：上证指数录得三连升，汽车股掀涨停潮,Wind
906,2020-11-20,A股午盘综述：上证指数涨0.1%，创业板指涨0.57%,Wind
907,2020-11-19,策略日报：指数震荡下跌 创业板下跌2%,新浪
908,2020-11-19,银行行业月报：宏观持续修复 政策利率稳定,新浪
909,2020-11-18,业绩增速趋缓、减值损失大增 应对信用风险杭州银行加大计提力度,投资时报
910,2020-11-18,机构称有逾60%上升空间 股东高管出手增持银行股,中投网
911,2020-11-18,【研报掘金】信用风险缓释长周期逐渐步入尾期 银行板块估值修复有望建议积极布局,证券时报网
912,2020-11-18,业绩增速趋缓，减值损失大增！应对信用风险杭州银行加大计提力度,投资时报
913,2020-11-18,银行业月度报告（2020年10月）：信贷平稳增长，结构持续向好,财信证券研究
914,2020-11-17,A股收盘综述：上证指数收跌0.21%，白酒股午后高台跳水,Wind
915,2020-11-17,银行业周报第35期：包商银行二级资本债全额减记 市场充分预期,新浪
916,2020-11-17,【读财报】上市银行三季报：资产质量保持稳定 资本充足率普遍下降,新华网
917,2020-11-17,764亿！美国银行业大手笔收购来了，作价20倍市盈率，银行股集体大涨！,证券时报网
918,2020-11-16,银行行业点评报告：10月信贷结构继续向好 银行业三季度经营数据改善,新浪
919,2020-11-15,专题！“信用事件”对权益市场和银行的影响几何？【中泰银行·戴志锋/邓美君/贾靖】,传统借贷vs新型金融
920,2020-11-15,银行业周报：二级资本债首次触发减记 社融高增支撑行业景气度上行,新浪
921,2020-11-13,【兴证金融 傅慧芳】银行业周报2020.11.9-2020.11.15,兴证金融
922,2020-11-13,【行情】银行股全线走弱，平安银行跌近5%，兴业银行、宁波银行、杭州银行、招商银行等跌逾3%,金十数据
923,2020-11-12,"杭州银行现1笔大宗交易 共成交5,560.10万元",新浪
924,2020-11-12,银行角度看10月社融：社融总量稳定，信贷略有回落【中泰银行·戴志锋/邓美君/贾靖】,传统借贷vs新型金融
925,2020-11-11,银行行业周观点报告：同业存单发行利率继续上行,新浪
926,2020-11-10,"杭州银行现1笔大宗交易 共成交7,158.00万元",新浪
927,2020-11-10,【杭州银行】息差持续上升，资产质量大幅改善,志明看金融
928,2020-11-09,14家城商行前三季度业绩：5家利润超100亿 郑州银行不良贷款率最高为2.1%,挖贝网
929,2020-11-09,杭州银行(600926)：手续费收入快速增长 资产质量好于预期,新浪
930,2020-11-06,银行股进入估值修复期 高管密集主动增持,时代在线
931,2020-11-06,14家A股城商行前三季净利939亿 贵阳银行等5家负增长,中国经济网
932,2020-11-05,A股收盘综述：上证指数连涨四日站上3300，五粮液迈入万亿市值俱乐部,Wind
933,2020-11-05,A股午盘综述：上证指数半日涨0.88%，五粮液市值首次突破一万亿,Wind
934,2020-11-05,银行板块转跌，两市股指收窄涨幅,Wind
935,2020-11-04,上金所公布黄金拆借品种参与机构名单,Wind
936,2020-11-04,三季度核心盈利指标向上，银行板块发力拉升，招商银行再创新高,证券时报网
937,2020-11-04,银行三季报看懂了吗？这一主力资金正从多家银行股东名单消失,中投网
938,2020-11-04,保险资金投资路线追踪：三季度增持银行加码制造业,证券时报网
939,2020-11-04,保险资金投资路线追踪：三季度增持银行加码制造业,证券时报
940,2020-11-03,前三季A股上市城商行5家净利负增长，厦门银行净利增幅最高,澎湃新闻
941,2020-11-03,杭州银行发行可转债申请材料获证监会受理,证券时报网
942,2020-11-03,杭州银行(600926.SH)公开发行A股可转债申请获中国证监会受理,格隆汇
943,2020-11-03,【研报掘金】银行利润增速三季度已见拐点 四季度估值切换窗口打开建议超配银行板块,证券时报网
944,2020-11-03,银行业拐点到来？三季报数据揭晓相关变化,21世纪经济报道
945,2020-11-03,三季度城商行业绩增速放缓 手续费、佣金净收入成主要增长动力 盈利能力下降,第一财经
946,2020-11-03,详解银行业三季报：息差回升、资产平稳、分化持续,新浪
947,2020-11-03,看好银行板块四季度估值切换+市场风格转换机会（附股）,证券时报
948,2020-11-03,银行三季度业绩表现企稳向好，服务实体经济力度加大,Wind
949,2020-11-02,A股上市城商行三季报扫描：净利负增长队伍扩大,第一财经
950,2020-11-02,A股上市城商行三季报扫描：净利负增长队伍扩大，不良率稳中有降 盈利能力下降,第一财经
951,2020-11-02,杭州银行前三季度净利56亿元 信用减值损失74亿,中国经济网
952,2020-11-02,40公司获得增持评级-更新中,中财网
953,2020-11-02,杭州银行(600926)：资产质量优异保持 业绩基本符合预期,广发证券
954,2020-11-02,粤开证券：公司1.73亿元银行存款将被冻结 资产查封,Wind
955,2020-11-02,中信证券：银行板块当前逐步进入配置窗口期 推荐招商银行等,证券时报网
956,2020-11-02,36家A股上市银行前三季度，合计实现净利1.3万亿元,Wind
957,2020-11-01,【浙商|银行】杭州银行20Q3：实际经营业绩大超预期,大话金融
958,2020-11-01,杭州银行(600926)：息差持续提升 资产质量优异,新浪
959,2020-11-01,37家上市银行三季报透视：业绩“天地”分化，差距就是那么大！,Wind
960,2020-11-01,杭州银行(600926)：活期存款高增长 拨备站上新阶梯,新浪
961,2020-10-30,股市分析：杭州银行三季报浅析,搜狐
962,2020-10-30,杭州银行前9月营收186.52亿元同比增长16% 陆股通新晋十大股东,证券时报
963,2020-10-30,杭州银行前三季净利润同比增5.11% 计提拨备同比增27.95%,中国证券网
964,2020-10-30,杭州银行：前三季净利55.77亿元 同比增长5.11%,新浪
965,2020-10-30,杭州银行第三季度净利润下降10%，不良余额不良率“双降” 盈利能力下降,澎湃新闻
966,2020-10-30,杭州银行发布三季报：贯彻落实“六稳”“六保”要求 积极践行普惠金融,和讯
967,2020-10-30,杭州银行：前三季度净利润同比增长5.11%,Wind
968,2020-10-30,杭州银行：“17精功MTN001”违约后续 未按时兑付本息,Wind
969,2020-10-30,今年银行永续债发行近5000亿元,Wind
970,2020-10-30,深化金融企业改革完善公司治理,经济日报
971,2020-10-29,旺能环境(002034.SZ)为子公司旺能环保向杭州银行借款提供3300万元额度的担保 大额借贷担保,智通财经
972,2020-10-29,晚间重要公告2020年10月29日星期四,Wind
973,2020-10-29,杭州银行陈震山：近年来坚持规范股东行为 督促股东履行好义务,上证报
974,2020-10-29,今年融资骤降，银行可转债发行不香了？,Wind
975,2020-10-29,年内银行股最后一波解禁潮来袭，对股价影响几何？ 解禁,第一财经
976,2020-10-29,A股早报2020年10月29日星期四,Wind
977,2020-10-29,杭州银行股份有限公司 关于公开发行A股可转换公司债券 获中国银保监会浙江监管局核准的公告,证券时报
978,2020-10-29,年内银行股最后一波解禁潮来袭，对股价影响几何？,Wind
979,2020-10-28,年内银行股最后一波解禁潮来袭，对股价影响几何？ 解禁,第一财经
980,2020-10-28,晚间重要公告2020年10月28日星期三,Wind
981,2020-10-28,杭州银行发行150亿元A股可转债获核准,上证报
982,2020-10-28,【中原晨会1028】市场分析、宝钛股份公司点评报告、银行行业月报、华宇软件三季报分析,中原证券研究所
983,2020-10-28,银行理财向子公司“迁移”调查：存量处置有难度,Wind
984,2020-10-28,银行行业：积极关注板块投资机会,财富动力网
985,2020-10-27,股票仓位为84.49%，重仓杭州银行、万科A等,新浪
986,2020-10-27,银行业2021年度策略：历经洗礼 沐浴新生,新浪
987,2020-10-27,上市银行“大零售”转型受青睐,中国经济时报
988,2020-10-26,年内最大一波银行解禁潮即将来临 六家银行解禁规模近千亿 解禁,北京商报
989,2020-10-25,【浙商II梁凤洁/邱冠华】怎么看第一份城商行三季报？,大话金融
990,2020-10-24,下周1106亿市值限售股解禁，环比增加352.37% 解禁,Wind
991,2020-10-23,A股共发生44宗大宗交易成交12.28亿元（10月23日）,Wind
992,2020-10-23,杭州银行现1笔大宗交易 共成交440.37万元,新浪
993,2020-10-22,东北证券：银行具有确定性行情，上涨空间较大,理财18
994,2020-10-22,【东北晨会1022】银行行业周报/东方雨虹、中联重科、华润微/复盘笔记,东北证券研究所
995,2020-10-22,【东北银行王凤华/陈玉卢】行业周报：银行具有确定性行情，上涨空间较大,东北证券研究所
996,2020-10-21,杭州银行现2笔大宗交易总成交金额2182.58万元,证券时报网
997,2020-10-21,杭州银行：1900余万股限售股于10月27日解禁 解禁,上证报
998,2020-10-21,杭州银行：1903.72万股首次公开发行限售股将于10月27日上市流通 解禁,中证网
999,2020-10-21,杭州银行：1903万股限售股10月27日上市流通 解禁,Wind
1000,2020-10-21,杭州银行(600926.SH)：1903.72万股限售股10月27日解禁 解禁,格隆汇
1001,2020-10-21,"杭州银行现2笔大宗交易 共成交2,182.58万元",新浪
1002,2020-10-21,快讯：银行股盘中异动拉升 杭州银行等多股走强,新浪
1003,2020-10-21,银行股盘中拉升 杭州银行涨超3%,e公司
1004,2020-10-21,银行业月度报告（2020年9月）：中长期信贷增长，盈利可期,财信证券研究
1005,2020-10-20,北京银保监局：核准马煜杭州银行北分副行长任职资格,银保监会
1006,2020-10-20,从银行半年报看理财变化,Bank资管
1007,2020-10-20,【银行】《商业银行法》修订点评：健全监管框架，加强公司治理与风险管理,中银证券研究
1008,2020-10-19,天风证券廖志明：此轮银行股上涨非小反弹,澎湃新闻
1009,2020-10-19,分析｜银行股集体上涨的核心逻辑是什么，还有多大上涨空间,澎湃新闻
1010,2020-10-18,深度｜银行3季报前瞻：稳健性持续，投资核心逻辑是经济【中泰银行·戴志锋/邓美君/贾靖】,传统借贷vs新型金融
