,2021-12-31,歌尔股份：公司在VR/AR整机及其相关的精密光学零组件等产品领域内具有相关的技术储备,Wind
0,2021-12-31,2021年A股年终盘点：十大“水逆”板块在哪里？,Wind
1,2021-12-31,歌尔股份2021成绩单：营收净利双增，资产规模破500亿,第一财经
2,2021-12-31,银河证券：电子行业盈利端有望维持快速增长,Wind
3,2021-12-31,银河证券：电子行业盈利端有望维持快速增长,证券时报网
4,2021-12-31,北向资金动向盘点：多点开花，平均推进,Wind
5,2021-12-31,北向资金扫货A股81亿元 增持银行减持电力（个股名单） 减持股份,21世纪经济报道
6,2021-12-30,国产MEMS龙头冲上市：歌尔分拆，去年营收30亿,36氪
7,2021-12-30,宁南山：从苹果2021年公布的全球200大供应商看产业转移趋势,证券之星
8,2021-12-29,歌尔微IPO有新进展！,新浪
9,2021-12-29,歌尔微正式“赶考”创业板，富豪姜滨将迎资本双子星,鲁网
10,2021-12-29,天风海外：Oculus Quest 2销量预达奇点，国产供应商迎机遇，建议关注歌尔股份(002241.SZ)等,智通财经
11,2021-12-29,歌尔股份分拆子公司歌尔微创业板IPO已获受理,金融界
12,2021-12-29,歌尔股份：公司暂未与Nreal开展合作,每日经济新闻
13,2021-12-29,歌尔股份：公司目前暂无安排投资者现场调研交流活动的计划,每日经济新闻
14,2021-12-29,歌尔股份：公司的麦克风等声学零组件产品目前有在汽车电子领域内的应用,每日经济新闻
15,2021-12-29,歌尔股份(002241.SZ)分拆歌尔微至创业板上市申请获深交所受理,智通财经
16,2021-12-29,歌尔股份：分拆所属子公司歌尔微电子至创业板上市申请获得深交所受理,Wind
17,2021-12-29,调仓+减持，市场赚钱效应衰退,Wind
18,2021-12-28,瞰鉴鲁股：总市值连涨6周后骤然向下，缩水701亿元仍居全国第六,每日经济新闻
19,2021-12-28,12月股东减持超650亿，45家大额解禁来袭,Wind
20,2021-12-28,龙虎榜机构抢筹股曝光，两大资金同时买入这些股,Wind
21,2021-12-28,苹果公布全球200大供应商，有哪些新变化？,虎嗅网
22,2021-12-28,龙虎榜机构抢筹股曝光，两大资金同时买入这些股,证券时报网
23,2021-12-28,苹果供应链TOP200有喜有忧，“果链造富神话”要靠造车续写？,36氪
24,2021-12-27,中国银河维持电子行业推荐评级：华为召开冬季新品发布，会鸿蒙汽车AITO问界M5等新品亮相,每日经济新闻
25,2021-12-27,智能化浪潮奔涌，多条主线迎变革机遇,Wind
26,2021-12-25,消费电子龙头借力突围　宁德领跌 锂电池受挫,财富动力网
27,2021-12-25,103家公司预告2021年业绩，逾八成报喜,Wind
28,2021-12-24,中药板块被主力资金抱团防御,大众证券报
29,2021-12-23,姜滨、姜龙所持歌尔股份共计1.51%股份解除质押,乐居财经
30,2021-12-23,歌尔股份(002241.SZ)实控人姜滨等解除质押5200万股,智通财经
31,2021-12-23,财看闪电｜企业市值从破千亿到接近2个千亿，歌尔股,齐鲁网
32,2021-12-23,科技专题策划稿四|歌尔凭VR突围 欧菲光借新能源车“翻盘” “果链”们明年如何发力？,财联社
33,2021-12-23,歌尔股份：公司具有智能穿戴类产品的研发、制造能力和丰富的项目量产经验,每日经济新闻
34,2021-12-23,歌尔股份：公司仍有持有高平电子股票,每日经济新闻
35,2021-12-23,歌尔股份：公司目前没有参加2022年1月在美国举行的CES消费类电子产品展会计划,Wind
36,2021-12-23,歌尔股份：公司具有使用Pancake光学技术的VR产品量产经验,财联社
37,2021-12-23,北向资金动向盘点：集中净卖金融股,Wind
38,2021-12-23,每日理财观察：《数字交通“十四五”发展规划》发布,Wind
39,2021-12-23,27股获券商买入评级，上海建工目标涨幅达67.13%,Wind
40,2021-12-23,科技板块接棒地产，市场风向快速切换,Wind
41,2021-12-22,最高增幅超10倍！近百家A股公司披露全年业绩预告,Wind
42,2021-12-22,苹果板块火了，3000亿龙头股一度大涨8%！传筹建大型iPhone组装厂,中证报
43,2021-12-22,北向资金连续4日净卖出累计出货超百亿，立讯精密遭大幅净卖出6.46亿元,Wind
44,2021-12-22,A股收盘综述：苹果、网游、中药板块涨势强劲，立讯精密、歌尔、韦尔集体上冲,Wind
45,2021-12-22,消费电子板块拉升，歌尔股份(002241.SZ)涨超6%,证券之星
46,2021-12-22,智能音箱指数保持强势，科森科技涨停,Wind
47,2021-12-22,龙头公司3个20%涨停，2900亿元市值巨头冲击历史高点，这个赛道火爆,中证报
48,2021-12-22,A股午盘综述：苹果板块火了，立讯精密歌尔股份大涨！网游、文化传媒同步走升,Wind
49,2021-12-22,融资客青睐2股，凤凰股份买入占比高达35.20%,Wind
50,2021-12-22,北向资金连续三日出逃，增减持行业一览（附股） 减持股份,21经济网
51,2021-12-22,北向资金动向盘点：观望，厌恶高估值,Wind
52,2021-12-21,66股获重要股东增持，四大领域最受青睐！,Wind
53,2021-12-21,北向资金交投意愿转淡连续3日净卖出，白酒、新能源均遭出货,Wind
54,2021-12-21,黄俊: 歌尔股份走完阶段性行情 引发各路资金争相兑现,第一财经
55,2021-12-21,力源信息：公司代理的相关产品有供给下游VR相关客户,Wind
56,2021-12-21,28股受青睐，北向资金增持额超亿元,证券时报网
57,2021-12-21,A股早报2021年12月21日星期二,Wind
58,2021-12-21,北向资金动向盘点：不仅没砸盘，反而逢低净买电子、传媒,Wind
59,2021-12-21,每日理财观察：LPR时隔20个月首次下调,Wind
60,2021-12-21,严打“假外资”影响几何？北向资金连续2日净卖出，出逃这些股（名单）,21世纪经济报道
61,2021-12-21,【中证盘前】“史上最贵新股”拟不超45亿元理财；6连板牛股提示风险；大全能源拟332.5亿元投建工业硅等项目,中证报
62,2021-12-21,个股局部活跃 机构高抛低吸,金融投资报
63,2021-12-21,从严监管消“噪音”，凸显“真外资”属性,Wind
64,2021-12-20,龙虎榜丨歌尔股份跳水跌停，3.69亿资金趁低吸纳，但机构和北向资金现分歧,21世纪经济报道
65,2021-12-20,突发利空，千亿大白马跌停！董事长一把减持近18亿，四机构抛售超5亿 减持股份,中证报
66,2021-12-20,【经纬晚班车】歌尔股份跳水跌停，网友：“爬了10天，1天跌回原处”,中新经纬
67,2021-12-20,每经19点|薇娅丈夫董海锋发布致歉信；国家能源集团：推进煤电机组“三改联动”；市场船多货少，沿海煤炭运价继续下跌,每日经济新闻
68,2021-12-20,跌停板解密：高位股情绪分歧，两市超10只个股跌停！（12月20日）,Wind
69,2021-12-20,千亿白马股跳水跌停！歌尔股份遭四机构抛售超5亿元,第一财经
70,2021-12-20,数据复盘｜主力资金撤离电气设备、电子等行业 龙虎榜机构净卖出歌尔股份等股,证券时报网
71,2021-12-20,机构今日买入这13股，抛售歌尔股份3.46亿元丨龙虎榜,第一财经
72,2021-12-20,龙虎榜丨机构今日买入这13股，抛售歌尔股份3.46亿元,第一财经
73,2021-12-20,北向资金今日再度净卖出9.71亿元，药明康德连续4日遭抛售累计出货超30亿,Wind
74,2021-12-20,大盘加速回调 机构卖多买少,金融投资报
75,2021-12-20,12月20日龙虎榜解析：歌尔股份单日净买入额最多，涉及机构专用席位的个股有24只,每经网
76,2021-12-20,歌尔股份龙虎榜数据（12月20日）,Wind
77,2021-12-20,歌尔股份跌停 四机构合计净卖出4.89亿元,e公司
78,2021-12-20,歌尔股份今日跌停，机构大幅卖出,36氪
79,2021-12-20,龙虎榜|歌尔股份跌停 四机构合计净卖出4.9亿元,财联社
80,2021-12-20,歌尔股份放量跌停，机构席位卖出超5亿元,Wind
81,2021-12-20,歌尔股份3300万股减持背后的探秘 减持股份,雪球
82,2021-12-20,A股资金流向：赛道股加速遭抛售，低价股成短线“避风港”,Wind
83,2021-12-20,元宇宙概念集体走弱，歌尔股份触及跌停,阿尔法工场
84,2021-12-20,A股收盘综述：创业板指跌近3%，新能源股大步回撤,Wind
85,2021-12-20,元宇宙概念大幅回落，中青宝、汤姆猫跌幅超10%，歌尔股份跌停,证券时报网
86,2021-12-20,快讯：歌尔股份尾盘触及跌停 成交额超58亿,新浪
87,2021-12-20,歌尔股份触及跌停,e公司
88,2021-12-20,歌尔股份午后跌停，主力流出超4亿元,第一财经
89,2021-12-20,歌尔股份跌停，主力净流出超4亿元,Wind
90,2021-12-20,歌尔股份接近跌停，苹果板块承压,Wind
91,2021-12-20,A股早报2021年12月20日星期一,Wind
92,2021-12-19,2021年A股年终盘点：十大超级牛股关键词,Wind
93,2021-12-19,歌尔股份(002241)：XR助推开启高速成长期 持续深化MEMS战略布局,新浪
94,2021-12-17,电子行业2022年投资策略：汽车电子、国产半导体“铁马入冰河” 元宇宙XR、MINILED“长风上万里”,西南证券
95,2021-12-17,A股共发生144宗大宗交易成交57.17亿元（12月17日）,Wind
96,2021-12-17,歌尔股份(002241.SZ)股东姜滨累计减持3300万股 持股比例降至8.41% 减持股份,智通财经
97,2021-12-17,"歌尔股份现4笔大宗交易 共成交175,791.00万元",新浪
98,2021-12-17,歌尔股份今日大宗交易成交3300万股，成交价53.27元折价4.99%,Wind
99,2021-12-17,加速冲刺创业板！歌尔微完成上市辅导工作,全景网
100,2021-12-17,歌尔股份现17.6亿元折价大宗交易,Wind
101,2021-12-17,歌尔股份：公司生产经营情况正常,每日经济新闻
102,2021-12-17,歌尔股份：公司具有Pancake等VR光学解决方案的量产能力和经验,财联社
103,2021-12-16,腾讯退出，字节高位接盘,Ofweek
104,2021-12-15,北向资金动向盘点：两条主线清晰明了，但已无新能源,Wind
105,2021-12-15,北向资金抢筹逾60亿元，扫货股一览（名单）,21世纪经济报道
106,2021-12-15,北向资金抢筹逾60亿元，扫货股一览（名单）,21经济网
107,2021-12-14,瞰鉴鲁股：A股山东板块公司增至268家，市值排名再回全国第六,每日经济新闻
108,2021-12-14,北向资金再度扫货超60亿，连续7日抢筹东方财富累计加仓超近61亿元,Wind
109,2021-12-14,【银河电子傅楚雄/王恺】行业周报丨硅片出货创历史新高，未来仍面临供需缺口,中国银河证券研究
110,2021-12-13,2021年12月13日大宗交易机构专用买入席位报告,搜狐
111,2021-12-13,股价创历史新高股一览,证券时报网
112,2021-12-13,"歌尔股份现4笔大宗交易 共成交15,297.40万元",新浪
113,2021-12-13,歌尔股份今日大宗交易成交180万股，成交价54.53元折价5.0%,Wind
114,2021-12-13,歌尔股份今日再创新高并出现1.53亿元折价大宗交易，机构接盘山东两营业部,Wind
115,2021-12-13,东吴证券：元宇宙为2022年最值得期待的成长主线,智通财经
116,2021-12-13,“果链”龙头股价新高，市值直逼2000亿，为全球最大VR设备代工厂,AI财经社
117,2021-12-12,沪指周线五连阳，哪些股票在创新高？,量化藏经阁
118,2021-12-10,元宇宙概念再度活跃，中青宝大涨超13%，美盛文化等涨停,证券时报网
119,2021-12-09,2021年红杉资本调研114家上市公司，元宇宙概念崛起歌尔一路飙升,金融界
120,2021-12-09,北向资金狂买A股超200亿净买入额创历史次高，继续大幅抢筹白酒股,Wind
121,2021-12-09,瞰鉴鲁股：总市值排名被福建反超，潍坊国资拟斥资近10亿入主巴安水务,每日经济新闻
122,2021-12-09,A股突然启动上涨，茅台收复2000元，人民币连创新高！,Wind
123,2021-12-08,苹果最新规划的大动作 全年业绩有望高增长的概念股出炉（附股）,新浪
124,2021-12-08,苹果创历史新高，歌尔股份放量上行,阿尔法工场
125,2021-12-08,元宇宙概念卷土重来，中文在线一度涨停，当虹科技等大涨,证券时报网
126,2021-12-08,电子行业2022年投资策略：半导体创新与国产化并重 汽车、VR／AR空间广阔,新浪
127,2021-12-08,解盘：大盘震荡走高，白酒、军工、半导体、光刻胶领涨,Wind
128,2021-12-08,【行情】元宇宙概念股短线拉升，硕贝德涨超9%，当虹科技、歌尔股份、中科创达、中文在线跟涨,金十数据
129,2021-12-07,元宇宙框架梳理,新浪
130,2021-12-07,歌尔股份：“果链”巨头“漂移”元宇宙,《商学院》杂志
131,2021-12-07,外资月报第26期：外围扰动加剧 配置盘稳步流入,新浪
132,2021-12-06,中国银河维持电子行业推荐评级：《电子烟管理办法（征求意见稿）》出台，行业有望良性发展,每日经济新闻
133,2021-12-06,年报预增股来了！三大行业表现亮眼，9股净利预计翻倍,Wind
134,2021-12-06,63家上市公司披露全年业绩预告，逾八成预喜,Wind
135,2021-12-04,北上资金年度净买入刷新历史纪录,Wind
136,2021-12-03,元宇宙分析框架：VRCHAT或为元宇宙入口雏形,国金证券股份有限公司
137,2021-12-03,银河证券：电子行业盈利端有望维持快速增长，维持“推荐”评级,智通财经
138,2021-12-03,大举布局跨年行情，银行理财“剧透”投资主线,Wind
139,2021-12-02,28万亿资金“剧透”A股跨年行情，多条投资主线曝光,Wind
140,2021-12-02,北向资金今日净买入30.21亿元，宁德时代连续6日净买入累计加仓超24亿,Wind
141,2021-12-02,银河证券：能源变革奏响电子行业新篇章,Wind
142,2021-12-01,华西策略：最新“外资”持股结构剖析,证券之星
143,2021-12-01,北向资金12月首个交易日加仓A股30亿，紫光国微净买入超6亿元,Wind
144,2021-12-01,中国银河维持电子行业推荐评级：手机需求回暖，功率器件需求旺盛,每日经济新闻
145,2021-12-01,年报业绩预增股来了，7家公司预计业绩翻倍增长,Wind
146,2021-12-01,歌尔股份：公司暂无开展品牌VR/AR业务的计划,Wind
147,2021-12-01,上市公司正负面新闻2021年12月1日星期三,Wind
148,2021-12-01,三季度业绩大增股价却持续走低 京东方被面板价格下行“阴霾”缠绕,投资者网
149,2021-11-30,歌尔股份：公司及子公司担保总额度约127.33亿元 大额借贷担保,每日经济新闻
150,2021-11-30,歌尔股份：子公司拟向IFC申请贷款本金总额合计不超过7亿美元的长期贷款,财联社
151,2021-11-30,歌尔股份：与IFC签署总额不超7亿美元的长期贷款协议,Wind
152,2021-11-30,MSCI指数调整生效日，这些股票尾盘异动！外资11月调仓瞄准科技股,Wind
153,2021-11-30,2200亿锂电龙头跳水！北上资金逆向操作,Wind
154,2021-11-30,陆股通月报：11月北上资金有何动向？,新浪
155,2021-11-30,元宇宙炒作图谱：2大新特征正在浮现,Wind
156,2021-11-30,元宇宙炒作图谱：游资前仆后继，上演“最小阻力式”博弈,Wind
157,2021-11-29,电子行业周报：半导体厂房建设投资创历史新高,新浪
158,2021-11-29,2021年11月第4周策略周报：A股受变异病毒影响震荡将加剧 逢低继续布局新能源、半导体等先进制造赛道,新浪
159,2021-11-29,银河电子周观点：国内10月手机出货量大幅增长 看好射频前端国产替代机遇,新浪
160,2021-11-29,科技硬件周报：功率半导体高景气度有望延续、关注5G+AIOT投资机遇,新浪
161,2021-11-29,布局新增长点，年内超40家公司发布分拆上市计划,Wind
162,2021-11-28,电子行业周报：估值开始切换 乐观反映明年苹果、MINILED、半导体设备,新浪
163,2021-11-26,北向资金净卖出近45亿结束连续5日净买入，招商银行净卖出超6亿元,Wind
164,2021-11-26,歌尔股份：公司在VR/AR整机及其相关的精密光学零组件等产品领域内具有相关的技术储备,Wind
165,2021-11-26,年报业绩预告提前看！近八成公司预喜，谁是预增王？,证券之星
166,2021-11-26,高瓴重金押注新能源之王！外资最宠爱银行小白马(名单),Wind
167,2021-11-26,热点快速轮动，资金分歧明显,Wind
168,2021-11-26,年报业绩提前看，6家公司预计全年净利翻倍,Wind
169,2021-11-26,年报业绩提前看 6家公司预计全年净利翻倍,证券时报
170,2021-11-25,深度*行业*电子行业周报：TI宣布新厂建设计划 联发科发布4NM处理器,新浪
171,2021-11-25,东吴策略·行业风火轮：行业抄北上 个股抄QFII,新浪
172,2021-11-25,区块链行业：元宇宙的运行之“DAO”,新浪
173,2021-11-25,北向资金连续5日净买入成交额创5个月新低，再度净买入贵州茅台超3亿元,Wind
174,2021-11-25,元宇宙概念龙头在列，年报预增股曝光，6股业绩翻倍,Wind
175,2021-11-25,年内上市公司回购金额逾1100亿,Wind
176,2021-11-25,Facebook的元宇宙成风口，带火1800亿巨头代工生意,21商评网
177,2021-11-24,商络电子：公司现有客户如歌尔股份、影石创新、共达电声、矽勤科技、影创信息、重庆蓝岸等均涉及AR、VR技术或产品，但该领域客户所产生的相关收入占公司总体销售收入比重较小,每日经济新闻
178,2021-11-24,北向资金连续4日净买入累计加仓超170亿，批量扫货白酒股,Wind
179,2021-11-24,公募仓位连降4月！超千亿新发基金待建仓，四大行业重回视野,Wind
180,2021-11-24,蓝思科技多元是与非，抵御不确定性靠什么？,Ofweek
181,2021-11-24,29家A股公司预告全年业绩，医药等行业表现抢眼,Wind
182,2021-11-23,外资周报第104期：人民币韧性凸显 配置盘加速入场,新浪
183,2021-11-23,市场温度计：东吴策略·外资大幅买入成长,新浪
184,2021-11-23,元宇宙有望带动光模块需求，机构高关注股出炉,Wind
185,2021-11-23,山东区域股市周报：板块总市值涨598亿 3亿融资买入歌尔股份,每日经济新闻
186,2021-11-22,强瑞技术：公司与歌尔股份暂无合作,每日经济新闻
187,2021-11-22,1800亿巨头冲击涨停，元宇宙还能火多久？,深水财经社
188,2021-11-22,股价创历史新高股一览,证券时报网
189,2021-11-22,主题策略周报十五：看好元宇宙和深度低碳化主题,新浪
190,2021-11-22,市场资金面周观察：股市流动性回暖 银行间资金偏紧,新浪
191,2021-11-22,北向资金今日净买入14.35亿元，宁德时代再获大幅净买入近17亿,Wind
192,2021-11-22,长信科技：公司与歌尔股份有合作,Wind
193,2021-11-22,电子行业周报：折叠屏关注度继续升温 德仪宣布大额扩产计划,新浪
194,2021-11-22,电子行业周报：苹果公司重回全球第一的宝座,新浪
195,2021-11-22,科技硬件周报：AIOT产业加速 CMP材料与设备受关注,新浪
196,2021-11-22,元宇宙概念股走强，歌尔股份(002241.SZ)续创历史新高,证券之星
197,2021-11-22,34股获北向资金加仓超亿元,证券时报网
198,2021-11-22,A股融资融券日报：两融余额减少11.76亿元（11月19日）,Wind
199,2021-11-22,北向资金　上周加仓111亿,财富动力网
200,2021-11-22,全力加仓“新能源之王”！北上资金1/4的钱都买了它,Wind
201,2021-11-21,集微咨询：苹果市值全球第一，从苹果业务结构看A股供应商明年承压,搜狐
202,2021-11-21,央行货币执行及表述变化对A股意味着什么,招商策略研究
203,2021-11-20,北向资金本周加仓111亿，抄底交运物流、汽车零部件等超跌板块，扫货这些龙头股（名单）,21世纪经济报道
204,2021-11-20,房地产合理贷款得到满足！A股普涨，本周北上资金买入百亿,Wind
205,2021-11-19,数据复盘｜81股获主力加仓超亿元 北向资金抢筹宁德时代、歌尔股份等,证券时报网
206,2021-11-19,北向资金今日大幅净买入近83亿，再度爆买宁德时代超14亿,Wind
207,2021-11-19,歌尔创历史新高背后：“聪明钱”和机构提前预判 其余消费股机会也来了？,财联社
208,2021-11-19,房地产飙升3%提振大盘，北上资金依旧宠爱新能源,Wind
209,2021-11-19,苹果大涨重回全球第一！1800亿果链龙头歌尔股份创历史新高 分析称警惕成长空间受限,金融界
210,2021-11-19,黑天鹅！这家公司股债双杀，可转债一度跌超20%！A股快递板块大爆发，啥情况？,证券时报
211,2021-11-19,消费电子概念走势活跃 共达电声、歌尔股份等拉升走高,证券时报网
212,2021-11-19,解盘：资金持续流入，燃料电池、物流、智能音箱领涨,Wind
213,2021-11-19,歌尔股份涨约6%，元宇宙带动科技题材反弹持续，VRETF（159786）开盘大涨超1.5%,资本邦
214,2021-11-19,歌尔股份涨8.26%，股价创历史新高,证券时报网
215,2021-11-19,歌尔股份等23股获北向资金增持额超亿元,证券时报网
216,2021-11-19,元宇宙概念再度拉升，天下秀两连板，歌尔股份涨逾8%,证券时报网
217,2021-11-19,苹果概念股集体走强 歌尔股份(002241.SZ)涨超8%,格隆汇
218,2021-11-19,智能音箱板块短线拉升,Wind
219,2021-11-19,北向资金动向盘点：反手减持食品饮料、医药,Wind
220,2021-11-19,北向资金抛售医药白酒，买入元宇宙、锂电概念（附股）,21世纪经济报道
221,2021-11-19,【中证盘前】*ST罗顿拟与腾讯科技签订合作协议；微博通过港交所上市聆讯；北向资金净买入歌尔股份4.97亿元,中证报
222,2021-11-18,每经18点丨钢铁行业碳达峰实施方案将于近期发布；歌尔股份获北向资金净买入近5亿元；京东第三季度营收2187亿元，同比增25.5%,每日经济新闻
223,2021-11-18,北向资金持续流出！出逃“宁王”、五粮液等个股，净买入歌尔股份居首（名单）,21世纪经济报道
224,2021-11-18,北水卖出腾讯超3亿港元，买入美团超2亿港元；南水买入歌尔股份近5亿元,富途证券
225,2021-11-18,北向资金今日净流出超44亿元，逆市加仓歌尔股份近5亿元,第一财经
226,2021-11-18,元宇宙持续爆发 中青宝歌尔股份万兴科技完美世界有望受益,凤凰网
227,2021-11-18,歌尔股份今日获北向资金净买入4.97亿元,e公司
228,2021-11-18,北上资金净买入歌尔股份4.97亿元,格隆汇
229,2021-11-18,北向资金今日净卖出44.53亿元 歌尔股份净买入近5亿元,财联社
230,2021-11-18,北向资金今日净卖出44.53亿元，传统核心资产集体遭抛售,Wind
231,2021-11-18,深度*行业*电子行业周报：代工双雄营收创新高 英伟达更新OMNIVERSE,新浪
232,2021-11-18,A股融资融券日报：两融余额增加35.43亿元（11月17日）,Wind
233,2021-11-18,分拆子公司歌尔微上市 歌尔股份踏入VR赛道营收大增背后,投资者网
234,2021-11-18,业绩下滑市值缩水近千亿 蓝思科技多元化转型能否见效？ 盈利能力下降,投资者网
235,2021-11-17,北向资金结束连续4日净买入，贵州茅台遭大幅抛售超11亿元,Wind
236,2021-11-17,"歌尔股份现1笔大宗交易 共成交1,372.82万元",新浪
237,2021-11-17,歌尔股份今日大宗交易成交28.79万股，成交价47.69元折价6.58%,Wind
238,2021-11-17,北向资金增持市值超亿元股票（附名单）,证券时报网
239,2021-11-17,A股融资融券日报：两融余额减少48.12亿元（11月16日）,Wind
240,2021-11-16,歌尔股份：VR/AR是公司在智能硬件领域内的重要战略方向之一,全景网
241,2021-11-16,瞰鉴鲁股：板块总市值再度接近4万亿，今年新增上市公司已达32家,每日经济新闻
242,2021-11-16,北交所之智新电子：索尼任天堂连接器线缆供应商,Ofweek
243,2021-11-16,钉科技观察：歌尔股份不是下一个欧菲光,和讯
244,2021-11-16,歌尔股份“去苹果化”十字路口：分拆子公司上市，跟风元宇宙,华夏时报
245,2021-11-15,通信周报：英伟达GTC大会OMNIVERSE贯穿始终 元宇宙概念持续火热,华安证券
246,2021-11-15,A股资金流向：新能源遭资金集中抛售,Wind
247,2021-11-15,科技硬件周报：半导体板块高景气度延续、关注5G+AIOT新机遇,新浪
248,2021-11-15,VR风口上的猪？ 短期还是小心点,Ofweek
249,2021-11-15,歌尔股份：公司的MEMS气流传感器等产品已有在电子烟等产品领域内的应用,Wind
250,2021-11-15,23股获北向资金加仓超亿元,证券时报网
251,2021-11-15,A股融资融券日报：两融余额减少22.02亿元（11月12日）,Wind
252,2021-11-15,元宇宙燃爆A股！35只概念股两周涨幅普超20%,Wind
253,2021-11-15,电子行业周报：杂音干扰的旺季VS乐观看待的明年,新浪
254,2021-11-12,北向资金再度加仓超36亿，东方财富本周净买入近28亿,Wind
255,2021-11-12,“元宇宙”激情万丈！Facebook都没涨，中青宝大涨近5倍，一大堆概念股十有八九是“演员”？,21世纪经济报道
256,2021-11-12,歌尔股份：公司可以为客户提供VR虚拟现实和AR增强现实及其相关的精密零组件产品整体解决方案,每日经济新闻
257,2021-11-12,歌尔股份：公司暂无开展VR品牌业务的计划,Wind
258,2021-11-12,歌尔股份：公司的VR相关光学零组件产品早已实现项目量产出货,Wind
259,2021-11-12,歌尔股份：公司暂无开展VR品牌业务的计划,每日经济新闻
260,2021-11-12,A股融资融券日报：两融余额增加26.26亿元（11月11日）,Wind
