1036,2021-06-30,银河证券每日晨报,新浪
1037,2021-06-30,歌尔股份：公司没有显示屏相关业务,每日经济新闻
1038,2021-06-30,基于透支久期与盈利增速视角的择股策略：核心资产分化下的投资机会挖掘,新浪
1039,2021-06-30,北向资金连续两日净流出，抛售银行股增持电子元件行业（附股）,21世纪经济报道
1040,2021-06-30,北向资金动向盘点：观望中加持电子、计算机,Wind
1041,2021-06-30,535家公司公布上半年业绩预告，超六成预喜,Wind
1042,2021-06-29,歌尔股份：“家园4号”员工持股计划锁定期到期,每日经济新闻
1043,2021-06-29,北向资金今日净卖出31.39亿元，贵州茅台获净买入额3.17亿元,Wind
1044,2021-06-28,北向资金今日净卖出40.55亿元，中远海控、宁德时代净卖出额居前,Wind
1045,2021-06-28,电子行业每周市场动态追踪：看好半导体的短中长期大逻辑 消费电子迎布局时点,新浪
1046,2021-06-28,中信证券：消费电子端迎来中长期布局时点,证券时报网
1047,2021-06-28,佳禾智能(300793)股票行情 原料上涨销量下滑募资估值倒挂 盈利能力下降,至诚财经
1048,2021-06-28,原料上涨销量下滑 佳禾智能募资估值倒挂 盈利能力下降,投资者网
1049,2021-06-28,原料上涨销量下滑募资估值倒挂 佳禾智能增发背后隐现控制权之忧 盈利能力下降,投资者网
1050,2021-06-25,果链龙头立讯精密盘中爆拉9%：机构透露iPhone量产时间表 10只概念股被盯上,新浪
1051,2021-06-25,北向资金本周爆买A股超200亿，连续加码金融股,Wind
1052,2021-06-25,突发大消息？果链龙头盘中爆拉9%，机构透露iPhone量产时间表！北上资金扫货55亿，10只概念股被盯上,e公司
1053,2021-06-24,摩根士丹利：将歌尔股份评级上调至超配，目标价52.50元,Wind
1054,2021-06-24,财联社6月24日讯，摩根士丹利将歌尔股份评级上调至超配，目标价52.50元。,财联社
1055,2021-06-23,北向资金近82亿资金大幅加码A股，药明康德净买入近8亿元,Wind
1056,2021-06-23,【行情】消费电子板块全线走高，领益智造午后拉升触板，长盈精密、立讯精密、环旭电子、歌尔股份等纷纷大幅走高,金十数据
1057,2021-06-22,北向资金连续3日净卖出，贵州茅台遭净卖出近8亿元,Wind
1058,2021-06-22,瞰鉴鲁股：齐鲁银行从新三板“晋级”A股，板块老大万华化学市值缩水超300亿 连续下跌,每日经济新闻
1059,2021-06-22,2021下半年电子行业投资策略：5G产业强者恒强 聚焦国产化,新浪
1060,2021-06-22,电子元件：AR 下一个蓝海,新浪
1061,2021-06-22,中国银河维持电子行业推荐评级：行业复苏叠加MiniLED爆发LED将迎来新一轮景气周期,每日经济新闻
1062,2021-06-22,【银河电子傅楚雄/王恺】行业周报丨行业复苏叠加Mini LED爆发，LED将迎来新一轮景气周期,中国银河证券研究
1063,2021-06-21,山东区域股市周报：板块总市值连续三周下跌 万华化学缩水332.81亿元 连续下跌,每日经济新闻
1064,2021-06-21,策略周报：把握科技大牛市,西南证券
1065,2021-06-21,苹果产业链离不开中国：大陆供应商占比第一，从零件生产向整机组装拓展,时代周报
1066,2021-06-21,北向资金连续2日净卖出，继续抛售医药生物和白酒股,Wind
1067,2021-06-21,消费电子股活跃蓝思科技、歌尔股份涨超5%,格隆汇
1068,2021-06-21,消费电子板块表现活跃，福日电子封板,Wind
1069,2021-06-21,歌尔股份涨5.97%报42.80元 振幅7.55%,中新经纬
1070,2021-06-21,A股融资融券日报：两融余额增加35.34亿元（6月18日）,Wind
1071,2021-06-20,周末突发！深圳一航班，已有38例阳性病例，东莞新增一例确诊！十大券商最新研判：千金难买“黄金坑”，把握科技股大牛市,中国基金报
1072,2021-06-19,迷茫期的一张投资明牌,Wind
1073,2021-06-18,华为白皮书释放重磅信号，AR有望开启“真元年”,Wind
1074,2021-06-18,电子设备、仪器和元件周报：种植业的“人造太阳”：LED产业链再成长,新浪
1075,2021-06-18,歌尔股份(002241.SZ)实控人姜滨质押800万股及解押5000万股,智通财经
1076,2021-06-18,数据复盘｜汽车、通信等7个行业获主力资金青睐 北向资金抢筹歌尔股份等股,证券时报网
1077,2021-06-18,歌尔股份：姜滨累计质押股数为6150万股,每日经济新闻
1078,2021-06-18,北向资金本周累计净卖出50亿元，药明康德、宁德时代连续4日遭抛售,Wind
1079,2021-06-18,力压“蔡经理”，单日净值涨超9%，比诺安成长更牛的基金出现了,证券之星
1080,2021-06-18,501家上市公司中报业绩预告出炉！预喜率超六成，两大行业领跑,Wind
1081,2021-06-18,天弘中证电子ETF(159997)：科技核心 价值底部,新浪
1082,2021-06-18,【行情】A股电子制造板块持续走高，瀛通通讯涨停，佳禾智能涨超8%，兴瑞科技涨超4%，闻泰科技、歌尔股份涨超3%,金十数据
1083,2021-06-18,北向资金动向盘点：疯狂买入“半导体”,Wind
1084,2021-06-17,北向资金今日净买入15.94亿元，芯片、消费电子股获资金大幅抢筹,Wind
1085,2021-06-17,领益智造收购浙江锦泰95%股权，在布什么样的大局？,Ofweek
1086,2021-06-17,VR站上风口，A股这些概念股腿却在发抖,锦缎
1087,2021-06-17,领益智造收购浙江锦泰：布局动力电池，减轻果链依赖,Ofweek
1088,2021-06-17,「果链」公司领益智造收购浙江锦泰，切入新能源汽车领域,和讯
1089,2021-06-17,北向资金动向盘点：大额减持白酒，加仓银行,Wind
1090,2021-06-17,北向资金增持银行、减持白酒，贵州茅台遭抛售6.75亿元 减持股份,21世纪经济报道
1091,2021-06-16,北向资金连续第3日净流出，抛售贵州茅台逾6亿元,第一财经
1092,2021-06-16,北向资金今日小幅净卖出4.05亿元，白酒股集体遭抛售,Wind
1093,2021-06-16,歌尔股份：公司的MEMS传感器所使用的芯片中，既有向合作伙伴采购的部分，也有公司自主研发设计的部分,每日经济新闻
1094,2021-06-16,A股苹果供应商集体去越南印度开厂！真相是这样的,Wind
1095,2021-06-16,VR/AR迈入产业化发展快车道,大众证券报
1096,2021-06-16,A股早报2021年6月16日星期三,Wind
1097,2021-06-16,歌尔股份：公司在AR核心零组件和整机组装领域内有较为丰富的经验,Wind
1098,2021-06-16,周三证券 | 科技阵营火热 VR生态圈吸睛,金融投资报
1099,2021-06-15,牛人重仓｜搭上“鸿蒙OS2”快车，这只“最热闹”的题材股要加速？,每日经济新闻
1100,2021-06-15,歌尔股份：实际控制人、董事长姜滨质押3500万股，解除质押2500万股,每日经济新闻
1101,2021-06-15,两上市公司为一麦克风专利“掐架”：敏芯股份一审败诉，判赔歌尔股份400万 诉讼纠纷,每日经济新闻
1102,2021-06-15,北向资金今日净卖出逾51亿元，药明康德、紫金矿业净卖出额均创新高,Wind
1103,2021-06-15,A股资金流向（6月15日）：主板两只新股疯狂“吸金”,Wind
1104,2021-06-15,电子行业每周市场动态追踪：华为鸿蒙OS 2操作系统落地 有望助推AIOT产业加速发展,新浪
1105,2021-06-15,诉讼一审判决结果出炉！敏芯股份应立即停止生产、销售侵犯原告相关专利产品等 诉讼纠纷,资本邦
1106,2021-06-15,最高预亏超亿元，486股发中报预告 预亏,Wind
1107,2021-06-14,华为AR即将登场，六氟磷酸锂一年涨三倍丨明日主题前瞻,第一财经
1108,2021-06-14,敏芯股份(688286.SH)：一审判决公司立即停止生产、销售侵犯原告歌尔相关专利的产品并赔偿400万元等 诉讼纠纷,格隆汇
1109,2021-06-11,A股共发生131宗大宗交易成交24.46亿元（6月11日）,Wind
1110,2021-06-11,歌尔股份现1笔大宗交易 共成交207.79万元,新浪
1111,2021-06-11,歌尔股份今日大宗交易成交5.50万股，成交价37.78元溢价0.13%,Wind
1112,2021-06-11,歌尔股份：公司未涉及VR品牌零售业务,每日经济新闻
1113,2021-06-10,社保基金海外投资“金手指”曝光！接下来看好这些领域,Wind
1114,2021-06-10,价值+成长！480份中报预告揭秘A股业绩“牛”,Wind
1115,2021-06-10,从股东户数增减看筹码集中度 其中一公司获70只基金持股,和讯
1116,2021-06-10,八大券商主题策略：国产软件进入新的景气周期？华为产业链受益公司名单曝光,中金在线
1117,2021-06-10,A股早报2021年6月10日星期四,Wind
1118,2021-06-10,58股股东户数连降 筹码持续集中,证券时报网
1119,2021-06-09,牛人重仓｜坐拥诸多热门概念，这只股被70只基金持有1.90亿股，易方达产品扎堆儿,每日经济新闻
1120,2021-06-09,被70只基金持有1.90亿股，这只股易方达扎堆儿！,每经网
1121,2021-06-09,【繁微另类数据】基于移动大数据的上市公司金融活动指数的选股应用,东证衍生品研究院
1122,2021-06-09,歌尔股份如何在VR行业站稳脚跟？,Ofweek
1123,2021-06-09,VR月度跟踪：QUEST占比持续提升 FB发力元宇宙,新浪
1124,2021-06-09,三驾马车保增长，歌尔股份站稳VR优势地位！,Ofweek
1125,2021-06-09,深圳致尚科技创业板IPO获受理 前五大客户贡献近八成营业收入,北京商报
1126,2021-06-09,电子商业模式专题一：用巴菲特的逻辑选电子公司,新浪
1127,2021-06-09,致尚科技要冲创业板 过半营收依赖富士康,北京商报
1128,2021-06-08,新一波业绩预告“先头部队”已抵达！聚焦确定性，三条主线把握中报行情,财联社
1129,2021-06-08,歌尔股份：实际控制人、董事长姜滨持有的0.54%公司股份质押延期购回,Wind
1130,2021-06-08,致尚科技患大客户依赖症 富士康集团贡献过半营收 经营问题,北京商报
1131,2021-06-08,歌尔股份：实际控制人姜滨延期购回1850万股,每日经济新闻
1132,2021-06-08,北向资金今日小幅净买入3.01亿元，山西汾酒净卖出额创历史新高,Wind
1133,2021-06-08,歌尔股份：下属的微电子业务子公司有涉及MEMS微电子领域内的部分芯片设计研发相关业务,每日经济新闻
1134,2021-06-08,歌尔股份：公司生产经营情况一切正常,每日经济新闻
1135,2021-06-08,52股股东户数连续下降 （附股）,证券时报网
1136,2021-06-08,半年报业绩行情来了 六大行业预喜率高,财富动力网
1137,2021-06-07,北向资金净卖出额创近一个月新高，宁德时代遭大幅抛售超14亿元,Wind
1138,2021-06-07,电子元件：鸿蒙OS2.0发布 AIOT发展加速,新浪
1139,2021-06-07,电子行业周报：疫情影响全球封测产能 大陆企业供应链国产化趋势加快,新浪
1140,2021-06-07,电子行业周报：上肥下瘦 传统旺季,新浪
1141,2021-06-07,通信电子行业景气数据跟踪报告之五：全球与国内龙头的靓丽业绩持续印证半导体高景气度,光大证券
1142,2021-06-07,半导体板块飙涨，有芯片价格涨至5倍，行业供需格局或仍趋紧丨牛熊眼,第一财经
1143,2021-06-06,手机厂商疯狂涌入 小耳机成万亿“吸金杀器”,亿邦动力
1144,2021-06-05,北向资金扫货A股88.88亿，却出逃恒瑞医药18亿、长春高新7亿，医药股怎么了？,21世纪经济报道
1145,2021-06-04,2021年5月陆股通持仓分析：北上资金对哪些行业的偏好在起变化？,新浪
1146,2021-06-04,通信-华为产业系列深度之三：万物归一 鸿蒙2.0 重构物联世界,新浪
1147,2021-06-04,传媒&通信行业“数字未来”系列一：元宇宙 未来数字绿洲入口已打开,华安证券
1148,2021-06-04,和林微纳(688661)深度报告：国产MEMS微电子零部件龙头 进军半导体测试探针贡献新动能,新浪
1149,2021-06-04,A股资金流向（6月4日）：面板、光伏龙头持续遭资金抛售,Wind
1150,2021-06-04,苹果概念股普遍下滑，比亚迪、立讯、工业富联、京东方、蓝思、歌尔集体走低,Wind
1151,2021-06-04,千亿市值龙头公司股东户数骤降30%！这些股票筹码正快速集中,Wind
1152,2021-06-04,紧密跟踪市场变化，基金及时站上热点风口,Wind
1153,2021-06-03,北向资金今日净买入15.21亿元，二线白酒股获追捧,Wind
1154,2021-06-03,歌尔股份：在VR相关领域内有开展大量的技术研发工作,每日经济新闻
1155,2021-06-03,歌尔股份：目前暂无涉及VR内容制作方面的投资规划,每日经济新闻
1156,2021-06-03,北向资金净卖出20.14亿元 这些行业和个股被抛售最多 股票卖空,21世纪经济报道
1157,2021-06-02,歌尔股份(002241.SZ)：向556名激励对象授予5246万份股票期权,格隆汇
1158,2021-06-02,歌尔股份：聘任李友波、朱胜波为公司副总裁,Wind
1159,2021-06-02,北向资金今日净卖出20.14亿元，恒瑞医药净卖出额创历史新高,Wind
1160,2021-06-02,最新股东户数揭秘：这37股股东户数连降三期,证券时报网
1161,2021-06-02,苹果板块回调，立讯精密、工业富联、京东方A、歌尔、鹏鼎、环旭普跌,Wind
1162,2021-06-02,VR、汽车电子行业景气持续,财富动力网
1163,2021-06-02,A股早报2021年6月2日星期三,Wind
1164,2021-06-02,银河证券：5G终端及汽车电动化需求旺盛推动下，电子行业盈利端将维持快速增长,证券时报网
1165,2021-06-02,电子行业景气持续，关注VR、汽车电子等高成长领域,银河证券
1166,2021-06-02,晶圆厂资本开支上行，关注设备和材料国产化机会,招商证券
1167,2021-06-01,千亿“顶流”在忙啥？刘彦春四次探访消费电子股 邓晓峰等扎堆儿童食品,新浪
1168,2021-06-01,北向资金今年净买入额已超去年全年，东方雨虹再获净买入超7亿元,Wind
1169,2021-06-01,工银瑞信深证物联网50ETF正在发行,中证网
1170,2021-06-01,A股资金流向（6月1日）：周期股重获资金青睐，券商龙头遭抛售,Wind
1171,2021-06-01,陆股通月报第20期：近期外资入场有何变化？,新浪
1172,2021-06-01,电子行业：行业景气持续 关注VR、汽车电子等高成长领域,新浪
1173,2021-06-01,苹果板块逆市拉升，比亚迪、立讯精密、歌尔、长电、信维通信走强,Wind
1174,2021-06-01,布局物联网龙头有“基”可寻 全市场首只深证物联网50ETF正式发行,中国网
1175,2021-06-01,466家公司预告上半年业绩 58.80%报喜,证券之星
1176,2021-06-01,北向资金5月抄底A股557亿元，昨日净买入52亿元，这些行业和个股最受青睐,21世纪经济报道
1177,2021-05-31,北向资金再度大幅净买入超52亿元，东方雨虹净买入额创历史新高,Wind
1178,2021-05-31,5月31日晚间重要行业研究汇总(附股),中金在线
1179,2021-05-31,电子周观点：自动驾驶提升算力需求 SOC芯片是主要增量市场,新浪
1180,2021-05-31,从手机多摄到智能汽车、AR/VR，欧菲光等光学企业纷纷瞄准新方向,和讯
1181,2021-05-31,歌尔股份：目前汇率变动对公司业务影响在可控范围内,财联社
1182,2021-05-30,专题策划二：VR/AR产业链拆解：谁将站上风口？（附投资图谱）,财联社
1183,2021-05-30,歌尔股份(002241)：TWS蓄力 AR/VR接棒,新浪
1184,2021-05-30,区块链：元宇宙：互联网的下一站,新浪
1185,2021-05-29,创新高！北向资金全周净流入超468亿元，重点加仓酿酒板块，贵州茅台占一半,21世纪经济报道
1186,2021-05-29,2021年全球智能手机出货量增速或放缓,Wind
1187,2021-05-28,苹果概念股表现不振，立讯、工业富联、京东方、歌尔、鹏鼎集体下滑,Wind
1188,2021-05-28,利好消息不断 AR/VR产业持续升温,中国电子报
1189,2021-05-28,超级风口要来？龙头股爆发，这些股估值低+净利连增,Wind
1190,2021-05-28,【银河晨报】5.28丨电子：硬件、生态持续升级，VR设备有望加速渗透,中国银河证券研究
1191,2021-05-27,北向资金四日抢筹A股近500亿，格力电器净买超7亿,Wind
1192,2021-05-27,5月27日晚间重要行业研究汇总(附股),中金在线
1193,2021-05-27,淡水泉概念股普遍走升，濮阳惠成、三环集团、歌尔股份、水晶光电等涨幅居前,Wind
1194,2021-05-27,百亿资金紧急“上车”，刘彦春掌管资金或超1200亿,Wind
1195,2021-05-27,今日再迎外资配置重要时点！北向资金连续三日净买入327亿元，增持这些股,21世纪经济报道
1196,2021-05-27,35只获得5家以上机构推荐,证券导报
1197,2021-05-27,北向资金动向盘点：重手净买91亿，茅台占12.5%,Wind
1198,2021-05-27,从外资近期净流入和持仓风格变化角度：目前依然是核心资产牛市的延续而非普涨牛市,新浪
1199,2021-05-26,中报大幕开启，绩优头部公司获市场“溢价”，机构上调全年业绩预期,红周刊
1200,2021-05-26,北向资金连续三日抢筹A股超300亿，贵州茅台再获净买入超11亿元,Wind
1201,2021-05-26,【异动股】智能电视板块下挫，歌尔股份(002241.CN)跌4.93%,财华社
1202,2021-05-26,苹果板块震荡休整，歌尔、鹏鼎控股、蓝思、立讯精密、大族激光普遍下滑,Wind
1203,2021-05-26,217亿元北向资金跑步进场 “疯抢”白酒、金融、医药股（名单）,21世纪经济报道
1204,2021-05-26,【银河电子傅楚雄/王恺】行业周报丨硬件、生态持续升级，VR设备有望加速渗透,中国银河证券研究
1205,2021-05-26,北向资金净流入创纪录，A股再现万亿成交,Wind
1206,2021-05-25,A股迎“大奇迹日”！有50ETF期权单日暴涨6850%,Wind
1207,2021-05-25,瞰鉴鲁股：7家山东公司涨幅超过10% 二股东频繁举牌“逼疯”山东墨龙股价,每日经济新闻
1208,2021-05-25,北向资金爆买A股超200亿创历史纪录，白酒、金融、医药股遭“疯抢”,Wind
1209,2021-05-25,电子行业：建议关注AR／VR产业链投资机会,新浪
1210,2021-05-25,歌尔股份：公司持有Waveoptics公司约7%的股权,每日经济新闻
1211,2021-05-24,5月24日晚间重要行业研究汇总(附股),中金在线
1212,2021-05-24,歌尔股份：公司的微型麦克风产品被广泛应用于各种降噪技术应用场景中,每日经济新闻
1213,2021-05-24,电子行业周报：荣耀复苏 大基金减持 减持股份,新浪
1214,2021-05-24,科技硬件行业周报：AR新进展广受关注,新浪
1215,2021-05-24,中国银河--电子行业：硬件、生态持续升级，VR设备有望加速渗透【行业研究】,金融界股吧
1216,2021-05-24,苹果概念股复苏，立讯精密、歌尔股份、欣旺达、长盈精密领涨,Wind
1217,2021-05-24,一周概念股：Q2超30家半导体公司集体涨价，两大硬件产业链竞争局面反转,搜狐
1218,2021-05-22,【银河周知】看好大宗商品和消费相关行业的投资机会,中国银河证券研究
1219,2021-05-22,【民生周末重点推荐】首席看电子：业绩增长强劲，电子行业景气延续——电子行业2020年报和2021一季报总结,MS研究
1220,2021-05-22,电子行业周报：煎熬过后静待佳音,新浪
1221,2021-05-22,高端制造：科技行业物联网周报：滴滴自动驾驶携手广汽埃安推进量产全无人驾驶车型,新浪
1222,2021-05-21,19股筹码连续3期集中,证券时报网
1223,2021-05-21,歌尔股份：公司在VR/AR产品上有相关业务布局，并具备较强的竞争力,每日经济新闻
1224,2021-05-20,光学行业深度追踪系列第29期(2021年4月)：4月份数据环比下行 关注疫情、缺货以及终端需求影响,新浪
1225,2021-05-20,2021一季度行业净利增速超1.5倍：复盘电子行业大数据 提速之后再提速,全景网
1226,2021-05-20,“专利战”后的敏芯股份：盈利下滑30%，细分产品收入披露混乱 盈利能力下降,新浪
1227,2021-05-20,虚拟现实发展将迎来爆发期,上证报
1228,2021-05-20,A股早报2021年5月20日星期四,Wind
1229,2021-05-20,虚拟货币一周蒸发6000亿，马斯克来回割韭菜？,Wind
1230,2021-05-19,银河电子周观点：功率半导体景气度向上 国内厂商扩产趋势明显,新浪
1231,2021-05-19,三大概念受105亿主力资金追捧,证券时报网
1232,2021-05-19,资金抢筹！虚拟现实迎涨停潮，产业空间几何,Wind
1233,2021-05-19,A股资金流向（5月19日）：比亚迪获资金爆买，银行股遭抛售,Wind
1234,2021-05-19,VR不再遥不可及，产业进入爆发期，千亿果链大白马反弹已近60%,财联社
1235,2021-05-19,苹果板块升势强劲，歌尔股份、欣旺达、水晶光电、蓝思、鹏鼎大涨,Wind
1236,2021-05-19,午评：指数早盘走势分化 汽车整车板块领涨,ZAKER
1237,2021-05-19,虚拟现实概念股集体拉升歌尔股份涨超7%,格隆汇
1238,2021-05-19,TOF概念板块走强 歌尔股份涨幅居前,新浪
1239,2021-05-19,快讯：虚拟现实概念股早盘走强 歌尔股份领涨,财联社
1240,2021-05-19,歌尔股份盘中快速上涨,新浪
1241,2021-05-18,歌尔股份：公司越南工厂一直执行严格的防疫政策，目前工厂生产经营情况一切正常,每日经济新闻
1242,2021-05-18,银河证券：5G终端及汽车电动化需求旺盛，电子行业盈利端将加速增长,证券时报网
1243,2021-05-18,103股上半年净利润预计翻倍,财富动力网
1244,2021-05-17,5月17日晚间重要行业研究汇总(附股),中金在线
1245,2021-05-17,歌尔股份发布新型TWS主动降噪耳机参考设计ROX,IT之家
1246,2021-05-17,歌尔股份大涨,新浪
1247,2021-05-17,歌尔股份：发布新型TWS耳机参考设计,e公司
1248,2021-05-16,智新电子(837212)：深耕连接器15载 消费电子+汽车双引擎驱动,新浪
1249,2021-05-16,【民生研究】周观点汇总：疫情和就业数据只是扰动，发达国家经济复苏趋势没有改变,新浪
1250,2021-05-14,北向资金狂买近百亿，五粮液获大幅净买入超9亿元,Wind
1251,2021-05-14,北向资金大幅减持股名单 减持股份,证券时报网
1252,2021-05-14,北向资金动向盘点：重手净减持医药,Wind
1253,2021-05-14,北向资金3日合计出逃百亿元，昨日大幅买入“锂茅”4.7亿元，加仓白酒行业最多,21世纪经济报道
1254,2021-05-13,电子行业2020年年报暨2021年一季报总结：淡季不淡 高景气下电子行业表现亮眼,新浪
1255,2021-05-13,歌尔股份(002241.SZ)：2020年度拟10派1.5元5月19日股权登记,格隆汇
1256,2021-05-13,北水加仓美团12亿，增持腾讯10亿；南水抛售万华化学、歌尔股份 资产异常,富途证券
1257,2021-05-13,北向资金连续3日净卖出逾百亿，万华化学遭大幅抛售8亿元,Wind
1258,2021-05-13,A股资金流向（5月13日）：资金各自为战，有色龙头连续被抛售,Wind
1259,2021-05-13,电子行业2021年中期策略：大变局下的电子行业新机遇,新浪
1260,2021-05-13,白金分析师强烈看多AR/VR获四重逻辑共振行业变局已至,科创板日报
1261,2021-05-13,电子行业2020年报和2021一季报总结：业绩增长强劲 电子行业景气延续,新浪
1262,2021-05-12,果链巨头集体走跌：苹果、立讯精密等贡献9成收入 智立方IPO胜算几何？ 盈利能力下降,野马财经
1263,2021-05-12,44股筹码连续3期集中,证券时报网
1264,2021-05-12,博敏电子(603936)：盈利能力逐年增长 一季度需求旺盛业绩亮眼,新浪
1265,2021-05-12,电子行业4月动态报告：半导体景气度向上 华为引领汽车智能化,新浪
1266,2021-05-12,VR爆发前夜，歌尔股份的虚与实,36氪
1267,2021-05-12,电子行业：FY20&1Q21业绩回顾和持仓分析,新浪
1268,2021-05-11,银河证券：2021年电子行业盈利端将加速增长，维持行业“推荐”评级,证券时报网
1269,2021-05-10,科技行业FY20&1Q21业绩回顾：半导体设计／制造板块迎来高景气周期,新浪
1270,2021-05-10,电子行业周报：21Q1业绩向好 行业景气度持续旺盛,新浪
1271,2021-05-10,电子行业：高景气延续 把握国产替代+顺周期机会,国联证券
1272,2021-05-10,魔咒上演？茅资产跌8500亿，A股在担心什么？,Wind
1273,2021-05-10,机构最新潜在目标曝光，海康威视获500家机构调研,Wind
1274,2021-05-08,歌尔微电子拟A股IPO已进行上市辅导备案,搜狐
1275,2021-05-07,北向资金分化加剧，中国平安、贵州茅台再遭净卖出逾5亿元,Wind
1276,2021-05-07,【行情】苹果板块单边下跌，比亚迪、工业富联、立讯精密、京东方A、蓝思科技、歌尔股份、鹏鼎控股、长电科技集体走低 连续下跌,金十数据
1277,2021-05-07,苹果板块单边下滑，比亚迪、工业富联、立讯、京东方、蓝思、歌尔集体走低,Wind
1278,2021-05-07,歌尔股份：提前发布半年报预告，盈利增长超100%,中金在线
1279,2021-05-06,瞰鉴鲁股：总市值暴涨千亿后五一节前大跌，板块老大万华化学市值缩水263亿 连续下跌,每日经济新闻
1280,2021-05-06,股东户数降幅榜：4股最新股东户数降逾一成,证券时报网
1281,2021-05-06,北向资金午后加速离场，中国平安遭大幅抛售超15亿元,Wind
1282,2021-05-06,中国银河--电子行业4月动态报告：半导体景气度向上，华为引领汽车智能化【行业研究】,金融界股吧
1283,2021-05-06,歌尔股份：公司暂未涉及Steam的VR硬件产品合作,每日经济新闻
1284,2021-05-06,歌尔股份：有涉及与游戏相关的硬件产品业务,Wind
