1005,2021-07-01,【兴证银行 傅慧芳/陈绍兴】理财周报（2021.06.21-2021.06.27）：理财净值波动加大,兴证金融
1006,2021-06-30,民生银行福州片区分行被罚50万：贷前调查不尽职 金融监管处罚,新浪
1007,2021-06-30,福建银保监局：对民生银行福建自贸试验区福州片区分行作出行政处罚，罚款50万元 金融监管处罚,Wind
1008,2021-06-30,房地产行业周报：多城市房贷收紧 板块估值再创新低,新浪
1009,2021-06-29,泛海控股(000046.SZ)：就向民生银行北京分行申请的融资增加抵押担保 大额借贷担保,格隆汇
1010,2021-06-29,看联想“新IT”如何做多中国经济,投资家
1011,2021-06-29,民生银行秦皇岛分行开展普及金融知识宣传月活动,新浪
1012,2021-06-29,民生银行衡水分行开展2021年“普及金融知识万里行”活动,新浪
1013,2021-06-29,民生银行信息科技部获TMMi 5级认证,财经网
1014,2021-06-29,学法用法护小家 防非处非靠大家 —民生银行石家庄分行组织开展2021年防范非法集资宣传活动,新浪
1015,2021-06-29,善行河北抗疫情，民生爱心进校园——民生银行石家庄分行捐赠爱心图书,新浪
1016,2021-06-29,践行普惠金融，服务实体经济 ——民生银行石家庄分行打造真正的“小微之家”,新浪
1017,2021-06-29,投资国债，安全理财 ——民生银行保定分行开展国债宣传活动,新浪
1018,2021-06-29,民生银行张家口分行举行“小小银行家 民生消保在行动”主题宣传活动,新浪
1019,2021-06-29,民生银行唐山分行开展 “普及金融知识守住钱袋子”宣传活动,新浪
1020,2021-06-29,民生银行衡水永兴路支行成功堵截一起出租出借账户事件,新浪
1021,2021-06-29,民生银行保定分行组织开展消防培训活动,新浪
1022,2021-06-29,民生银行衡水永兴路支行开展《存款保险条例》宣传活动,新浪
1023,2021-06-29,央行召开重磅会议，六大定调出现调整，释放啥信号,Wind
1024,2021-06-28,金风科技：对天信租赁相关《保理服务合同》项下发生的债务偿还义务提供担保 担保风险,每日经济新闻
1025,2021-06-28,中国民生银行信用卡中心深入开展2021年消费者权益保护宣教活动,中国网
1026,2021-06-28,公募FOF驶入快车道 三大优势破解基民痛点,新浪
1027,2021-06-28,A股融资融券日报：两融余额增加18.39亿元（6月25日）,Wind
1028,2021-06-28,三大优势破解基民痛点 公募FOF驶入快车道,上证报
1029,2021-06-27,中国民生银行重庆分行20周年行庆名家讲坛成功举办,上游新闻
1030,2021-06-27,广州20家银行房贷利率测评：首套最高已涨至5.85%,新浪
1031,2021-06-27,陆家嘴财经早餐2021年6月27日星期日,Wind
1032,2021-06-26,"银行二季度发债规模创新高，什么信号？中小行密集""补血""，永续债发行升温",Wind
1033,2021-06-25,民生银行(01988.HK)：非执行董事赵鹏任职资格获核准,格隆汇
1034,2021-06-25,快讯｜民生银行：董事赵鹏任职资格获批,财经网
1035,2021-06-25,民生银行(600016.SH)赵鹏董事任职资格获中国银保监会核准,智通财经
1036,2021-06-25,联想集团(00992.HK)金融领域又一重磅动作 与民生银行达成战略合作,格隆汇
1037,2021-06-25,联想集团(00992)与民生银行(01988)达成战略合作，“新IT”赋能行业取得新进展,智通财经
1038,2021-06-25,什么信号？A股突然爆发，外资扫货141亿,Wind
1039,2021-06-25,棱镜｜民生银行回应为恒大集团贷款：授信风险在可控范围内,腾讯网
1040,2021-06-25,网传骑手反抗美团霸王条款！松下已卖掉所有特斯拉股票！,搜狐
1041,2021-06-25,民生银行首创键盘银行 让银行服务无处不在,金融界
1042,2021-06-25,*ST澄星:民生银行部分债权转让给中国信达江苏分公司,深水财经社
1043,2021-06-24,民生银行称已降低恒大风险敞口 授信风险可控,新浪
1044,2021-06-24,提前偿还美元债、金融机构力挺，恒大暂时松口气,新浪
1045,2021-06-24,中国民生银行成都分行：坚持法治引领 践行依法治行,金融投资报
1046,2021-06-24,央行研究局报告：应重点加大对清洁能源领域绿色贷款支持,Wind
1047,2021-06-24,【兴证银行 傅慧芳/陈绍兴】理财周报（2021.06.14-2021.06.20）：理财产品预期收益率小幅回升,兴证金融
1048,2021-06-24,银行理财周报：理财收益率环比下降 恒丰银行理财子获批,新浪
1049,2021-06-24,民生银行成功堵截一起涉聋哑人士网络诈骗 欺诈造假,财富动力网
1050,2021-06-23,【银华基金】交易日报 2021-6-23,新浪
1051,2021-06-23,吸收存款负增长为何由？民生银行：剔除结构性存款压降，吸收存款余额为正增长,新浪
1052,2021-06-23,频收百万罚单 民生银行年内累计被罚逾千万成监管重点“关心”对象 金融监管处罚,新浪
1053,2021-06-23,这家股份行成监管重点“关心”对象！频收百万罚单，民生银行年内累计被罚逾千万！ 金融监管处罚,和讯
1054,2021-06-23,被金融逼上“煤山”的地产大佬,新浪
1055,2021-06-23,民生银行今日大宗交易成交30万股，成交价5.1元溢价10.15%,Wind
1056,2021-06-23,民生银行“过昭关”，6月新增罚款近500万，年内已领罚单15张,资本邦
1057,2021-06-23,民生银行兰州分行虚假办理信用卡？银行：客户经理私自承诺，已离职 欺诈造假,新浪
1058,2021-06-23,民生银行广州分行 廿五载深耕民企小微金融“沃土”,南方日报
1059,2021-06-23,银行行业周报：理财产品预期收益率小幅回升,新浪
1060,2021-06-22,新报价方式下不同银行存款利率分化明显在哪家银行存钱最划算？,财联社
1061,2021-06-22,智慧银行体验店玩法一览，京东方、中国民生银行城会玩,牛华网
1062,2021-06-22,福建银保监局：对民生银行福州分行作出行政处罚，罚款100万元 金融监管处罚,Wind
1063,2021-06-22,民生银行福州分行被罚款百万 金融监管处罚,中新经纬
1064,2021-06-22,因理财产品投前调查不尽职等，中国民生银行福州分行被罚100万 金融监管处罚,中华网
1065,2021-06-22,民生银行福州分行被罚100万：未按工程进度发放贷款 金融监管处罚,新浪
1066,2021-06-22,民生银行重庆分行启动“2021年银行业普及金融知识万里行”暨“普及金融知识，守护‘钱袋子’”宣教活动,上游新闻
1067,2021-06-22,聚焦改革老年客群服务体验 民生银行保定分行服务再升,新浪
1068,2021-06-22,误入科幻片现场？京东方&中国民生银行打造的智慧银行太酷,电子产品世界
1069,2021-06-22,北京以37个备案数量居首,证券日报
1070,2021-06-21,中国民生银行重庆分行： 助力乡村振兴 为涉农企业发展注入金融活水,上游新闻
1071,2021-06-21,中国民生银行与北国人百集团联合举办“民生北国卡发卡周年庆暨2.0权益升级发布会”,新浪
1072,2021-06-21,销售渠道力推“金选”基金 精品化策略助推流量提升,中国基金报
1073,2021-06-20,宁波银行(002142.SZ)：最高人民法院终审判决驳回民生银行宁波分行的上诉、维持原判 诉讼纠纷,格隆汇
1074,2021-06-19,创新物联科技赋能金融场景 BOE（京东方）携手中国民生银行打造智慧银行新标杆,中国家电网
1075,2021-06-18,中国民生银行北京分行行长杨毓：银行如何在企业生长全周期进行融资需求匹配,金融界
1076,2021-06-18,宁波银行(002142.SZ)与民生银行宁波分行合同纠纷终审结案 诉讼纠纷,智通财经
1077,2021-06-18,民生银行董事长高迎欣：支行长要把小微金融的具体工作放到国之大者中思考定位,中国网
1078,2021-06-18,4家科技企业亮相民生银行新经济企业专题路演,每日经济新闻
1079,2021-06-18,民生银行董事长高迎欣：支行长作为银企相连重要枢纽，要推动企业充分享受政策红利,和讯
1080,2021-06-18,河北银保监局：一季度银行业消费投诉894件 工农邮储农行投诉量前三,银保监会
1081,2021-06-18,民生银行党委书记、董事长高迎欣：金融服务顾问制度有望成为小微金融的主渠道之一,金融界
1082,2021-06-18,2张图一览地方债现状！上半年发行放缓，下半年将加速？,Wind
1083,2021-06-18,针对处罚、不良、资本补充等问题 民生银行回复证监会,中国银行保险报
1084,2021-06-18,万字长文回复监管，民生银行怎么了？,凤凰网
1085,2021-06-18,民生银行董事长高迎欣：“支行长们”要登高望远 做懂全局的追随者,新浪
1086,2021-06-18,三季度地方债或迎发行高峰，对基建投资形成支撑,Wind
1087,2021-06-18,民生银行跨境金融E站通,北京商报
1088,2021-06-17,民生银行(01988)拟派现金红利每股A股0.213元,智通财经
1089,2021-06-17,民生银行(01988.HK)A股年报推10派2.13元 股权登记日6月23日,格隆汇
1090,2021-06-17,泛海控股(000046.SZ)：增加2家控股子公司为92亿元融资提供担保 大额借贷担保,格隆汇
1091,2021-06-17,打造理财替代标杆 “民生磐石”上线半年突破600亿元,上证报
1092,2021-06-17,泛海控股获得民生银行同意增加两家子公司为92亿借款提供担保 大额借贷担保,观点地产网
1093,2021-06-17,泛海控股：增加子公司92亿元贷款的连带责任保证担保 大额借贷担保,乐居财经
1094,2021-06-17,泛海控股：获中国民生银行融资本金余额92亿元,乐居财经
1095,2021-06-17,民生银行现1笔大宗交易 共成交997.92万元,新浪
1096,2021-06-17,银行理财周报：理财收益率环比上升 理财子浮动管理费率最低,新浪
1097,2021-06-17,民生银行乳山支行积极开展存款保险宣传活动,搜狐
1098,2021-06-17,民生银行(600016.SH)：2020年度权益分派10派2.13元 股权登记日6月23日,格隆汇
1099,2021-06-17,民生银行(600016.SH)6月24日分红 A股拟每股派0.213元,智通财经
1100,2021-06-17,民生银行重庆分行：开展行长接待日活动 切实维护消费者合法权益,上游新闻
1101,2021-06-17,【兴证银行 傅慧芳/陈绍兴】理财周报（2021.06.07-2021.06.13）：理财产品预期收益率下行,兴证金融
1102,2021-06-17,商业银行行业：商业银行业日报,新浪
1103,2021-06-17,5月经济稳定恢复，消费制造业投资明显改善,Wind
1104,2021-06-16,再现重磅产品！ 兴证全球基金，发力FOF基金市场,新浪
1105,2021-06-16,民生银行6万字回复证监会二次反馈：已在规定时间内缴纳罚款并制定整改计划 金融监管处罚,新浪
1106,2021-06-16,【异动股】民生银行(01988.HK)涨3.2%,金融界
1107,2021-06-16,燕赵献礼百年 唱响征信文化 --民生银行衡水分行开展“6·14”征信宣传系列活动,新浪
1108,2021-06-16,守护账户安全 畅通金融消费 ——民生银行石家庄分行开展“断卡”系列宣传活动,新浪
1109,2021-06-16,民生银行衡水分行开展存款保险宣传活动,新浪
1110,2021-06-16,银行行业周报：理财产品预期收益率下行,新浪
1111,2021-06-15,民生银行500亿元可转债发行进展：6万字回复证监会二次反馈,和讯
1112,2021-06-15,民生银行跌1.28% 股价创近1个月新低 连续下跌,中新经纬
1113,2021-06-15,民生银行信贷业务违规领罚351万元 涉及为“四证”不全的房地产项目融资等 金融监管处罚,乐居财经
1114,2021-06-15,险资一路减持 A股“第一大傻”银行股路在何方？ 减持股份,中新经纬
1115,2021-06-15,民生银行手机银行率先适配鸿蒙系统,经济网
1116,2021-06-15,分红4900亿！险资却一路减持，银行股路在何方？,Wind
1117,2021-06-14,真金白银分红4900亿:险资却一路减持 A股“第一傻”工商银行路在何方？|农业银行 减持股份,21世纪经济报道
1118,2021-06-14,真金白银分红4900亿险资却一路减持，萎靡不振的A股“第一大傻”银行股路在何方？ 减持股份,21世纪经济报道
1119,2021-06-13,一站受理 一次办好 民生银行西安分行民企服务中心为企业办实事小记,中国金融新闻网
1120,2021-06-12,民生银行召开股东大会 董事长高迎欣坦言“过去出现了一些问题”,新浪
1121,2021-06-12,直击民生银行股东大会 | 董事长高迎欣回应“失去的十年”：用长期和协同追回差距,和讯
1122,2021-06-12,民生银行召开股东大会 投票通过多项议案,中证网
1123,2021-06-12,中国民生银行股份有限公司2020年年度股东大会、2021年第一次A股类别股东大会和2021年第一次H股类别股东大会决议公告,中证报
1124,2021-06-11,民生银行(01988)将派发现金股息每股0.25883754港元,智通财经
1125,2021-06-11,湖北银保监局：对民生银行武汉分行作出行政处罚，罚没合计351.07万元 金融监管处罚,Wind
1126,2021-06-11,民生银行现1笔大宗交易 共成交158.78万元,新浪
1127,2021-06-11,民生银行一分行被罚没350余万：为“四证”不全房地产项目融资等 金融监管处罚,中新经纬
1128,2021-06-11,民生银行今日大宗交易成交34万股，成交价4.67元溢价0.0%,Wind
1129,2021-06-11,民生银行武汉分行被罚330万：违规向关系人发放贷款 金融监管处罚,新浪
1130,2021-06-11,普惠金融抓落实助企暖企添活力,海峡导报
1131,2021-06-10,银行业理财周报：理财收益率环比下降 大行浮动管理费率较高,新浪
1132,2021-06-10,民生银行南宁分行：十年立业的“坚守”与“变化”,中国金融新闻网
1133,2021-06-10,民生银行手机银行率先适配鸿蒙系统,金融界
1134,2021-06-10,股价低迷、关联贷款风险、高管薪酬，民生银行高管回应热点问题,36氪
1135,2021-06-10,民生银行三亚凤凰路支行,海口网
1136,2021-06-10,A股融资融券日报：两融余额减少2.5亿元（6月9日）,Wind
1137,2021-06-10,我为群众办实事 疫情之下 民生银行广州分行助力“穗穗平安”,财富动力网
1138,2021-06-10,5月PPI涨幅创近13年新高，料将渐进回落,Wind
1139,2021-06-09,民生银行今日大宗交易成交45.98万股，成交价4.67元溢价0.0%,Wind
1140,2021-06-09,银行行业周报：理财净值波动持续分化,新浪
1141,2021-06-08,浙商银行换届：一行两副辞职，高管团队年轻化,21世纪经济报道
1142,2021-06-08,莆田银保监局：对民生银行莆田分行作出行政处罚，罚款30万元 金融监管处罚,Wind
1143,2021-06-08,账上资金不足4000万遭银行追讨1.7亿欠款 ST中昌要如何还债？ 违约失信,每日经济新闻
1144,2021-06-08,民生银行石家庄分行开展 “小小银行家 民生消保进校园”活动,新浪
1145,2021-06-08,什么信号？中国5月外储重回3.2万亿美元，创五年多新高,Wind
1146,2021-06-07,“高估”的贵州茅台和“低估”的民生银行，该选谁？,证券之星
1147,2021-06-07,民生银行莆田分行被罚30万：贷款管理不到位导致贷款资金被挪用 金融监管处罚,新浪
1148,2021-06-07,民生银行莆田分行因贷款管理不到位被罚30万元 金融监管处罚,鲸平台
1149,2021-06-07,净利暴跌、股东减持，问诊民生银行，“动刀”可否纾困？ 盈利能力下降,《商学院》杂志
1150,2021-06-07,DataPipeline实时数据融合平台V3.0里程碑版发布！澎湃新动能,砍柴网
1151,2021-06-07,多家上市银行“破净”触发稳定股价措施,Wind
1152,2021-06-07,破净率逼近八成，上市银行股东频增持,Wind
1153,2021-06-05,增持进行时！多家上市银行触发稳定股价措施启动条件,Wind
1154,2021-06-05,泛海再卖海外资产 卢志强已走到最艰难时刻 资产异常,搜狐
1155,2021-06-04,绿色足迹 | 股份行的绿色“成绩单”,和讯
1156,2021-06-03,星展银行：将民生银行评级下调至卖出，目标价3.39港元,Wind
1157,2021-06-02,银行资产质量哪家强？最新榜单来了,证券之星
1158,2021-06-02,民生银行吕梁分行与汾阳市人民政府签署战略合作协议,山西晚报
1159,2021-06-01,324只股破净房地产建筑装饰最为集中,证券时报网
1160,2021-06-01,净利暴跌、股东减持 盈利能力下降,商学院
1161,2021-06-01,每日理财观察：时隔14年央行再度上调外汇存款准备金率,Wind
1162,2021-06-01,14年来第一次！央行外汇存款准备金率提高2%,Wind
1163,2021-05-31,海外信用评级汇总2021年5月31日星期一,Wind
1164,2021-05-31,标普：确认民生银行及其子公司“BBB-”长期发行人信用评级,Wind
1165,2021-05-30,中国民生银行总行党委委员、副行长林云山一行在汾酒公司调研,搜狐
1166,2021-05-28,多家银行信用卡分期收入超过百亿 揭开信用卡“暴利”真相,新浪
1167,2021-05-28,抢滩财富管理市场 陆金所香港与民生银行香港分行达成战略合作,中证网
1168,2021-05-28,陆金所香港与民生银行香港分行达成战略合作 强强连手迎接财富管理的庞大机遇,中国网
1169,2021-05-28,中国民生银行成都分行：川内首批推广碳减排再贴现业务落地,搜狐
1170,2021-05-27,银行行业周报：理财净值波动持续分化,新浪
1171,2021-05-27,因个人征信纠纷 招行、民生和交行曾同时坐上被告席,新浪
1172,2021-05-27,重磅！千亿金控集团泛海控股美元债实质性违约 泛海系年内209亿债券待偿 未按时兑付本息,新浪
1173,2021-05-27,银行行业：理财收益率平稳 非净值型产品发行占比续降,新浪
1174,2021-05-26,近10日45家公司获高管增持,证券时报网
1175,2021-05-26,49家公司高管出手增持动用资金4.97亿元,证券时报网
1176,2021-05-26,四度“冲关”终突破，离岸人民币汇率重回“6.3时代”,Wind
1177,2021-05-26,经济数据显示美国通胀加剧 美元债一级供给持续增加,新浪
1178,2021-05-25,邮储银行再启稳定股价方案：邮政集团出资5000万护航，上市至今增持出资超48亿,搜狐
1179,2021-05-25,民生银行举办“银色经济·灵活就业与养老金服务”,中国网
1180,2021-05-24,民生银行遭“清仓”背后：业绩大幅下滑，频领巨额罚单 盈利能力下降,发现网
1181,2021-05-24,13股获重要股东大手笔增持（附股）,证券时报网
1182,2021-05-24,智通港股沽空统计|5月24日,智通财经
1183,2021-05-24,民生银行高管耗资千万增持“护价”,国际金融报
1184,2021-05-23,【中信建投银行杨荣】周报257期:《从招行升级“财富开放平台”谈起》,eResearch杨荣团队
1185,2021-05-23,天泽信息(300209.SZ)：已无力偿还两笔到期并购贷款 合计产生逾期贷款本金3650万元 未按时兑付本息,格隆汇
1186,2021-05-23,天泽信息(300209.SZ)部分并购贷款逾期 违约失信,智通财经
1187,2021-05-23,又一批银行可转债计划密集公布，还有这些银行已发行完毕,Wind
1188,2021-05-21,【兴证银行】银行理财周报（2021.05.10-2021.05.16）：理财净值波动分化,兴证金融
1189,2021-05-21,深圳银保监局：对民生银行深圳分行作出行政处罚，罚款40万元 金融监管处罚,Wind
1190,2021-05-21,什么信号？深圳等地上调，全国房贷平均利率连升4月,Wind
1191,2021-05-21,分化料持续 银行股估值有望修复,中证报
1192,2021-05-21,银行行业周报：理财净值波动分化,新浪
1193,2021-05-21,分化料持续 银行股估值有望修复,中证网
1194,2021-05-20,调查|“热”楼市再遇“冷”信贷 宁波深圳多地房贷利率悄然上调 业内称稳仍是主旋律,财联社
1195,2021-05-20,民生银行举办“萤火计划”华北区域投资路演峰会,中国网
1196,2021-05-20,问诊民生：净利暴跌、股东减持 董事长高迎欣“动刀”可否纾困？ 盈利能力下降,新浪
1197,2021-05-20,民生银行高增长的大环境已逝，高迎欣带队下的集体增持成色几何？,腾讯网
1198,2021-05-20,民生银行独董刘纪鹏买入15万股民生银行股票，承诺锁定两年,资本邦
1199,2021-05-20,5月20日保险日报：华夏人寿或清仓民生银行,新浪
1200,2021-05-20,民生银行(01988.HK)独立非执行董事刘纪鹏买入股票,财华社
1201,2021-05-19,经济学家刘纪鹏买入民生银行股票，现任公司独董，此前高管斥资千万集体增持,中证报
1202,2021-05-19,力挺“护价”上市银行高管、股东频频出手增持,北京商报
1203,2021-05-19,晚间重要公告2021年5月19日星期三,Wind
1204,2021-05-19,民生银行(01988)获独董刘纪鹏增持15万股A股,智通财经
1205,2021-05-19,民生银行(01988.HK)获独董刘纪鹏买入15万股A股,格隆汇
1206,2021-05-19,刘纪鹏回应首次买入民生银行：新领导班子改革带来信心,e公司
1207,2021-05-19,民生银行独立董事增持公司股票,上证报
1208,2021-05-19,犀牛财经晚报：民生银行众高管斥资千万增持 非凡中国大举减持李宁,GPLP犀牛财经
1209,2021-05-19,漩涡中的民生银行又有新动作！15名高管斥千万买入自家股票,新浪
1210,2021-05-19,华夏人寿或清仓民生银行 高管紧急增持“护价”,21世纪经济报道
1211,2021-05-19,民生银行董监高、独董购入自家A股股票，斥资超1150万元,澎湃新闻
1212,2021-05-19,高管集体斥资千万增持233万股 民生银行股价或趋稳,华夏时报
1213,2021-05-19,民生银行(600016.SH)获独立董事刘纪鹏增持15万股,智通财经
1214,2021-05-19,民生银行：独立董事刘纪鹏5月19日增持15万股公司A股股份,Wind
1215,2021-05-19,民生银行高管二度增持自家股票233万股，锁定期两年,资本邦
1216,2021-05-19,民生银行高管再度增持公司股票,新浪
1217,2021-05-19,银行股下挫，兴业银行跌超2%！民生银行15位高管斥资千万增持自家股票,资本邦
1218,2021-05-19,民生银行15位高管斥资千万买自家股票，所为何因？,Wind
1219,2021-05-19,47股获高管增持三七互娱获增持8.69亿元,证券时报网
1220,2021-05-19,民生银行遭遇“变形记”,发现网
1221,2021-05-19,再度集体增持！民生银行15位高管斥资千万买入自家股票，董事长行长带头，所为何因？,券商中国
1222,2021-05-19,A股融资融券日报：两融余额增加53.49亿元（5月18日）,Wind
1223,2021-05-19,民生银行独立董事买入15万股A股股票,北京商报
1224,2021-05-18,民生银行(01988)获15位高管合共增持233万股A股,智通财经
1225,2021-05-18,民生银行(600016.SH)：高管已合计买入233万股,格隆汇
1226,2021-05-18,7天内14家银行被罚3210万 7家因贷款违规流入楼市被罚1890万 金融监管处罚,新浪
1227,2021-05-18,银行周报：4月社融数据稳定 息差或将上行,新浪
1228,2021-05-18,【我为群众办实事】3个工作日放款，民生银行高效解决客户融资需求,财富动力网
1229,2021-05-17,哈投股份(600864.SH)拟以持有的民生银行及方正证券不超30%股份参与出借交易,智通财经
1230,2021-05-17,业绩大幅下滑行业垫底 民生银行频领大罚单不良率连升 盈利能力下降,长江商报
1231,2021-05-17,用指尖感触有温度的金融服务,中国金融新闻网
1232,2021-05-17,民生银行加速出清不良净利21年首降 小微招牌失色转战对公业务前路待考 盈利能力下降,长江商报
1233,2021-05-17,民生银行分行频频被罚：违规转嫁成本，同业投资资金变向支付土地出让金 金融监管处罚,电鳗快报
1234,2021-05-17,民生银行加速出清净利回到9年前，发力对公业务能崛起吗？,长江商报
1235,2021-05-15,谁家卖基金的能力最强？,包子君
1236,2021-05-14,中小银行逐鹿基金江湖：浦发民生领跑 中信平安紧跟,新浪
1237,2021-05-14,福布斯全球企业2000强发布！中国银行跌出前十，国寿排名下降12位,新浪
1238,2021-05-14,民生加银金牌FOF团队 实力打造一站式资产配置,和讯
1239,2021-05-13,A股上市股份行首季净利增速排名：平安招行兴业领先,中国经济网
1240,2021-05-13,银行业能否扛起金融科技创新大旗？看几个关键指标就清楚了,和讯
1241,2021-05-13,多家中小行一季度营收出现负增长，投资收益成拖累，3家大降95%,Wind
1242,2021-05-13,安信国际 | IPO点评：新希望服务(3658.HK)-5分,安信国际
1243,2021-05-13,专家：贷款总量平稳增长，货币投放将凸显“有保有压”,Wind
1244,2021-05-13,一季度投资收益挺不住，多家中小银行营收露“负”,Wind
1245,2021-05-12,理财子多款现金类产品七日年化超3% 国有大行现金类产品收益总体偏低丨机警理财日报 （5月12日）,21世纪经济报道
1246,2021-05-12,中证报：通胀总体可控，货币政策以稳为主,Wind
1247,2021-05-11,城商行三强：13年沧海桑田,新浪
1248,2021-05-11,民生银行以远程银行赋能普惠金融服务,中国金融新闻网
1249,2021-05-11,民生银行温彬：4月PPI同比涨幅超预期,Wind
1250,2021-05-11,民生银行股价创6年新低 重要股东“坚持”清仓 连续下跌,财富动力网
1251,2021-05-10,上市银行薪酬排行榜：员工年薪33万 民生银行业绩最差高管平均薪酬最高为163万,挖贝网
1252,2021-05-10,民生银行净利跌36% 行长仍拿400万年薪！ 盈利能力下降,新浪
