495,2021-06-25,嘉益股份上市首日涨308% IPO募1.95亿浙商证券赚0.28亿,中国经济网
496,2021-06-24,券业一哥欲设资管子公司，未来还要发力公募，影响有多大,Wind
497,2021-06-23,粤开证券150亿定增悬了还是妥了？屡见券商缩水定增 控股股东愿意护航吗,财联社
498,2021-06-23,4000亿“不死鸟”崩盘，这份数据引发空袭？四大信号指明方向,Wind
499,2021-06-23,屡见券商定增大幅缩水，究竟是谁拒绝“买单”？都有一个重要原因：主要股东均未参与,财联社
500,2021-06-22,浙商证券：元力股份（300174.SZ）全球木质活性炭龙头，首予“增持”评级,智通财经
501,2021-06-21,公募REITs上市首日全面告捷，首批双创50ETF开售,Wind
502,2021-06-21,浙商证券：晶盛机电（300316.SZ）再增资中环领先，期待公司半导体设备再突破，维持“买入”评级,智通财经
503,2021-06-21,浙商证券营收破百亿净利率仅15.3% 百亿募资缩水72亿同业竞争再遭延期 盈利能力下降,长江商报
504,2021-06-21,浙商证券沪杭甬杭徽高速封闭式基础设施证券投资基金上市交易提示性公告,证券时报
505,2021-06-20,谁在闷声发大财？一文看懂券商成绩单,腾讯网
506,2021-06-20,券商成绩单出炉，一文揭晓哪些业务最赚钱，哪家券商发展潜力大？,新京报
507,2021-06-19,券业38项指标排名出炉，投资能力分化显著,Wind
508,2021-06-18,浙商证券(601878.SH)：成功发行10亿元超短融,格隆汇
509,2021-06-18,浙商证券(601878.SH)完成发行10亿元2021年度第五期短期融资券,智通财经
510,2021-06-18,全球流动性拐点确认，如何投资？,Wind
511,2021-06-18,浙江浙商证券资产管理有限公司关于浙商证券沪杭甬杭徽高速封闭式基础设施证券投资基金做市商的公告,证券时报
512,2021-06-17,中国证监会行政处罚决定书（周燕） 金融监管处罚,证监会
513,2021-06-17,再融资月报｜5月再融资合计募资518亿,每日经济新闻
514,2021-06-17,浙商证券：莱克电气（603355.SH）世界吸尘器出货龙头，向自主品牌转型，首予“买入”评级,智通财经
515,2021-06-17,2021定增半年度特别报告：三成企业无法足额募资，实募最多缩水超八成,Wind
516,2021-06-16,定增半年度报告：发行难度增加，三成企业无法足额募资,Wind
517,2021-06-16,景气回升，2021年油服迎业绩拐点,Wind
518,2021-06-16,从百亿缩至28亿！浙商证券定增额不及预期三成 亮眼业绩藏隐忧 盈利能力下降,投资时报
519,2021-06-16,写在首批REITs上市之前: 网下询价与公众认购行为，共识之外差异仍存,辰奥临君
520,2021-06-15,券商密集看多，科技股逆市上涨，成长股中长期布局黄金期到来？,21世纪经济报道
521,2021-06-15,【行情】A股证券板块持续走弱，湘财股份跌超5%，浙商证券、西南证券、财通证券跟跌,金十数据
522,2021-06-15,十大券商：科创板牛市已来！市场震荡蓄力之后将是再次拉升,Wind
523,2021-06-15,陆家嘴财经早餐2021年6月15日星期二,Wind
524,2021-06-14,浙商证券“股道行”走进湖南系列一圆满举行！,浙商证券研究所
525,2021-06-14,一年卖3.66亿只粽子，五芳斋端午前冲刺A股IPO,Wind
526,2021-06-11,板块异动丨底部区域拐点将至 券商板块再度上扬,智通财经
527,2021-06-11,浙商证券：八部委开展非法医美专项整治，利好行业长久发展,智通财经
528,2021-06-11,浙商证券：服装跨境现象级玩家SHEIN，产品、供应链、营销共同打造核心竞争力,乐居财经
529,2021-06-10,这个行业“钱包”充裕，未来景气可期！,Wind
530,2021-06-10,8部委突然剑指A股最火赛道！万亿资产迎洗礼？,Wind
531,2021-06-10,浙商证券：航发动力（600893.SH）关联交易存款限额翻倍，公司营收有望大幅增长，维持“买入”评级,智通财经
532,2021-06-10,10倍牛股被大V举报，4000亿白酒新贵也遭质疑 诉讼纠纷,Wind
533,2021-06-10,浙商证券：粤高速A（000429.SZ）佛开南段改扩建后收费期延长，维持“增持”评级,智通财经
534,2021-06-09,财富管理时代，营业部增or减？多家券商密集新增分支机构，也有的缩减阵地，线下线下各有布局战略,财联社
535,2021-06-09,浙商证券(601878.SH)2021年度第二期短期融资券兑付完成,智通财经
536,2021-06-08,主力资金近18亿加仓光大证券，机构：券商股估值有望修复,第一财经
537,2021-06-08,浙商证券(601878.SH)：完成兑付本息15亿元短期融资券,格隆汇
538,2021-06-08,浙商证券发布公告 收到实控人延期解决同业竞争函告,北京商报
539,2021-06-08,什么信号？茅台五粮液大跌！825亿杠杆资金跑步入场,Wind
540,2021-06-08,解盘：资金小幅流出，上海自贸区、消费电子、物联网略涨,Wind
541,2021-06-08,光大证券回封涨停板，主力净流入约17亿元,Wind
542,2021-06-08,奇葩！二季度都快过完了 浙商证券邱冠华还给常熟银行发一季度研报,新浪
543,2021-06-08,首批公募REITs投资者配置偏好差异不小,Wind
544,2021-06-07,招商基金李佳存新基发售 在手1只产品近期业绩不佳排名“靠后” 盈利能力下降,证券之星
545,2021-06-07,解决同业竞争问题存难度 浙商证券实控人再度延长承诺履行期限一年,北京商报
546,2021-06-07,浙江沪杭甬：浙商证券推选金雪军担任独立董事,乐居财经
547,2021-06-07,浙江沪杭甬(00576.HK)：浙商证券提名金雪军为独立董事候选人,格隆汇
548,2021-06-07,2021券商医药行业动态（第23周）,Wind
549,2021-06-07,浙商证券(601878.SH)推选金雪军担任独立董事,智通财经
550,2021-06-07,A股融资融券日报：两融余额减少27.87亿元（6月4日）,Wind
551,2021-06-07,券商定增融资陷缩水困局 同行捧场认购成主流,中国基金报
552,2021-06-05,近期券商研报力推这些股票，最高有144%上涨空间,Wind
553,2021-06-03,券商定增出现缩水困局，行情卷土重来或带来定增良机,第一财经
554,2021-06-03,超千亿资金认购首批公募基础设施REITs,上证报
555,2021-06-02,浙商证券：山西汾酒（600809.SH）清香白酒龙头，首予“买入”评级,智通财经
556,2021-06-02,浙商证券：传音控股（688036.SH）新兴市场国家最优秀手机终端品牌厂商，维持“买入”评级,智通财经
557,2021-06-02,浙商证券：中国铁建（601186.SH）基建“国家队”转型投资运营商，首予“增持”评级,智通财经
558,2021-05-31,上交所首批公募REITs正式开售，十问十答了解该不该投？如何投？,搜狐
559,2021-05-31,热点全面引爆！科创50领涨，创业板首家万亿市值公司诞生,Wind
560,2021-05-31,800亿巨头爆雷，一字跌停！科创板涨3%，锂电股掀涨停潮,Wind
561,2021-05-31,7家券商定增缩水 部分投资人陷浮亏,国际金融报
562,2021-05-28,【中证协优秀课题】境外市场风险对我国资本市场的外溢影响研究,中证协发布
563,2021-05-28,信用研究 | 基础设施公募REITs中国化之路启程,齐晟太子看债
564,2021-05-27,【华泰固收|信用】首批公募REITs发行看点全解析,华泰固收强债论坛
565,2021-05-27,股价“过山车”：投资者偏谨慎 这7家券商定增会缩水吗,新浪
566,2021-05-27,公募REITs彻底火了！募集314亿，平均有效认购超7倍！,Wind
567,2021-05-27,又一券商大动作增资，百亿量级注册资本券商增至8家，重资本业务拼资本实力，近一年12家券商增资近200亿,财联社
568,2021-05-27,首批公募REITS发售跟踪：认购超预期 募集期缩短,新浪
569,2021-05-27,首批公募REITs5月31日开售，最高13.38元/份,Wind
570,2021-05-27,首批公募REITs5月31日开售，最高13.38元/份,澎湃新闻
571,2021-05-27,苹果或于6月推出首款VR眼镜，浙商证券预计主流品牌将突破千万量级,巨丰财经
572,2021-05-26,首批6只公募REITs发行价出炉：全部实现超额认购；最高有效报价认购倍数达11.13倍！,每日经济新闻
573,2021-05-26,首批7只公募REITs项目确定发行价 最高定价为13.38元/份,北京商报
574,2021-05-26,A股收盘综述：上证指数涨0.34%，创业板指跌0.95%,Wind
575,2021-05-26,金融报道｜ “询价、限量、分红、流动性”公募REITs的关键词,财经网
576,2021-05-26,电鳗快报|浙商证券定增现波折：首轮认购金额不足募资总额四成,电鳗快报
577,2021-05-26,半年报业绩行情前瞻：近六成公司预喜百余家净利翻番，机构扎堆调研,Wind
578,2021-05-26,券商再迎爆发时刻，机构看好板块估值修复,Wind
579,2021-05-26,公募REITs火速推进首批项目陆续公布询价结果,Wind
580,2021-05-26,浙商证券沪杭甬杭徽高速封闭式基础设施证券投资基金基金份额发售公告,证券时报
581,2021-05-25,定增市场周报：竞价募足率环比下滑 本周解禁六成浮动破发 解禁,新浪
582,2021-05-25,浙商证券：控股股东上三高速派出的董事骆鉴湖辞职 董监高成员变化,中证网
583,2021-05-25,浙商证券：公司董事辞职 董监高成员变化,Wind
584,2021-05-25,“猪茅”大跌“油茅”大涨，核心资产分化或将持续,Wind
585,2021-05-24,造纸板块崛起，北向资金大举加仓股揭秘（附名单）,Wind
586,2021-05-24,频现股权出售拍卖，民营银行迎加速洗牌期 资产异常,ZAKER
587,2021-05-24,百亿定增预案实际募资不足三成，浙商证券遭遇定增“滑铁卢”,环球老虎财经
588,2021-05-22,爆满！浙商证券-长沙银行资本市场湘江峰会圆满落幕！,浙商证券研究所
589,2021-05-22,发行期恰逢券商板块调整 浙商证券百亿定增缩水至28亿元,上证报
590,2021-05-21,"晚间公告热点追踪：昔日""跨境电商龙头""*ST跨境股东拟被动减持3%",新浪
591,2021-05-21,百亿定增缩水 浙商证券定增实际募集金额约28亿元,北京商报
592,2021-05-21,公告精选：何享健拟不低于8亿元增持美的集团；金磊减持长春高新近2%股份,e公司
593,2021-05-21,浙商证券百亿定增大缩水至28亿、是否与前期股价下滑有关?公司回应,财联社
594,2021-05-21,5月21日晚间沪深上市公司重大事项公告最新快递,中金在线
595,2021-05-21,【公告抢先看】晚间重要公告：飞亚达设立全资子公司把握免税市场机会、北汽蓝谷定增事项宁德时代获配3亿元,金融界
596,2021-05-21,浙商证券定增结果出炉 募集资金总额约28.05亿元,中证网
597,2021-05-21,浙江沪杭甬(00576)：浙商证券完成发行约2.64亿股A股 净筹约28.01亿元,智通财经
598,2021-05-21,浙江沪杭甬(00576.HK):浙商证券股东上三高速持股比例降至54.79%,格隆汇
599,2021-05-21,浙商证券：非公开发行新增股份约2.64亿股,每日经济新闻
600,2021-05-21,时代出版：1亿元参与认购浙商证券非公开发行股份,e公司
601,2021-05-21,A股融资融券日报：两融余额增加9.63亿元（5月20日）,Wind
602,2021-05-21,以文化建设为中心开启二次创业征程,中证报
603,2021-05-20,湖南“破零倍增”计划驱动更多湘企上市 医药生物等领域上市公司数量较多,Wind
604,2021-05-20,追高壕买5200多万，这家公司一纸公告5个涨停,Wind
605,2021-05-19,5月31日上交所首批公募REITs正式开售，十问十答了解该不该投？如何投？,财联社
606,2021-05-19,长沙千亿市值公司仅次北上广深！资本市场湘江峰会今日开幕,ZAKER
607,2021-05-19,5月24日询价，上交所首批5只公募REITs项目询价区间出炉,Wind
608,2021-05-19,重磅信号！资金正加速进场，2大板块成为买入目标,Wind
609,2021-05-19,融资余额六连增，杠杆资金加仓疫苗股汽车股,Wind
610,2021-05-18,融资客青睐7股，江苏舜天买入占比高达41.09%,Wind
611,2021-05-18,A股融资融券日报：两融余额增加66.37亿元（5月17日）,Wind
612,2021-05-17,A股收盘综述：上证指数收复3500点，创业板指创近3个月新高,Wind
613,2021-05-17,浙商证券涨7.01%报13.13元，换手率5.72%,中新经纬
614,2021-05-17,券商股尾盘发力，华创阳安直线封板,Wind
615,2021-05-17,解盘：抱团股突起，资金连续流入，半导体、医疗、高价股领涨,Wind
616,2021-05-17,券商股早盘分化，湘财股份一字涨停，浙商证券涨超3%，天风证券、中泰证券、太,新浪
617,2021-05-17,券商股大幅分化,Wind
618,2021-05-17,A股融资融券日报：两融余额增加42.69亿元（5月14日）,Wind
619,2021-05-17,A股早报2021年5月17日星期一,Wind
620,2021-05-14,涨停复盘 | 全面普涨！券商股掀涨停潮,第一财经
621,2021-05-14,涨停板解密：估值修复，券商股掀涨停潮！（5月14日）,Wind
622,2021-05-14,首批5单基础设施公募REITs项目获上交所审核通过,Wind
623,2021-05-14,券商板块大涨7%北上资金抢筹90亿，牛市来了？,Wind
624,2021-05-14,券商分公司老总竟在酒店兼职，罚单来了！,中国财富网
625,2021-05-14,A股收盘综述：上证指数涨1.78%剑指3500点，券商罕见涨停潮,Wind
626,2021-05-14,东方财富涨超10%，券商股持续井喷板块涨超5.8%,Wind
627,2021-05-14,最新追查，2确诊病例省外详细轨迹公布！医药股飙升,Wind
628,2021-05-14,“牛市旗手”突然启动？创业板指大涨2%,Wind
629,2021-05-14,监管出手，黑色系集体闪崩！2000亿龙头冲涨停,Wind
630,2021-05-14,经纪业务走量不可持续,证券市场周刊
631,2021-05-14,券商股盘中大幅拉升，浙商证券等多股涨停，机构指出三条投资主线,金融界
632,2021-05-14,A股午盘综述：上证指数涨1.21%，券商、大消费造好,Wind
633,2021-05-14,【异动股】券商概念板块拉升，浙商证券(601878.CN)涨10.04%,财华社
634,2021-05-14,券商板块再当旗手：浙商证券等3股涨停，现阶段能否逐步买入？,第一财经
635,2021-05-14,券商股涨势如潮，浙商证券封板,Wind
636,2021-05-14,券商股涨幅进一步扩大 浙商证券、湘财股份涨停,e公司
637,2021-05-14,浙商证券（601878.SH）首板,Wind
638,2021-05-14,证券板块集体走强,Wind
639,2021-05-14,券商股持续走强，湘财股份率先封板,Wind
640,2021-05-14,券商股走强 浙商证券涨超5%,e公司
641,2021-05-14,券商股发力，浙商证券大涨6%,Wind
642,2021-05-14,券商板块走强 浙商证券、东方财富涨逾3%,中证网
643,2021-05-13,浙商证券(601878.SH)完成发行15亿元2021年度第四期短期融资券,智通财经
644,2021-05-13,浙商证券(601878.SH)完成发行2021年度第四期短期融资券,格隆汇
645,2021-05-12,申万宏源、浙商证券分公司负责人在外兼职被罚 金融监管处罚,资本邦
646,2021-05-12,非银金融行业周报：收入普增 业绩驱动因素分化,新浪
647,2021-05-12,浙商证券重庆分公司负责人兼职酒店经理挣外快被罚 金融监管处罚,中证网
648,2021-05-12,惊了！券商分公司老总竟兼职酒店经理挣外快，监管出手了！,中国基金报
649,2021-05-11,北向资金创一个半月最大净卖出，京东方A、通威股份净卖出超6亿元,Wind
650,2021-05-11,茅台盘中暴拉超1000亿，白酒股涨势领先,中国基金报
651,2021-05-11,浙商证券大涨7.4% 成交额48269万元,中新经纬
652,2021-05-11,快讯：券商股午后短线拉升 国联证券、浙商证券涨逾6%,新浪
653,2021-05-11,【行情】证券板块短线拉升，财达证券、华创阳安此前涨停，浙商证券涨超6%，国联证券、湘财股份跟涨,金十数据
654,2021-05-11,【行情】券商股异动拉升，华创阳安大涨6%，国联证券、第一创业、湘财股份、浙商证券等纷纷跟涨,金十数据
655,2021-05-11,券商股异动攀升，华创阳安大涨6%,Wind
656,2021-05-11,北向资金动向盘点：周期类，独甩煤炭,Wind
657,2021-05-10,【行情】证券板块持续走弱，兴业证券此前跌停，锦龙股份跌超6%，湘财股份、中金公司、浙商证券跟跌 连续下跌,金十数据
658,2021-05-10,大幕开启！万亿公募新市场来了，看最新、最全解读,Wind
659,2021-05-08,数钱数到手抽筋：券商“卖产品”卖出7万亿大市场！“财富管理转型”之路由此开启？,每经头条
660,2021-05-07,3张图一览今年公司发债融资情况！成本已上升，发行是否会收缩？,Wind
661,2021-05-07,券商行业周报：一季报业绩显着提升 头部券商表现亮眼,新浪
662,2021-05-06,五一快递爆棚！政策拐点已现，A股迎来布局时机？,Wind
663,2021-05-06,【十大券商一周策略】5月是布局下半年行情最佳窗口,Wind
664,2021-05-06,陆家嘴财经早餐2021年5月6日星期四,Wind
665,2021-05-03,"82亿融资落地，5家券商""抱团""捧场天风证券",Wind
666,2021-05-03,牛市旗手的盛宴要来？券业两大利好预期仍在酝酿,Wind
667,2021-05-01,浙商证券：非金融A股ROE回升至近两年新高,Wind
668,2021-05-01,又一家充电宝企业要上市！港交所将迎共享充电宝第一股？曾拟冲刺A股IPO,证券之星
669,2021-05-01,这一决定性板块又亮了：4月券商金股平均涨幅创年内新高，7大组合年内累计收益超10%！,每日经济新闻
670,2021-04-30,因旗下分公司负责人违规在多家营利性机构兼职 浙商证券受罚 金融监管处罚,北京商报
671,2021-04-30,浙商证券分公司负责人陈健存在在其他营利性机构兼职的行为 浙商证券及陈健收警示函 金融监管处罚,新浪
672,2021-04-30,赚翻了！券商一季报出炉，“一哥”狂赚51亿,Wind
673,2021-04-30,仍处高增长！上市券商首季业绩排名出炉，中信国君海通营收超百亿，东财净利位居第九，各业务排名有看点,证券之星
674,2021-04-30,浙商证券：焦点科技（002315.SZ）业绩高增，维持“买入”评级,智通财经
675,2021-04-30,申通一季度大幅亏损 快递江湖价格战未休 亏损,财经网
676,2021-04-29,牛市旗手彻底爆发！啥情况？3家券商首季营收超百亿,Wind
677,2021-04-29,张坤、刘彦春还爱吗？茅台罕见失速，1日跌600亿,Wind
678,2021-04-29,券业科技投入大比拼！华泰18亿居榜首，招商大增52%,Wind
679,2021-04-29,浙商证券：2021年第一季度净利润约4.21亿元，同比增加31.88%,每日经济新闻
680,2021-04-28,浙商证券：聘周文超为旗下2只基金基金经理,和讯
681,2021-04-28,浙商证券(601878.SH)向专业投资者公开发行公司债券获证监会注册批复,智通财经
682,2021-04-28,浙商证券(601878.SH)一季度归母净利同比增长32%至4.21亿元,智通财经
683,2021-04-28,浙商证券：一季度净利润4.21亿元同比增长32%,格隆汇
684,2021-04-28,浙商证券(601878.SH)一季度净利润升31.88%至4.21亿元,格隆汇
685,2021-04-28,浙商证券：一季度净利润同比增长31.88%,Wind
686,2021-04-28,A股融资融券日报：两融余额减少23.65亿元（4月27日）,Wind
687,2021-04-27,浙商证券：首予阜博集团(03738)“买入”评级 受益海外DTC及国内短视频爆发趋势 业绩有望超预期,智通财经
688,2021-04-27,康华生物上市10个月股价涨5.48倍 王宝桐隐秘入股三年获利2.8亿,长江商报
689,2021-04-27,QFII一季度加码科创板品种,Wind
690,2021-04-26,非银金融行业周报：并购题材有望带领券商板块反弹,新浪
691,2021-04-26,A股融资融券日报：两融余额减少29.83亿元（4月23日）,Wind
692,2021-04-25,权益产品清盘数大增；首批两单公募REITs项目申报获受理；下周将有12只基金发行 基金清算,和讯
693,2021-04-25,下周将有12只基金发行：偏股混合型基金共有4只,理财不二牛
694,2021-04-24,浙商证券：基金一季度整体仓位下降加仓银行和化工,证券之星
695,2021-04-24,券商投行排名不看三中一华，改看三中两沪，TOP5投行收入占行业近一半，行业集中度高企，中信建投IPO完胜,证券之星
696,2021-04-24,全球货币政策有异：发达国家宽松不改、新兴市场加息,Wind
697,2021-04-23,最快6月上中旬上市，万亿投资新品即将面世,Wind
698,2021-04-23,上交所正式受理首批2单基础设施公募REITs项目申报,Wind
699,2021-04-23,A股融资融券日报：两融余额增加33.53亿元（4月22日）,Wind
700,2021-04-21,事关万亿市场！基础设施公募REITs首批申报项目来了,Wind
701,2021-04-21,首批项目出炉，交易所正式接收基础设施公募REITs申报,Wind
702,2021-04-21,券商发力场外业务这一年！新增规模逼近5万亿，头部券商大施拳脚，收益互换大爆发，华泰中信申万宏源居前三,财联社
703,2021-04-21,晨鸣纸业（01812）：股价爆涨1倍的Q1,智通财经
704,2021-04-21,各地重大项目赶工忙，基建投资上演“加速度”,Wind
705,2021-04-20,港股异动︱李宁(02331)涨超5% 浙商证券称其一季度流水超预期并维持“买入”评级,智通财经
706,2021-04-20,A股融资融券日报：两融余额增加83.5亿元（4月19日）,Wind
707,2021-04-20,券商“联姻”：大势所趋更是“大浪淘沙”,Wind
708,2021-04-20,增量资金集结造势，谁是基金新宠,Wind
709,2021-04-19,十大券商一周策略：潜在入市基金规模超1.1万亿,Wind
710,2021-04-16,华西证券--浙商证券：年度季度利润高增，100亿定增在途【公司研究】,金融界股吧
711,2021-04-16,6家券商披露一季报预告：第一创业投资失利 长江、浙商大赚,第一财经
712,2021-04-16,一季度上市券商业绩表现两极分化第一创业预降94%长江证券盈利7亿 盈利能力下降,长江商报
713,2021-04-16,【十大券商一周策略】吃饭行情正在酝酿，基金仓位明显下降,同壁财经
714,2021-04-16,行情颠簸券商一季度业绩分化，投资成“胜负手”,Wind
715,2021-04-15,上市券商一季报业绩抢先看 分化明显、归母净利润增幅涨跌不一,北京商报
716,2021-04-15,浙商证券：徐工机械（000425.SZ）Q1业绩超预期，维持“买入”评级,智通财经
717,2021-04-15,A股融资融券日报：两融余额增加21.59亿元（4月14日）,Wind
718,2021-04-14,上市券商一季度业绩分化大：浙商、长江迎“开门红”，这家券商却业绩下降94%！ 盈利能力下降,每日经济新闻
719,2021-04-14,港股异动|浙江沪杭甬(0576.HK)涨超4%子公司浙商证券首季赚4.21亿,格隆汇
720,2021-04-14,券商首季“开门红”！浙商证券净利预增三成，还有券商被预测增速超200%,资本邦
721,2021-04-14,A股融资融券日报：两融余额减少50.61亿元（4月13日）,Wind
722,2021-04-13,A股融资融券日报：两融余额减少31.16亿元（4月12日）,Wind
723,2021-04-13,港股公告精选：阿里巴巴称蚂蚁集团完成整改方案研究和制定工作，金融业务全部纳入监管,Wind
724,2021-04-12,晚间重要公告2021年4月12日星期一,Wind
725,2021-04-12,浙江沪杭甬(00576)：浙商证券一季度净利润同比增31.88%至4.21亿元,智通财经
726,2021-04-12,浙商证券(601878.SH)业绩快报：一季度净利升31.88%至4.21亿元,格隆汇
727,2021-04-12,浙商证券：一季度净利润同比增长31.88%（业绩快报）,Wind
728,2021-04-12,【行情】券商板块短线走低，浙商证券跌超5%，国联证券、中信建投、华鑫股份、中金公司跟跌,金十数据
729,2021-04-12,A股融资融券日报：两融余额减少32.23亿元（4月9日）,Wind
730,2021-04-12,浙商证券发布一季度业绩快报 归母净利润4.21亿元、同比增31.88%,北京商报
731,2021-04-11,【国君非银】手续费和资本业务共振，业绩大幅提升——2020年券商行业年报业绩综述,欣琦看金融
732,2021-04-11,25家券商去年信用减值损失逼近300亿，同比暴增！,Wind
733,2021-04-09,浙商证券关于网络引用“邱冠华”观点的声明,浙商证券研究所
734,2021-04-09,证券行业2020年报总结：集中度略降 大券商ROE、杠杆率齐升,新浪
735,2021-04-08,贴着半导体标签的诺安成长 竟然交易了这么多券商股,上证报
736,2021-04-08,浙商证券：厦门象屿（600057.SH）2020年归母净利润同比稳增18%，维持“买入”评级,智通财经
737,2021-04-08,5家券商净利超百亿 券商龙头股有哪些股票？,至诚财经
738,2021-04-08,前十券商贡献行业七成营收，人均创收最高387万,Wind
739,2021-04-07,沧海横流！头部券商集体卧倒，6家券商股价逆势上涨，如此抗跌底气何在？,21世纪经济报道
740,2021-04-02,“尾佣”激增百亿元，基金公司“赚了吆喝”没拿到好处,Wind
741,2021-04-02,爆表“研值”已成券商核心竞争力，4家券商“基金分仓”佣金同比增超900%,Wind
742,2021-04-02,公募基金风生水起，券商分仓佣金水涨船高,Wind
743,2021-04-01,金融业薪酬大比拼：去券商做打工人，去保险做高管,Wind
744,2021-04-01,机构资金抢筹，ETF份额放量，这个板块近期默默复苏,Wind
745,2021-04-01,36家券商公布年报，5家净利超百亿，除了头部都是腰部？,财经网
746,2021-04-01,市场震荡加剧券商挖掘金股忙,Wind
747,2021-03-31,券商界演绎马太效应：输在起跑线上的中小券商如何求生？,GPLP犀牛财经
748,2021-03-31,人均年薪超100万，碾压腾讯！中金又亮了,Wind
