513,2021-06-09,*ST聚龙(300202.SZ)：子公司诉浙商银行沈阳分行合同纠纷一案已立案受理 关联方问题,格隆汇
514,2021-06-09,晚间重要公告2021年6月9日星期三,Wind
515,2021-06-09,独家｜“一正六副”或变“一正五副”浙商银行高管团队变阵,财联社
516,2021-06-09,一正两副行长集体辞职的浙商银行：业绩增速放缓，不良率三连升 董监高成员变化,新浪
517,2021-06-09,*ST聚龙：收到案件受理通知书,Wind
518,2021-06-09,浙商银行换届高管架构初定，经营班子或迎两位“79年”年轻干部,Wind
519,2021-06-09,浙商银行换届高管架构初定 经营班子或迎两位“79年”年轻干部,上证报
520,2021-06-09,独家电报｜消息人士：浙商银行原副行长张荣森将升任行长,财联社
521,2021-06-09,护送这家银行回A的高管开始更替，“一正两副”齐辞职，他们曾降薪百万 董监高成员变化,时代财经
522,2021-06-09,这家银行“一正两副”三名行长集体辞职！ 董监高成员变化,丁丁创e
523,2021-06-09,什么情况？这家2万亿银行“一正两副”行长辞职 年轻干部将被提拔 董监高成员变化,北京商报
524,2021-06-09,2万亿股份行迎“新老交棒”，浙商银行副行长张荣森拟接任行长！,环球老虎财经
525,2021-06-09,张荣森或接棒行长，浙商银行高管团队趋于年轻化,环球老虎财经
526,2021-06-09,银行行业周报：理财净值波动持续分化,新浪
527,2021-06-09,浙江银行换帅！原副行长张荣森代履行长职务 董监高成员变化,国际金融报
528,2021-06-09,新老交棒 2万亿浙商银行将迎回A后新一轮换届 原行长徐仁艳退任 52岁张荣森接任,券商中国
529,2021-06-08,新老更迭，战略稳定——评浙商银行行长更替 董监高成员变化,中金在线
530,2021-06-08,评浙商银行行长更替：新老更迭 战略稳定 董监高成员变化,--
531,2021-06-08,浙商银行迎新一轮高管换届 老将徐仁艳辞任行长职务 董监高成员变化,新浪
532,2021-06-08,张荣森代为履行浙商银行行长职务,中国金融新闻网
533,2021-06-08,浙商银行换届：一行两副辞职，高管团队年轻化,21世纪经济报道
534,2021-06-08,浙商银行行长与两副行长辞任，53岁张荣森代为履行行长职务 董监高成员变化,澎湃新闻
535,2021-06-08,评浙商银行行长更替：新老更迭 战略稳定,雪球
536,2021-06-08,浙商银行高管层换届：“一正两副”三位行长辞职，副行长张荣森代履行长职务 董监高成员变化,搜狐
537,2021-06-08,徐蔓萱及刘贵山辞任浙商银行(02016)副行长职务 董监高成员变化,智通财经
538,2021-06-08,浙商银行：徐蔓萱、刘贵山辞去副行长等职务 董监高成员变化,Wind
539,2021-06-08,浙商银行行长、副行长辞职 迎新一轮高管换届 董监高成员变化,证券之星
540,2021-06-08,徐仁艳辞任浙商银行(02016)执行董事 董监高成员变化,智通财经
541,2021-06-08,浙商银行(02016.HK)：徐仁艳辞任执行董事及行长职务 董监高成员变化,格隆汇
542,2021-06-08,浙商银行：徐仁艳辞去执行董事及行长职务 董监高成员变化,Wind
543,2021-06-08,浙江银行行长“新老交棒”，52岁张荣森接棒，“一正六副”将如何变阵？,证券时报网
544,2021-06-08,电报|浙商银行回应高管换届：系正常的工作调整不会对公司经营造成重大影响 董监高成员变化,财联社
545,2021-06-08,浙商银行：浙商银行股份有限公司关于副行长辞职的公告,新浪
546,2021-06-08,浙商银行：浙商银行股份有限公司关于执行董事及行长辞职的公告,新浪
547,2021-06-08,浙商银行(601916.SH)：徐仁艳辞任执行董事及行长等职务 董监高成员变化,智通财经
548,2021-06-08,浙商银行(601916.SH)：徐蔓萱及刘贵山辞任副行长职务 董监高成员变化,智通财经
549,2021-06-08,浙商银行行长徐仁艳辞职 53岁副行长张荣森代为履职 董监高成员变化,证券时报网
550,2021-06-08,浙商银行：执行董事及行长徐仁艳辞职 董监高成员变化,Wind
551,2021-06-08,浙商银行：副行长徐蔓萱、刘贵山辞职 董监高成员变化,每日经济新闻
552,2021-06-08,强化风险意识 防范电信诈骗——浙商银行北京分行2021年普及金融知识宣教进社区,中国网
553,2021-06-07,多家上市银行“破净”触发稳定股价措施,Wind
554,2021-06-07,破净率逼近八成，上市银行股东频增持,Wind
555,2021-06-05,增持进行时！多家上市银行触发稳定股价措施启动条件,Wind
556,2021-06-04,绿色足迹 | 股份行的绿色“成绩单”,和讯
557,2021-06-04,总资产破2万亿的浙商银行换帅 张荣森或接棒徐仁艳晋升行长,新浪
558,2021-06-04,4900亿银行股现金分红来了：大部分股息率高于4%，3家分红比率下降,21世纪经济报道
559,2021-06-01,G60科创走廊又有新动作：推动产融结合示范园建设，即将发行上证G60综指增强型基金,Wind
560,2021-05-28,凭证类CRM信息披露,银行间市场协会
561,2021-05-28,晚间重要公告2021年5月28日星期五,Wind
562,2021-05-28,浙商银行：要求判令河南省国有资产控股运营集团等偿还借款本金13亿元及利息罚息等 金融监管处罚,Wind
563,2021-05-28,浙商银行(02016)就金融借款合同纠纷向法院递交起诉状 诉讼纠纷,智通财经
564,2021-05-28,港股异动 | 内银股持续走高 浙商银行(02016)涨超8% 邮储银行(01658)涨近5%,智通财经
565,2021-05-28,快讯：内银股集体走高 浙商银行涨近9%邮储银行涨近5%,新浪
566,2021-05-28,【行情】港股银行板块持续走高，浙商银行涨8.7%，邮储银行涨超5%，汇丰控股涨3.6%，恒生银行涨3%，招商银行、渣打集团、建设银行均涨近2%,金十数据
567,2021-05-28,【异动股】浙商银行(02016.HK)涨10.67%,财华社
568,2021-05-27,省农信五位高层入驻 温州银行完成“大换血”,券商中国
569,2021-05-27,哪些行业不良贷款率高？,岳读债市
570,2021-05-26,*ST金刚：新增与江苏恒源诉讼案件 诉讼纠纷,Wind
571,2021-05-26,正泰电器：控股子公司对外担保,Wind
572,2021-05-26,津膜科技：拟向浙商银行天津分行申请人民币1.1亿元融资授信,发布易
573,2021-05-26,报警、账户管控及时！浙商银行宁波镇海支行堵截一起电信网络诈骗案件 欺诈造假,中国经济网
574,2021-05-25,浙商银行：董事会临时会议通过《2021-2025 年发展规划》等三项议案,Wind
575,2021-05-25,首家大行“维稳”！邮储银行触发股价稳定条件，大股东增持！仍有八成银行破净,证券时报
576,2021-05-25,“地王”制造者龙光和它的金主们,华尔街见闻
577,2021-05-24,保利置业：获浙商银行提供一年期1亿美元或等值港元的循环贷款,资本邦
578,2021-05-24,银行贷款余额哪家强？平安信用卡竟然超过房贷,新浪
579,2021-05-24,浙商银行西安分行：产业链金融支持养猪产业发展,中国金融新闻网
580,2021-05-22,银行理财周报：理财收益率下降 六大行降幅较大,新浪
581,2021-05-21,12家全国性股份行到底哪家强？,新浪
582,2021-05-21,识破“李鬼”诈骗 浙商银行上海普陀支行为客户保住十余万元,中国金融新闻网
583,2021-05-21,银行行业周报：理财净值波动分化,新浪
584,2021-05-20,创新供应链金融业务模式，精准赋能华为 企业网生态圈 ——浙商银行深圳分行受邀出席华为中国生态大会2021,南都网
585,2021-05-19,制造业保卫战已打响 股份行支持制造业谁最卖力？,和讯
586,2021-05-19,股份行支持制造业大比拼：谁在冲刺？谁在赶超？,新浪
587,2021-05-19,民生银行15位高管斥资千万买自家股票，所为何因？,Wind
588,2021-05-18,银行业一季报透视：地方性银行4家实现净利润增长六大行发展存分化,GPLP犀牛财经
589,2021-05-18,山西国资运营公司与浙商银行总行举行工作会谈,Wind
590,2021-05-18,金融护航 助力外贸实现逆势增长、稳健运行,经济日报
591,2021-05-17,六大行投入金融科技近千亿，区块链加码下供应链金融能走多远？,21世纪经济报道
592,2021-05-16,金融助力外贸企业“乘风破浪”,经济日报
593,2021-05-14,中小银行逐鹿基金江湖：浦发民生领跑 中信平安紧跟,新浪
594,2021-05-13,A股上市股份行首季净利增速排名：平安招行兴业领先,中国经济网
595,2021-05-13,多家中小行一季度营收出现负增长，投资收益成拖累，3家大降95%,Wind
596,2021-05-13,一季度投资收益挺不住，多家中小银行营收露“负”,Wind
597,2021-05-10,同业存单周报：同业存单发行规模逐渐下降,新浪
598,2021-05-10,五年期年利率3.97%，四家银行试水手机购买国债,Wind
599,2021-05-07,今天股市行情最新消息 今日股市新闻（5月7日）,至诚财经
600,2021-05-07,逆市下跌！西安银行跌破“生命线” 什么情况？稳定股价措施已启动,券商中国
601,2021-05-06,去年A股公司营收占GDP总额52%，顺周期板块逆袭,Wind
602,2021-05-06,关于鹏华产业精选灵活配置混合型证券投资基金参与中国建设银行股份有限公司定期定额申购费率优惠活动的公告,中证报
603,2021-05-05,全部54家上市银行2020年指标排名大全,搜狐
604,2021-05-02,通胀是青春痘，通缩是老年斑,搜狐
605,2021-05-02,陆家嘴财经早餐2021年5月2日星期日,Wind
606,2021-05-01,上市股份行十年业绩分化：谁在沉沦，谁在突进 盈利能力下降,Wind
607,2021-04-30,21金融研究丨银行一季报全景：银行业绩全线分化，8家收入下降 盈利能力下降,21世纪经济报道
608,2021-04-30,*ST金刚：目前共涉及84项诉讼/仲裁案件，案件金额合计约57.7亿元 诉讼纠纷,Wind
609,2021-04-30,A股上市股份行一季度比拼：平安、招行、兴业净利增速排前三,澎湃新闻
610,2021-04-30,26家A股上市银行业绩成绩单：多数实现净利润稳健增长，资产质量风险整体可控,资本邦
611,2021-04-30,9家上市股份制银行日赚超15亿！“零售之王”招商银行稳居宝座，光大银行资产增速最快,金融界
612,2021-04-30,南方基金管理股份有限公司,证券时报
613,2021-04-29,浙商银行一季度营收降3.4%净利增1%，不良率1.53%,澎湃新闻
614,2021-04-29,浙商银行：一季度净利润同比增长1.06%,Wind
615,2021-04-29,浙商银行(02016)一季度归母净利润同比增长1.06%至45.76亿元,智通财经
616,2021-04-29,浙商银行今年一季度实现净利润45.76亿元 同比增长1.06%,上证报
617,2021-04-29,浙商银行(02016.HK)一季度净利润45.76亿元同比增加1.06%,格隆汇
618,2021-04-29,浙商银行：第一季度净利润45.76亿元，同比增1.06%,Wind
619,2021-04-29,净利差、成本收入比持续优化 浙商银行2021年一季报发布,财经网
620,2021-04-29,中小银行转型提速两家科技子公司低调现身,中证报
621,2021-04-28,2020年股份制银行科技转型再提速：招行投入首破百亿 光大科研资金增速超50%,华夏时报
622,2021-04-28,14家手机银行APP仅8家开发适老化版本 语音输入“如何转账”这些APP傻傻分不清,南都报
623,2021-04-27,固定收益专题研究：松紧切换助力行业长足发展,新浪
624,2021-04-27,浙商银行(02016)就借款合同纠纷起诉汕头市宜东房地产及汕头市互汇智能科技等公司 涉及本息约17.88亿元 诉讼纠纷,智通财经
625,2021-04-27,浙商银行：深圳分行向宜东房地产、互汇智能、宜华企业等提起诉讼 诉讼纠纷,Wind
626,2021-04-27,浙商银行小微线上业务累计授信金额超1000亿元,中证网
627,2021-04-27,银行基本面跟踪三十：Q1持仓增幅显着 继续看好板块配置价值,新浪
628,2021-04-27,恒逸石化(000703)：保价惜售导致1Q21产销率下滑；短期利空或已基本消化,新浪
629,2021-04-27,浙农集团股份有限公司,中证报
630,2021-04-26,道道全：拟向浙商银行长沙分行申请2亿元授信额度,和讯
631,2021-04-23,银行行业：主动偏股基金的银行持仓分析：四大行持仓占比提升明显,新浪
632,2021-04-23,考核趋严票据被剔，银行普惠小微贷面临增长的“烦恼”,Wind
633,2021-04-22,河南银保监局：对河南中牟农商行作出行政处罚，罚款160万元 金融监管处罚,Wind
634,2021-04-22,河南中牟农商行被罚160万：购买浙商银行违规理财产品实现不良虚假出表 金融监管处罚,新浪
635,2021-04-22,因购买浙商银行违规理财产品实现不良虚假出表等行为 河南中牟农商行被罚160万元 欺诈造假,北京商报
636,2021-04-21,浙商银行涉嫌债券违规被调查 多名股东近60亿股份被质押 金融监管处罚,新浪
637,2021-04-20,*ST新光：全资子公司部分房产拍卖，总价款2569.5万元 关联方问题,Wind
638,2021-04-19,集中发力家族信托！12家私人银行业务数据曝光，各有什么打法？,信托百佬汇
639,2021-04-19,浙商银行(02016.HK)拟4月29日举行董事会会议审核一季度业绩,格隆汇
640,2021-04-19,浙商银行今日大宗交易成交452.65万股，成交价4.38元溢价9.23%,Wind
641,2021-04-19,2020年信用风险缓释工具市场研究报告,金融界
642,2021-04-17,卖基金比买基金更赚钱？银行与基金不止于“销售”,Wind
643,2021-04-15,2020年四季度股份行哪家投诉多？招行投诉量居首,新浪
644,2021-04-15,做好“加减乘除” 助力“六稳”“六保” 浙商银行服务小微企业质效再提升,浙商银行
645,2021-04-15,银保监会：2020年第四季度银行业消费投诉环比减少10.4%,Wind
646,2021-04-14,海外信用评级汇总2021年4月14日星期三,Wind
647,2021-04-14,穆迪：将浙商银行的评级列入上调观察名单,Wind
648,2021-04-14,零售金融周报(4.5日-4.11日)：百信银行宣布进军汽车金融；哈银消费金融2021年一季度营收超2.32亿元,零壹财经
649,2021-04-13,浙商银行贵阳分行：“双链”融合输血中小企业,中国金融新闻网
650,2021-04-13,开盘20%跌停！可能被“ST”，发生了什么？ 风险警示,证券之星
651,2021-04-13,创新服务模式 发挥供应链金融服务实体经济效能,中国金融新闻网
652,2021-04-13,小微金融浙商银行样本：增长与风险的平衡术,零壹财经
653,2021-04-12,8家上市银行房贷业务“踩红线”，建行、邮储银行均有一项指标踩线,Wind
654,2021-04-12,零壹上市公司周报(4.5日-4.11日)：嘉银金科并购区块链公司碧威科技；招商银行与京东数科获批新设合营企业,零壹财经
655,2021-04-12,8家上市银行房贷业务“踩红线”,Wind
656,2021-04-11,上市国股银行2020年财报深度解读：国有行股份行表现如何,澎湃新闻
657,2021-04-10,上市银行重金投入金融科技，工行建行首次突破200亿元,Wind
658,2021-04-09,金融圈高薪“鄙视链”：基金最高，券商年终奖扣税百万,Wind
659,2021-04-09,浙商银行不良上升势头未止，盈利能力承压|年报季,云掌财经
660,2021-04-09,年度报告说了啥？上市银行掌门人“擎画”未来,证券时报
661,2021-04-09,北京房贷利率“暂未上调”，部分银行无额度放款,Wind
662,2021-04-08,浙江广厦：持有的1.43亿股浙商银行股份被全部冻结 股权冻结,乐居财经
663,2021-04-08,浙江广厦(600052.SH)所持浙商银行股份冻结 股权冻结,格隆汇
664,2021-04-08,浙江广厦：所持浙商银行股份已被执行冻结及轮候冻结 股权冻结,Wind
665,2021-04-08,银行日报：国有六大行2020年业绩数据PK；非上市银行2020年“成绩”如何,中金在线
666,2021-04-08,服务升级让“夕阳红”更美——浙商银行北京分行积极做好老年客户服务工作,中国网
667,2021-04-07,在激进中迷失的浙商银行：净利下跌近5% 不良率连续三年上涨 盈利能力下降,新浪
668,2021-04-07,浙商银行涉重大违规遭调查2020年营收净利增长疲乏、资本充足率承压 金融监管处罚,经济观察报
669,2021-04-07,全市场科技产业策略报告第104期：从银行最新年报看银行IT市场的高增长,新浪
670,2021-04-07,银行业两千亿重金“砸向”金融科技 产业数字化成金融机构业务布局重点,财联社
671,2021-04-07,为申请不超过8000万元综合授信，华光源海拟以3艘自有船舶等质押,资本邦
672,2021-04-07,交易商协会启动对浙商银行自律调查 浙商回应：应是几年前承销项目,21世纪经济报道
673,2021-04-07,浙商银行(601916)：平台战略持续 对公实力强化,新浪
674,2021-04-07,犀牛财经早报：滴滴开启造车项目顺控发展停牌核查,GPLP犀牛财经
675,2021-04-07,信用负面跟踪20210406,新浪
676,2021-04-06,浙商银行回应被自律调查：应该是几年前承销的项目，将积极配合,Wind
677,2021-04-06,浙商银行回应被自律调查：应该是几年前承销的项目，将积极配合,澎湃新闻
678,2021-04-06,严重违规 浙商银行被启动自律调查,新浪
679,2021-04-06,【银行视点】西安银行为一客户计提4.75亿减值准备；开业仅5个月，四川银行1亿股股权将被拍卖！ 资产异常,金融界
680,2021-04-06,作为主承销商涉嫌虚假记载等违规，浙商银行被启动自律调查 欺诈造假,澎湃新闻
681,2021-04-06,消费行业周报：蒙牛携手爱养牛搭建线上学习平台助力牧民提高收入,新浪
682,2021-04-06,疫情大考后，银行业整体实现净利润正增长，有大行不良率悄然走高,Wind
683,2021-04-06,上市公司业绩和发债规模比一比，风险如何？4张图看清,Wind
684,2021-04-06,重磅！银行“打工人”薪资大曝光,中投网
685,2021-04-06,交易商协会对浙商银行启动自律调查,Wind
686,2021-04-06,浙商银行信用卡2020年实现消费额740.51亿元 业务收入13.44亿元,中国网
687,2021-04-06,险资提前调仓换股，究竟买了哪些股票？,Wind
688,2021-04-06,浙商银行总资产破2万亿贷款净额占57% 公司不良贷款年增30亿不良率升至1.86%,长江商报
689,2021-04-06,3家银行人均年薪超50万？却有银行降薪15%，银行还能去吗？,搜狐
690,2021-04-06,交易商协会对浙商银行启动自律调查,银行间市场协会
691,2021-04-05,银行“打工人”薪资曝光 4家银行人均薪酬超50万,中国基金报
692,2021-04-05,近230万银行人的薪酬“曝光”，创收能力也显露出来！,中国基金报
693,2021-04-05,"银行""打工人""薪资大曝光：平安57万，招行53万，中信、兴业大幅加薪了！",中国基金报
694,2021-04-05,陆家嘴财经早餐2021年4月5日星期一,Wind
695,2021-04-04,银行薪酬大曝光！3家银行人均年薪超50万元，这家人均降薪15%,Wind
696,2021-04-04,银行薪酬大曝光！3家银行人均年薪超50万元，这家人均降薪15%,中证报
697,2021-04-04,5家上市银行个人房贷超标，还有多家逼近红线,Wind
698,2021-04-02,十年上市银行排位赛 宁波银行净利润增幅超362%,上证报
699,2021-04-02,浙商银行归母净利降4.76%，因罚单被质疑以虚假出表掩盖不良贷款 盈利能力下降,中访网
700,2021-04-01,金融业薪酬大比拼：去券商做打工人，去保险做高管,Wind
701,2021-04-01,浙商银行16年来首现净利负增长 净息差弹性较大,财经网
702,2021-04-01,六银行同日披露年报：3家银行不良率攀升 农行涉诉金额达60亿 资产异常,科技新闻网
703,2021-04-01,息差收窄盈利承压，银行竞逐财富管理新赛道,Wind
704,2021-03-31,浙商银行回应不良上升：不良贷款基数小，较易受个别企业影响,第一财经
705,2021-03-31,拆解2万亿浙商银行：盈利疲软，激进扩张下埋雷 运营能力下降,北京商报
706,2021-03-31,浙商银行去年处置不良资产184.45亿元 副行长刘龙：去年核销率大幅提升至65%,证券时报网
707,2021-03-31,9大股份行业绩PK：招行净利赶超国有行，民生下滑近四成 盈利能力下降,21世纪经济报道
708,2021-03-31,[路演]浙商银行业绩说明会：公司业务结构持续调整 资产负债的结构更为优化,全景网
709,2021-03-31,[路演]浙商银行业绩说明会：零售业务快速增长 储蓄存款规模稳步提升,全景网
710,2021-03-31,[路演]浙商银行业绩说明会：平台化服务战略是银行业务与经营的重大创新,全景网
711,2021-03-31,银行日报：六大银行日赚31亿 银行板块有望再迎配置窗口期,中金在线
712,2021-03-30,浙商银行去年净利润下降4.76%，不良率微升至1.42% 盈利能力下降,澎湃新闻
713,2021-03-30,浙商银行发布2020年报：营收477.03亿元 同比增长2.89%,证券时报网
714,2021-03-30,浙商银行(02016)拟给予浙江能源集团及关联方最高综合授信额度50亿元,智通财经
715,2021-03-30,浙商银行(02016)拟续聘毕马威华振及毕马威香港,智通财经
716,2021-03-30,浙商银行(02016)拟每10股派发现金红利1.61元,智通财经
717,2021-03-30,蒙牛集团携手浙商银行创新银企合作模式 “浙+牛”乳业链平台正式启动助力奶业发展乡村振兴,中金在线
718,2021-03-30,浙商银行去年拨备前净利同比增长2.82% 拟现金分红30.1%,上证报
719,2021-03-30,浙商银行(601916.SH)2020年度净利润降4.76%至123.09亿元拟10派1.61元 盈利能力下降,格隆汇
720,2021-03-30,浙商银行(601916.SH)年度归母净利同比降4.76%至123.09亿元 拟10派1.61元 盈利能力下降,智通财经
721,2021-03-30,浙商银行(02016)年度归母净利同比降4.76%至123.09亿元 拟10股派1.61元 盈利能力下降,智通财经
722,2021-03-30,浙商银行(02016.HK)年度纯利下降4.76%至123.09亿元10派1.61元 盈利能力下降,格隆汇
723,2021-03-30,浙商银行：2020年净利润同比减少4.76% 盈利能力下降,Wind
724,2021-03-30,浙商银行牵手蒙牛集团为乳业链企业融资逾10亿元,证券时报网
725,2021-03-30,浙商银行与蒙牛集团达成战略合作 共打造乳业产业链服务平台,财联社
726,2021-03-30,浙商银行2020年归母净利润123.09亿元，比上年下降4.76% 盈利能力下降,北京商报
727,2021-03-29,关于换发《中华人民共和国金融许可证》的公告,搜狐
728,2021-03-26,关于以通讯方式召开前海开源中债3-5年,中证报
729,2021-03-25,资金违规流入房地产市场，多家银行被罚 金融监管处罚,Wind
730,2021-03-24,上海清算所首单同业授信担保品管理业务成功落地,Wind
731,2021-03-24,银行“顶风作案”，资金违规流向楼市被重罚,Wind
732,2021-03-24,银行业：消费贷款利率回升 对业绩影响几何？,新浪
733,2021-03-19,浙商银行台州分行被罚95万：发放用途不真实贷款 金融监管处罚,新浪
734,2021-03-19,“随借随还”破解融资痛点 银行推广亟待打通成本关,上证报
735,2021-03-18,浙商银行(02016.HK)3月30日举行董事会会议审批年度业绩,格隆汇
736,2021-03-17,浙商银行天津分行 用有温度的金融服务护航幸福晚年,中国金融新闻网
737,2021-03-17,中国短期融资券及中期票据信用分析周报,新浪
738,2021-03-17,浙商银行(02016.HK)：预计5亿美元票据3月17日前后上市,格隆汇
739,2021-03-16,浙商银行重庆分行：防范非法集资 护航幸福晚年,上游新闻
740,2021-03-12,亚太药业：控股股东所持公司部分股份将被司法拍卖 司法拍卖,Wind
741,2021-03-11,提升尝试做市机构做市能力的思考,搜狐
742,2021-03-10,泰达股份：为控股子公司泰达能源提供8800万元担保 大额借贷担保,Wind
743,2021-03-10,浙商银行重庆分行：开展国际劳动妇女节主题活动,上游新闻
744,2021-03-09,正元智慧(300645.SZ)拟为控股子公司提供担保 大额借贷担保,智通财经
745,2021-03-09,海外信用评级汇总2021年3月9日星期二,Wind
746,2021-03-09,【银行视点】消金机构频繁试水房抵贷，徽商银行获批百亿定增，存保基金成第一大股东！,金融界
747,2021-03-09,标普：予浙商银行(02016.HK)20亿美元中期票据计划“BBB-”长期发行评级,云掌财经
748,2021-03-09,浙商银行(02016.HK)香港分行拟发行3年期美元高级无抵押票据，初始指导价CT3+120bps区域,云掌财经
749,2021-03-09,标普：授予浙商银行20亿美元中期票据计划“A-3”短期及“BBB-”长期发行评级,Wind
750,2021-03-09,2月银行业罚单报告：共218张罚单，中信银行领16张,Wind
751,2021-03-08,解盘：抱团股续跌，稀土、次新、风力发电、环保略涨,Wind
752,2021-03-08,银行板块持续走高，南京银行涨超4%,Wind
753,2021-03-08,华安基金管理有限公司关于以通讯方式 召开华安鼎瑞定期开放债券型发起式 证券投资基金基金份额持有人大会的 第二次提示性公告,证券日报
754,2021-03-06,擎旗奋进正当时 凝心聚力再出发,北京青年报
755,2021-03-05,浙商银行贵阳分行：“区块链+供应链”双链融合 助应收账款变现,中国金融新闻网
756,2021-03-04,蒙牛携手浙商银行助力奶业发展 金融支持为乡村振兴注入源头活水,财经网
757,2021-03-04,浙商银行发生大宗交易成交折价率10.53%,证券时报网
758,2021-03-04,固定收益研究报告：重庆能源美元债大跌点评,新浪
