,2021-12-31,铁打的银行流动的高管，“年轻时代”走上C位,Wind
0,2021-12-31,浙商银行董事长沈仁康：于变局中开新局,21世纪经济报道
1,2021-12-30,浙商银行最新融资余额1.22亿元，融券余额为1955万元,资本邦
2,2021-12-30,浙商银行：2021年 “区块链+物联网”产业链金融应用白皮书,199IT
3,2021-12-29,今年首个获批开业的银行理财子公司来了，广银理财落户浦东,Wind
4,2021-12-29,房产会计政策变更、4660万债务豁免 宜华健康收深交所关注函 关注函,新浪
5,2021-12-28,宜华健康部分自用房地产改为出租及变更会计政策 净利增加642万,观点地产网
6,2021-12-27,近九成A股上市银行破净,财经杂志
7,2021-12-27,浙商银行上一交易日融资余额1.2亿元，股票质押共有124笔,资本邦
8,2021-12-26,乱象过后日趋规范，上海重现异地银行资金营运中心设立潮,第一财经
9,2021-12-25,银行抢布资金营运中心,中国经营报
10,2021-12-24,浙商银行牵头发布国内首个“区块链+物联网”产业链金融应用白皮书,中国金融新闻网
11,2021-12-24,浙商银行上日融资余额增0.57%至1.2亿元，融券余量516万股,资本邦
12,2021-12-22,嘉华集团质押万通发展总股本34.67%股份，市值56.33亿元,乐居财经
13,2021-12-22,浙商银行：浙商银行股份有限公司关于监事辞职的公告 董监高成员变化,新浪
14,2021-12-22,浙商银行(02016.HK)：监事郑建明辞任 董监高成员变化,格隆汇
15,2021-12-22,浙商银行：郑建明因内部岗位调整之需要而辞任本行副监事长 董监高成员变化,Wind
16,2021-12-22,浙商银行：郑建明辞去公司副监事长、职工监事、监事会办公室主任职务 董监高成员变化,每日经济新闻
17,2021-12-22,浙商银行郑建明辞任副监事长职务 董监高成员变化,乐居财经
18,2021-12-22,名家汇：控股股东程宗玉先生减持股份系筹措资金，用于向浙商银行股份有限公司偿还债务，该笔债务已清偿完毕 减持股份,每日经济新闻
19,2021-12-22,浙商银行(601916.SH)郑建明辞去监事相关职务 董监高成员变化,智通财经
20,2021-12-22,浙商银行2名副行长骆峰、景峰任职资格获批,和讯
21,2021-12-22,浙商银行：郑建明先生辞职,财联社
22,2021-12-22,浙商银行：监事辞职 董监高成员变化,Wind
23,2021-12-22,中金：关于银行涉房敞口的几个焦点问题,Wind
24,2021-12-21,机构推荐这些个股 兴业银行还可涨72%,第一财经
25,2021-12-21,博天环境(603603.SH)在浙商银行天津分行的逾期债务已完成续贷,智通财经
26,2021-12-21,《中国金融》｜张荣森：三大优势推进中小微发展,新浪
27,2021-12-20,【行业动态】多家龙头企业加入浙商银行创新型供应链金融体系,阿尔法工场
28,2021-12-18,年末银行为资本狂 花式“补血”轮番上阵,中国经营报
29,2021-12-17,浙商银行借助“金综平台”添动力，服务实体经济增活力,财经网
30,2021-12-17,浙商银行最新融资余额约1.2亿元，较前一日增4.39%,资本邦
31,2021-12-17,“数智”化催动银行创新：“链”上金融力挺千万小微,中国金融新闻网
32,2021-12-16,浙商银行两名副行长任职资格获批,上证报
33,2021-12-16,浙商银行(02016.HK)：骆峰及景峰任副行长获中国银保监会核准,财华社
34,2021-12-16,浙商银行：银保监会已核准骆峰及景峰的副行长任职资格,Wind
35,2021-12-16,企业纷纷点赞，这家银行供应链金融体系好在哪里？,中国金融新闻网
36,2021-12-15,浙商银行深圳分行荣获第四届深圳网络盛典“年度公益先锋力量”,深圳新闻网
37,2021-12-15,无锡银行抛出20亿定增计划，资本充足率捉襟见肘,时代在线
38,2021-12-15,百万年薪招兵买马！今年以来上市银行高管变动超170次,Wind
39,2021-12-14,浙商银行:融资余额比上日增2.77%，融券余量830万股,资本邦
40,2021-12-14,浙银金融租赁增资至40亿元 上半年实现净利3.05亿元,中国网
41,2021-12-13,企业纷纷点赞，浙商银行供应链金融体系好在哪里？,浙商银行
42,2021-12-13,四家上市银行配股募资规模达500亿 最高折价五成助力资本实力提升,长江商报
43,2021-12-10,浙银租赁注册资本增至40亿元 浙商银行持股51%保持不变,中国经济网
44,2021-12-10,浙商银行:融资余额比上日增10.55%，融券余额比上日增7.16%,资本邦
45,2021-12-10,银保监会：三季度银行业个人贷款业务投诉同比增长38.6%,Wind
46,2021-12-09,浙商银行资金营运中心筹建获批,中国网
47,2021-12-08,浙商银行南京分行：“债保通”赋能江苏乡村振兴新蓝图建设,大众证券报
48,2021-12-07,今年4家银行登陆A股，明年中小银行IPO料提速,Wind
49,2021-12-07,降准带来三利好，银行板块四连阳,Wind
50,2021-12-04,银行A股将达42只！这家城商行IPO领文，6年上市冲关路进入倒计时，金融科技有亮点,Wind
51,2021-12-03,浙商银行(02016)：郑州分行金融借款合同纠纷取得终审胜诉,智通财经
52,2021-12-03,配股融资持续升温，上市银行积极“补血”,Wind
53,2021-12-03,大举布局跨年行情，银行理财“剧透”投资主线,Wind
54,2021-12-03,系统重要性银行密集“补血” 10月份以来永续债、二级资本债发行规模破4000亿元,证券日报
55,2021-12-02,上市银行配股热卷土重来 多重优势助4家银行“补血”,证券日报
56,2021-12-01,中国短期融资券及中期票据信用分析周报,新浪
57,2021-12-01,年内已有5家拿到筹建“许可证”，为何银行扎堆设立资金业务专营机构,北京商报
58,2021-11-30,浙商银行获批筹建资金营运中心,腾讯网
59,2021-11-30,浙商银行:融资余额比上日增3.44%，融券余额比上日增3.98%,资本邦
60,2021-11-28,资管新规过渡期即将结束，上市银行11月发债超三季度,第一财经
61,2021-11-28,临近年末银行频频“补血”永续债、二级资本债齐上阵，系统重要性银行成主力,北京商报
62,2021-11-26,利欧股份(002131)：股东股份解除质押,资本邦
63,2021-11-26,浙商银行董事马红任职资格获准 出自浙江省委组织部,和讯
64,2021-11-26,银保监会核准马红担任浙商银行(02016)执行董事的任职资格,智通财经
65,2021-11-26,浙商银行：董事任职资格获中国银行保险监督管理委员会核准,Wind
66,2021-11-26,浙商银行(601916.SH)完成发行250亿元无固定期限资本债券,智通财经
67,2021-11-26,浙商银行(601916.SH)董事马红任职资格获核准,智通财经
68,2021-11-26,浙商银行重庆分行积极开展消防安全培训,上游新闻
69,2021-11-24,标准债券远期实物交割机制正式推出,Wind
70,2021-11-24,中国银保监会消费者权益保护局发文 5家银行被点名通报！ 其他违规处罚,中国银行保险报
71,2021-11-24,金融报道｜银行股破净率超八成 又一家上市银行折价配股 年内已有3家银行拟配股募资,财经网
72,2021-11-24,基本面与股价缘何背离？银行股明年怎么走？,Wind
73,2021-11-23,浙商银行(02016)聘任莫立君为公司计划财务部总经理,智通财经
74,2021-11-23,浙商银行(601916.SH)第一大股东承诺全额认购可获配股份,智通财经
75,2021-11-23,统统打1折！银行代销基金烽烟起，更有银行推出“0费率”,Wind
76,2021-11-22,浙商银行参与发起国内首个跨链协议,金融界
77,2021-11-22,浙商银行：陈海强董事任职资格获中国银保监会核准,Wind
78,2021-11-22,浙商银行(02016.HK)：中国银保监会核准陈海强任执行董事任职资格,格隆汇
79,2021-11-22,浙商银行：董事陈海强任职资格获监管机构核准,Wind
80,2021-11-22,浙商银行(601916.SH)：董事陈海强任职资格获监管机构核准,格隆汇
81,2021-11-22,浙商银行重庆分行荣获2021年金融联合 教育宣传活动先进个人表彰,上游新闻
82,2021-11-22,浙商银行拟首发永续债 募集250亿元补充资本,和讯
83,2021-11-22,陆家嘴财经早餐2021年11月22日星期一,Wind
84,2021-11-22,创新绿色金融 助力打造美丽温州,经济日报
85,2021-11-21,浙商银行：与华为公司签署战略合作协议,Wind
86,2021-11-21,浙商银行：与华为公司签署战略合作协议,e公司
87,2021-11-21,陆家嘴财经早餐2021年11月21日星期日,Wind
88,2021-11-20,事关28万亿元大市场！银行理财资金投向哪里？,Wind
89,2021-11-20,浙商银行副行长景峰：银行理财子公司在大资管格局中具有“三强”“三弱” 特点,中证网
90,2021-11-20,浙商银行副行长景峰：商业银行向大财富管理转型成为趋势,中证网
91,2021-11-20,*ST金刚：新增已判决生效案件金额超10亿元,证券日报网
92,2021-11-20,财富管理争抢客源：银行仍居基金代销C位,Wind
93,2021-11-20,"中小银行""补血""急！这家银行折价配股，募资不超过120亿，影响多大？",Wind
94,2021-11-20,RMBS规模放量，房地产信贷环境有望改善,Wind
95,2021-11-20,财富管理争抢客源：银行仍居基金代销C位,新浪
96,2021-11-19,中电光谷与浙商银行达成战略合作协议 并获授信20亿,观点地产网
97,2021-11-19,浙商银行西安分行：多维度投资模式支持“一带一路”建设,中国金融新闻网
98,2021-11-19,中小银行“补血”热潮：定增、配股、发债轮番上阵，资本承压仍待破解,Wind
99,2021-11-19,800亿股份行惊现乌龙指，2800万打了水漂？银行股近9成破净,Wind
100,2021-11-19,中小银行资本补充热情升温，更多渠道加速打通,Wind
101,2021-11-19,银行股近9成破净，多家高管出手增持,Wind
102,2021-11-18,分析丨去年底以来4家A股银行启动配股融资，对股价有何影响,澎湃新闻
103,2021-11-18,中国公司债及企业债信用分析周报,新浪
104,2021-11-18,清理银行乱收费，银保监会点名通报这5家银行,Wind
105,2021-11-18,涉企乱收费，浙商银行等五家银行被通报 其他违规处罚,AI财经社
106,2021-11-18,牢记使命勇担当 浙商银行北京分行跑出高质量发展“加速度”,北京青年报
107,2021-11-17,定增配股发债齐上阵商业银行“补血”工具多样化,Wind
108,2021-11-15,【银华基金】交易日报 2021-11-15,新浪
109,2021-11-15,浙江广厦竞得浙商银行2000万股限售流通股，涉资6414.3万元,乐居财经
110,2021-11-15,浙江广厦(600052.SH)以6414.3万元竞得浙商银行2000万股限售流通股,智通财经
111,2021-11-15,浙江广厦斥资6414.30万元竞得浙商银行限售流通股2000万股股权,乐居财经
112,2021-11-15,浙商银行西安分行：绿色金融助力碳达峰碳中和,中国金融新闻网
113,2021-11-12,长沙银行董事长辞任，年内已有多家银行“换帅” 董监高成员变化,金融界
114,2021-11-12,浙商银行获批发行不超过250亿元无固定期限资本债券,北京商报
115,2021-11-12,浙商银行：获批发行不超过250亿元无固定期限资本债券,Wind
116,2021-11-12,浙商银行(601916.SH)：获准发行无固定期限资本债券,格隆汇
117,2021-11-12,剖析中资企业美元债风险，财务自律等四大警示须重视,Wind
118,2021-11-11,中化岩土(002542.SZ)：拟向浙商银行北京分行申请综合授信1.3亿元,格隆汇
119,2021-11-11,穆迪：予海川国际投资发行增信债券“Baa3”最终评级,久期财经
120,2021-11-11,破净率超8成，“打骨折”的银行股还能翻身吗？,Wind
121,2021-11-11,股份行三季报业绩大比拼：浦发、民生、渤海三家银行营收净利双降 民生银行不良率最高 盈利能力下降,新浪
122,2021-11-10,【银华基金】交易日报 2021-11-10,新浪
123,2021-11-10,发挥区块链技术优势 创新金融科技应用 全力为民营经济保驾护航,发现网
124,2021-11-10,IPO前股权遭大股东亏本清仓甩卖，湖州银行上市不被看好？ 亏损,中访网
125,2021-11-09,信贷资金违规流入房市被罚，浙商银行激进扩张后凸显风控短板 运营能力下降,中访网
126,2021-11-09,中金固收中资美元债周报：二级市场再度走弱，负面评级频发,Wind
127,2021-11-08,【银华基金】交易日报 2021-11-8,新浪
128,2021-11-08,浙商银行配股募资180亿被质疑“割韭菜” 回A两年股价破发40%业绩增速放缓 盈利能力下降,新浪
129,2021-11-08,A股上市银行估值能否修复,新浪
130,2021-11-07,浙商银行股份有限公司深圳分行与中国东方资产管理股份有限公司深圳市分公司债权,新浪
131,2021-11-05,浙商银行持续下滑 欲配股“补血” 连续下跌,中金在线
132,2021-11-04,上市银行股权融资频现，资本补充靠“外源”,第一财经
133,2021-11-04,浙商银行北京分行持续助力企业发展 账户服务“松紧”有度,中国网
134,2021-11-04,浙商银行三季度核心一级资本充足率略有回升 仍拟募资180亿补充资本,华夏时报
135,2021-11-03,浙商银行前三季度营收同比增长14.69%,经济日报
136,2021-11-03,CZB 17USDPREF：将于11月23日召开2021年第三次临时股东大会,Wind
137,2021-11-03,浙商银行：将于11月23日召开股东大会,Wind
138,2021-11-03,披露单列省内信贷计划等36条措施 浙商银行全面支持浙江共同富裕示范区建设,上证报
139,2021-11-03,上市银行最新业绩一览 9家银行拨备超过400%,新浪
140,2021-11-03,快讯 | ST维维：股东维维集团质押所持2310万股给浙商银行,财经网
141,2021-11-03,浙商银行：11月23日召开股东大会,Wind
142,2021-11-03,从三季报中读浙商银行的金融服务价值,和讯
143,2021-11-03,上市银行不良率普降，部分涉房业务风险暴露,Wind
144,2021-11-02,业绩涨股价跌！上市银行能否迎来估值修复行情？,国际金融报
145,2021-11-02,浙商银行被罚 70 万元：对公信贷资金挪用于房地产行业 金融监管处罚,ZAKER
146,2021-11-02,上市行“补血”频现 系统重要性银行资本补充紧迫性几何？,财联社
147,2021-11-02,银行财眼 | 浙商银行衢州分行因信贷资金流入房市等两项违规被罚70万元 金融监管处罚,凤凰网
148,2021-11-01,受个别房企风险暴露影响，部分银行前三季度关注类贷款攀升,Wind
149,2021-11-01,上市银行“补血”忙，无锡银行、浙商银行拟募资补充资本,资本邦
150,2021-11-01,定增配股双双来袭！银行业三季报收官，股权融资快马加鞭，发生了什么？两大原因,券商中国
151,2021-11-01,瞄准时间窗口，上市银行加快股权融资“补血”,Wind
152,2021-11-01,瞄准时间窗口 上市银行加快股权融资“补血”,全景网
153,2021-10-31,四季度经济怎么走？券商首席、专家学者激烈交锋,金融界
154,2021-10-30,【三季报观察】江浙沪城商行表现亮眼 优质银行获基金加仓,经济观察报
155,2021-10-29,上市银行配股融资，又来了！募资180亿元，27万股东都有份,上证报
156,2021-10-29,【银华基金】交易日报 2021-10-29,新浪
157,2021-10-29,浙商银行股份有限公司2021年度第一期21恒逸CP003信用风险缓释凭证流通要素公告,上清所
158,2021-10-29,3家股份行齐发三季报 营收稳定增长业绩表现不俗,证券日报网
159,2021-10-29,浙商银行零售奋起直追：单点突破，精细制胜,每日财报
160,2021-10-29,详读浙商银行2021三季报：立足服务民营小微实现质量双增 不良“降旧控新”现成效,财联社
161,2021-10-29,港股盘前必读：李宁折价配股融资超百亿港元股价跌逾8%,Wind
162,2021-10-28,智通港股公告精选︱(10.28)比亚迪股份前三季度营收同比增长38.25%至1451.92亿元,智通财经
163,2021-10-28,浙商银行(601916.SH)拟实施AH股配股募资不超180亿元,智通财经
164,2021-10-28,继中报资产质量水平引交易所关注后 浙商银行三季度不良率仍在上升,北京商报
165,2021-10-28,浙商银行前三季度营收实现两位数增长,中证网
166,2021-10-28,浙商银行(601916.SH)：第三季度归母净利增10.63%至37.27亿元,格隆汇
167,2021-10-28,浙商银行(02016)拟向原股东配售股份募资不超过180亿元,智通财经
168,2021-10-28,浙商银行(02016.HK)前三季度净利润105.78亿元 同比增加4.28%,格隆汇
169,2021-10-28,浙商银行前三季度净利105.78亿元，不良率升至1.52%，拟配股募资180亿元,搜狐
170,2021-10-28,浙商银行前三季度营收净利双增,上证报
171,2021-10-28,浙商银行公布三季报 前三季净利增加4.28%,新浪
172,2021-10-28,浙商银行前三季度净利润增长4.28% 将启动配股补充核心一级资本,第一财经
173,2021-10-28,浙商银行拟配股不超过180亿元,上证报
174,2021-10-28,浙商银行前三季度营收同比增长14.69%，不良率较上年末上升0.10个百分点,新浪
175,2021-10-28,浙商银行发布配股预案：拟每10股配3股,新浪
176,2021-10-28,浙商银行：前三季度净利润同比增长4.28%，拟10配3募资不超过180亿元,资本邦
177,2021-10-28,图解浙商银行三季报：第三季度单季净利润同比增10.63%,证券之星
178,2021-10-28,浙商银行：前三季度净利润同比增长4.28%,Wind
179,2021-10-28,浙商银行：拟配股募资180亿元 补充核心一级资本,e公司
180,2021-10-28,浙商银行：拟10配3配股募资不超180亿元,Wind
181,2021-10-28,浙商银行：拟10股配3股募资不超过180亿元,财联社
182,2021-10-28,浙商银行股份有限公司配股公开发行证券预案,证券日报
183,2021-10-27,【中金固收·信用】中国短期融资券及中期票据信用分析周报,中金固定收益研究
184,2021-10-27,浙商银行：旅行者汽车集团所持公司股份被继续冻结 股权冻结,Wind
185,2021-10-27,浙商银行(02016.HK)：旅行者汽车集团持有公司的13.469亿股限售流通股被冻结,格隆汇
186,2021-10-27,浙商银行：股东股份被继续冻结 股权冻结,Wind
187,2021-10-27,宝能，失去的5年,新浪
188,2021-10-26,浙商银行回应上交所监管函：不良率近年来有所上升系存量客户风险暴露和加快出清所致 问询,北京商报
189,2021-10-25,浙商银行回复上交所监管工作函：着力不良贷款降旧控新 上市公司控股股东质押融资业务无逾期 问询,证券时报
190,2021-10-22,浙商银行殷剑锋：人达峰后导致经济停滞 关键要找到高回报投资,新浪
191,2021-10-19,“人才银行”累计授信132亿元——浙商银行全力助推科创企业融资,中国金融新闻网
192,2021-10-19,*ST新光：世贸中心项目的住宅及酒店式公寓，除抵押房产外，已全部售罄,每日经济新闻
193,2021-10-19,浙商银行支持“精专特新”企业,浙商银行
194,2021-10-18,浙江广厦拟竞拍浙商银行3000万限售股 总金额不超1.6亿,观点地产网
195,2021-10-18,浙江广厦(600052.SH)拟参与浙商银行3000万限售股的司法拍卖 司法拍卖,智通财经
196,2021-10-18,浙江广厦(600052.SH)：拟参与竞拍东阳三建所持的浙商银行3000万A股,格隆汇
197,2021-10-15,浙商银行(02016.HK)将于10月28日举行董事会会议以审批前三季度业绩,格隆汇
198,2021-10-15,浙商银行：将于十月二十八日举行董事会会议,Wind
199,2021-10-15,银行财眼 | 浙江银保监局连开3张罚单 浙商银行绍兴分行被罚225万元 金融监管处罚,凤凰网
200,2021-10-14,浙商银行全力助推科创企业融资,经济日报
201,2021-10-14,开展安全教育“必修课” 浙商银行“一行一校”助力“双减”,和讯
202,2021-10-14,浙商银行被罚225万元 因贷款管理不到位等六项违规行为 金融监管处罚,和讯
203,2021-10-08,大龙地产(600159.SH)：大龙顺发拟开展不超1亿元应收款链平台业务,智通财经
204,2021-10-07,9月23家银行发债约900亿元，二级资本债占近一半,Wind
205,2021-10-03,54家上市银行信用卡存量规模与增长竞争力比拼,腾讯网
206,2021-09-30,银行对公模式深度研究系列之二：拥抱新经济 对公新升级,新浪
207,2021-09-30,听说现在银行高管间，流行买自家股票？,搜狐
208,2021-09-30,年内多家银行董监高增持自家股票,中国银行保险报
209,2021-09-30,刚上市一个多月，这家农商行股东就出手“护盘” 还有这些银行也在增持,券商中国
210,2021-09-29,中交地产3亿担保融资抵押变更为“在建工程及对应的土地使用权” 大额借贷担保,观点地产网
211,2021-09-29,银行行业周报：理财产品预期收益率下行,新浪
212,2021-09-29,浙商银行济宁分行强化创新深耕服务，助力实体经济发展,腾讯网
213,2021-09-28,浙商银行再推30余项优惠减免措施,经济日报
214,2021-09-28,行业深度！2021年中国股份制上市银行竞争格局及市场份额分析 招商银行综合实力领先发展,前瞻研究院
215,2021-09-28,银行再现高管护盘增持 四季度银行板块能否重启估值修复行情,经济观察报
216,2021-09-28,浙商银行贵阳分行：“定制”场景化信用贷款 疏解农产品供应链“堵点”,中国金融新闻网
217,2021-09-28,支付手续费降费政策9月30日全面落地！浙商银行等银行相继推出降费“礼包”,上证报
218,2021-09-28,浙商银行：9月30日起拟进一步降低小微企业和个体工商户支付手续费,中国银行保险报
219,2021-09-28,浙商银行再推降费“礼包” 进一步优化小微营商环境,中国经济网
220,2021-09-28,银行行业周报：银行监管评级办法升级；行业整体信用风险不必悲观,新浪
221,2021-09-28,银行股掀起增持潮！三季度11家银行高管“自掏腰包”增持护盘,资本邦
222,2021-09-28,商业银行行业：商业银行业日报,新浪
223,2021-09-28,一个星期两名高管接连增持自家股票！银行股掀起集体增持潮！,上证报
224,2021-09-28,银保合作服务“两新一重”,经济日报
225,2021-09-27,浙商银行高管耗资100万元增持公司股份,上证报
226,2021-09-27,三季度11家银行高管“自掏腰包”稳股价 增持耗资超3000万人民币,财联社
227,2021-09-27,浙商银行：副行长刘龙增持公司A股28.33万股 增持金额100万元,中证网
228,2021-09-27,浙商银行行长张荣森任职资格获批,北京商报
229,2021-09-27,浙商银行：副行长兼董秘以自有资金增持浙商银行A股股份,上证报
230,2021-09-27,浙商银行(601916.SH)副行长兼董秘刘龙耗资100万元增持28.33万股A股,智通财经
231,2021-09-27,浙商银行：董秘今日增持公司28.33万股,e公司
232,2021-09-27,浙商银行副行长刘龙增持100万元公司股份 价格3.53元/股,新浪
233,2021-09-27,浙商银行(601916.SH)：获副行长刘龙增持28.33万股,格隆汇
234,2021-09-27,浙商银行：副行长刘龙9月27日增持100万元公司股份,财联社
235,2021-09-27,浙商银行：董事会秘书刘龙9月27日增持公司A股股份28.33万股,Wind
236,2021-09-27,浙商银行获批发行550亿元永续债、小微企业贷款专项金融债,搜狐
237,2021-09-27,中国银保监会关于浙商银行张荣森任职资格的批复,银保监会
238,2021-09-27,恒大地产负债“瘦身”＋多家银行力挺能否满血复活？,乡村小萌宝
239,2021-09-26,银行校招进行时，动作要快，姿势要帅,Bank资管
240,2021-09-25,"债券""南向通""正式上线，1元起买的理财也来了",Wind
241,2021-09-24,浙商银行上海分行积极开展金融联合宣教活动,中国金融新闻网
242,2021-09-24,浙商银行行长4个月内两度增持：股价年内跌近10%，上半年利润增速1.12%,搜狐
243,2021-09-24,浙商银行行长张荣森增持30万股 上任后力推五大业务板块,新浪
244,2021-09-24,浙商银行成功达成首批债券通“南向通”交易,中金在线
245,2021-09-24,武汉、郑州两地合计近300亿元 浙商银行撮合多笔保险债权投资计划,经济观察报
246,2021-09-24,银行高管纷纷出手“护价” 浙商银行行长张荣森增持公司30万股,和讯
247,2021-09-24,自掏百万元，浙商银行行长张荣森再度增持30万股自家股票,证券时报
248,2021-09-24,浙商银行：多措并举普及金融知识 增强公众风险防范意识,发现网
249,2021-09-23,浙商银行(02016)获行长张荣森增持30万股A股,智通财经
250,2021-09-23,浙商银行(02016.HK)获行长张荣森增持30万股A股,格隆汇
251,2021-09-23,浙商银行：行长增持30万股股份,Wind
252,2021-09-23,浙商银行：落地百亿保债计划 另辟“两新一重”融资蹊径,中金在线
253,2021-09-23,浙商银行落撮合险资助力“两新一重”,经济日报
254,2021-09-23,拉闸刷屏！千亿巨头突涨24%，1700亿牛股闪崩,Wind
255,2021-09-23,房地产贷款风险来袭，多家银行撇清与恒大关联,Wind
256,2021-09-23,史无前例！一大批公司限产，牛股核心工厂全面停产,Wind
257,2021-09-23,港股盘前必读：中策集团拟清仓出售所持全部恒大汽车股票,Wind
258,2021-09-23,浙商银行：科技赋能精准识别涉诈骗风险交易,中国金融新闻网
259,2021-09-23,银行股是否反应过度了？多家撇清与恒大关联,Wind
260,2021-09-23,突发！中国恒大ADR疯涨47%,Wind
261,2021-09-22,兴业银行等多家上市银行回应与恒大业务往来：风险可控,Wind
