,2021-12-31,深南电路(002916.SZ)：拟在不超3亿美元的规模内开展外汇衍生品交易,格隆汇
0,2021-12-31,深南电路(002916.SZ)：拟向金融机构申请合计不超195亿元综合授信额度,格隆汇
1,2021-12-31,深南电路(002916.SZ)：限制性股票解锁实际可上市流通的数量为146.7411万股,格隆汇
2,2021-12-31,深南电路(002916.SZ)：A股限制性股票激励计划(第一期)第二个解锁期解锁条件成就,智通财经
3,2021-12-29,兴森快捷：公司IC封装基板客户主要有三星、长电、华天、瑞芯微电子、紫光、西部数据、OSE、Amkor等,Wind
4,2021-12-23,【东吴通信侯宾团队】通信行业点评：载板供需缺口仍将存在，持续看好行业景气度稳步向上,东吴通信互联网团队
5,2021-12-22,苹果板块火了，3000亿龙头股一度大涨8%！传筹建大型iPhone组装厂,中证报
6,2021-12-22,供应吃紧至2026年，PCB概念爆发，两大龙头涨停，机构看好19股,证券时报
7,2021-12-21,东吴证券：载板供需缺口仍存，龙头布局优势显著,智通财经
8,2021-12-16,鹏鼎控股、生益科技、深南电路……谁是盈利能力最强的印制电路板企业？,Ofweek
9,2021-12-14,深南电路：25.5亿元定增申请获证监会审核通过,C114通信网
10,2021-12-13,深南电路(002916.SZ)非公开发行股票申请获中国证监会发行审核委员会审核通过,智通财经
11,2021-12-11,深南电路：无锡封装基板工厂目前产能利用率已达90%以上,e公司
12,2021-12-10,深南电路：无锡生产基地现有1家封装基板工厂投产，产能利用率达90%以上,每日经济新闻
13,2021-12-08,PCB行业深度：通讯／消费电子／汽车齐发力 FPC替代传统线束前景可期,新浪
14,2021-12-08,深南电路：新能源和ADAS是公司在该领域发展的主要方向,每日经济新闻
15,2021-12-08,深南电路：南通三期汽车电子专业工厂于2021年4季度连线，处于投产早期阶段,Wind
16,2021-12-07,深南电路股份有限公司 关于A股限制性股票激励计划（第一期）部分限制性股票回购注销完成的公告,证券时报
17,2021-12-03,兴森科技：平安资产管理有限责任公司、国盛证券等2家机构于12月1日调研我司,证券之星
18,2021-11-30,深南电路(002916.SZ)回购注销2.24万股限制性股票,智通财经
19,2021-11-30,深南电路：控股股东拟变更股权结构 控制人变化,中证网
20,2021-11-28,IC载板订单能见度延长至明年下半年 或成明年短缺部件 相关公司股价已率先上涨,财联社
21,2021-11-24,深南电路：目前公司汽车电子业务占比较小,每日经济新闻
22,2021-11-22,新能源需求持续景气，产业转移为半导体设备材料,金融界
23,2021-11-21,【西部电子】PCB行业专题报告,茂飞电子研究
24,2021-11-20,高成长预期叠加成本压力趋缓，印制电路板再掀投资热,智通财经
25,2021-11-17,2021年中国印制电路板行业产业链现状及市场竞争格局分析 投资重心将在产能建设上,前瞻研究院
26,2021-11-17,高端印制电路板供需缺口扩大 行业迎持续复苏,证券时报
27,2021-11-16,深南电路：公司目前封装基板所用材料以BT类板材为主,每日经济新闻
28,2021-11-16,化工行业周观点：锂膜国产化进程加速 碳硅负极材料优势显着,新浪
29,2021-11-16,缺货严重，龙头公司股价两年飙涨12倍！,Wind
30,2021-11-14,深南电路(002916)：2021Q3重振旗鼓 PCB业务订单与成本双重改善,新浪
31,2021-11-12,IC载板行业持续高景气 龙头厂商高呼：明年产能更缺,财联社
32,2021-11-10,电子行业2021年三季报回顾：板块分化 回调为主,新浪
33,2021-11-09,深南电路：目前汽车电子业务占比较小,每日经济新闻
34,2021-11-09,生益科技(600183)：乘汽车新三化东风 覆铜板龙头再起航,新浪
35,2021-11-04,东方财富证券维持深南电路增持评级：Q3单季度业绩亮眼，PCB产需持续改善,每日经济新闻
36,2021-11-03,安信证券维持深南电路买入评级：封装基板业务高速增长，新项目建设有序进行,每日经济新闻
37,2021-11-03,安信证券：给予深南电路买入评级，目标价位119.5元,证券之星
38,2021-11-03,科技制造行业11月月报：新能源仍是焦点 继续布局估值和增长匹配的制造业专精特新标的,新浪
39,2021-11-03,A股早报2021年11月3日星期三,Wind
40,2021-11-03,【东北电子程雅琪】深南电路（002916）三季报点评：通讯PCB需求改善，载板有望接力成长,东北证券研究所
41,2021-11-03,智通A股龙虎榜统计|11月2日,智通财经
42,2021-11-02,深南电路：目前汽车电子业务占比较小,每日经济新闻
43,2021-11-02,深南电路：无锡封装基板工厂产能爬坡顺利,每日经济新闻
44,2021-11-02,深南电路(002916.SZ)股价异动 不存在未披露事项,智通财经
45,2021-11-02,交易异动！深南电路：前期披露的信息不存在需要更正、补充之处,每日经济新闻
46,2021-11-02,盈亚证券咨询 顶级游资动向：炒股养家大手笔扫货A股里的最纯正,搜狐
47,2021-11-02,深南电路涨停，深股通龙虎榜上净买入5371.66万元,证券时报网
48,2021-11-02,突然跳水！12倍大牛股高位闪崩，周期股全线下跌！这一板块却逆势大涨，火锅丸龙头要提价！,雪球
49,2021-11-02,龙虎榜丨深南电路涨停，但机构、北资现分歧；还有这些涨停股上榜（名单）,21世纪经济报道
50,2021-11-02,涨停板解密：市场回落，军工股逆市火爆！（11月2日）,Wind
51,2021-11-02,大盘再度回调 机构卖多买少,金融投资报
52,2021-11-02,深南电路放量涨停 机构资金净卖出867万元,证券之星
53,2021-11-02,深南电路龙虎榜数据（11月2日）,Wind
54,2021-11-02,“缺芯”助推半导体热潮，深南电路2连板，5G50ETF（159811）四连阳,资本邦
55,2021-11-02,11月2日深南电路涨停分析：军工研究所，PCB板，军工概念热股,证券之星
56,2021-11-02,通信行业跟踪周报：本周专题 通信第三季度基金持仓环比持平 持续关注物联网及能源信息化赛道投资机会,新浪
57,2021-11-02,PCB行业毛利环比改善，但拐点仍未见到？,中财网
58,2021-11-02,解盘：资源股低迷，半导体、食品、IGBT、航母领涨,Wind
59,2021-11-02,快讯：深南电路涨停 报于107.48元,金融界
60,2021-11-02,【行情】半导体板块再度走强，PCB概念股深南电路涨停，世运电路、崇达技术、鹏鼎控股、华亚智能、沪电股份、超声电子涨超5%,金十数据
61,2021-11-02,PCB概念股继续走强 深南电路涨停,e公司
62,2021-11-02,深南电路2连板,Wind
63,2021-11-02,A股早报2021年11月2日星期二,Wind
64,2021-11-01,深南电路(002916.SZ)今年累计收到政府补助1.54亿元,智通财经
65,2021-11-01,深南电路(002916.SZ)：公司及子公司累计获得与收益相关的政府补助1.54亿元,格隆汇
66,2021-11-01,涨停板解密：资金追捧，两大板块个股现涨停潮！（11月1日）,Wind
67,2021-11-01,图解深南电路三季报：第三季度单季净利润同比增24.60%,证券之星
68,2021-11-01,PCB板块掀涨停潮 多公司现业绩拐点迹象 新能源车打开长期增长空间,财联社
69,2021-11-01,5G概念领航，深南电路封板涨停，5G50ETF（159811）三连阳,资本邦
70,2021-11-01,解盘：人气回升，新能源、充电桩、网络游戏、苹果领涨,Wind
71,2021-11-01,快讯：半导体板块开盘走强 深南电路涨停,新浪
72,2021-11-01,半导体板块走强 深南电路涨停,第一财经
73,2021-10-31,【中信建投电子|刘双锋&雷鸣团队】深南电路(002916)：三季度收入增速回升，净利润表现亮眼,中信建投电子研究
74,2021-10-31,平安证券：给予深南电路增持评级,证券之星
75,2021-10-31,盈亚证券咨询 大盘短期有回调需求，调整即是加仓好时机,搜狐
76,2021-10-30,【招商电子】深南电路：Q3收入超预期，确立经营拐点重回上行通道,招商电子
77,2021-10-30,深南电路披露2021年三季报 实现营收97.55亿元,资本邦
78,2021-10-29,深南电路公布三季报 前三季净利减少6.51% 盈利能力下降,新浪
79,2021-10-29,深南电路(002916.SZ)：第三季度净利升24.60%至4.66亿元,格隆汇
80,2021-10-29,深南电路：第三季度净利润4.66亿元 同比增长24.6%,财联社
81,2021-10-29,深南电路：前三季度净利润同比减少6.51% 盈利能力下降,Wind
82,2021-10-28,深南电路：目前广州封装基板项目整体进展处于拟参与竞拍土地使用权的前期阶段,每日经济新闻
83,2021-10-26,半导体制造系列：先进封装扮演更重要角色,新浪
84,2021-10-26,深南电路：公司综合产能利用率自2021年初以来持续恢复,每日经济新闻
85,2021-10-26,深南电路：公司PCB业务下游应用领域广泛，覆盖通信、数据中心、工控医疗、汽车电子等领域,每日经济新闻
86,2021-10-23,深南电路股份有限公司 关于非公开发行A股股票申请获得 中国证监会受理的公告,证券时报
87,2021-10-22,深南电路：公司南通三期项目预计将在2021年4季度内投产,每日经济新闻
88,2021-10-20,深南电路：上半年公司研发投入3.49亿元,Wind
89,2021-10-20,深南电路：预计将于2021年10月30日披露公司2021年第三季度报告,每日经济新闻
90,2021-10-20,深南电路：2021年上半年，公司研发投入3.49亿元,每日经济新闻
91,2021-10-20,生益科技前三季净利预增81%远超同行 三年半投22亿研发攻关抓住市场机遇,长江商报
92,2021-10-19,供应链本土化：解码跨国医械企业的“传、帮、带”生意经,21世纪经济报道
93,2021-10-18,GE医疗中国陈和强：医疗设备国产化不是简单引进吸收消化,澎湃新闻
94,2021-10-16,深南电路股份有限公司 关于非公开发行股票获得中国航空 工业集团有限公司批复的公告,证券时报
95,2021-10-15,电子行业2021年四季度投资策略：消费电子环比改善 布局低估值龙头半导体持续关注国产替代,新浪
96,2021-10-15,深南电路：截至2021年6月30日，公司已获授权专利601项，其中发明专利372项、国际PCT专利59项,每日经济新闻
97,2021-10-15,深南电路：公司主要原材料包括覆铜板、半固化片、铜箔、金盐、油墨等，涉及品类较多。受国际市场铜、石油等大宗商品影响，公司主要原材料价格目前整体呈现高位企稳的状态,每日经济新闻
98,2021-10-15,深南电路(002916.SZ)：定增事项获航空工业集团批复,格隆汇
99,2021-10-13,深南电路：天芯互联嵌入式封装模块模组产品为公司全资子公司天芯互联主要产品类型之一,每日经济新闻
100,2021-10-12,148家公司获机构调研（附名单）,证券之星
101,2021-10-11,深南电路：其他应付款中的工程及设备款主要用于公司无锡、南通部分项目基建及设备的支出,每日经济新闻
102,2021-10-08,深南电路：公司现有深圳2家、无锡1家封装基板工厂均已投产,每日经济新闻
103,2021-10-08,电子行业2021年三季报业绩展望：消费电子环比业绩改善 半导体国产替代持续,新浪
104,2021-10-08,计算机行业周报：高通收购维宁尔对“智联汽车+AI芯片”格局影响？,新浪
105,2021-09-30,深南电路：中欧基金、华创证券等4家机构于9月28日调研我司,证券之星
106,2021-09-29,深南电路：公司南通三期项目面向汽车电子领域PCB产品，为公司自有资金建设项目，预计2021年4季度投产,每日经济新闻
107,2021-09-26,通信行业2021年中报总结：通信行业Q2业绩维持高增长 估值仍处低位 持续关注主设备、运营商等细分赛道投资机会,新浪
108,2021-09-25,深南电路：公司目前生产经营一切正常,每日经济新闻
109,2021-09-14,深南电路：汽车电子业务完成国内外多家战略重点客户认证与导入,Wind
110,2021-09-14,深南电路：汽车电子业务完成国内外多家战略重点客户认证与导入,e公司
111,2021-09-14,深南电路：汽车电子为公司看好并重点拓展的领域之一,财联社
112,2021-09-14,A股早报2021年9月14日星期二,Wind
113,2021-09-13,深南电路：华西证券、中信证券等2家机构于9月8日调研我司,证券之星
114,2021-09-13,深南电路：南通三期项目预计将于2021年4季度投产,每日经济新闻
115,2021-09-10,电子行业2021年中报总结：板块增速分化 自下而上关注细分龙头,新浪
116,2021-09-06,通信行业跟踪周报-本周专题：AI产业链日渐成熟 关注相关优质标的投资机会,新浪
117,2021-09-05,专精特新还是核心资产？顶流私募最新投资思路曝光,Wind
118,2021-09-03,深南电路：野村证券、UBS瑞银等2家机构于9月1日调研我司,证券之星
119,2021-09-03,科技制造行业先进制造2021年9月月报：聚焦专精特新 继续布局估值和增长匹配的中小市值标的,新浪
120,2021-09-02,深南电路：公司通信类PCB产品覆盖无线网、传输网、核心网、固网宽带等企业级应用场景,每日经济新闻
121,2021-09-01,私募大佬持仓出炉！冯柳、邓晓峰、葛卫东、裘国根、赵军等心水股有哪些,Wind
122,2021-08-31,新基建加码，重磅大会开幕，5G厂商业绩迎爆发,Wind
123,2021-08-26,深南电路：招商证券、UBS瑞银证券等18家机构于8月20日调研我司,证券之星
124,2021-08-26,中航产融(600705.SH)子公司中航产投拟出资1.5亿元认购深南电路非公开发行股票,智通财经
125,2021-08-26,东方财富证券维持深南电路增持评级，2021年中报点评：持续优化业务结构，封装基板迎来爆发,每日经济新闻
126,2021-08-26,当前时点，为什么我们再度重视新基建及5G应用的投资机会？,金融界
127,2021-08-25,【中信建投电子|刘双锋&雷鸣团队】深南电路(002916)：封装基板高景气，下半年盈利有望改善,中信建投电子研究
128,2021-08-25,深南电路(002916)点评：数通PCB稼动率较低 封装基板需求紧俏,新浪
129,2021-08-24,券商首次关注6股并给予买入评级（8月24日）,Wind
130,2021-08-24,西南证券首予深南电路买入评级：短期业绩承压，PCB龙头积极运营反弹可期，目标价117.26元,每日经济新闻
131,2021-08-23,通信本周专题：从派息率和子公司独立分拆上市重新审视运营商投资价值,新浪
132,2021-08-22,景旺电子：利润增长遇瓶颈,证券市场周刊
133,2021-08-21,【招商电子】深南电路：下半年主业有望好转，封装基板业务阔步向前,招商电子
134,2021-08-20,"深南电路现1笔大宗交易 共成交2,880.12万元",新浪
135,2021-08-20,深南电路今日大宗交易成交30.02万股，成交价95.94元溢价0.0%,Wind
136,2021-08-20,碧桂园?美好中国ESG100指数完成2021年度调仓,新浪
137,2021-08-20,福斯特(603806)点评：光伏胶膜产销稳步扩张 平台化拓展电子材料产品,新浪
138,2021-08-19,PCB企业业绩分化 龙头股业绩下降北上资金不减反增 盈利能力下降,e公司
139,2021-08-19,福斯特(603806)：胶膜持续成长 多方位打造增长极,新浪
140,2021-08-19,晚间重要公告2021年8月19日星期四,Wind
141,2021-08-19,深南电路半年报：上半年净利5.61亿元 同比降23% 盈利能力下降,财联社
142,2021-08-19,深南电路：2021年半年度净利润约5.61亿元，同比下降22.57% 盈利能力下降,每日经济新闻
143,2021-08-19,深南电路(002916.SZ)：上半年净利降22.57%至5.61亿元 盈利能力下降,格隆汇
144,2021-08-19,深南电路：上半年净利润同比减少22.57% 盈利能力下降,Wind
145,2021-08-16,深南电路：全资子公司广州广芯封装基板有限公司成立,中证网
146,2021-08-16,出资2亿，国产PCB巨头拟成立子公司,证券之星
147,2021-08-16,通信电子行业周报：高精度位导龙头华测导航迈入自动驾驶时代,光大证券
148,2021-08-16,深南电路于广州成立新公司，注册资本2亿元,搜狐
149,2021-08-09,通信电子行业周报：看好通信板块中期行情 半导体波动中掘金,光大证券
150,2021-08-05,南亚新材(688519)：业绩符合预期 覆铜板高端新产品有望陆续放量,新浪
151,2021-08-03,深南电路：拟定增不超过25.5亿用于高阶倒装芯片用IC载板产品制造项目等项目,资本邦
152,2021-08-03,8月3日操盘必读：影响股市利好与利空消息,新浪
153,2021-08-03,深南电路拟定增25.5亿加码封装基板产能,证券时报
154,2021-08-02,晚间重要公告2021年8月2日星期一,Wind
155,2021-08-02,深南电路(002916.SZ)拟非公开发行股票募集不超25.5亿元,智通财经
156,2021-08-02,深南电路：拟定增募资不超过25.5亿元,Wind
157,2021-08-02,深南电路拟募资不超25.5亿元 定增面临这几大风险,每日经济新闻
158,2021-08-02,深南电路：拟非公开增发募资不超过25.5亿元,每日经济新闻
159,2021-08-02,深南电路：最近五年不存在被证券监管部门和证券交易所处罚的情况,每日经济新闻
160,2021-08-02,深南电路：拟定增募资不超25.5亿元,Wind
161,2021-07-27,【深度·天风电子】持续看好 IC 载板基材及制造的国产化机遇,科技伊甸园
162,2021-07-20,深南电路：公司有参与700MHz频段5G通信PCB产品的制造,Wind
163,2021-07-20,深南电路：公司有参与700MHz频段5G通信PCB产品的制造,每日经济新闻
164,2021-07-20,深南电路：由于产能规模扩张，公司存货规模有所增长,Wind
165,2021-07-20,重磅机会！机构罕见扎堆调研，这一策略胜率高达八成,Wind
166,2021-07-20,机构调研跑断腿，科创板股票春天将至？,Wind
167,2021-07-19,深南电路最新公告：以6720万元竞得龙岗区坪地街道某地使用权,证券之星
168,2021-07-19,深南电路(002916.SZ)以6720万元竞拍取得土地使用权,智通财经
169,2021-07-19,A股午盘综述：三大股指午前均有抬头迹象,Wind
170,2021-07-14,今年新款iPhone产量有望增两成 我国累计建设5G基站91.6万座丨明日主题前瞻,第一财经
171,2021-07-14,深南电路：公司南通三期项目建设进展顺利,Wind
172,2021-07-14,深南电路：公司南通三期项目建设进展顺利预计2021年4季度投产,财联社
173,2021-07-13,电子行业2021中报前瞻：5G手机、远程需求、汽车电子仍为2021三大主轴,新浪
174,2021-07-13,通信点评报告：为何当前时点我们继续坚定看好通信板块价值和投资机会,新浪
175,2021-07-12,家居｜金牌厨柜变更持续督导保荐代表人 黄熙接替陈霖,财经网
176,2021-07-12,【招商电子】PCB月度深度跟踪：覆铜板Q2量价齐升，下半年关注IC载板、通信板及苹果链,招商电子
177,2021-07-12,26股获北向资金加仓超亿元,证券时报网
178,2021-07-12,上市公司正负面新闻2021年7月12日星期一,Wind
179,2021-07-10,上市公司正负面新闻2021年7月10日星期六,Wind
180,2021-07-09,深南电路(002916.SZ)：拟以非公开发行股票方式募资用于公司项目建设和日常经营,格隆汇
181,2021-07-09,深南电路：FC-BGA封装基板主要应用在CPU、GPU等高阶IC芯片，有较高的技术壁垒,每日经济新闻
182,2021-07-09,深南电路：受通信市场需求调整影响，目前国内通信市场需求以700M项目为主，海外通信市场需求同比有所改善,每日经济新闻
183,2021-07-09,晚间重要公告2021年7月9日星期五,Wind
184,2021-07-09,深南电路：筹划非公开发行股票事项,e公司
185,2021-07-08,深南电路：2020年度公司折旧和摊销合计6.44亿元,Wind
186,2021-07-07,深南电路：公司近期PCB综合产能利用率较去年同期有所下降,Wind
187,2021-07-07,深南电路：受通信市场需求调整影响，公司近期PCB综合产能利用率较去年同期有所下降 盈利能力下降,每日经济新闻
188,2021-07-07,深南电路：目前广州封装基板项目整体进展处于拟参与竞拍土地使用权的前期阶段,Wind
189,2021-07-07,深南电路：公司现有工厂已具备FC-CSP基板的批量生产能力,Wind
190,2021-07-06,先进制造行业2021年7月投资策略：七月防守为主 布局估值和增长匹配的中小市值标的,新浪
191,2021-07-04,半导体行业月度深度跟踪：行业景气业绩兑现 关注AIOT智能化浪潮,新浪
192,2021-07-02,电子行业2021年中报业绩展望：半导体持续景气 消费电子阶段承压,新浪
193,2021-07-01,电子行业2021年三季度投资策略：半导体持续重点推荐 消费电子看好下半年苹果链确定性,新浪
194,2021-07-01,【干货】中国印制电路板(PCB)产业链全景梳理及区域热力地图,前瞻研究院
195,2021-06-30,6月29日57只个股获券商关注，深南电路目标涨幅达87.62%,每日经济新闻
196,2021-06-30,【东北电子杨一飞】深南电路（002916）事件点评：拟建封装基板生产基地，迈向更高阶技术,微信
197,2021-06-29,通信行业跟踪周报：本周专题 三大运营商5G总用户数超4.5亿 智慧能源解决方案加速发展,新浪
198,2021-06-29,东北证券：深南电路（002916.SZ）拟建封装基板生产基地，维持“买入”评级,智通财经
199,2021-06-29,第二季度集中开工163个重大项目 今年上半年总投资约1.4万亿元,南方日报
200,2021-06-29,抢先机！上千个重大项目落子布局,南方日报
201,2021-06-29,广州开发区打造全国集成电路第三极核心承载区，粤芯已吸引32家上下游半导体企业落户,21世纪经济报道
202,2021-06-29,机构看中这些股 近五日大手笔净买入,证券之星
203,2021-06-29,东北证券维持深南电路买入评级：拟建封装基板生产基地，迈向更高阶技术,每日经济新闻
204,2021-06-29,广州黄埔七大集成电路项目开工含粤芯半导体二期、深南电路FCBGA封装基板项目,财联社
205,2021-06-29,38股获券商买入评级，深南电路目标涨幅达82.32%,Wind
206,2021-06-28,【招商电子】深南电路：发力FC-BGA等载板业务，引领高端载板国产化,招商电子
207,2021-06-27,【建投中小盘|深度】东威科技：从PCB到锂电池，深耕电镀技术的高端精密电镀设备供应商,中信建投中小市值
208,2021-06-25,总投资60亿元深南电路拟投建广州封装基板生产基地,半导体协会
209,2021-06-25,60亿扩产瞄准中长期发展 深南电路建设封装基板生产基地,长江商报
210,2021-06-25,A股早报2021年6月25日星期五,Wind
211,2021-06-25,深南电路拟投60亿巩固封装基板领先地位 深耕主业37年连续五年高增长,长江商报
212,2021-06-24,两市全天共58只股涨停，电气部件与设备行业成最大赢家,Wind
213,2021-06-24,深南电路龙虎榜数据（6月24日）,Wind
214,2021-06-24,60亿元投资建设封装基板项目 深南电路跳空高开封涨停板,产业经济新闻网
215,2021-06-24,深南电路拟投60亿元资金用于拓产封装基板,证券之星
216,2021-06-24,解盘：光伏屋顶强势拉升，医药、芯片股回调,Wind
217,2021-06-24,深南电路拟投60亿用于FC-BGA封装基板项目,TechWeb
218,2021-06-24,异动股揭秘：深南电路：拟投资建设广州封装基板生产基地项目 深南电路触及涨停,ZAKER
219,2021-06-24,A股早报2021年6月24日星期四,Wind
220,2021-06-24,深南电路(002916)点评：投资60亿封装基板新项目 加速IC材料国产化,新浪
221,2021-06-23,热点追踪：“鸿蒙概念股”福日电子辟谣称目前生产的机型均未搭载鸿蒙系统,新浪
222,2021-06-23,市场需求旺盛订单饱满 深南电路拟投60亿拓产封装基板,e公司
223,2021-06-23,公告精选：深南电路拟60亿投建封装基板生产基地项目；一批公司拟中选药品集中采购,e公司
224,2021-06-23,晚间重要公告2021年6月23日星期三,Wind
225,2021-06-23,深南电路(002916.SZ)：拟以2亿元在广州设子公司以建FC-BGA封装基板项目,格隆汇
226,2021-06-23,深南电路：拟60亿元投建广州封装基板生产基地项目,Wind
227,2021-06-23,深南电路(002916.SZ)拟参与竞拍土地使用权,智通财经
228,2021-06-23,深南电路(002916.SZ)投资建设广州封装基板生产基地项目,智通财经
229,2021-06-22,2021下半年电子行业投资策略：5G产业强者恒强 聚焦国产化,新浪
230,2021-06-20,电气设备行业感光干膜：如何看福斯特的“第二增长极”,新浪
231,2021-06-17,福斯特(603806)：光伏胶膜龙头的新成长,新浪
232,2021-06-17,深南电路：公司共拥有深圳2家、无锡1家封装基板工厂,Wind
233,2021-06-17,深南电路：公司共拥有深圳2家、无锡1家封装基板工厂,每日经济新闻
234,2021-06-17,深南电路：已积极投入汽车电子相关技术研发,上证报
235,2021-06-17,深南电路：公司目前汽车电子业务占比较小,Wind
236,2021-06-16,通用机械行业先进制造：PCB需求持续景气 把握中游设备投资机会,新浪
237,2021-06-15,通信行业跟踪周报：本周专题 四部委印发《能源领域5G应用实施方案》 华为成立子公司发力能源数字化,新浪
238,2021-06-10,120家公司获机构调研（附名单）,证券之星
239,2021-06-09,【繁微另类数据】基于移动大数据的上市公司金融活动指数的选股应用,东证衍生品研究院
