1975,2020-07-01,生猪养殖巨头扩产能否逃脱“猪周期”魔咒,金融投资报
1976,2020-07-01,温氏股份：实际控制人温鹏程质押约2210万股,每日经济新闻
1977,2020-07-01,温氏股份(300498.SZ)：实控人温鹏程质押2209.59万股,格隆汇
1978,2020-06-30,温氏股份现1笔大宗交易 共成交800.41万元,新浪
1979,2020-06-30,大牛市的味道！创业板涨疯了,中国基金报
1980,2020-06-30,最强猪周期调查：一头赚3000，农校生月薪2万不算高,每日经济新闻
1981,2020-06-30,盘前有料丨支付巨头财务造假丑闻曝光，股价却飙升超150%；道指狂拉近600点，波音大涨14%…重要消息还有这些 欺诈造假,证券时报网
1982,2020-06-29,【提前看】29日公告精选：兆易创新子公司卖出全部中芯国际H股；江南高纤控股股东拟减持不超6%股权,e公司
1983,2020-06-29,农林牧渔行业周报：关注种业政策催化机会及养殖股业绩释放行情,新浪
1984,2020-06-29,招商农业周报第一百零五期（6.22-6.28）—生猪板块情绪回暖，龙头再迎布局良机,金猪十年招商农业
1985,2020-06-29,温氏股份首个“5G+智慧农牧平安猪场”正式启动,e公司
1986,2020-06-29,【方正农业】2020中报前瞻：猪鸡养殖或现分化，后周期板块迎明显复苏,一胜农业
1987,2020-06-28,中泰金工可转债发行跟踪周报(0628),微信
1988,2020-06-28,下周操盘攻略：A股再迎“打新潮”，全球重磅数据周来临,Wind
1989,2020-06-28,本周8家上市公司发布可转债预案，融资总规模达170.82亿元,Wind
1990,2020-06-24,温氏股份(300498.SZ)：终止第二期限制性股票激励计划 股权激励异常,格隆汇
1991,2020-06-24,温氏股份(300498.SZ)：拟向云浮市云安区鲲鹏小学捐赠7000万元现金,格隆汇
1992,2020-06-24,温氏股份(300498.SZ)拟发行不超98.75亿元可转债29.62亿元用于补充流动资金,格隆汇
1993,2020-06-24,温氏股份：拟公开发行不超过98.75亿元可转债,e公司
1994,2020-06-24,温氏股份：公司终止第二期限制性股票激励计划 股权激励异常,Wind
1995,2020-06-24,"温氏股份现2笔大宗交易 共成交3,883.75万元",新浪
1996,2020-06-24,农林牧渔行业投资策略报告：后周期反转 加强关注2C端爆发式增长,新浪
1997,2020-06-24,农林牧渔行业2020年中期策略报告：猪价高位运行 看好饲料龙头份额持续提升,广发证券
1998,2020-06-24,上证综指温和收升0.3%创业板指连涨9日，明星股继续批量刷新新高,Wind
1999,2020-06-24,温氏股份(300498.SZ)：拟发行不超30亿元公司债,格隆汇
2000,2020-06-23,【国君农业】行业周报： 继续看好养殖、种植长期成长价值,农业凯歌
2001,2020-06-23,生猪养殖专题报告五十一：优质生猪养殖股未来会有哪些超预期？,新浪
2002,2020-06-23,创业板注册制首批名单出炉，”新一哥“要上位？外资持续加仓创业板龙头,证券时报网
2003,2020-06-23,【国君农业】行业周报：继续看好生猪链&农业消费品化,农业凯歌
2004,2020-06-22,温氏股份(300498.SZ)：约4311.61万股限制性股票6月24日解禁 解禁,格隆汇
2005,2020-06-22,温氏股份：占总股本0.65%限售股将于6月24日上市流通 解禁,Wind
2006,2020-06-22,温氏股份现1笔大宗交易 共成交372.86万元,新浪
2007,2020-06-22,猪肉股拉升，牧原股份、温氏股份纷纷上扬,Wind
2008,2020-06-22,农林牧渔行业周报：猪价重回高位 关注养猪板块的业绩兑现,新浪
2009,2020-06-20,生猪价格降了，养猪“ETF”生不逢时？,经济观察网
2010,2020-06-19,温氏股份现1笔大宗交易 共成交450.39万元,新浪
2011,2020-06-19,贵州关岭发展30万头生猪养殖项目,农产品期货网
2012,2020-06-18,"温氏股份现3笔大宗交易 共成交4,787.91万元",新浪
2013,2020-06-18,创业板50指数创四年新高，近一年涨幅超76%,魔都资产管理人
2014,2020-06-18,5月出栏量环比提升， 价格触底反弹,中信建投证券研究
2015,2020-06-17,"温氏股份现2笔大宗交易 共成交1,611.29万元",新浪
2016,2020-06-17,超级猪周期完结？养猪ETF遭遇生猪连环降价，猪企决战下半年,21世纪经济报道
2017,2020-06-17,补锅式举牌华统股份 温氏资本积极押宝A股产业链公司,上证报
2018,2020-06-17,华统股份：温氏资本持股比例重回5%,中证网
2019,2020-06-17,溢多利（300381）：专注研发创新的生物技术隐形冠军，“替抗”业务迎来高增长！【天风农业】,吴立话农业牛股
2020,2020-06-16,国内首只养猪ETF上报，聚焦养猪龙头上市企业,资本邦
2021,2020-06-16,基金早班车|“爆款”闪电售罄卖超200亿 高管变更频繁任期最短仅1个多月,金融界
2022,2020-06-16,业绩与股价齐飞 畜禽养殖产业链机会凸显,大众证券报
2023,2020-06-16,"看好二师兄？""养猪""ETF来了",中国基金报
2024,2020-06-15,主题性愈发减弱，个股趋势性操作,财经
2025,2020-06-15,生猪养殖家庭农场来了，“二师兄”迎拐点,Wind
2026,2020-06-15,【国君农业】行业周报：继续看好生猪板块长期成长价值,农业凯歌
2027,2020-06-15,农林牧渔行业周报：5月农产品同比涨幅继续回落 对CPI压力减弱,新浪
2028,2020-06-12,消费行业日报：吉林三部门联合发出《通知》规范设施农业用地管理,新浪
2029,2020-06-12,A股走出独立行情，北上尾盘出逃，11张图看清市场真相,Wind
2030,2020-06-11,分红比不过股价跌速！温氏股份巨量暴跌压垮农业板块 连续下跌,重庆商报
2031,2020-06-11,新希望、温氏股份、牧原股份持续走软，农林牧渔股整体低迷,Wind
2032,2020-06-11,猪肉股疲软，温氏股份、新希望、唐人神等纷纷下跌,Wind
2033,2020-06-11,猪肉持续降价 温氏等猪企收入下滑 盈利能力下降,广州日报
2034,2020-06-10,农林牧渔行业中期策略：继续首推海大集团 生猪养殖仍有配置价值,新浪
2035,2020-06-09,债券重大事件2020年6月9日星期二,Wind
2036,2020-06-09,消费行业日报：新希望生猪销售持续高增长 推荐关注生猪养殖板块,新浪
2037,2020-06-09,温氏股份：“17温氏02”回售金额为19.76亿元,Wind
2038,2020-06-09,温氏股份现1笔大宗交易 共成交550.69万元,新浪
2039,2020-06-08,温氏股份现1笔大宗交易 共成交960.08万元,新浪
2040,2020-06-08,农林牧渔行业周观点：猪价继续回暖 牧原5 月出栏增速领先,新浪
2041,2020-06-08,大宗商品行业周报：全球复工预期渐浓 大宗商品整体预计上行,新浪
2042,2020-06-06,三大逻辑支撑农林牧渔板块年内大涨，9只个股被QFII加持,Wind
2043,2020-06-05,温氏股份(300498.SZ)5月肉猪销售收入环比降8.18% 同比升7.07% 盈利能力下降,格隆汇
2044,2020-06-04,温氏股份：5月肉猪销售收入34.69亿元,e公司
2045,2020-06-04,温氏股份：5月肉鸡销售收入环比下降12.28%，均价环比下降16.78% 盈利能力下降,Wind
2046,2020-06-04,AGRICULTURE：PORK PRICE HIKE IN PEAK SEASON STARTS EYE ON COMPANIESWITH GROWTH AND REALIZATION OF PERFORMANCECOMMITMENTS,Sina
2047,2020-06-04,分红潮再次来临：8家高送转，百元牛股藏其中,Wind
2048,2020-06-03,温氏股份(300498.SZ)年报推10转2派10元 股权登记日6月10日,格隆汇
2049,2020-06-02,"温氏股份现1笔大宗交易 共成交1,109.40万元",新浪
2050,2020-06-02,【方正农业】湘佳股份深度报告：十年深耕，从默默无闻到冰鲜行业龙头,一胜农业
2051,2020-06-01,东兴证券大消费组周观点5月第5期：两会提振消费领涨 继续看好休闲服务及可选消费品复苏,新浪
2052,2020-06-01,温氏股份发生大宗交易 成交折价率11.43%,证券时报网
2053,2020-06-01,屠宰肉制品行业专题报告：周期的重塑与屠宰肉制品历史机遇,新浪
2054,2020-06-01,温氏股份：将“17温氏02”后2年的票面利率由4.87%下调至3%,Wind
2055,2020-06-01,温氏股份现1笔大宗交易 共成交499.59万元,新浪
2056,2020-06-01,农林牧渔2020年第22周周报：继续推荐刚需属性的农业板块！,新浪
2057,2020-06-01,创业板指紧扣产业转型升级，市值十年增十倍,证券时报
2058,2020-05-31,继续推荐刚需属性的农业板块！【天风农业】,吴立话农业牛股
2059,2020-05-29,农林牧渔行业投资策略报告：猪价旺季上涨启动 关注成长、业绩兑现,新浪
2060,2020-05-29,【国君农业】行业周报：继续推荐养殖链，看好细分行业龙头,农业凯歌
2061,2020-05-28,华统股份(002840)调研简报：屠宰主业受益生猪后周期 后继养殖再增盈利贡献,国海证券
2062,2020-05-28,温氏股份：未来公司在直播平台、直播内容等都将有更多尝试,Wind
2063,2020-05-28,温氏股份：未来公司在直播平台、直播内容等都将有更多尝试,e公司
2064,2020-05-27,消费行业日报-两部门：聚焦主导产业推进农业产业强镇建设,新浪
2065,2020-05-27,20股获券商买入评级 金达威目标涨幅达39.61%,Wind
2066,2020-05-27,“公司+农户”模式持续迭代升级,中证报
2067,2020-05-26,引资本扩产能 牧原股份难解投资者疑虑,北京商报
2068,2020-05-26,华泰证券：三季度临近，猪价可能出现一定程度的反弹,Wind
2069,2020-05-25,温氏股份现1笔大宗交易 共成交266.29万元,新浪
2070,2020-05-25,为何资本这么喜欢“二师兄”？价格回调依然暴赚,上证报
2071,2020-05-25,农林牧渔行业周报：2C端快速增长 关注圣农发展、雪榕生物、湘佳股份,新浪
2072,2020-05-25,农业周报：生猪价格周环比大涨9% 散养户补栏积极性锐减,新浪
2073,2020-05-24,【方正农业】政府工作报告关注了哪些三农问题？,一胜农业
2074,2020-05-24,两会释放哪些农业信号?【天风农业】,吴立话农业牛股
2075,2020-05-22,温氏股份(300498.SZ)：可申请解锁的限制性股票达3593.008万股,格隆汇
2076,2020-05-20,消费行业日报：中南六区非洲猪瘟分区防控试点工作深入推进,新浪
2077,2020-05-20,温氏股份现1笔大宗交易 共成交227.96万元,新浪
2078,2020-05-20,41股获券商买入评级，日月股份目标涨幅达59.82%,Wind
2079,2020-05-19,消费行业日报：唐人神拟10.2亿元投建甘谷50万头生猪养殖项目,新浪
2080,2020-05-19,消费行业日报：农业农村部发布“三夏”农机跨区作业应急处置方案,新浪
2081,2020-05-19,温氏股份：已和多家第三方在线购物平台合作，也在尝试直播带货等新销售方式,Wind
2082,2020-05-19,2020年5月第三期周报大消费组周观点：可选消费环比改善持续 关注线下消费回暖,新浪
2083,2020-05-18,总体投苗减少 温氏股份4月肉猪销售量同比下降54% 盈利能力下降,北京商报网
2084,2020-05-18,温氏股份发生大宗交易 成交折价率12.35%,证券时报网
2085,2020-05-18,温氏股份现1笔大宗交易 共成交264.07万元,新浪
2086,2020-05-18,农产品行业-生猪养殖专题报告四十七：当前时点如何看猪价？,新浪
2087,2020-05-18,头部房企跨界布局猪养殖生态链 两月新增4万家相关企业万亿市场待掘金,长江商报
2088,2020-05-17,短期猪价下行，农业板块投资机会怎么看？【天风农业】,吴立话农业牛股
2089,2020-05-17,【国君农业】行业周报：继续推荐生猪与种业 看好细分行业龙头,农业凯歌
2090,2020-05-16,上市猪企谈猪价：短期内回落，但仍将处在相对高位,Wind
2091,2020-05-14,万科牌猪肉要来了！养多少头猪 才能成就一个万科,中国新闻周刊
2092,2020-05-14,地产商争念养猪经,财经国家周刊
2093,2020-05-13,猪产业添搅局者：温氏股份子公司举牌华统股份,每日经济新闻
2094,2020-05-13,生猪养殖行业专题报告：生猪价格仍处于高位，建议关注龙头,新浪
2095,2020-05-13,生猪价格跌破15元，猪周期景气高峰已过？,Wind
2096,2020-05-13,消费行业日报：2019年全国农产品网络零售额达3975亿元,新浪
2097,2020-05-13,获温氏股份举牌，华统股份开盘涨近5%！,格隆汇
2098,2020-05-13,温氏投资举牌华统股份 双方战略合作再进一步,上证报
2099,2020-05-12,温氏股份第11届中国上市公司投资者关系天马奖寄语,证券时报网
2100,2020-05-12,多地猪价跌破30元大关，最强猪周期拐点来了？养猪龙头公司这样看,证券时报
2101,2020-05-12,超强周期提升产业集中度猪价下行拐点已现？,证券时报
2102,2020-05-11,从“量跌价升”到“量价齐跌”的猪肉板块，后市如何看？,第一财经
2103,2020-05-11,【国君农业】猪价阶段性拐点有望显现，看好养殖链,农业凯歌
2104,2020-05-10,卖房不如养猪：万科养猪引争议 养猪玩家有哪些？,中新网
2105,2020-05-10,粤开策略专题研究| 业绩洼地显现，边际改善正在路上—年报季报点评,微信
2106,2020-05-10,继续重点推荐农业板块！【天风农业】,吴立话农业牛股
2107,2020-05-09,“二师兄”还能飞多久？万科“对养猪充满热情”，但这一数据却暗藏玄机,Wind
2108,2020-05-09,卖房的干不过养猪的？万科招本科“猪倌”,金融界
2109,2020-05-09,生猪价格下跌，养猪企业4月销量跑赢收入增速,Wind
2110,2020-05-08,万科养猪惹网友调侃，为何马云王健林等大佬都热衷养猪,中国商报
2111,2020-05-08,人人都爱“二师兄”，万科“出圈”养猪，这项事业王健林曾放弃过,时代在线
2112,2020-05-08,郁亮也要当“猪倌”了，万科现在养猪还来得及吗？,中新经纬
2113,2020-05-08,郁亮当“猪倌” 万科贪图肉贵还是想圈地？,新浪
2114,2020-05-07,“猪周期”还能持续多久？肉价已创年内新低,Wind
2115,2020-05-07,温氏股份：4月出栏环比增长 公司估值优势明显,第一财经
2116,2020-05-07,财报窗口期 行业配置的蛛丝马迹,太平桥策略随笔
2117,2020-05-07,101股获券商买入评级，太阳纸业目标涨幅达73.44%,Wind
2118,2020-05-07,核心资产净利润占A股近两成整体回报率超九成A股,证券时报
2119,2020-05-06,"温氏股份现1笔大宗交易 共成交1,632.60万元",新浪
2120,2020-05-06,温氏股份(300498.SZ)：监事何维光减持期届满 未减持公司股份,格隆汇
2121,2020-05-06,温氏股份：监事何维光没有实施减持,Wind
2122,2020-05-06,申万宏源研究谈一季报和2019年报：疫情冲击下，14行业景气度较高,新浪
2123,2020-05-06,超级猪周期风口动能弱减： 4月销售均价小幅下滑，上市猪企二季度利润增速同比放缓 盈利能力下降,21世纪经济报道
2124,2020-05-06,上市公司正负面新闻2020年5月6日星期三,Wind
2125,2020-05-05,温氏股份4月毛猪销售均价33.24元/公斤，环比降逾5% 盈利能力下降,澎湃新闻
2126,2020-05-05,温氏股份(300498.SZ)4月肉鸡、肉猪销售收入同比分别升18.44%、21.95%,格隆汇
2127,2020-05-05,晚间重要公告2020年5月5日星期二,Wind
2128,2020-05-05,温氏股份：4月销售肉猪收入环比增长3.62% 价格下滑5.65%,e公司
2129,2020-05-05,温氏股份：4月销售肉猪收入37.78亿元同比增21.95%，环比则增长3.62%,Wind
2130,2020-04-30,【国君农业】行业周报：生猪加快规模化 玉米种子迎周期拐点,农业凯歌
2131,2020-04-30,69家公司获机构调研（附名单）,证券时报
2132,2020-04-30,中信建投：今年生猪价格将维持高位运行，5-6月或迎来反弹,Wind
2133,2020-04-30,发挥龙头作用 上市公司多措并举践行扶贫责任,中证网
2134,2020-04-30,证券时报头版：受疫情影响，一季度上市公司营收盈利显著下滑,Wind
2135,2020-04-29,“两桶油”刷新A股亏损记录：一季度均亏超150亿 亏损,第一财经
2136,2020-04-29,猪肉价格连续10周下降！养“二师兄”的公司还能赚钱吗？,中国财富网
2137,2020-04-29,61家公司获机构调研（附名单）,证券时报
2138,2020-04-29,陆家嘴财经早餐2020年4月29日星期三,Wind
2139,2020-04-28,北向资金连续5日净流入，立讯精密获净买入4.58亿元居首,Wind
2140,2020-04-28,牧原股份兽医总监年薪507万 正邦科技董秘涨薪一万五,21世纪经济报道
2141,2020-04-28,创业板改革启动 谨防成为“科创板第二”,新浪
2142,2020-04-28,养猪业跳槽指南：牧原股份兽医总监年薪507万，正邦科技垫底董秘涨薪一万五,21世纪经济报道
2143,2020-04-28,一季度净利暴增38倍！湖南这家养猪企业“闷声发大财” 一头猪挣约1800元,搜狐
2144,2020-04-28,48家公司获机构调研（附名单）,证券时报
2145,2020-04-28,生猪期货提供套保工具 猪企扩张也疯狂,时代在线
2146,2020-04-27,温氏股份：预计今年公司的养鸡业务还会保持稳健增长,Wind
2147,2020-04-27,[公司]温氏股份：非洲猪瘟防控整体往好的方向前进,全景网
2148,2020-04-27,306股获券商买入评级，安车检测目标涨幅达78.06%,Wind
2149,2020-04-27,南温氏东立华 湘佳股份缘何成为黄羽肉鸡养殖行业“中神通”,证券市场周刊
2150,2020-04-26,暴增38倍！唐人神一季度净利超去年全年 “养猪的都挣大钱”,中证报
2151,2020-04-26,鸡猪双引擎、生产端一体化驱动业绩创新高 温氏股份全链条“肉蛋白航母”起航,每日经济新闻
2152,2020-04-25,温氏股份：目前公司核心种猪群约1万多头，祖代种猪存栏7万头左右,Wind
2153,2020-04-25,“猪肉第一股”300亿市值解禁 “资本剩宴”后还剩多少肉？ 解禁,金融界
2154,2020-04-25,粮食危机来了？粮油涨 猪肉涨 这些公司赚翻了（机会解析）,红周刊
2155,2020-04-25,新证券法催热董责险，4月份19家上市公司发布投保方案,Wind
2156,2020-04-24,拆财报｜猪价走强驱动温氏股份营收、净利大涨，出栏量隐患不容忽视,21世纪经济报道
2157,2020-04-24,[路演]温氏股份：一季度受新冠肺炎疫情的影响 公司毛鸡售价同比下降15.33%,全景网
2158,2020-04-24,[路演]温氏股份：公司猪出栏量下降是暂时的阶段性的,全景网
2159,2020-04-24,[路演]温氏股份：公司判断非洲猪瘟在行业将会有很长一段时间的存在,全景网
2160,2020-04-24,想发家致富吗？养猪！生猪养殖企业一季度赚翻了！,中新网
2161,2020-04-24,养猪到底有多赚钱？温氏股份不到3天就挣一个亿,中新经纬
2162,2020-04-24,养猪！“自行车换兰博基尼，真的不是梦”？,搜狐
2163,2020-04-24,肉鸡、肉猪销量上升 温氏股份2019年归母净利增超两倍,证券日报
2164,2020-04-24,A股早报2020年4月24日星期五,Wind
2165,2020-04-23,温氏股份：外资持股比例创新高 一季度加快新产能建设,上证报
2166,2020-04-23,温氏股份2019年收入增长27.75%,北京商报
2167,2020-04-23,晚间要闻2020年4月23日星期四,Wind
2168,2020-04-23,业绩说明会|农尚环境、雪浪环境、诚迈科技、温氏股份等25家上市公司2019年度业绩说明会4月24日在全景·路演天下举行,全景网
2169,2020-04-23,温氏股份：一季度净利润18.92亿 去年同期亏损4.6亿 亏损,新浪
2170,2020-04-23,温氏股份：2019年实现净利润139.67亿元 同比增252.94%,中证网
2171,2020-04-23,温氏股份2019年净利增长253% 外资持股占比持续上升,e公司
2172,2020-04-23,温氏股份(300498.SZ)2019年度净利润升252.94%至139.67亿元 拟10转2派10元,格隆汇
2173,2020-04-23,温氏股份：2019年净利润同比增长252.94%，拟10转2派10元,Wind
2174,2020-04-23,温氏股份：2019年净利同比增253% 拟10转2派10元,e公司
2175,2020-04-23,温氏股份(300498.SZ)一季度业绩扭亏为盈至18.92亿元,格隆汇
2176,2020-04-23,温氏股份：净利润18.92亿元去年同期亏损4.6亿元 亏损,格隆汇
2177,2020-04-22,温氏股份大宗交易成交217.53万元,证券时报网
2178,2020-04-22,A股共发生56宗大宗交易成交9.35亿元（4月22日）,Wind
2179,2020-04-22,统计局发布一季度生产数据 机构重点推荐高成长公司,中国财富网
2180,2020-04-20,【建投专题】养殖产业化步入快车道，猪企扩张大不同,CFC农产品研究
2181,2020-04-17,上市公司一季度理财规模骤减，是产品“赶客”还是“囊中羞涩”？,Wind
2182,2020-04-16,华安基金苏卿云：创业板商誉和股权质押缓解 看好科技成长指数,新浪
2183,2020-04-16,【国盛策略|季报前瞻】业绩大幅下滑，哪些行业具备较强韧性？ 盈利能力下降,尧望后势
2184,2020-04-16,收藏！一季度扭亏王股票名单出炉！,金融界
2185,2020-04-16,逾1600股预告一季度业绩近七成预忧,证券时报
2186,2020-04-15,8家猪企一季度利润近百亿，二师兄身价仍在高位,时代在线
2187,2020-04-14,温氏股份大宗交易成交7.45万股成交额208.67万元,证券时报网
2188,2020-04-14,温氏股份现1笔大宗交易 共成交208.67万元,新浪
2189,2020-04-14,温氏股份一季度预盈近19亿 养猪业务大增助力同比扭亏,长江商报
2190,2020-04-14,上市猪企一季度利润暴增4.5倍，“超级猪周期”拐点何时至？,Wind
2191,2020-04-14,上市猪企 一季度利润暴增4.5倍 猪价回调“超级猪周期”拐点将至？,21世纪经济报道
2192,2020-04-13,【招商策略】2020Q1创业板业绩转为负增长——2020Q1创业板业绩预告点评（0413） 盈利能力下降,招商策略研究
2193,2020-04-13,温氏股份一季度肉猪售价涨两倍,农产品期货网
2194,2020-04-13,创业板一季度业绩大幅回落，重要拐点或已现,证券时报网
2195,2020-04-13,突发闪崩跌停！利空云集击倒一批股票 连续下跌,中国基金报
2196,2020-04-13,上证指数午盘跌0.33%，RCS概念偃旗息鼓,Wind
2197,2020-04-13,最差财报来袭？最惨跌超64倍！这些公司业绩却翻倍,中国基金报
2198,2020-04-13,猪肉股集体下挫，正邦科技逼近跌停,Wind
2199,2020-04-13,3月猪价回调 保供稳价措施显现效果,广州日报
2200,2020-04-12,继续重点推荐生猪养殖板块：一季度盈利继续兑现，二季度有望环比高增长！【天风农业】,吴立话农业牛股
2201,2020-04-12,创业板一季报提前看 43股预盈超亿元,北京商报
2202,2020-04-12,中信证券：积极配置，迎接市场拐点确认,Wind
2203,2020-04-10,4月10日晚间上市公司十大重磅公告,巨丰财经
2204,2020-04-10,牧原股份一季度预盈超40亿2020年红利期会否持续？,经济观察报
2205,2020-04-10,温氏股份：“17温氏01”回售总金额约2877.69万元,Wind
2206,2020-04-10,公告点题｜4月10日这些公告有看头,第一财经
2207,2020-04-10,温氏股份(300498.SZ)预计一季度扭亏为盈 预盈18.92亿-18.97亿元,格隆汇
2208,2020-04-10,温氏股份：一季度预计盈利18.92亿元至18.97亿元,e公司
2209,2020-04-10,温氏股份：生猪价格同比大幅上涨，一季度预盈18.92亿-18.97亿元,Wind
2210,2020-04-10,牧原股份：3月生猪销量同比增长，2020年有望迎量价齐升？,搜狐
2211,2020-04-10,“赌徒”天邦股份：6年资本支出37亿营业利润1.89亿 存栏数据混乱定增未来模糊,中国网
2212,2020-04-10,华统转债——区域屠宰龙头，拓展生猪养殖,债券池
2213,2020-04-09,养殖业风光独好？还仅仅是猪的“独角戏”,Wind
2214,2020-04-09,67股获券商买入评级 皮阿诺目标涨幅达69.65%,Wind
2215,2020-04-08,3月销售数据亮丽，养殖企业一季度业绩很肥美,Wind
2216,2020-04-07,多家上市猪企披露3月销售情况：销售量及收入增加，售价下降,澎湃新闻
2217,2020-04-07,博弈猪肉板块需知的几条逻辑！,和讯
2218,2020-04-07,牧原股份一季度预盈40亿 市值超越养猪龙头温氏股份,新京报
2219,2020-04-07,晚间重要公告2020年4月7日星期二,Wind
2220,2020-04-07,四家猪企先后披露3月销售情况，谁家猪卖得最贵？,新京报
2221,2020-04-07,温氏股份3月肉猪、肉鸡收入均同比上升,新京报
2222,2020-04-07,温氏股份3月份肉猪销售收入同比增长12.22%,金融界
2223,2020-04-07,温氏股份：3月肉猪销售收入环比增长49.43%,e公司
2224,2020-04-07,温氏股份：3月肉猪销售收入36.46亿元，同比增长12.22%,Wind
2225,2020-04-07,温氏股份现1笔大宗交易 共成交206.84万元,新浪
2226,2020-04-07,北上资金百亿扫货，两大板块已提前锁定,Wind
2227,2020-04-06,【国君农业】行业周报：鸡猪共振 周期景气仍在上行,农业凯歌
2228,2020-04-03,温氏股份现1笔大宗交易 共成交245.60万元,新浪
2229,2020-04-02,2019净利猛增近200%新希望养猪“大跃进”,时代周报
2230,2020-04-01,温氏股份：“17温氏01”持有人会议审议通过相关议案,Wind
2231,2020-03-31,北上资金活跃股名单(3月31日),证券时报网
2232,2020-03-31,北向资金净流入16.5亿元，今日净买入贵州茅台12.25亿元,Wind
2233,2020-03-31,“猪中茅台”成中小板龙头！猪肉股迎“第二春”,Wind
2234,2020-03-30,【东兴大消费】周观点3月第5期：国内疫情逐步好转，消费复苏在即,东兴社服
2235,2020-03-27,【国君农业】行业周报：继续看好生猪产业 关注粮食涨价机会,农业凯歌
2236,2020-03-26,"温氏股份现1笔大宗交易 共成交2,501.20万元",新浪
2237,2020-03-26,中央储备猪肉又来了！养猪大省产能恢复提速,中投网
