3009,2019-06-17,金龙鱼要上市创业板！去年净赚55亿力压温氏股份，3个月完成辅导，创始人是96岁新加坡首富！,e公司
3010,2019-06-17,"农林牧渔行业:猪价创年内新高,鸡苗价格遭遇腰斩",东北证券
3011,2019-06-14,北上资金活跃股名单(6月14日),证券时报网
3012,2019-06-14,北向资金结束连续8日净流入局面 温氏股份遭净卖出3.56亿元,证券时报网
3013,2019-06-14,北向资金今日净流出逾16亿元，温氏股份遭净卖出超3亿元,Wind
3014,2019-06-14,温氏股份(300498.SZ)：监事伍政维已累计减持53.6968万股 减持股份,格隆汇
3015,2019-06-14,温氏股份：监事减持计划时间过半，累计减持0.01%公司股份 减持股份,Wind
3016,2019-06-13,温氏股份：目前各区域肉猪价格分化，下半年肉价有一定上涨空间,Wind
3017,2019-06-13,生猪存栏降幅扩大 供需缺口引发猪价上行 6股飞,证券时报
3018,2019-06-12,温氏股份(300498.SZ)：减持计划已完成 高管罗旭芳及林建兴已减持40万股 减持股份,格隆汇
3019,2019-06-12,温氏股份：高管罗旭芳减持20万股,金融界
3020,2019-06-12,A股共发生43宗大宗交易成交9.74亿元（6月12日）,Wind
3021,2019-06-12,温氏股份：2名高管减持计划实施完毕，合计减持0.008%公司股份 减持股份,Wind
3022,2019-06-12,温氏股份今日大宗交易成交6万股，成交价38.87元折价0.0%,Wind资讯
3023,2019-06-11,温氏股份：拟收购京海禽业80%股权，战略切入白羽肉鸡行业,证券时报网
3024,2019-06-11,日常消费品：继续推荐畜禽养殖板块 荐7股,财信证券
3025,2019-06-11,北向资金连续五天净流入 继续大举扫货金融股,投资快报
3026,2019-06-11,猪价加速上涨开启六股雄起,中财网
3027,2019-06-11,A股“养猪佬”硬刚“猪周期”,斑马消费
3028,2019-06-10,【光大农业&中小盘】周期验证——农林牧渔行业2019年下半年投资策略,i研究
3029,2019-06-10,"温氏股份6.4亿收购京海禽业三疑问 ""杀鸡""为何用牛刀",新浪
3030,2019-06-10,北上资金疯狂扫货，早盘净买入逾70亿元,Wind
3031,2019-06-09,A股龙头大PK：百强龙头贡献A股近五成市值（附名单）,证券时报
3032,2019-06-09,A股美股估值比较：市盈率中位数是美股两倍，破净股只有三分之一,证券时报
3033,2019-06-09,多重利好刺激下，质优龙头股站上投资风口,红周刊
3034,2019-06-08,本周11家上市公司发布可转债预案 融资总规模达116.50亿元,Wind
3035,2019-06-07,产品涨价预期激活农业股股性,红周刊
3036,2019-06-06,深交所披露5月深股通交易情况，美的集团遭净卖出39亿元居首,Wind
3037,2019-06-06,34股获券商买入评级 智飞生物目标涨幅达68.82%,Wind
3038,2019-06-06,温氏股份：未来会向北方发展白羽肉鸡养殖业务,中金在线
3039,2019-06-05,温氏股份 （300498.SZ）—— 收购乃双方共同诉求，温氏开启白羽鸡产业布局,金猪十年招商农业
3040,2019-06-05,温氏股份：拟收购京海布局白鸡，禽业龙头地位夯实,证券时报网
3041,2019-06-05,A股早报2019年6月5日星期三,Wind
3042,2019-06-05,温氏股份收购京海禽业 进军白羽鸡行业,中证报
3043,2019-06-04,A股头条之上市公司公告精选（6.5）,金融界
3044,2019-06-04,温氏股份：拟6.4亿元购买江苏京海禽业80%股权,Wind
3045,2019-06-04,温氏股份：5月商品肉猪销售收入超32亿元，环比增4.58%,第一财经
3046,2019-06-04,温氏股份：5月商品肉猪销售收入环比增4.58%,Wind
3047,2019-06-04,"农业周报:南方地区抛售接近尾声,猪价上涨;龙头企业传达积极信心",申万宏源
3048,2019-06-03,影响5000亿大消息！这些重磅指数调仓换股：康美康得新全被剔除了,中国基金报
3049,2019-06-02,日常消费品：抛售接近尾声 广东与东北猪价启动上涨,广发证券
3050,2019-06-02,日常消费品：非瘟重构养殖防控模式 荐7股,广发证券
3051,2019-05-31,猪肉价格将继续步入快速上涨通道六股值得关注,中财网
3052,2019-05-30,关注优质养殖行业龙头 五股业绩向好掘良机,中证报
3053,2019-05-29,MSCI扩容落地,21世纪经济报道
3054,2019-05-28,A股尾盘暴力拉升！北上资金杀回马枪，10分钟净流入56亿，这26只个股“涨姿势”,e公司
3055,2019-05-28,猪肉股直线拉升，温氏股份等多股涨超5%,Wind
3056,2019-05-27,日常消费品：猪价上涨日益临近 荐13股,申万宏源
3057,2019-05-27,【研报精读】温氏股份（300498.SZ）,联讯金融
3058,2019-05-24,沪指周线五连阴，北上资金持续撤离，券商激辩后市走向,第一财经
3059,2019-05-24,央行重磅发声A股市场否极能否泰来,证券时报
3060,2019-05-24,北上资金调仓加码中盘蓝筹股,投资快报
3061,2019-05-23,温氏股份(300498.SZ)拟每10股派5元 股权登记日为5月30日,格隆汇
3062,2019-05-23,A股共发生36宗大宗交易成交8.81亿元（5月23日）,Wind
3063,2019-05-23,温氏股份：预计今年猪肉价格下半年会好于上半年,Wind
3064,2019-05-23,A股早报2019年5月23日星期四,Wind
3065,2019-05-22,[路演]温氏股份：暂时闲置的流动资金用于理财 有利于提高资金收益水平,全景网
3066,2019-05-22,北上资金新动向：卖出高价股，买入低价股,Wind
3067,2019-05-22,A股早报2019年5月22日星期三,Wind
3068,2019-05-21,北上资金连续4日净流出，调仓换股迹象明显，机构建议关注这些板块,第一财经
3069,2019-05-21,"农林牧渔行业农业周报:南方地区抛售压制猪价,农业部能繁母猪存栏量环比降幅扩大",申万宏源
3070,2019-05-20,[快讯]温氏股份3669万限售股5月22日解禁 解禁,中财网
3071,2019-05-20,温氏股份(300498.SZ)3686.79万股股权激励限售股5月22日解锁,格隆汇
3072,2019-05-20,温氏股份：3686.79万股限售股解禁 解禁,Wind
3073,2019-05-20,【国君金工】沪深300成分股调整名单与冲击成本预测,辰奥临君
3074,2019-05-20,温氏股份净利腰斩新增借款15亿 将养殖户46亿押金理财牟利遭质疑 盈利能力下降,长江商报
3075,2019-05-17,温氏股份：肉猪成本略有上升，预计猪价下半年好于上半年,第一财经
3076,2019-05-17,温氏股份：目前饲料成本较去年四季度略有下降,e公司
3077,2019-05-16,【中信建投金融工程】MSCI扩容A股超预期，创业板成分增加冲击显著,鲁明量化全视角
3078,2019-05-15,MSCI扩容名单出炉 创业板成为重头戏(附股),投资快报
3079,2019-05-15,增至10% A股入摩权重翻倍,北京商报
3080,2019-05-14,18只创业板股纳入MSCI指数 这6只被超百家基金追捧（附名单）,每日经济新闻
3081,2019-05-14,“人造肉”Beyond Meat是一家怎样的公司？,金融界
3082,2019-05-14,18只“创蓝筹”首度亮相！市场波动不影响MSCI扩容决策,第一财经
3083,2019-05-14,重磅！MSCI如期扩容 18只创业板股首次纳入！1600亿资金来了 北上资金已“抢跑”！（附名单）,证券时报
3084,2019-05-14,MSCI公布A股扩容第一阶段的新纳个股：18只创业板大盘A股上榜,华福小福牛
3085,2019-05-14,盘前重磅！MSCI官宣，A股权重扩容由5%到10%，新增纳入26股中文名单来了！18只创业板股，4000亿增量资金候场,券商中国
3086,2019-05-14,MSCI公布A股扩容名单 温氏股份等18只创业板股票首度纳入,中证网
3087,2019-05-14,宁德时代等109只个股新增入MSCI中国A股在岸指数,Wind
3088,2019-05-14,MSCI：纳入的26只中国A股股票中，有18只来自创业板,Wind
3089,2019-05-14,“二师兄”持续涨价推高CPI,新京报
3090,2019-05-14,农业周报:持续推荐生猪养殖及白羽肉鸡养殖,申万宏源
3091,2019-05-13,招商农业周报第六十九期（05.06-05.12）把握市场主线，静待猪价上涨,金猪十年招商农业
3092,2019-05-09,75股获券商买入评级 建发股份目标涨幅达95.92%,Wind
3093,2019-05-09,北上资金节后3天净流出逾百亿 绩优+机构推荐+外资圈定7股,证券日报
3094,2019-05-08,日常消费品：出栏量持续增长 区域疫情导致价格涨幅分化,中信建投
3095,2019-05-08,股市上的“飞天猪”会回到凡间吗？,证券日报
3096,2019-05-06,温氏股份(300498.SZ)4月商品肉猪销售均价14.08元/公斤 同比上升40.66%,格隆汇
3097,2019-05-06,温氏股份等猪企4月销售收入同比大幅增长 猪价环比走高,e公司
3098,2019-05-06,公告精选：多家公司披露回购进展；温氏股份4月商品肉猪销售收入同比增长33%,e公司
3099,2019-05-06,温氏股份：4月商品肉猪销售收入30.98亿元 同比增长33%,e公司
3100,2019-05-06,温氏股份：4月份肉猪销售均价14.08元/公斤，环比涨0.43%,Wind
3101,2019-05-06,温氏股份：股东叶京华已经减持143.2万股 减持股份,Wind
3102,2019-05-06,温氏股份：行业供给缺口将逐步显现 买入评级,广发证券
3103,2019-05-05,一季报尘埃已定，二季度养殖蓄势待发【天风农业】,吴立话农业牛股
3104,2019-05-05,日常消费品：持续看好禽板块 荐4股,方正证券
3105,2019-05-05,光大证券 | 五月金股电话会议纪要,超悦策略
3106,2019-05-02,光大策略 | 一季度盈利增速转正，低收入增速压制企业盈利能力 ——2018年年报及2019年一季报分析,超悦策略
3107,2019-05-01,最牛基金操盘术是这样的：顶住大盘回调 前四月赚63%,中证报
3108,2019-05-01,创业板盈利拐点确认，中游制造及TMT景气良好【国盛策略|财报分析】,尧望后势
3109,2019-04-30,为何说布局一只农业主题基金时不我待？,养基司令
3110,2019-04-30,温氏股份：公司高级管理人员拟减持10万股 减持股份,Wind
3111,2019-04-29,300多家一季度业绩亏损，这些上市公司发行的债券需防踩雷！,Wind
3112,2019-04-29,【农林牧渔行业】本周猪价开始反弹，供需缺口将逐步体现,格隆汇
3113,2019-04-28,本周猪价回升，如何看待当前的养殖板块？【天风农业】,吴立话农业牛股
3114,2019-04-26,温氏股份：公司高级管理人员股份减持实施完毕 减持股份,Wind
3115,2019-04-26,温氏股份：未来受益周期上行 买入评级,和讯
3116,2019-04-26,【农林牧渔-温氏股份(300498)】陈奇、潘振亚：生猪稳健扩张，周期反转在途-20190425,中泰证券研究所
3117,2019-04-26,"温氏股份动态跟踪报告:猪鸡双保险,龙头稳中赢",光大证券
3118,2019-04-25,【光大农业&中小盘|公司深度】温氏股份（300498.SZ）:猪鸡双保险，龙头稳中赢,i研究
3119,2019-04-25,温氏股份一季度亏损4.6亿 只是“黎明前的黑夜” 亏损,挖贝网
3120,2019-04-25,【策略*王杨】【基金2019Q1分析】配置逻辑：从衰退向复苏过渡,东吴研究所
3121,2019-04-25,猪肉板块直线拉升，温氏股份领衔上涨,Wind
3122,2019-04-25,二季度猪肉价格有望加速上涨 六股人气爆棚,证券时报网
3123,2019-04-25,温氏股份一季度亏4.6亿 1-2月业绩不佳3月有所改善 亏损,财富动力网
3124,2019-04-24,由于肉猪肉鸡销售价格下跌 温氏股份一季度亏损4.6亿元 亏损,中证网
3125,2019-04-24,上市公司晚间利空公告：温氏股份一季度亏损4.6亿元 亏损,金融界
3126,2019-04-24,温氏股份：因非洲猪瘟及猪价低迷，一季度净利下降逾130% 盈利能力下降,澎湃新闻
3127,2019-04-24,温氏股份一季度净利润下滑132.69% 盈利能力下降,北京商报网
3128,2019-04-24,温氏股份(300498.SZ)一季度由盈转亏4.6亿元 亏损,格隆汇
3129,2019-04-24,温氏股份：一季度亏损4.6亿元，上年同期盈利14.08亿元,Wind
3130,2019-04-24,19Q1基金持仓结构分析：总仓位大幅提升，一致性加仓消费,格隆汇
3131,2019-04-22,【广发策略】仓位进攻，加配景气确定性—主动偏股型基金19年Q1配置分析,戴康的策略世界
3132,2019-04-22,【华泰策略|基金仓位】食饮和农牧筹码集中度高，成长加配中,华泰策略研究
3133,2019-04-22,日常消费品：伴随猪周期预期上行 公募配置比例继续提升,广发证券
3134,2019-04-22,兵临3300点，北上资金调仓蓄势,中证报
3135,2019-04-21,14家百亿明星私募看中了这10家公司，王亚伟也亮相了,21世纪经济报道
3136,2019-04-21,北上资金动向：上周净流出8.2亿元，净买入12股，大举抛售五粮液,腾讯网
3137,2019-04-21,猪价何时再上涨？ 【天风农业】,吴立话农业牛股
3138,2019-04-19,"招商农业周报第六十三期:猪价、存栏、饲料端三重利好,助推板块持续上行",正点财经
3139,2019-04-18,这个板块竟成年内最大热门，最大黑马却是它,证券时报
3140,2019-04-18,温氏股份：预防非洲猪瘟约增加0.5元/斤的成本,Wind
3141,2019-04-18,温氏股份：预防非洲猪瘟约增加0.5元/斤的成本,e公司
3142,2019-04-18,猪肉价格下半年预期大涨 猪肉概念股价格怎么走？,第一财经
3143,2019-04-17,猪又飞了，温氏股份撬动创业板上涨，猪价下半年或同比上涨超70%,21世纪经济报道
3144,2019-04-17,养殖业股价与业绩冰火两重天,中证报
3145,2019-04-16,4月上半月公募基金“摸底”53股 偏爱调研“TMT”行业,投资快报
3146,2019-04-15,温氏股份(300498.SZ)参股公司三角防务获准A股IPO,格隆汇
3147,2019-04-15,天风农业:坚守猪重视糖 盛享农业大周期,新浪
3148,2019-04-14,日常消费品：猪价小幅回调 荐7股,东北证券
3149,2019-04-12,上调评级至买入策略选股（4月12日）,Wind
3150,2019-04-12,"东北证券：将温氏股份评级调高为""买入""",Wind
3151,2019-04-12,东北证券：上调温氏股份评级至买入,Wind
3152,2019-04-12,138股获券商买入评级，顺网科技目标涨幅达95.99%,Wind
3153,2019-04-12,"温氏股份:猪周期有望迎来反转,鸡猪共舞在即",东北证券
3154,2019-04-11,受非洲猪瘟影响！温氏股份迎上市后首亏 这些公司也中招,中新经纬
3155,2019-04-11,国金策略：创业板2019年Q1净利润增速-14.96% 否极泰来,金融界
3156,2019-04-11,【国金策略】季报预告专题||创业板Q1-14.96%，否极泰来（李立峰/丁潇）,策略李立峰与行业配置笔记
3157,2019-04-11,华创证券：上调温氏股份评级至强推,Wind
3158,2019-04-11,日常消费品：出栏增长符合预期 荐8股,和讯
3159,2019-04-11,"华创证券：将温氏股份评级调高为""强推""",Wind
3160,2019-04-11,【农林牧渔-温氏股份(300498)】陈奇、潘振亚：出栏稳健扩张，周期反转在途-20190410,中泰证券研究所
3161,2019-04-11,中信建投晨会0411 | 核心布局房企当有为；进击的券商；格力电器、温氏股份,中信建投证券研究
3162,2019-04-11,温氏股份去年净利39.57亿同比降41% 董事长温志芬年薪509万,挖贝网
3163,2019-04-11,温氏股份首次预亏投资者可逢低介入猪肉股 预亏,重庆商报
3164,2019-04-11,"温氏股份2018年年报点评:猪鸡共振,等待猪周期反转",光大证券
3165,2019-04-10,[路演]温氏股份：增加肉猪成本0.5元/斤左右,全景网
3166,2019-04-10,日常消费品：猪价快速上涨渐行渐近 荐8股,和讯
3167,2019-04-10,温氏股份一季度亏超4亿，猪价回暖周期拐点渐至,21世纪经济报道
3168,2019-04-10,温氏股份去年净利下滑超四成 今年一季度再亏损近5亿 亏损,新京报
3169,2019-04-10,129股获券商买入评级 大亚圣象目标涨幅达85.81%,Wind
3170,2019-04-10,鸡猪双歇 温氏股份预计一季度亏损超4亿 预亏,每日经济新闻
3171,2019-04-10,"温氏股份2018年年报点评:猪跌鸡升业绩仍受拖累,周期反转凸显龙头优势",东莞证券
3172,2019-04-09,温氏股份收入稳定增长 养禽业务盈利再创新高,证券日报
3173,2019-04-09,温氏股份(300498.SZ)2018年净利降41.38%至39.57亿元 拟10派5元 盈利能力下降,格隆汇
3174,2019-04-09,温氏股份2018年实现净利39.57亿元 同比降41.38%,中金在线
3175,2019-04-09,温氏股份：2018年净利同比降41% 拟10派5元,金融界
3176,2019-04-09,温氏股份：向控股公司提供原料采购货款担保不超过38.12亿元 大额借贷担保,Wind
3177,2019-04-09,温氏股份(300498.SZ)预期一季度业绩盈转亏至4.58亿元—4.63亿元 预亏,格隆汇
3178,2019-04-09,温氏股份：2018年度净利润同比下降41.38％ 拟10派5元 盈利能力下降,金融界
3179,2019-04-09,温氏股份：2018年净利下滑41.38% 拟10派5 盈利能力下降,e公司
3180,2019-04-09,温氏股份：2018年净利下滑超4成，一季度预计亏损4.58亿-4.63亿元,Wind
3181,2019-04-09,温氏股份：龙头优势继续彰显 买入评级,和讯
3182,2019-04-08,猪周期已确立？仔猪价格率先领涨，机构预计猪价二季度或加速上涨,证券时报网
3183,2019-04-08,招商农业：预计8月仔猪价格较3月翻倍,金猪十年招商农业
3184,2019-04-07,如何看待二季度的猪价和股价？【天风农业】,吴立话农业牛股
3185,2019-04-05,龙头企业扩张不止 “猪倌”变“屠夫”,中国经营报
3186,2019-04-04,４月4日晚间上市公司十大重磅公告,巨丰财经
3187,2019-04-04,温氏股份：3月商品肉猪售价环比涨20.65%，同比涨27.80%,Wind
3188,2019-04-04,温氏股份(300498.SZ)3月份商品肉猪销售收入同比升23.40%,格隆汇
3189,2019-04-04,温氏股份：3月商品肉猪销量及均价均环比上升,证券时报网
3190,2019-04-04,温氏股份:目前有种猪存栏约140万头,金融界
3191,2019-04-02,猪肉股午后走低，天邦股份跌近6%,Wind
3192,2019-03-31,如何看待养猪公司2019Q1业绩预告？【天风农业】,吴立话农业牛股
3193,2019-03-31,日常消费品：猪价上涨放缓 荐6股,东北证券
3194,2019-03-30,基于历史的复盘——当前猪周期和股票处于什么位置？【天风农业】,吴立话农业牛股
3195,2019-03-30,机构称生猪养殖周期拐点显现 六股布局良机,证券时报
3196,2019-03-28,【中信期货】农产品专题：农产品价格周期性特征明显，今年股、期两端均可关注,中信期货微资讯
3197,2019-03-28,年报揭示持仓全景 多只基金捕获最牛板块,金融投资报
3198,2019-03-26,医疗保健：兽用生物制品明星企业,中信建投
3199,2019-03-25,申万宏源：免疫兽用生物制品龙头科前生物 与温氏股份等建立了长期合作关系,挖贝网
3200,2019-03-25,"农林牧渔行业:猪价震荡上涨,鸡苗毛鸡价格高位震荡",东北证券
3201,2019-03-22,猪用疫苗生产商科前生物科创板申请获受理 温氏股份是第一大客户,每日经济新闻
3202,2019-03-22,日常消费品：如何看待生猪养殖股价值 荐8股,和讯
3203,2019-03-20,"大盘差点被""猪""带到沟里，幸好地产神助攻，""炸板率""提升、成交量萎缩…盯紧市场五点变化",券商中国
3204,2019-03-19,7亿减持计划打趴东方通信 “10倍妖股”套现潮将至,21经济网
3205,2019-03-19,猪价连涨催热概念股 业内押注景气度超预期,21世纪经济报道
3206,2019-03-19,"农林牧渔:鸡产品加速涨价,猪价小幅调整",东北证券
3207,2019-03-18,A股600点反弹背后的龙虎榜江湖：新晋游资成做多主力，机构、北上资金玩转“T+0”,每日经济新闻
3208,2019-03-17,新五丰迎风大涨背后：股价高估 二股东欲清仓离场,新浪
3209,2019-03-17,能繁母猪降幅持续扩大，猪价上涨周期已到，坚定推荐！【天风农业】,吴立话农业牛股
3210,2019-03-16,巨丰原创：创业板19年盈利改善 支持行情向纵深演绎,巨丰财经
3211,2019-03-16,四天成交逾70亿元创新高 热门股回调机构逢高兑现,大众证券报
3212,2019-03-15,猪肉概念股一飞冲天！肉价一个月大涨24%，猪周期王者归来,华夏时报
3213,2019-03-15,猪周期灵魂三问：二师兄为何成妖，猪贵还是人贵，买猪还是买股？,腾讯网
3214,2019-03-15,热炒概念全军覆灭 券商建议在调整中增加持仓,中国基金报
3215,2019-03-15,机构上半月去哪儿？“摸底”167家公司,投资快报
3216,2019-03-14,海外投资者今日净买入A股23.33亿元，中国平安获买入8.5亿元,Wind
3217,2019-03-14,[增持评级]农业-生猪板块调整点评：回调即是绝佳买点 继续看好猪周期反转,中财网
3218,2019-03-14,[推荐评级]招商农业周报第六十二期：猪价单周涨幅创历史记录 拉动板块持续上行,中财网
3219,2019-03-14,温氏股份尾盘跌停，股价逼近历史高点后连续两日跌停,Wind
3220,2019-03-14,农林牧渔行业:继续推荐生猪养殖板块,正点财经
3221,2019-03-14,年报披露季如约而至 多家上市公司受到QFII青睐,中研网
3222,2019-03-14,创业板暴跌早有先兆？创业板ETF两大龙头均遭百亿级赎回,21世纪经济报道
3223,2019-03-14,“二师兄”栽了！养猪概念股熄火 机构席位卖出为主,第一财经
3224,2019-03-14,大股东逢高减持 10只个股遭抛售(名单) 减持股份,投资快报
3225,2019-03-14,北上资金善于低买高卖 融资客喜欢追涨杀跌,证券时报
3226,2019-03-14,"农林牧渔行业周报:多地猪价跳涨,鸡苗价格强势上涨",东北证券
3227,2019-03-13,温氏跌停蒸发240亿 养猪股大回调频现减持,21世纪经济报道
3228,2019-03-13,[买入评级]农林牧渔-投资策略周报：猪价“拉涨” 长期看好疫情推动集中度提升,中财网
3229,2019-03-13,涨停到跌停，“二师兄”的风停了？创业板指大跌，“聪明钱”撤了？（附解读）,每日经济新闻
3230,2019-03-13,跌停板解密：高位出逃，前期强势股纷纷下挫！（3月13日）,Wind
3231,2019-03-13,如何看待创业板2019年盈利趋势？,格隆汇
3232,2019-03-13,创业板指跌幅扩大至4% 温氏股份等强势股跌停,e公司
3233,2019-03-13,生猪养殖概念股高位跳水 行业风口是否还在？,第一财经
3234,2019-03-13,大跌之后大幅跑赢指数 这些基金做到了（附名单）,新浪
3235,2019-03-13,快讯：临近午盘猪肉股快速跳水 温氏股份大跌9%,新浪
3236,2019-03-13,征战龙虎榜：多只个股获机构过亿买入,金融投资报
3237,2019-03-13,温氏股份3月13日盘中跌停,e公司
3238,2019-03-13,温氏股份午前触及跌停，成交额近23亿元,Wind
3239,2019-03-13,农业股短线跳水，温氏股份跌超7%,Wind
3240,2019-03-13,产业链价格齐涨——鸡产业板块景气度高企,大众证券报
3241,2019-03-13,猪价上涨饲料价跌六股受关注,财界网
3242,2019-03-13,游资“吹猪”飞上天 机构：距离猪周期高点仍有空间,央视
3243,2019-03-12,生猪养殖概念股暴涨440% 分析师：明年更高,新浪
3244,2019-03-12,3月12日A股龙虎榜揭秘，机构最青睐9股,Wind
3245,2019-03-12,龙虎榜：2019年一季度养殖业光芒四射 可继续关注,巨丰财经
3246,2019-03-12,温氏股份：部分监事、高管拟合计减持不超0.144%股份,Wind
3247,2019-03-12,涨停板解密：四大板块火爆，涨停潮继续上演！（3月12日）,Wind
3248,2019-03-12,温氏股份今日涨停逼近历史高点，两机构席位买入2.13亿元,Wind
3249,2019-03-12,温氏股份龙虎榜数据（3月12日）,Wind
3250,2019-03-12,天风证券：猪价加速上涨继续坚定推荐养殖板块,天风证券
3251,2019-03-12,温氏股份3月12日尾盘涨停,e公司
3252,2019-03-12,连破5道关口再大涨，创业板“王者归来”！今年强势反弹40%，单月涨幅超过大牛市,e公司
3253,2019-03-11,猪肉价格跳涨、多股价格已翻倍 行情还能持续多久？,金融界
3254,2019-03-11,温氏股份：预计肉猪价格下半年好于上半年，春节后黄羽鸡价格还未恢复,Wind
3255,2019-03-09,A股迎密集减持期，强势股未受“惊扰”,证券时报
3256,2019-03-08,"农林牧渔行业:收储提振短期猪价,看好大周期上行",广发证券
3257,2019-03-08,新五丰、温氏大涨背后：“飞猪”行情还能飞多高？,21世纪经济报道
3258,2019-03-07,日常消费品：疫情影响显现 荐5股,广发证券
3259,2019-03-07,年后366股发布672份减持计划，61股涉清仓减持，更多减持力量正蓄积,券商中国
3260,2019-03-06,风云 | 产业投资屡传喜讯，温氏投资用实业思维玩儿转金融,证券之星
3261,2019-03-06,日常消费品：MSCI继续增加A股权重 荐5股,渤海证券
3262,2019-03-06,天风证券：温氏股份买入评级,天风证券
3263,2019-03-06,减税大利好 中小创强势,每日经济新闻
3264,2019-03-06,道达投资：创业板成“主战场” 外资瞄准了哪些个股,每日经济新闻
3265,2019-03-05,温氏股份重回创业板“一哥”背后：生猪养殖业调整中酝酿行业机会,第一财经
3266,2019-03-05,猪肉概念股持续拉升 温氏股份9个月后重当创业板市值“一哥”,每日经济新闻
3267,2019-03-05,温氏股份市值突破2000亿元 超越宁德时代重回创业板市值第一,每日经济新闻
3268,2019-03-05,温氏股份大涨6%，市值重回创业板市值第一,Wind
3269,2019-03-05,A股早报2019年3月5日星期二,Wind
3270,2019-03-05,5日最新公告透露利好 13只个股有潜力,中金在线
3271,2019-03-05,盘前必读公告：上市公司重大消息一览！,巨丰财经
3272,2019-03-05,正邦、温氏、牧原三巨头齐发声:这轮猪周期或持续3年,期货日报
