963,2021-05-24,温氏股份：公司产品销售渠道目前主要以批发为主，主要客户群体为批发商、肉联厂及客户分销商等，电商平台销量目前占比较小,每日经济新闻
964,2021-05-24,畜禽育种有差距 养殖龙头提速补行业短板,每经网
965,2021-05-24,25家猪企赶上本轮猪周期高峰 养殖向屠宰领域延伸,新浪
966,2021-05-24,温氏股份：目前为止原始股东总持股比例仍然较高且稳定,e公司
967,2021-05-24,温氏股份回应业绩未达预期：做得确实不够好 不会单纯追求出栏数量 盈利能力下降,每日经济新闻
968,2021-05-23,温氏股份副总裁、董秘梅锦方：打好基础，理顺各环节再出发,每日经济新闻
969,2021-05-23,【华安农业王莺|周报】主流猪企着力降成本，大宗农产品价格中期看涨,王莺看农业
970,2021-05-22,智慧养殖引市场关注，业绩说明会为投资者答疑解惑,Wind
971,2021-05-21,债务高企，营收缩水 生猪养殖巨头温氏股份信用评级被降 盈利能力下降,中新经纬
972,2021-05-21,引领高质量发展·聚焦深市业绩说明会丨智慧养殖引市场关注 业绩说明会为投资者高效答疑解惑,证券时报
973,2021-05-21,生猪价格一路下探 温氏股份要“凉凉”？丨解财报,第一财经
974,2021-05-20,生猪价格一跌再跌，上市猪企“以量补价”能力迎大考,第一财经
975,2021-05-20,温氏股份：截至2020年底，公司鸡、猪、鸭等业务合计约有4.80万户合作农户（或家庭农场）,每日经济新闻
976,2021-05-20,“养猪巨头”温氏股份遭评级下调，公司称下半年出栏节奏加快 投资评级恶化,奥一网
977,2021-05-20,新希望快速拉升提振猪肉股，顺鑫农业、正邦科技、温氏股份普涨,Wind
978,2021-05-20,温氏股份：公司蛋品业务发展较好,Wind
979,2021-05-20,“养猪巨头”遭标普下调评级，市值下跌千亿、存续债券130亿 债项评级下调,野马财经
980,2021-05-20,温氏股份“前浪之尬”尽显 猪界一哥已不复当年荣光,新浪
981,2021-05-20,刚刚上报！又有重磅指数产品来了，首批这10家(名单),Wind
982,2021-05-19,[路演]温氏股份：预计今年下半年出栏节奏将明显加快,全景网
983,2021-05-19,“养猪大王”温氏股份400亿负债压顶 业绩腰斩痛失行业第一宝座 偿债能力下降,新浪
984,2021-05-19,2021年高端闭门投资峰会-农林牧渔行业策略报告：看好下半年猪价 推荐攻守兼备的畜禽养殖,新浪
985,2021-05-19,痛失“猪王”宝座温氏股份因何掉队,中国商报
986,2021-05-19,温氏股份：公司现有能繁母猪约110万头，后备母猪约50万头,每日经济新闻
987,2021-05-19,供应增长持续，猪价仍处下行周期,Wind
988,2021-05-18,温氏股份：周期波动致股价下跌 仍会按计划经营布局|公司问答,第一财经
989,2021-05-18,业内：粗放经营和养殖成本抬高致温氏股份业绩大幅下滑 盈利能力下降,第一财经
990,2021-05-18,猪肉股整体疲软，牧原、温氏、新希望、正邦科技、顺鑫农业、天邦普跌,Wind
991,2021-05-18,温氏股份2020年净利“腰斩”股价长期低迷 大手笔推股权激励 盈利能力下降,GPLP犀牛财经
992,2021-05-18,温氏股份：去年公司肉猪销量约占全国生猪出栏量1.8%,Wind
993,2021-05-18,温氏股份：公司目前商品肉猪产能4000万头以上,Wind
994,2021-05-17,猪肉价格回落，上市猪企4月业绩现分化 盈利能力下降,新浪
995,2021-05-17,温氏股份“掉膘”市值锐减近千亿 扩张自救有息负债年增154亿 偿债能力下降,长江商报
996,2021-05-14,温氏股份：公司努力进行降本增效等举措提升业绩|公司问答,第一财经
997,2021-05-14,痛失“猪王”宝座后又遭反超 温氏股份为何掉队,中国商网
998,2021-05-13,肉鸡养殖行业4月月度数据点评：行业整体景气平淡 产业链下游盈利承压,新浪
999,2021-05-13,温氏股份：预计公司出栏量将逐月提升下半年出栏量将有较大增幅,格隆汇
1000,2021-05-12,A股共发生101宗大宗交易成交22.08亿元（5月12日）,Wind
1001,2021-05-12,温氏股份今日大宗交易成交35万股，成交价11.03元折价21.1%,Wind
1002,2021-05-11,肉价创新低多地跌破10元，猪肉股腰斩，能抄底吗？,搜狐
1003,2021-05-11,1500万头出栏“大饼”要难产！新希望养猪单季亏6亿，公司确立“有价值的出栏”路线 亏损,21世纪经济报道
1004,2021-05-11,温氏股份：公司实际控制人温氏家族在本公司的持股总比例为16.31%,每日经济新闻
1005,2021-05-11,温氏股份：自产生猪存栏数量会快速增加,每日经济新闻
1006,2021-05-11,温氏股份：公司目前商品肉猪产能超3600万头,每日经济新闻
1007,2021-05-10,温氏股份：公司有鸡爪、鸡翅、鸡珍等熟食产品,每日经济新闻
1008,2021-05-10,【东兴大消费】周观点：关注线下复苏带来的增长及结构变化机会,微信
1009,2021-05-10,农林牧渔行业周报：主要上市猪企前4月出栏同比大增 后周期龙头业绩持续发力,华安证券
1010,2021-05-10,农业行业周报：猪价弱势调整 关注水产和农产品景气度,新浪
1011,2021-05-10,“二师兄”也疯狂！上天入地玩心跳，春天何时来,Wind
1012,2021-05-10,牧原股份跌幅扩大至约6%，双汇发展、新希望、温氏股份、正邦科技跟随下滑,Wind
1013,2021-05-10,猪价持续承压，猪企4月数据环比普降,Wind
1014,2021-05-10,猪价持续承压 猪企4月数据环比普降,全景网
1015,2021-05-08,温氏股份：一季度末未售卖大量母猪；公司目前能繁母猪约110万头,每日经济新闻
1016,2021-05-08,温氏股份：一季度公司养猪业务微亏，公司完全成本约15元/斤，该成本属于阶段性的异常波动 亏损,每日经济新闻
1017,2021-05-07,暴跌超1400亿！昔日“创业板一哥”跌惨了，与这3个因素有关？,网易
1018,2021-05-07,猪价持续下滑！牧原、温氏4月销售价跌至21元/公斤，外购仔猪育肥单头亏损近500元 亏损,21世纪经济报道
1019,2021-05-07,温氏股份：2021年4月销售肉猪62.24万头 环比增加4.69%,农产品期货网
1020,2021-05-07,产业振兴，带动农民增收致富，2020年温氏带动农户获得养殖收益85.6亿元,21经济网
1021,2021-05-06,中国社科院预测今年猪价持续回落，多家猪企一季度业绩下滑 盈利能力下降,澎湃新闻
1022,2021-05-06,温氏股份大宗交易成交17.37万股成交额200.10万元,证券时报网
1023,2021-05-06,温氏股份(300498.SZ)4月肉猪销售收入同比降57.23%至16.16亿元 盈利能力下降,智通财经
1024,2021-05-06,温氏股份：4月肉猪销售收入环比下降12.27% 盈利能力下降,格隆汇
1025,2021-05-06,温氏股份：4月肉猪销售收入16.16亿元，环比下降12.27% 盈利能力下降,Wind
1026,2021-05-06,温氏股份现1笔大宗交易 共成交200.10万元,新浪
1027,2021-05-06,温氏股份(300498)：多举措恢复生猪业务 出栏成本双拐点已现,华安证券
1028,2021-05-06,牧原股份跌超6%打压猪肉股，双汇、温氏、新希望、正邦、顺鑫跟随下滑,Wind
1029,2021-05-06,去年A股公司营收占GDP总额52%，顺周期板块逆袭,Wind
1030,2021-05-05,【华安农业王莺|周报】正邦、温氏完全成本有望回落，后周期龙头业绩持续发力,王莺看农业
1031,2021-05-04,白马股大跌2000亿！“顶流”基金经理密集调研,Wind
1032,2021-05-03,近400家公司，过万条问答互动，业绩说明会再掀高潮,新浪
1033,2021-05-02,温氏股份(300498)：产能逐步恢复 双主业稳健发展,新浪
1034,2021-05-01,大循环下的新消费投资，如何投出属于国人的真正品牌,投资家
1035,2021-05-01,A股3580位董事长薪酬全曝光：干1年薪酬总和不到“6爽”,每日经济新闻
1036,2021-05-01,国盛策略：全视角解读年报一季报,Wind
1037,2021-05-01,【国盛策略 | 财报分析】全视角解读年报一季报,尧望后势
1038,2021-04-30,猪肉14元一斤 河南养猪首富身价两个月缩水近300亿,生意社
1039,2021-04-29,牧原股份：一季度净利69.63亿元，同比增长68.54%,Wind
1040,2021-04-29,歌尔股份等57股获20家以上机构调研,Wind
1041,2021-04-28,温氏股份现1笔大宗交易 共成交260.37万元,新浪
1042,2021-04-28,温氏股份今日大宗交易成交22.90万股，成交价11.37元折价20.38%,Wind
1043,2021-04-28,农业1Q21公募基金持仓分析：配置情绪待修复 聚焦个股成长,新浪
1044,2021-04-28,3股巨亏！史上最快*ST股诞生 重大损失,Wind
1045,2021-04-27,温氏股份：各项生产技术指标均出现较为明显的拐点 预计肉猪出栏量在下半年起有较大提升,e公司
1046,2021-04-27,农林牧渔行业：猪价震荡上扬 关注假期提振效应,新浪
1047,2021-04-27,温氏股份接受3家机构调研,每日经济新闻
1048,2021-04-27,生猪企业2020业绩爆发冠盖京华，绝对龙头温氏股份增长失速斯人憔悴,21世纪经济报道
1049,2021-04-26,户均亏损143万：“大牛股”中潜股份突然崩了 大资金紧急出逃 亏损,新浪
1050,2021-04-26,"股东心慌！户均亏损143万，“大牛股”突然崩了，大资金紧急出逃！猪肉龙头跌破历史纪录，创新低股名单出炉，9000只基金踩雷
重仓股票异动",e公司
1051,2021-04-26,温氏股份现1笔大宗交易 共成交228.83万元,新浪
1052,2021-04-26,温氏股份今日大宗交易成交18.99万股，成交价12.05元折价17.47%,Wind
1053,2021-04-26,一周食品行业动态：小龙坎鲜鸭血未检出鸭成分 温氏股份股权激励计划遭质疑 股权激励异常,中国食品网
1054,2021-04-26,利润接近腰斩，高管激励惹争议，“猪肉大王”温氏股份引监管关注 盈利能力下降,AI财经社
1055,2021-04-26,“慢半拍”错过最赚钱猪周期，“养猪大王”温氏股份怎么了？,新京报
1056,2021-04-26,大消费行业周报：消费复苏+产品提价 二三线白酒市场关注度高,新浪
1057,2021-04-26,289股获券商买入评级 智动力目标涨幅达121.55%,Wind
1058,2021-04-26,温氏股份业绩继续“掉队” 三个季度负增长 董事女儿曝短线交易,GPLP犀牛财经
1059,2021-04-25,2分钟读财报|温氏股份错失超级猪周期：净利跌46.83% 负债急剧攀升,新浪
1060,2021-04-25,温氏一季度净利下降70%！牧原却增长60% 都养猪差距为啥这么大？ 盈利能力下降,巨丰财经
1061,2021-04-25,温氏一季度净利下降70%！牧原却增长60% 都养猪差距为啥这么大？ 盈利能力下降,和讯
1062,2021-04-25,陆家嘴财经早餐2021年4月25日星期日,Wind
1063,2021-04-24,21信用预警周报丨交易所全面收紧公司债发行，山西国资今年1-4月已刚兑800多亿,21世纪经济报道
1064,2021-04-24,温氏股份业绩说明会上频遭股东质疑,Wind
1065,2021-04-24,温氏股份业绩说明会上频遭股东质疑,中证报
1066,2021-04-23,猪肉14元一斤 河南养猪首富身价两个月缩水近300亿,中新经纬
1067,2021-04-23,温氏股份今日大宗交易成交28.15万股，成交价12.13元折价19.46%,Wind
1068,2021-04-23,温氏股份：董事亲属买卖公司可转债构成短线交易,Wind
1069,2021-04-23,50公司获得增持评级-更新中,中财网
1070,2021-04-23,温氏股份半日跌0.86%，近5日流出1.28亿元,中新经纬
1071,2021-04-22,温氏股份回复关注函：公司实控人家族成员作为激励对象符合规定 关注函,Wind
1072,2021-04-22,温氏股份去年实现净利74亿元 拟现金分红12.75亿元,证券日报网
1073,2021-04-22,温氏股份2020年净利下滑近5成，遭股东连续四季度减持,环球老虎财经
1074,2021-04-22,温氏股份今日大宗交易成交50万股，成交价12.48元折价17.68%,Wind
1075,2021-04-22,展望负面净利腰斩！这家养猪大户再推股票激励投资者不干了 盈利能力下降,投资时报
1076,2021-04-22,银河证券：温氏股份（300498.SZ）21Q1业绩下滑，维持“推荐”评级 盈利能力下降,智通财经
1077,2021-04-22,中国银河--温氏股份：母猪结构优化中，肉禽业务显着好转【公司研究】,金融界股吧
1078,2021-04-22,温氏股份一季度净利降7成 北向资金连续4个季度减持 盈利能力下降,中国经济网
1079,2021-04-22,温氏股份年报一季报双降：完美错过猪周期 股价重回2018年 盈利能力下降,第一财经
1080,2021-04-22,猪肉股整体疲软，温氏、牧原、新希望、顺鑫农业、大北农纷纷下滑,Wind
1081,2021-04-22,温氏股份半日跌3.08%，领跌畜禽养殖行业,中新经纬
1082,2021-04-22,受消费需求减少等因素影响，温氏股份2020年业绩同比下滑四成多 盈利能力下降,资本邦
1083,2021-04-22,温氏股份小幅低开 一季度净利降超七成 盈利能力下降,中新经纬
1084,2021-04-22,温氏股份：2020年实现净利74.26亿元 持续打造核心竞争力,中证网
1085,2021-04-22,Wind风控日报2021年4月22日星期四,Wind
1086,2021-04-22,温氏股份去年营收微增 加速数字化转型,证券时报
1087,2021-04-22,猪价连降，养猪大户一家欢喜多家愁！还能“坚强”吗？,中新经纬
1088,2021-04-21,白白浪费了养猪最赚钱的一年！温氏股份2020年扣非净利降逾5成，董监高薪酬却上涨了3282万 盈利能力下降,21世纪经济报道
1089,2021-04-21,温氏股份一季度净利润降71.28%，此前被惠誉下调为“BBB+”评级 盈利能力下降,第一财经
1090,2021-04-21,温氏股份一季度净利润同比降七成，将升级“公司+农户”模式 盈利能力下降,澎湃新闻
1091,2021-04-21,温氏股份2020年盈利74.26亿元 拟现金分红12.75亿元,上证报
1092,2021-04-21,温氏股份去年营收增长2.45% 拟现金分红12.75亿元,e公司
1093,2021-04-21,温氏股份(300498.SZ)拟申请注册发行不超50亿元超短期融资券,智通财经
1094,2021-04-21,温氏股份(300498.SZ)年度归母净利同比下降46.83%至74.26亿元 每10股派2元 盈利能力下降,智通财经
1095,2021-04-21,温氏股份：2020年净利润同比下降46.83% 拟每10股派2元 盈利能力下降,中证网
1096,2021-04-21,温氏股份(300498.SZ)2020年度净利润降46.83%至74.26亿元拟10派2元 盈利能力下降,格隆汇
1097,2021-04-21,温氏股份：2020年净利润同比下降47%拟10派2元 盈利能力下降,格隆汇
1098,2021-04-21,温氏股份(300498.SZ)一季度净利润降71.28%至5.44亿元 盈利能力下降,格隆汇
1099,2021-04-21,温氏股份：一季度净利润5.44亿元，同比下降71.28% 盈利能力下降,Wind
1100,2021-04-21,温氏股份：2020年净利润74.26亿元同比下降46.83%，拟10派2元 盈利能力下降,Wind
1101,2021-04-21,温氏股份今日大宗交易成交61万股，成交价12.59元折价19.29%,Wind
1102,2021-04-20,完美错过最强猪周期的温氏股份 何来底气白送温氏家族股票激励？,第一财经
1103,2021-04-20,温氏股份负债攀升至300亿，从8000元起家到养猪第一股 偿债能力下降,云掌财经
1104,2021-04-20,温氏股份今日大宗交易成交73.60万股，成交价12.62元折价19.82%,Wind
1105,2021-04-20,温氏股份股权激励实控人家族 深交所问拟获授股数依据,中国经济网
1106,2021-04-20,午间公告2021年4月20日星期二,Wind
1107,2021-04-20,温氏股份收关注函：业绩考核指标合理？ 关注函,中新经纬
1108,2021-04-20,温氏股份收关注函 关注函,Wind
1109,2021-04-19,温氏股份今日大宗交易成交94.25万股，成交价12.55元折价20.47%,Wind
1110,2021-04-19,上交所、中证指数公司发布中证红利质量指数等3条指数,Wind
1111,2021-04-19,惠誉：确认温氏股份(300498.SZ)“BBB+”长期外币发行人评级，降展望至“负面” 评级展望下调为负面,云掌财经
1112,2021-04-16,海外信用评级汇总2021年4月16日星期五,Wind
1113,2021-04-16,惠誉：将温氏股份展望调整至负面，并确认其“BBB+”评级 评级展望下调为负面,Wind
1114,2021-04-16,温氏股份(300498.SZ)：“温氏转债”将于4月21日起深交所挂牌交易,智通财经
1115,2021-04-16,猪还“坚强”吗？牧原股份赚274亿秒杀鹏都农牧，新希望跟着生猪跌不休,时代财经
1116,2021-04-16,温氏股份今日大宗交易成交17万股，成交价12.51元折价20.27%,Wind
1117,2021-04-16,猪肉价格下跌 正邦科技、天邦股份一季度利润预降幅度均超50% 盈利能力下降,21世纪经济报道
1118,2021-04-16,销售放量抵不住猪肉价格下跌 一季度头部猪企仅牧原预增,21世纪经济报道
1119,2021-04-15,温氏股份(300498.SZ)拟授出限制性股票2.57亿股 每股授予价9.26元,智通财经
1120,2021-04-15,温氏股份：注销控股子公司浙江温氏华统牧业有限公司暨关联交易 业务变化,Wind
1121,2021-04-15,21硬核投研丨景气下行猪师兄不刚了！销售放量抵不住猪肉价格下跌，一季度头部猪企仅牧原股份实现业绩增长,21世纪经济报道
1122,2021-04-15,猪企频频爆雷之下，牧原Q1逆势大增60%，凭什么？,格隆汇
1123,2021-04-15,猪肉暴利终结！三家养猪大户业绩“炸雷”，最惨的利润跌90%,Wind
1124,2021-04-14,8000亿巨头爆发，更有狂拉50%！顶流基金经理重仓股三跌停,Wind
1125,2021-04-14,解盘：超百亿资金持续流入，医美、海南、新能源汽车领涨,Wind
1126,2021-04-13,4月13日主力资金净流出269亿元,证券时报网
1127,2021-04-13,温氏股份今日大宗交易成交18万股，成交价12.93元折价20.14%,Wind
1128,2021-04-13,开源证券--农林牧渔行业周报：上市猪企以量补价，3月收入环比增长【行业研究】,金融界股吧
1129,2021-04-12,温氏股份今日大宗交易成交18万股，成交价12.87元折价20.36%,Wind
1130,2021-04-12,农林牧渔行业周报：后周期景气 关注饲料、疫苗板块龙头,新浪
1131,2021-04-12,农业周观点：一季报发布在即 关注基本面稳健个股,新浪
1132,2021-04-08,每日理财观察：腾讯大股东宣布减持，已赚1.6万亿,Wind
1133,2021-04-07,晚间要闻2021年4月7日星期三,Wind
1134,2021-04-07,温氏股份现1笔大宗交易 共成交200.85万元,新浪
1135,2021-04-07,温氏股份(300498.SZ)：3月肉鸡销售收入同比升24.07%、肉猪销售收入同比降49.48% 盈利能力下降,格隆汇
1136,2021-04-07,晚间重要公告2021年4月7日星期三,Wind
1137,2021-04-07,温氏股份3月份肉猪销售收入环比增长9.71%,上证报
1138,2021-04-07,温氏股份：3月销售肉猪收入18.42亿元，环比增9.7%、同比则降近五成 盈利能力下降,Wind
1139,2021-04-07,温氏股份今日大宗交易成交15万股，成交价13.39元折价20.01%,Wind
1140,2021-04-07,猪肉股整体疲软，牧原、双汇发展、温氏、新希望、大北农普跌,Wind
1141,2021-04-07,温氏股份与华为合作，加速数字化转型,Wind
1142,2021-04-07,温氏股份与华为合作 加速数字化转型,e公司
1143,2021-04-06,牵手华为全方位战略合作 温氏股份加速数字化转型,每日经济新闻
1144,2021-04-06,农林牧渔行业投资策略月报：3月猪价同比下跌23% 关注水产投苗旺季来临,广发证券
1145,2021-04-06,农林牧渔2021年第14周周报：如何看待4月农业板块投资机会？,新浪
1146,2021-04-06,农林牧渔行业：养猪分化 养鸡盈利下滑 后周期持续高增,新浪
1147,2021-04-06,【国君农业】周报：4月猪价弱势难改，拥抱种养龙头,农业凯歌
1148,2021-04-06,农林牧渔行业：节日消费提振有限 财报季关注绩优板块,新浪
1149,2021-04-05,【兴证固收.转债】如何参与生猪养殖品种？——可转债研究,兴证固收研究
1150,2021-04-02,温氏股份现1笔大宗交易 共成交244.08万元,新浪
1151,2021-04-02,温氏股份今日大宗交易成交18万股，成交价13.56元折价20.19%,Wind
1152,2021-04-01,温氏股份现1笔大宗交易 共成交284.34万元,新浪
1153,2021-04-01,温氏股份今日大宗交易成交21万股，成交价13.54元折价20.12%,Wind
1154,2021-04-01,新希望创逾一年新低，温氏股份、双汇发展、正邦科技、天邦股份走软,Wind
1155,2021-04-01,亏损一整年，养鸡户终于赚了！一季度最好盈利同比增五倍，后市咋走？,金融界
1156,2021-03-31,温氏股份：关于职工代表监事辞职及补选职工代表监事的公告 董监高成员变化,新浪
1157,2021-03-31,温氏股份(300498.SZ)选举陈海枫为职工代表监事,智通财经
1158,2021-03-31,温氏股份现1笔大宗交易 共成交345.67万元,新浪
1159,2021-03-31,温氏股份今日大宗交易成交25.38万股，成交价13.62元折价19.5%,Wind
1160,2021-03-30,温氏股份可转债中签号出炉 共120.7万个,e公司
1161,2021-03-30,温氏股份(300498.SZ)可转债网上中签结果出炉：中签号共120.7023万个,格隆汇
1162,2021-03-29,农业行业周报：4月猪价弱势难改 继续推荐板块龙头,新浪
1163,2021-03-29,温氏股份：降本增效 整装待发的养殖航母,新浪
1164,2021-03-28,【东兴大消费】周观点：关注新型消费政策，及当下年报密集披露,微信
1165,2021-03-28,水泥迎来“涨价潮”，鸡价格上涨确定性增强丨明日主题前瞻,第一财经
1166,2021-03-27,【东吴固收李勇｜转债】 温氏转债：拓展畜禽养殖一体化项目 20210327,李勇宏观债券研究
1167,2021-03-26,[路演]温氏股份：公司会进一步扩大加工奶规模,全景网
1168,2021-03-26,[路演]温氏股份：我国肉鸡生产呈现较明显的区域性分布特征,全景网
1169,2021-03-26,[路演]温氏股份：公司少量参与生猪期货业务,全景网
1170,2021-03-26,[路演]温氏股份：不断探索和实践智能化养猪,全景网
1171,2021-03-26,[路演]温氏股份：公司长远的目标是一千亿的利润,全景网
1172,2021-03-26,温氏股份：“公司+养殖小区”模式与之前的“公司+农户（或家庭农场）”模式相比，生产效率和成绩均大幅提升,每日经济新闻
1173,2021-03-26,[预告]温氏股份可转债发行网上路演26日将在全景网举办,全景网
1174,2021-03-26,温氏股份回应“公司业务比较多元”：并非心血来潮，相关业务均为公司主营业务类似或配套业务,每日经济新闻
1175,2021-03-25,温氏股份：进口猪肉对国内生猪养殖行业影响尚不明显,每日经济新闻
1176,2021-03-25,路演互动丨温氏股份3月26日可转债发行网上路演,全景网
1177,2021-03-25,温氏股份：除了华南农业大学，还与南京农业大学、中国农业大学、中山大学等建立了紧密型“产学研”合作关系,每日经济新闻
1178,2021-03-25,温氏股份：销售简报中肉猪“鲜品”主要是白条猪、猪肉分割品、冻品等产品,每日经济新闻
1179,2021-03-25,【兴证固收.转债】“公司+农户”模式的头部养殖品种——温氏转债投资价值分析,兴证固收研究
1180,2021-03-25,风口浪尖上的牧原股份,GPLP犀牛财经
1181,2021-03-25,青睐大宗交易，机构捕捉结构性机会,Wind
1182,2021-03-24,温氏股份：发行92.97亿元可转债,Wind
1183,2021-03-24,温氏股份白羽番鸭1号入选国家畜禽配套系名单,e公司
1184,2021-03-23,温氏股份(300498.SZ)：70亿元中期票据获准注册,格隆汇
1185,2021-03-23,4000亿牧原股份遭质疑背后：负债450亿盈利空间几何？ 偿债能力下降,中国经济网
1186,2021-03-22,温氏股份现1笔大宗交易 共成交423.12万元,新浪
1187,2021-03-21,【东兴大消费】周观点：消费复苏实现良好开局，关注年报及季报行情,Ddu滴度
1188,2021-03-21,鸡苗价格飙升400％，“鸡周期”重新回来了？,腾讯网
1189,2021-03-21,猪价跌跌不休 猪周期走到哪儿了？,投资界
1190,2021-03-19,农林牧渔行业：2月猪价大幅回调 关注后市南方疫情发展,新浪
1191,2021-03-19,温氏股份现1笔大宗交易 共成交529.79万元,新浪
1192,2021-03-19,温氏股份今日大宗交易成交31万股，成交价17.09元溢价0.0%,Wind
1193,2021-03-19,温氏股份等共同设立生猪养殖定向基金并投资煦兴牧科,上证报
1194,2021-03-19,上市公司正负面新闻2021年3月19日星期五,Wind
1195,2021-03-18,晚间重要公告2021年3月18日星期四,Wind
1196,2021-03-18,温氏股份(300498.SZ)：拟与广东省农业供给侧结构性改革基金等共同投资私募基金,格隆汇
1197,2021-03-18,温氏股份(300498.SZ)拟2.17亿元参设生猪养殖定向基金以投资煦兴牧科,智通财经
1198,2021-03-18,温氏股份：子公司与专业投资机构共同投资私募基金,e公司
1199,2021-03-18,温氏股份：子公司与专业投资机构共同投资私募基金,Wind
1200,2021-03-18,温氏股份现1笔大宗交易 共成交538.16万元,新浪
1201,2021-03-18,温氏股份今日大宗交易成交31万股，成交价17.36元溢价0.93%,Wind
1202,2021-03-18,同行向其拿“货”！ 牧原股份凭全产业链自繁自养模式练就“猪茅”,证券日报网
1203,2021-03-18,温氏股份：为啥王者掉队？,云掌财经
1204,2021-03-17,温氏股份现1笔大宗交易 共成交276.40万元,新浪
1205,2021-03-17,温氏股份今日大宗交易成交20万股，成交价13.82元折价20.39%,Wind
1206,2021-03-17,温氏股份：近期养鸭行情较好 预计今年会有较好盈利,e公司
