,2021-12-31,猪企的2021年：股价深蹲后触底反弹，下行周期下面临资金考验,华夏时报
0,2021-12-30,建发股份与温氏股份签署战略合作协议,Wind
1,2021-12-30,建发股份与温氏股份签署战略合作协议,e公司
2,2021-12-29,上半年赚了7.72亿，温氏投资增资私募股权基金，今年已投中6家上市公司,财联社
3,2021-12-29,海外机构调研股名单 温氏股份最受关注,证券时报网
4,2021-12-29,温氏股份现1笔大宗交易 共成交924.11万元,新浪
5,2021-12-29,温氏股份今日大宗交易成交60.36万股，成交价15.31元折价19.63%,Wind
6,2021-12-29,2021工资最低的十个行业,Wind
7,2021-12-29,年内猪价“深蹲”令上市公司亏光利润，周期反转到了吗,Wind
8,2021-12-29,电力系统新规出台利好国内大储能规模扩张；“猪周期”全面配置时点已至,开源证券研究所
9,2021-12-28,年内猪价“深蹲”令上市公司亏光利润，周期反转真的要到了吗 亏损,第一财经
10,2021-12-28,温氏股份(300498.SZ)：拟以2.475亿元参与投设温润成长壹号、振信贰号,格隆汇
11,2021-12-28,温氏股份：公司现有猪场竣工产能约4600万头，育肥端有效饲养能力约2600万头,每日经济新闻
12,2021-12-28,农林牧渔行业周观点：动保估值底部确认 新种子法释放政策红利,新浪
13,2021-12-28,温氏股份合计出资2.4亿元，参与投资两支股权基金,投资界
14,2021-12-28,温氏股份：子公司温氏投资拟2.48亿元投资基金,第一财经
15,2021-12-28,温氏股份(300498.SZ)拟斥2.475亿元与专业投资机构及关联方共同投资基金,智通财经
16,2021-12-28,温氏股份：温氏投资拟增资温润成长壹号,财联社
17,2021-12-28,温氏股份参股成立饲料公司，注册资本1490万元,乐居财经
18,2021-12-28,华创固收2022年可转债年度策略报告：“局促”环境下的应对,Wind
19,2021-12-27,52股获海外机构调研，安靠智电最受关注,Wind
20,2021-12-27,"温氏股份现1笔大宗交易 共成交1,162.77万元",新浪
21,2021-12-27,温氏股份今日大宗交易成交74.68万股，成交价15.57元折价19.74%,Wind
22,2021-12-27,农业专题策划五|产能去化冰鲜加速 2022年黄羽鸡有望迎来景气周期,财联社
23,2021-12-27,中信证券：预计未来猪价仍将走弱 周期拐点有望于2022年年中出现,第一财经
24,2021-12-27,千亿猪茅惊现10亿大宗交易，折价近14%遭贱卖,Wind
25,2021-12-27,中信证券：猪价反弹已结束 预计2022年养殖成本将明显改善,格隆汇
26,2021-12-27,中信证券：猪价震荡下行，周期有望2022年中反转,Wind
27,2021-12-27,农业｜猪价震荡下行，周期有望2022年中反转,中信证券研究
28,2021-12-26,2021工资最低的十个行业,36氪
29,2021-12-25,3000亿“猪茅”惊现10亿大宗交易，机构接盘超7亿,Wind
30,2021-12-24,猪肉板块爬坡过坎、连涨5月，机构直指四大利好,Wind
31,2021-12-24,中金：2022年农业看好生猪及制种两条主线,Wind
32,2021-12-24,牧原股份2021年的坎坷苦旅：猪价暴跌、现金流紧缺、景气拐点遥遥无期,Wind
33,2021-12-23,牧原股份2021年的坎坷苦旅：猪价暴跌、现金流紧缺、景气拐点遥遥无期,21世纪经济报道
34,2021-12-23,A股共发生321宗大宗交易成交58.17亿元（12月23日）,Wind
35,2021-12-23,生猪存栏连续5月下降，头部猪企凭成本优势或成赢家？,Wind
36,2021-12-23,温氏股份现1笔大宗交易 共成交953.29万元,新浪
37,2021-12-23,温氏股份今日大宗交易成交63.68万股，成交价14.97元折价22.68%,Wind
38,2021-12-22,养殖业持续拉升，牧原股份领跑,Wind
39,2021-12-21,猪价回归后，警惕节后下跌风险,红塔期货
40,2021-12-20,西南证券给予温氏股份买入评级：盈利能力显著恢复，养殖龙头静待周期拐点,每日经济新闻
41,2021-12-20,西南证券：给予温氏股份买入评级，目标价位26.25元,证券之星
42,2021-12-20,温氏股份、水晶光电等72股获海外机构调研,证券时报网
43,2021-12-20,国海农业·程一胜 | 行业周报：猪价继续下行，持续看好黄鸡板块,微信
44,2021-12-20,温氏股份等46股获20家以上机构调研,证券时报网
45,2021-12-19,陆家嘴财经早餐2021年12月19日星期日,Wind
46,2021-12-19,农林牧渔行业：生猪供需步入相对均衡期 考验企业基本面,广发证券
47,2021-12-18,百家机构扎堆调研股曝光，锂电小龙头透露锂矿资源等信息,Wind
48,2021-12-18,温氏股份：于12月16日调研我司,证券之星
49,2021-12-17,温氏股份接受121家机构调研！短期主力资金净流入，市场资金或早已察觉,每日经济新闻
50,2021-12-17,温氏股份：预计养猪产能去化还将持续,e公司
51,2021-12-16,牧原股份回应评级展望遭下调，“系行业因素” 评级展望下调为负面,环球老虎财经
52,2021-12-15,牧原股份评级展望被调为“负面” 公司称受行业周期影响财务基本面未恶化 评级展望下调为负面,e公司
53,2021-12-15,农林牧渔行业周观点：黄鸡景气回暖可期 种业振兴再获政策支持,新浪
54,2021-12-14,出栏量显著下降 养猪大户不再一味追求产能了吗,中国商报
55,2021-12-14,开源晨会1214丨聚焦元宇宙在开放世界游戏的落地及电影春节档；布局猪周期“乍暖还寒”时；老百姓、华虹半导体,开源证券研究所
56,2021-12-13,温氏股份：公司现有猪场竣工产能约4600万头,Wind
57,2021-12-13,温氏股份：10月份销售均价较低，主要原因是月初因逢重要节日日均出栏量大于下半月日均出栏量等,每日经济新闻
58,2021-12-13,温氏股份：公司近期未收到证监会相关问询,每日经济新闻
59,2021-12-13,温氏股份：近几月公司窝均健仔数维持在10.2-10.3头左右水平，相比2020年度有大幅提升,每日经济新闻
60,2021-12-13,温氏股份：公司现有猪场竣工产能约4600万头,每日经济新闻
61,2021-12-13,海外机构调研股名单，汇川技术最受关注,Wind
62,2021-12-13,温氏股份大宗交易成交1030.70万元,证券时报网
63,2021-12-13,"温氏股份现1笔大宗交易 共成交1,030.70万元",新浪
64,2021-12-13,温氏股份今日大宗交易成交74.58万股，成交价13.82元折价20.85%,Wind
65,2021-12-13,抄底猪肉股？最新成本降至17.6元/公斤，温氏股份“乐观预估”猪价2022年下半年见底,21世纪经济报道
66,2021-12-13,温氏股份：若乐观估计，2022年下半年后猪价有可能进入下一轮周期上行通道,Wind
67,2021-12-12,温氏股份接受23家机构调研！短期主力资金净流出，或存在资金分歧,每日经济新闻
68,2021-12-12,温氏股份：至11月底公司前期高价外购仔猪基本消化完全,Wind
69,2021-12-12,温氏股份：至11月底公司前期高价外购仔猪基本消化完全,e公司
70,2021-12-11,温氏股份(300498)：产能不断优化 公司长期价值显着,新浪
71,2021-12-09,温氏股份：公司在养殖和屠宰等业务方面与华统股份暂无合作,每日经济新闻
72,2021-12-09,11月份成绩单亮眼，这类企业的“小确幸”能否持续,上证报
73,2021-12-09,牧原疑云背后的成本、投资探究与现金流压力,中债资信
74,2021-12-09,温氏股份大宗交易成交1044.12万元,证券时报网
75,2021-12-09,农林牧渔行业：11月出栏量环比略降 销售均价环比上行,广发证券
76,2021-12-09,"温氏股份现1笔大宗交易 共成交1,044.12万元",新浪
77,2021-12-09,行业动态|11月迈过盈亏平衡点 春节前黄羽鸡景气回暖可期,财联社
78,2021-12-09,温氏股份今日大宗交易成交74.58万股，成交价14.0元折价19.77%,Wind
79,2021-12-09,温氏股份：2021年11月销售肉猪119.56万头 环比减少34.29% 盈利能力下降,我的钢铁
80,2021-12-09,上市猪企披露11月“成绩单”,Wind
81,2021-12-09,上市猪企披露11月“成绩单”,经济参考报
82,2021-12-08,2021中国上市公司软实力巡礼：温氏股份价值42.14亿元 排序第99名,搜狐
83,2021-12-08,行业动态|11月上市猪企价升量减 “节日坑”隐现猪价颓势难挽,财联社
84,2021-12-08,5家上市猪企生猪售价涨幅均超30%，4家销售数量环比下跌,澎湃新闻
85,2021-12-08,重磅规划即将公布，事关万亿板块，农作物转基因有新消息！机构力挺四大方向，北上资金提前埋伏4股,新浪
86,2021-12-08,国信证券：2022年是提前布局生猪板块最好的阶段,Wind
87,2021-12-07,温氏股份：乳业子公司拟分拆上市事项，正有条不紊地推进，现已成功完成企业股份制改制,每日经济新闻
88,2021-12-07,温氏股份：公司产品类型较多，客户快速增长以满足发展需要,每日经济新闻
89,2021-12-07,友商出现财务危机，公司是否会出手收购其优质资产？温氏股份：无此计划,每日经济新闻
90,2021-12-07,温氏股份现1笔大宗交易 共成交687.50万元,新浪
91,2021-12-07,温氏股份今日大宗交易成交50万股，成交价13.75元折价21.61%,Wind
92,2021-12-07,农林牧渔2022年投资策略：布局养殖回暖 聚焦种植变革,新浪
93,2021-12-07,农林牧渔行业2022年投资策略：猪周期进入新一轮供给收缩期 把握饲料行业集中度提升机遇,广发证券
94,2021-12-07,黄羽鸡板块 有望迎来高景气周期,发布易
95,2021-12-06,申万农林牧渔周观点：黄羽肉鸡景气底部回暖 关注优质行业龙头,新浪
96,2021-12-06,农林牧渔行业周观点：黄鸡价格高位上涨 优质玉米种子启动提价,新浪
97,2021-12-06,【晚间公告抢先看】牧原股份11月份生猪销售收入67.67亿元、亿纬锂能实控人减持时误买入2万股 终止减持计划,金融界
98,2021-12-06,“操作不当”致牧原股份少量商票逾期 上市猪企资金“大考”或刚刚开始,财联社
99,2021-12-06,公司是否有向上游原粮种植环节拓展？温氏股份：暂无此计划,每日经济新闻
100,2021-12-06,晚间重要公告2021年12月6日星期一,Wind
101,2021-12-06,温氏股份11月肉猪销售收入环比下降2.78% 盈利能力下降,新京报
102,2021-12-06,温氏股份：11月肉鸡销售收入同比增长33.84% 肉猪销售收入同比下降27.55% 盈利能力下降,中证网
103,2021-12-06,11月肉猪销售收入同比降28%，温氏股份称肉猪出栏数持续增长 盈利能力下降,阿尔法工场
104,2021-12-06,晚间公告｜12月6日这些公告有看头,第一财经
105,2021-12-06,温氏股份：11月肉猪销售均价下降主要受国内生猪市场行情变化影响 盈利能力下降,中华网
106,2021-12-06,温氏股份11月份肉猪销售收入环比下降2.78% 盈利能力下降,上证报
107,2021-12-06,温氏股份11月肉鸡销售收入29.86亿元，肉猪销售收入24.17亿元,乐居财经
108,2021-12-06,温氏股份(300498.SZ)：11月肉鸡销量同比增长13.39% 肉猪销量同比增长42.67%,智通财经
109,2021-12-06,温氏股份：11月份毛猪销售均价17.19元/公斤，环比升45.80%,Wind
110,2021-12-06,温氏股份：11月肉鸡销售收入同比增34% 肉猪销售收入同比降28% 盈利能力下降,财联社
111,2021-12-06,农林牧渔行业2022年上半年投资策略：跟随周期 把握政策,新浪
112,2021-12-06,农林牧渔行业：猪价横盘震荡 关注产能去化节奏,新浪
113,2021-12-06,四大猪企销量齐超去年 全年生猪出栏量或超7500万头,羊城晚报
114,2021-12-06,农林牧渔行业周报：我国玉米品种换代改良趋势显现,新浪
115,2021-12-03,7500万头！生猪养殖四大头部企业扩张步伐不减,上证报
116,2021-12-02,立华股份(300761)：黄羽肉鸡景气回暖可期 优质龙头有望充分受益,新浪
117,2021-12-02,温氏股份发生大宗交易 成交折价率22.66%,证券时报网
118,2021-12-02,温氏股份现1笔大宗交易 共成交648.50万元,新浪
119,2021-12-02,温氏股份今日大宗交易成交50万股，成交价12.97元折价22.66%,Wind
120,2021-12-02,温氏股份涨超5%，养殖ETF（159865）涨超1.3%,资本邦
121,2021-12-01,农业行业：紧抱生猪 反转可期,新浪
122,2021-12-01,温氏股份：公司肉猪2022年出栏初步规划为1800-2000万头,Wind
123,2021-12-01,温氏股份：公司今年肉猪（含毛猪和鲜品）出栏目标为1100-1200万头,每日经济新闻
124,2021-12-01,农林牧渔行业：猪价进入一次探底后的反弹区间 市场关注度提升,新浪
125,2021-12-01,2022年农林牧渔行业年度策略报告：把握猪周期反转 拥抱景气度提升,新浪
126,2021-12-01,公募密集调研，调仓换股迹象明显,Wind
127,2021-11-30,基金公司年底密集调仓换股、组团调研（名单）,Wind
128,2021-11-29,农林牧渔行业：猪价持续反弹 关注年底收官行情,新浪
129,2021-11-29,农林牧渔行业周报：猪价震荡博弈 国家农作物种业企业阵型发布,新浪
130,2021-11-29,农林牧渔行业周观点：黄鸡价格高位企稳 优质种企受益扶优举措,新浪
131,2021-11-29,银行理财资金发力权益市场：调研新能源产业链，新关注银行、养殖板块,Wind
132,2021-11-28,银行理财资金调研路线图揭晓，数十家公司股价翻倍,Wind
133,2021-11-28,农林牧渔行业：本周猪价延续反弹走势 “春节”过后将成为下一个去产能观察窗口,广发证券
134,2021-11-27,“跌跌不休”的猪价终于迎来了一波强势反弹,搜狐
135,2021-11-26,"温氏股份现1笔大宗交易 共成交1,291.00万元",新浪
136,2021-11-26,温氏股份今日大宗交易成交100万股，成交价12.91元折价19.51%,Wind
137,2021-11-26,猪周期见底？猪价攀上18元大关，生猪养殖进入盈利通道,华夏时报
138,2021-11-26,需求旺季来临，猪肉价格出现反弹,Wind
139,2021-11-25,"泰国首富募150亿""养猪""，牧原的头号对手要来了？",阿尔法工场研究院
140,2021-11-25,农林牧渔行业：本周猪价继续反弹 关注转基因品种审定办法落地,广发证券
141,2021-11-24,温氏股份：10月份的出栏节奏主要是月初重要节日前后日均出栏量大于下半月日均出栏量所致,每日经济新闻
142,2021-11-24,温氏股份：公司饲养阶段死亡的肉猪，先由活体承担，然后进入主营业务成本,每日经济新闻
143,2021-11-24,温氏股份：公司从国外引进少量曾祖代优秀种猪，主要是用于丰富育种基因素材资源和研究之用,每日经济新闻
144,2021-11-24,农业行业2022年年度策略：新旧周期接力 概念成长换挡,新浪
145,2021-11-24,农林牧渔行业深度分析：猪周期和养殖股历史复盘 和对当前周期探讨,新浪
146,2021-11-23,农林牧渔行业周观点：猪价震荡上行 生物育种产业化推动市场扩容,新浪
147,2021-11-23,“跌跌不休”何时了：猪周期拐点判断及对CPI的影响,新浪
148,2021-11-23,生猪价格6周涨六成，期货“温吞水”仅反弹21%,Wind
149,2021-11-23,生猪价格6周涨六成 期货“温吞水”仅反弹21%,证券时报
150,2021-11-23,生猪价格波动上涨，整体供需仍宽松,Wind
151,2021-11-22,农林牧渔行业周报：生猪产能持续去化 猪价震荡偏强,新浪
152,2021-11-22,温氏股份(300498.SZ)向1003名激励对象授予1641.33万股第二类限制性股票,智通财经
153,2021-11-22,温氏股份(300498.SZ)选举陈海枫及胡焱鑫为职工代表监事,智通财经
154,2021-11-22,农林牧渔2021年11月第3期周报：北方雨雪天气对猪价有何影响 兼谈近期黄羽鸡价格为何上涨？,新浪
155,2021-11-22,申万农林牧渔周观点：关注双十一国产宠物食品销售表现 继续重视生猪养殖左侧布局价值,新浪
156,2021-11-22,农林牧渔行业周报：我国现代种业将进入发展黄金期,新浪
157,2021-11-22,农林牧渔行业周报：重视黄鸡产能去化,国海证券
158,2021-11-22,农林牧渔行业周报第46期：能繁母猪产能去化趋势延续 种植板块高景气依旧,新浪
159,2021-11-21,猪肉价格会涨到几时?,ZAKER
160,2021-11-21,IPO观察｜正大股份拟A股上市，中国市场已进不了前五，产能利用率远未饱和,搜狐
161,2021-11-21,农林牧渔行业：本周猪价延续反弹 关注后续去产能节奏,广发证券
162,2021-11-19,农业行业：黄鸡产能出清加速 价格有望迎反转,新浪
163,2021-11-19,温氏股份：公司今年的肉猪出栏目标为1100-1200万头，1-10月份已销售肉猪（含毛猪和鲜品）1079万头，明年为1800-2000万头,每日经济新闻
164,2021-11-19,温氏股份：公司首先立足国内市场，待时机成熟，再考虑拓展国外市场,每日经济新闻
165,2021-11-19,希望转2：农业龙头 二代再临,新浪
166,2021-11-19,【异动股】鸡肉概念板块下挫，温氏股份(300498.CN)跌3.49%,财华社
167,2021-11-19,北向资金减持榜单：22股减持市值超亿元 减持股份,证券时报网
168,2021-11-18,广东区域股市周报：新增2家上市公司 翰宇药业一周涨60.52%排第一,每日经济新闻
169,2021-11-18,国常会传来利好！海外机构扎堆调研这些公司，榨菜龙头最受关注,Wind
170,2021-11-18,年末密集调研，海外资管巨头盯上A股“便宜货”,Wind
171,2021-11-17,温氏股份接受51家机构调研！短期主力资金净流入，市场资金或早已察觉,每日经济新闻
172,2021-11-17,棱镜｜猪企9个月赔光三年利润，股价却暴涨50％，猪肉股可以抄底了？,腾讯网
173,2021-11-16,温氏股份：公司现有猪场竣工产能约4600万头，并非实际产出为4600万头,每日经济新闻
174,2021-11-16,温氏股份：公司对于新闻媒体论述及未来不确定的事项不做评价,每日经济新闻
175,2021-11-16,温氏股份：公司禽类产品主要是通过B端大批发渠道进行销售,每日经济新闻
176,2021-11-16,温氏股份：公司生产的仔猪，部分养23-25天至7公斤左右断奶后投放给农户，部分保育猪养55天左右至15公斤投放给农户,每日经济新闻
177,2021-11-16,农林牧渔行业周报：转基因品种审定办法落地 种业板块迎来重大变革,新浪
178,2021-11-16,农业2022年年度策略：周期轮回 布局养殖,新浪
179,2021-11-16,温氏股份：猪苗生产成本下降，预计年底完全成本降至8.7元/斤,新京报
180,2021-11-15,申万农林牧渔周观点：转基因品种审定办法落地 商业化进入倒计时阶段,新浪
181,2021-11-15,温氏投资业务进入“快车道”，资本力量为企业长远发展护航,凤凰网
182,2021-11-15,温氏股份：公司10月份自繁苗育肥猪降至9元/斤以下，环比下降明显,Wind
183,2021-11-15,猪价恢复至成本线上 养殖亏损情况有所缓解 亏损,经济观察网
184,2021-11-15,温氏股份接受35家机构调研！短期主力资金净流入，市场资金或早已察觉,每日经济新闻
185,2021-11-15,温氏股份：未来一段时间不会将楼房养猪作为主要发展方向,e公司
186,2021-11-12,温氏股份：公司和叮咚合作，是集团子公司与叮咚直接签约供货,每日经济新闻
187,2021-11-12,温氏股份：截至9月末，公司窝均健仔数已提升至10.3头,每日经济新闻
188,2021-11-11,温氏股份(300498.SZ)：超短期融资券获准注册,格隆汇
189,2021-11-11,农林牧渔行业：龙头企业出栏增长迅速 销售均重环比下滑 盈利能力下降,广发证券
190,2021-11-10,温氏股份：公司现阶段猪苗生产成本大幅下降，由今年初的650元/头持续降至9月底的430元/头左右，部分优秀的猪场单头猪苗生产成本低于280元,每日经济新闻
191,2021-11-10,温氏股份：公司5月份暂停外购猪苗，5月份之后的投苗均以自产猪苗为主,每日经济新闻
192,2021-11-10,温氏股份：目前运营四个冷库储存猪肉项目，但涉及储量相比公司肉猪产品规模仍然较小,每日经济新闻
193,2021-11-10,猪价暴涨前“下车” 10月上市猪企集体大量甩卖或亏损加剧 亏损,财联社
194,2021-11-10,猪粮比连续数日破6，能繁母猪存栏量决定猪周期趋势性拐点,Wind
195,2021-11-09,农林牧渔行业周观点：猪价继续震荡反弹 种业支持政策稳步推进,新浪
196,2021-11-09,猪粮比连续数日破6，能繁母猪存栏量决定猪周期趋势性拐点,第一财经
197,2021-11-09,温氏股份：根据公司前期投苗及生产周期，因5月份暂停外购猪苗，5月份之后的投苗均以自产猪苗为主，若按照正常出栏节奏，预计11月份后相比10月份出栏会有暂时性回落，之后逐月提升至正常生产水平,每日经济新闻
198,2021-11-09,温氏股份：公司暂无投资或者参股子公司在北交所挂牌上市,Wind
199,2021-11-09,猪周期拐点渐行渐近？猪企10月销售均价现企稳迹象,Wind
200,2021-11-09,温氏股份：公司投资管理事业部投资的股权项目有几个已在新三板挂牌,每日经济新闻
201,2021-11-09,温氏股份：公司5月份暂停外购猪苗，9月份投苗中均为自产猪苗,每日经济新闻
202,2021-11-09,温氏股份：10月销售肉猪收入24.86亿元，环比增长3.15%,资本邦
203,2021-11-09,中金固收中资美元债周报：二级市场再度走弱，负面评级频发,Wind
204,2021-11-09,温氏股份：2021年10月销售肉猪181.96万头 环比增7.11%,我的钢铁
205,2021-11-09,中信证券发布2022年海外中资股展望：价值崛起,Wind
206,2021-11-09,Wind风控日报2021年11月9日星期二,Wind
207,2021-11-09,上市公司正负面新闻2021年11月9日星期二,Wind
208,2021-11-09,温氏股份：长江证券、华泰柏瑞等15家机构于11月4日调研我司,证券之星
209,2021-11-09,重要信号！猪企10月销售均价现企稳迹象，猪周期拐点渐行渐近？,Wind
210,2021-11-08,温氏股份：2022年肉猪出栏目标为1800万-2000万头,新京报
211,2021-11-08,理财子公司密集调研后，这些“明星股”大涨,Wind
212,2021-11-08,温氏股份10月肉猪销售收入环比上涨3.15%,贝壳财经
213,2021-11-08,晚间重要公告2021年11月8日星期一,Wind
214,2021-11-08,【晚间公告抢先看】祖名股份上调部分植物蛋白饮品出厂价、ST中天股票累计涨幅较大 停牌核查,金融界
215,2021-11-08,温氏股份10月毛猪销售均价11.79元/公斤，同比下降60.38% 盈利能力下降,阿尔法工场
216,2021-11-08,温氏股份：10月销售肉鸡收入29.90亿元同比增长30.23%,新浪
217,2021-11-08,温氏股份(300498.SZ)：10月肉鸡收入同比升30.23%、环比升12.58%,格隆汇
218,2021-11-08,温氏股份：10月肉猪销售收入24.86亿元,新浪
219,2021-11-08,温氏股份：10月毛猪销售均价环比降1.75% 同比降60.38% 盈利能力下降,财联社
220,2021-11-08,温氏股份：10月肉猪销售收入环比增长3.15%,Wind
221,2021-11-08,农林牧渔2021年11月第1期周报：当前如何看待养殖和种业板块的投资机会？,新浪
222,2021-11-08,农林牧渔周观点：关注拉尼娜“再临”主题 重视养殖板块左侧布局价值,新浪
223,2021-11-08,温氏股份：预计年底完全成本降至8.7元/斤左右 逐步回归正常,e公司
224,2021-11-08,巨亏出清，温氏股份反转来临？ 重大损失,第一财经
225,2021-11-08,三季报一言难尽，私募大佬逆势加仓，“二师兄”有机会了？,Wind
226,2021-11-08,多家头部私募频频调研猪肉概念股,格隆汇
227,2021-11-06,股价大涨意味着投资逻辑生变 “超级猪周期”拐点到来的信号?,投资界
228,2021-11-06,Wind风控日报2021年11月6日星期六,Wind
229,2021-11-06,本周央行两度调升逆回购规模，国债期货大涨创两个月收盘新高｜债市综述,Wind
230,2021-11-05,信用债日报：地产债大跌并上演临停潮，世茂集团澄清传闻,Wind
231,2021-11-05,海外信用评级汇总2021年11月5日星期五,Wind
232,2021-11-05,惠誉：下调温氏股份的长期外币发行人违约评级至“BB+”，展望负面 主体评级下调,Wind
233,2021-11-05,A股2021年三季报分析总结：消费和房地产单季大幅负增长 拖累A股三季报显著低预期,新浪
234,2021-11-05,【行情】养殖业持续下行，巨星农牧跌超5%，民和股份、圣农发展、温氏股份跟跌,金十数据
235,2021-11-05,养猪、电力等行业何时迎拐点？机构预测15只业绩低潮股今年逆转,Wind
236,2021-11-04,基金、外资齐齐加仓“猪茅”，猪周期拐点来了？,Wind
237,2021-11-04,【行情】养殖股继续走强，益生股份、新希望、民和股份、圣农发展、温氏股份等涨幅居前,金十数据
238,2021-11-04,多家上市猪企透露价格反弹 供过于求局面短期或难改善,证券时报
239,2021-11-04,多家上市猪企透露价格反弹，供过于求局面短期或难改善,Wind
240,2021-11-04,大消费板块重回视野，机构积极调仓布局,Wind
241,2021-11-03,温氏股份今日大宗交易成交63.50万股，成交价13.53元折价22.51%,Wind
242,2021-11-03,【国君农业】生猪：行业全面亏损，“危”中看“机”——生猪养殖板块2021年三季报总结 亏损,农业凯歌
243,2021-11-03,温氏股份大宗交易成交63.50万股 成交额859.16万元,证券时报网
244,2021-11-03,多家上市猪企透露价格反弹 猪价回暖不宜过分乐观,e公司
245,2021-11-03,公募基金持股市值创新高，社保显著加仓周期股（附表）,Wind
246,2021-11-03,温氏股份现1笔大宗交易 共成交859.16万元,新浪
