2037,2019-10-15,片仔癀：看好公司打造国内一流健康养生品牌的发展前景,证券时报网
2038,2019-10-15,"医药生物行业:关注带量采购全国扩面,聚焦核心资产",东吴证券
2039,2019-10-12,三季报披露开闸 三行业迎估值切换行情,金融投资报
2040,2019-10-11,第六届中医药康博会即将召开！中医药产业如今有何看点？,格隆汇
2041,2019-09-24,拓展日化快速消费品，片仔癀能否维持高增长？,第一财经
2042,2019-09-20,"片仔癀现1笔大宗交易 共成交1,036.04万元",新浪
2043,2019-09-19,片仔癀今日大宗交易成交10.09万股，成交价102.68元溢价0.0%,Wind
2044,2019-09-12,高增长背后的隐忧：细数老字号片仔癀的喜与悲,中新网
2045,2019-09-05,"西部证券：将片仔癀评级调高为""买入""",Wind
2046,2019-09-04,【东吴医药】医药生物行业2019H1业绩总结：行业增速放缓，龙头引领增长，聚焦创新药产业链、创新生物制品、医疗服务等景气细分赛道,东吴医药研究团队
2047,2019-09-02,工信部公示2019年国家技术创新示范企业拟认定名单，多家上市公司在列,Wind
2048,2019-08-29,片仔癀因存在缺陷被通报！ 其他违规处罚,新浪
2049,2019-08-27,福建：同仁堂、片仔癀等药企存在缺陷被责令整改 食药监处罚,第一财经
2050,2019-08-27,肝病用药半年卖11亿！片仔癀三大独家产品称霸零售市场，无缘新医保后何去何从？,米内网
2051,2019-08-27,片仔癀：公司生产质量管理符合GMP要求，未发现产品质量问题 产品问题,Wind
2052,2019-08-27,片仔癀：公司生产质量管理符合GMP要求，未发现产品质量问题,e公司
2053,2019-08-26,片仔癀、同仁堂、归真堂……这些知名药企因缺陷被通报！ 食药监处罚,澎湃新闻
2054,2019-08-26,与华润分手20亿承诺成空 昔日白马股片仔癀何去何从,投资者报
2055,2019-08-25,【片仔癀】19年中报：Q2片仔癀系列稳步增长，原材料涨价锭剂毛利率下降 盈利能力下降,医心医意要健康
2056,2019-08-25,片仔癀发布半年报：“两翼”表现抢眼，肝病用药毛利率下滑 盈利能力下降,每日经济新闻
2057,2019-08-23,片仔癀半年报公布：净利润同比增两成，四大股东增持,投中网
2058,2019-08-23,片仔癀2019年上半年净利7.47亿已向5个国家提交海外注册申请,挖贝网
2059,2019-08-23,片仔癀：上半年净利润同比增20.89%,Wind
2060,2019-08-23,片仔癀(600436.SH)半年度净利润升20.89%至7.47亿元,格隆汇
2061,2019-08-23,片仔癀：上半年净利7.47亿元 同比增两成,e公司
2062,2019-08-22,片仔癀中药饮片存一般缺陷5项 遭福建药监责令整改 其他违规处罚,中国经济网
2063,2019-08-22,片仔癀产品存5项缺陷被勒令整改 股价却破了百元大关 其他违规处罚,中新经纬
2064,2019-08-22,片仔癀被要求整改:林园投资或减仓 汇添富等基金持有,新浪
2065,2019-08-22,刚刚!股价重回100的片仔癀被勒令整改 林园投资、汇添富会“跑”吗？ 其他违规处罚,金融界
2066,2019-08-22,片仔癀中药饮片因“一般缺陷5项”被福建省药监局勒令整改 其他违规处罚,中国网
2067,2019-08-20,"医药行业周报:中报行情有望延续,坚守医药创新及消费主线",西南证券
2068,2019-08-19,"片仔癀2019年追踪点评报告:购回华润片仔癀51%股权,继续保持平稳增长",浙商证券
2069,2019-08-16,与华润医药分道扬镳片仔癀业绩高增长难持续,中国经营网
2070,2019-08-13,未能熬过“七年之痒”，这两家药企宣布分道扬镳,制药网
2071,2019-08-13,华润医药与片仔癀正式分手，20亿承诺成空话，药中茅台流去何方,AI财经社
2072,2019-08-12,片仔癀与华润医药分手，业绩放缓存估值回归风险,格隆汇
2073,2019-08-12,祸不单行！片仔癀刚和华润“分手”又迎来股价跌停？,运营商财经网
2074,2019-08-12,白马股又崩了！抱团取暖还能持续多久？,中投网
2075,2019-08-12,片仔癀1.66亿买回合资公司股权 业绩增长亮红灯,新浪
2076,2019-08-11,闪崩！跌停！爆雷！“失蹄”的白马股，还是不是白马？,中国基金报
2077,2019-08-09,白马股扎堆闪崩！除了业绩大跌眼镜，还有这个原因 盈利能力下降,中证报
2078,2019-08-09,白马股至暗时刻？又有2只白马股“卧倒”，融资客出逃，北上资金却持续增持这只股,证券时报网
2079,2019-08-09,片仔癀与华润医药分道扬镳 合作成效不达预期股价跳水,GPLP犀牛财经
2080,2019-08-09,片仔癀与华润医药分手：1.66亿买回华润所持合资公司股权,澎湃新闻
2081,2019-08-09,企鹅球财 |片仔癀股价跳水一度逼近跌停 白马股爆雷延续？,腾讯网
2082,2019-08-09,白马玩闪崩！片仔癀、安琪酵母、中兴通讯惨暴跌 基金“抱团取暖”结束风险升级？ 连续下跌,金融界
2083,2019-08-09,片仔癀跳水8.86% 华润医药抛售华润片仔癀股权 资产异常,腾讯网
2084,2019-08-09,片仔癀午后持续走低 跌逾9%,e公司
2085,2019-08-09,【EEO财经午餐】7月鲜果价格上涨39.1%；郭台铭610亿增城项目将易主？买茅台要人脸识别了？吉药控股被立案调查；WhatsApp曝重大安全漏洞,经济观察网
2086,2019-08-09,片仔癀1.65亿元接盘合资公司与华润医药分道扬镳,全景网
2087,2019-08-09,七年之痒梦醒！片仔癀独自抚养与华润医药亲生子,新浪
2088,2019-08-08,片仔癀与华润难熬“七年之痒” 相濡以沫不如相忘于江湖,每日经济新闻
2089,2019-08-07,片仔癀(600436.SH)1.66亿元摘得华润片仔癀药51%股权,格隆汇
2090,2019-08-06,增厚业绩、助攻股价！寻找未被挖掘的涨价黑马,Wind
2091,2019-07-31,片仔癀：完成控股子公司片仔癀银之杰注销,Wind
2092,2019-07-31,"医药行业周报:科创板+中报密集披露,重点推荐创新+消费",西南证券
2093,2019-07-30,券商首次关注5股并给予买入评级（7月30日）,Wind
2094,2019-07-24,“痔疮一哥”马应龙跨界卖口红 美容真的不分上下？,GPLP犀牛财经
2095,2019-07-24,"医药生物行业2019年中报业绩前瞻:医药板块持续分化,寻找景气与避险的交集",申万宏源
2096,2019-07-22,聚焦医药的两个新变化-“政策趋缓+科创板映射” --医药行业周报（2019.07.15-2019.07.21）,兴证医药健康
2097,2019-07-21,【西南医药|0721周报】科创板正式落地，重点推荐南微医学+心脉医疗,国广有话说
2098,2019-07-21,【国盛医药张金洋团队】周观点：详解2019Q2机构医药持仓，继续推荐2+X主线,国医盛视
2099,2019-07-17,片仔癀医药业毛利高达近80% 暴利背后短板暴露无疑,运营商财经网
2100,2019-07-17,前海中国稀缺资产混合A基金十大重仓股曝光,Wind
2101,2019-07-17,片仔癀发布半年快报 高基数下业绩增速超20%,电鳗快报
2102,2019-07-17,周三机构一致看好的七大金股（07.17）,中金在线
2103,2019-07-16,医疗保健：医药盘前早知道 荐6股,东莞证券
2104,2019-07-16,【片仔癀】19H1快报点评：受宏观环境影响，短期增长有所放缓,医心医意要健康
2105,2019-07-16,片仔癀上半年业绩同比上涨 拟提供子公司2亿元贷款,资本邦
2106,2019-07-16,【天风医药】片仔癀：上半年业绩延续快速增长势头，营销拓展持续推进,思医辨药
2107,2019-07-16,【东吴晨报0716】【个股】锐科激光、南微医学、我武生物、片仔癀,东吴研究所
2108,2019-07-16,"片仔癀2019年中报业绩快报点评:受宏观环境影响,短期增长有所放缓 盈利能力下降",光大证券
2109,2019-07-16,"片仔癀:主产品高基数下平稳增长,化妆品预计高增速",国金证券
2110,2019-07-15,片仔癀：上半年公司营收同比增长20.36%，“一核两翼”业务 销售收入均有增加,经济观察网
2111,2019-07-15,片仔癀预计上半年营收净利双增长 同比上涨幅度均超20%,中证网
2112,2019-07-15,片仔癀：上半年净利润同比增20.61%（快报）,Wind
2113,2019-07-15,片仔癀(600436.SH)披露业绩快报 上半年净利润升20.61%至7.45亿元,格隆汇
2114,2019-07-15,片仔癀半年度业绩快报:净利润7.45亿 同比增长20.61%,新浪
2115,2019-07-15,片仔癀2019年上半年盈利7.45亿 同比增长21%,挖贝网
2116,2019-07-15,片仔癀业绩快报：上半年净利同比增20.61%,e公司
2117,2019-07-15,片仔癀：清算并注销控股子公司 减资破产,Wind
2118,2019-07-14,医疗保健：第二轮国家集中带量采购仍锁定25品种 荐9股,东吴证券
2119,2019-07-06,华润分手片仔癀:合资公司七年磨合不利 业绩不达预期,华夏时报
2120,2019-07-05,五大券商下周看好6板块35股,证券之星
2121,2019-07-04,千亿医药巨头“大甩卖”！华润片仔癀“分手”,晨哨网
2122,2019-07-03,中国“科”公司之东阿阿胶VS片仔癀:谁的科研实力强?,新浪
2123,2019-07-03,片仔癀高速增长后疲态渐露 多元化投资难当大任,投资者网
2124,2019-07-03,股价飙涨63倍后 高速增长的片仔癀露出了疲态,投资者报
2125,2019-07-02,片仔癀：董事、高级管理人员变动 董监高成员变化,Wind
2126,2019-07-01,1.66亿！知名药企收购华润子公司,赛柏蓝
2127,2019-06-30,片仔癀：拟收购华润片仔癀药业有限公司51%股权 买入评级,长江证券
2128,2019-06-29,中报预告：超六成公司业绩预喜 医药建材服装位列前茅,金融投资报
2129,2019-06-28,华润医药清仓式抛售华润片仔癀股权 片仔癀欲接盘 资产异常,新京报
2130,2019-06-28,公告点题｜6月28日这些公告有看头,第一财经
2131,2019-06-28,6月28日上市公司晚间公告速递,新浪
2132,2019-06-28,[快讯]6月28日晚间沪深两市重要公司公告一览-更新中,中财网
2133,2019-06-28,片仔癀：拟参与竞买华润片仔癀51%股权，获取全资控股权,Wind
2134,2019-06-28,片仔癀：拟参与竞买华润片仔癀51%股权,e公司
2135,2019-06-28,17只百元股呈现四大共性,证券日报
2136,2019-06-28,1.66亿抛售华润片仔癀股权，华润医药大健康版图再变动 资产异常,财华社
2137,2019-06-27,2019年中药饮片质量集中整治（生产环节）专项检查及处理情况公示（二） 产品问题,福建药监局
2138,2019-06-27,业绩不达标 华润医药退出与片仔癀的合资公司,北京商报
2139,2019-06-26,华润片仔癀不敌“七年之痒”,和讯
2140,2019-06-26,这些大品种，华润宣布退出！,赛柏蓝
2141,2019-06-26,医疗保健：安徽省率先开始省级高值耗材带量谈判 荐6股,渤海证券
2142,2019-06-26,欲与片仔癀“分手”，华润医药拟转让所持合资公司全部股权,每日经济新闻
2143,2019-06-24,"医药生物行业:医药政策进入密集落地期,聚焦科创板、医药创新和医药消费",东吴证券
2144,2019-06-19,片仔癀(600436.SH)拟每10股派6元 股权登记日为6月26日,格隆汇
2145,2019-06-19,片仔癀：年报推10派6元 股权登记日6月26日,金融界
2146,2019-06-16,医疗保健：继续看多创新消费和器械 荐13股,西南证券
2147,2019-06-09,医疗保健：医保控费政策进入常态化运行阶段 荐9股,东吴证券
2148,2019-06-07,6成上市公司中报预喜 医药食品服装含金量高,金融投资报
2149,2019-06-05,「药你说」6家中药老字号悉数调降制药业务 云南白药变身成日化企业？,和讯
2150,2019-06-05,"医药行业政策点评:医改任务清单落地,改革进入深水区",西南证券
2151,2019-06-05,"2019年6月医药行业投资策略:行业数据逐渐回暖,政策推动结构分化",西南证券
2152,2019-05-24,产业观察|困在南边的片仔癀,和讯
2153,2019-05-21,"片仔癀:核心品种片仔癀高增长,两翼产品发力",正点财经
2154,2019-05-19,片仔癀到涨价天花板了吗,证券市场周刊
2155,2019-05-14,【华泰医药代雯团队】医药行业2019年中期策略：屈盘侧白马，劈浪把龙头,谈医论股丨华泰医药
2156,2019-05-09,医药板块估值重塑性价比优势凸显 六股值得关注,证券时报网
2157,2019-05-07,应收账款票据五年升三倍片仔癀高增长背后经营活动现金流承压,投资时报
2158,2019-05-05,片仔癀一季度净利4.04亿元同比增长24% 现金流量净额为5亿元,挖贝网
2159,2019-04-29,【西南医药】片 仔 癀（600436）：核心产品高基数新增速，日化板块略超预期,国广有话说
2160,2019-04-29,【华泰医药代雯团队】片仔癀 (600436) 季报点评：高基数下维持快速增长,谈医论股丨华泰医药
2161,2019-04-29,片仔癀：业绩符合预期，同比高基数下增速可观,证券时报网
2162,2019-04-29,【东吴医药】医药周观点20190429:基金医药持仓比例11.3%，较2018年略有提升，建议积极关注有业绩保障的公司,东吴医药研究团队
2163,2019-04-29,片仔癀主业成本上涨压力凸显 多元业务发展步伐缓慢,投资者网
2164,2019-04-29,【中银医药】片仔癀2019Q1点评：业绩增速略低于预期，透视“低于预期”背后的原因,周观宇论
2165,2019-04-28,【东吴医药】片仔癀2019年一季报点评：2019年Q1片仔癀销售增速稳定，业绩增长23.99%，符合预期,东吴医药研究团队
2166,2019-04-26,公告点题｜今晚这些公告有看头（更新中）,第一财经
2167,2019-04-26,上海家化一季度利润增55% 玉泽、片仔癀牙膏增逾50%,新浪
2168,2019-04-26,片仔癀(600436.SH)一季度净利润升23.99%至4.04亿元,格隆汇
2169,2019-04-26,片仔癀：一季度净利逾4亿元 同比增长24%,e公司
2170,2019-04-26,片仔癀：一季度净利润同比增23.99%,Wind
2171,2019-04-25,【中信建投医药】科创板系列研究之诺康达：专注药学制剂的研发外包企业,菊颖医药观察
2172,2019-04-22,【天风医药】一周医讯：医药后市更值得期待，持续关注“三条主线”,思医辨药
2173,2019-04-22,【东吴医药】医药周观点20190421:关注医保局动态，把握医药科创板行情,东吴医药研究团队
2174,2019-04-19,片仔癀估值过高引质疑：一粒售价十年涨幅165%，毛利率创2013年以来新低,华夏时报
2175,2019-04-19,"医药生物行业:增值税减税潜在业绩弹性测算,减税提供弹性,关注高毛率、低净利率标的",正点财经
2176,2019-04-18,【华泰医药代雯团队】片仔癀(600436)年报点评：小锭剂、大乾坤，加速成为全国性产品,微信
2177,2019-04-18,"片仔癀:四季度恢复高速增长,全国化进程仍在继续",浙商证券
2178,2019-04-17,老字号片仔癀的烦恼：价格涨了，毛利却创了8年新低,中新经纬
2179,2019-04-16,招商证券：上调片仔癀评级至强烈推荐,Wind
2180,2019-04-16,片仔癀：片仔癀维持快速增长 买入评级,和讯
2181,2019-04-16,"【国金晨讯】特别的新东方,焦虑的在线教育；Ucloud差异化是破局关键；科创机器人缘何青睐系统集成？工程机械龙头能否超越上轮高点",国金证券研究所
2182,2019-04-16,【天风医药】片仔癀：2018年业绩实现高增长，2019年有望延续良好的发展态势,思医辨药
2183,2019-04-16,"医药生物行业2019年一季报前瞻:行业增速全年预期前低后高,加大配置中小市值标的",证券之星
2184,2019-04-16,"片仔癀:核心品种继续放量,有望借产业兼并扩张",国金证券
2185,2019-04-15,科创板受理企业达72家 A股概念炒作明显降温,第一财经
2186,2019-04-15,医疗保健：关注创新题材与业绩估值高性价比个股 荐10股,东兴证券
2187,2019-04-15,片仔癀(600436)：片仔癀系列产品持续高速增长 驱动公司业绩快速释放,东吴证券
2188,2019-04-15,【中银医药】片仔癀2018年报点评：业绩略超预期，核心品种稳健增长,周观宇论
2189,2019-04-15,"招商证券：将片仔癀评级调高为""强烈推荐""",Wind
2190,2019-04-15,【片仔癀】年报点评：品牌知名度扩大，产品增长持续可期,医心医意要健康
2191,2019-04-14,片仔癀去年净利11.43亿同比增42% 董事长刘建顺年薪44万元,挖贝网
2192,2019-04-13,科创板受理公司猛增至72家！哪些省市领跑、哪家券商保荐最多？这是最新排名,中国基金报
2193,2019-04-12,片仔癀2018年净利增四成 四季度获证金增持,大众证券报
2194,2019-04-12,上市公司业绩精选：片仔癀2018年净利同比增41.62％拟10派6元,金融界
2195,2019-04-12,一图读财报：片仔癀2018年度净利同比增长41.62%,发布易
2196,2019-04-12,片仔癀(600436.SH)2018年度净利润升41.62%至11.43亿元 拟10派6元,格隆汇
2197,2019-04-12,片仔癀：2018年净利润11.43亿元 拟10派6元,金融界
2198,2019-04-12,片仔癀：2018年净利11.43亿元 同比增42%,e公司
2199,2019-04-12,片仔癀：2018年净利润同比增41.62%，拟10派6元,Wind
2200,2019-04-10,"医药生物行业跨市场周报:建议关注医药国改机会,港股医药配置价值凸显",光大证券
2201,2019-04-08,【天风医药】一周医讯：看好医药板块行情，重点关注生物类细分领域及医药大消费投资机会,思医辨药
2202,2019-04-07,医疗保健：医药行业2019Q1业绩前瞻 荐1股,长江证券
2203,2019-04-01,一边驴皮跌价一边无力涨价 东阿阿胶扣非净利十年首次下挫,投资时报
2204,2019-03-28,巡市|广誉远赚的钱都去哪了？每年现金“亏损”超亿元 亏损,腾讯网
2205,2019-03-20,"医药周观点:业绩浪、长期资金持续流入,医药蓝筹白马股价历史新高再新高",联讯证券
2206,2019-03-18,医疗保健：行业增速预期有望提升 荐10股,和讯
2207,2019-03-18,医疗保健：业绩浪 长期资金持续流入,联讯证券
2208,2019-03-18,医药板块科技+消费双重属性 6股迎腾飞契机,中证报
2209,2019-03-12,这个人很懒，什么也没有留下 . . .,华夏时报网
2210,2019-03-11,"医药行业周报;医保控费趋严,需更加重视CRO/CMO投资价值",证券之星
2211,2019-03-11,"片仔癀:原料无虞,2019年有望继续放量",国金证券
2212,2019-03-11,"医药生物行业:科创板助力,带动医药板块估值回升",东吴证券
2213,2019-03-08,医药生物行业2018年报前瞻:行业增速预期有望提升、加大配置中小市值标的,正点财经
2214,2019-03-06,片仔癀今日大宗交易成交2.18万股，成交价96.26元折价8.97%,Wind资讯
2215,2019-03-04,【天风医药】3月月报：寻找低估值滞涨同时业绩有望向上的标的，关注科创板影响,思医辨药
2216,2019-03-03,【天风医药】一周医讯：寻找低估值业绩向上标的，关注科创板对医药板块的影响,思医辨药
2217,2019-03-03,【中银医药】行业增速预期有望提升、加大配置中小市值标的---医药生物行业2018年报前瞻,周观宇论
2218,2019-02-28,行业第一品牌的顶层设计和底层运营,钛媒体
2219,2019-02-26,"医药生物行业周报:科创板加快,创新药产业链标的估值有望重构",西南证券
2220,2019-02-25,【天风医药】一周医讯：继续看好后续医药板块行情，关注业绩高增长标的,思医辨药
2221,2019-02-25,"医药生物行业:两会政策决定医药产业走势,政策免疫板块仍是首选",东吴证券
2222,2019-02-24,医疗保健：继续推荐确定性高的细分行业 荐3股,中银国际
2223,2019-02-19,"医药生物行业基于2000余份新春调查问卷结果的分析研究:知否知否,医药消费应是愈浓愈厚",正点财经
2224,2019-02-19,"医药行业周报2019第7期:修复或将持续,提前布局业绩高增长标的",长城证券
2225,2019-02-18,"医药生物行业:居民医药消费需求依旧刚性,紧抓业绩高增长个股",东吴证券
2226,2019-02-14,25股获券商买入评级 保利地产目标涨幅达55.27%,Wind
2227,2019-02-14,中信建投晨会0214 | 医药板块投资机会；红宝丽、片仔癀、万科A,中信建投证券研究
2228,2019-02-13,片仔癀：业绩增速环比加快 买入评级,广发证券
2229,2019-02-13,"片仔癀:控货因素解除,业绩恢复高速增长",正点财经
2230,2019-02-13,【东吴晨报0213】【行业】公用事业【个股】三七互娱、新洋丰、片仔癀、绿盟科技,东吴研究所
2231,2019-02-13,片仔癀净利11亿上市15年增18倍 联手上海家化涉足口腔护理亏1.25亿,长江商报
2232,2019-02-13,片仔癀去年净利润增40% 两大养麝基地将助增业绩,证券日报
2233,2019-02-13,"片仔癀2018年业绩快报点评:控货仍有高增长,19销量增速有望再上台阶",光大证券
2234,2019-02-12,大过年的，买点片仔癀,财华社
2235,2019-02-12,片仔癀：单季度业绩高增长 略超市场预期,西南证券
2236,2019-02-12,23股获券商买入评级 万科A目标涨幅达62.63%,Wind
2237,2019-02-12,12日最新公告透露利好 12只个股有潜力,中金在线
2238,2019-02-11,涨停板早知道：七大利好明日有望发酵,新浪
2239,2019-02-11,公告精选：中国电影源于《流浪地球》的收益暂为约1亿元；片仔癀去年净利同比增40%,e公司
2240,2019-02-11,受益核心产品销售增长 片仔癀2018年净利润预增近40%,中证网
2241,2019-02-11,片仔癀(600436.SH)2018年度扣非净利润升43.03%至11.09亿元,格隆汇
2242,2019-02-11,片仔癀：2018年净利11.28亿元 同比增40%,e公司
2243,2019-02-11,片仔癀：2018年净利润11.28亿元，同比增39.83%,Wind
2244,2019-02-01,医药和周期行业“超级明星股”剖析,红周刊
2245,2019-01-31,"医药行业周报:创新药产业链为长期主题,重点推荐恒瑞医药、药石科技",西南证券
2246,2019-01-30,医药行业周报:三类医药股的不同投资策略,正点财经
2247,2019-01-30,"医药生物行业深度研究:忆往昔,观今朝,中药板块价值几何",正点财经
2248,2019-01-30,医药行业周报:上海卫健委进一步规范自费药品采购及使用管理,渤海证券
2249,2019-01-29,"片仔癀:一核两翼战略持续推进,预计2018年业绩持续高增长",证券之星
2250,2019-01-29,"医药行业周报:集采落地期多管齐下确保用量,绩报期关注确定性高的标的-",证券之星
2251,2019-01-25,"医药行业周报:利空政策落地,近期有望止跌回升",西南证券
2252,2019-01-22,销售劣药，片仔癀、九州通等多家知名药企被罚，最高111万！ 食药监处罚,医药观察家网
2253,2019-01-16,医药行业周报:大连市首发4+7集采工作方案,渤海证券
2254,2019-01-14,"医药生物行业周报:创新药逻辑不变,医疗器械受青睐",西南证券
2255,2019-01-09,片仔癀今日大宗交易成交6.03万股，成交价85.2元折价0.0%,Wind资讯
2256,2019-01-09,医药行业周报:“轻药重医”为正道,西南证券
2257,2019-01-08,"2019年1月医药行业投资策略:“轻药重医”为正道,首推医疗器械板块",西南证券
2258,2019-01-08,"医药行业周观点:2019推荐配置具备消费属性的医药标的,持续推荐长春高新、我武生物等标的",东吴证券
2259,2019-01-04,"医药与健康护理行业:政策扰动大,短期关注政策免疫标的",正点财经
2260,2018-12-27,"东吴医药行业周观点:首个国产PD-1获批上市,药政持续改革加快创新药进程",东吴证券
2261,2018-12-26,医疗保健：辅助用药将进一步边缘化 荐11股,渤海证券
2262,2018-12-24,"医药行业周报:“药”保守,“轻药重医”为正道",西南证券
2263,2018-12-21,"医药行业周报:有奖举报医保欺诈行为,长期利好药店连锁龙头",渤海证券
2264,2018-12-20,三部门发文推进道地药材基地建设 六股布局良机,中财网
2265,2018-12-19,"医药行业周观点:带量采购试点落地、辅助用药管理通知出台,政策主导医药板块加速完成调整",东吴证券
2266,2018-12-17,"医药生物行业周报:政策多发扰动期,建议关注品牌中药的配置价值",光大证券
2267,2018-12-16,几乎不受“带量采购”影响的5类药,巨丰财经
2268,2018-12-12,融资客青睐14股，嘉化能源买入占比高达41.69%,Wind
2269,2018-12-12,"东吴医药行业周观点:“4+7”带量采购落地,25个中标品种平均降幅达52.2%,医药板块加速出清",东吴证券
2270,2018-12-11,"医药行业周报:4+7仿制药带量采购落地,“轻药重医”正当时",西南证券
2271,2018-12-07,A股国际化步伐再加速，逾七成MSCI成份股受机构青睐,证券日报
2272,2018-12-04,"医药行业周报:仿制药格局变革、器械崛起,轻药重医",西南证券
2273,2018-12-04,"医药行业2018年12月投资策略:医疗器械崛起,持续重点推荐行业龙头",西南证券
2274,2018-12-03,医药行业周报:重点关注医保控费和带量采购影响小的板块,证券之星
2275,2018-12-01,银河基金袖珍产品再扩容 袁曦挂帅新品成迷你司令？,新浪
2276,2018-11-27,"医药行业周报:仿制药格局变革、器械崛起,轻医重药",西南证券
2277,2018-11-26,估值处于相对底部区域，医药板块迎来修复行情,证券时报
2278,2018-11-24,渠道结构优化近尾声 东阿阿胶有望现戴维斯双击,红周刊
2279,2018-11-22,片仔癀：马钱子总碱囊泡凝胶获临床试验批件,e公司
2280,2018-11-22,试点带量采购模式落地 医药生物板块领跑两市,大众证券报
2281,2018-11-21,医疗保健：仿制药格局变革 荐9股,西南证券
2282,2018-11-11,医疗保健：当下对医药板块可适度乐观 荐10股,中银国际
