513,2021-08-19,片仔癀今日大宗交易成交15.85万股，成交价378.34元溢价0.0%,Wind
514,2021-08-19,股价创出新高之际，深圳燃气遭新希望集团抛出第三轮减持计划 拟减持股份,经济观察网
515,2021-08-19,A股早报2021年8月19日星期四,Wind
516,2021-08-19,片仔癀8月18日现4笔大宗交易,证券时报网
517,2021-08-18,A股共发生190宗大宗交易成交48.12亿元（8月18日）,Wind
518,2021-08-18,片仔癀今日大宗交易成交31.68万股，成交价375.43元溢价0.0%,Wind
519,2021-08-17,"片仔癀现1笔大宗交易 共成交3,899.98万元",新浪
520,2021-08-17,六年首次，A股19天超万亿成交！北上资金买了啥,Wind
521,2021-08-16,医药指数重仓股分析来了！,制药网
522,2021-08-16,减持公告砸盘，9股出逃超10亿，42家大额解禁即将来袭,Wind
523,2021-08-16,医药指数重仓股分析，这些企业成为核心资产,制药网
524,2021-08-16,医药生物行业周报：医疗服务三问三答 何时会出现板块性机会？,新浪
525,2021-08-15,车界“片仔癀”汽车芯片价格疯涨！监管总局：严查！,ZAKER
526,2021-08-13,"片仔癀现2笔大宗交易 共成交7,992.21万元",新浪
527,2021-08-12,华西策略：集中于中高端制造领域 指向未来新经济,新浪
528,2021-08-12,"片仔癀现1笔大宗交易 共成交5,996.08万元",新浪
529,2021-08-12,片仔癀今日大宗交易成交15.41万股，成交价389.01元溢价0.0%,Wind
530,2021-08-12,财信证券医药生物行业2021年8月月度报告：坚守高景气，关注高性价比个股,财信证券研究
531,2021-08-11,片仔癀今日大宗交易成交0.80万股，成交价394.68元溢价0.0%,Wind
532,2021-08-11,片仔癀现1笔大宗交易 共成交315.74万元,新浪
533,2021-08-10,"片仔癀现1笔大宗交易 共成交5,996.06万元",新浪
534,2021-08-10,片仔癀今日大宗交易成交15.33万股，成交价391.01元溢价0.0%,Wind
535,2021-08-10,“药中茅台”片仔癀退烧 黄牛卖价比官方价还低,快科技
536,2021-08-10,A股风格快速切换：金融地产绝地反击，热门赛道“停车休整”,Wind
537,2021-08-09,片仔癀炒作“退烧”：黄牛报价每粒550，门店称供应已缓解,Wind
538,2021-08-09,"片仔癀现1笔大宗交易 共成交3,625.52万元",新浪
539,2021-08-09,A股风格分化背后：外资加仓“老白马”，两融资金涌入周期股,Wind
540,2021-08-09,片仔癀今日大宗交易成交9.56万股，成交价379.29元溢价0.0%,Wind
541,2021-08-09,北方华创技术驱动三年累投36亿研发 重组5年股价涨22倍近四个月涨300元,长江商报
542,2021-08-07,林园回应“怒怼投资者”：外界误读，本意是提示风险,Wind
543,2021-08-07,千亿中药巨头半年蒸发802亿，股民人均亏损64万，怎么回事？ 亏损,搜狐
544,2021-08-05,"片仔癀现1笔大宗交易 共成交3,996.18万元",新浪
545,2021-08-05,片仔癀今日大宗交易成交10.49万股，成交价380.98元溢价0.0%,Wind
546,2021-08-05,天价片仔癀炒作“熄火”,中国经营网
547,2021-08-04,片仔癀分拆上市“阳谋”：1.5亿成立化妆品商贸公司，“药中茅台”押注颜值经济,华夏时报
548,2021-08-04,"片仔癀现1笔大宗交易 共成交5,996.23万元",新浪
549,2021-08-04,扶起中药靠创新还是多元化？云南白药、片仔癀之路可复制吗？,E药经理人
550,2021-08-04,5-6月化妆品双月报：化妆品及洗护用品进口金额为649.8亿,亿邦动力
551,2021-08-04,游戏产业将变天？北上积极调仓聚焦两大板块,Wind
552,2021-08-03,扶起中药，靠创新还是多元化？云南白药，片仔癀之路可复制吗？连续多年个位数上新背后，真的委屈吗？,E药经理人
553,2021-08-03,北上资金不惧调整逆势增仓，三季度重拾传统“大白马”,Wind
554,2021-08-03,"片仔癀现1笔大宗交易 共成交1,999.99万元",新浪
555,2021-08-03,片仔癀今日大宗交易成交5.29万股，成交价378.07元溢价0.0%,Wind
556,2021-08-03,医药生物行业周观点：短期波动加剧 持续关注中报业绩,新浪
557,2021-08-03,2000亿芯片龙头跌停！本轮科技股行情拐点到了吗？,Wind
558,2021-08-02,片仔癀现1笔大宗交易 共成交234.86万元,新浪
559,2021-08-02,片仔癀今日大宗交易成交0.63万股，成交价372.8元溢价0.0%,Wind
560,2021-08-02,“你算老几”引发惨案，芯片股集体大跌！风向要变？,Wind
561,2021-08-02,回眸大健康——2021年7月医药大事记,中国经济网
562,2021-07-31,医药行业周报：散点疫情偶发 寻找“脱敏”品种,西南证券
563,2021-07-30,北向资金今日净买入22.47亿元，对白酒股态度分化,Wind
564,2021-07-30,半年吸金11亿 “中药股一哥”3个1类新药搅局万亿市场,米内网
565,2021-07-30,北京当地医保发布|药监局召回一批医疗器械|维生素B6注射剂说明书修订|以岭药业|基石药业|片仔癀|步长制药 产品问题,艾美达行业研究
566,2021-07-30,半年吸金11亿，“独家布点”超300个！“中药股一哥”3个1类新药搅局万亿市场,米内网
567,2021-07-30,策略日报：指数午后回暖 通信板块领涨,新浪
568,2021-07-30,片仔癀市值突然蒸发超600亿 18年首遭控股股东减持何去何从 连续下跌,投资者网
569,2021-07-29,市场思考随笔之六十五：“宁”与“茅”分化的背后,新浪
570,2021-07-29,县市场监管局“三到位”排查“片仔癀”违法销售情况,钢企网
571,2021-07-29,"片仔癀现3笔大宗交易 共成交12,236.01万元",新浪
572,2021-07-29,片仔癀今日大宗交易成交30.81万股，成交价381.79元溢价0.0%,Wind
573,2021-07-29,片仔癀到底是“药”还是“茅”？,澎湃新闻
574,2021-07-29,张坤、谢治宇、刘格菘们已行动，新能源基金开始调仓,Wind
575,2021-07-29,片仔癀：片仔癀是药品，锭剂有效期60个月，胶囊有效期36个月,每日经济新闻
576,2021-07-28,"片仔癀现3笔大宗交易 共成交8,489.47万元",新浪
577,2021-07-28,北向资金今日净买入80.53亿元，东方雨虹获净买入近12亿元,Wind
578,2021-07-28,片仔癀今日大宗交易成交21.14万股，成交价378.02元溢价0.0%,Wind
579,2021-07-28,A股收盘综述：沪指四连跌，创业板指止跌反弹,Wind
580,2021-07-28,A股异动丨片仔癀(600436.SH)反弹4.75% 此前四日累跌逾26% LDS片获批进行临床试验,格隆汇
581,2021-07-28,A股反弹，茅台急剧拉升，宁德时代大涨,Wind
582,2021-07-28,片仔癀7月27日现2笔大宗交易,证券时报网
583,2021-07-28,市场资金面周观察：北上资金波动加大市场风险偏好回落,新浪
584,2021-07-28,强势股补跌沪指失守3400点，机构称下跌带来优质股布局机会,Wind
585,2021-07-27,“茅”头狂跌！A股遭遇黑色星期二，恒生科技指数创史上最大跌幅…这类股票却逆市上涨，发生了什么？ 连续下跌,证券时报
586,2021-07-27,片仔癀(600436.SH)：与上海璃道医药合作研发的LDS片获批临床试验,格隆汇
587,2021-07-27,片仔癀(600436.SH)：用于治疗纤维肌痛的LDS 片临床试验申请获批,智通财经
588,2021-07-27,片仔癀：收到国家药品监督管理局签发的《药物临床试验批准通知书》,格隆汇
589,2021-07-27,片仔癀：LDS片获批进行临床试验,财联社
590,2021-07-27,片仔癀：LDS片收到《药物临床试验批准通知书》,Wind
591,2021-07-27,A股、港股双双跳水，发生了什么？,Wind
592,2021-07-27,片仔癀今日大宗交易成交21.88万股，成交价360.98元溢价0.0%,Wind
593,2021-07-27,同仁堂，为何追不上片仔癀？,第一财经
594,2021-07-27,解盘：资金回流科技发威，光刻胶、芯片、网络安全领涨,Wind
595,2021-07-27,记者探店片仔癀！谁在助推“神药”1500元一粒还被疯抢？,中国经济周刊
596,2021-07-27,自股东减持以来片仔癀股价连续下跌 今日盘中大跌超6% 减持股份,新浪
597,2021-07-27,医药龙头短线再度跳水，通策医疗跌近6%,Wind
598,2021-07-27,机构扎堆出逃 10股被过亿资金甩卖,财富动力网
599,2021-07-27,机构扎堆出逃 10股被过亿资金甩卖,投资快报
600,2021-07-26,片仔癀1.5亿成立化妆品商贸公司,北京商报
601,2021-07-26,大跌！散户慌了 机构投资人却在泰山“淡定”旅游 林园：涨多了就跌是正常现象,红周刊
602,2021-07-26,大跌散户慌了：机构投资人却在泰山“淡定”旅游 另有机构争分夺秒加仓,红周刊
603,2021-07-26,股指集体走弱 白酒和医疗大幅杀跌,至诚财经
604,2021-07-26,"片仔癀现2笔大宗交易 共成交6,498.65万元",新浪
605,2021-07-26,暴涨18倍后，千亿市值大牛股跌停，神话就此破灭？,投资家
606,2021-07-26,二季末被84只公募基金重仓的片仔癀，今日盘中再度跌停！,红周刊
607,2021-07-26,片仔癀今日大宗交易成交15.34万股，成交价391.25元折价0.03%,Wind
608,2021-07-26,2大超级赛道大跌7%，下一个是谁？4大信号透露玄机,Wind
609,2021-07-26,片仔癀成立化妆品商贸公司，注册资本1.5亿,搜狐
610,2021-07-26,医药板块大幅走低，华熙生物跌逾15%，片仔癀3日跌逾20%,证券时报网
611,2021-07-26,千亿巨头闪崩跌停潮：茅台跌1000亿，腾讯跌7%,Wind
612,2021-07-26,三大股指早盘杀跌，“喝酒吃药”大调整！贵州茅台创年内新低，通策医疗跌停 连续下跌,上证报
613,2021-07-26,A股午盘综述：三大指数均跌逾2%，茅指数、宁组合集体大跌,Wind
614,2021-07-26,中药板块走弱 片仔癀触及跌停,格隆汇
615,2021-07-26,【行情】片仔癀触及跌停，成交额超37亿元,金十数据
616,2021-07-26,医药股全线杀跌，通策医疗跌停,Wind
617,2021-07-26,融资客青睐13股，陕天然气买入占比高达49.30%,Wind
618,2021-07-26,A股融资融券日报：两融余额减少25.75亿元（7月23日）,Wind
619,2021-07-26,北上资金重点加仓名单来了！22股连续七周加仓,Wind
620,2021-07-26,意在遏制市场炒作？片仔癀控股股东首次披露减持计划 拟减持股份,证券日报
621,2021-07-25,"明星基金经理投资风向已变？二季度早已布局这些""宁指数""标的",红周刊
622,2021-07-24,锂电池疯狂再度刷屏 片仔癀股东减持打击信心 减持股份,财富动力网
623,2021-07-24,面板头龙上半年业绩大涨10倍，这周却被北向资金抛售26亿元！,ZAKER
624,2021-07-24,"每周大事｜礼来中国抗肿瘤事业部副总裁钱江离职；片仔癀大股东首次减持将套现30亿；康希诺上半年实现营业收入20-22亿元
董监高成员变化",思齐俱乐部
625,2021-07-23,大股东减持片仔癀，新董事长不为套现为“灭火”？ 减持股份,环球老虎财经
626,2021-07-23,片仔癀现1笔大宗交易 共成交503.81万元,新浪
627,2021-07-23,中药企业“淘金”大健康产业成趋势！,制药网
628,2021-07-23,A股震荡下行超46亿外资暂时撤离，新能源产业链股遭大幅抛售,Wind
629,2021-07-23,突发大风暴！新东方一度崩了50%，400亿灰飞烟灭,Wind
630,2021-07-23,新董事长上任3月国资拟高位套现 片仔癀单日市值蒸发295亿元 减持股份,产业经济新闻网
631,2021-07-23,市场活跃 震荡反复,第一财经
632,2021-07-23,“中药茅”片仔癀午后大跌逾7% 成交额超43亿元 连续下跌,新浪
633,2021-07-23,3大千亿白马重挫，锂电牛股跌13%！券商股却火了,Wind
634,2021-07-23,A股午盘综述：创业板指下挫1.8%，券商领衔周期股逆势走强,Wind
635,2021-07-23,片仔癀(600436.SH)连续第二日大跌 上市18年首遭大股东减持 连续下跌,格隆汇
636,2021-07-23,医药行业2021Q2持仓分析：医药仓位持续回升 核心资产继续分化,西南证券
637,2021-07-23,片仔癀（600436）龙虎榜解析（7-22）沪股通、机构上榜,证券之星
638,2021-07-23,13股中报估值大幅下降+股价上涨空间超30%,Wind
639,2021-07-23,7家医药公司7月22日现大宗交易，累计成交2.37亿元,制药网
640,2021-07-23,3000亿中药茅突然闪崩跌停！北上资金和机构狂砸盘,Wind
641,2021-07-23,资金疯狂出逃 !市值蒸发 200 亿! 片仔癀大股东变现套路引发投资者不满 连续下跌,财富动力网
642,2021-07-23,半年翻四倍，大股东按捺不住终于舍得卖了!,财富动力网
643,2021-07-23,A股早报2021年7月23日星期五,Wind
644,2021-07-23,中报估值大幅下降+股价上涨空间超30%仅13股(名单) 盈利能力下降,中财网
645,2021-07-23,每日理财观察：新时代推动中部地区高质量发展的意见发布,Wind
646,2021-07-23,大股东高位减持，片仔癀市值一日蒸发300亿,斑马消费
647,2021-07-23,资金疯狂出逃，市值蒸发200亿！片仔癀大股东变现套路引发投资者不满,投资快报
648,2021-07-23,北向资金连续4日净流入A股；7.58亿资金出逃，“药茅”片仔癀跌停,21世纪经济报道
649,2021-07-23,北向资金动向盘点：重手净买金融，大额净卖医药,Wind
650,2021-07-23,跌懵了！“喝酒吃药”一天亏掉1亿多瓶茅台，原因竟是它！中报估值大幅下降+股价上涨空间超30%仅13股,证券时报网
651,2021-07-23,控股股东系国资背景 片仔癀股东减持释放啥信号 减持股份,新浪
652,2021-07-23,3000亿中药茅突然闪崩跌停！北上资金和机构狂砸盘,中国基金报
653,2021-07-22,近3000亿“药中茅台”惨烈跌停，一天296亿市值灰飞烟灭！机构也疯狂甩卖8亿，发生了什么？,每日经济新闻
654,2021-07-22,减持公告吓坏中药龙头 片仔癀罕见跌停市值蒸发300亿 减持股份,证券时报网
655,2021-07-22,股价创下新高 股东减持套现 片仔癀跌停 减持股份,新京报
656,2021-07-22,放量跌停！两月飙涨2倍的广誉远神话讲完了？,格隆汇
657,2021-07-22,今日热文精选 | 暴雨中财产受损，保险怎么赔？科创板两周年交出硬核成绩单,财经网
658,2021-07-22,大股东减持套现近 30 亿元！“中药一哥”片仔癀市值蒸发 200 多亿 减持股份,ZAKER
659,2021-07-22,大资金排队跑路：超级牛股片仔癀高位跌停 大股东要甩货 关联方问题,新浪
660,2021-07-22,沪港通十大成交活跃股排名（7月22日）,Wind
661,2021-07-22,视频|单日市值蒸发296亿！“药茅”片仔癀被投资者怒砸跌停 连续下跌,北京商报
662,2021-07-22,大资金排队跑路，超级牛股高位跌停，大股东要甩货！ 这个板块彻底火了，6只概念股获主力资金和北上资金同时增持，明星基金盯上龙头,e公司
663,2021-07-22,片仔癀龙虎榜数据（7月22日）,Wind
664,2021-07-22,数据复盘｜主力资金撤离医药股 北向资金连续4日净流入,证券时报网
665,2021-07-22,股东套现近30亿，“药中茅台”一字跌停，市值一日蒸发296亿！,医药观察家网
666,2021-07-22,大股东甩货30亿，“药茅”片仔癀惨烈跌停，机构、北向也慌了,21世纪经济报道
667,2021-07-22,A股惊现一大“乌龙指”,证券之星
668,2021-07-22,速读社丨片仔癀大股东首次减持将套现30亿 辉瑞2款JAK抑制剂美国审查延期 减持股份,新浪医药
669,2021-07-22,机构今日买入这19股，抛售片仔癀1.70亿元丨龙虎榜,第一财经
670,2021-07-22,首遭控股股东减持，片仔癀“牛势”会否因此生变？ 减持股份,财经网
671,2021-07-22,"片仔癀现1笔大宗交易 共成交5,995.58万元",新浪
672,2021-07-22,大股东拟减持套现30亿，片仔癀跌停，沪股通净卖出近6亿 拟减持股份,第一财经
673,2021-07-22,片仔癀今日大宗交易成交13.60万股，成交价440.78元溢价0.0%,Wind
674,2021-07-22,北向资金连续4日“买买买”累计加仓超160亿，歌尔股份净买入额创逾7个月新高,Wind
675,2021-07-22,“药茅”片仔癀跌停，上市18年来控股股东首次减持套现近30亿 减持股份,中华网
676,2021-07-22,老周侃股：片仔癀控股股东减持股份释放啥信号 减持股份,北京商报
677,2021-07-22,片仔癀大跌10% 沪股通净卖出5.76亿元 连续下跌,e公司
678,2021-07-22,片仔癀放量跌停，外资、机构集体出逃,Wind
679,2021-07-22,3000亿药茅惨烈跌停、贾跃亭又要上市、白酒大跌,Wind
680,2021-07-22,股市动态 | 沪指走强，有机硅领涨，机械工程获拉升，中药股走弱,财经网
681,2021-07-22,片仔癀上市后股价狂飙629倍，大股东计划减持603.32万股每股获利490元，“牛势”会否因此生变？ 拟减持股份,21世纪经济报道
682,2021-07-22,“药茅”首遭大股东减持 片仔癀回应：对股价影响会持续一段时间｜一只热股 减持股份,第一财经
683,2021-07-22,片仔癀上市18年大股东首抛减持 股价降温跌停 减持股份,长江商报
684,2021-07-22,暴跌10%！片仔癀承认减持会影响股价！银华基金一日缩水超2亿 减持股份,凤凰网
685,2021-07-22,A股收评：沪指涨0.34%，锂电、半导体板块继续大涨,证券之星
686,2021-07-22,A股资金流向（7月22日）：资金持续减仓白酒、医药等消费龙头,Wind
687,2021-07-22,片仔癀股价涨一倍后遭控股股东拟减持30亿元，产品价格曾被炒至一粒1600元 拟减持股份,搜狐
688,2021-07-22,跌停收盘 片仔癀股价报440.78元/股,北京商报
689,2021-07-22,企业观｜片仔癀控股股东减持股价下跌，狂欢之后谁在裸泳 减持股份,财经网
690,2021-07-22,医药股遭暴击，广誉远、片仔癀双双跌停！,证券之星
691,2021-07-22,量能持续放大 短期反弹可看高一线,金融投资报
692,2021-07-22,昨天刚创新高、今天就暴跌295亿：“药茅”片仔癀突遭大股东减持 拟套现30亿 连续下跌,每日经济新闻
693,2021-07-22,巨丰微策略：券商拉升 两日成交又过万亿 新一轮行情要来？,巨丰财经
694,2021-07-22,中药板块大幅走低 广誉远、片仔癀双双跌停 连续下跌,证券时报网
695,2021-07-22,片仔癀午后持续下行 股价逼近跌停 连续下跌,鲸平台
696,2021-07-22,网红“药茅”片仔癀午后逼近跌停 成交额近54亿元,新浪
697,2021-07-22,【行情】片仔癀股价逼近跌停，成交额超53亿元,金十数据
698,2021-07-22,片仔癀：大股东减持对股价影响会持续一段时间丨公司问答 减持股份,第一财经
699,2021-07-22,李闻捷：片仔癀新品类增长超预期 偏高估值压制短期股价,第一财经
700,2021-07-22,医药股暴跌，两只大白马重挫！恒大汽车突然涨30%,Wind
701,2021-07-22,A股异动：“药茅”片仔癀大跌超过8%，公司大股东宣布减持 连续下跌,证券之星
702,2021-07-22,片仔癀大跌，拉垮中药板块；恒大系狂欢，债务警报解除了？,e公司
703,2021-07-22,罕见！2700亿“中药一哥”遭控股股东减持大跌8%，千亿“锂茅”股价创新高 减持股份,Wind
704,2021-07-22,大股东减持！“药茅”暴跌234亿拉垮中药板块，66只个股下跌；恒大系概念股狂欢，债务警报解除了？ 减持股份,e公司
705,2021-07-22,套现30亿！上市18年来首遭大股东减持，片仔癀暴跌8% ，后市如何走？ 减持股份,21世纪经济报道
706,2021-07-22,套现30亿！上市18年来首遭大股东减持，片仔癀暴跌8% ，后市如何走？ 减持股份,南方财经网
707,2021-07-22,控股股东拟减持 或套现近30亿……“药茅”片仔癀跌超7% 拟减持股份,新浪
708,2021-07-22,"突发暴雷跌停！医药股又暴跌，两只3000亿大白马重挫！半导体彻底炸了，恒大汽车突然暴涨30%！痛心！河南强降雨已致33人遇难
连续下跌",中国基金报
709,2021-07-22,惨遭大股东首次减持！片仔癀暴跌8%“药中茅台”何去何从？ 减持股份,财联社
710,2021-07-22,1600元一粒的片仔癀，股价暴跌7.93%，大股东要甩货30亿了 连续下跌,格隆汇
711,2021-07-22,解盘：百亿资金流入，光刻胶、挖掘机、锂矿领涨,Wind
712,2021-07-22,片仔癀股价狂欢后 控股股东欲套现近30亿元！ 减持股份,第一财经
713,2021-07-22,21健讯Daily｜国产mRNA疫苗启动国内III期临床；沃森研发新冠变异株疫苗；博爱生物生产假药被罚,21世纪经济报道
714,2021-07-22,A股高开低走创业板指跌1%有机硅板块逆势拉升片仔癀大跌近8% 连续下跌,华尔街见闻
715,2021-07-22,#片仔癀大股东首次减持将套现30亿#上热搜 网友：林园听了估计想骂人 减持股份,新浪
716,2021-07-22,片仔癀今日跌超8%：控股股东拟套现30亿 减持股份,企查查
717,2021-07-22,大股东计划套现近30亿元，“药茅”片仔癀股价大跌逾8% 减持股份,第一财经
718,2021-07-22,片仔癀大股东首次减持将套现30亿 股价应声下跌 减持股份,红周刊
719,2021-07-22,上市首次！2900亿“中药一哥”或遭减持近30亿，市值蒸发近200亿 减持股份,中新经纬
720,2021-07-22,快讯｜片仔癀：因自身资金需求，控股股东及其一致行动人拟减持公司股份 拟减持股份,财经网
721,2021-07-22,开盘：A股三大股指创业板指涨0.35%，盐湖提锂板块领涨，片仔癀跌超3%,金融界
722,2021-07-22,片仔癀控股股东拟首次减持 减持市值近30亿元 拟减持股份,和讯
723,2021-07-22,中药板块全线杀跌，广誉远跌停,Wind
724,2021-07-22,“中药一哥”片仔癀首遭大股东减持，套现近30亿！ 减持股份,券商中国
725,2021-07-22,“药茅”片仔癀首遭大股东减持30亿，股价一度暴跌7% 减持股份,证券之星
726,2021-07-22,大股东减持套现近30亿 网红“药茅”片仔癀早盘大跌近7% 减持股份,新浪
727,2021-07-22,“药中茅台”片仔癀股价刚创新高，控股股东却拟套现约30亿元？ 减持股份,资本邦
728,2021-07-22,快讯：中药板块下挫走弱 片仔癀、广誉远大跌7% 连续下跌,新浪
729,2021-07-22,A股异动 | 片仔癀(600436.SH)大跌7% 控股股东拟减持不超1%公司股份 连续下跌,格隆汇
730,2021-07-22,2900亿“药茅”，大股东罕见套现30亿！什么信号,Wind
731,2021-07-22,快讯：控股股东拟减持片仔癀跌近5% 拟减持股份,财联社
732,2021-07-22,大股东减持套现近30亿 网红“药茅”片仔癀早盘低开3% 减持股份,新浪
733,2021-07-22,片仔癀跳空低开3.01%,36氪
734,2021-07-22,上市以来首次！2900亿网红“药茅”突遭控股股东减持，拟套现近30亿！,证券之星
735,2021-07-22,证监会出手 又有A股实控人被立案调查！ 董监高成员异常事件,中国基金报
736,2021-07-22,2900亿“中药一哥”首遭大股东减持套现近30亿 什么信号？上市18年飙涨56倍 最牛散户暴赚130亿 减持股份,券商中国
737,2021-07-22,上市以来首次！2900亿网红“药茅”片仔癀突遭减持 拟套现近30亿,e公司
738,2021-07-22,套现30亿！“药中茅台”遭大股东首度减持，股价一年半翻了4倍 减持股份,证券时报
739,2021-07-22,药价炒到比茅台还贵 片仔癀股东宣布减持：套现近30亿 减持股份,快科技
740,2021-07-22,片仔癀股价创新高！控股股东却突然宣布大额减持 网友吵翻了 减持股份,每日经济新闻
741,2021-07-22,深夜突发！套现近30亿，药中茅台突遭大股东减持！告急！河南又一市遭遇特大暴雨，2小时降水已超郑州！南京最新通报来了 减持股份,中国基金报
742,2021-07-21,【掘牛股】股价大涨！易主山西国资，广誉远“焕新颜”,财华社
743,2021-07-21,片仔癀：控股股东九龙江集团因自身资金需求减持600多万股 减持股份,澎湃新闻
744,2021-07-21,晚间重要公告2021年7月21日星期三,Wind
745,2021-07-21,股价创新高 片仔癀控股股东欲趁机减持套现 减持股份,第一财经
746,2021-07-21,片仔癀：控股股东拟减持不超603.32万股 拟减持股份,中证网
747,2021-07-21,注意！片仔癀：控股股东九龙江集团计划减持不超过1% 拟减持股份,每日经济新闻
748,2021-07-21,片仔癀(600436.SH)：控股股东拟减持不超603.3172万股 拟减持股份,格隆汇
749,2021-07-21,片仔癀(600436.SH)控股股东九龙江集团拟减持不超1%的股份 拟减持股份,智通财经
750,2021-07-21,"片仔癀公告：控股股东九龙江集团拟通过集中竞价交易方式减持其持有的公司股份数量总计不超过目前公司总股本的1%，即不超过6,033,172股
拟减持股份",金十数据
751,2021-07-21,片仔癀：控股股东拟减持公司不超1%股份 拟减持股份,e公司
752,2021-07-21,片仔癀：控股股东拟减持不超过1%公司股份 拟减持股份,Wind
753,2021-07-21,片仔癀现1笔大宗交易 共成交495.98万元,新浪
754,2021-07-21,片仔癀今日大宗交易成交1.18万股，成交价420.32元折价14.18%,Wind
755,2021-07-21,北向资金今日净买入31.17亿元，东方财富获净买入逾11亿元,Wind
756,2021-07-21,片仔癀再创新高提振中药板块，广誉远冲击涨停,Wind
757,2021-07-21,重仓股大“换血”！顶流基金经理最新布局思路曝光,Wind
758,2021-07-21,医药行业2021年中报业绩前瞻：继续保持恢复性增长,新浪
759,2021-07-20,片仔癀(600436)：日化持续高速增长 分拆上市提上日程,西南证券
760,2021-07-20,国资委接手百年药企广誉远，广誉远要成为“下一个片仔癀”？,ZAKER
761,2021-07-20,片仔癀今日大宗交易成交12.84万股，成交价467.02元溢价0.0%,Wind
