1253,2021-04-08,片仔癀董事长刘建顺因身体原因辞职 董监高成员变化,第一财经
1254,2021-04-07,抱团卷土重来？“中药一哥”片仔癀大涨超8%,环球老虎财经
1255,2021-04-07,片仔癀：董事长退休辞职 董监高成员变化,Wind
1256,2021-04-07,片仔癀：漳州片仔癀药业股份有限公司关于董事长退休辞职的公告 董监高成员变化,新浪
1257,2021-04-07,片仔癀(600436.SH)：董事长刘建顺退休辞职 董监高成员变化,智通财经
1258,2021-04-07,民族品牌指数跌1.59% 片仔癀领涨,上证报
1259,2021-04-07,片仔癀：4月7日获主力资金净流入2.46亿元,每日经济新闻
1260,2021-04-07,中药股尾盘拉升片仔癀(600436.SH)收涨7.5%,格隆汇
1261,2021-04-07,医药股尾盘回暖，片仔癀大涨7%,Wind
1262,2021-04-06,道达投资手记：市场缩量震荡 缺乏明确方向感,每日经济新闻
1263,2021-04-06,医药生物行业：为什么说智飞生物二季度有望迎来亮眼表现？,新浪
1264,2021-04-06,医药行业2021年4月投资月报：把握一季报最佳反弹窗口期 加配低估值且高增长标的,西南证券
1265,2021-04-06,医药行业周报：当前是反弹最佳窗口期 加配低估值高增长标的,西南证券
1266,2021-04-06,医药行业每周医览药闻：从2020年财报看国内创新药行业发展,新浪
1267,2021-04-03,2021年中国牙膏行业市场竞争格局与企业市场份额分析 云南白药牙膏位居第一位,前瞻研究院
1268,2021-04-02,医药行业周报：一季报行情开启 建议关注高增长的医药板块,新浪
1269,2021-04-02,投入翻一番！中药股迎重大利好，高毅资产冯柳大举加仓,私募排排网
1270,2021-04-02,A股收盘综述：上证指数涨0.52%，创业板指涨1.31%,Wind
1271,2021-04-02,解盘：人气继续回暖，半导体、今日头条、白酒、高价股领涨,Wind
1272,2021-04-02,A股午盘综述：上证指数涨0.43%，创业板指涨1.58%,Wind
1273,2021-04-02,机构抱团股持续回暖，Wind茅指数涨近2.5%,Wind
1274,2021-04-02,医药与健康护理行业月报：年报相继披露 关注高增长公司及A+H股医药投资机会,新浪
1275,2021-04-01,300家医药上市公司迎来年报季，各细分赛道谁是盈利王？,国际金融报
1276,2021-03-31,后疫情时代OTC产业投资机会：结构性调整持续 政策共振驱动长期成长,新浪
1277,2021-03-31,片仔癀：公司主导产品片仔癀锭剂的国内市场零售指导价590元/粒,每日经济新闻
1278,2021-03-30,一批中药企业将迎来发展机遇！,制药网
1279,2021-03-30,中药行业有望迎来业绩增长点，龙头企业被看好,制药网
1280,2021-03-30,“十四五”推动中医药七大领域建设，一批中药企业被关注,制药网
1281,2021-03-30,“十四五”支持中医药振兴发展，相关产业链公司一览,财联社
1282,2021-03-30,“十四五”支持中医药振兴发展，产业链公司有这些,财联社
1283,2021-03-30,爆发式需求吸引资本涌入，国货美妆全产业链掀IPO热潮,Wind
1284,2021-03-29,发改委将从七大方面推进中医药振兴，行业获得长足发展（附股）,云掌财经
1285,2021-03-29,每日理财观察：华为拿下重磅牌照！微信、支付宝真正对手来了？,Wind
1286,2021-03-26,金融街下午茶2021年3月26日星期五,Wind
1287,2021-03-26,“茅”系白马股暴涨超5000亿，A股绝地反攻？,Wind
1288,2021-03-26,A股主力资金流向：周五大幅流入本周仍净流出千亿,Wind
1289,2021-03-26,张坤年内首度现身调研，300亿细分龙头涨停,Wind
1290,2021-03-26,A股收盘综述：上证指数涨1.63%受益机构抱团股反弹，周线结束五连阴,Wind
1291,2021-03-26,A股午盘综述：上证指数涨1.37%收复3400关口，茅指数劲升3.26%,Wind
1292,2021-03-26,茅指数涨超3%，宁德时代、东方雨虹、片仔癀涨超6%,Wind
1293,2021-03-26,片仔癀：从经济的角度出发，公司选择中国邮政快递包裹邮寄纸质财报,每日经济新闻
1294,2021-03-26,片仔癀：本次分拆上市尚处于前期筹划阶段,每日经济新闻
1295,2021-03-23,5张图看清！千亿市值大票年后跌幅、估值和债务规模,Wind
1296,2021-03-23,医药行业周报：医药板块“渐入佳境” 估值和基本面均逐步具备吸引力,新浪
1297,2021-03-23,医药与健康护理行业周报：估值风险有效控制 关注业绩高增长公司,新浪
1298,2021-03-21,医药生物行业周报：基因细胞治疗CDMO黄金赛道有望孕育下一个药明生物,新浪
1299,2021-03-19,A股周线4连跌，48只大白马股回撤超30%,Wind
1300,2021-03-19,片仔癀成为龙晖药业有限公司大股东 控制人变化,企查查
1301,2021-03-19,医药生物行业：业绩弹性逐步释放 关注一季报高增长品种,新浪
1302,2021-03-18,“茅”股连续反弹，最新估值高不高？5张图看清！,Wind
1303,2021-03-17,2020年片仔癀营收、净利增长，转型看齐“云南白药”,药智网
1304,2021-03-17,A股史上首次蓝筹股泡沫破裂，6成私募反对抄底,Wind
1305,2021-03-17,业绩增长靠提价，单一产品打天下，机构减持下的片仔癀还香吗？ 经营问题,金融界
1306,2021-03-16,年报解读|健民集团高增长隐忧：研发投入缩水销售费用大增,财联社
1307,2021-03-16,医药生物行业周报：CXO、医疗服务、生物制品等板块预计Q1高增长,新浪
1308,2021-03-16,片仔癀：《片仔癀调控肿瘤细胞凋亡与增殖的途径》是国家自然科学基金项目，与公司无关,每日经济新闻
1309,2021-03-13,制药行业周榜：医药龙头股表现分化，云南白药市值超越片仔癀,华夏时报
1310,2021-03-12,汇丰晋信大盘波动股票四季报：股票仓位为93.45%，重仓片仔癀、中航光电等,每日经济新闻
1311,2021-03-11,茅台招行罕见联手：暴涨1800亿，白马股集体爆发,Wind
1312,2021-03-11,A股午盘综述：上证指数涨1.78%，茅台、宁德时代、隆基股份涨超4%,Wind
1313,2021-03-11,金龙鱼、泸州老窖、紫金矿业、片仔癀等明星股涨超6%,Wind
1314,2021-03-11,抱团股企稳？3000股下跌茅指数却大涨近3%,Wind
1315,2021-03-10,券商首席：今天早上买了点基金！机构开始乐观了？,Wind
1316,2021-03-10,A股核心资产大涨，两市成交却大幅萎缩，什么情况？,Wind
1317,2021-03-10,终于反攻！A股核心资产大涨归来，北向资金也在涌入！两市成交却大幅萎缩,券商中国
1318,2021-03-10,抱团股卷土重来？3000股下跌茅指数却大涨近3%,Wind
1319,2021-03-10,西南证券--医药行业2021年3月投资月报：核心资产大跌之后性价比凸显，建议关注PEG投资机会【行业研究】,金融界股吧
1320,2021-03-10,A股午盘综述：上证指数涨0.67%、创业板指涨2.95%，机构抱团股复苏,Wind
1321,2021-03-10,茅指数维持逾3%升幅，通策医疗、亿纬锂能涨超7%,Wind
1322,2021-03-10,宁德时代、中免、迈瑞医疗、药明康德、爱尔眼科、片仔癀等涨超5%,Wind
1323,2021-03-09,片仔癀3月9日大宗交易成交918.73万元,证券时报网
1324,2021-03-09,片仔癀今日大宗交易成交3.80万股，成交价241.77元溢价0.0%,Wind
1325,2021-03-09,医药行业周报：逐步布局一季报高增长核心资产,新浪
1326,2021-03-09,各种“茅”被抛弃？机构调研偏好中小盘！这些最受关注,Wind
1327,2021-03-09,每日理财观察：证监会重磅发声，全面落实退市方案,Wind
1328,2021-03-09,全球市场分化，欧洲开始领跑，纳指、沪指跌超2%,Wind
1329,2021-03-09,蓝筹股步入“分化”和“新兴”阶段？,Wind
1330,2021-03-09,接连大跌何时休？别慌，这类标的机会来了,Wind
1331,2021-03-08,"片仔癀现1笔大宗交易 共成交2,141.74万元",新浪
1332,2021-03-08,金融街下午茶2021年3月8日星期一,Wind
1333,2021-03-08,创业板指牛年累挫20%，“抱团股”再遭重锤，传统价值股将回归？,Wind
1334,2021-03-08,片仔癀跌9% 年内海通证券和东方财富证券唱多,中国经济网
1335,2021-03-08,片仔癀今日大宗交易成交8.36万股，成交价256.06元溢价0.0%,Wind
1336,2021-03-08,A股收盘综述：上证指数下滑2.3%，创业板指跌入技术性熊市,Wind
1337,2021-03-08,股市投资者必看！如何识别一家公司的真假“护城河”？,创业邦
1338,2021-03-08,医药生物行业报告：创新药企商业化能力的再思考,新浪
1339,2021-03-07,医药与健康护理行业周报：业绩确定性高 继续看好医药龙头公司,新浪
1340,2021-03-06,"近八成个股上涨，各类""茅""跌3.4万亿，后市操作指南来了…",Wind
1341,2021-03-04,片仔癀节后市值蒸发逾600亿 去年Q3单一产品净利占比逾七成 经营问题,新浪
1342,2021-03-04,女神节驾到，化妆品销量大爆发，概念股速递,财联社
1343,2021-03-02,"片仔癀现1笔大宗交易 共成交3,397.07万元",新浪
1344,2021-03-02,片仔癀今日大宗交易成交11.64万股，成交价291.95元折价0.02%,Wind
1345,2021-03-01,医药行业一周观察：龙头延续回调趋势 关注二线投资机会,新浪
1346,2021-03-01,医药生物行业报告：医药板块大幅调整之后的布局思路,新浪
1347,2021-03-01,新华社民族品牌指数多只成分股获北向资金增持,中证网
1348,2021-02-28,明眼观潮丨泡沫开始退潮 投资长跑需要钝感力,21世纪经济报道
1349,2021-02-28,顶尖投资人“擒牛”复盘：买定离手，熬住寂寞,Wind
1350,2021-02-27,3500点关口下A股分歧：杀估值的机会与风险,经济观察报
1351,2021-02-26,牛市结束了？别慌！聪明钱已进场布局,红周刊
1352,2021-02-26,华为紧急澄清造车传闻，长安汽车等两大车企直线飙涨后回落,上游新闻
1353,2021-02-26,39倍大牛股遭遇历史最大跌幅，“常青树”板块市值蒸发近万亿！ 连续下跌,证券时报网
1354,2021-02-26,"片仔癀现1笔大宗交易 共成交3,346.76万元",新浪
1355,2021-02-26,片仔癀今日大宗交易成交11.25万股，成交价297.49元溢价0.0%,Wind
1356,2021-02-24,【华泰固收|信用月报】2月信用月报：国资控股类平台解析,华泰固收强债论坛
1357,2021-02-24,隆基股份、片仔癀、紫金矿业、天齐锂业、恒力石化等明星股均跌超8%,Wind
1358,2021-02-24,宁德时代、中免、隆基、爱尔眼科、荣盛石化、片仔癀等明星股集体大跌,Wind
1359,2021-02-24,同仁堂降费难奏效净利连降 市值379亿仅为片仔癀18% 盈利能力下降,发现网
1360,2021-02-22,2000亿！片仔癀VS云南白药，谁是中药一哥,节点财经
1361,2021-02-22,医药行业周报：趁医药回调良机 布局高景气板块,西南证券
1362,2021-02-20,中药行业周报：第四批国采结果公布 年报季建议关注创新+消费超预期标的,新浪
1363,2021-02-19,商业贸易行业信息点评：春节零售餐饮销售额增28.7% 数字消费、就地过年成新亮点,新浪
1364,2021-02-18,“药中茅台”片仔癀，1粒卖出590元，市值站上2300亿,21商评网
1365,2021-02-18,片仔癀今日大宗交易成交1.28万股，成交价389.3元溢价0.0%,Wind
1366,2021-02-18,医药与健康护理行业周报：国内疫情向好 仍需紧密关注防控政策,新浪
1367,2021-02-17,中药行业：促中药发展政策发布 激发中药产业活力,新浪
1368,2021-02-16,【浙商医药|周报】新起点，强调中国优势,杏林建研
1369,2021-02-14,数据揭秘A股牛年牛市特征，多只百倍股原来这样诞生！,Wind
1370,2021-02-12,“药中茅台”片仔癀，1粒卖出590？片仔癀凭啥市值两千亿？,搜狐
1371,2021-02-11,医药行业重大事项点评：国办鼓励中医药特色发展 龙头企业强者恒强,新浪
1372,2021-02-10,片仔癀现1笔大宗交易 共成交397.90万元,新浪
1373,2021-02-10,片仔癀今日大宗交易成交1.01万股，成交价393.96元溢价0.0%,Wind
1374,2021-02-10,云南白药又创新高 可昔日“中药一哥”盈利已不靠药,新浪
1375,2021-02-10,中药板块利好消息扎堆发布 90%的个股股价本周以来均实现了上涨,第一财经
1376,2021-02-10,利好消息满天飞，这一板块或起飞，20只绩优概念股来了,中国基金报
1377,2021-02-10,节前股市迎来大红包，但这些“消费茅”仍趴地板上,证券时报网
1378,2021-02-10,"发生了什么，股民哀嚎亏了150万，千亿市值苹果概念股或被错杀？利好消息满天飞，中药板块或起飞，20只绩优概念股出炉（附股）
亏损",证券时报网
1379,2021-02-09,中药板块升温 两只龙头股早已超出券商目标价,第一财经
1380,2021-02-09,中药行业利好接踵而来，龙头股年内涨超40%，后市抓住这两条投资主线,第一财经
1381,2021-02-09,红包行情来了？茅台涨破3万亿，“国宝神药”创新高，“女人茅台”20%涨停，这些“消费茅”仍趴地板上,证券时报
1382,2021-02-09,节前股市迎来大红包 但这些“消费茅”仍趴地板上,证券时报
1383,2021-02-09,什么情况？中药股集体大爆发！云南白药片仔癀都嗨了,e公司
1384,2021-02-09,牧原股份、荣盛石化、片仔癀、万华化学、中联重科等明星股盘中均创历史新高,Wind
1385,2021-02-09,中药股集体大爆发！云南白药创历史新高！,证券时报网
1386,2021-02-09,什么情况？中药股集体大爆发！云南白药、片仔癀都嗨了……新机会来了？,新浪
1387,2021-02-09,云南白药、片仔癀齐创历史新高,格隆汇
1388,2021-02-09,每日理财观察：央行发布中国货币政策执行报告,Wind
1389,2021-02-09,片仔癀(600436)：国宝名药走向全国 一核两翼展翅腾飞,西南证券
1390,2021-02-09,民族品牌指数再创新高 片仔癀市值超2200亿元,上证报
1391,2021-02-08,常春藤资产蒋煜:机构抱团是伪命题 云计算SAAS服务是无敌商业模式,新浪
1392,2021-02-08,片仔癀今日大宗交易成交6.32万股，成交价378.95元溢价0.0%,Wind
1393,2021-02-08,民族品牌指数创历史新高 片仔癀涨停,上证报
1394,2021-02-08,西南证券给予片仔癀评级，国宝名药走向全国，一核两翼展翅腾飞,每日经济新闻
1395,2021-02-08,A股收盘综述：沪指缩量涨逾1%，进入假期模式,Wind
1396,2021-02-08,片仔癀涨停！云南白药涨停！中药板块强势爆发,金融界
1397,2021-02-08,快讯：“药中茅台”片仔癀午后涨停 市值接近2300亿,新浪
1398,2021-02-08,片仔癀触及涨停再创新高，同仁堂、众生药业、白云山等跟涨,Wind
1399,2021-02-08,中药股集体走强云南白药涨停片仔癀逼近涨停创历史新高,格隆汇
1400,2021-02-08,片仔癀大涨7.14%，振幅7.12%,中新经纬
1401,2021-02-08,片仔癀持续走强 股价创历史新高,证券时报网
1402,2021-02-08,医药行业周报：第四批集采落地 持续看好创新及相关产业链CXO,西南证券
1403,2021-02-08,新华社民族品牌指数多只成分股表现强势,中证报
1404,2021-02-07,医药生物行业2020业绩前瞻：2020板块分化明显 下半年医疗服务等有序复苏,新浪
1405,2021-02-07,医药生物行业周报：新冠变异后是否需要常态化免疫加强？智飞新高后继续强烈看好,新浪
1406,2021-02-05,片仔癀今日大宗交易成交10.44万股，成交价344.5元溢价0.0%,Wind
1407,2021-02-05,中国中免、智飞生物、片仔癀、阳光电源等明星股刷新历史新高,Wind
1408,2021-02-05,中信证券：第四批带量采购降价符合预期 未来带量采购对市场冲击料将减小,证券时报网
1409,2021-02-04,片仔癀今日大宗交易成交17.48万股，最低成交价337.0元溢价0.0%,Wind
1410,2021-02-04,医药行业重大事项点评：第四批带量采购拟中选结果产生 降价幅度符合预期,新浪
1411,2021-02-03,上海家化(600315)：Q4净利润高增609% 大超预期 百亿收入未来可期,新浪
1412,2021-02-03,上海家化(600315)：Q4盈利持续改善 业绩超预期,新浪
1413,2021-02-03,片仔癀2月3日大宗交易成交3596.71万元,证券时报网
1414,2021-02-03,医药生物2月月报：寻业绩主线 重点关注CXO等高增长赛道,新浪
1415,2021-02-02,基金经理年终奖7000万？抱团股笑了，6000亿巨头创新高,中国基金报
1416,2021-02-02,片仔癀(600436.SH)创历史新高市值逼近2000亿,格隆汇
1417,2021-02-02,中国中免、片仔癀、泸州老窖、荣盛石化等明星股再创历史新高,Wind
1418,2021-02-02,医药生物行业：四季度常规诊疗继续恢复 板块业绩增速提升,广发证券
1419,2021-02-02,医药行业周报：短期流动性收紧 如何看医药后市机会？,西南证券
1420,2021-01-29,医药行业重大事项点评：国务院发布药品带量采购意见 应采尽采 范围更广,新浪
1421,2021-01-29,"片仔癀现3笔大宗交易 共成交7,579.40万元",新浪
1422,2021-01-29,片仔癀关联企业等共同成立健康管理公司，经营范围含远程健康管理服务,企查查
1423,2021-01-29,2020年片仔癀营收、净利增长，转型看齐“云南白药”,药智网
1424,2021-01-29,90家A股公司交出“成绩单”，37家营收净利双位数增长,21世纪经济报道
1425,2021-01-28,A股业绩快报前瞻：90家公司已交出“成绩单”，37家营收净利双位数增长,21世纪经济报道
1426,2021-01-28,"片仔癀现2笔大宗交易 共成交6,140.93万元",新浪
1427,2021-01-28,“中药一哥”地位生变？肝炎药王独霸市场销售再暴涨，逼“国民神药”出大招,米内网
1428,2021-01-28,片仔癀(600436)公司跟踪报告：核心产品片仔癀量价齐升高景气 化妆品业务筹划分拆,新浪
1429,2021-01-27,"片仔癀现3笔大宗交易 共成交6,491.07万元",新浪
1430,2021-01-26,片仔癀16年提价19次，把一粒药做成奢侈品,斑马消费
1431,2021-01-25,片仔癀现3笔大宗交易合计成交38.35万股,证券时报网
1432,2021-01-25,片仔癀(600436)动态点评：业绩基本符合预期 归母净利润增速超过营收,新浪
1433,2021-01-25,一粒590元，药中的“奢侈品”，片仔癀虚吗？,钛媒体
1434,2021-01-25,"片仔癀现3笔大宗交易 共成交11,869.80万元",新浪
1435,2021-01-25,医药生物行业周报：2020Q4公募基金重仓医药持仓几何？继续强调Q1医药躁动期,新浪
1436,2021-01-25,医疗健康行业2020年报业绩预览：四季度业绩加速恢复,新浪
1437,2021-01-25,63份年度业绩快报亮相，超八成实现净利润同比增长,Wind
1438,2021-01-23,制药行业一周风云榜:中药一哥争夺白热化 药明康德市值突破4000亿,华夏时报
1439,2021-01-23,4个注射剂被调查，招投标、开单提成……中纪委再掀反腐风暴！片仔癀、同仁堂登胡润品牌榜 其他违规处罚,米内网
1440,2021-01-22,"片仔癀现1笔大宗交易 共成交3,197.88万元",新浪
1441,2021-01-22,谢治宇、董承非等十大明星经理重仓股大曝光,中国基金报
1442,2021-01-21,"片仔癀现1笔大宗交易 共成交3,240.19万元",新浪
1443,2021-01-21,片仔癀(600436)：国宝名药走向全国 一核两翼展翅腾飞,西南证券
1444,2021-01-21,胡润品牌榜：工行和建行跌出十强 分列第15名和第19名,新浪
1445,2021-01-21,【医药-马帅】片仔癀：全年业绩略超预期，片仔癀系列和化妆品双轮驱动增长,安信证券研究
1446,2021-01-20,片仔癀大宗交易成交11.24万股成交额3296.07万元,证券时报网
1447,2021-01-20,片仔癀(600436)2020年度业绩快报点评：业绩符合预期 核心产品稳健增长,新浪
1448,2021-01-20,"片仔癀现1笔大宗交易 共成交3,296.07万元",新浪
1449,2021-01-20,医药生物行业报告：中外新冠疫苗PK 孰优孰劣？,新浪
1450,2021-01-20,片仔癀(600436)：业绩增长符合预期 量价齐升再次显现,新浪
1451,2021-01-19,公告精选丨三连板爱施德收关注函，这家公司2020年净利预增超4倍,21世纪经济报道
1452,2021-01-19,盘后公告集锦|华天科技定增募资51亿元加码高端封测 片仔癀2020年净利润同比增长21.27%,财联社
1453,2021-01-19,片仔癀2020年净利同比增长21%-公告解读-上市公司-,中国财富网
1454,2021-01-19,晚间重要公告2021年1月19日星期二,Wind
1455,2021-01-19,"片仔癀现1笔大宗交易 共成交1,597.15万元",新浪
1456,2021-01-19,茅台史上最大利空？但斌“戒酒！”机构：继续紧抱白酒,券商中国
1457,2021-01-19,片仔癀(600436.SH)2020年度归母净利润同比增长21.27%至16.667亿元,智通财经
1458,2021-01-19,片仔癀业绩快报：2020年度净利润16.67亿元 同比增长21.27%,财联社
1459,2021-01-19,片仔癀业绩快报：2020年净利16.67亿元 同比增21%,e公司
1460,2021-01-19,片仔癀(600436.SH)业绩快报：2020年净利升21.27%至16.67亿元,格隆汇
1461,2021-01-19,片仔癀：2020年净利润同比增长21.27%（业绩快报）,Wind
1462,2021-01-19,医药行业周报：关注两大政策变化 推荐“创新”+“药店”,新浪
1463,2021-01-18,片仔癀现1笔大宗交易 共成交581.62万元,新浪
1464,2021-01-18,50亿营收的片仔癀，贵过200亿营收的云南白药，合理吗？,钛媒体
1465,2021-01-18,医药生物：中国创新药是否到了国际化的拐点？,新浪
1466,2021-01-17,A股新逻辑：赛道、指数与抱团,Wind
1467,2021-01-17,医药行业每周医览药闻：如何看待医药零售板块的政策机遇,新浪
1468,2021-01-16,制药行业市值排行榜：恒瑞医药市值稳居首位，君实生物市值缩水过千亿 连续下跌,华夏时报
1469,2021-01-15,片仔癀现1笔大宗交易 共成交284.19万元,新浪
1470,2021-01-15,A股午盘综述：上证指数跌0.53%，抱团股继续下挫、银行保险护盘未果,Wind
1471,2021-01-15,海天味业、英科医疗、片仔癀、云南白药、药明康德等热门抱团股集体大跌,Wind
1472,2021-01-15,2020年，这2家市值站上千亿大关的药企受关注,制药网
1473,2021-01-15,每日理财观察：我国外贸进出口连续7个月实现正增长,Wind
1474,2021-01-15,抱团股集体重摔，科技要“爷青回”？,Wind
1475,2021-01-14,云南白药vs片仔癀 谁能先到2000亿？,新浪
1476,2021-01-14,A股收盘综述：上证指数跌0.91%，长城汽车、酒鬼酒、航发动力等抱团强势股跌停,Wind
1477,2021-01-14,医药生物行业：Q4医药板块延续恢复态势 结构性机会突出,新浪
1478,2021-01-14,A股午盘综述：上证指数触底反弹跌0.29%，机构抱团股杀跌、中字头股再度走强,Wind
1479,2021-01-13,小米的锅？云南白药一季度炒股大亏 7 亿，1400 亿市值不及片仔癀 投资失误,砍柴网
1480,2021-01-13,侃财丨开“自己”的车，很尴尬,证券时报网
1481,2021-01-13,民族品牌指数跌0.48% 科沃斯片仔癀创新高,上证报
1482,2021-01-13,谁才是“中药一哥”？片仔癀市值超云南白药，一粒药卖590元,网易
1483,2021-01-13,A股午盘综述：上证指数跌0.08%，中字头基建股大涨,Wind
1484,2021-01-13,片仔癀涨超5%再创新高，中药板块转涨,Wind
1485,2021-01-12,片仔癀现1笔大宗交易 共成交783.00万元,新浪
1486,2021-01-11,"片仔癀现1笔大宗交易 共成交1,959.24万元",新浪
1487,2021-01-11,医药行业周报：从历史复盘看“高景气度龙头”抱团趋势,新浪
1488,2021-01-08,"片仔癀现1笔大宗交易 共成交3,099.37万元",新浪
1489,2021-01-06,云南白药3日暴涨20%，滞涨白马回归？,格隆汇
1490,2021-01-06,兴证医药行业2021年1月投资月报：创新药差异化、国际化时代开启,新浪
1491,2021-01-06,医药行业一周观察：国药新冠疫苗附条件获批上市 紧握创新龙头,新浪
1492,2021-01-05,2020年十大话题基金：白酒永远滴神，新能源是救世主！,格隆汇
1493,2021-01-05,中药股集体走强：云南白药连续第二日涨停 片仔癀首度站上300元,格隆汇
1494,2021-01-05,炒作还是实力，片仔癀凭什么比云南白药贵？,搜狐
1495,2021-01-05,聚焦结构、强者恒强、盯牢业绩，绩优私募新年布局紧扣三大关键词,Wind
1496,2021-01-04,片仔癀(600436.SH)及控股子公司通过高新技术企业认定,格隆汇
1497,2021-01-04,天风证券：12月金股组合盈利1.66% 1月荐股名单出炉,新浪
1498,2020-12-29,医药行业周报：海外疫情引关注 “国谈”下创新药企业面临新考验,新浪
1499,2020-12-29,医药生物行业报告：继续重点关注创新核心竞争力和医药大消费两大投资方向,新浪
1500,2020-12-28,医药行业整体或存风险，自下而上仍多机会,湛述宏观
1501,2020-12-24,贝壳投研：百年民族品牌云南白药，成了名副其实的日化厂？,新浪
1502,2020-12-22,医药生物行业报告：医保谈判落地不确定性消除 加大医药优质赛道关注度,新浪
1503,2020-12-22,医药生物行业周报：“三重行业红利 五重公司催化”助推智飞生物 强调Q1医药躁动机会,新浪
1504,2020-12-16,片仔癀今日大宗交易成交1.21万股，成交价252.01元溢价0.0%,Wind
1505,2020-12-16,【从300个瞬间看2020】健康：疫苗突围 耗材集采 健康的舍与得,北京商报
1506,2020-12-14,医药生物行业周报：2021医药“春季躁动”有望提前到来 关注医药消费投资机会,新浪
1507,2020-12-10,2021年度策略行业策略：医药黄金时代行情不会缺席 2021只是更加极致聚焦,新浪
1508,2020-12-09,民族品牌指数跌1.02% 片仔癀上涨4.65%,上证报
