,2021-12-31,2021年消费金融行业专利及科技全景分析报告,零壹财经
0,2021-12-30,苏宁易购:子公司为子公司提供1.7亿担保 大额借贷担保,金融界
1,2021-12-30,提升高端产品市场占比，苏宁易购与索尼敲定2022年合作方案,金融界
2,2021-12-30,跨过2021，我们都经历了哪些商业大事儿,北京商报
3,2021-12-29,小米12上新，苏宁易购小米生态产品热销,砍柴网
4,2021-12-29,24小时待命保障供应 苏宁易购西安防疫仓日均发货超百万件,奥一网
5,2021-12-28,苏宁易购发布2021小镇青年消费图鉴 高端洗衣机销量增长134%,中金在线
6,2021-12-28,苏宁已偿还1%员工借款本金 张近东称集团债务问题已阶段性企稳,中华网
7,2021-12-28,新鲜早科技丨百度首次在“元宇宙”希壤开会；美团将在快手上线小程序；苏宁力争半年内偿还员工借款本金,21世纪经济报道
8,2021-12-28,苏宁集团：已偿还1%员工借款本金 力争于明年年中前全部偿还完毕,观点地产网
9,2021-12-28,苏宁集团已偿还员工借款本金的1%，力争明年6月30日前偿还全部本金,Wind
10,2021-12-28,独家！苏宁集团已偿还员工借款本金的1%，力争明年6月30日前偿还全部本金,中证报
11,2021-12-27,苏宁董事长张近东：集团的债务问题已取得阶段性企稳，易购经营工作正有序恢复,搜狐
12,2021-12-27,张近东：苏宁集团债务问题阶段性企稳，易购经营正有序恢复,奥一网
13,2021-12-27,苏宁董事长张近东：苏宁债务问题已取得阶段性企稳,搜狐
14,2021-12-27,棱镜｜南京银行拟收购苏宁消金控股权：看中牌照与全国展业资质,腾讯网
15,2021-12-24,债券重大事件2021年12月24日星期五,Wind
16,2021-12-24,苏宁易购发布“星选家电”“潮new新机”双计划，全面启动跨年狂欢季,和讯
17,2021-12-24,西安加油，陕西苏宁易购物流防疫物资专用仓全面升级民生保障响应,物流指闻
18,2021-12-24,北京市消费者协会吸油烟机比较试验结果,质量新闻网
19,2021-12-24,24小时待命保障供应 苏宁易购西安防疫仓日均发货150万件,中金在线
20,2021-12-23,苏宁易购首推“潮new新机” 洞察3C新潮流,砍柴网
21,2021-12-23,任泽平：中国城市高质量发展排名2021,Wind
22,2021-12-23,提升高端产品市场占比，苏宁易购与索尼敲定2022年合作方案,和讯
23,2021-12-23,整机10年包修 苏宁易购跨年季加码“星选家电”专属服务,砍柴网
24,2021-12-23,实体零售如何突围,经济日报
25,2021-12-22,苏宁易购：公司推进线上线下双线融合的消费方式,Wind
26,2021-12-22,苏宁易购：公司聚焦零售开展业务,Wind
27,2021-12-21,苏宁易购携手齐鲁粮油发力年末消费潮 2022年品牌合作再升级,中金在线
28,2021-12-21,促消费稳增长 实体零售数智化转型积极探索新路径,中国商网
29,2021-12-20,2021南京企业百强榜：苏宁蝉联榜首，七家银行入列,腾讯网
30,2021-12-20,复盘2021：零售圈十大股权案,亿邦动力
31,2021-12-17,苏宁易购物流与松下电气达成战略合作 携手打造智慧仓储解决方案,中金在线
32,2021-12-17,银发消费趋势明显，苏宁易购双十二长辈到店订单增长120%,中金在线
33,2021-12-17,北京苏宁易购副总经理高崑：实体零售数智化转型 变粗放式为精准化,中国经济网
34,2021-12-17,江苏银行：目前苏宁易购和苏宁电器集团在我行贷款均为正常状态,每日经济新闻
35,2021-12-16,苏宁于江苏新设科技服务公司，业务含电子烟零售等,乐居财经
36,2021-12-16,实体零售如何促消费？专家：数智化转型很重要,中新网
37,2021-12-15,家装消费进入年末爆发期，苏宁易购双十二智能家居产品销售增长86%,和讯
38,2021-12-15,双十二康佳小家电增长超10倍，天猫苏宁易购官旗助力传统品牌进阶,和讯
39,2021-12-15,爱企查显示：江苏苏宁易购被冻结4000万股权,TechWeb
40,2021-12-14,苏宁易购：公司对日本免税店企业Laox持股比例为29.77%,每日经济新闻
41,2021-12-14,苏宁易购双12收官，“聚光灯”直播赋能品牌流量增长813%,砍柴网
42,2021-12-14,苏宁易购双十二“防疫消杀”数据:除菌家电需求激增 女性偏爱颜值高花式口罩,中金在线
43,2021-12-13,为什么电商平台都开始推“付费会员”了？,亿邦动力
44,2021-12-13,招商家电｜家电行业周度点评21W50-中央经济工作会议定调稳增长，乡村振兴消费拉动家电需求,招商家电研究
45,2021-12-13,冷链物流有望成为A股新赛道！国办发话，打造国际竞争力龙头,Wind
46,2021-12-11,2021十大收缩行业,美尔雅期货
47,2021-12-10,苏宁易购：公司持有江苏苏宁银行股份有限公司30%股份,每日经济新闻
48,2021-12-10,苏宁易购自主品牌携手蓝帆医疗，首款产品12月上市,牛华网
49,2021-12-10,厂门直通家门 双十二苏宁易购家装物流全链路发力,中金在线
50,2021-12-09,苏宁易购与海信签署2022年协议 3年突破500亿长期目标,Bianews
51,2021-12-09,3年500亿！海信与苏宁易购正式签署全面战略合作,金融界
52,2021-12-09,每日理财观察：外资布局中国资管业力度加大,Wind
53,2021-12-09,牛根生退出蒙牛、张瑞敏退休，还有人去世或出事，哪些大佬隐退了,搜狐
54,2021-12-08,苏宁易购：公司持有日本LAOX株式会社股份比例为29.77%,Wind
55,2021-12-08,双十二大促服务“内卷” 苏宁易购家庭全场景服务订单增46%,中金在线
56,2021-12-08,股权拍卖遇冷，银行业大变化正在发生,Wind
57,2021-12-07,盒马鲜生今日头条盘点|2021-12-07,亿邦动力
58,2021-12-07,“大雪”吹热“暖经济”，苏宁易购双十二水暖毯销售增长336.67%,中金在线
59,2021-12-07,上海票据交易所：384家持续逾期公司，苏宁易购、荣盛发展等成重灾区 未按时兑付本息,金融界
60,2021-12-07,苏宁易购状告新力地产，案由为合同纠纷 诉讼纠纷,乐居财经
61,2021-12-06,阿里大调整！蒋凡不再负责淘宝天猫，武卫卸任CFO，股价跌超60%,Wind
62,2021-12-06,"苏宁出售日本最大连锁免税店34%股权,让出第一大股东 减持股份",金融界
63,2021-12-05,2021十大收缩行业 旅游业并不是最难受的,腾讯网
64,2021-12-04,苏宁出售日本最大连锁免税店34%股权，持股比例降至30%,Bianews
65,2021-12-03,中建信息：业务依赖华为 正起诉客户讨要3亿货款 诉讼纠纷,每日经济新闻
66,2021-12-03,苏宁易购平台所售多种产品抽检不合格被通报 产品问题,质量新闻网
67,2021-12-03,苏宁出售日本乐购仕34%股权 新加坡基金成最大股东 控制人变化,观点地产网
68,2021-12-02,多部门全链条发力，绿色消费迎新风口,Wind
69,2021-12-01,苏宁易购股价上涨2.6%跑赢大盘，一个月内确立百亿合作目标,中金在线
70,2021-11-30,2022年增长30% 苏宁易购方太明确四大策略升级合作,和讯
71,2021-11-30,小米、vivo、西门子、海尔、海信，苏宁易购双12直播大牌云集,砍柴网
72,2021-11-29,银保机构大股东纷纷出具主要股东承诺书 看看都有哪些内容,21世纪经济报道
73,2021-11-29,苏宁易购公布江苏苏宁银行主要股东承诺书,Bianews
74,2021-11-29,联商电商周报：主播雪梨偷逃税被处罚 苏宁欠款被起诉 税收处罚,联商网
75,2021-11-29,深交所：调整深证成指、创业板指、深证100等指数样本股,Wind
76,2021-11-28,违法实施经营者集中，新旧法衔接期该如何处理？,新浪
77,2021-11-26,35股收盘价创年内最低，回撤最高70%以上,Wind
78,2021-11-26,锚定2022年合作目标18亿，苏宁易购与康佳战略合作再升级,中金在线
79,2021-11-25,北京节能减排促消费政策倒计时 北京苏宁易购累计销售150万台产品,北京商报
80,2021-11-25,喜讯！北京苏宁易购总经理郝嘉当选通州区第七届人大代表,中国家电网
81,2021-11-25,福建前首富出手放大招！重仓一只股就赚上百亿,Wind
82,2021-11-25,在苏宁买美的洗衣机收到旧机！平台称系厂家库房作业不规范,奥一网
83,2021-11-24,沃尔玛将关内地首店；Q3快手电商GMV1758亿；海底捞筹资23亿,搜狐
84,2021-11-23,苏宁易购遭供应商起诉，被指拖欠3600多万货款未付 关联方问题,联商网
85,2021-11-23,苏宁易购因拒付汇票被小家电企业起诉 诉讼纠纷,羊城晚报
86,2021-11-23,全国首店落地闵行，开启消费电子零售新篇章,东方网
87,2021-11-23,苏宁易购携手老板电器，2022年合作目标25亿,乐居财经
88,2021-11-23,每日理财观察：央行按兵不动！LPR连续19个月维持不变,Wind
89,2021-11-23,中国奥园8.16亿ABS获展期；阜兴集团非法集资案宣判；华融国际按期兑付13.5亿美元债券丨预警内参（第六十九期）,21世纪经济报道
90,2021-11-22,追讨3600多万元，这家A股公司将苏宁易购告上法庭 诉讼纠纷,中证报
91,2021-11-22,《英雄联盟》WBG 副总裁：短期目标为 LPL 四强，未来瞄准世界赛,IT之家
92,2021-11-22,票据纠纷遭索偿3671万！知名A股又遇上事了！,中国基金报
93,2021-11-22,苏宁易购欠货款被起诉，涉案金额3671万，现金流情况堪忧 诉讼纠纷,奥一网
94,2021-11-22,到期拒不付款 彩虹电器起诉苏宁易购 诉讼纠纷,北京商报
95,2021-11-22,高端家电年末冲量，双线融合的苏宁易购还是那个最优解吗？,搜狐
96,2021-11-22,CEO自习室：B站收购有妖气漫画平台 拼多多周五公布财报,亿邦动力
97,2021-11-22,联商电商周报：阿里Q2净利润降39％ 苏宁回应“破产” 盈利能力下降,联商网
98,2021-11-22,布局电竞生态新发展，微博与苏宁合作入席LPL联盟,美股研究社
99,2021-11-22,苏宁易购电子竞技俱乐部宣布更名 业务变化,Bianews
100,2021-11-22,彩虹集团：就与苏宁票据纠纷一案向法院提起诉讼 诉讼纠纷,中新经纬
101,2021-11-22,彩虹集团称已起诉苏宁易购，要求支付3671万元商票被拒 诉讼纠纷,乐居财经
102,2021-11-22,午间公告2021年11月22日星期一,Wind
103,2021-11-22,彩虹集团：近日就与苏宁采购中心、苏宁易购票据纠纷一案向法院提起诉讼 诉讼纠纷,财联社
104,2021-11-22,"彩虹集团：近日就与苏宁采购中心、苏宁易购票据纠纷一案向江苏省南京市中级人民法院提起诉讼，请求判令二被告向原告支付票据款项3671万元及利息
诉讼纠纷",金十数据
105,2021-11-22,苏宁易购电子竞技俱乐部宣布更名 原SN战队正式更名为WBG战队 业务变化,TechWeb
106,2021-11-22,微博宣布与苏宁合作：原 SN 战队正式更名为 WBG 战队,IT之家
107,2021-11-22,深圳国资入股苏宁易购 电商格局会被改写吗？,钢企网
108,2021-11-22,苏宁易购8月起流动性逐步好转，力争实现11月EBITDA转正,金融界
109,2021-11-22,苏宁易购全员信：双11销售目标全面达成，力争11月EBITDA转正,Wind
110,2021-11-22,苏宁易购发全员信：力争11月EBITDA转正,财联社
111,2021-11-21,国家反垄断局挂牌，多家巨头违法并购再被罚！图解43张罚单 其他违规处罚,奥一网
112,2021-11-21,百度、阿里、京东、苏宁等被罚,数据观
113,2021-11-21,困境之下优化线下布局，苏宁易购全国首家3C潮品店在沪开幕,新民网
114,2021-11-21,陆家嘴财经早餐2021年11月21日星期日,Wind
115,2021-11-20,欧莱雅不怕薇娅李佳琦?元宇宙割“韭菜”|一周电商大事,亿邦动力
116,2021-11-20,涪陵榨菜回应“天价榨菜”：只是尝试，业绩提升仍要靠大众款产品,Wind
117,2021-11-20,国家反垄断局挂牌后的大动作：阿里、腾讯、字节跳动等多家巨头被顶格处罚,21世纪经济报道
118,2021-11-20,43起收购案被反垄断，腾讯、阿里、京东、滴滴、美团等被市场监管总局罚款 其他违规处罚,经济观察网
119,2021-11-20,反垄断！分别罚50万！多家名企被市场监管总局处罚 其他违规处罚,上游新闻
120,2021-11-20,市场监管总局调查43起违法实施经营者集中案件，阿里、腾讯等被罚 其他违规处罚,证券时报网
121,2021-11-20,苏宁易购被罚50万元，收购八天贸易10%股权案涉违法实施经营者集中 其他违规处罚,Bianews
122,2021-11-20,反垄断处罚，43 起！涉及数个互联网大厂,ZAKER
123,2021-11-20,违反《反垄断法》 多家企业被市场监管总局处罚 其他违规处罚,每日经济新闻
124,2021-11-20,43起未依法申报违法实施经营者集中案被通报，腾讯、阿里、百度、京东等上榜 其他违规处罚,中华网
125,2021-11-20,市场监管总局：苏宁易购被罚50万元 收购八天贸易股权涉未依法申报违法实施经营者集中 其他违规处罚,市场监管总局
126,2021-11-20,阿里巴巴、腾讯、百度等被罚！,ZAKER
127,2021-11-20,市场监管总局依法对43起未依法申报违法实施经营者集中案作出行政处罚决定,Wind
128,2021-11-19,携手“大干40天”，美的集团殷必彤：始终会和苏宁易购站在一起,中金在线
129,2021-11-19,40天冲刺5亿 苏宁易购携手创维发力年末高端彩电市场,中金在线
130,2021-11-18,长三角百强企业，上汽阿里恒力宝武苏宁的营收列榜单前五,上观
131,2021-11-18,处罚员工“摸鱼”背后，国美难以“真快乐”,钛媒体
132,2021-11-18,苏宁易购大跌逾5%，股价跌回15年前，曾公开辟谣破产传闻 减资破产,AI财经社
133,2021-11-17,定了，25亿！苏宁易购携手老板电器发力2022年高端厨电市场,金融界
134,2021-11-17,双11苏宁智能家装同比增长108% 只因他们做对了三点,Ofweek
135,2021-11-17,极力布局家装服务领域 苏宁物流能否凭借这招实现突围？,亿邦动力
136,2021-11-17,早读拾光（11.17）丨三盛控股一日卖出两商厦 奥园9亿港元出售香港罗便臣道物业,和讯
137,2021-11-17,8点1氪丨罗永浩吐槽苹果文案没文化；苏宁回应“12月底破产”传闻；网易云音乐重启IPO 减资破产,36氪
138,2021-11-17,华融获批发行不超过700亿元金融债；佳兆业长期外币发行人评级被下调；苏宁辟谣破产传言丨预警内参（第六十六期） 投资评级恶化,21世纪经济报道
139,2021-11-16,联商头条：苏宁易购回应破产传闻 盒马开出生鲜奥莱 减资破产,联商网
140,2021-11-16,【经纬下午茶】1块钱买个“有缘人”？交友盲盒存个人信息泄露风险,中新经纬
141,2021-11-16,苏宁易购双十一战绩如何？回应破产传言：经营正常，已报案 减资破产,奥一网
142,2021-11-16,快讯丨苏宁易购辟谣“破产”传闻 称经营一切正常 减资破产,财经网
143,2021-11-16,苏宁易购回应破产传闻：系谣言，对造谣者将依法追责 减资破产,中华网
144,2021-11-16,净利亏损41.16亿！苏宁易购回应破产传闻：谣言 已报案 亏损,第一财经
145,2021-11-16,苏宁易购：年底破产传闻系谣言 公司经营一切正常 减资破产,观点地产网
146,2021-11-16,苏宁易购回应“十二月底宣布破产”：系谣言，公司经营一切正常 减资破产,新京报
147,2021-11-16,苏宁易购称“12 月底破产”系谣言，三季度净亏损 41.16 亿 减资破产,IT之家
148,2021-11-16,12月底宣布破产？苏宁易购：谣言！已报案 减资破产,中新经纬
149,2021-11-16,苏宁易购回应破产传闻：谣言已报案,Wind
150,2021-11-16,苏宁易购：网传“苏宁易购十二月底宣布破产”系谣言，苏宁易购经营一切正常 减资破产,金十数据
151,2021-11-16,苏宁易购回应破产传闻：谣言 已报案 减资破产,新浪
152,2021-11-16,高端家电成大趋势，消费者真正回归线下实体了吗?,中国家电网
153,2021-11-14,“双11”苏宁易购到店体验人次大幅增长,经济日报
154,2021-11-14,地产向左，床垫消费向右：万亿睡眠经济重塑新格局,经济观察报
155,2021-11-13,数字化时代新机遇：外引流量 内建平台,亿邦动力
156,2021-11-12,苏宁易购“18苏宁06”11月16日兑付及摘牌，每手派1037.6元,乐居财经
157,2021-11-12,苏宁易购拟11月16日对“18苏宁07”付息，每手派49元,乐居财经
158,2021-11-12,苏宁易购“18苏宁06”将本息兑付及摘牌 “18苏宁07”回售6.2亿,观点地产网
159,2021-11-12,苏宁易购：“18苏宁06”11月16日兑付本息并摘牌,Wind
160,2021-11-12,苏宁易购：“18苏宁07”回售金额为6.2亿元，回售部分本息已足额支付,Wind
161,2021-11-12,“双十一”消费火爆，内需潜力加快释放,Wind
162,2021-11-11,苏宁易购：双11中高端家电销售额同比增长43% 物流整体履约率达99.8%,中证网
163,2021-11-11,苏宁易购披露“双十一”物流数据，家装发货量较去年同期增长3倍,金融界
164,2021-11-11,“双十一”数据盘点：京东下单金额超3000亿元，电子产品销售火爆,金融界
165,2021-11-11,央视聚焦双十一新消费新玩法 苏宁易购3006名门店金牌导购员“上线”,中金在线
166,2021-11-11,“一城一天一店”激发双线消费活力 苏宁易购“双十一”半日到店人次同比提升122%,中金在线
167,2021-11-11,苏宁易购双11半日消费数据：家电套购GMV同比增长46%,财联社
168,2021-11-11,“双11”速报！京东4小时卖出1.9亿件商品，天猫前1小时2600个品牌成交额超去年全天，这些股票也涨了,e公司
169,2021-11-11,苏宁易购：低碳消费崛起，手机以旧换新同比增长186%,乐居财经
170,2021-11-11,苏宁易购双11战报：前半小时高端家电销售增长43%，智能家装同比增88%,和讯
171,2021-11-11,江苏省消保委发布调查报告 苏宁易购、考拉海购等电商平台过度收集个人信息,中国消费者报
172,2021-11-10,个人信息保护合规测评③丨20款电商生活类APP：拼多多等5款无法应用内撤回同意，11款个性化推荐拒绝难,21经济网
173,2021-11-10,央视聚焦绿色家电消费 苏宁易购多措并举助力碳中和,新浪
174,2021-11-10,“薇娅们”下乡，搅动小镇直播江湖,中金在线
175,2021-11-10,双11电商平台争相“适老化”，线下门店首现“长辈导购员”,中金在线
176,2021-11-10,江苏省消保委调查淘宝等平台，发现个性化展示关闭功能隐蔽等问题 经营问题,Wind
177,2021-11-10,单方面挑战北京SKP，北京5家苏宁易购门店“双11”销量pk一店,北京商报
178,2021-11-10,EDG「骑士抗韩」：联盟有英雄，游戏无边界,投资界
179,2021-11-09,苏宁易购双十一当天预启动“一城一天一店”，家电力度6折起步,砍柴网
180,2021-11-08,拒绝“双11”价格套路，部分商家推出“一口价”,上游新闻
181,2021-11-08,双十一苏宁易购intel再携手 千元神券88折换新惠及多品牌,新浪
182,2021-11-08,南京苏宁易购11.11全民嘉年华 六大旗舰门店开仓甩卖24小时不打烊,新浪
183,2021-11-08,CEO自习室：趣小面更名趣巴渝“你好世界”获过亿元融资,亿邦动力
184,2021-11-08,苏宁调整发货管理规范：商家延迟发货将扣分11月12日生效,电商报
185,2021-11-06,国美零售只剩下一个“壳子”,联商网
186,2021-11-05,苏宁易购联合奥维云网发布白皮书：家电市场存量换新成增长主力,中金在线
187,2021-11-05,苏宁易购为子公司提供担保，担保额度为9.5亿元 大额借贷担保,资本邦
188,2021-11-05,苏宁易购为广东苏宁易购融资提供最高9.5亿元担保 大额借贷担保,乐居财经
189,2021-11-05,苏宁易购全国超500个核心门店，增设千名“长辈导购员”,中金在线
190,2021-11-05,10点聊电商：不懂英文 不会运营 跨境电商怎么做才能变“轻松”？,亿邦动力
191,2021-11-05,养猪、电力等行业何时迎拐点？机构预测15只业绩低潮股今年逆转,Wind
192,2021-11-04,大件服务覆盖全国超98%县镇 苏宁易购双十一比拼下沉市场服务,中金在线
193,2021-11-04,三年1000亿，苏宁易购与海尔启动2022年战略合作,中金在线
194,2021-11-04,苏宁易购发布10月手机消费报告 荣耀、realme表现抢眼,新浪
195,2021-11-04,重磅消息！即日起南京苏宁易购发放1万张300元康佳无敌券让利消费者,新浪
196,2021-11-04,未来的企业|苏宁易购下一步：做长家电长板，拓展家装赛道,中新经纬
197,2021-11-03,苏宁易购与科大讯飞推出联名学习机礼盒 加量不加价助力双十一,新浪
198,2021-11-03,业绩低潮股名单出炉，18股机构预测今年盈利逆转,Wind
199,2021-11-03,苏宁易购“低碳人”消费行为报告：以换代弃成主流 以旧换新人数增74%,中金在线
200,2021-11-03,Wind风控日报2021年11月3日星期三,Wind
201,2021-11-02,起底朱少醒，16年20倍的收益率是怎样炼成的？,证券之星
202,2021-11-02,县镇市场加快消费升级，苏宁易购零售云智能一体化产品双十一热销,搜狐
203,2021-11-02,以旧换新玩出新花样：男子用诺基亚等17台废旧电子产品换1台iPhone13,和讯
204,2021-11-02,苏宁易购：前三季度亏损金额达上年末净资产10.56% 重大损失,Wind
205,2021-11-01,联商电商周报：京东双11首份战报出炉 极兔收购百世快递,联商网
206,2021-11-01,苏宁易购：升级“零售服务商”，为实体经济发展注入新动能,投资时报
207,2021-11-01,家电三季报喜忧参半，双十一高端品类成交最高增10倍，或成破局关键？,Wind
208,2021-11-01,规范“双十一”！北京约谈阿里美团微店苏宁等14家电商平台,奥一网
209,2021-11-01,2021中国人居环境健康大会·好水好空气消费节在线直播、成功举行,凤凰网
210,2021-11-01,图解苏宁易购三季报：第三季度单季净利润同比减676.73% 盈利能力下降,证券之星
211,2021-11-01,火星人三季度业绩持续增长 高质量发展巩固行业龙头地位,财经网
212,2021-10-31,单季巨亏41亿，苏宁到了“最艰难的时期”｜看财报 重大损失,钛媒体
213,2021-10-30,犀牛日讯：美的集团第三季度净利84.46亿 海天味业第三季度净利13.55亿,GPLP犀牛财经
214,2021-10-30,CEO自习室：快手程一笑接任宿华 极兔收购百世国内业务,亿邦动力
215,2021-10-30,洞察消费新风向 苏宁易购双11发布《2021美好生活白皮书》,中金在线
216,2021-10-30,苏宁易购前三季度营收1155.74亿元 同比降36.1% 盈利能力下降,和讯
217,2021-10-30,苏宁易购第三季度亏损超41亿 与去年全年亏损相当 亏损,联商网
218,2021-10-29,苏宁易购Q3净利润亏损超41亿元，与2020年全年亏损相当 亏损,新京报
219,2021-10-29,苏宁易购前三季度营收1155.74亿元 净利润亏损75.68亿 亏损,观点地产网
220,2021-10-29,公告精选：招商轮船拟收购中外运集运；ST柏龙时任董事长陈伟雄等被终身市场禁入 其他违规处罚,e公司
221,2021-10-29,三十年发展中最艰难时期，苏宁易购三季度净亏损达41.16亿元 亏损,资本邦
222,2021-10-29,苏宁易购：前三季度亏损75.68亿元 亏损,中证网
223,2021-10-29,苏宁易购：前三季度苏宁易购营收达1155.74亿元,36氪
224,2021-10-29,苏宁易购前三季度营收1155.74亿元,乐居财经
225,2021-10-29,苏宁易购：2021年第三季度净利润约-41.16亿元,每日经济新闻
226,2021-10-29,苏宁易购：第三季度营业收入219.68亿元 流动性逐步恢复,e公司
227,2021-10-29,苏宁易购发布三季报：第三季度零售云商品销售规模环比增长33.38%,财联社
228,2021-10-29,苏宁易购：第三季度净亏损41.16亿元，前三季度净亏损75.68亿元 亏损,Wind
229,2021-10-29,苏宁易购：前三季度净亏损75.68亿元，由盈转亏 亏损,Wind
230,2021-10-29,8款深圳产美容护理器抽检不合格，有3款仍未按要求全面下架 产品问题,南都报
231,2021-10-29,苏宁易购双十一发布“219”家装物流服务标准，推动行业标准化建设,中金在线
232,2021-10-29,或再被“转手”，家乐福中国还能“攀”上哪座靠山？,美股研究社
233,2021-10-29,影石创新增资股转被关注，高估值及关联方存疑点,金融界
234,2021-10-29,24%新“红线”下 中原消金、苏宁任性贷等实际利率仍近36%,南都报
235,2021-10-28,日峰值将突破20万单，苏宁易购双十一加码家电家装清洗安维上门服务,中金在线
236,2021-10-28,天猫苏宁易购官旗双11预售家电家装爆款标签：大容量、一体化,中金在线
237,2021-10-28,苏宁易购参股成立科技公司，经营范围含互联网信息服务等,搜狐
238,2021-10-27,苏宁易购:家电以旧换新订单大增,经济日报
239,2021-10-27,老旧家电危害触目惊心 听说苏宁易购11.11全民嘉年华要砸重金为你换新,新浪
240,2021-10-27,苏宁易购双11“低碳消费力”战报：以旧换新咨询量翻3倍 订单增长153%,中金在线
241,2021-10-27,《2021胡润百富榜》：张一鸣3400亿元跃居第二超越马化腾,Wind
242,2021-10-26,苏宁易购“五个农民”培养新农人，助力涌泉蜜桔销售,牛华网
243,2021-10-26,新股又破发，盘中跌超10%，中一签亏损4600 亏损,Wind
