2260,2021-01-31,加码云网万店苏宁变道提速,北京商报
2261,2021-01-31,苏宁宣布云网万店组织架构和核心领导团队,电商报
2262,2021-01-31,【开源零售|周视角】各大社区团购平台相继进军一线城市,泽鹏商业观察
2263,2021-01-31,苏宁云网万店组织架构浮出水面,金融界
2264,2021-01-31,犀牛财经早报： IG集团禁止游戏驿站开仓 腾讯子公司成被执行人,GPLP犀牛财经
2265,2021-01-30,苏宁宣布云网万店组织架构：集团总裁任峻担任总裁,Wind
2266,2021-01-30,苏宁2021聚焦零售主业，开启规模效益发展的新起点,中国家电网
2267,2021-01-30,张近东新年部署：大胆任用85后总裁、90后总经理、95后总监,中国家电网
2268,2021-01-30,张近东定调苏宁2021年发展：聚焦零售 创造效益,新浪
2269,2021-01-30,苏宁公布云网万店人事任命：任峻担任总裁 将探讨独立上市,新浪
2270,2021-01-30,苏宁宣布云网万店组织架构：集团总裁任峻担任总裁,36氪
2271,2021-01-30,苏宁易购确定云网万店独立发展战略 探讨其独立上市,电商报
2272,2021-01-30,沪深两市年报预告收官，多家公司2020年预亏上百亿元 预亏,Wind
2273,2021-01-30,今年以来苏宁易购深圳大区小家电销量翻6倍,格隆汇
2274,2021-01-29,苏宁易购“困境”中的逆增长,中证网
2275,2021-01-29,苏宁易购未来三年收入保持复合增长不低于20% 2023年扣非净利润目标超30亿,时代在线
2276,2021-01-29,苏宁易购：预计2020年自营商品销售规模同比增长45.28%,中证网
2277,2021-01-29,苏宁易购：2020年预计收入2575.62亿元至2595.62亿元,电商报
2278,2021-01-29,苏宁易购拟使用最高10亿元回购股份，约占总股本0.98％,澎湃新闻
2279,2021-01-29,苏宁易购预计归母净利至少亏损34.53亿 同比下降135% 预亏,观点地产网
2280,2021-01-29,苏宁易购拟用5至10亿元自有资金回购公司股份,电商报
2281,2021-01-29,苏宁易购：云网万店探讨独立上市 计划加大员工股权激励,TechWeb
2282,2021-01-29,苏宁易购发布2020年业绩预告 营业收入2575.62亿元至2595.62亿元,e公司
2283,2021-01-29,苏宁易购：拟使用最高10亿元自有资金回购股份,e公司
2284,2021-01-29,苏宁易购：预计2020年营收2575.62亿元-2595.62亿元,36氪
2285,2021-01-29,苏宁易购四季度活跃买家增长超五成，云网万店销售规模同比增长33.61%,第一财经
2286,2021-01-29,苏宁易购：拟以5亿-10亿元回购股份，回购价格不超过11元/股,36氪
2287,2021-01-29,苏宁易购：预计2020年净亏损34.53亿元至39.53亿元，拟回购5亿元-10亿元 预亏,Wind
2288,2021-01-29,补齐冷链短板 引发物流玩家新一轮争夺战,电商报
2289,2021-01-29,苏宁电器：完成19苏电01债券行权回售，回售金额9亿元,澎湃新闻
2290,2021-01-29,苏宁电器：顺利完成19苏电01债券行权回售,电商报
2291,2021-01-29,苏宁张近东：内部管理将“化大为小”，营造全员创业氛围,36氪
2292,2021-01-29,苏宁易购股债齐跌 股价创2013年8月以来新低,观点地产网
2293,2021-01-29,苏宁易购股债齐跌，股价创2014年7月以来新低,Wind
2294,2021-01-29,19苏电01债券如期兑付,GPLP犀牛财经
2295,2021-01-29,苏宁易购股价跌5.8% 现报6.53元,乐居财经
2296,2021-01-28,就地过年也能年味十足：央视点赞苏宁易购聚焦零售保障年货供应,中国家电网
2297,2021-01-28,苏宁易购关联企业退出橙子映像，邓超为后者最终受益人,企查查
2298,2021-01-28,“20苏宁易购MTN001”跌超30%,Wind
2299,2021-01-27,苏宁以旧换新服务再升级：新手机最快1小时达,牛华网
2300,2021-01-27,苏宁易购：手机“以旧换新”服务覆盖超110城,36氪
2301,2021-01-26,苏宁与宝洁商讨年货节营销规划 将开启2021年合作,电商报
2302,2021-01-26,零售云融资10亿，苏宁打出一张王牌,电商报
2303,2021-01-26,强强联手，苏宁天猫共乘2021列车,电商报
2304,2021-01-26,苏宁易购旗下“零售云”业务板块完成10亿元A轮融资,资本邦
2305,2021-01-26,快递行业高强度竞争 格局将加速清晰,中证报
2306,2021-01-26,网上年货节苏宁开门红，单场直播3.08亿成抖音新纪录,砍柴网
2307,2021-01-26,犀牛财经早报：营口港股票终止上市金信诺实控人黄昌华协助调查,GPLP犀牛财经
2308,2021-01-26,抢夺市场份额快递业资源整合频繁,中证报
2309,2021-01-25,苏宁易购旗下“零售云”完成约10亿元A轮融资,电商报
2310,2021-01-25,服务型消费或成下一风口，张近东纵横布局探索行业未来,金融界
2311,2021-01-25,科创板晚报|上海：争取集成电路12纳米先进工艺规模量产EDA公司芯华章完成A+轮融资,科创板日报
2312,2021-01-25,苏宁易购零售云A轮融资接近完成，融资总额或超10亿元,36氪
2313,2021-01-25,张近东布局服务型消费，零售服务商打开行业升级空间,中金在线
2314,2021-01-25,苏宁易购公司债集体上涨,Wind
2315,2021-01-25,苏宁易购、华夏幸福、欧菲光等均刷新阶段新低,Wind
2316,2021-01-25,需求变化驱动行业变革，张近东一纵一横布局服务型消费,中国家电网
2317,2021-01-25,苏宁易购调整《苏宁秒杀收费费率》规则,电商报
2318,2021-01-25,传媒行业动态：微信将重点发力视频号 芒果TV《姐姐2》首期上线；疫情反复下关注线上娱乐标的,新浪
2319,2021-01-23,苏宁物流推出“苏鲜达”冷链物流服务 可实现“48小时达”,电商报
2320,2021-01-23,抗疫保供彰显企业家担当 张近东获评全国抗击新冠肺炎疫情民营经济先进个人,金融界
2321,2021-01-23,为抗疫凝聚力量 张近东获评全国抗击新冠肺炎疫情民营经济先进个人,中金在线
2322,2021-01-22,苏宁易购大宗交易成交965.21万元，买方为机构专用席位,证券时报网
2323,2021-01-22,A股共发生93宗大宗交易成交16.44亿元（1月22日）,Wind
2324,2021-01-22,"踩中三道红线后,千亿祥生开始“自我调整”了 | 深读",金融界
2325,2021-01-22,线下超市小型化、社区化是个伪命题,联商网
2326,2021-01-22,苏宁易购今日大宗交易成交131.50万股，成交价7.34元溢价0.0%,Wind
2327,2021-01-22,苏宁易购：2021年公司将加快对直播业务开放赋能,电商报
2328,2021-01-22,A股早报2021年1月22日星期五,Wind
2329,2021-01-22,数字蝶变中的苏宁易购,北京商报
2330,2021-01-22,苏宁由“零售商”升级为“零售服务商”,北京商报
2331,2021-01-21,苏宁易购：与抖音电商达成深度合作,Wind
2332,2021-01-21,2020年大消费数据观察：2020社零-3.9 关注今冬疫情对1Q21消费影响,新浪
2333,2021-01-20,固定收益点评：本轮大幅折价券有哪些属性？风险如何判断,新浪
2334,2021-01-20,苏宁易购开启2021网上年货节,中证网
2335,2021-01-20,暂别低价冲量彩电业向品牌升级转型,中国商报
2336,2021-01-20,本轮大幅折价券有哪些属性？风险如何判断 | 国盛固收,业谈债市
2337,2021-01-20,苏宁易购：家乐福供应链已与苏宁易购线上超市共享,电商报
2338,2021-01-20,苏宁易购调整2021年春节期间交易时效,电商报
2339,2021-01-20,魅族科技将在苏宁门店新增300+服务网点,证券之星
2340,2021-01-20,苏宁以旧换新多重补贴 助力消费者春节焕新,中国家电网
2341,2021-01-19,40批次防脱育发产品测评：章光101、霸王效果排名靠后,奥一网
2342,2021-01-19,苏宁易购：“腊八”关键词搜索量同比增长719%,36氪
2343,2021-01-19,商贸零售行业周观点报告：王府井投资免税企业 华熙生物“抢跑”食用透明质酸,新浪
2344,2021-01-19,苏宁易购关联企业注册资本增加220%,企查查
2345,2021-01-18,专注好服务！苏宁魅族战略合作，全链路优化用户体验,金融界
2346,2021-01-18,苏宁帮客连夜召集100多位工程师增援石家庄黄庄隔离点,中金在线
2347,2021-01-18,苏宁易购魅族达成战略合作，打通服务体系新增300+网点,中金在线
2348,2021-01-18,苏宁易购与魅族达成战略合作,中证网
2349,2021-01-18,全面深化服务体系 进一步洞察用户需求 魅族这次干得漂亮！,砍柴网
2350,2021-01-18,立足实业，张近东与苏宁的“数字蝶变”之路,中国家电网
2351,2021-01-18,苏宁易购：用数字科技升级零售服务这三项请划重点,中国家电网
2352,2021-01-18,苏宁魅族达成合作 门店新增300+魅族服务网点,电商报
2353,2021-01-18,魅族与苏宁达成战略合作 首批在苏宁门店新增300+快修网点,DoNews
2354,2021-01-16,苏宁抗疫再行动：紧急捐赠200万元抗疫物资支援石家庄集中隔离点建设,中国青年网
2355,2021-01-16,苏宁物流携手小米打造智慧仓配中心 发货量高达25万件,电商报
2356,2021-01-16,国美APP改名真快乐后，还有救吗？ 业务变化,搜狐
2357,2021-01-15,苏宁电器质押5000万股苏宁易购 占总股本0.54%,乐居财经
2358,2021-01-15,韵达盯电商，苏宁盯末端，或触及快递“价格战”突破口,电商报
2359,2021-01-15,张老虎唯品会专场卖货2022万元 主播向电商平台靠拢？,亿邦动力
2360,2021-01-15,从喜临门洞见“家装棋局”，南风窗解析未来新风向,飞象网
2361,2021-01-15,苏宁易购“20苏宁易购MTN001”涨逾8%,Wind
2362,2021-01-15,苏宁易购入股右来了，持股5%,企查查
2363,2021-01-15,1月18日起苏宁易购将连续4天开启原产地直播,电商报
2364,2021-01-15,韵达速递与苏宁物流签订合作协议,电商报
2365,2021-01-14,苏宁国际海南电商运营中心正式开园，跨境物流布局进一步夯实,搜狐
2366,2021-01-14,韵达联姻苏宁物流 建设全国性设施网络平台,北京商报
2367,2021-01-14,浙江美大(002677)公司首次覆盖报告：受益渗透率提升 集成灶龙头业绩增长空间广阔,新浪
2368,2021-01-14,首款锦鲤手机realme V15苏宁开售 限量赠独家盲盒,砍柴网
2369,2021-01-13,直播仓、产地仓和冷链仓，苏宁物流发挥仓配一体物流供应链优势,证券之星
2370,2021-01-13,国美零售股价大涨！“真快乐”这下真的快乐了？,环球老虎财经
2371,2021-01-12,中粮福临门和苏宁家乐福联合启动全国首批自然香销售战略合作,凤凰网
2372,2021-01-12,苏宁家乐福成福临门自然香大米首家线下战略合作零售商,联商网
2373,2021-01-12,苏宁易购申请“苏宁豆芽”商标,企查查
2374,2021-01-12,广西壮族自治区市场监管局：6批次家用燃气快速热水器产品不合格 产品问题,质量新闻网
2375,2021-01-12,以旧换新助力家电消费升级，苏宁家电推年货节焕新回馈,砍柴网
2376,2021-01-12,风向真的变了，涨到极致股东减持意愿也降低？,Wind
2377,2021-01-12,商贸零售行业周观点报告：12部门印发通知提振消费 “免税概念股”持续火爆,新浪
2378,2021-01-12,苏宁易购2021年货节正式开启,电商报
2379,2021-01-12,用抢购软件抢购茅台？恐有隐私泄露风险,工人日报
2380,2021-01-11,易达货栈获3500万人民币战略融资，京东、苏宁、拼多多投资,证券时报网
2381,2021-01-11,昆明“断崖式”降温致供暖小家电热销,北京青年报
2382,2021-01-11,苏宁易购17亿元债券购回款到账 苏宁系流动性压力是否缓解？,面包财经
2383,2021-01-09,苏宁电子竞技俱乐部与一加手机达成战略合作,36氪
2384,2021-01-08,丰巢再融资4亿美元，拼多多也瞄准快递柜，什么信号？,电商报
2385,2021-01-08,荣耀V40苏宁易购开启盲约推出独家盲盒,砍柴网
2386,2021-01-08,苏宁4个月内兑付债券超180亿,砍柴网
2387,2021-01-08,大厂专家下场创业获1.1亿美元D+轮融资；京东、苏宁、拼多多联投快递柜|投资速递,IT桔子
2388,2021-01-08,得意与黯然 盘点2020年家电上市公司(下篇),中国家电网
2389,2021-01-07,新零售转折在即，这次谁主沉浮？,大众新闻网
2390,2021-01-07,苏宁易购：今日债券购回金额17.33亿元,36氪
2391,2021-01-07,苏宁易购：18苏宁债第二次债券购回基本方案完成,Wind
2392,2021-01-07,21世纪最冷的北京 北京苏宁易购电暖器环比增长148%,中国家电网
2393,2021-01-06,《云计算半月刊》第七十一期（2021.2.25）,计算机司令部
2394,2021-01-06,零售变革抓两头 苏宁易购：用户需求反推供应链建设,联商网
2395,2021-01-06,苏宁吹响零售变革前哨 四大维度解读未来零售,砍柴网
2396,2021-01-06,苏宁易购副董事长孙为民：面向未来的生产会出现三个方面的变化,新浪
2397,2021-01-06,苏宁易购联合吴晓波频道发布2021新消费白皮书,中金在线
2398,2021-01-06,传媒互联网行业11月广告市场回顾：广告需求持续回暖 梯媒继续保持高景气度,新浪
2399,2021-01-05,高盛：阿里股价未来上涨；拼多多知乎账号禁言15天；罗森关东煮门店停业；苏宁电器质押股权融资；恒大商铺0元出售 经营问题,搜狐
2400,2021-01-04,苏宁易购发布《人的全景：数字生活的新消费趋势白皮书》,电商报
2401,2021-01-04,天风家电 | 火星人深度：集成灶行业的新基因,小蔡看家电
2402,2021-01-04,侯恩龙退出天天快递有限公司法定代表人 姚凯接任,电商报
2403,2021-01-04,TMT一周谈之电子行业：关注“疫情剪刀差”及3C情绪复苏,新浪
2404,2021-01-01,苏宁张近东：把握新机遇，谋求新发展,投资时报
2405,2021-01-01,广东南方洁灵科技实业有限公司 其他违规处罚,信用广州
2406,2020-12-31,苏宁集团董事长张近东元旦致辞：肩负使命，阔步前行,新浪
2407,2020-12-31,苏宁易购大数据：“魔王级”寒潮，把“秋裤线”往南吹了1000公里,中国家电网
2408,2020-12-31,苏宁易购：元旦前夕，自发热保暖内衣销量同比增长698%,36氪
2409,2020-12-31,楚天龙过会：今年IPO过关第385家 中信证券过29单,中国经济网
2410,2020-12-31,家电“以旧换新”迎来政策利好，厂商推出“自选动作”抢商机,经济日报
2411,2020-12-31,vivo X60正式发布，苏宁易购携手vivo送新机好礼,砍柴网
2412,2020-12-31,vivo X60上线苏宁易购，以旧换新至高补贴6666元,凤凰网
2413,2020-12-31,家电“以旧换新”商机大,经济日报
2414,2020-12-30,苏宁易购退出努比亚股东之列 中兴通讯此前称统一操盘回归2C市场,科技新闻网
2415,2020-12-30,跨年！苏宁把超买直播间搬进吴晓波年终秀会场,凤凰网
2416,2020-12-30,零售基建上云，苏宁易购赋能,投资家
2417,2020-12-30,苏宁易购在南京成立国际供应链管理公司，经营范围含国际货物运输代理等,企查查
2418,2020-12-30,苏宁易购退出努比亚技术有限公司股东,证券时报网
2419,2020-12-30,苏宁易购公司债小幅上涨,Wind
2420,2020-12-30,苏宁零售云8000店落地河南 稳步迈向万店时代,财经网
2421,2020-12-29,苏宁聚焦零售主业，联动众多品牌打响新十年第一枪,中金在线
2422,2020-12-29,持续聚焦零售“主赛道” 2021苏宁携手众多品牌共同开启新的未来,每经网
2423,2020-12-29,传媒本周观点：腾讯、拼多多业绩超预期 值得买双十一 GMV同增52% 关注疫苗研究获积极结果后线下复苏,新浪
2424,2020-12-29,稳定就业人才抄底，从苏宁秋招大数据看2020招聘新形势,中金在线
2425,2020-12-29,苏宁国际与海旅投合作优势探索，新格局下打造体验式服务,中金在线
2426,2020-12-29,苏宁易购：“18苏宁01”等7只债券已完成第二次购回,Wind
2427,2020-12-29,苏宁秋招大数据曝光：1200高管占比超30% 10年成长为总裁,中国青年网
2428,2020-12-28,苏宁与海南省旅游投资发展有限公司签战略合作协议,e公司
2429,2020-12-28,牵手海南旅投 苏宁曲线入场离岛免税,电商报
2430,2020-12-28,苏宁集团、苏宁国际与海南旅游投资发展公司达成战略合作,电商报
2431,2020-12-28,苏宁30年，张近东的又一次抉择,网易
2432,2020-12-26,"而立关口 苏宁走出""至暗时刻""",凤凰网
2433,2020-12-26,苏宁举办30周年庆 张近东：聚焦零售 深化服务,中证网
2434,2020-12-26,三十而立 励精图治——苏宁董事长张近东在30周年庆生会讲话稿,新浪
2435,2020-12-26,苏宁张近东谈下个十年：聚焦零售主业，学会做减法大胆调整,澎湃新闻
2436,2020-12-26,Haotaitai集成智慧厨房全新战略升级 引领“轻松下厨”智慧生活,中新网
2437,2020-12-26,苏宁易购筹划重大事项,中证报
2438,2020-12-25,苏宁易购申请“基于区块链的敏感数据交易方法及系统”专利,企查查
2439,2020-12-25,零售下半场的较量刚开始，孰能弯道超车？,中华网
2440,2020-12-24,圣诞节iPhone 12以旧换新，苏宁易购最高补贴1500元,凤凰网
2441,2020-12-24,“内循环”东风持续吹拂，这类公司2021迎来入手良机,投资家
2442,2020-12-24,零售大象苏宁易购：核心资产在手，何惧短期扰动,读懂财经
2443,2020-12-23,发挥样本价值，探寻苏宁30年高质量发展路径,金融界
2444,2020-12-23,聚焦城乡新消费，苏宁助力零售新变局探索,中金在线
2445,2020-12-22,论健2020，中国家电健康趋势高峰论坛在京举办,中国家电网
2446,2020-12-22,苏宁联合年销亿级家电3C商家签订战略合作协议,电商报
2447,2020-12-22,苏宁易购召开家电3C商家大会，亿级商家超过100家,36氪
2448,2020-12-22,长沙苏宁易购电子商务有限公司注销,电商报
2449,2020-12-22,打造家电行业发展“风向标” 苏宁海尔“三年战略”加速落地,证券日报网
2450,2020-12-21,公告精选：仁东控股回复关注函；苏宁易购继续对公司债券进行购回,e公司
2451,2020-12-21,苏宁易购：使用自有资金回购20亿元债券,搜狐
2452,2020-12-21,苏宁易购：使用20亿元自有资金对“18苏宁01”等7只债进行购回,企查查
2453,2020-12-21,三十周年苏宁，一场狂风暴雨般的舆论审判,搜狐
2454,2020-12-21,苏宁易购：继续以自有资金对公司债券进行购回,e公司
2455,2020-12-21,苏宁易购：使用自有资金对“18苏宁01”等7只债进行购回，购回资金总额为20亿元,Wind
2456,2020-12-21,四川苏宁物流有限公司法定代表人、执行董事、监事发生变更 董监高成员变化,电商报
2457,2020-12-21,12个案例3大场景演绎新能源汽车商业化破冰：私人消费兴起、商用营运突破,腾讯网
2458,2020-12-21,2020零售业升级 张近东：聚焦零售主业，拥抱变化,凤凰网
2459,2020-12-21,永煤事件问责拉开序幕？一券商四大业务线责任人被处分,券商中国
2460,2020-12-18,苏宁战略合作美的 确立3年800亿元销售目标,电商报
2461,2020-12-18,北京苏宁携手海信“双旦”推出多重福利回馈京城消费者,中国家电网
2462,2020-12-18,北京苏宁&北京美的：2021年实现全面增长,中国家电网
2463,2020-12-18,苏宁：未来三年全渠道销售美的空调800亿元,中证网
2464,2020-12-18,苏宁联合家电生产及回收企业成立以旧换新升级联盟,中国家电网
2465,2020-12-18,苏宁新十年聚焦开放赋能，张近东：加快社会化发展步伐,凤凰网
2466,2020-12-18,苏宁易购：公司截至目前未减持联通股权,Wind
2467,2020-12-18,苏宁华为深化战略合作 将联手推出全场景创新解决方案,中金在线
2468,2020-12-17,上海跨年迎新购物季 苏宁家乐福华东区推出“礼遇双旦”活动,联商网
2469,2020-12-17,苏宁易购=苏宁集团？别再傻傻分不清,阿尔法工场研究院
2470,2020-12-17,苏宁以旧换新：首创“送新拖旧一体化”服务机制,凤凰网
2471,2020-12-17,苏宁易购：股东减持达到公司股份总数百分之一 减持股份,电商报
2472,2020-12-17,苏宁易购公司债延续跌势,Wind
2473,2020-12-17,苏宁易购：已报名参加深圳、苏州数字人民币购物试点活动,电商报
2474,2020-12-17,张近东被误读了！,云掌财经
2475,2020-12-16,苏宁全面升级零售服务商，张近东：重点赋能三大领域,中金在线
2476,2020-12-16,家电产业如何智慧转型？这场大会透露了这些信息,南方+
2477,2020-12-16,苏宁金融延保火力全开 年末爆款产品优惠不停,凤凰网
2478,2020-12-16,苏宁易购与寿光蔬菜基地达成战略合作 启动山东寿光果蔬节,电商报
2479,2020-12-16,苏宁易购公司债下跌，“18苏宁06”跌近6%,Wind
2480,2020-12-16,2020人才引进多措并举，张近东加码苏宁新十年人才储备,凤凰网
2481,2020-12-16,苏宁品类发展策略：巩固家电、主攻快消、培育百货,电商报
2482,2020-12-16,苏宁频秀“肌肉”自证实力 组合拳粉碎不实市场传闻,电鳗快报
2483,2020-12-15,"2020苏宁加速开拓县镇市场 张近东如何将""好服务""下沉",凤凰网
2484,2020-12-15,苏宁易购申请多条“苏小嘿”、“嘿小苏”商标,企查查
2485,2020-12-15,浙江美大(002677)：集成灶渗透率提升有潜力 2021增长有望提速,新浪
2486,2020-12-15,苏宁易购双十二数据：12日当天30分钟卖出9000杯奶茶,电商报
2487,2020-12-15,食品饮料行业周观点报告：五粮浓香发布牛年生肖酒 习酒跨过百亿大关,新浪
2488,2020-12-15,提前还债提振市场信心 转型零售服务商是苏宁未来十年新机会,华夏时报
2489,2020-12-15,快递巨头加速拥抱“绿色包装”,上证报
2490,2020-12-14,苏宁易购双12酱酒销售同增83％,中国白酒网
2491,2020-12-14,保持定力，聚焦智慧场景，苏宁置业稳健发展,中国网
2492,2020-12-14,苏宁董事长张近东：不被外部杂音所干扰 用行动做出有力回应,TechWeb
2493,2020-12-14,张近东首次回应苏宁风波：全体员工不要被外部杂音干扰,AI财经社
2494,2020-12-14,刚刚，美团大跌，阿里腾讯也惊了!A股小伙伴火速“降温” 连续下跌,e公司
2495,2020-12-14,张近东开苏宁内部专题会:不被外部杂音所干扰 用行动做出有力回应,新浪
2496,2020-12-14,江瀚：苏宁控股集团股权质押给淘宝？苏宁质押事件究竟该怎么看？,金融界
2497,2020-12-14,食品饮料行业周报：推荐屠宰肉制品板块,国海证券
2498,2020-12-14,苏宁易购公司债小幅上涨,Wind
2499,2020-12-14,每日理财观察：证监会开展上市公司治理专项行动,Wind
2500,2020-12-13,苏宁重磅合作寿光蔬菜基地，水果萝卜现采现发,凤凰网
2501,2020-12-13,苏宁易购iPhone12旧机300元补贴700元 全国家电以旧换新促消费升级,中研网
2502,2020-12-12,三星高层密访苏宁 开展2021年战略合作会晤,中国家电网
2503,2020-12-12,苏宁云网万店完成A轮融资 融资金额为60亿元人民币,中研网
2504,2020-12-12,阿里美团拼多多退出社区团购？社区团购双十二正欢！,Wind
2505,2020-12-12,苏宁“股权质押”真相,搜狐
2506,2020-12-12,苏宁双十二12小时战报：iPhone12换新占比65%,联商网
2507,2020-12-12,苏宁iPhone12以旧换新补贴加码 最低补贴700元,中证网
2508,2020-12-12,苏宁易购“被质疑”的背后：聪明的机构正在激进“抄底”,环球老虎财经
2509,2020-12-12,苏宁加码iPhone12以旧换新补贴 最高补贴1500元,联商网
2510,2020-12-12,商业丨苏宁的“求救”与“自救”,搜狐
2511,2020-12-12,苏宁双12超级补贴：本地生活券5分钟售出10万份,电商报
2512,2020-12-12,苏宁易购：找马云借钱?,财富动力网
2513,2020-12-11,苏宁电器：15苏宁01发行额100亿，已提前兑付全部本息,澎湃新闻
2514,2020-12-11,苏宁电器：12月16日开始支付债券本金和最后一个年度利息,TechWeb
2515,2020-12-11,股权全部质押淘宝，苏宁最新回应来了,搜狐
2516,2020-12-11,苏宁电器提前兑付15苏宁01债券 总额100亿元,乐居财经
2517,2020-12-11,苏宁电器：15苏宁01债券12月16日兑付,上证报
2518,2020-12-11,21深度丨把脉苏宁股权质押，风波之下前景几何？,21世纪经济报道
2519,2020-12-11,来来来一起抢茅台：10个购买渠道 真一瓶难求,腾讯网
2520,2020-12-11,苏宁电器公告：已将100亿元规模“15苏宁01”债券本息提前转入结算账户,搜狐
2521,2020-12-11,苏宁电器百亿债券提前兑付,证券时报网
2522,2020-12-11,千亿大白马罕见杀跌！14万股东傻眼，股民惊呼“第二个仁东”，发生什么事?,21财闻汇
2523,2020-12-11,质押股权很正常，但苏宁易购的经营，还有待观察,DoNews
2524,2020-12-11,将苏宁控股全部股权质押给阿里，主业连亏6年，苏宁路在何方？ 股票质押异常,云掌财经
2525,2020-12-11,苏宁易购：推出总额10亿“超级双十二补贴”,e公司
2526,2020-12-11,苏宁与宝洁中国达成全场景深入合作,硅谷动力
2527,2020-12-11,苏宁发放10亿补贴 专注提升本地生活体验,中国青年网
2528,2020-12-11,本地生活也开放百亿补贴，苏宁易购全面布局线下供应链,凤凰网
2529,2020-12-11,理解苏宁：互联网转型之战,每经网
2530,2020-12-11,A股收盘综述：A股放量下探，上证指数跌0.77%,Wind
2531,2020-12-11,突发！千亿市值分众传媒早盘闪崩跌停，A股传媒板块集体“被重锤” 连续下跌,21世纪经济报道
