7279,2018-11-20,解析苏宁双十一战报的生态棋局：县镇店如何成为新引擎,砍柴网
7280,2018-11-20,(互动)苏宁易购：已在货源和推广等方面全力准备双十二大促,全景网
7281,2018-11-19,小米第三季度报：智能手机收入占比7成 提前完成1亿台“小目标”,挖贝网
7282,2018-11-19,无人机物流热情不减 多方推动行业迎来新阶段,投中网
7283,2018-11-19,"2018q3商贸零售行业基金持仓数据分析:机构重仓占比微增,集中度显著提升",光大证券
7284,2018-11-18,商业零售：10月社零增速回落 乡村消费增速快于城镇,中泰证券
7285,2018-11-18,顺丰、京东、苏宁、招商局等争抢分食冷链“蛋糕”,亿欧网
7286,2018-11-18,首富之子如何续写财富神话？解读最强富二代的投资“小目标”,巨丰财经
7287,2018-11-16,“风”起“云”涌——苏宁“云游小镇”活动落地安徽凤阳获央视点赞,信产网
7288,2018-11-16,小米股价疲软多时，双11这支“兴奋剂”也没用,中新经纬
7289,2018-11-16,"苏宁易购:流量变迁,线下渠道龙头再成长",国联证券
7290,2018-11-16,"商业贸易行业十月零售数据点评:受中秋节前移和11月促销消费滞后等多因素影响,10月零售增速回落",国海证券
7291,2018-11-15,苏宁易购25亿元第六期公司债 确定利率最低为4.70%,观点地产网
7292,2018-11-15,双十一大捷功臣：苏宁物流格局初现，扩张在即,搜狐
7293,2018-11-15,央视点赞的苏宁云游小镇 是低线消费市场的规模化崛起,证券之星
7294,2018-11-15,双十一苏宁零售云打造“云游小镇”助力乡镇消费升级，获央视记者点赞,砍柴网
7295,2018-11-15,“双十一”狂欢不吃土 捷信助力蓝领人群提高生活品质,和讯
7296,2018-11-15,“新零售”的另一种玩法？从“时尚之王”蘑菇街说起,搜狐
7297,2018-11-15,央视点赞“云游小镇” 苏宁零售云燃起“互联网大包干”风潮,砍柴网
7298,2018-11-15,无人车成智慧物流的香饽饽，电商企业、车企、科技公司竞逐,亿欧网
7299,2018-11-15,"商业贸易行业10月社零数据点评:社零总额同比增长8.6%,消费增速继续承压",申万宏源
7300,2018-11-15,"商业贸易行业周报:线上线下全渠道带动双十一高增长,进博会举办孕育跨境进口行业新机遇",中航证券
7301,2018-11-14,苏宁智慧零售的制胜法宝：“一个场景化”里圈定“三个半径”,证券之星
7302,2018-11-14,苏宁智慧零售的成功秘笈：技术深耕28载，科技突破无限可能,证券之星
7303,2018-11-14,央视点赞苏宁无人机械臂店 无人零售成就不一样的双十一,砍柴网
7304,2018-11-14,苏宁孙为民：谁把本地化互联网做好了，谁就能赢定未来,证券之星
7305,2018-11-14,未来零售服务先行 苏宁聚焦技术引领行业智慧变革,证券之星
7306,2018-11-14,苏宁“双十一”爆点满满：多维度发力推动消费升级,砍柴网
7307,2018-11-14,苏宁双十一全民嘉年华华丽落幕 开启“有品”消费新风尚,砍柴网
7308,2018-11-14,央视点赞苏宁智能家居Biu OS：直击行业痛点，实现跨品牌互联,砍柴网
7309,2018-11-14,苏宁易购今日大宗交易成交18万股，成交价11.59元折价0.0%,Wind资讯
7310,2018-11-14,央视直播大力报道，小岗村“云游小镇”有多火,砍柴网
7311,2018-11-14,小镇也能云游 苏宁“云游小镇”落地农村改革开放发源地！,砍柴网
7312,2018-11-14,安迅物流副总裁吴光华：5000亿元市场规模的家居物流，发展前景巨大,亿欧网
7313,2018-11-14,板桥镇云游小镇折射苏宁助力乡镇创业和经济发展 谱写改革开放后四十年新起点,砍柴网
7314,2018-11-14,重新定义双十一，苏宁胜在将服务做到极致,砍柴网
7315,2018-11-14,消费升级下的零售升级：苏宁双十一重构消费场景,砍柴网
7316,2018-11-14,当智慧零售遇上消费升级，双十一亮点大增！,砍柴网
7317,2018-11-14,双十一“云游小镇”落地凤阳板桥镇，零售云助推县镇市场消费升级,砍柴网
7318,2018-11-14,签约徐工施维英，苏宁助力制造行业员工福利模式升级,证券之星
7319,2018-11-14,苏宁卡携手联通、移动 推出积分免费兑卡福利,证券之星
7320,2018-11-14,【亿欧快讯】全时便利店或将出让部分股权给苏宁易购,亿欧网
7321,2018-11-14,苏宁易购“双线融合”引爆双十一，服务两亿消费者，订单增长132%,环球老虎财经
7322,2018-11-14,“双十一”再爆发显消费潜力 中国消费升级路径如何？,21世纪经济报道
7323,2018-11-14,苏宁拼购发力社交电商 新进者如何差异化破局？,21世纪经济报道
7324,2018-11-13,全时便利店被传倒手,北京商报网
7325,2018-11-13,2018年“双十一”全网零售额TOP20店铺榜单：苏宁易购官方旗舰店零售额第一,中商情报网
7326,2018-11-13,双十一购物狂欢又刷新纪录 剁手族手速惊人,慧聪网
7327,2018-11-13,“互联网大包干”改革开放40年再掀新浪潮，苏宁零售云双十一销售暴增3308%,砍柴网
7328,2018-11-13,双十一后苏宁电视悟空榜：小米持续领先，线下榜首属海信,证券之星
7329,2018-11-13,【计算机-胡又文】2018双十一主要电商表现小结,安信证券研究
7330,2018-11-13,"商业贸易行业周报:天猫双十一成交额超2135亿,新零售巨头引领线上线下融合",申万宏源
7331,2018-11-12,苏宁双11电视悟空榜：夏普全军出击 小米大屏夺冠！,证券之星
7332,2018-11-12,双十一结尾 你熟知的几家手机厂商在战报里写了啥？,新浪
7333,2018-11-12,改革开放40年科技是第1生产力 苏宁金融坚持技术赋能,飞象网
7334,2018-11-12,快讯：苏宁：销售猛增132%，90后是最大消费群体,国际金融报
7335,2018-11-12,苏宁易购双十一：全渠道销售同比增长132%,Wind
7336,2018-11-12,苏宁易购公布双十一战报：全渠道销售同比增长132%,TechWeb
7337,2018-11-11,苏宁易购18小时战报：线下订单增长96%，南方人更爱买取暖器过冬,IT之家
7338,2018-11-11,苏宁易购18小时战报：县镇市场同比增171%，东北西北成先锋,Wind
7339,2018-11-11,苏宁国际双十一战报：97分钟销售超去年全天,Wind
7340,2018-11-11,18个小时苏宁易购县镇市场成交额增长171%,亿欧网
7341,2018-11-11,商业零售：双十一大战已起 荐5股,安信证券
7342,2018-11-11,华泰证券：三大变化助力“双十一”高增长,中证网
7343,2018-11-11,苏宁易购发布双11战报：4秒破亿元，50秒破10亿元,Wind
7344,2018-11-11,【亿欧快讯】苏宁物流9分48秒完成双11首单配送,亿欧网
7345,2018-11-11,苏宁易购总裁：真实数据 4秒破亿元,北京商报网
7346,2018-11-11,苏宁易购双十一当日开场4秒破亿！,中金在线
7347,2018-11-11,苏宁易购宣布“双11”销售额4秒破亿 50秒破10亿,网易
7348,2018-11-10,洋成都过双十一，江疏影1亿红包等待揭秘,证券之星
7349,2018-11-09,苏宁小店版SUPER VIP双十一开放，会员专享价商品5折起,赛迪网
7350,2018-11-09,“双11”苏宁小店版SUPER VIP对外开放,亿欧网
7351,2018-11-09,苏宁霸屏社交APP，1108超级拼购日链接被分享1.1亿次,IT时代网
7352,2018-11-09,苏宁发声世界互联网大会 高效融合AI、业务和管理，追求发展新机遇,中金在线
7353,2018-11-09,【亿欧快讯】苏宁易购互联网门店已达一万家,亿欧网
7354,2018-11-09,秋裤畅销！95后“新人类”成苏宁1108“超级拼购日”大买家,IT之家
7355,2018-11-09,"苏宁双十一预售榜出炉,揭秘国人购买偏好",证券之星
7356,2018-11-09,“双十一”十周年：零售巨头们步调一致掉头向“下”,证券之星
7357,2018-11-09,双11带动线下商超：盒马鲜生销售增加两成、欧尚单日客流翻了两倍,联商网
7358,2018-11-09,双十一倒计时，苏宁加购专场撼动天猫预售？,证券之星
7359,2018-11-09,双十一提振商业连锁等三板块上涨预期 大单抢筹45只股,证券日报
7360,2018-11-08,黄山：买公司股票送景区门票！网友：买一手逛完就抛,每日经济新闻
7361,2018-11-08,1108超级拼购日亮眼，苏宁拼购冲刺千万订单,IT之家
7362,2018-11-08,电商迎来“年度大考” 券商点赞“苏宁自营商品运费全免”,砍柴网
7363,2018-11-08,改革开放40周年乡镇消费模式大变样，苏宁智慧零售为“乡村振兴”增砖添瓦,砍柴网
7364,2018-11-08,双十一下单就定30分钟倒计时，苏宁小店的延迟赔从来没见过,证券之星
7365,2018-11-08,董秘解码：美好置业将于年底建成投产装配式建筑生产线,巨丰财经
7366,2018-11-08,苏宁超级CP品牌盛典，12大品牌燃动双十一,证券之星
7367,2018-11-08,电商流量拉动苏宁金融成长 双11前交易量已超万亿元,北京商报网
7368,2018-11-08,乡村振兴产业兴旺是重点 苏宁智慧零售全面赋能乡村升级,证券之星
7369,2018-11-08,[互动]苏宁易购：双十一开启线上线下融合玩乐于一体的丰富活动,全景网
7370,2018-11-08,苏宁易购：家电零售形成宽阔护城河 全渠道多业态实现规模发展,中泰证券
7371,2018-11-08,苏宁控股集团董事长张近东:积跬步方能致千里,中国经济网
7372,2018-11-07,火拼1108拼购日，苏宁拼购老总微信朋友圈疑挤兑京东,IT之家
7373,2018-11-07,双十一薅羊毛要趁早，苏宁厨卫电器29元拼不拼,证券之星
7374,2018-11-07,热气球俯瞰广州？苏宁双十一让家电飞上天！,证券之星
7375,2018-11-07,购物补贴、自营运费全免，苏宁86元以下订单量增长186%,IT之家
7376,2018-11-07,京东擅用江疏影照片 工作室声明侵权对与苏宁合作造成影响 诉讼纠纷,新浪
7377,2018-11-07,提速更提质 从“全民嘉年华”看苏宁智慧零售如何赋能县镇市场,证券之星
7378,2018-11-07,苏宁三季度归母净利润增长812.11% 万家门店智慧迎战双十一,证券之星
7379,2018-11-07,美的微晶冰箱苏宁万名用户交付 168道极智法餐打造高端会员圈层,消费日报网
7380,2018-11-06,"苏宁未来2年将推三大举措,加速建设线下渠道",亿欧网
7381,2018-11-06,步步高、天虹、苏宁等中国零售中坚力量的深度思考,连锁协会
7382,2018-11-06,苏宁进博会期间海外采购额将达150亿欧元,Wind
7383,2018-11-06,张近东：苏宁通过“互联网+”促进区块链等技术的应用,Bianews
7384,2018-11-06,苏宁领跑双十一价格战，彩电越买越大是主流,证券之星
7385,2018-11-06,苏宁卡携手小米手机 双11推出米粉专属品牌卡优惠,证券之星
7386,2018-11-06,商业零售：精选优质成长 荐5股,安信证券
7387,2018-11-06,大动作不断 苏宁物流开始家居供应链改革战,亿邦动力
7388,2018-11-06,双11临近，家居物流开始放大招,亿欧网
7389,2018-11-05,长江零售 | 复盘看零售企业的周期性,长江零售研究团队
7390,2018-11-05,张近东：苏宁未来三年初步拟定100亿欧元全球采购计划,Wind
7391,2018-11-05,德邦、京东物流、苏宁物流、日日顺，究竟谁能拿下家居物流？,亿欧网
7392,2018-11-05,苏宁双十一设家装比价日 4000万补贴正面刚,IT之家
7393,2018-11-05,近万家智慧零售门店发力双十一 全业态联动实现“上网上街上苏宁”,砍柴网
7394,2018-11-05,亮眼财报撞上双十一，苏宁万家门店助力，打造消费新“极致体验”,砍柴网
7395,2018-11-05,苏宁三季报为何再次“爆表”答案就在“一二三”,砍柴网
7396,2018-11-05,双十一狂欢到来时，苏宁已重新定义不一样的双线玩法,砍柴网
7397,2018-11-05,零售云入县镇 苏宁智慧零售赋能低线市场消费升级,砍柴网
7398,2018-11-05,148股获券商买入评级 建发股份目标涨幅达132.94%,Wind
7399,2018-11-05,上周机构调研123家公司数量飙升近四成，20只潜力股备受外资青睐,证券日报
7400,2018-11-04,一周物流大事件 | 苏宁45仓三段式体系成型，德邦乡镇覆盖率达到94%,亿欧网
7401,2018-11-03,从量变到质变 苏宁易购逆势高增长的三个原因,证券之星
7402,2018-11-03,券商为何调高目标价？苏宁易购三季报出炉给出答案,证券之星
7403,2018-11-03,央行正对5家金融控股公司模拟监管试点 监管办法力争明年上半年推出,每日经济新闻
7404,2018-11-02,深交所推出首批信用保护工具业务试点,Wind
7405,2018-11-02,苏宁牵手泸州老窖 双十一开门红发布战略新品茗酿,和讯
7406,2018-11-02,苏宁易购双十一玩法“激变”3大节点最实惠,中国电子报
7407,2018-11-02,苏宁易购启动“双11” 自营商品运费全免,新快报
7408,2018-11-01,双十一苏宁首日战报：最受欢迎商品TOP3小米占俩,驱动之家
7409,2018-11-01,苏宁双11首日12小时战报：全渠道GMV同比大增231%,联商网
7410,2018-11-01,Suning Reports 31.15% Rise In Operating Revenue In First Three Quarters As Retail Business Thrives,PR Newswire
7411,2018-11-01,苏宁物流和维尚家具联手发力家居物流新服务,亿欧网
7412,2018-11-01,342股获券商买入评级 光明地产目标涨幅达275.71%,Wind
7413,2018-10-31,消费升级成大势所趋 央视用苏宁智慧零售案例 “激变”市场新玩法,砍柴网
7414,2018-10-31,苏宁双十一“奥斯卡”添星万家乐洗碗机新品首发,IT之家
7415,2018-10-31,2018双十一超级拼购日 苏宁推客发放额外补贴,证券之星
7416,2018-10-31,【光大零售|公告点评】苏宁易购（002024.SZ）：业绩略低于预期，收入增速放缓,鸭毛信
7417,2018-10-31,苹果发布iPad Pro、MacBook，苏宁双十一已开启预售,IT之家
7418,2018-10-31,苏宁预售榜单公布，小米Mix3预售量突破10万+,证券之星
7419,2018-10-31,苏宁易购紧急撇清“逃税门” 115只基金暂舒一口气,号外财经网
7420,2018-10-31,苏宁易购前三季度净利润61.27亿元 智慧零售仍处前期投入,每日经济新闻
7421,2018-10-30,苏宁易购：前三季度净利润大增812% 仓储面积近800万平米,中国网
7422,2018-10-30,苏宁易购：前三季度净利润同比增812.11%,Wind
7423,2018-10-30,苏宁易购：前三季度净利61亿 同比增长812%,e公司
7424,2018-10-30,苏宁易购前三季度净利润61.27亿元 同比增长812.11%,中证网
7425,2018-10-30,剑指双十一，苏宁卞农出访洋河,证券之星
7426,2018-10-30,苏宁上榜《财富》未来50强：智慧零售模式获肯定,联商网
7427,2018-10-30,员工持股黑洞：花3000万买自家股票缩水84%，有公司人均亏160万,凤凰网
7428,2018-10-30,苏宁易购回应财政部点名：会计事务所执业质量问题与纳税无关,Wind
7429,2018-10-30,A股早报2018年10月30日星期二,Wind
7430,2018-10-29,2018双十一苏宁华为Mate 20首战告捷 销售额破亿,驱动之家
7431,2018-10-29,苏宁冷链45仓备战双11，渠道下沉三线城市,亿欧网
7432,2018-10-28,商业零售：基金持仓持续低配 关注零售行业优质成长性龙头,中泰证券
7433,2018-10-27,拆解苏宁双十一战术：线上自营免运费 零售云店加码线下主战场,经济观察网
7434,2018-10-27,原苏宁IT执行副总裁向江旭加盟宜信任CTO,亿欧网
7435,2018-10-27,苏宁双十一重兵布局线下：联手万家门店，撒10亿购物补贴,华夏时报
7436,2018-10-26,苏宁易购总裁侯恩龙：“双11”自营产品运费全免,IT之家
7437,2018-10-26,苏宁双十一线上线下全参与自营商品运费全免,凤凰网
7438,2018-10-26,苏宁双十一发10亿购物补贴 自营商品运费全免,驱动之家
7439,2018-10-26,苏宁易购总裁谈京东百万门店计划：更多的是纸上谈兵,新浪
7440,2018-10-26,易读|苏宁易购总裁侯恩龙：“双11”运费不收一毛钱,网易
7441,2018-10-26,双十一苏宁悟空榜再升级，共享快递盒投13城,亿欧网
7442,2018-10-26,侯恩龙：抢风口的人做0-1，苏宁干的是1-N,IT之家
7443,2018-10-26,苏宁易购放大招，今年双11期间自营运费全免,亿欧网
7444,2018-10-25,苏宁基金研究中心预判 金融主题基金值得关注,南方财富网
7445,2018-10-25,双11前夕互联网巨头 拼速度 抢入口,新华网
7446,2018-10-25,中国智能机Q3销量苹果跌至第六，特斯拉上海工厂环评公布|早8点档,动点科技
7447,2018-10-25,新金融独角兽“步履蹒跚”：争牌照、募资难、估值承压,投中网
7448,2018-10-25,苏宁 “线上+线下”搭建智慧零售新模式,新京报
7449,2018-10-25,"商业贸易周报:9月社零总额同比增长9.2%,超市行业相关品类增速较高",申万宏源
7450,2018-10-24,苏宁易购：拟融资40亿支持公司海外业务发展,腾讯网
7451,2018-10-24,苏宁易购：对华泰证券投资转为权益法 将增2018年净利润7.61亿元,中证网
7452,2018-10-24,搭上券商股反弹便车 苏宁易购参与华泰证券定增将增利逾7亿,e公司
7453,2018-10-24,苏宁易购：将对华泰证券的投资会计核算方法转为权益法核算,e公司
7454,2018-10-24,苏宁易购三季报出炉在即 业绩预测继续令人惊艳,证券之星
7455,2018-10-24,65城同步开通“苏宁秒达”：30分钟极速配送,IT之家
7456,2018-10-24,牵手苏宁后再和阿里达成新零售合作 中宠股份盘中放量涨停,挖贝网
7457,2018-10-24,年内478家公司斥资236亿元回购 近七成公司三季报预喜,中国网
7458,2018-10-23,抢双十一生意 苏宁做了个秒达众包平台,IT之家
7459,2018-10-23,A股或迎年内幅度最大反弹 苏宁易购等大消费板块全线走强,证券网
7460,2018-10-23,苏宁易购：盘活物流存量资产 加强供应链核心竞争力,国海证券
7461,2018-10-23,医疗保健：粤港澳大湾区疫苗产业基地成立,川财证券
7462,2018-10-23,"商业贸易行业9月零售数据点评报告:9月消费小幅回暖,必须消费品普遍改善",国海证券
7463,2018-10-22,合景泰富与苏宁签订合作 涉零售、投资、商业等,观点地产网
7464,2018-10-21,苏宁易购拟为旗下金融、电商公司提供50亿元担保,观点地产网
7465,2018-10-20,【亿欧快讯】苏宁物流陆君峰：“苏宁秒达”下周上线,亿欧网
7466,2018-10-19,苏宁易购拟注册发行不超过50亿元中期票据,观点地产网
7467,2018-10-19,苏宁易购拟变更293亿定增部分资金用途 涉资31.7亿元,观点地产网
7468,2018-10-19,苏宁易购：拟向交易商协会申请注册发行不超过50亿元中票,Wind
7469,2018-10-19,京东快递正式上线！寄东西价格比顺丰低一点,观察者网
7470,2018-10-19,美的置业与苏宁签署战略合作协议,证券时报网
7471,2018-10-19,美的置业与苏宁战略合作 将在零售等三大版块深度合作,观点地产网
7472,2018-10-19,苏宁布局家居物流，痛点难除非一日之功,亿欧网
7473,2018-10-19,37股获券商买入评级 隆华科技目标涨幅达54.48%,Wind
7474,2018-10-19,苏宁金服53.35亿元融资到位,证券日报
7475,2018-10-19,本月五类机构调研37家公司 9只个股后市望存反弹机会,证券日报
7476,2018-10-18,【亿欧快讯】苏宁物流天津布局智慧电商产业园,亿欧网
7477,2018-10-18,K线丨美的置业与苏宁签署战略协议 将在零售、金融方面等开展合作,乐居财经
7478,2018-10-18,苏宁易购：10月26日起门店率先启动“双十一”,e公司
7479,2018-10-18,51股获券商买入评级：鲁亿通目标涨幅达160%,Wind
7480,2018-10-17,苏宁金服53亿募资全部到位 马云入股投资10亿元,联商网
7481,2018-10-17,"苏宁易购:苏宁小店股权变更,搭建灵活资本运作平台",正点财经
7482,2018-10-17,华为Mate20全球首秀，苏宁易购超级新品同步预定,IT之家
7483,2018-10-16,【海通策略】中小创利润增速放缓，龙头更优——18年三季报预告分析（荀玉根、李影、王一潇）,股市荀策
7484,2018-10-16,销售业绩抢眼 苏宁双线融合布局成行业最大亮点,证券之星
7485,2018-10-16,[买入评级]苏宁易购(002024)公告点评：减持小店股份不改其长期战略价值,中财网
7486,2018-10-16,苏宁合作宜家 家居物流服务痛点难解决,投中网
7487,2018-10-16,[增持评级]苏宁易购(002024)更新报告：优化小店股权结构 撬动线下流量入口,中财网
7488,2018-10-16,[看好评级]商业贸易行业周报：零售行业三季报前瞻出炉 推荐优质龙头个股,中财网
7489,2018-10-16,55股获券商买入评级 新城控股目标涨幅达117.19%,Wind
7490,2018-10-15,苏宁金服增资扩股募资53.35亿全部到位，投前估值270亿元,21世纪经济报道
7491,2018-10-15,双十一大练兵！苏宁微软品牌日连上两款重磅新品,IT之家
7492,2018-10-15,零售行业三季报业绩预览：行业增速有所放缓 龙头表现优于平均,中财网
7493,2018-10-15,[买入评级]苏宁易购(002024)点评：变更苏宁小店为35%参股 共谋长期智慧零售协同发展,中财网
7494,2018-10-15,瑞幸的咖啡苏宁送，这是啥操作？,砍柴网
7495,2018-10-15,[买入评级]苏宁易购(002024)公告点评：小店增资扩股、转让部分股权到体外 搭建灵活资本运作平台,中财网
7496,2018-10-15,苏宁小店获3亿美元增资 张近东儿子持有65%股份,联商网
7497,2018-10-15,苏宁金服投前估值270亿元 增资扩股加速金融业态升级,金融界
7498,2018-10-15,光大证券：苏宁易购买入评级,光大证券
7499,2018-10-15,[增持评级]商业贸易行业周报：生鲜电商GMV破千亿 政策促进购物中心便利店发展,中财网
7500,2018-10-15,苏宁易购（002024）快评：稀释苏宁小店持股比例，减少经营业绩影响 盈利能力下降,国信研究
7501,2018-10-15,苏宁易购拟7.45亿出售苏宁小店100％股权予参股公司,观点地产网
7502,2018-10-15,棕榈股份实控人将变为栖霞建设 苏宁易购7.45亿售苏宁小店,观点地产网
7503,2018-10-15,"苏宁易购关联交易公告点评:减持苏宁小店股权至35%,轻装上阵降低业绩压力",光大证券
7504,2018-10-14,苏宁易购：苏宁小店前7月亏近3亿 股权转让增净利3亿,新京报
7505,2018-10-14,晚间重要公告2018年10月14日星期日,Wind
7506,2018-10-14,苏宁易购：苏宁金服增资扩股募集资金已全部到位,Wind
7507,2018-10-14,苏宁易购：苏宁金服增资扩股募集资金已全部到位,e公司
7508,2018-10-12,设小店中心仓双十一苏宁发力即时配送,IT之家
7509,2018-10-12,苏宁易购新品优惠价，创维全面屏爆款直降千元,砍柴网
7510,2018-10-11,1305份三季报预告逾六成实现净利增长,证券日报
7511,2018-10-07,商业零售：整体消费疲弱态势持续 行业洗牌期间成长性龙头优势将更加凸显,中泰证券
7512,2018-10-04,苏宁易购股票行情：线上GMV增速居高位，线下门店外延扩张叠加内生增长持续改善业绩,方正证券
7513,2018-09-30,苏宁进军智能家居抢占市场C位 智慧零售生态链再下一环,砍柴网
7514,2018-09-30,科技苏宁打造智能硬件产品 智慧零售抢占万物互联制高点,砍柴网
7515,2018-09-29,苏宁快递费“不涨一毛钱”的背后,IT之家
7516,2018-09-29,苏宁Biu+生态联盟成立 助力中国智慧家居生态建设,证券之星
7517,2018-09-29,强势进军智能生活硬件领域 苏宁吹响智慧零售新战场“集结号”,证券之星
7518,2018-09-29,零售服务带动消费升级，苏宁见证改革开放40年行业变迁,南方财富网
7519,2018-09-29,智慧家居领航品质生活 苏宁智慧零售再造极,砍柴网
7520,2018-09-28,彩电市场遭遇“国庆劫”？看行业老大苏宁怎么说！,全景网
7521,2018-09-28,需求反向驱动创新 科技苏宁助力生活美学,证券之星
7522,2018-09-28,多款智能硬件领军智慧家庭 智慧零售创造美好生活,证券之星
7523,2018-09-28,新兴业态助力消费升级 智慧零售链接美好生活,证券之星
7524,2018-09-28,继苏宁后，国美宣布双11物流不涨价,IT之家
7525,2018-09-28,智慧零售再开发 科技助力苏宁抢占智慧家居蓝海,证券之星
7526,2018-09-28,从苏宁“头号买家”，看张近东企业经营创新之道,证券之星
7527,2018-09-28,榨菜泡面等于消费降级？NO！苏宁告诉你28年来如何助力消费升级,证券之星
7528,2018-09-28,苏宁推出智能硬件生态 这次跨越的步子是不是太大了？,创业邦
7529,2018-09-28,多家快递“双11”前涨价 苏宁物流发声不参与,证券日报
7530,2018-09-27,天天快递总裁姚凯：让用户多掏钱的双11缺少最基本的真诚,TechWeb
7531,2018-09-27,风口下的体育产业版权争夺战 入局者陷变现困局,经济观察网
7532,2018-09-27,苏宁姚凯：双十一苏宁快递不涨价,亿邦动力
7533,2018-09-27,双十一前快递纷纷涨价 苏宁高管发声：不涨一毛钱,金融界
7534,2018-09-27,天天快递总裁：苏宁双11快递不涨价 涨价企业缺乏真诚,联商网
7535,2018-09-27,央视点赞苏宁校招 万人全球招聘火力全开,证券之星
7536,2018-09-27,苏宁物流集团常务副总裁：双十一 苏宁快递不涨价,中证网
7537,2018-09-27,智慧网联新篇章掀开 苏宁“黑科技”渗入人们生活各方面,证券之星
7538,2018-09-27,科通芯城加入苏宁智能联盟 共建硬件生态圈,亿邦动力
