4643,2020-02-25,苏宁“救市”：3000场同步直播，1.3亿人次在线，家乐福单店日销5万单,21商评网
4644,2020-02-25,新动向！楼市两成首付又回来了,中国财富网
4645,2020-02-24,苏宁“云签约”众多家电家装3C品牌,中证网
4646,2020-02-24,128G版iPhone11每天只要8元苏宁买家电家装电脑手机24期免息,快科技
4647,2020-02-24,苏宁连发救市三箭：24期免息、开仓、超店播,牛华网
4648,2020-02-24,苏宁易购：将通过24期免息等举措全面刺激市场需求,e公司
4649,2020-02-24,苏宁易购：购家电、家装、手机 享24期分期免息,e公司
4650,2020-02-24,3000斤“爱心芹菜”明天上架北京苏宁家乐福,环球家电网
4651,2020-02-24,下沉市场消费回暖，苏宁零售云主抓“在线化”销售增2倍,中金在线
4652,2020-02-24,“宅经济”新模式涌现 全场景零售服务价值凸显,中金在线
4653,2020-02-24,当医疗队想念家乡的味道，苏宁物流半日达驰援,证券之星
4654,2020-02-24,【V路演】苏宁云商董事长张近东详解零售业发展契机,新浪
4655,2020-02-24,苏宁联手恒大集团推出网上购房活动,电商报
4656,2020-02-24,雷神山、方舱医院的背后，苏宁帮客硬核驰援,证券之星
4657,2020-02-24,苏宁联手恒大网上卖房：75折再送5000元苏宁卡,快科技
4658,2020-02-24,75折叠加1元抵5000元！苏宁联手恒大发起网上卖房春季攻势,牛华网
4659,2020-02-24,苏宁恒大联手线上卖房：购房者享75折再送5000元苏宁卡,澎湃新闻
4660,2020-02-24,苏宁物流升级同城配，51城半日达助力家乐福到家,凤凰网
4661,2020-02-24,苏宁易购为家乐福中国子公司2亿元融资提供担保 大额借贷担保,观点地产网
4662,2020-02-24,苏宁金融科技专利申请数居全球前列 聚焦人工智能技术,牛华网
4663,2020-02-24,苏宁新风口罩环比增长2020%，智慧零售“中台”思路价值凸显,证券之星
4664,2020-02-24,“一店一品一商” 苏宁大数据助力智慧供应链建设,证券之星
4665,2020-02-24,联商百货周报：零售业加码直播 苏宁易购平台全面开放,联商网
4666,2020-02-23,重庆农商行：专属服务 精准施策 金融助力民生物资供应保障足,红周刊
4667,2020-02-21,快手发布《2019快手内容报告》：日活突破3亿，App内视频近200亿条；蓝色光标发布在线营销平台丨【每日播报】,阿特列斯如是说
4668,2020-02-21,疫中大考，家乐福逆流而上,和讯
4669,2020-02-21,抗疫期间助农保供考验电商巨头渠道下沉,中金在线
4670,2020-02-21,苏宁易购：拟将租赁店项目部分募集资金15亿元用于偿还金融机构贷款项目,Wind
4671,2020-02-21,苏宁易购(002024.SZ)拟将租赁店项目部分募集资金15亿元用于偿还金融机构贷款,格隆汇
4672,2020-02-21,苏宁易购：为子公司提供合计不超2亿元担保 大额借贷担保,Wind
4673,2020-02-21,苏宁易购推出“超店播计划”,硅谷动力
4674,2020-02-21,开仓计划后，苏宁冰洗撒亿元补贴助力“焕新”,证券之星
4675,2020-02-21,苏宁家乐福CEO田睿：今年要打造家乐福核心业务模式,国际金融报
4676,2020-02-21,张近东：苏宁最核心两件事，全场景与智慧供应链,第一财经
4677,2020-02-21,苏宁推出家电“开仓计划” 科技支撑下沉市场多维度需求满足,证券之星
4678,2020-02-21,疫情之下网购哪家强？12城超100人亲测结论惊人,联商网
4679,2020-02-21,苏宁开启12小时不间断直播，10点开播,联商网
4680,2020-02-21,直播带货，家电业的应急之策还是长远之计？,中国家电网
4681,2020-02-20,苏宁家乐福CEO田睿：不要做金丝雀,虎嗅网
4682,2020-02-20,无接触焕新，苏宁家电开仓计划推出 “九道防护”,证券之星
4683,2020-02-20,服务部队，苏宁小店保障军民供给,牛华网
4684,2020-02-20,上午买下午到，苏宁物流西部双城恢复半日达保民生,证券之星
4685,2020-02-19,家乐福“同城配”服务上线 已接入苏宁易购,电商报
4686,2020-02-19,疫情批量催生“厨神” 苏宁大数据：每天卖出近万口锅,证券之星
4687,2020-02-19,苏宁助家乐福拓展配送辐射至10公里,北京商报网
4688,2020-02-19,家乐福“同城配”上线苏宁易购，到家服务再升级,牛华网
4689,2020-02-19,再获家电全渠道第一，苏宁给“疫期”的厨卫行业什么启示,证券之星
4690,2020-02-18,无人车无接触配送来了！一个千亿产业就在眼前！,电商报
4691,2020-02-18,便利店餐饮企业都来试水 “全民卖菜”风口渐起,经济观察网
4692,2020-02-18,报告称2019年家电市场全渠道市场份额苏宁居首,中证网
4693,2020-02-18,到家业务井喷线下商超“翻身”,中国商报
4694,2020-02-18,2019年国内家电零售额总额8032亿 苏宁、京东居前二,联商网
4695,2020-02-18,2019年国内家电市场零售额规模8032亿元 苏宁全渠道占比22.8%居首位,证券日报
4696,2020-02-18,苏宁易购赠送湖北省所有用户Super会员,牛华网
4697,2020-02-18,1元就能下单，菜品新鲜不贵，疫情下这家平价菜场订单暴涨,21商评网
4698,2020-02-18,家电复工苏宁紧急启动 “开仓计划”,红周刊
4699,2020-02-18,疫情之下，零售企业不该只是为了 “ 活 ” ！,联商网
4700,2020-02-18,2019年家电市场份额排名：苏宁全渠道第一,快科技
4701,2020-02-18,2019年度家电市场排位：苏宁全渠道第一,证券时报
4702,2020-02-18,疫情下的社区零售，不出众就出局,红周刊
4703,2020-02-18,继公共交通 苏宁出行码将再落地商超、社区、学校等,中华网
4704,2020-02-18,远程办公非“万能药” 互联网企业仍盼线下复工,时代周报
4705,2020-02-17,科技领先 发展稳健 苏宁金融荣获国内最高AAA主体评级,金融界
4706,2020-02-17,江苏省商务厅充分发挥电子商务作用 助力做好应对疫情工作,商务部
4707,2020-02-17,南昌市市场监督管理局：6批次食品不合格 产品问题,质量新闻网
4708,2020-02-17,今天起全国收费公路免费通行!快递物流行业受利好恢复元气？,格隆汇
4709,2020-02-17,各方围剿“口罩”乱象：苏宁电动口罩为物资供应打开新出路,证券之星
4710,2020-02-17,苏宁美的再度响应武汉求援：冷柜半日送达,证券之星
4711,2020-02-16,联商周报：阿里Q3营收增长38％ 海底捞停业损失超11亿 经营问题,联商网
4712,2020-02-16,连年亏损，又遭疫情，苏宁LAOX高管降薪裁员图自救 员工变动,联商网
4713,2020-02-16,商超企业供应链大考,中国企业家网
4714,2020-02-15,【复工在行动】没有停工的“复工”,新华网
4715,2020-02-15,响应“绿色购物倡议” 线下商家转战线上，开直播卖手机推家电,重庆商报
4716,2020-02-15,助力公共交通疫情防控 苏宁推出免费城市出行信息系统,中金在线
4717,2020-02-15,疫情下北京商圈走访｜特殊情人节，风雪石景山：“好多店开门一天都没开张”,华夏时报
4718,2020-02-15,招工数万，生鲜零售春潮「涌动」,和讯
4719,2020-02-15,“复工”之后：A股企业的三张“灵魂考卷”,21世纪经济报道
4720,2020-02-14,“宅经济”需求激增 带火“在线+”各大领域,金融投资报
4721,2020-02-14,助力公共交通抑制疫情 苏宁出行信息系统今在南京落地,证券之星
4722,2020-02-14,情人节众生相：花农销售遇阻，消费者购买无门,牛华网
4723,2020-02-14,苏宁：情人节巧克力不可少 “云复工”笔记本销量紧俏,新京报
4724,2020-02-14,企业抱团战“疫” 那些被共享的员工都怎么样了？,亿邦动力
4725,2020-02-14,生鲜电商争霸赛：得“供应链+即时配送”者，得天下,第一财经
4726,2020-02-14,家乐福响应市场监督管理总局“保价格、保质量、保供应”系列行动,市场导报
4727,2020-02-14,情人节消费大数据：蔬菜、理发器、消毒液、巧克力、维C均成热门礼物,21世纪经济报道
4728,2020-02-14,苏宁大数据：情人节消毒液销量增2501％ 抗疫力取代男友力,联商网
4729,2020-02-14,每日理财观察：九成基金收复“黄金坑”，次新基金积极抢筹优质资产,Wind
4730,2020-02-13,菜鸟招募2万个岗位，苏宁物流短短三天收到近3000人报名,澎湃新闻
4731,2020-02-13,盒马苏宁相继推出万人招聘计划 生鲜电商的“春天”到了？,电商报
4732,2020-02-13,苏宁助农18条实施首日：家乐福芦蒿半天卖出一吨,证券之星
4733,2020-02-13,苏宁易购推出“超店播计划”二十五万终端员工上线直播,牛华网
4734,2020-02-13,苏宁张近东谈复工战“疫”：中小企业要自救，更要抱团取暖,中国家电网
4735,2020-02-13,从田间到货架，南京八卦洲滞销芦蒿新鲜直达上海家乐福,凤凰网
4736,2020-02-13,苏宁张近东：春节一线服务不打烊 苏宁易购主站流量同比提升50%,电商报
4737,2020-02-13,苏宁张近东：今年将稳健加大在商品、物流、科技等零售基础设施领域的投入,e公司
4738,2020-02-13,苏宁张近东：各个业务端推出创新措施应对疫情,e公司
4739,2020-02-13,苏宁张近东：及时向武汉地区援助了大批医疗和民生物资,e公司
4740,2020-02-13,苏宁科技推出零接触远程检修技术服务,飞象网
4741,2020-02-13,苏宁张近东：苏宁金融、苏宁科技提供一系列措施，助力中小微企业复工复产,Wind
4742,2020-02-13,苏宁张近东：抗“疫”将催生新模式、新业态、新经济,e公司
4743,2020-02-13,苏宁易购：艰难时期 必然要把保障和援助放在首位,e公司
4744,2020-02-13,苏宁张近东：苏宁百货推出硬核政策支持零售行业 免收2020年全年平台使用费,e公司
4745,2020-02-13,苏宁张近东：春节期间家乐福销售额增速同行业领先 上线“一小时达”,证券时报网
4746,2020-02-13,苏宁张近东：春节一线服务不打烊，到家业务规模同比增长近4倍,Wind
4747,2020-02-13,【预告】张近东做客e公司微访谈 抗疫保供是苏宁易购首要任务,e公司
4748,2020-02-12,69万人参与!国际米兰球衣义卖落幕 张康阳邀球迷观赛,新浪
4749,2020-02-12,苏宁家乐福开通助农通道 首批2吨滞销芦蒿启运上海,大众证券报
4750,2020-02-12,苏宁电器推出“开仓计划” 提供无接触服务,北京商报网
4751,2020-02-12,苏宁易购推出“品牌赢新计划” 扶持中小商户,电商报
4752,2020-02-12,家电复工苏宁紧急启动 “开仓计划”,牛华网
4753,2020-02-12,给武汉送物资的90后物流人,牛华网
4754,2020-02-12,硬核企业：损失再大，也要保障员工利益,环球家电网
4755,2020-02-12,苏宁智能供应链体系 科技助力打赢这场战“疫”,北国网
4756,2020-02-12,订单量激增 生鲜电商要迎行业“拐点”？,南都报
4757,2020-02-12,多家上市公司打出“共享员工”牌，在线生鲜迎来“翻身战”？,Wind
4758,2020-02-12,A股新零售“抗疫进化论”：商场“直播带货”，电商“无接触”配送,Wind
4759,2020-02-12,生鲜果蔬 千里“闯关”进城 一大车蜜瓜从三亚到上海，运费已经大涨三至五成,新浪
4760,2020-02-12,A股新零售“抗疫进化论”： 百货商场开启“直播带货” 电商“无接触”配送成标配,21世纪经济报道
4761,2020-02-11,苏宁控股：还未正式复工 重点支援家乐福拣配服务,新浪
4762,2020-02-11,苏宁拼购发起助农“战疫” 保障城市菜篮子量足价稳,大众证券报
4763,2020-02-11,发挥特色行业优势助力抗疫 互联网企业在行动,凤凰网
4764,2020-02-11,苏宁推出“开仓计划” 联合家电大牌抗击疫情,电商报
4765,2020-02-11,苏宁、美的、海尔等齐现战疫一线 网友：是时候表现真正的技术了,凤凰网
4766,2020-02-11,小米、荣耀加盟苏宁“品牌赢新计划” ，分享平台能力,联商网
4767,2020-02-11,苏宁商管“智慧”突围｜商业战疫③,乐居财经
4768,2020-02-11,疫情是把“双刃剑”：大屏社交和物联网方兴未艾,中国家电网
4769,2020-02-11,打击发“疫情财” 苏宁科技加大线上商品异常监控,北国网
4770,2020-02-11,79股延期披年报天威视讯已二度后延,兰格钢铁网
4771,2020-02-11,配送、巡逻、消毒……无人驾驶加入“战疫”大军!,中国汽车报
4772,2020-02-10,国家邮政局：13家快递企业恢复正常运营,金十数据
4773,2020-02-10,给方舱送货：4吨物资 90后小伙一个个扛上车,牛华网
4774,2020-02-10,IT大后方稳定支撑 苏宁科技全方位推进抗疫保供,北国网
4775,2020-02-10,抗疫情 保供应 苏宁宣布部分Biu×24h店切换为无人模式,砍柴网
4776,2020-02-10,苏宁现摘现运上百吨蔬菜驰援湖北医院！今日运抵襄阳！,牛华网
4777,2020-02-10,又一家苏宁易购旗下企业新增清算信息 2019年来已注销多家 业务变化,金融界
4778,2020-02-10,苏宁物流：已协同百家机构免费运输500吨防疫物资,电商报
4779,2020-02-10,驰援抗疫一线，苏宁、伊利100万物资全部到位,牛华网
4780,2020-02-10,苏宁义诊24小时无休 联合互联网医院提供全民免费在线咨询服务,牛华网
4781,2020-02-10,疫情期间如何保障物流？苏宁物流无人仓成奇兵,证券之星
4782,2020-02-10,犀牛财经早报：石头科技发行价创科创板新高,GPLP犀牛财经
4783,2020-02-09,苏宁易购向外卖、社区团购等到家业务推出免费快递暂存服务,Wind
4784,2020-02-09,战“疫”催生无接触服务 苏宁13000多家业态门店免费开放快递暂存,证券日报
4785,2020-02-09,苏宁易购：社区门店开放快递暂存服务,新京报
4786,2020-02-09,战疫情 驰援小汤山|北京苏宁紧急配送工地所需物资,中国青年网
4787,2020-02-09,11市19家医院万件防疫物资 苏宁物流送达广西抗疫一线,中金在线
4788,2020-02-09,宅家无忧：29款好用的远程办公硬件推荐,快科技
4789,2020-02-09,2年多过去了，马云砸224亿买下的大润发，现在怎么样了？,搜狐
4790,2020-02-09,缺人！电商满负荷运转多日 盒马美菜苏宁等紧急招工,新浪
4791,2020-02-09,半日达！苏宁携手美的冰箱急速驰援抗疫一线,牛华网
4792,2020-02-09,“人才共享”召集令起，苏宁战“疫”脚步不停,牛华网
4793,2020-02-09,泸州酒博会延期举办；郎酒强调市场“四到位”；苏宁要进口百种日本酒｜云酒早知道,新浪
4794,2020-02-08,疫情之下的零售业：得物流者得天下,凤凰网
4795,2020-02-08,苏宁上线“疫情防护医疗用品生产企业查询”功能,中证网
4796,2020-02-08,口罩、防护服、医疗帽一键溯源 苏宁上线疫情防护用品信息查询功能,中国青年网
4797,2020-02-08,共克时艰！继餐饮“共享员工”之后 物流“人才共享”也来了,每日经济新闻
4798,2020-02-07,共克时艰！苏宁物流推“人才共享”计划，为疫情下待业人群减压,时代周报
4799,2020-02-07,苏宁物流发布“人才共享”计划 提供分拣、包装、骑手等岗位,中证网
4800,2020-02-07,设闹钟买菜，预约买菜，线上生意火爆，生鲜电商的春天来了？,中国财富网
4801,2020-02-07,共渡难关抗击疫情 万达、保利、苏宁、龙湖等商业地产商做了哪些努力？,证券之星
4802,2020-02-07,生鲜品消费需求激增，哪些公司或将受益？,格隆汇
4803,2020-02-07,响应国家号召全力抗“疫” 苏宁保障急需物资到位,中金在线
4804,2020-02-07,打赢抗疫阻击战，苏宁快消双线布局保民生,证券之星
4805,2020-02-07,苏宁易购（002024）：危中有机，疫情影响可控，积极调整应对,中信证券研究
4806,2020-02-07,一遍遍消毒、一遍遍测温、一遍遍排查，这些商业“逆行人”生意下滑，人却更忙了,上观
4807,2020-02-07,33股获券商买入评级 兴业银行目标涨幅达64.21%,Wind
4808,2020-02-07,苏宁物流发布“人才共享”计划 全国350个城市就近分配,北京商报网
4809,2020-02-06,财闻点金：生态环境部召开会议 研究部署疫情防控环保工作,巨丰财经
4810,2020-02-06,苏宁物流协助西安高新区运营防疫仓库,中证网
4811,2020-02-06,疫情当下到家业务迎爆发期 苏宁全场景布局优势明显,中金在线
4812,2020-02-06,苏宁物流协助西安高新区运营防疫仓库,联商网
4813,2020-02-06,苏宁物流高颜值女调度员 守护司机共赴武汉护送医疗物资,牛华网
4814,2020-02-06,聚焦商品、发力社群、延期还款，苏宁零售云多举措助商户、战疫情,中金在线
4815,2020-02-06,疫情冲击下 商贸零售业或迎“抄底”良机,飞象网
4816,2020-02-06,菜场销售最高增长超十倍，苏宁小店守护社区菜篮子,凤凰网
4817,2020-02-05,日本Laox通过苏宁易购紧急交货100万枚口罩,联商网
4818,2020-02-05,苏宁：100吨蔬菜将陆续运抵武汉 免费供应抗疫一线医院,DoNews
4819,2020-02-05,疫情下的生鲜电商：需求猛增，面临供应、运力、价格三项大考,腾讯网
4820,2020-02-05,苏宁向武汉医院捐献100吨蔬菜，现摘现运一日达,联商网
4821,2020-02-05,苏宁易购APP接入“家乐福1小时达”服务,电商报
4822,2020-02-05,供应链决定胜负，苏宁菜场订单量提升超650%,凤凰网
4823,2020-02-05,价稳量足受欢迎，苏宁菜场全力保障居民生鲜供应,凤凰网
4824,2020-02-05,特殊的春节，京东物流和菜鸟哪家强？,联商网
4825,2020-02-05,周三机构一致看好的七大金股（02.05）,中金在线
4826,2020-02-05,昆明零售企业承诺供应放心菜平价菜,昆明日报
4827,2020-02-04,苏宁：100万件防疫物资抵达 全球供应链保障一线战“疫”员工,中证网
4828,2020-02-04,100万件防护物资火速清关 苏宁全球供应链驰援防疫战,证券时报网
4829,2020-02-04,疫情刺激线上购物 苏宁易购主站流量春节同比攀升50%,红周刊
4830,2020-02-04,苏宁拼购推出电动口罩 一般地区3天到货,牛华网
4831,2020-02-04,疫期消毒柜、洗碗机被疯抢断货？苏宁：全面供应，服务不打烊,环球家电网
4832,2020-02-04,苏宁物流：开通捐赠防疫救援物资免费运输通道,36氪
4833,2020-02-04,疫情下的互联网买菜：苏宁菜场上海市场订单量增8倍,凤凰网
4834,2020-02-04,苏宁易购：截至2月3日累计回购3470万股 耗资3.5亿元,TechWeb
4835,2020-02-04,年后开工首日：战“疫”关头，他们这样在家远程办公,新京报
4836,2020-02-03,淮安市市场监督管理局：7批次食品不合格 产品问题,质量新闻网
4837,2020-02-03,苏宁易购：已耗资3.55亿元回购公司股份,中证网
4838,2020-02-03,苏宁物流：30000名一线人员驻守 累计运送物资360吨,南方财经网
4839,2020-02-03,苏宁易购：累计回购3470.39万股 占公司总股本0.37%,乐居财经
4840,2020-02-03,苏宁物流：超3万名一线人员坚守 累计运送物资360吨,DoNews
4841,2020-02-03,苏宁易购：已耗资3.55亿元回购股份,e公司
4842,2020-02-03,苏宁易购(002024.SZ)截至2月3日已累计回购3.55亿元的股份,格隆汇
4843,2020-02-03,美团、盒马、饿了么等上线“无接触配送”服务,联商网
4844,2020-02-03,苏宁物流全力推进抗疫保供,上证报
4845,2020-02-03,苏宁物流发布请战书 累计运送抗疫物资360吨,电商报
4846,2020-02-03,苏宁物流：30000名一线物流人员服务全国生活保障,证券时报网
4847,2020-02-03,苏宁菜场订单激增，“无接触配送”让人安心,凤凰网
4848,2020-02-03,苏宁物流：3万名一线人员坚守岗位 累计运送物资360吨,中证网
4849,2020-02-03,苏宁物流发请战书：愿做国家授权和征用的物流排头兵,联商网
4850,2020-02-03,外资抢爆美的股票背后：短板如影随形,搜狐
4851,2020-02-02,员工安全第一位 苏宁严格遵守复工时间规定,牛华网
4852,2020-02-01,快讯：佳兆业、苏宁易购、蓝润商业等4家宣布商场减租计划,乐居财经
4853,2020-02-01,苏宁董事长张近东：决不允许涨价艰难时期再大利益也无足轻重,快科技
4854,2020-02-01,苏宁小店守护大家过个安心年 持续提供数百种新鲜菜品,北国网
4855,2020-02-01,苏宁张近东：艰难时期，要把保障和援助放在首位,电商报
4856,2020-02-01,苏宁张近东最新内部信：艰难时期再大的利益也无足轻重 决不允许涨价,每日经济新闻
4857,2020-02-01,苏宁张近东：发挥全球采购、全国配送等优势 助力打赢疫情防控战,证券日报
4858,2020-02-01,苏宁发布新春团拜信 张近东：坚守岗位保障服务，就是最大的责任,中金在线
4859,2020-02-01,苏宁：重奖武汉抗击疫情表现优秀的一线员工,快科技
4860,2020-02-01,多方联手搭建绿色通道：援助物资是这样运抵抗疫前线的,澎湃新闻
4861,2020-01-31,家乐福涉“哄抬物价”被罚200万：生菜价格暴涨近700% 曾承诺“亏钱也不涨价”,搜狐
4862,2020-01-31,从手机硬件到互联网，疫情阴影下的危与机,和讯
4863,2020-01-30,不一样的年货节“战报”：家乐福超8000吨菜肉果蛋保供应,中国青年网
4864,2020-01-28,北京苏宁稳价保供应：160吨蔬菜到货,新京报
4865,2020-01-28,全城抗疫情！郑州各大商超百货、便利店调整运营时间,联商网
4866,2020-01-27,电子竞技未来可期 相关概念股备受资金青睐,巨丰财经
4867,2020-01-27,苏宁集团：已累计向武汉捐助物资达500万元,中金在线
4868,2020-01-26,增调40吨消毒水、捐赠价值100万净化器，苏宁驰援武汉,投资界
4869,2020-01-26,苏宁筹措物资助力防疫战,经济日报
4870,2020-01-25,苏宁：积极备货口罩、消毒液 禁止相关产品涨价,北京商报
4871,2020-01-25,春节保供 苏宁易购年货产品供应量翻倍增长,北京商报
4872,2020-01-25,苏宁紧急调配物资支援疫区前线 10万库存货物已经在途,亿邦动力
4873,2020-01-24,他身家百亿，却成就了弟弟千亿商业帝国！,电商报
4874,2020-01-23,联商头条：武汉超市储备充足 线上线下联动共对疫情,联商网
4875,2020-01-23,家乐福首次加入全场景“春节不打烊”，今年过年服务体验不一样,牛华网
4876,2020-01-23,【光大零售|行业动态】零售行业每日动态20200123,鸭毛信
4877,2020-01-23,苏宁易购：2019净利润预计超百亿元 四季度家乐福中国扭亏为盈,DoNews
4878,2020-01-23,苏宁易购：2019年第四季度家乐福中国扭亏为盈,中证网
4879,2020-01-23,苏宁易购预计2019年净利润110亿元-112亿元,电商报
4880,2020-01-23,苏宁：预计去年净利110亿 同比降15.94%-17.44% 盈利能力下降,观察者网
4881,2020-01-23,疫情来袭 哪些互联网公司愿意为用户“兜底”？,和讯
4882,2020-01-23,线下N95口罩一天涨价50%还缺货 电商人士称目前口罩需求量是平时十倍,华夏时报
4883,2020-01-22,"""口罩供给战""打响 政府和电商协力抑制口罩价格上涨",国际金融报
4884,2020-01-22,苏宁易购：预计净利润超110亿，家乐福四季度扭亏为盈,新京报
4885,2020-01-22,苏宁易购2019年业绩预告：净利预降15.94%–17.44% 盈利能力下降,金融界
4886,2020-01-22,苏宁易购：2019净利润预计同比下降15.94%至17.44% 盈利能力下降,新浪
4887,2020-01-22,苏宁易购：2019年预盈110亿元至112亿 同比降16%-17%,e公司
4888,2020-01-22,苏宁易购：2019年预计盈利110亿-112亿元,第一财经
4889,2020-01-22,苏宁易购预计去年实现净利110-112亿 四季度家乐福中国扭亏为盈,腾讯网
4890,2020-01-22,苏宁易购(002024.SZ)：预计2019年净利110.03亿元-112.03亿元 同比下降15.94%-17.44% 盈利能力下降,格隆汇
4891,2020-01-22,苏宁易购：2019年业绩预减15.94%–17.44%,Wind
4892,2020-01-22,电商平台不准涨价，口罩卖家把运费调到300？多地出手严打,澎湃新闻
4893,2020-01-22,走近苏宁生活帮：春节不打烊，坚守岗位上,凤凰网
4894,2020-01-22,苏宁“年终大赏” 上千个团队被表彰,中金在线
4895,2020-01-22,拓展智慧零售生态圈，9位苏宁小店合伙人获优秀合作伙伴奖,中金在线
4896,2020-01-22,多家电商稳定口罩价格，官方也纷纷出手,中新经纬
4897,2020-01-22,Facebook继续拓展英国业务丨IBM发布Q4及全年财报【Do说】,DoNews
4898,2020-01-22,部分口罩商家趁“疫”涨价？淘宝、苏宁等电商平台纷纷启动专项补贴,联商网
4899,2020-01-22,针对武汉疫情 淘宝京东等电商平台启动防疫用品保价措施,电商报
4900,2020-01-22,京东、淘宝、拼多多等电商平台发声明：口罩等上千款健康商品不允许涨价,腾讯网
4901,2020-01-22,电商的一纸空文：承诺不涨价 却无口罩可售,北京商报
4902,2020-01-22,淘宝苏宁拼多多京东等电商集体表态：不允许在售的口罩涨价,澎湃新闻
4903,2020-01-22,苏宁年度表彰大会，却将奖颁给了在乡镇奔跑的他们?,凤凰网
4904,2020-01-22,午评：三大指数下探回升创指涨0.17% 半导体板块领涨,新浪
4905,2020-01-22,淘宝苏宁拼多多表态：口罩不得涨价，但仍缺货,第一财经
4906,2020-01-22,拼多多、苏宁、淘宝：口罩等上千款健康商品不允许涨价,腾讯网
