473,2021-04-12,医药与健康护理行业周报：年报一季报相继披露 看好业绩确定性高的医药白马,新浪
474,2021-04-10,贝达药业(300558.SZ)：贝成投资已通过集中竞价减持157.5564万股 减持股份,格隆汇
475,2021-04-09,贝达药业：股东贝成投资减持约157.56万股 减持股份,每日经济新闻
476,2021-04-09,两市百元股数量达134只，医药生物行业占比最高,证券之星
477,2021-04-08,贝达药业BPI-421286胶囊临床获批，“入坑”KRASG12C抑制剂领域,云掌财经
478,2021-04-08,贝达药业KRASG12C抑制剂BPI-421286获批临床,生物探索
479,2021-04-08,首批基金一季报来了！这些基金减仓,Wind
480,2021-04-07,中国生物医药行业的研发竞争,贝壳社
481,2021-04-07,贝达药业(300558.SZ)：“BPI-421286胶囊”获临床试验批准,智通财经
482,2021-04-07,贝达药业1类抗癌新药BPI-421286获批临床,新浪
483,2021-04-07,贝达药业BPI-421286获得临床试验批准通知书,上证报
484,2021-04-07,贝达药业：药品临床试验申请获批,中证网
485,2021-04-07,贝达药业(300558.SZ)：1类抗癌新药BPI-421286获批临床,格隆汇
486,2021-04-07,午间公告2021年4月7日星期三,Wind
487,2021-04-07,贝达药业拟H股上市 新药能否接棒化解大单品增长隐忧？,新浪
488,2021-04-07,【贝达药业*朱国广】深度：以运营战略巩固城池，用创新实力开疆拓土,东吴研究所
489,2021-04-07,【东吴晨报0407】【策略】【宏观】【行业】机械、电子【个股】通威股份、爱婴室、华菱钢铁、贝达药业,东吴研究所
490,2021-04-06,医药生物行业：为什么说智飞生物二季度有望迎来亮眼表现？,新浪
491,2021-04-06,医药行业2021年4月投资月报：把握一季报最佳反弹窗口期 加配低估值且高增长标的,西南证券
492,2021-04-06,医药行业周报：当前是反弹最佳窗口期 加配低估值高增长标的,西南证券
493,2021-04-06,Wind医药：每日行业动态（2021-04-06）,Wind
494,2021-04-06,贝达药业BPI-16350药品联用临床试验申请获受理,上证报
495,2021-04-06,贝达药业(300558.SZ)：BPI-16350药品联用临床试验申请获得受理,格隆汇
496,2021-04-05,一文看懂为何近期医疗服务、医美标的股价反弹涨幅较大,21世纪经济报道
497,2021-04-03,基因测序双周榜：药明康德触底反弹“王者归来”？国际医学迎明星基金经理调研,华夏时报
498,2021-04-03,贝达药业：业绩符合预期 多个产品上市在即,财富动力网
499,2021-04-02,医药行业周报：一季报行情开启 建议关注高增长的医药板块,新浪
500,2021-04-02,医药与健康护理行业月报：年报相继披露 关注高增长公司及A+H股医药投资机会,新浪
501,2021-04-01,人民金融·创新药指数涨0.92% | 基石药业再传喜讯，近10家创新药企业将迎里程碑事件,证券时报网
502,2021-04-01,重磅 | 粤开策略4月十大金股及市场展望,粤开崇利论市
503,2021-04-01,市场震荡加剧券商挖掘金股忙,Wind
504,2021-03-31,2021年4月十大金股及市场展望,新浪
505,2021-03-30,凯美纳销售继续放量——贝达药业调研纪要20210330,微信
506,2021-03-30,贝达药业：埃克替尼术后辅助治疗适应症上市申请有望上半年获批,Wind
507,2021-03-30,贝达药业：埃克替尼术后辅助治疗适应症上市申请有望上半年获批,e公司
508,2021-03-30,东方财富证券--贝达药业2020年报点评：凯美纳累计销售超90亿，创新产品接踵而至【公司研究】,金融界股吧
509,2021-03-30,去年一季报营收为0未盈利药企天广实主动撤回科创板IPO IPO融资异常,科创板日报
510,2021-03-30,复宏汉霖11亿元与润新生物达成独家许可交易；先声药业引进PI3K/mTOR抑制剂；来凯医药启动卵巢癌1类新药全球注册临床研究,GBIHealth
511,2021-03-29,中国银河给予贝达药业推荐评级，埃克替尼继续快速放量，恩沙替尼获批打破单药困局,每日经济新闻
512,2021-03-29,医药行业周报：本周医药涨幅居前 建议关注核心资产触底反弹,新浪
513,2021-03-29,华鑫证券维持贝达药业推荐评级：业绩符合预期，多个产品进入收获期,每日经济新闻
514,2021-03-29,西部证券维持贝达药业买入评级：埃克替尼持续放量，研发管线迎来收获期,每日经济新闻
515,2021-03-29,贝达药业盈利狂飙背后：研发投入占比惊人维持在40%左右,云掌财经
516,2021-03-29,卡瑞利珠单抗2项新适应证报上市；艾力斯艾弗沙患者援助项目启动；贝达药业、赛生药业、先声药业2020年业绩报告,GBIHealth
517,2021-03-29,华西证券维持贝达药业买入评级：业绩符合预期，后期管线快速推进,每日经济新闻
518,2021-03-28,【华西医药崔文亮团队】?《贝达药业点评报告：业绩符合预期，后期管线快速推进》,崔文亮研究团队
519,2021-03-26,西南证券维持贝达药业持有评级：业绩维持高速增长，公司逐渐进入收获期,每日经济新闻
520,2021-03-26,贝达药业(300558)：2020完美收官 2021值得期待 从1到多新征程开启,新浪
521,2021-03-26,国盛证券维持贝达药业买入评级：2020完美收官，2021值得期待，从1到多新征程开启,每日经济新闻
522,2021-03-26,每日“药”闻|蓝帆医疗商誉减值17.6亿；多家药企公布业绩，先声药业利润下滑34%,云掌财经
523,2021-03-26,国金证券--贝达药业:埃克替尼放量，恩沙替尼接棒，多药上市中【公司研究】,金融界股吧
524,2021-03-26,上市公司正负面新闻2021年3月26日星期五,Wind
525,2021-03-26,贝达药业：2020年盈利6.06亿人民币，同比增长162.79%,Wind
526,2021-03-25,贝达药业2020年度净利同比增163% 拟10派3.1元,上证报
527,2021-03-25,贝达药业(300558.SZ)拟使用不超15亿元闲置自有资金购买理财产品,智通财经
528,2021-03-25,贝达药业(300558.SZ)及子公司拟申请不超20亿元融资额度,格隆汇
529,2021-03-25,交卷！贝达药业：2020年度净利润约6.06亿元，同比增加162.70%,每日经济新闻
530,2021-03-25,贝达药业：2020年净利同比增162.7% 拟10派3.1元,e公司
531,2021-03-25,贝达药业(300558.SZ)：2020年净利升162.7%至6.06亿元拟10派3.1元,格隆汇
532,2021-03-25,贝达药业：2020年净利同比增长162.70%拟10派3.1元,格隆汇
533,2021-03-25,贝达药业：2020年净利润同比增长162.7%,Wind
534,2021-03-24,浙江省委统战部副部长、省工商联党组书记陈浩一行调研贝达梦工场,贝达药业
535,2021-03-24,贝达药业：巴替利单抗注射液药品临床试验申请获受理,e公司
536,2021-03-24,贝达药业花费千万美元引进的PD-1单抗申报临床丨医麦猛爆料,医麦客News
537,2021-03-23,医药行业周报：医药板块“渐入佳境” 估值和基本面均逐步具备吸引力,新浪
538,2021-03-23,医药与健康护理行业周报：估值风险有效控制 关注业绩高增长公司,新浪
539,2021-03-23,医药行业：创新药周报,新浪
540,2021-03-22,万字长文解析红杉中国15年医疗投资！平均每月1起IPO背后，红杉做对了什么？,E药经理人
541,2021-03-22,贝达药业(300558.SZ)股东贝成投资质押150万股,智通财经
542,2021-03-21,医药生物行业周报：基因细胞治疗CDMO黄金赛道有望孕育下一个药明生物,新浪
543,2021-03-19,贝达药业：多款创新产品即将上市,大众证券报
544,2021-03-19,浙江医药(600216)：新码生物获4.15亿A轮融资 ADC临床研发进程加速,新浪
545,2021-03-18,医药界的“小恒瑞”！创新药隐形冠军，毛利率比茅台、恒瑞还高,云掌财经
546,2021-03-18,创纪录！人民金融·创新药指数涨2.88%！16个品种获批临床，贝达药业进军双抗，多款创新药取得重大进展,证券时报网
547,2021-03-18,创新药板块热度不减，双鹭、海思科、丽珠、人福、贝达、康龙化成均大涨,Wind
548,2021-03-18,国金证券上调贝达药业评级至买入：多款产品即将上市，自主研发逐步验证，目标价145元,每日经济新闻
549,2021-03-17,贝达药业MCLA-129获批开展临床试验,微信
550,2021-03-17,贝达药业引进的EGFR/c-Met双特异性抗体获得临床默示许可 | 医麦猛爆料,微信
551,2021-03-17,贝达药业：MCLA-129注射液获得临床试验批准通知书,发布易
552,2021-03-17,贝达药业(300558.SZ)：MCLA-129注射液用于治疗晚期实体瘤获批临试,格隆汇
553,2021-03-17,贝达药业：药品临床试验申请获批准,中证网
554,2021-03-17,贝达药业治疗晚期实体瘤注射液获批临床试验,上证报
555,2021-03-17,午间公告2021年3月17日星期三,Wind
556,2021-03-16,抗肿瘤新药行业专题系列1：实体瘤靶点篇：百舟竞流 何以争锋,渤海证券
557,2021-03-15,医药行业：创新药周报,新浪
558,2021-03-15,贝达药业：拟发行H股并在香港联交所上市的申请已获得中国证监会受理,每日经济新闻
559,2021-03-15,国际权威肿瘤学家毛力出任丽珠生物CEO；朱凌宇博士出任首席商务官,医药魔方
560,2021-03-15,医药行业一周观察：板块战略配置价值显现 关注成长性与估值的匹配,新浪
561,2021-03-14,速读社丨贝达药业副总裁兼CMO辞职 礼来β淀粉样蛋白抗体二期临床结果发布 董监高成员变化,新浪医药
562,2021-03-14,贝达药业资深副总裁兼CMO辞职 董监高成员变化,新浪
563,2021-03-13,毛力辞去贝达药业资深副总裁兼首席医学官 董监高成员变化,汇聚南药
564,2021-03-12,贝达药业：关于董事兼高管辞职的公告 董监高成员变化,新浪
565,2021-03-12,贝达药业(300558.SZ)：董事、资深副总裁兼首席医学官LI MAO辞职,格隆汇
566,2021-03-12,LI MAO辞任贝达药业(300558.SZ)董事等职务 董监高成员变化,智通财经
567,2021-03-12,贝达药业：董事LI MAO（毛力）辞职,每日经济新闻
568,2021-03-12,贝达药业：LI MAO辞去董事等职务 董监高成员变化,Wind
569,2021-03-12,药企人的两会“朋友圈”： 创新热情正得到激发 关键点在基础研究,第一财经
570,2021-03-11,稀土重磅，巨头刚刚提价30%！抄底资金爆买145亿,Wind
571,2021-03-10,贝达药业：股东凯铭投资解除质押239万股,每日经济新闻
572,2021-03-10,贝达药业：股东凯铭投资质押延期购回511万股,Wind
573,2021-03-10,贝达药业(300558.SZ)：凯铭投资解押239万股及质押的511万股延期购回,格隆汇
574,2021-03-10,如何解决医药原始创新能力不足？强化基础研究成关键,第一财经
575,2021-03-09,国盛证券--医药生物行业周报：全民免疫迫在眉睫，新冠疫苗的热点问题怎么看【行业研究】,金融界股吧
576,2021-03-08,浙江：代表委员畅谈税收“获得感”,中国税务报
577,2021-03-08,医药行业周报：从政府工作报告厘清医药投资逻辑,新浪
578,2021-03-07,医药板块估值有多贵？哪些估值贵？【东吴医药朱国广团队|0307周报】,国广有话说
579,2021-03-07,贝达药业董事长丁列明：加快在医院全面实行强制安检,第一财经
580,2021-03-07,网售处方药风险如何防范？贝达药业丁列明两会建言一文解密,投资时报
581,2021-03-07,医药与健康护理行业周报：业绩确定性高 继续看好医药龙头公司,新浪
582,2021-03-07,全国人大代表、贝达药业董事长丁列明：加快自主创新药上市审批速度 杜绝网售处方药“滥用”风险,中证网
583,2021-03-06,年销30亿“神药”退市！知名药企遭重罚，恒瑞、豪森、迈瑞……医药界千亿富豪曝光 食药监处罚,米内网
584,2021-03-05,两会时间 | 全国人大代表、贝达药业董事长丁列明：完善网售处方药医保报销机制,经济观察网
585,2021-03-04,人民金融·创新药指数涨0.81% | 艾力斯肺癌“神药”获批上市，荣昌生物重磅品种就要获批了,证券时报网
586,2021-03-04,贝达药业：甲磺酸贝福替尼胶囊上市申请获受理 肺癌治疗领域或将再添新军,金融界
587,2021-03-04,生物药“集采禁区”被打破，格局重构谁是最大赢家？,Wind
588,2021-03-04,贝达药业抗肿瘤新药获批临床试验，拟用于晚期实体瘤治疗,新京报
589,2021-03-03,贝达药业(300558.SZ)：甲磺酸贝福替尼胶囊药品注册申请获受理,格隆汇
590,2021-03-03,全国人大代表丁列明：资本对创新药的过度追捧或导致泡沫现象,中新经纬
591,2021-03-03,贝达药业一治疗晚期实体瘤创新药获准临床试验,上证报
592,2021-03-03,贝达药业(300558.SZ)：BPI-21668片用于治疗晚期实体瘤获批临试,格隆汇
593,2021-03-03,贝达药业：BPI-21668片获批药品临床试验,中证网
594,2021-03-03,午间公告：长春高新子公司、贝达药业获批开展药物临床试验,e公司
595,2021-03-03,贝达药业PI3Kα抑制剂BPI-21668获批临床,新浪
596,2021-03-02,贝达药业：目前在针对恶性肿瘤的大分子免疫治疗方面布局了多个产品,每日经济新闻
597,2021-02-26,医药行业2020年报及2021年一季报业绩前瞻：2020分化巨大 21Q1恢复良好,新浪
598,2021-02-26,人民金融·创新药指数涨0.8% 多个新药临床试验结果积极,证券时报
599,2021-02-25,晚间重要公告2021年2月25日星期四,Wind
600,2021-02-25,贝达药业(300558.SZ)：BPI-361175 片获临床试验批准通知书,智通财经
601,2021-02-25,贝达药业：BPI-361175片临床试验获批,Wind
602,2021-02-25,贝达药业：BPI-361175片获得临床试验批准,e公司
603,2021-02-22,医药行业周报：趁医药回调良机 布局高景气板块,西南证券
604,2021-02-20,【浙商医药|孙建】周报：“恐高”回调，坚守主线,杏林建研
605,2021-02-20,医药生物行业深度报告：双抗时代 渐入佳境,新浪
606,2021-02-18,医药与健康护理行业周报：国内疫情向好 仍需紧密关注防控政策,新浪
607,2021-02-17,贝达药业(300558)：三代EGFR-TKI BPI-D0316临床数据 结果与其他同类产品相似,新浪
608,2021-02-14,港股IPO|贝达药业拟A+H股上市，两款自研癌症靶向创新药已商业化,资本邦
609,2021-02-10,贝达药业，来自杭州的生物科技企业，拟香港IPO上市,资本邦
610,2021-02-10,贝达药业递交赴港IPO申请 已有两款自研癌症靶向创新药在中国上市,新浪
611,2021-02-09,犀牛财经晚报：拜腾回应上市传闻博泰与上汽通用五菱举报腾讯垄断,GPLP犀牛财经
612,2021-02-09,赴港上市贝达药业单品独大难题何解,北京商报
613,2021-02-09,A股共发生146宗大宗交易成交40.76亿元（2月9日）,Wind
614,2021-02-09,"贝达药业现3笔大宗交易 共成交12,200.75万元",新浪
615,2021-02-09,贝达药业今日大宗交易成交92.50万股，成交价131.9元折价5.77%,Wind
616,2021-02-09,贝达药业(300558.SZ)向香港联交所递交境外上市外资股(H股)上市申请,智通财经
617,2021-02-09,早间公告2021年2月9日星期二,Wind
618,2021-02-09,贝达药业：向香港联交所递交H股上市申请并刊发申请资料,中证网
619,2021-02-09,贝达药业(300558.SZ)于2月8日向香港联交所递表,格隆汇
620,2021-02-08,新股消息 | A股上市公司贝达药业递表港交所，已有两款自研癌症靶向创新药在中国上市,智通财经
621,2021-02-08,贝达药业今日大宗交易成交11万股，成交价131.6元折价6.21%,Wind
622,2021-02-08,早间公告2021年2月8日星期一,Wind
623,2021-02-08,医药生物行业：第二款国产新冠疫苗获批上市 看好疫苗大时代背景下的新冠增量,新浪
624,2021-02-08,医药行业周报：第四批集采落地 持续看好创新及相关产业链CXO,西南证券
625,2021-02-07,医药生物行业2020业绩前瞻：2020板块分化明显 下半年医疗服务等有序复苏,新浪
626,2021-02-07,医药生物行业周报：新冠变异后是否需要常态化免疫加强？智飞新高后继续强烈看好,新浪
627,2021-02-07,贝达药业：公司产品尚在专利保护期内的1类新药，不在带量采购范围之内,Wind
628,2021-02-05,2月5日晚间重要行业研究汇总(附股),中金在线
629,2021-02-05,顶梁柱“埃克替尼”竞争加剧 贝达药业能否焕发新生命？,新浪
630,2021-02-05,赴港上市，贝达药业能否焕发新生命？,网易
631,2021-02-04,贝达药业(300558.SZ)发行境外上市外资股(H股)申请获证监会受理,智通财经
632,2021-02-04,贝达药业：H股首发申请获证监会受理,中证网
633,2021-02-04,午间公告2021年2月4日星期四,Wind
634,2021-02-04,贝达药业(300558.SZ)：赴港上市申请获中国证监会受理,格隆汇
635,2021-02-03,医药生物2月月报：寻业绩主线 重点关注CXO等高增长赛道,新浪
636,2021-02-02,医药行业周报：短期流动性收紧 如何看医药后市机会？,西南证券
637,2021-02-01,中泰证券--贝达药业：业绩表现亮眼，创新管线不断丰富【公司研究】,金融界股吧
638,2021-02-01,贝达药业：争做国产创新药研发的标杆企业,21世纪经济报道
639,2021-02-01,贝达药业(300558)：恩沙替尼与埃克替尼研究数据亮眼 Q4超预期,新浪
640,2021-02-01,贝达药业(300558)：业绩表现亮眼 创新管线不断丰富,新浪
641,2021-02-01,国金证券--贝达药业：公司业绩稳步增长，恩莎替尼一线数据更新【公司研究】,金融界股吧
642,2021-01-30,贝达药业(300558)：业绩超预期 即将进入多产品驱动时代,新浪
643,2021-01-29,贝达药业(300558)2020年业绩预告点评：扣非业绩高增长 埃克替尼有望稳步增长,新浪
644,2021-01-29,“抗癌第一股”贝达药业准备赴港上市！它会复制泰格医药的走势吗？,云掌财经
645,2021-01-29,贝达药业(300558)：业绩大超预期 恩沙替尼开始贡献收入 Q4表现亮眼,新浪
646,2021-01-29,贝达药业预计2020年度归母净利润5.89亿-6.58亿 同比增逾1.5倍,全景网
647,2021-01-29,中泰证券--医药生物行业周报：CRO/CDMO行情将如何延续？长坡厚雪，未来可期【行业研究】,金融界股吧
648,2021-01-28,贝达药业：2020年度净利预增155%-185%,格隆汇
649,2021-01-28,贝达药业(300558.SZ)预计2020年度归母净利润同比增长155.00%至185.00%,智通财经
650,2021-01-28,贝达药业：2020年净利润同比预增155%至185%,中证网
651,2021-01-28,专访贝达药业丁列明： 拓荒中国创新抗癌药，打造“非凡TKI”,新康界
652,2021-01-28,港股IPO|贝达药业拟赴港上市，旗下肺癌国产新药已获批上市,资本邦
653,2021-01-28,2020年四季度基金医药持仓点评：四季度公募基金医药重仓持股小幅下降 头部聚集趋势延续,新浪
654,2021-01-27,贝达药业拟发行“H股”,新浪
655,2021-01-25,医药生物行业周报：2020Q4公募基金重仓医药持仓几何？继续强调Q1医药躁动期,新浪
656,2021-01-25,深度|百亿爆款基份额缩水一半，新基金加速“输血”老基金,第一财经
657,2021-01-25,55股获券商买入评级 富满电子目标涨幅达109.21%,Wind
658,2021-01-24,今年超火爆新募基金会建仓哪些票？这里有迹可循,上证报
659,2021-01-22,贝达药业(300558.SZ)股东温州特瑞西创拟计划减持不超过1239万股 拟减持股份,智通财经
660,2021-01-22,贝达药业(300558.SZ)：股东温州特瑞西创拟减持不超3%股份 拟减持股份,格隆汇
661,2021-01-22,贝达药业：温州特瑞西创拟减持不超过总股本3% 拟减持股份,Wind
662,2021-01-22,贝达药业(300558)：KRAS抑制剂受理 肺癌市场潜力巨大,新浪
663,2021-01-22,盘点：国内在研的15款 T790M “EGFR-TKI”,药渡
664,2021-01-21,盘后公告集锦|东方日升与福莱特签订近90亿元光伏玻璃重大销售合同 药明康德、江铃汽车年度净利大幅预增,财联社
665,2021-01-21,贝达药业(300558.SZ)：BPI-421286胶囊药品临床试验申请获受理,格隆汇
666,2021-01-20,71股获券商买入评级，中铁工业目标涨幅达63.93%,Wind
667,2021-01-19,BETTA(贝达)：ABIGALPHA,新浪
668,2021-01-18,医药生物行业：创新药周报,新浪
669,2021-01-18,医药生物：中国创新药是否到了国际化的拐点？,新浪
670,2021-01-18,创新药行业实用投资手册2021：持续进化中的中国创新药大时代,新浪
671,2021-01-18,医药行业政策点评：第四批集采开标在即 持续看好创新药及相关产业链,西南证券
672,2021-01-15,贝达药业(300558.SZ)：股东济和创投解除质押956.1万股,格隆汇
673,2021-01-15,贝达药业1类新药BET抑制剂获批临床,药明康德
674,2021-01-15,艾德证券期货：贝达药业拟申请在港交所主板上市,新浪
675,2021-01-14,贝达药业(300558.SZ)：BPI-23314获临床试验批准通知书,智通财经
676,2021-01-14,贝达药业(300558.SZ)：BPI-23314片用于晚期恶性实体瘤的药品临床试验申请已取得批准,格隆汇
677,2021-01-13,谁能打败恒瑞医药？,锦缎
678,2021-01-12,Wind快讯|每日医药行业动态（2021-01-12）,Wind
679,2021-01-11,贝达药业：MCLA-129注射液药品临床试验申请获受理,e公司
680,2021-01-11,贝达药业(300558.SZ)：MCLA-129注射液药品临床试验申请获受理,格隆汇
681,2021-01-11,医药生物/行业周报：关注业绩超预期的机会,新浪
682,2021-01-11,每日“药”闻|全球医疗健康产业投融资额创纪录；河北新增40例,读懂财经
683,2021-01-10,微评丨医疗影响力排行榜：诺诚健华、惠泰医疗、联影医疗、联合健康,搜狐
684,2021-01-07,贝达药业(300558.SZ)提名童佳为非独立董事候选人,智通财经
685,2021-01-07,贝达药业：为提高资金使用效率 拟使用不超8亿元暂时闲置募集资金进行现金管理,发布易
686,2021-01-07,贝达药业：拟发行H股并申请在香港联交所主板挂牌上市,中证网
687,2021-01-07,贝达药业拟发行H股并申请在港交所主板上市,上证报
688,2021-01-07,贝达药业(300558.SZ)：预计2021年日常关联交易总额不超5000万元,格隆汇
689,2021-01-07,贝达药业(300558.SZ)：拟用募集资金置换1.77亿元先期投入,格隆汇
690,2021-01-07,午间公告2021年1月7日星期四,Wind
691,2021-01-01,券商首次关注8股并给予买入评级（1月1日）,Wind
692,2020-12-31,贝达药业(300558.SZ)：凯铭投资解押570万股及新增质押350万股 贝成投资解押810万股,格隆汇
693,2020-12-31,贝达药业(300558)：埃克替尼持续增长 恩沙替尼上市,新浪
694,2020-12-31,杭州资本牵手贝达药业，投资4亿元医药产业基金,投资界
695,2020-12-28,医药生物行业跨市场周报：融合与共生 重视药店板块回调后的配置价值,光大证券
696,2020-12-25,研发日报丨恒瑞医药CDK 4/6抑制剂3期临床研究达主要终点,新浪
697,2020-12-25,贝达药业BPI-361175药品获准临床,北京商报
698,2020-12-24,前三季度净利增速212%！5家优质公司纳入创50指数,魔都资产管理人
699,2020-12-24,贝达药业：BPI-21668片药品临床试验申请获得受理,资本邦
700,2020-12-24,早间公告2020年12月24日星期四,Wind
701,2020-12-24,贝达药业(300558.SZ)：BPI-21668片药品临床试验申请获受理,格隆汇
702,2020-12-22,贝达药业：BPI-361175片药品临床试验申请获受理,格隆汇
703,2020-12-22,医药生物行业周报：“三重行业红利 五重公司催化”助推智飞生物 强调Q1医药躁动机会,新浪
704,2020-12-21,临床I期产品引来艾伯维买下使用权，加科思今日上市，如何？,药智网
705,2020-12-21,加科思-B正式登陆港交所：开盘涨超14% 高瓴、启明为股东,新浪
706,2020-12-21,医药行业周报：如何选股？创新赋能、制造升级和降本增效,新浪
707,2020-12-21,第四批药品集采倒计时，医药行业将加速创新转型,Wind
708,2020-12-18,贝达药业：恩沙替尼计划于明年向美国FDA申报一线治疗适应症的上市申,格隆汇
709,2020-12-18,人民金融·创新药指数涨1.39% 11个创新药获批临床,证券时报
710,2020-12-17,肺癌创新药贝美纳：开出中国首张处方单,经济网
711,2020-12-17,电鳗快报|公司募资1个亿 股东套现9个亿 “单腿”走路的贝达药业“缺钱”,电鳗快报
712,2020-12-16,那些进医保的药品，卖得咋样？,赛柏蓝
713,2020-12-16,今日，国产首个肺癌ALK抑制剂“恩沙替尼”开出第一张处方,医药云端工作室
714,2020-12-16,药品谈判进医保后，销售额达标了吗？,医药经济报
715,2020-12-15,贝达药业(300558.SZ)：1013.86万股股份将于12月17日上市,智通财经
716,2020-12-15,首款国产肺癌ALK抑制剂恩沙替尼首单出库,每日经济新闻
717,2020-12-15,Wind快讯|每日医药行业动态（2020-12-15）,Wind
718,2020-12-14,贝达药业(300558.SZ)：在研新药BPI-43487临床试验获批,格隆汇
719,2020-12-14,贝达药业：在研新药BPI-43487获得临床试验批准通知书,e公司
720,2020-12-14,贝达药业：在研新药BPI-43487临床试验获批,Wind
721,2020-12-14,研发日报丨恒瑞氟唑帕利胶囊、海思科环泊酚注射液获批上市,新浪
722,2020-12-14,天风证券：创新药行业 十年十倍赛道下的巨头与新规,新浪
723,2020-12-14,医药生物行业周报：2021医药“春季躁动”有望提前到来 关注医药消费投资机会,新浪
724,2020-12-12,上市公司正负面新闻2020年12月12日星期六,Wind
