,2021-12-31,公告精选：贵州茅台预计2021年净利520亿元左右；长江电力减持上海电力股份,e公司
0,2021-12-31,减持川投能源不久 长江电力又减持上海电力2.41% 减持股份,e公司
1,2021-12-31,【提前看】31日公告精选：贵州茅台：预计2021年净利520亿元左右 同比增长11%；ST西源：公司实控人将发生变更,e公司
2,2021-12-31,146股本月股价创历史新高,证券时报网
3,2021-12-31,上海电力：持股5%以上股东长江电力减持2.41%股份 减持股份,资本邦
4,2021-12-31,上海电力最新公告：长江电力减持2.41%股份 减持股份,证券之星
5,2021-12-31,上海电力(600021.SH)：长江电力12月30日减持2.41%股份 减持股份,格隆汇
6,2021-12-31,上海电力(600021.SH)：长江电力减持比例达2.41% 持股降至7.56% 减持股份,智通财经
7,2021-12-31,上海电力：股东长江电力累计减持2.41%股份 减持股份,Wind
8,2021-12-30,11只股股价创历史新高,证券时报网
9,2021-12-30,长江电力将设立太和抽水蓄能电站合资公司,北极星电力
10,2021-12-30,美国三大股指收盘涨跌不一，道指连涨六日并创历史新高,Wind
11,2021-12-29,上海电力股价闪崩跌停，3家机构净卖出逾3亿元,第一财经
12,2021-12-29,长江电力(600900.SH)：拟在重庆涪陵设太和抽水蓄能电站项目合资公司,格隆汇
13,2021-12-29,长江电力(600900.SH)下属签署溪洛渡右岸电站购售电合同,智通财经
14,2021-12-29,长江电力：签订2021-2025年度溪洛渡右岸电站购售电合同,财联社
15,2021-12-29,毫无征兆！2900亿大白马闪崩跌停，抛盘汹涌而出！超级牛散坚守12年，成百亿富翁，今日浮亏超12亿！,--
16,2021-12-29,茅台暴跌1200亿：白酒股狂跌！电力牛股闪崩跌停，最强妖股又涨停,和讯
17,2021-12-28,长江电力、华能水电、国投电力，谁是盈利能力最强的水电企业？,Ofweek
18,2021-12-28,长江电力：董秘李绍平暂未在中国三峡集团二级单位担任新职位,每日经济新闻
19,2021-12-28,长江电力：公司本次参与鼎和保险增资引战，出资约27.65亿元，持股比例15%,每日经济新闻
20,2021-12-28,鼎和财险拟引战三家新股东增资64.51亿 公司称系成立以来单笔最大股权性融资,中国网
21,2021-12-28,北向资金假期后首日加仓近13亿，兴业银行、宁德时代净买入均超5亿元,Wind
22,2021-12-27,上海电力(600021.SH)：长江电力拟不再认购公司定增股份,格隆汇
23,2021-12-27,三峡能源VS长江电力～三峡虽强但是在行业大佬面前差多了,深水财经社
24,2021-12-27,2021年最后一周解禁市值超千亿元,Wind
25,2021-12-26,【德邦金工|周报】新能源集体回调，避险情绪升温 20211226,微信
26,2021-12-26,公用事业周观点：辅助服务费用向用户侧传导，调动积极性【国君公用翟堃】,煤市乾坤
27,2021-12-26,华能水电：进军光伏拓宽成长空间,每日经济新闻
28,2021-12-26,拟收购云川公司100%股权 长江电力收上交所问询函 问询,e公司
29,2021-12-25,中国能建VS长江电力～几分钟看完两个企业4年的财务报表,深水财经社
30,2021-12-24,中国结算修订形成境内外证券交易所互联互通存托凭证登记结算业务实施细则,Wind
31,2021-12-24,上交所：拟将参与中国存托凭证业务个人投资者门槛下调至50万元,Wind
32,2021-12-24,上交所向长江电力(600900.SH)发出问询函，要求评估水电站蓄水政策对下属水电站发电量的影响 问询,智通财经
33,2021-12-24,北京区域股市周报：266家机构调研太极股份 宣亚国际股价涨125.09%排第一,每日经济新闻
34,2021-12-24,A股午盘综述：宁王跌7%、茅台涨3%，机构重仓股一通混战！五千亿电力龙头创新高,Wind
35,2021-12-24,长江电力涨超3%，创历史新高,Wind
36,2021-12-24,长江电力盘中创历史新高,证券时报网
37,2021-12-24,财信证券电力行业2021年12月报：持续看好新能源发电，关注水火转型新能源,财信证券研究
38,2021-12-23,川投能源：长江电力减持公司股份约4717.86万股 减持股份,每日经济新闻
39,2021-12-23,川投能源(600674.SH)：长江电力已减持1.07%股份 减持股份,格隆汇
40,2021-12-23,川投能源：长江电力累计减持比例达1.07% 减持股份,Wind
41,2021-12-22,长江电力、华能水电、国投电力，谁是成长能力最强的水电企业？,Ofweek
42,2021-12-21,长江电力大宗交易成交591.00万元,证券时报网
43,2021-12-21,长江电力今日大宗交易成交30万股，成交价19.7元折价10.37%,Wind
44,2021-12-21,长江电力现1笔大宗交易 共成交591.00万元,新浪
45,2021-12-21,长江电力：融资余额比上日降0.21%，融券余额比上日降0.97%,资本邦
46,2021-12-21,【建投公用环保】11月火电发电量同比减少2.5%，电煤剪刀差发生反转,能源交运万维网
47,2021-12-19,周观点：11月火电发电下滑，风光增速加快【国君公用翟堃】,煤市乾坤
48,2021-12-19,北向资金大调仓！加仓“券茅”逾40亿元，减仓“药茅”超20亿元,中证报
49,2021-12-17,川投能源：股东中国长江电力股份有限公司减持公司股份约5869.04万股 减持股份,每日经济新闻
50,2021-12-17,本周11家上市公司发布可转债预案 融资总规模达99.78亿元,Wind
51,2021-12-17,川投能源(600674.SH)：长江电力累计减持1.33%股份 持股降至12.71% 减持股份,格隆汇
52,2021-12-17,川投能源(600674.SH)股东长江电力减持合计5869.04万股 减持股份,智通财经
53,2021-12-17,川投能源：长江电力累计减持1.33%股份 减持股份,Wind
54,2021-12-17,鼎和财险增资64.5亿，净利润增速放缓，关联交易占比超9成 盈利能力下降,AI财经社
55,2021-12-17,北上资金连续12天净买入，煤炭行业搭上氢能源快车,Wind
56,2021-12-16,北向资金追平年内最长净买入纪录，山西汾酒净卖出额创历史新高,Wind
57,2021-12-16,北向资金动向盘点：持续净买非银,Wind
58,2021-12-16,北向资金小幅净买入，减持医疗服务，药明康德遭甩卖近7亿元 减持股份,21世纪经济报道
59,2021-12-16,外资连续11天加仓，4000亿龙头被买爆！两大领域成扫货专区,Wind
60,2021-12-15,“电力茅”资产收购案遭小散“狙击”：中小投资者呼吁对第二步方案投反对票,21经济网
61,2021-12-15,“电力系”险企鼎和财险引战投尘埃落定：新进三名股东，募资共计64.5亿元,资本邦
62,2021-12-15,15股获券商买入评级，比音勒芬目标涨幅达46.70%,Wind
63,2021-12-15,长江电力收购资产，为什么小散要对第二步方案投否决票,阿尔法工场
64,2021-12-14,民生证券：给予长江电力买入评级，目标价位26.0元,证券之星
65,2021-12-14,三家新股东拟投资鼎和财险64.5亿元 “南方电网系”持股比例将降至65%,每日经济新闻
66,2021-12-14,电力股午后异动，华电能源拉升封板,Wind
67,2021-12-14,全球最大水电上市公司复牌，重组利好拉动股价大涨,华夏能源网
68,2021-12-14,19股获券商买入评级，中天科技目标涨幅达58.20%,Wind
69,2021-12-14,A股：重磅突发！周二，医药板块要迎来大涨吗？,搜狐
70,2021-12-13,长江电力(600900)：“乌白”盈利能力自证 注入后EPS增厚可期,新浪
71,2021-12-13,能耗“双控”转向碳“双控”意味什么,郭丽丽的研究札记
72,2021-12-13,水电龙头一日飙涨250亿，”买买买“还有未来吗？,证券之星
73,2021-12-13,水电龙头一日飙涨300亿，”买买买“还有未来吗？,格隆汇
74,2021-12-13,“忐忑不安，我要投反对票！”5000亿龙头一度逼近涨停，欲募集千亿收购资产！小股东却说：我感到非常失望...发生了什么？,雪球
75,2021-12-13,长江电力复牌涨超6.5%，全市场首只绿色电力ETF（159611）即将发行,资本邦
76,2021-12-13,电力股二次拉升，三峡能源、时代新材、长江电力等走势强劲,Wind
77,2021-12-13,长江电力募资1246亿拟购买云川公司100%股权,阿尔法工场
78,2021-12-13,5000亿水电茅“铁树开花”，拟收购云川100%股权，总装机量增57%,AI财经社
79,2021-12-13,快讯：绿电板块开盘走强 长江电力涨超9%,新浪
80,2021-12-13,电力股集体走强 长江电力(600900.SH)逼近涨停,格隆汇
81,2021-12-13,电力股集体高开，长江电力涨停，上海电力、内蒙华电、华能国际纷纷走强,Wind
82,2021-12-13,A股早报2021年12月13日星期一,Wind
83,2021-12-13,盘前必读丨中央经济工作会议定调“稳健” 标普500刷新收盘纪录,第一财经
84,2021-12-13,“买买买”的水电之王，稳稳的10%幸福,虎嗅网
85,2021-12-12,【建投公用环保】中央经济会议提出新增可再生能源不纳入能耗双控考核指标,能源交运万维网
86,2021-12-11,绿电板块开盘拉升，长江电力涨停,36氪
87,2021-12-11,中国长江电力股份有限公司发行股份、发行可转换公司债券及支付现金购买资产并募集配套资金暨关联交易预案摘要,证券时报
88,2021-12-11,中国长江电力股份有限公司 关于重大资产重组一般风险提示 暨股票复牌公告,中证报
89,2021-12-10,长江电力拟收购云川公司100%股权 控股总装机容量将增长57%,上证报
90,2021-12-10,盘后公告集锦|炸雷！三连板“元宇宙”概念股要被ST？事涉控股股东非经营性资金占用,财联社
91,2021-12-10,晚间要闻2021年12月10日星期五,Wind
92,2021-12-10,公告精选：紫光集团重整确定战略投资者；长江电力拟并购云川公司，水电装机规模将大幅提升,e公司
93,2021-12-10,长江电力：拟并购云川公司 控股水电装机规模将大幅提升,e公司
94,2021-12-10,长江电力(600900.SH)：拟购买云川公司100%股权 公司控股总装机容量将增长57.46%、12月13日起复牌,格隆汇
95,2021-12-10,长江电力(600900.SH)拟增发收购两座水电站资产 12月13日复牌,智通财经
96,2021-12-10,长江电力最新公告：拟购买云川公司100%股权 12月13日起复牌,证券之星
97,2021-12-10,长江电力：公司股票将于2021年12月13日上午开市起复牌,每日经济新闻
98,2021-12-10,长江电力：拟购买云川公司100%股权,财联社
99,2021-12-10,长江电力：拟收购云川公司100%股权，股票复牌,Wind
100,2021-12-10,绿电之王再扩容,国际电力网
101,2021-12-09,长江电力：签订数份购售电合同,Wind
102,2021-12-09,长江电力：永善溪洛渡电厂签订2021-2025年度溪洛渡左岸电站购售电合同,财联社
103,2021-12-09,长江电力(600900.SH)：签订了2021-2025年度三峡水电站购售电合同,格隆汇
104,2021-12-09,长江电力(600900.SH)：宜宾向家坝电厂签订2021-2025年度向家坝水电站购售电合同,格隆汇
105,2021-12-09,长江电力(600900.SH)签订数份购售电合同,智通财经
106,2021-12-09,长江电力(600900.SH)：与南方电网、国家电网签订2021-2025年度三峡水电站购售电及输电合同,格隆汇
107,2021-12-08,公用事业行业简评报告：多地发布电力中长期交易规则征求意见稿,新浪
108,2021-12-07,A股融资融券日报：两融余额减少24.72亿元（12月6日）,Wind
109,2021-12-06,首席周观点：周期股会来第二春吗？,新浪
110,2021-12-06,长江电力：筹划重大资产重组停牌进展 重大事项停牌,Wind
111,2021-12-06,电力：山东印发高耗能企业碳管理办法 火电长协煤政策靴子落地,新浪
112,2021-12-06,公用环保行业周报：2022年电煤长协征求意见稿发布有利于保障煤电资产现金流,新浪
113,2021-12-06,环保与公用事业行业周报(2021年第46期)：工业和信息化部印发工业绿色发展规划 加快能源消费低碳化转型,新浪
114,2021-12-06,A股融资融券日报：两融余额减少18.05亿元（12月3日）,Wind
115,2021-12-06,绿色电力政策密集出台，行业发展步入快车道,Wind
116,2021-12-05,公用事业周观点：煤价中枢提高，绿电优势凸显【国君公用事业】,煤市乾坤
117,2021-12-05,公用周报：江苏首批平价海风项目启动竞争性配置 第二批内陆风电光伏大基地项目开始上报,新浪
118,2021-12-03,长江电力再现重大资产重组，全球最大水电“一哥”地位愈加稳固,中金在线
119,2021-12-03,A股融资融券日报：两融余额减少72.45亿元（12月2日）,Wind
120,2021-12-03,25股获券商买入评级，中孚信息目标涨幅达62.82%,Wind
121,2021-12-03,绿电之王再扩容,投资界
122,2021-12-02,A股融资融券日报：两融余额增加5.37亿元（12月1日）,Wind
123,2021-12-01,装机71.8GW！注入两大水电资产，长江电力意欲何为？,国际能源网
124,2021-12-01,A股融资融券日报：两融余额增加15.02亿元（11月30日）,Wind
125,2021-11-30,2021中国上市公司软实力巡礼：长江电力价值221.68亿元 排序第21名,搜狐
126,2021-11-30,长江电力：目前公司所属溪洛渡、向家坝电站的上网电价主要分为非市场化电价和市场化电价两部分,每日经济新闻
127,2021-11-30,长江电力：公司目前不涉及新建水电站,每日经济新闻
128,2021-11-30,长江电力：三峡集团不持有转股后的债券,每日经济新闻
129,2021-11-30,筹划注入巨型水电站资产！长江电力停牌,长江电力
130,2021-11-30,A股融资融券日报：两融余额增加18.95亿元（11月29日）,Wind
131,2021-11-29,电力资产等待重估：长江电力再收两座巨型水电站，三峡集团意欲何为？,21世纪经济报道
132,2021-11-29,公用事业行业周报：政策推动下电煤矛盾持续缓和 全国统一电力市场呼之欲出,新浪
133,2021-11-29,中国最大电力上市公司停牌，筹划注入乌东德、白鹤滩水电资产,澎湃新闻网
134,2021-11-29,定增易主渐成趋势，走强逻辑何在,Wind
135,2021-11-29,长江电力拟购买乌东德、白鹤滩电站资产 今起停牌,上证报
136,2021-11-29,长江电力等9股获融资净买入超亿元,证券时报网
137,2021-11-29,11月26日A股融资买入额807.52亿元，北方稀土（600111.SH）居首,智通财经
138,2021-11-29,融资客青睐7股，上实发展买入占比高达42.74%,Wind
139,2021-11-29,每经9点|长江电力：控股股东筹划将资产注入公司 ；国家发展改革委价格司召开座谈会，煤炭企业建议尽快建立长效机制,每日经济新闻
140,2021-11-29,A股融资融券日报：两融余额减少44.66亿元（11月26日）,Wind
141,2021-11-29,长江电力(600900.SH)控股股东筹划重大资产重组事项 11月29日起停牌 重大事项停牌,智通财经
142,2021-11-29,长江电力：筹划重大资产重组 今日起停牌 重大事项停牌,第一财经
143,2021-11-29,长江电力停牌 控股股东正筹划将乌东德、白鹤滩电站资产(股权)注入公司,格隆汇
144,2021-11-29,长江电力：控股股拟注入资产，11月29日开市起停牌 重大事项停牌,Wind
145,2021-11-29,多个指数迎重磅调整！科创板公司大幅增加，这些股票即将调入！,Wind
146,2021-11-28,公用周报：省间电力现货交易规则出台 三峡能源发布股权激励计划,新浪
147,2021-11-27,涉及超5500亿规模基金！新一轮指数样本大调整出炉,Wind
148,2021-11-26,晚间要闻2021年11月26日星期五,Wind
149,2021-11-26,上证50等系列指数进行定期调样，新经济和先进制造业样本增多,Wind
150,2021-11-26,公用环保行业周报：10月用电需求继续强劲南网发布十四五规划,新浪
151,2021-11-26,A股融资融券日报：两融余额增加16.32亿元（11月25日）,Wind
152,2021-11-26,11月25日A股融资买入额834.88亿元，北方稀土（600111.SH）居首,智通财经
153,2021-11-26,公用环保行业重点事项点评：省间现货交易意义重大 新能源消纳再添保障,新浪
154,2021-11-25,电力月谈：2021年11月期,新浪
155,2021-11-25,A股融资融券日报：两融余额增加23.98亿元（11月24日）,Wind
156,2021-11-24,中国长江电力：“18长电MTN001”回售金额1000万元,Wind
157,2021-11-24,A股融资融券日报：两融余额增加25.03亿元（11月23日）,Wind
158,2021-11-23,A股融资融券日报：两融余额增加111.29亿元（11月22日）,Wind
159,2021-11-22,【建投公用环保】10月发用电稳健增长，江苏提供风、光电市场化交易选项,能源交运万维网
160,2021-11-22,前瞻性研究行业月报：绿色能源与前瞻性产业月报(2021年11月报),新浪
161,2021-11-22,中信建投公用事业2022年投资策略报告：焚烧及环卫设备令人期待,Wind
162,2021-11-22,A股融资融券日报：两融余额减少11.76亿元（11月19日）,Wind
163,2021-11-21,公用环保行业周报：坚定看好火电转型新能源逻辑 不惧调整静待花开,新浪
164,2021-11-21,公用事业行业周报：10月数据点评：用电持续高增 风光发展提速,新浪
165,2021-11-21,聪明资金傻眼，要被割韭菜？刚加仓6倍，大股东就要大手笔减持,Wind
166,2021-11-20,聪明资金刚猛加仓6倍，大股东就要大比例减持？ 减持股份,Wind
167,2021-11-19,三年行动首次“大考”将至！多地国企调整股权结构，乐观应对完成“70%”目标,华夏时报
168,2021-11-19,申万宏源：首予粤水电(002060.SZ)“买入”评级 绿电量质兼优 工程业务景气度回升,智通财经
169,2021-11-19,长江电力&三峡集团布局金沙江下游风光大基地业务,北极星电力
170,2021-11-19,粤水电(002060)：新能源转型步伐加速 绿电质量兼优蓄势待发,新浪
171,2021-11-19,A股融资融券日报：两融余额减少3.0亿元（11月18日）,Wind
172,2021-11-18,长江电力张星燎：坚持问题导向需求驱动 加强自主创新应用创新,我的煤炭网
173,2021-11-18,公用事业2022年投资策略报告：火电触底反弹 双碳政策推动新能源快速发展；焚烧及环卫设备令人期待,新浪
174,2021-11-18,长江电力与三峡集团共同出资30亿设立合资公司,北极星电力
175,2021-11-18,A股融资融券日报：两融余额增加35.43亿元（11月17日）,Wind
176,2021-11-18,国企改革“年检”将至，多家国资公司调整股权结构,Wind
177,2021-11-17,公用事业及环保行业报告：央行推出碳减排支持工具,新浪
178,2021-11-17,长江电力工业互联网平台成功上线试运行,e公司
179,2021-11-17,长江电力：中国三峡集团拟将2%股份无偿划转至长江实业公司,资本邦
180,2021-11-17,长江电力(600900.SH)：控股股东拟将所持2%股份无偿划转至长江实业公司 减持股份,格隆汇
181,2021-11-17,十年大浪淘沙，全面平价时代终到来，光伏是新能源全村的希望？,OFweek
182,2021-11-17,A股融资融券日报：两融余额减少48.12亿元（11月16日）,Wind
183,2021-11-16,长江电力(600900.SH)携三峡集团云南能投斥30亿元设合资公司布局金下基地相关业务,智通财经
184,2021-11-16,长江电力(600900.SH)：子公司拟出资15.3亿元与三峡集团云南能投成立合资公司,格隆汇
185,2021-11-16,A股融资融券日报：两融余额减少2.07亿元（11月15日）,Wind
186,2021-11-15,沪港通十大成交活跃股排名（11月15日）,Wind
187,2021-11-15,陆股通净买入33.82亿元，连续3日净买入,证券时报网
188,2021-11-15,中国长江电力：“18长电MTN001”票面利率调整和投资人回售选择权行使,Wind
189,2021-11-15,A股融资融券日报：两融余额减少22.02亿元（11月12日）,Wind
190,2021-11-14,【建投公用环保】央行推出碳减排支持工具，燃气冬季保供有序进行,能源交运万维网
191,2021-11-12,A股融资融券日报：两融余额增加26.26亿元（11月11日）,Wind
192,2021-11-11,长江电力：当前公司所属三峡电能正在沿长江经济带加快推进智慧综合能源业务发展,每日经济新闻
193,2021-11-11,长江电力：目前，公司正在密切关注抽水蓄能产业发展，并结合大水电的管理和技术等方面优势，开展依托所属长江流域梯级水库和电站发展抽水蓄能的规划研究,每日经济新闻
194,2021-11-11,长江电力：三季度，公司各电站上网电价同比基本保持稳定,每日经济新闻
195,2021-11-11,A股融资融券日报：两融余额增加15.9亿元（11月10日）,Wind
196,2021-11-10,中国短期融资券及中期票据信用分析周报,新浪
197,2021-11-10,长江电力大宗交易成交29.51万股 成交额540.33万元,证券时报网
198,2021-11-10,长江电力今日大宗交易成交29.51万股，成交价18.31元折价9.13%,Wind
199,2021-11-10,长江电力现1笔大宗交易 共成交540.33万元,新浪
200,2021-11-10,公用事业行业深度报告：电价市场化与电力清洁化促行业发展,新浪
201,2021-11-10,前三季度水电业绩整体下滑 盈利能力下降,中国能源报
202,2021-11-10,A股异动 | 川投能源跌5% 股东长江电力拟减持不超过4% 拟减持股份,格隆汇
203,2021-11-10,A股融资融券日报：两融余额增加23.63亿元（11月9日）,Wind
204,2021-11-10,"【中证盘前】拓新药业称与默沙东无直接合作；长江电力拟减持川投能源；宁波方正拟12亿元投锂电池；元宇宙第一股收涨逾40CM
拟减持股份",中证报
205,2021-11-10,11月10日四大证券报头版头条内容精华摘要,新浪
206,2021-11-10,“电茅”罕见出手减持 长江电力拟出售川投能源4%股份,全景网
207,2021-11-09,逻辑推演与实证研究的多维视角：碳中和下的电力需求韧性来自哪里,新浪
208,2021-11-09,川投能源(600674)：持股5%以上股东减持计划 拟减持股份,资本邦
209,2021-11-09,晚间重要公告2021年11月9日星期二,Wind
210,2021-11-09,川投能源：股东长江电力拟减持不超4%股份 拟减持股份,财联社
211,2021-11-09,川投能源：长江电力拟减持不超过总股本4% 拟减持股份,Wind
212,2021-11-09,长江电力接受2家机构调研！短期主力资金净流出，或存在资金分歧,每日经济新闻
213,2021-11-09,A股融资融券日报：两融余额增加39.23亿元（11月8日）,Wind
214,2021-11-08,长江电力(600900.SH)：控股股东可交换债换股导致权益变动超1%,格隆汇
215,2021-11-08,电力：煤炭供需格局显著放松 煤价回落火电基本面持续好转,新浪
216,2021-11-08,A股融资融券日报：两融余额减少121.85亿元（11月5日）,Wind
217,2021-11-05,公用事业2021年三季报总结：火电盈利大幅下滑 风光新能源业绩向好 盈利能力下降,新浪
218,2021-11-05,A股融资融券日报：两融余额增加33.85亿元（11月4日）,Wind
219,2021-11-04,2021年中国水电发电量及重点上市企业对比分析：长江电力龙头优势明显,国际电力网
220,2021-11-04,中信证券：基础设施和现代服务，优质供给的扩张机遇,Wind
221,2021-11-04,当升科技、明阳智能涨超10%，碳中和ETF上涨2%,Wind
222,2021-11-04,A股融资融券日报：两融余额减少44.29亿元（11月3日）,Wind
223,2021-11-03,北向资金连续5日净买入，隆基股份遭大幅抛售超16亿元,Wind
224,2021-11-03,农业拉升电新杀跌，强势板块回调市场见底？,Wind
225,2021-11-03,北向资金减持榜单：32股减持市值超亿元 减持股份,证券时报网
226,2021-11-03,北向资金动向盘点：冷静应对巨幅波动,Wind
227,2021-11-03,A股融资融券日报：两融余额减少75.11亿元（11月2日）,Wind
228,2021-11-03,连续4日净买入！北向资金增持电子元件、减持银行，逾12亿大幅加仓“光伏茅” 减持股份,21世纪经济报道
229,2021-11-02,财信证券：给予长江电力增持评级，目标价位24.0元,证券之星
230,2021-11-02,A股融资融券日报：两融余额增加47.83亿元（11月1日）,Wind
231,2021-11-01,北向资金今日净买入7.11亿元，连续13日抢筹宁德时代累计加仓超76亿元,Wind
232,2021-11-01,图解长江电力三季报：第三季度单季净利润同比减11.04% 盈利能力下降,证券之星
233,2021-11-01,三季度公用事业持仓分析,郭丽丽的研究札记
234,2021-11-01,长江电力：发电量减少致第三季度业绩下滑11% 盈利能力下降,郭丽丽的研究札记
235,2021-11-01,长江电力：优化调度 蓄水保供，“大国重器”之责任担当,凤凰网
236,2021-11-01,45股受青睐，北向资金增持额超亿元,证券时报网
237,2021-11-01,A股融资融券日报：两融余额减少52.62亿元（10月29日）,Wind
238,2021-10-31,中泰证券：给予三峡水利买入评级,证券之星
239,2021-10-30,Wind风控日报2021年10月30日星期六,Wind
240,2021-10-29,长江电力公布三季报 前三季净利减少3.38% 盈利能力下降,新浪
241,2021-10-29,"长江电力现2笔大宗交易 共成交2,014.50万元",新浪
242,2021-10-29,长江电力今日大宗交易成交94.80万股，成交价21.25元溢价0.0%,Wind
243,2021-10-29,长江电力：第三季度净利润109.85亿元 同比下降11.04% 盈利能力下降,财联社
244,2021-10-29,长江电力：前三季度净利润同比减少3.38% 盈利能力下降,Wind
245,2021-10-29,A股融资融券日报：两融余额减少165.82亿元（10月28日）,Wind
246,2021-10-28,9种MSCI中国A股指数，布局A股优质资产哪家强？,养基司令
247,2021-10-28,41股获北向资金加仓超亿元,证券时报网
248,2021-10-28,A股融资融券日报：两融余额减少19.89亿元（10月27日）,Wind
