3947,2019-02-16,180份年报业绩快报盘点 机构集中推荐13只个股,证券日报
3948,2019-02-15,【方正公用环保郭丽丽团队】贵州省印发关于2019年能源行业安全重点工作的通知,公用环保郭丽丽团队
3949,2019-02-15,沪指跌近1%失守2700 或再面临关键时刻,证券时报网
3950,2019-02-14,【中泰公用&煤炭】每日速递：长江电力拟发行3年期公司债,能源观察站
3951,2019-02-14,【方正公用环保郭丽丽团队】江西省印发建立省内流域上下游横向生态保护补偿机制实施方案,公用环保郭丽丽团队
3952,2019-02-14,【东吴环保袁理团队】每日锦集0214：我国生态保护补偿机制将全面铺开,微信
3953,2019-02-14,公用事业：融资改善利好PPP标的 荐7股,和讯
3954,2019-02-14,长江电力(600900.SH)拟发行不超30亿元公司债,格隆汇
3955,2019-02-13,【方正公用环保郭丽丽团队】福建省发布促进天然气协调稳定发展实施意见,公用环保郭丽丽团队
3956,2019-02-13,【东吴环保袁理团队】每日锦集0213：甘肃省生态保护红黄牌管理制度,微信
3957,2019-02-13,02月13日 收盘突破五日均线个股一览,每日经济新闻
3958,2019-02-13,公用事业：蒙华铁路至 新年新气象,和讯
3959,2019-02-12,【东吴环保袁理团队】每日锦集0212：11家环保上市公司2018年业绩预告盘点：预亏较多 预亏,东吴环保公用研究
3960,2019-02-12,【每日晨报】策略丁文 银河证券晨会纪要—20190212,中国银河证券研究
3961,2019-02-12,环保工程及服务行业:关注全球货币宽松下的估值业绩回升,东吴证券
3962,2019-02-11,五大券商周二看好6板块34股,中财网
3963,2019-02-11,长江电力：在宜昌区域已着手开展充电桩业务,Wind
3964,2019-02-11,近250家公司去年净利有望超10亿 堪称A股“中流砥柱”,证券时报
3965,2019-02-10,【安信环保公用邵琳琳团队】周报0210：汽车五大总成再制造放开，汽车拆解产业有望迎来机遇,安信证券环保公用研究
3966,2019-02-10,公用事业：汽车拆解产业有望迎来机遇 荐6股,安信证券
3967,2019-02-10,【方正公用环保郭丽丽团队】一季度业绩展望——2019年第7周观点,公用环保郭丽丽团队
3968,2019-02-08,A股最抠门公司上市26年零派现 最豪公司发8000亿红包,新浪
3969,2019-02-03,41股狗年振幅低于25%(名单),中财网
3970,2019-02-02,狗年股市大盘点：主要股指全年收跌，被这些股票伤成了狗,证券时报网
3971,2019-02-02,电力：内陆核电再被提及 荐4股,和讯
3972,2019-02-02,公用事业：环保板块基金持仓降至四年来最低 荐6股,和讯
3973,2019-02-02,北上资金历史罕见单月净流入600亿 产业资本买买买,Wind
3974,2019-02-01,A股10亿净利俱乐部都有谁？除了银行股，还有这些优秀民企,e公司
3975,2019-02-01,国金证券李立峰：春季行情，外资在买什么？,腾讯网
3976,2019-02-01,红利低波动和红利低波动100在于金融地产还是消费股,新浪
3977,2019-01-31,【东吴环保袁理团队】每日锦集0131：《上海市生活垃圾管理条例》获表决通过，7月实施,微信
3978,2019-01-31,长城公用-公用事业行业周观点：Q3业绩披露，火电板块Q3业绩复苏加速，水电业绩增速放缓 盈利能力下降,流星飞电
3979,2019-01-31,长城公用-公用事业2019年三季报总结：煤价、电量数据向好，火电板块Q3业绩复苏加速；Q3水情致水电业绩增速放缓 盈利能力下降,流星飞电
3980,2019-01-31,【每日晨报】策略丁文 银河证券晨会纪要—20190131,中国银河证券研究
3981,2019-01-30,湖北能源财务负责人邓玉敏辞职 年薪约79万元 董监高成员变化,挖贝网
3982,2019-01-29,01月29日 收盘突破年线个股一览,每日经济新闻
3983,2019-01-29,大和：微降北控水务(00371.HK)目标价至5.9港元 评级“买入”,格隆汇
3984,2019-01-29,公用事业：继续关注二线火电投资机遇 荐6股,和讯
3985,2019-01-29,逾500股业绩有望创历史新高 19股盈利将超百亿元,证券时报
3986,2019-01-29,【晨会纪要】策略丁文 银河证券晨会纪要—20190129,中国银河证券研究
3987,2019-01-29,公用事业与环保行业2018q4基金与陆股通持仓分析:龙头吸引力增强,光大证券
3988,2019-01-27,【安信环保公用邵琳琳团队】周报 0127：环保板块基金持仓降至四年来最低，持仓向运营和监测聚焦,安信证券环保公用研究
3989,2019-01-27,公募老将选股思路延续 高ROE成为首要标准,新浪
3990,2019-01-25,"【电力及公用事业电力行业】2019年度投资策略：雪消冰又释,景和风复暄",格隆汇
3991,2019-01-25,"电力行业:电力重仓股持仓逆势增长,二线火电龙头得到市场关注",正点财经
3992,2019-01-25,申万宏源：2018年用电维持高速增长2019年供需格局区域分化,申万宏源
3993,2019-01-25,【晨会纪要】策略丁文 银河证券晨会纪要—20190125,中国银河证券研究
3994,2019-01-25,公用事业及环保行业周报:2019生态环境保护会议在京召开,东兴证券
3995,2019-01-24,【晨观方正】国六标准是否推迟？相关材料增长几何？,方正证券研究
3996,2019-01-24,次新基金首次公布季报 青睐金融消费医药,证券时报
3997,2019-01-24,"电力行业周报:2018全年用电增速达8.5%,增量配电明确结算电价",平安证券
3998,2019-01-24,"环保行业周报:长江参股北控,估值修复预期改善",华安证券
3999,2019-01-23,公用事业：安监趋严影响煤炭供给 荐7股,和讯
4000,2019-01-23,电力行业：2018年全社会用电量增速创新高,川财证券
4001,2019-01-23,【方正公用环保郭丽丽团队】18Q4公用事业基金持仓分析：电力行业持仓大幅增加，火电持仓仍有较大上升空间,公用环保郭丽丽团队
4002,2019-01-23,公用事业：水电持仓接近历史高位 荐58股,方正证券
4003,2019-01-23,南方瑞合等基金折价太诱人 基本就是送钱,新浪
4004,2019-01-22,电力：水火利用小时均提升 荐1股,西部证券
4005,2019-01-22,国金证券：公募基金第四季加仓万科 减仓茅台平保等,经济通
4006,2019-01-22,港股复盘：恒指微涨100点 腾讯重上340元,金融界
4007,2019-01-22,"环保及公用事业周报:煤价短期反弹有限,继续关注二线火电投资机遇",安信证券
4008,2019-01-21,"长江电力:归母净利预增1.66%,业绩稳健、发电量同比+2.18%",正点财经
4009,2019-01-21,港股异动︱配股引入三峡集团且获券商唱好 北控水务(00371)现涨3.26%,智通财经
4010,2019-01-21,电力：两部委推进风光无补贴平价上网 华龙一号开展标准化示范,和讯
4011,2019-01-21,港股异动丨北控水务高开4.66% 集团增持+三峡集团入股,格隆汇
4012,2019-01-21,北上资金节前涌入A股扫货 6股有望率先发力,证券日报
4013,2019-01-21,"长江电力业绩预告点评:秋汛来水超预期叠加投资收益,净利润同比增长1-66%",安信证券
4014,2019-01-21,"公用事业与环保行业周报:煤价短期有所支撑,布局融资环境改善机会",光大证券
4015,2019-01-21,"长江电力公司点评:业绩符合预期,逆周期配置价值凸显",证券之星
4016,2019-01-20,【国君公用|行业周报】2018年用电量同比增长8.5%，大水电业绩超预期（2019.01.14-2019.01.18）,妍姐电报
4017,2019-01-20,【方正公用环保郭丽丽团队】12月份全社会用电量增长8.99%，江西推进“基准电价+浮动电价”机制——2019年第4周观点,公用环保郭丽丽团队
4018,2019-01-20,【方正公用环保郭丽丽团队】四川省印发饮用水水源地环境问题整治攻坚战实施方案,公用环保郭丽丽团队
4019,2019-01-20,北控水务(00371-HK)向中国长电国际配股筹逾20亿,财华社
4020,2019-01-19,【中泰公用&煤炭】每日速递20190118,能源观察站
4021,2019-01-19,长江电力:关于通过参与北控水务集团有限公司新发股份认购获取固定收益暨关联交易公告,中财网
4022,2019-01-19,上资金节前涌入A股扫货 四维度圈定7只绩优白马股,证券日报
4023,2019-01-19,港股火电走到了逆向投资的起点,红周刊
4024,2019-01-18,长江电力(600900.SH)拟向三峡集团转让北控水务(00371.HK)4.71亿股 协助长江环保集团获得业务协同资产,格隆汇
4025,2019-01-18,格力电器:260亿+的弦外之音与股价思考,正点财经
4026,2019-01-18,"长江电力:来水良好推动发电量创历史新高,资本运作抵消税收优惠到期影响",中证网
4027,2019-01-18,【安信环保公用邵琳琳团队】长江电力2018年业绩预告点评,安信证券环保公用研究
4028,2019-01-18,回调是为了更好的上涨,中财网
4029,2019-01-17,长江电力2018年营收512.47亿元 较上年同期增长2.2%,挖贝网
4030,2019-01-17,重点关注：内蒙古自治区发布《2019年蒙东地区电力直接交易工作方案》，预计2019年蒙东电力直接交易规模200亿,长江电力及公用事业
4031,2019-01-17,1月17日上市公司晚间公告速递,新浪
4032,2019-01-17,长江电力：2018年度净利润226.30亿元 同比增长1.66%,e公司
4033,2019-01-17,长江电力业绩快报：2018年实现净利润226.3亿元，同比增长1.66%,Wind
4034,2019-01-17,公用事业：煤炭供需宽松带动火电盈利持续修复 荐2股,和讯
4035,2019-01-17,【每日晨报】策略丁文 银河证券晨报—20190117,中国银河证券研究
4036,2019-01-16,【方正公用环保郭丽丽团队】云南省印发固体废物污染治理攻坚战实施方案的通知,公用环保郭丽丽团队
4037,2019-01-16,公用事业：继续关注运营类环保标的 荐6股,和讯
4038,2019-01-16,【每日晨报】策略丁文 银河证券晨报—20190116,中国银河证券研究
4039,2019-01-15,【方正公用环保郭丽丽团队】国家发改委、能源局联合发布关于进一步推进增量配电业务改革的通知,公用环保郭丽丽团队
4040,2019-01-15,2019投资如何不踩雷？这四个风险要避开,金融界
4041,2019-01-15,"公用事业1月投资策略:宏观承压超配火电,密切观察政策信号",国信证券
4042,2019-01-14,电力：博弈火电核电业绩弹性 荐2股,和讯
4043,2019-01-14,"电力行业周报:两部委推进风光无补贴平价上网,“华龙一号”开展标准化示范",平安证券
4044,2019-01-14,公用事业与环保行业周报:第二轮中央生态环保督察将于2019年启动,光大证券
4045,2019-01-13,【方正公用环保郭丽丽团队】煤炭供需宽松带动火电盈利持续修复，关注低估值高弹性二线火电标的——2019年第3周观点,公用环保郭丽丽团队
4046,2019-01-13,【方正公用环保郭丽丽团队】工信部、国家发改委联合印发关于推进大宗固体废弃物综合利用产业集聚发展的通知,公用环保郭丽丽团队
4047,2019-01-13,【安信环保公用邵琳琳团队】周报 0113：国资入股环保民企梳理，继续关注运营类环保标的,安信证券环保公用研究
4048,2019-01-13,北上资金在疯狂抄底 我们还在观望吗,红周刊
4049,2019-01-11,【方正公用环保郭丽丽团队】国家发改委等八部委印发建立市场化、多元化生态保护补偿机制行动计划,公用环保郭丽丽团队
4050,2019-01-11,电力：水核龙头18年发电量均提升 本周煤价反弹,和讯
4051,2019-01-11,资本市场“天价离婚”再创纪录 世界首富685亿美元换得自由身,证券日报网
4052,2019-01-11,"电力行业深度报告暨2019年投资策略:新能源悲观预期或反转,核电新项目或重启",浙商证券
4053,2019-01-10,【方正公用环保郭丽丽团队】福建印发城市黑臭水体治理攻坚战实施方案,公用环保郭丽丽团队
4054,2019-01-09,私募手把手教你“排雷” 这四大风险要避开,中证报
4055,2019-01-09,不济之年 大股东们增减持亮明态度 减持股份,全景网
4056,2019-01-09,公用事业周报:深圳核定非居民配气价差;动力煤价持续低迷,国信证券
4057,2019-01-09,"电力行业周报:青海规划内陆核电,新疆公布煤电应急调峰储备电源",平安证券
4058,2019-01-08,【每月金股】银河研究 2019.1,中国银河证券研究
4059,2019-01-07,【方正公用环保郭丽丽团队】江苏印发全国首个增量配电网供电服务规范,公用环保郭丽丽团队
4060,2019-01-07,煤改电概念股有哪些？2019煤改电概念股一览表,云掌财经
4061,2019-01-07,"公用事业行业2019年度投资策略:与其苟延残喘,不如从容燃烧",光大证券
4062,2019-01-06,【方正公用环保郭丽丽团队】2018年江苏省内交易电量达1951亿千瓦时,公用环保郭丽丽团队
4063,2019-01-06,【国君公用|行业周报】11月天然气消费强劲，新年煤价小幅上行（2019.1.2-2019.1.4）,妍姐电报
4064,2019-01-04,【方正公用环保郭丽丽团队】青海印发建设国家清洁能源示范省工作方案（2018—2020年）,公用环保郭丽丽团队
4065,2019-01-04,"公用事业行业深度研究:煤价持续下行,火电逆周期属性凸显",中证网
4066,2019-01-04,用电需求回落 煤价下行遇阻 2019年电力行业十大猜想！,平安证券
4067,2019-01-04,两千亿！长江电力2018年发电量超两千亿千瓦时,北极星电力
4068,2019-01-04,长江电力短期融资券发行 总额为15亿元,挖贝网
4069,2019-01-03,【方正公用环保郭丽丽团队】深圳发布关于调整管道天然气非居民用气销售价格与配气价格的通知,公用环保郭丽丽团队
4070,2019-01-03,央企司法实践健康排名发布：湖北沙隆达位列榜首,新浪
4071,2019-01-03,央企业务经营法律健康排名公布：保定乐凯新材料第一,新浪
4072,2019-01-03,公用事业与环保行业周报:河北雄安新区总体规划获批,光大证券
4073,2019-01-02,【方正公用环保郭丽丽团队】广东省印发促进天然气利用实施方案,公用环保郭丽丽团队
4074,2019-01-02,央企上市公司法律健康排名公布：哪些公司上榜了？,新浪
4075,2019-01-02,附表 入选权重占比前20的A股上市公司,第一财经日报
4076,2019-01-02,北上资金持续加仓“春季行情”,中证报
4077,2019-01-02,1241只个股纳入标普道琼斯指数 李大霄：春天或将到来,证券日报
4078,2019-01-02,2018年北上资金逆市做多 外资持续流入,中证报
4079,2019-01-01,【方正公用环保郭丽丽团队】煤炭价格中枢继续下移，持续看好火电盈利修复——2019年第1周观点,公用环保郭丽丽团队
4080,2019-01-01,【方正公用环保郭丽丽团队】国家发改委发布2018年11月天然气情况,公用环保郭丽丽团队
4081,2019-01-01,2018年举牌的那些事 产业资本“扫货”近40公司,投资快报
4082,2019-01-01,2018年港资持仓大揭秘！！,股市动态分析
4083,2019-01-01,跨年夜，1241只A股股票“喜提”标普道琼斯指数,每日经济新闻
4084,2018-12-31,【长江电力】投资再发力，整合大流域,EBS公用环保研究
4085,2018-12-29,2018年北上资金十大重仓股出炉 部分个股被逆势增持超1亿股,中证网
4086,2018-12-29,第四批增量配电业务改革试点启动 四股值得关注,中财网
4087,2018-12-28,长源电力：即将起飞的二线火电龙头，后蒙华时代最受益的电力公司,微信
4088,2018-12-28,【每日晨报】策略丁文 银河证券晨报—20181228,中国银河证券研究
4089,2018-12-28,"发电行业2019年度投资策略:行业发展拐点显现,把握水电防御性优势,博弈火电核电业绩弹性",华融证券
4090,2018-12-27,【方正公用环保郭丽丽团队】山西省发布电力市场深化建设方案,公用环保郭丽丽团队
4091,2018-12-27,电力：水电防御价值显 荐4股,和讯
4092,2018-12-27,【每日晨报】策略丁文 银河证券晨报—20181227,中国银河证券研究
4093,2018-12-27,"电力行业周报:11月电力统计数据出炉,7机商运成就核电大年",平安证券
4094,2018-12-26,公用事业：动力煤价持续下行 荐4股,国信证券
4095,2018-12-26,平安研报20181226,平安研究
4096,2018-12-26,2018年举牌的那些事 产业资本“扫货”近40公司,投资快报
4097,2018-12-26,2018年A股牛股基因解密 229只逆市飘红股有三大特征,证券日报
4098,2018-12-26,2019年度猜新/猜心系列报告之电力行业十大猜想,平安证券
4099,2018-12-25,公用事业：继续关注环保结构性反弹行情 荐8股,和讯
4100,2018-12-25,长江电力股票行情怎么样？长江电力股票（600900）行情,益盟操盘手
4101,2018-12-25,"长江电力:来水偏丰推动收入增长,增值税返还到期影响业绩提升",正点财经
4102,2018-12-25,如果你有1000亿，你会用它来买一条铁路吗？,阿尔法工场
4103,2018-12-25,陈光明、裘国根、邓晓峰 这些大佬为何盯上这些股票？,中财网
4104,2018-12-25,【晨会1225】5G商用步伐加快、宁德时代、超华科技,中信建投证券研究
4105,2018-12-24,【方正公用环保郭丽丽团队】河南省发布煤炭消费减量行动计划（2018—2020年）,公用环保郭丽丽团队
4106,2018-12-24,公用事业：LNG价格迅速上涨 火电业绩拐点已现,和讯
4107,2018-12-24,五大券商周二看好6板块39股,证券之星
4108,2018-12-24,【安信环保公用邵琳琳团队】周报1223：电力板块防御性凸显，继续关注环保结构性反弹行情,安信证券环保公用研究
4109,2018-12-24,26股获券商买入评级 国祯环保目标涨幅达43.01%,Wind
4110,2018-12-23,中国证券博物馆揭牌 源于28年前那些如烟过往,中证报
4111,2018-12-23,【方正公用环保郭丽丽团队】从“中央经济工作会议”解读2019年公用环保板块的投资观点——2018年第51周观点,公用环保郭丽丽团队
4112,2018-12-23,【国君公用|行业点评】11月用电量增速回落，火电利用小时增幅扩大— —中电联发布1-11月电力工业运行简况点评,妍姐电报
4113,2018-12-23,多因素利好金价表现，黄金板块有望迎来量价齐升,第一财经
4114,2018-12-21,【方正公用环保郭丽丽团队】江西省出台电力建设三年攻坚行动计划（2018－2020年）,公用环保郭丽丽团队
4115,2018-12-21,【中证盘前播报】美股、油价大跌！国家税务总局：拟推新一轮普惠减税降负措施！商务部：中美拟明年1月贸易会谈；东阿阿胶出厂价上调6%,中证报
4116,2018-12-21,【每日晨报】策略丁文 银河证券晨报—20181221,中国银河证券研究
4117,2018-12-20,【方正公用环保郭丽丽团队】国家能源局发布11月份全社会用电量数据,公用环保郭丽丽团队
4118,2018-12-20,A股头条之上市公司公告精选（12.21）,金融界
4119,2018-12-20,公告汇总：电广传媒与华为战略合作进军5G,网易
4120,2018-12-20,公告精选：电广传媒将与华为合作进军5G；包钢股份拟12亿购入北方稀土资产；中核钛白、科伦药业完成股份回购,每日经济新闻
4121,2018-12-20,长江电力：三峡电站年发电量首次超过1000亿千瓦时,e公司
4122,2018-12-20,长江电力直接融资规模创历史新高,北极星电力
4123,2018-12-20,【每日晨报】策略丁文 银河证券晨报—20181220,中国银河证券研究
4124,2018-12-19,"电力行业周报:统计局发布11月能源生产情况,台山1号机商运",平安证券
4125,2018-12-18,【方正公用环保郭丽丽团队】内蒙古自治区印发土壤污染防治三年攻坚计划,公用环保郭丽丽团队
4126,2018-12-18,公用事业：寒潮来袭 荐4股,和讯
4127,2018-12-18,12月18日 13只个股已连涨5天,每日经济新闻
4128,2018-12-18,12月18日 17只股票封板 珠宝首饰板块涨幅最大,每日经济新闻
4129,2018-12-18,高股息板块表现坚挺 关注年报高分红个股,证券时报
4130,2018-12-17,2018年港资遭遇“滑铁卢”？数据告诉你他们的真正实力,每日经济新闻
4131,2018-12-17,从东芝事件看美日贸易冲突,方正证券小方理财
4132,2018-12-17,北上资金周流入放缓 消费和基建龙头受青睐,中证报
4133,2018-12-17,A股低位震荡不改“聪明资金”流向 24股上演建仓大戏,证券日报
4134,2018-12-17,"环保及公用事业周报:电镀等五行业自行监测技术指南发布,排污许可制持续落地",安信证券
4135,2018-12-16,【方正公用环保郭丽丽团队】生态环境部发布《有毒有害大气污染物名录（第一批）（征求意见稿）》,公用环保郭丽丽团队
4136,2018-12-16,【安信环保公用邵琳琳团队】周报1216：电镀等五行业自行监测技术指南发布，排污许可制持续落地,微信
4137,2018-12-16,融资客最看好个股一览,证券之星
4138,2018-12-14,【方正公用环保郭丽丽团队】国家统计局发布11月能源生产情况,公用环保郭丽丽团队
4139,2018-12-14,【晨会纪要】策略丁文 银河证券晨会纪要—20181214,中国银河证券研究
4140,2018-12-14,12月14日 主力资金近三日都在买这些概念股,每日经济新闻
4141,2018-12-14,水电业务保持稳定 投资收益平抑波动,证券时报
4142,2018-12-13,【方正公用环保郭丽丽团队】黑龙江省发布关于开展2019年度电力直接交易的通知,公用环保郭丽丽团队
4143,2018-12-13,长江电力总经理陈国庆：相信公司总市值还会继续上升,e公司
4144,2018-12-13,长江电力：积极探索发展配售电业务 参与开发重庆两江新区等8个试点项目,e公司
4145,2018-12-13,【晨会纪要】策略丁文 银河证券晨会纪要—20181213,中国银河证券研究
4146,2018-12-13,【高管面对面】长江电力：五大核心能力造就国之重器,e公司
4147,2018-12-13,中国上市公司高质量发展在行动：长江电力,证券时报网
4148,2018-12-13,长江电力：第四届董事会第三十次会议决议公告,上交所
4149,2018-12-12,【方正公用环保郭丽丽团队】山西省发布2019年电力直接交易工作方案,公用环保郭丽丽团队
4150,2018-12-12,【晨会纪要】策略丁文 银河证券晨会纪要—20181212,中国银河证券研究
4151,2018-12-12,"川投能源2018年三季报点评:受退税&分红影响,业绩微降3% 盈利能力下降",正点财经
4152,2018-12-12,"华能国际2018年三季报点评:三季度扣非亏损,电量电价稳定 亏损",正点财经
4153,2018-12-12,中信建投：2019年煤价中枢有望下行至绿色区间,新浪
4154,2018-12-12,溪洛渡水电站2018年累计发电量已达586亿千瓦时,中国能源网china5e
4155,2018-12-12,长江电力短期融资券发行 总额为25亿元,挖贝网
4156,2018-12-12,重点关注：山西发布《2019年山西省电力直接交易工作方案》，拟定2019年交易规模为800亿千瓦时,长江电力及公用事业
4157,2018-12-12,【长江证券电力公用|干货分享】华能经济技术研究院司纪朋：光热发电现状与展望,长江电力及公用事业
4158,2018-12-12,【长江证券电力公用|干货分享】“气荒”背后——华北地区天然气调峰分析,长江电力及公用事业
4159,2018-12-11,【每月金股】银河研究 2018.12,中国银河证券研究
4160,2018-12-11,银河证券：震荡磨底等信号 配置为先选个股,和讯
4161,2018-12-11,中国神华股票：熨平周期 业绩无忧,平安证券
4162,2018-12-11,清仓凶猛：A股1800亿市值减持版图 | 棱镜,野马财经
4163,2018-12-11,公用事业 | 2019年投资策略：远山初见疑无路，曲径徐行渐有村,中信建投证券研究
4164,2018-12-10,重点关注：新疆发布《新疆区域电力运营合同（协议）签订及备案实施办法（征求意见稿）》，拟规范电力交易合同相关流程,微信
4165,2018-12-10,【平安】2019年电力行业年度策略报告*把握确定，持有优质资产——核电与大水电*强于大市,平安研究
4166,2018-12-10,【国君公用|行业周报】动力煤价持续下行，继续看好火电投资机会（2018.11.30 -2018.12.7）,妍姐电报
4167,2018-12-10,公用事业周报：寒潮来袭，LNG价格、煤电日耗或走高；发改委能源局要求强化清洁能源消纳利好水电,国信研究
4168,2018-12-09,【安信环保公用邵琳琳团队】周报1209：第二批环保督察“回头看”进驻结束,安信证券环保公用研究
4169,2018-12-07,【长江证券电力公用|干货分享】国网能源研究院：全球能源分析与展望,长江电力及公用事业
4170,2018-12-07,【晨会纪要】策略丁文 银河证券晨会纪要—20181207,中国银河证券研究
4171,2018-12-07,盘前参考:美股大长腿 华为事件对大盘冲击有多大？,中财网
4172,2018-12-06,【长江证券电力公用|干货分享】中石油天然气研究所所长单卫国：低油价下亚洲天然气市场的新动向,长江电力及公用事业
4173,2018-12-06,【方正公用环保郭丽丽团队】沃施股份：发行股份购买中海沃邦获证监会通过， 跨入天然气上游开采行业前景广阔,公用环保郭丽丽团队
4174,2018-12-06,阿里云推出全栈IPv6解决方案，加速推进下一代互联网应用,TechWeb
4175,2018-12-06,西南证券：解禁市值减少一成多 59家公司百亿元以上 解禁,和讯
4176,2018-12-06,"公用事业行业增值税专题之微观视角:增值税变动,公用事业和煤炭行业影响几何",西南证券
